Sheet: Crosscheck
A1: MFG | B1: MFG Part No. | C1: Farnell Part No. | D1: RS Part No. | E1: Price | F1: MOQ | G1: Qty BOM | H1: Qty CvPcb | J1: Type | K1: Value | L1: Key
A2: of:=VLOOKUP([Group.$I2]&[Group.$L2]&[Group.$K2];[Parts.$A$1:.$V$1000];COLUMN([.A2])+3;0) -> Arduino | B2: of:=VLOOKUP([Group.$I2]&[Group.$L2]&[Group.$K2];[Parts.$A$1:.$V$1000];COLUMN([.B2])+3;0) -> A000066 | C2: of:=VLOOKUP([Group.$I2]&[Group.$L2]&[Group.$K2];[Parts.$A$1:.$V$1000];COLUMN([.C2])+3;0) -> 2075382 | D2: of:=VLOOKUP([Group.$I2]&[Group.$L2]&[Group.$K2];[Parts.$A$1:.$V$1000];COLUMN([.D2])+3;0) -> 0 | E2: of:=VLOOKUP([Group.$I2]&[Group.$L2]&[Group.$K2];[Parts.$A$1:.$V$1000];COLUMN([.E2])+3;0) -> 6875.79 | F2: of:=VLOOKUP([Group.$I2]&[Group.$L2]&[Group.$K2];[Parts.$A$1:.$V$1000];COLUMN([.F2])+3;0) -> 1 | G2: of:=VLOOKUP([Group.$I2]&[Group.$L2]&[Group.$K2];[Parts.$A$1:.$V$1000];COLUMN([.G2])+3;0) -> 1 | H2: of:=[Group.M2] -> 1 | J2: of:=[Group.I2] -> ARD | K2: of:=[Group.K2] -> A000066 | L2: of:=[Group.$I2]&[Group.$L2]&[Group.$K2] -> ARDBenchBudEE:ArduinoA000066
A3: of:=VLOOKUP([Group.$I3]&[Group.$L3]&[Group.$K3];[Parts.$A$1:.$V$1000];COLUMN([.A3])+3;0) -> Multicomp | B3: of:=VLOOKUP([Group.$I3]&[Group.$L3]&[Group.$K3];[Parts.$A$1:.$V$1000];COLUMN([.B3])+3;0) -> MC0805B103K500CT | C3: of:=VLOOKUP([Group.$I3]&[Group.$L3]&[Group.$K3];[Parts.$A$1:.$V$1000];COLUMN([.C3])+3;0) -> 1759246 | D3: of:=VLOOKUP([Group.$I3]&[Group.$L3]&[Group.$K3];[Parts.$A$1:.$V$1000];COLUMN([.D3])+3;0) -> 0 | E3: of:=VLOOKUP([Group.$I3]&[Group.$L3]&[Group.$K3];[Parts.$A$1:.$V$1000];COLUMN([.E3])+3;0) -> 3.9 | F3: of:=VLOOKUP([Group.$I3]&[Group.$L3]&[Group.$K3];[Parts.$A$1:.$V$1000];COLUMN([.F3])+3;0) -> 10 | G3: of:=VLOOKUP([Group.$I3]&[Group.$L3]&[Group.$K3];[Parts.$A$1:.$V$1000];COLUMN([.G3])+3;0) -> 4 | H3: of:=[Group.M3] -> 4 | J3: of:=[Group.I3] -> C | K3: of:=[Group.K3] -> .01u | L3: of:=[Group.$I3]&[Group.$L3]&[Group.$K3] -> CCapacitors_SMD:c_0805.01u
A4: of:=VLOOKUP([Group.$I4]&[Group.$L4]&[Group.$K4];[Parts.$A$1:.$V$1000];COLUMN([.A4])+3;0) -> Multicomp | B4: of:=VLOOKUP([Group.$I4]&[Group.$L4]&[Group.$K4];[Parts.$A$1:.$V$1000];COLUMN([.B4])+3;0) -> MC0805N101J500CT | C4: of:=VLOOKUP([Group.$I4]&[Group.$L4]&[Group.$K4];[Parts.$A$1:.$V$1000];COLUMN([.C4])+3;0) -> 1759203 | D4: of:=VLOOKUP([Group.$I4]&[Group.$L4]&[Group.$K4];[Parts.$A$1:.$V$1000];COLUMN([.D4])+3;0) -> 0 | E4: of:=VLOOKUP([Group.$I4]&[Group.$L4]&[Group.$K4];[Parts.$A$1:.$V$1000];COLUMN([.E4])+3;0) -> 6.1 | F4: of:=VLOOKUP([Group.$I4]&[Group.$L4]&[Group.$K4];[Parts.$A$1:.$V$1000];COLUMN([.F4])+3;0) -> 10 | G4: of:=VLOOKUP([Group.$I4]&[Group.$L4]&[Group.$K4];[Parts.$A$1:.$V$1000];COLUMN([.G4])+3;0) -> 1 | H4: of:=[Group.M4] -> 1 | J4: of:=[Group.I4] -> C | K4: of:=[Group.K4] -> 100p | L4: of:=[Group.$I4]&[Group.$L4]&[Group.$K4] -> CCapacitors_SMD:c_0805100p
A5: of:=VLOOKUP([Group.$I5]&[Group.$L5]&[Group.$K5];[Parts.$A$1:.$V$1000];COLUMN([.A5])+3;0) -> Multicomp | B5: of:=VLOOKUP([Group.$I5]&[Group.$L5]&[Group.$K5];[Parts.$A$1:.$V$1000];COLUMN([.B5])+3;0) -> MC0805X106K250CT | C5: of:=VLOOKUP([Group.$I5]&[Group.$L5]&[Group.$K5];[Parts.$A$1:.$V$1000];COLUMN([.C5])+3;0) -> 2320833 | D5: of:=VLOOKUP([Group.$I5]&[Group.$L5]&[Group.$K5];[Parts.$A$1:.$V$1000];COLUMN([.D5])+3;0) -> 0 | E5: of:=VLOOKUP([Group.$I5]&[Group.$L5]&[Group.$K5];[Parts.$A$1:.$V$1000];COLUMN([.E5])+3;0) -> 43.8 | F5: of:=VLOOKUP([Group.$I5]&[Group.$L5]&[Group.$K5];[Parts.$A$1:.$V$1000];COLUMN([.F5])+3;0) -> 10 | G5: of:=VLOOKUP([Group.$I5]&[Group.$L5]&[Group.$K5];[Parts.$A$1:.$V$1000];COLUMN([.G5])+3;0) -> 8 | H5: of:=[Group.M5] -> 8 | J5: of:=[Group.I5] -> C | K5: of:=[Group.K5] -> 10u | L5: of:=[Group.$I5]&[Group.$L5]&[Group.$K5] -> CCapacitors_SMD:c_080510u
A6: of:=VLOOKUP([Group.$I6]&[Group.$L6]&[Group.$K6];[Parts.$A$1:.$V$1000];COLUMN([.A6])+3;0) -> Multicomp | B6: of:=VLOOKUP([Group.$I6]&[Group.$L6]&[Group.$K6];[Parts.$A$1:.$V$1000];COLUMN([.B6])+3;0) -> MC1206X106K250CT | C6: of:=VLOOKUP([Group.$I6]&[Group.$L6]&[Group.$K6];[Parts.$A$1:.$V$1000];COLUMN([.C6])+3;0) -> 2320887 | D6: of:=VLOOKUP([Group.$I6]&[Group.$L6]&[Group.$K6];[Parts.$A$1:.$V$1000];COLUMN([.D6])+3;0) -> 0 | E6: of:=VLOOKUP([Group.$I6]&[Group.$L6]&[Group.$K6];[Parts.$A$1:.$V$1000];COLUMN([.E6])+3;0) -> 33.8 | F6: of:=VLOOKUP([Group.$I6]&[Group.$L6]&[Group.$K6];[Parts.$A$1:.$V$1000];COLUMN([.F6])+3;0) -> 10 | G6: of:=VLOOKUP([Group.$I6]&[Group.$L6]&[Group.$K6];[Parts.$A$1:.$V$1000];COLUMN([.G6])+3;0) -> 4 | H6: of:=[Group.M6] -> 3 | J6: of:=[Group.I6] -> C | K6: of:=[Group.K6] -> 10u | L6: of:=[Group.$I6]&[Group.$L6]&[Group.$K6] -> CCapacitors_SMD:c_120610u
A7: of:=VLOOKUP([Group.$I7]&[Group.$L7]&[Group.$K7];[Parts.$A$1:.$V$1000];COLUMN([.A7])+3;0) -> Multicomp | B7: of:=VLOOKUP([Group.$I7]&[Group.$L7]&[Group.$K7];[Parts.$A$1:.$V$1000];COLUMN([.B7])+3;0) -> MC1206X106K250CT | C7: of:=VLOOKUP([Group.$I7]&[Group.$L7]&[Group.$K7];[Parts.$A$1:.$V$1000];COLUMN([.C7])+3;0) -> 2320887 | D7: of:=VLOOKUP([Group.$I7]&[Group.$L7]&[Group.$K7];[Parts.$A$1:.$V$1000];COLUMN([.D7])+3;0) -> 0 | E7: of:=VLOOKUP([Group.$I7]&[Group.$L7]&[Group.$K7];[Parts.$A$1:.$V$1000];COLUMN([.E7])+3;0) -> 33.8 | F7: of:=VLOOKUP([Group.$I7]&[Group.$L7]&[Group.$K7];[Parts.$A$1:.$V$1000];COLUMN([.F7])+3;0) -> 10 | G7: of:=VLOOKUP([Group.$I7]&[Group.$L7]&[Group.$K7];[Parts.$A$1:.$V$1000];COLUMN([.G7])+3;0) -> 4 | H7: of:=[Group.M7] -> 4 | J7: of:=[Group.I7] -> C | K7: of:=[Group.K7] -> 10u | L7: of:=[Group.$I7]&[Group.$L7]&[Group.$K7] -> CCapacitors_SMD:c_120610u
A8: of:=VLOOKUP([Group.$I8]&[Group.$L8]&[Group.$K8];[Parts.$A$1:.$V$1000];COLUMN([.A8])+3;0) -> TDK | B8: of:=VLOOKUP([Group.$I8]&[Group.$L8]&[Group.$K8];[Parts.$A$1:.$V$1000];COLUMN([.B8])+3;0) -> C2012X7R1E105K125AB | C8: of:=VLOOKUP([Group.$I8]&[Group.$L8]&[Group.$K8];[Parts.$A$1:.$V$1000];COLUMN([.C8])+3;0) -> 2346940 | D8: of:=VLOOKUP([Group.$I8]&[Group.$L8]&[Group.$K8];[Parts.$A$1:.$V$1000];COLUMN([.D8])+3;0) -> 0 | E8: of:=VLOOKUP([Group.$I8]&[Group.$L8]&[Group.$K8];[Parts.$A$1:.$V$1000];COLUMN([.E8])+3;0) -> 14.09 | F8: of:=VLOOKUP([Group.$I8]&[Group.$L8]&[Group.$K8];[Parts.$A$1:.$V$1000];COLUMN([.F8])+3;0) -> 1 | G8: of:=VLOOKUP([Group.$I8]&[Group.$L8]&[Group.$K8];[Parts.$A$1:.$V$1000];COLUMN([.G8])+3;0) -> 11 | H8: of:=[Group.M8] -> 10 | J8: of:=[Group.I8] -> C | K8: of:=[Group.K8] -> 1u | L8: of:=[Group.$I8]&[Group.$L8]&[Group.$K8] -> CCapacitors_SMD:c_08051u
A9: of:=VLOOKUP([Group.$I9]&[Group.$L9]&[Group.$K9];[Parts.$A$1:.$V$1000];COLUMN([.A9])+3;0) -> 0 | B9: of:=VLOOKUP([Group.$I9]&[Group.$L9]&[Group.$K9];[Parts.$A$1:.$V$1000];COLUMN([.B9])+3;0) -> 0 | C9: of:=VLOOKUP([Group.$I9]&[Group.$L9]&[Group.$K9];[Parts.$A$1:.$V$1000];COLUMN([.C9])+3;0) -> 0 | D9: of:=VLOOKUP([Group.$I9]&[Group.$L9]&[Group.$K9];[Parts.$A$1:.$V$1000];COLUMN([.D9])+3;0) -> 0 | E9: of:=VLOOKUP([Group.$I9]&[Group.$L9]&[Group.$K9];[Parts.$A$1:.$V$1000];COLUMN([.E9])+3;0) -> 0 | F9: of:=VLOOKUP([Group.$I9]&[Group.$L9]&[Group.$K9];[Parts.$A$1:.$V$1000];COLUMN([.F9])+3;0) -> 0 | G9: of:=VLOOKUP([Group.$I9]&[Group.$L9]&[Group.$K9];[Parts.$A$1:.$V$1000];COLUMN([.G9])+3;0) -> 0 | H9: of:=[Group.M9] -> 3 | J9: of:=[Group.I9] -> C | K9: of:=[Group.K9] -> NOPOP | L9: of:=[Group.$I9]&[Group.$L9]&[Group.$K9] -> CCapacitors_SMD:c_0805NOPOP
A10: of:=VLOOKUP([Group.$I10]&[Group.$L10]&[Group.$K10];[Parts.$A$1:.$V$1000];COLUMN([.A10])+3;0) -> Diodes Inc. | B10: of:=VLOOKUP([Group.$I10]&[Group.$L10]&[Group.$K10];[Parts.$A$1:.$V$1000];COLUMN([.B10])+3;0) -> B0540WS-7 | C10: of:=VLOOKUP([Group.$I10]&[Group.$L10]&[Group.$K10];[Parts.$A$1:.$V$1000];COLUMN([.C10])+3;0) -> 1773477 | D10: of:=VLOOKUP([Group.$I10]&[Group.$L10]&[Group.$K10];[Parts.$A$1:.$V$1000];COLUMN([.D10])+3;0) -> 0 | E10: of:=VLOOKUP([Group.$I10]&[Group.$L10]&[Group.$K10];[Parts.$A$1:.$V$1000];COLUMN([.E10])+3;0) -> 163.8 | F10: of:=VLOOKUP([Group.$I10]&[Group.$L10]&[Group.$K10];[Parts.$A$1:.$V$1000];COLUMN([.F10])+3;0) -> 1 | G10: of:=VLOOKUP([Group.$I10]&[Group.$L10]&[Group.$K10];[Parts.$A$1:.$V$1000];COLUMN([.G10])+3;0) -> 1 | H10: of:=[Group.M10] -> 1 | J10: of:=[Group.I10] -> D | K10: of:=[Group.K10] -> B0540WS-7 | L10: of:=[Group.$I10]&[Group.$L10]&[Group.$K10] -> DBenchBudEE:SOD-323B0540WS-7
A11: of:=VLOOKUP([Group.$I11]&[Group.$L11]&[Group.$K11];[Parts.$A$1:.$V$1000];COLUMN([.A11])+3;0) -> Kingbright | B11: of:=VLOOKUP([Group.$I11]&[Group.$L11]&[Group.$K11];[Parts.$A$1:.$V$1000];COLUMN([.B11])+3;0) -> KP-1608CGCK | C11: of:=VLOOKUP([Group.$I11]&[Group.$L11]&[Group.$K11];[Parts.$A$1:.$V$1000];COLUMN([.C11])+3;0) -> 2290328 | D11: of:=VLOOKUP([Group.$I11]&[Group.$L11]&[Group.$K11];[Parts.$A$1:.$V$1000];COLUMN([.D11])+3;0) -> 0 | E11: of:=VLOOKUP([Group.$I11]&[Group.$L11]&[Group.$K11];[Parts.$A$1:.$V$1000];COLUMN([.E11])+3;0) -> 24 | F11: of:=VLOOKUP([Group.$I11]&[Group.$L11]&[Group.$K11];[Parts.$A$1:.$V$1000];COLUMN([.F11])+3;0) -> 1 | G11: of:=VLOOKUP([Group.$I11]&[Group.$L11]&[Group.$K11];[Parts.$A$1:.$V$1000];COLUMN([.G11])+3;0) -> 1 | H11: of:=[Group.M11] -> 1 | J11: of:=[Group.I11] -> D | K11: of:=[Group.K11] -> KP-1608CGCK | L11: of:=[Group.$I11]&[Group.$L11]&[Group.$K11] -> DLEDs:LED-0603KP-1608CGCK
A12: of:=VLOOKUP([Group.$I12]&[Group.$L12]&[Group.$K12];[Parts.$A$1:.$V$1000];COLUMN([.A12])+3;0) -> Diodes Inc. | B12: of:=VLOOKUP([Group.$I12]&[Group.$L12]&[Group.$K12];[Parts.$A$1:.$V$1000];COLUMN([.B12])+3;0) -> MMBD914-7-F | C12: of:=VLOOKUP([Group.$I12]&[Group.$L12]&[Group.$K12];[Parts.$A$1:.$V$1000];COLUMN([.C12])+3;0) -> 1773539 | D12: of:=VLOOKUP([Group.$I12]&[Group.$L12]&[Group.$K12];[Parts.$A$1:.$V$1000];COLUMN([.D12])+3;0) -> 0 | E12: of:=VLOOKUP([Group.$I12]&[Group.$L12]&[Group.$K12];[Parts.$A$1:.$V$1000];COLUMN([.E12])+3;0) -> 14.4 | F12: of:=VLOOKUP([Group.$I12]&[Group.$L12]&[Group.$K12];[Parts.$A$1:.$V$1000];COLUMN([.F12])+3;0) -> 1 | G12: of:=VLOOKUP([Group.$I12]&[Group.$L12]&[Group.$K12];[Parts.$A$1:.$V$1000];COLUMN([.G12])+3;0) -> 8 | H12: of:=[Group.M12] -> 8 | J12: of:=[Group.I12] -> D | K12: of:=[Group.K12] -> MMBD914-7-F | L12: of:=[Group.$I12]&[Group.$L12]&[Group.$K12] -> DBenchBudEE:SOT23-DIODEMMBD914-7-F
A13: of:=VLOOKUP([Group.$I13]&[Group.$L13]&[Group.$K13];[Parts.$A$1:.$V$1000];COLUMN([.A13])+3;0) -> Diodes Inc. | B13: of:=VLOOKUP([Group.$I13]&[Group.$L13]&[Group.$K13];[Parts.$A$1:.$V$1000];COLUMN([.B13])+3;0) -> S1M-13-F | C13: of:=VLOOKUP([Group.$I13]&[Group.$L13]&[Group.$K13];[Parts.$A$1:.$V$1000];COLUMN([.C13])+3;0) -> 1773482 | D13: of:=VLOOKUP([Group.$I13]&[Group.$L13]&[Group.$K13];[Parts.$A$1:.$V$1000];COLUMN([.D13])+3;0) -> 0 | E13: of:=VLOOKUP([Group.$I13]&[Group.$L13]&[Group.$K13];[Parts.$A$1:.$V$1000];COLUMN([.E13])+3;0) -> 59.43 | F13: of:=VLOOKUP([Group.$I13]&[Group.$L13]&[Group.$K13];[Parts.$A$1:.$V$1000];COLUMN([.F13])+3;0) -> 1 | G13: of:=VLOOKUP([Group.$I13]&[Group.$L13]&[Group.$K13];[Parts.$A$1:.$V$1000];COLUMN([.G13])+3;0) -> 8 | H13: of:=[Group.M13] -> 2 | J13: of:=[Group.I13] -> D | K13: of:=[Group.K13] -> S1M-13-F | L13: of:=[Group.$I13]&[Group.$L13]&[Group.$K13] -> DDiodes_SMD:Diode-SMA_StandardS1M-13-F
A14: of:=VLOOKUP([Group.$I14]&[Group.$L14]&[Group.$K14];[Parts.$A$1:.$V$1000];COLUMN([.A14])+3;0) -> 0 | B14: of:=VLOOKUP([Group.$I14]&[Group.$L14]&[Group.$K14];[Parts.$A$1:.$V$1000];COLUMN([.B14])+3;0) -> 0 | C14: of:=VLOOKUP([Group.$I14]&[Group.$L14]&[Group.$K14];[Parts.$A$1:.$V$1000];COLUMN([.C14])+3;0) -> 0 | D14: of:=VLOOKUP([Group.$I14]&[Group.$L14]&[Group.$K14];[Parts.$A$1:.$V$1000];COLUMN([.D14])+3;0) -> 0 | E14: of:=VLOOKUP([Group.$I14]&[Group.$L14]&[Group.$K14];[Parts.$A$1:.$V$1000];COLUMN([.E14])+3;0) -> 0 | F14: of:=VLOOKUP([Group.$I14]&[Group.$L14]&[Group.$K14];[Parts.$A$1:.$V$1000];COLUMN([.F14])+3;0) -> 0 | G14: of:=VLOOKUP([Group.$I14]&[Group.$L14]&[Group.$K14];[Parts.$A$1:.$V$1000];COLUMN([.G14])+3;0) -> 0 | H14: of:=[Group.M14] -> 4 | J14: of:=[Group.I14] -> JP | K14: of:=[Group.K14] -> JUMPER | L14: of:=[Group.$I14]&[Group.$L14]&[Group.$K14] -> JPBenchBudEE:GND_POINTJUMPER
A15: of:=VLOOKUP([Group.$I15]&[Group.$L15]&[Group.$K15];[Parts.$A$1:.$V$1000];COLUMN([.A15])+3;0) -> Omron | B15: of:=VLOOKUP([Group.$I15]&[Group.$L15]&[Group.$K15];[Parts.$A$1:.$V$1000];COLUMN([.B15])+3;0) -> G5LA-1 12DC | C15: of:=VLOOKUP([Group.$I15]&[Group.$L15]&[Group.$K15];[Parts.$A$1:.$V$1000];COLUMN([.C15])+3;0) -> 1455504 | D15: of:=VLOOKUP([Group.$I15]&[Group.$L15]&[Group.$K15];[Parts.$A$1:.$V$1000];COLUMN([.D15])+3;0) -> 0 | E15: of:=VLOOKUP([Group.$I15]&[Group.$L15]&[Group.$K15];[Parts.$A$1:.$V$1000];COLUMN([.E15])+3;0) -> 247.61 | F15: of:=VLOOKUP([Group.$I15]&[Group.$L15]&[Group.$K15];[Parts.$A$1:.$V$1000];COLUMN([.F15])+3;0) -> 1 | G15: of:=VLOOKUP([Group.$I15]&[Group.$L15]&[Group.$K15];[Parts.$A$1:.$V$1000];COLUMN([.G15])+3;0) -> 1 | H15: of:=[Group.M15] -> 1 | J15: of:=[Group.I15] -> K | K15: of:=[Group.K15] -> G5LA-1 12DC | L15: of:=[Group.$I15]&[Group.$L15]&[Group.$K15] -> KBenchBudEE:TE-SPDTG5LA-1 12DC
A16: of:=VLOOKUP([Group.$I16]&[Group.$L16]&[Group.$K16];[Parts.$A$1:.$V$1000];COLUMN([.A16])+3;0) -> Multicomp | B16: of:=VLOOKUP([Group.$I16]&[Group.$L16]&[Group.$K16];[Parts.$A$1:.$V$1000];COLUMN([.B16])+3;0) -> SPC20484 | C16: of:=VLOOKUP([Group.$I16]&[Group.$L16]&[Group.$K16];[Parts.$A$1:.$V$1000];COLUMN([.C16])+3;0) -> 1462888 | D16: of:=VLOOKUP([Group.$I16]&[Group.$L16]&[Group.$K16];[Parts.$A$1:.$V$1000];COLUMN([.D16])+3;0) -> 0 | E16: of:=VLOOKUP([Group.$I16]&[Group.$L16]&[Group.$K16];[Parts.$A$1:.$V$1000];COLUMN([.E16])+3;0) -> 327.6 | F16: of:=VLOOKUP([Group.$I16]&[Group.$L16]&[Group.$K16];[Parts.$A$1:.$V$1000];COLUMN([.F16])+3;0) -> 1 | G16: of:=VLOOKUP([Group.$I16]&[Group.$L16]&[Group.$K16];[Parts.$A$1:.$V$1000];COLUMN([.G16])+3;0) -> 1 | H16: of:=[Group.M16] -> 2 | J16: of:=[Group.I16] -> K | K16: of:=[Group.K16] -> SPC20484 | L16: of:=[Group.$I16]&[Group.$L16]&[Group.$K16] -> KPin_Headers:Pin_Header_Straight_1x03SPC20484
A17: of:=VLOOKUP([Group.$I17]&[Group.$L17]&[Group.$K17];[Parts.$A$1:.$V$1000];COLUMN([.A17])+3;0) -> TDK | B17: of:=VLOOKUP([Group.$I17]&[Group.$L17]&[Group.$K17];[Parts.$A$1:.$V$1000];COLUMN([.B17])+3;0) -> MPZ2012S101A | C17: of:=VLOOKUP([Group.$I17]&[Group.$L17]&[Group.$K17];[Parts.$A$1:.$V$1000];COLUMN([.C17])+3;0) -> 1669751 | D17: of:=VLOOKUP([Group.$I17]&[Group.$L17]&[Group.$K17];[Parts.$A$1:.$V$1000];COLUMN([.D17])+3;0) -> 0 | E17: of:=VLOOKUP([Group.$I17]&[Group.$L17]&[Group.$K17];[Parts.$A$1:.$V$1000];COLUMN([.E17])+3;0) -> 25.52 | F17: of:=VLOOKUP([Group.$I17]&[Group.$L17]&[Group.$K17];[Parts.$A$1:.$V$1000];COLUMN([.F17])+3;0) -> 5 | G17: of:=VLOOKUP([Group.$I17]&[Group.$L17]&[Group.$K17];[Parts.$A$1:.$V$1000];COLUMN([.G17])+3;0) -> 1 | H17: of:=[Group.M17] -> 1 | J17: of:=[Group.I17] -> L | K17: of:=[Group.K17] -> 1u | L17: of:=[Group.$I17]&[Group.$L17]&[Group.$K17] -> LSMD_Packages:SM08051u
A18: of:=VLOOKUP([Group.$I18]&[Group.$L18]&[Group.$K18];[Parts.$A$1:.$V$1000];COLUMN([.A18])+3;0) -> Würth Elektronik | B18: of:=VLOOKUP([Group.$I18]&[Group.$L18]&[Group.$K18];[Parts.$A$1:.$V$1000];COLUMN([.B18])+3;0) -> 744031220 | C18: of:=VLOOKUP([Group.$I18]&[Group.$L18]&[Group.$K18];[Parts.$A$1:.$V$1000];COLUMN([.C18])+3;0) -> 1890602 | D18: of:=VLOOKUP([Group.$I18]&[Group.$L18]&[Group.$K18];[Parts.$A$1:.$V$1000];COLUMN([.D18])+3;0) -> 0 | E18: of:=VLOOKUP([Group.$I18]&[Group.$L18]&[Group.$K18];[Parts.$A$1:.$V$1000];COLUMN([.E18])+3;0) -> 399.98 | F18: of:=VLOOKUP([Group.$I18]&[Group.$L18]&[Group.$K18];[Parts.$A$1:.$V$1000];COLUMN([.F18])+3;0) -> 1 | G18: of:=VLOOKUP([Group.$I18]&[Group.$L18]&[Group.$K18];[Parts.$A$1:.$V$1000];COLUMN([.G18])+3;0) -> 1 | H18: of:=[Group.M18] -> 1 | J18: of:=[Group.I18] -> L | K18: of:=[Group.K18] -> 22u | L18: of:=[Group.$I18]&[Group.$L18]&[Group.$K18] -> LBenchBudEE:NR401222u
A19: of:=VLOOKUP([Group.$I19]&[Group.$L19]&[Group.$K19];[Parts.$A$1:.$V$1000];COLUMN([.A19])+3;0) -> Bourns | B19: of:=VLOOKUP([Group.$I19]&[Group.$L19]&[Group.$K19];[Parts.$A$1:.$V$1000];COLUMN([.B19])+3;0) -> CM322522-220KL | C19: of:=VLOOKUP([Group.$I19]&[Group.$L19]&[Group.$K19];[Parts.$A$1:.$V$1000];COLUMN([.C19])+3;0) -> 9357912 | D19: of:=VLOOKUP([Group.$I19]&[Group.$L19]&[Group.$K19];[Parts.$A$1:.$V$1000];COLUMN([.D19])+3;0) -> 0 | E19: of:=VLOOKUP([Group.$I19]&[Group.$L19]&[Group.$K19];[Parts.$A$1:.$V$1000];COLUMN([.E19])+3;0) -> 69.71 | F19: of:=VLOOKUP([Group.$I19]&[Group.$L19]&[Group.$K19];[Parts.$A$1:.$V$1000];COLUMN([.F19])+3;0) -> 10 | G19: of:=VLOOKUP([Group.$I19]&[Group.$L19]&[Group.$K19];[Parts.$A$1:.$V$1000];COLUMN([.G19])+3;0) -> 3 | H19: of:=[Group.M19] -> 3 | J19: of:=[Group.I19] -> L | K19: of:=[Group.K19] -> CM322522-220KL | L19: of:=[Group.$I19]&[Group.$L19]&[Group.$K19] -> LSMD_Packages:SM1210LCM322522-220KL
A20: of:=VLOOKUP([Group.$I20]&[Group.$L20]&[Group.$K20];[Parts.$A$1:.$V$1000];COLUMN([.A20])+3;0) -> IMO Precision Controls | B20: of:=VLOOKUP([Group.$I20]&[Group.$L20]&[Group.$K20];[Parts.$A$1:.$V$1000];COLUMN([.B20])+3;0) -> 20.501M/3 | C20: of:=VLOOKUP([Group.$I20]&[Group.$L20]&[Group.$K20];[Parts.$A$1:.$V$1000];COLUMN([.C20])+3;0) -> 9632980 | D20: of:=VLOOKUP([Group.$I20]&[Group.$L20]&[Group.$K20];[Parts.$A$1:.$V$1000];COLUMN([.D20])+3;0) -> 0 | E20: of:=VLOOKUP([Group.$I20]&[Group.$L20]&[Group.$K20];[Parts.$A$1:.$V$1000];COLUMN([.E20])+3;0) -> 129.52 | F20: of:=VLOOKUP([Group.$I20]&[Group.$L20]&[Group.$K20];[Parts.$A$1:.$V$1000];COLUMN([.F20])+3;0) -> 1 | G20: of:=VLOOKUP([Group.$I20]&[Group.$L20]&[Group.$K20];[Parts.$A$1:.$V$1000];COLUMN([.G20])+3;0) -> 1 | H20: of:=[Group.M20] -> 1 | J20: of:=[Group.I20] -> P | K20: of:=[Group.K20] -> 20.501M/3 | L20: of:=[Group.$I20]&[Group.$L20]&[Group.$K20] -> PBenchBudEE:3pinTB20.501M/3
A21: of:=VLOOKUP([Group.$I21]&[Group.$L21]&[Group.$K21];[Parts.$A$1:.$V$1000];COLUMN([.A21])+3;0) -> Molex | B21: of:=VLOOKUP([Group.$I21]&[Group.$L21]&[Group.$K21];[Parts.$A$1:.$V$1000];COLUMN([.B21])+3;0) -> 39-30-1240 | C21: of:=VLOOKUP([Group.$I21]&[Group.$L21]&[Group.$K21];[Parts.$A$1:.$V$1000];COLUMN([.C21])+3;0) -> 9963472 | D21: of:=VLOOKUP([Group.$I21]&[Group.$L21]&[Group.$K21];[Parts.$A$1:.$V$1000];COLUMN([.D21])+3;0) -> 0 | E21: of:=VLOOKUP([Group.$I21]&[Group.$L21]&[Group.$K21];[Parts.$A$1:.$V$1000];COLUMN([.E21])+3;0) -> 860.9 | F21: of:=VLOOKUP([Group.$I21]&[Group.$L21]&[Group.$K21];[Parts.$A$1:.$V$1000];COLUMN([.F21])+3;0) -> 1 | G21: of:=VLOOKUP([Group.$I21]&[Group.$L21]&[Group.$K21];[Parts.$A$1:.$V$1000];COLUMN([.G21])+3;0) -> 1 | H21: of:=[Group.M21] -> 1 | J21: of:=[Group.I21] -> P | K21: of:=[Group.K21] -> 39-30-1240 | L21: of:=[Group.$I21]&[Group.$L21]&[Group.$K21] -> PBenchBudEE:ATX_Header39-30-1240
A22: of:=VLOOKUP([Group.$I22]&[Group.$L22]&[Group.$K22];[Parts.$A$1:.$V$1000];COLUMN([.A22])+3;0) -> CamdenBoss | B22: of:=VLOOKUP([Group.$I22]&[Group.$L22]&[Group.$K22];[Parts.$A$1:.$V$1000];COLUMN([.B22])+3;0) -> CTB0355/12 | C22: of:=VLOOKUP([Group.$I22]&[Group.$L22]&[Group.$K22];[Parts.$A$1:.$V$1000];COLUMN([.C22])+3;0) -> 2315251 | D22: of:=VLOOKUP([Group.$I22]&[Group.$L22]&[Group.$K22];[Parts.$A$1:.$V$1000];COLUMN([.D22])+3;0) -> 0 | E22: of:=VLOOKUP([Group.$I22]&[Group.$L22]&[Group.$K22];[Parts.$A$1:.$V$1000];COLUMN([.E22])+3;0) -> 1146.6 | F22: of:=VLOOKUP([Group.$I22]&[Group.$L22]&[Group.$K22];[Parts.$A$1:.$V$1000];COLUMN([.F22])+3;0) -> 1 | G22: of:=VLOOKUP([Group.$I22]&[Group.$L22]&[Group.$K22];[Parts.$A$1:.$V$1000];COLUMN([.G22])+3;0) -> 1 | H22: of:=[Group.M22] -> 1 | J22: of:=[Group.I22] -> P | K22: of:=[Group.K22] -> CTB0355/12 | L22: of:=[Group.$I22]&[Group.$L22]&[Group.$K22] -> PBenchBudEE:12pinTBCTB0355/12
A23: of:=VLOOKUP([Group.$I23]&[Group.$L23]&[Group.$K23];[Parts.$A$1:.$V$1000];COLUMN([.A23])+3;0) -> Multicomp | B23: of:=VLOOKUP([Group.$I23]&[Group.$L23]&[Group.$K23];[Parts.$A$1:.$V$1000];COLUMN([.B23])+3;0) -> MC33282 | C23: of:=VLOOKUP([Group.$I23]&[Group.$L23]&[Group.$K23];[Parts.$A$1:.$V$1000];COLUMN([.C23])+3;0) -> 1710672 | D23: of:=VLOOKUP([Group.$I23]&[Group.$L23]&[Group.$K23];[Parts.$A$1:.$V$1000];COLUMN([.D23])+3;0) -> 0 | E23: of:=VLOOKUP([Group.$I23]&[Group.$L23]&[Group.$K23];[Parts.$A$1:.$V$1000];COLUMN([.E23])+3;0) -> 140.94 | F23: of:=VLOOKUP([Group.$I23]&[Group.$L23]&[Group.$K23];[Parts.$A$1:.$V$1000];COLUMN([.F23])+3;0) -> 1 | G23: of:=VLOOKUP([Group.$I23]&[Group.$L23]&[Group.$K23];[Parts.$A$1:.$V$1000];COLUMN([.G23])+3;0) -> 2 | H23: of:=[Group.M23] -> 2 | J23: of:=[Group.I23] -> P | K23: of:=[Group.K23] -> MC33282 | L23: of:=[Group.$I23]&[Group.$L23]&[Group.$K23] -> PBenchBudEE:V8508HMC33282
A24: of:=VLOOKUP([Group.$I24]&[Group.$L24]&[Group.$K24];[Parts.$A$1:.$V$1000];COLUMN([.A24])+3;0) -> Multicomp | B24: of:=VLOOKUP([Group.$I24]&[Group.$L24]&[Group.$K24];[Parts.$A$1:.$V$1000];COLUMN([.B24])+3;0) -> SPC20484 | C24: of:=VLOOKUP([Group.$I24]&[Group.$L24]&[Group.$K24];[Parts.$A$1:.$V$1000];COLUMN([.C24])+3;0) -> 1462888 | D24: of:=VLOOKUP([Group.$I24]&[Group.$L24]&[Group.$K24];[Parts.$A$1:.$V$1000];COLUMN([.D24])+3;0) -> 0 | E24: of:=VLOOKUP([Group.$I24]&[Group.$L24]&[Group.$K24];[Parts.$A$1:.$V$1000];COLUMN([.E24])+3;0) -> 327.6 | F24: of:=VLOOKUP([Group.$I24]&[Group.$L24]&[Group.$K24];[Parts.$A$1:.$V$1000];COLUMN([.F24])+3;0) -> 1 | G24: of:=VLOOKUP([Group.$I24]&[Group.$L24]&[Group.$K24];[Parts.$A$1:.$V$1000];COLUMN([.G24])+3;0) -> 1 | H24: of:=[Group.M24] -> 1 | J24: of:=[Group.I24] -> P | K24: of:=[Group.K24] -> SPC20484 | L24: of:=[Group.$I24]&[Group.$L24]&[Group.$K24] -> PPin_Headers:Pin_Header_Straight_2x03SPC20484
A25: of:=VLOOKUP([Group.$I25]&[Group.$L25]&[Group.$K25];[Parts.$A$1:.$V$1000];COLUMN([.A25])+3;0) -> NXP | B25: of:=VLOOKUP([Group.$I25]&[Group.$L25]&[Group.$K25];[Parts.$A$1:.$V$1000];COLUMN([.B25])+3;0) -> 2N7002 | C25: of:=VLOOKUP([Group.$I25]&[Group.$L25]&[Group.$K25];[Parts.$A$1:.$V$1000];COLUMN([.C25])+3;0) -> 1510761 | D25: of:=VLOOKUP([Group.$I25]&[Group.$L25]&[Group.$K25];[Parts.$A$1:.$V$1000];COLUMN([.D25])+3;0) -> 0 | E25: of:=VLOOKUP([Group.$I25]&[Group.$L25]&[Group.$K25];[Parts.$A$1:.$V$1000];COLUMN([.E25])+3;0) -> 11.43 | F25: of:=VLOOKUP([Group.$I25]&[Group.$L25]&[Group.$K25];[Parts.$A$1:.$V$1000];COLUMN([.F25])+3;0) -> 5 | G25: of:=VLOOKUP([Group.$I25]&[Group.$L25]&[Group.$K25];[Parts.$A$1:.$V$1000];COLUMN([.G25])+3;0) -> 1 | H25: of:=[Group.M25] -> 1 | J25: of:=[Group.I25] -> Q | K25: of:=[Group.K25] -> 2N7002 | L25: of:=[Group.$I25]&[Group.$L25]&[Group.$K25] -> QSMD_Packages:SOT23EBC2N7002
A26: of:=VLOOKUP([Group.$I26]&[Group.$L26]&[Group.$K26];[Parts.$A$1:.$V$1000];COLUMN([.A26])+3;0) -> Fairchild Semiconductor | B26: of:=VLOOKUP([Group.$I26]&[Group.$L26]&[Group.$K26];[Parts.$A$1:.$V$1000];COLUMN([.B26])+3;0) -> FDD6630A | C26: of:=VLOOKUP([Group.$I26]&[Group.$L26]&[Group.$K26];[Parts.$A$1:.$V$1000];COLUMN([.C26])+3;0) -> 2322585 | D26: of:=VLOOKUP([Group.$I26]&[Group.$L26]&[Group.$K26];[Parts.$A$1:.$V$1000];COLUMN([.D26])+3;0) -> 0 | E26: of:=VLOOKUP([Group.$I26]&[Group.$L26]&[Group.$K26];[Parts.$A$1:.$V$1000];COLUMN([.E26])+3;0) -> 236.18 | F26: of:=VLOOKUP([Group.$I26]&[Group.$L26]&[Group.$K26];[Parts.$A$1:.$V$1000];COLUMN([.F26])+3;0) -> 1 | G26: of:=VLOOKUP([Group.$I26]&[Group.$L26]&[Group.$K26];[Parts.$A$1:.$V$1000];COLUMN([.G26])+3;0) -> 2 | H26: of:=[Group.M26] -> 2 | J26: of:=[Group.I26] -> Q | K26: of:=[Group.K26] -> FDD6630A | L26: of:=[Group.$I26]&[Group.$L26]&[Group.$K26] -> QSMD_Packages:DPAK2FDD6630A
A27: of:=VLOOKUP([Group.$I27]&[Group.$L27]&[Group.$K27];[Parts.$A$1:.$V$1000];COLUMN([.A27])+3;0) -> Diodes Inc. | B27: of:=VLOOKUP([Group.$I27]&[Group.$L27]&[Group.$K27];[Parts.$A$1:.$V$1000];COLUMN([.B27])+3;0) -> MMBT3904-7-F | C27: of:=VLOOKUP([Group.$I27]&[Group.$L27]&[Group.$K27];[Parts.$A$1:.$V$1000];COLUMN([.C27])+3;0) -> 1773602 | D27: of:=VLOOKUP([Group.$I27]&[Group.$L27]&[Group.$K27];[Parts.$A$1:.$V$1000];COLUMN([.D27])+3;0) -> 0 | E27: of:=VLOOKUP([Group.$I27]&[Group.$L27]&[Group.$K27];[Parts.$A$1:.$V$1000];COLUMN([.E27])+3;0) -> 17.52 | F27: of:=VLOOKUP([Group.$I27]&[Group.$L27]&[Group.$K27];[Parts.$A$1:.$V$1000];COLUMN([.F27])+3;0) -> 1 | G27: of:=VLOOKUP([Group.$I27]&[Group.$L27]&[Group.$K27];[Parts.$A$1:.$V$1000];COLUMN([.G27])+3;0) -> 1 | H27: of:=[Group.M27] -> 1 | J27: of:=[Group.I27] -> Q | K27: of:=[Group.K27] -> MMBT3904-7-F | L27: of:=[Group.$I27]&[Group.$L27]&[Group.$K27] -> QSMD_Packages:SOT23EBCMMBT3904-7-F
A28: of:=VLOOKUP([Group.$I28]&[Group.$L28]&[Group.$K28];[Parts.$A$1:.$V$1000];COLUMN([.A28])+3;0) -> Multicomp | B28: of:=VLOOKUP([Group.$I28]&[Group.$L28]&[Group.$K28];[Parts.$A$1:.$V$1000];COLUMN([.B28])+3;0) -> MCMR08X000 PTL | C28: of:=VLOOKUP([Group.$I28]&[Group.$L28]&[Group.$K28];[Parts.$A$1:.$V$1000];COLUMN([.C28])+3;0) -> 2073603 | D28: of:=VLOOKUP([Group.$I28]&[Group.$L28]&[Group.$K28];[Parts.$A$1:.$V$1000];COLUMN([.D28])+3;0) -> 0 | E28: of:=VLOOKUP([Group.$I28]&[Group.$L28]&[Group.$K28];[Parts.$A$1:.$V$1000];COLUMN([.E28])+3;0) -> 2.67 | F28: of:=VLOOKUP([Group.$I28]&[Group.$L28]&[Group.$K28];[Parts.$A$1:.$V$1000];COLUMN([.F28])+3;0) -> 100 | G28: of:=VLOOKUP([Group.$I28]&[Group.$L28]&[Group.$K28];[Parts.$A$1:.$V$1000];COLUMN([.G28])+3;0) -> 33 | H28: of:=[Group.M28] -> 22 | J28: of:=[Group.I28] -> R | K28: of:=[Group.K28] -> 0 | L28: of:=[Group.$I28]&[Group.$L28]&[Group.$K28] -> RBenchBudEE:Resistor_SMD0805_Blob0
A29: of:=VLOOKUP([Group.$I29]&[Group.$L29]&[Group.$K29];[Parts.$A$1:.$V$1000];COLUMN([.A29])+3;0) -> Multicomp | B29: of:=VLOOKUP([Group.$I29]&[Group.$L29]&[Group.$K29];[Parts.$A$1:.$V$1000];COLUMN([.B29])+3;0) -> MCMR08X000 PTL | C29: of:=VLOOKUP([Group.$I29]&[Group.$L29]&[Group.$K29];[Parts.$A$1:.$V$1000];COLUMN([.C29])+3;0) -> 2073603 | D29: of:=VLOOKUP([Group.$I29]&[Group.$L29]&[Group.$K29];[Parts.$A$1:.$V$1000];COLUMN([.D29])+3;0) -> 0 | E29: of:=VLOOKUP([Group.$I29]&[Group.$L29]&[Group.$K29];[Parts.$A$1:.$V$1000];COLUMN([.E29])+3;0) -> 2.67 | F29: of:=VLOOKUP([Group.$I29]&[Group.$L29]&[Group.$K29];[Parts.$A$1:.$V$1000];COLUMN([.F29])+3;0) -> 100 | G29: of:=VLOOKUP([Group.$I29]&[Group.$L29]&[Group.$K29];[Parts.$A$1:.$V$1000];COLUMN([.G29])+3;0) -> 33 | H29: of:=[Group.M29] -> 15 | J29: of:=[Group.I29] -> R | K29: of:=[Group.K29] -> 0 | L29: of:=[Group.$I29]&[Group.$L29]&[Group.$K29] -> RSMD_Packages:SM08050
A30: of:=VLOOKUP([Group.$I30]&[Group.$L30]&[Group.$K30];[Parts.$A$1:.$V$1000];COLUMN([.A30])+3;0) -> Multicomp | B30: of:=VLOOKUP([Group.$I30]&[Group.$L30]&[Group.$K30];[Parts.$A$1:.$V$1000];COLUMN([.B30])+3;0) -> MCHP06W2F100KT5E | C30: of:=VLOOKUP([Group.$I30]&[Group.$L30]&[Group.$K30];[Parts.$A$1:.$V$1000];COLUMN([.C30])+3;0) -> 1576602 | D30: of:=VLOOKUP([Group.$I30]&[Group.$L30]&[Group.$K30];[Parts.$A$1:.$V$1000];COLUMN([.D30])+3;0) -> 0 | E30: of:=VLOOKUP([Group.$I30]&[Group.$L30]&[Group.$K30];[Parts.$A$1:.$V$1000];COLUMN([.E30])+3;0) -> 11.05 | F30: of:=VLOOKUP([Group.$I30]&[Group.$L30]&[Group.$K30];[Parts.$A$1:.$V$1000];COLUMN([.F30])+3;0) -> 50 | G30: of:=VLOOKUP([Group.$I30]&[Group.$L30]&[Group.$K30];[Parts.$A$1:.$V$1000];COLUMN([.G30])+3;0) -> 1 | H30: of:=[Group.M30] -> 1 | J30: of:=[Group.I30] -> R | K30: of:=[Group.K30] -> 1 | L30: of:=[Group.$I30]&[Group.$L30]&[Group.$K30] -> RSMD_Packages:SM12061
A31: of:=VLOOKUP([Group.$I31]&[Group.$L31]&[Group.$K31];[Parts.$A$1:.$V$1000];COLUMN([.A31])+3;0) -> Multicomp | B31: of:=VLOOKUP([Group.$I31]&[Group.$L31]&[Group.$K31];[Parts.$A$1:.$V$1000];COLUMN([.B31])+3;0) -> MC01W080514R87 | C31: of:=VLOOKUP([Group.$I31]&[Group.$L31]&[Group.$K31];[Parts.$A$1:.$V$1000];COLUMN([.C31])+3;0) -> 2141671 | D31: of:=VLOOKUP([Group.$I31]&[Group.$L31]&[Group.$K31];[Parts.$A$1:.$V$1000];COLUMN([.D31])+3;0) -> 0 | E31: of:=VLOOKUP([Group.$I31]&[Group.$L31]&[Group.$K31];[Parts.$A$1:.$V$1000];COLUMN([.E31])+3;0) -> 13.33 | F31: of:=VLOOKUP([Group.$I31]&[Group.$L31]&[Group.$K31];[Parts.$A$1:.$V$1000];COLUMN([.F31])+3;0) -> 1 | G31: of:=VLOOKUP([Group.$I31]&[Group.$L31]&[Group.$K31];[Parts.$A$1:.$V$1000];COLUMN([.G31])+3;0) -> 1 | H31: of:=[Group.M31] -> 1 | J31: of:=[Group.I31] -> R | K31: of:=[Group.K31] -> 4.87 | L31: of:=[Group.$I31]&[Group.$L31]&[Group.$K31] -> RSMD_Packages:SM08054.87
A32: of:=VLOOKUP([Group.$I32]&[Group.$L32]&[Group.$K32];[Parts.$A$1:.$V$1000];COLUMN([.A32])+3;0) -> Bourns | B32: of:=VLOOKUP([Group.$I32]&[Group.$L32]&[Group.$K32];[Parts.$A$1:.$V$1000];COLUMN([.B32])+3;0) -> CRT0805-BY-10R0ELF | C32: of:=VLOOKUP([Group.$I32]&[Group.$L32]&[Group.$K32];[Parts.$A$1:.$V$1000];COLUMN([.C32])+3;0) -> 2008313 | D32: of:=VLOOKUP([Group.$I32]&[Group.$L32]&[Group.$K32];[Parts.$A$1:.$V$1000];COLUMN([.D32])+3;0) -> 0 | E32: of:=VLOOKUP([Group.$I32]&[Group.$L32]&[Group.$K32];[Parts.$A$1:.$V$1000];COLUMN([.E32])+3;0) -> 62.47 | F32: of:=VLOOKUP([Group.$I32]&[Group.$L32]&[Group.$K32];[Parts.$A$1:.$V$1000];COLUMN([.F32])+3;0) -> 5 | G32: of:=VLOOKUP([Group.$I32]&[Group.$L32]&[Group.$K32];[Parts.$A$1:.$V$1000];COLUMN([.G32])+3;0) -> 1 | H32: of:=[Group.M32] -> 1 | J32: of:=[Group.I32] -> R | K32: of:=[Group.K32] -> 10 | L32: of:=[Group.$I32]&[Group.$L32]&[Group.$K32] -> RSMD_Packages:SM080510
A33: of:=VLOOKUP([Group.$I33]&[Group.$L33]&[Group.$K33];[Parts.$A$1:.$V$1000];COLUMN([.A33])+3;0) -> Multicomp | B33: of:=VLOOKUP([Group.$I33]&[Group.$L33]&[Group.$K33];[Parts.$A$1:.$V$1000];COLUMN([.B33])+3;0) -> MCMR08X1000FTL | C33: of:=VLOOKUP([Group.$I33]&[Group.$L33]&[Group.$K33];[Parts.$A$1:.$V$1000];COLUMN([.C33])+3;0) -> 2073605 | D33: of:=VLOOKUP([Group.$I33]&[Group.$L33]&[Group.$K33];[Parts.$A$1:.$V$1000];COLUMN([.D33])+3;0) -> 0 | E33: of:=VLOOKUP([Group.$I33]&[Group.$L33]&[Group.$K33];[Parts.$A$1:.$V$1000];COLUMN([.E33])+3;0) -> 3.43 | F33: of:=VLOOKUP([Group.$I33]&[Group.$L33]&[Group.$K33];[Parts.$A$1:.$V$1000];COLUMN([.F33])+3;0) -> 100 | G33: of:=VLOOKUP([Group.$I33]&[Group.$L33]&[Group.$K33];[Parts.$A$1:.$V$1000];COLUMN([.G33])+3;0) -> 1 | H33: of:=[Group.M33] -> 2 | J33: of:=[Group.I33] -> R | K33: of:=[Group.K33] -> 100 | L33: of:=[Group.$I33]&[Group.$L33]&[Group.$K33] -> RSMD_Packages:SM0805100
A34: of:=VLOOKUP([Group.$I34]&[Group.$L34]&[Group.$K34];[Parts.$A$1:.$V$1000];COLUMN([.A34])+3;0) -> Multicomp | B34: of:=VLOOKUP([Group.$I34]&[Group.$L34]&[Group.$K34];[Parts.$A$1:.$V$1000];COLUMN([.B34])+3;0) -> MCTC0525B2000T5E | C34: of:=VLOOKUP([Group.$I34]&[Group.$L34]&[Group.$K34];[Parts.$A$1:.$V$1000];COLUMN([.C34])+3;0) -> 1575647 | D34: of:=VLOOKUP([Group.$I34]&[Group.$L34]&[Group.$K34];[Parts.$A$1:.$V$1000];COLUMN([.D34])+3;0) -> 0 | E34: of:=VLOOKUP([Group.$I34]&[Group.$L34]&[Group.$K34];[Parts.$A$1:.$V$1000];COLUMN([.E34])+3;0) -> 18.29 | F34: of:=VLOOKUP([Group.$I34]&[Group.$L34]&[Group.$K34];[Parts.$A$1:.$V$1000];COLUMN([.F34])+3;0) -> 5 | G34: of:=VLOOKUP([Group.$I34]&[Group.$L34]&[Group.$K34];[Parts.$A$1:.$V$1000];COLUMN([.G34])+3;0) -> 2 | H34: of:=[Group.M34] -> 2 | J34: of:=[Group.I34] -> R | K34: of:=[Group.K34] -> 200 | L34: of:=[Group.$I34]&[Group.$L34]&[Group.$K34] -> RSMD_Packages:SM0805200
A35: of:=VLOOKUP([Group.$I35]&[Group.$L35]&[Group.$K35];[Parts.$A$1:.$V$1000];COLUMN([.A35])+3;0) -> Multicomp | B35: of:=VLOOKUP([Group.$I35]&[Group.$L35]&[Group.$K35];[Parts.$A$1:.$V$1000];COLUMN([.B35])+3;0) -> MC01W08051715R | C35: of:=VLOOKUP([Group.$I35]&[Group.$L35]&[Group.$K35];[Parts.$A$1:.$V$1000];COLUMN([.C35])+3;0) -> 2141787 | D35: of:=VLOOKUP([Group.$I35]&[Group.$L35]&[Group.$K35];[Parts.$A$1:.$V$1000];COLUMN([.D35])+3;0) -> 0 | E35: of:=VLOOKUP([Group.$I35]&[Group.$L35]&[Group.$K35];[Parts.$A$1:.$V$1000];COLUMN([.E35])+3;0) -> 13.33 | F35: of:=VLOOKUP([Group.$I35]&[Group.$L35]&[Group.$K35];[Parts.$A$1:.$V$1000];COLUMN([.F35])+3;0) -> 1 | G35: of:=VLOOKUP([Group.$I35]&[Group.$L35]&[Group.$K35];[Parts.$A$1:.$V$1000];COLUMN([.G35])+3;0) -> 2 | H35: of:=[Group.M35] -> 2 | J35: of:=[Group.I35] -> R | K35: of:=[Group.K35] -> 715 | L35: of:=[Group.$I35]&[Group.$L35]&[Group.$K35] -> RSMD_Packages:SM0805715
A36: of:=VLOOKUP([Group.$I36]&[Group.$L36]&[Group.$K36];[Parts.$A$1:.$V$1000];COLUMN([.A36])+3;0) -> KOA | B36: of:=VLOOKUP([Group.$I36]&[Group.$L36]&[Group.$K36];[Parts.$A$1:.$V$1000];COLUMN([.B36])+3;0) -> RK73H2ATTD1301F | C36: of:=VLOOKUP([Group.$I36]&[Group.$L36]&[Group.$K36];[Parts.$A$1:.$V$1000];COLUMN([.C36])+3;0) -> 1811799 | D36: of:=VLOOKUP([Group.$I36]&[Group.$L36]&[Group.$K36];[Parts.$A$1:.$V$1000];COLUMN([.D36])+3;0) -> 0 | E36: of:=VLOOKUP([Group.$I36]&[Group.$L36]&[Group.$K36];[Parts.$A$1:.$V$1000];COLUMN([.E36])+3;0) -> 6.48 | F36: of:=VLOOKUP([Group.$I36]&[Group.$L36]&[Group.$K36];[Parts.$A$1:.$V$1000];COLUMN([.F36])+3;0) -> 5 | G36: of:=VLOOKUP([Group.$I36]&[Group.$L36]&[Group.$K36];[Parts.$A$1:.$V$1000];COLUMN([.G36])+3;0) -> 2 | H36: of:=[Group.M36] -> 2 | J36: of:=[Group.I36] -> R | K36: of:=[Group.K36] -> 1.3K | L36: of:=[Group.$I36]&[Group.$L36]&[Group.$K36] -> RSMD_Packages:SM08051.3K
A37: of:=VLOOKUP([Group.$I37]&[Group.$L37]&[Group.$K37];[Parts.$A$1:.$V$1000];COLUMN([.A37])+3;0) -> Multicomp | B37: of:=VLOOKUP([Group.$I37]&[Group.$L37]&[Group.$K37];[Parts.$A$1:.$V$1000];COLUMN([.B37])+3;0) -> MCMR08X1001FTL | C37: of:=VLOOKUP([Group.$I37]&[Group.$L37]&[Group.$K37];[Parts.$A$1:.$V$1000];COLUMN([.C37])+3;0) -> 2073606 | D37: of:=VLOOKUP([Group.$I37]&[Group.$L37]&[Group.$K37];[Parts.$A$1:.$V$1000];COLUMN([.D37])+3;0) -> 0 | E37: of:=VLOOKUP([Group.$I37]&[Group.$L37]&[Group.$K37];[Parts.$A$1:.$V$1000];COLUMN([.E37])+3;0) -> 3.43 | F37: of:=VLOOKUP([Group.$I37]&[Group.$L37]&[Group.$K37];[Parts.$A$1:.$V$1000];COLUMN([.F37])+3;0) -> 100 | G37: of:=VLOOKUP([Group.$I37]&[Group.$L37]&[Group.$K37];[Parts.$A$1:.$V$1000];COLUMN([.G37])+3;0) -> 4 | H37: of:=[Group.M37] -> 5 | J37: of:=[Group.I37] -> R | K37: of:=[Group.K37] -> 1K | L37: of:=[Group.$I37]&[Group.$L37]&[Group.$K37] -> RSMD_Packages:SM08051K
A38: of:=VLOOKUP([Group.$I38]&[Group.$L38]&[Group.$K38];[Parts.$A$1:.$V$1000];COLUMN([.A38])+3;0) -> Vishay | B38: of:=VLOOKUP([Group.$I38]&[Group.$L38]&[Group.$K38];[Parts.$A$1:.$V$1000];COLUMN([.B38])+3;0) -> PAT1206E2003BST5 | C38: of:=VLOOKUP([Group.$I38]&[Group.$L38]&[Group.$K38];[Parts.$A$1:.$V$1000];COLUMN([.C38])+3;0) -> 1858262 | D38: of:=VLOOKUP([Group.$I38]&[Group.$L38]&[Group.$K38];[Parts.$A$1:.$V$1000];COLUMN([.D38])+3;0) -> 0 | E38: of:=VLOOKUP([Group.$I38]&[Group.$L38]&[Group.$K38];[Parts.$A$1:.$V$1000];COLUMN([.E38])+3;0) -> 380.93 | F38: of:=VLOOKUP([Group.$I38]&[Group.$L38]&[Group.$K38];[Parts.$A$1:.$V$1000];COLUMN([.F38])+3;0) -> 1 | G38: of:=VLOOKUP([Group.$I38]&[Group.$L38]&[Group.$K38];[Parts.$A$1:.$V$1000];COLUMN([.G38])+3;0) -> 2 | H38: of:=[Group.M38] -> 2 | J38: of:=[Group.I38] -> R | K38: of:=[Group.K38] -> 200K | L38: of:=[Group.$I38]&[Group.$L38]&[Group.$K38] -> RSMD_Packages:SM1206200K
A39: of:=VLOOKUP([Group.$I39]&[Group.$L39]&[Group.$K39];[Parts.$A$1:.$V$1000];COLUMN([.A39])+3;0) -> Bourns | B39: of:=VLOOKUP([Group.$I39]&[Group.$L39]&[Group.$K39];[Parts.$A$1:.$V$1000];COLUMN([.B39])+3;0) -> CR0805-FX-3001GLF | C39: of:=VLOOKUP([Group.$I39]&[Group.$L39]&[Group.$K39];[Parts.$A$1:.$V$1000];COLUMN([.C39])+3;0) -> 2333540 | D39: of:=VLOOKUP([Group.$I39]&[Group.$L39]&[Group.$K39];[Parts.$A$1:.$V$1000];COLUMN([.D39])+3;0) -> 0 | E39: of:=VLOOKUP([Group.$I39]&[Group.$L39]&[Group.$K39];[Parts.$A$1:.$V$1000];COLUMN([.E39])+3;0) -> 10.29 | F39: of:=VLOOKUP([Group.$I39]&[Group.$L39]&[Group.$K39];[Parts.$A$1:.$V$1000];COLUMN([.F39])+3;0) -> 1 | G39: of:=VLOOKUP([Group.$I39]&[Group.$L39]&[Group.$K39];[Parts.$A$1:.$V$1000];COLUMN([.G39])+3;0) -> 2 | H39: of:=[Group.M39] -> 2 | J39: of:=[Group.I39] -> R | K39: of:=[Group.K39] -> 3K | L39: of:=[Group.$I39]&[Group.$L39]&[Group.$K39] -> RSMD_Packages:SM08053K
A40: of:=VLOOKUP([Group.$I40]&[Group.$L40]&[Group.$K40];[Parts.$A$1:.$V$1000];COLUMN([.A40])+3;0) -> Bourns | B40: of:=VLOOKUP([Group.$I40]&[Group.$L40]&[Group.$K40];[Parts.$A$1:.$V$1000];COLUMN([.B40])+3;0) -> 3310C-1-502L | C40: of:=VLOOKUP([Group.$I40]&[Group.$L40]&[Group.$K40];[Parts.$A$1:.$V$1000];COLUMN([.C40])+3;0) -> 9353895 | D40: of:=VLOOKUP([Group.$I40]&[Group.$L40]&[Group.$K40];[Parts.$A$1:.$V$1000];COLUMN([.D40])+3;0) -> 0 | E40: of:=VLOOKUP([Group.$I40]&[Group.$L40]&[Group.$K40];[Parts.$A$1:.$V$1000];COLUMN([.E40])+3;0) -> 1020.89 | F40: of:=VLOOKUP([Group.$I40]&[Group.$L40]&[Group.$K40];[Parts.$A$1:.$V$1000];COLUMN([.F40])+3;0) -> 1 | G40: of:=VLOOKUP([Group.$I40]&[Group.$L40]&[Group.$K40];[Parts.$A$1:.$V$1000];COLUMN([.G40])+3;0) -> 2 | H40: of:=[Group.M40] -> 2 | J40: of:=[Group.I40] -> R | K40: of:=[Group.K40] -> 3310C-1-502L | L40: of:=[Group.$I40]&[Group.$L40]&[Group.$K40] -> RBenchBudEE:EVUE3K3310C-1-502L
A41: of:=VLOOKUP([Group.$I41]&[Group.$L41]&[Group.$K41];[Parts.$A$1:.$V$1000];COLUMN([.A41])+3;0) -> Susumu | B41: of:=VLOOKUP([Group.$I41]&[Group.$L41]&[Group.$K41];[Parts.$A$1:.$V$1000];COLUMN([.B41])+3;0) -> RR1220P-4991-B-M-T5 | C41: of:=VLOOKUP([Group.$I41]&[Group.$L41]&[Group.$K41];[Parts.$A$1:.$V$1000];COLUMN([.C41])+3;0) -> 1653310 | D41: of:=VLOOKUP([Group.$I41]&[Group.$L41]&[Group.$K41];[Parts.$A$1:.$V$1000];COLUMN([.D41])+3;0) -> 0 | E41: of:=VLOOKUP([Group.$I41]&[Group.$L41]&[Group.$K41];[Parts.$A$1:.$V$1000];COLUMN([.E41])+3;0) -> 25.9 | F41: of:=VLOOKUP([Group.$I41]&[Group.$L41]&[Group.$K41];[Parts.$A$1:.$V$1000];COLUMN([.F41])+3;0) -> 1 | G41: of:=VLOOKUP([Group.$I41]&[Group.$L41]&[Group.$K41];[Parts.$A$1:.$V$1000];COLUMN([.G41])+3;0) -> 2 | H41: of:=[Group.M41] -> 2 | J41: of:=[Group.I41] -> R | K41: of:=[Group.K41] -> 5K | L41: of:=[Group.$I41]&[Group.$L41]&[Group.$K41] -> RSMD_Packages:SM08055K
A42: of:=VLOOKUP([Group.$I42]&[Group.$L42]&[Group.$K42];[Parts.$A$1:.$V$1000];COLUMN([.A42])+3;0) -> Vishay | B42: of:=VLOOKUP([Group.$I42]&[Group.$L42]&[Group.$K42];[Parts.$A$1:.$V$1000];COLUMN([.B42])+3;0) -> PHP01206E4991BST3 | C42: of:=VLOOKUP([Group.$I42]&[Group.$L42]&[Group.$K42];[Parts.$A$1:.$V$1000];COLUMN([.C42])+3;0) -> 2325357 | D42: of:=VLOOKUP([Group.$I42]&[Group.$L42]&[Group.$K42];[Parts.$A$1:.$V$1000];COLUMN([.D42])+3;0) -> 0 | E42: of:=VLOOKUP([Group.$I42]&[Group.$L42]&[Group.$K42];[Parts.$A$1:.$V$1000];COLUMN([.E42])+3;0) -> 384.74 | F42: of:=VLOOKUP([Group.$I42]&[Group.$L42]&[Group.$K42];[Parts.$A$1:.$V$1000];COLUMN([.F42])+3;0) -> 1 | G42: of:=VLOOKUP([Group.$I42]&[Group.$L42]&[Group.$K42];[Parts.$A$1:.$V$1000];COLUMN([.G42])+3;0) -> 2 | H42: of:=[Group.M42] -> 2 | J42: of:=[Group.I42] -> R | K42: of:=[Group.K42] -> 5K | L42: of:=[Group.$I42]&[Group.$L42]&[Group.$K42] -> RSMD_Packages:SM12065K
A43: of:=VLOOKUP([Group.$I43]&[Group.$L43]&[Group.$K43];[Parts.$A$1:.$V$1000];COLUMN([.A43])+3;0) -> Vishay | B43: of:=VLOOKUP([Group.$I43]&[Group.$L43]&[Group.$K43];[Parts.$A$1:.$V$1000];COLUMN([.B43])+3;0) -> CRCW08059K10FKEA | C43: of:=VLOOKUP([Group.$I43]&[Group.$L43]&[Group.$K43];[Parts.$A$1:.$V$1000];COLUMN([.C43])+3;0) -> 1653046 | D43: of:=VLOOKUP([Group.$I43]&[Group.$L43]&[Group.$K43];[Parts.$A$1:.$V$1000];COLUMN([.D43])+3;0) -> 0 | E43: of:=VLOOKUP([Group.$I43]&[Group.$L43]&[Group.$K43];[Parts.$A$1:.$V$1000];COLUMN([.E43])+3;0) -> 24.76 | F43: of:=VLOOKUP([Group.$I43]&[Group.$L43]&[Group.$K43];[Parts.$A$1:.$V$1000];COLUMN([.F43])+3;0) -> 1 | G43: of:=VLOOKUP([Group.$I43]&[Group.$L43]&[Group.$K43];[Parts.$A$1:.$V$1000];COLUMN([.G43])+3;0) -> 2 | H43: of:=[Group.M43] -> 2 | J43: of:=[Group.I43] -> R | K43: of:=[Group.K43] -> 9.1K | L43: of:=[Group.$I43]&[Group.$L43]&[Group.$K43] -> RSMD_Packages:SM08059.1K
A44: of:=VLOOKUP([Group.$I44]&[Group.$L44]&[Group.$K44];[Parts.$A$1:.$V$1000];COLUMN([.A44])+3;0) -> 0 | B44: of:=VLOOKUP([Group.$I44]&[Group.$L44]&[Group.$K44];[Parts.$A$1:.$V$1000];COLUMN([.B44])+3;0) -> 0 | C44: of:=VLOOKUP([Group.$I44]&[Group.$L44]&[Group.$K44];[Parts.$A$1:.$V$1000];COLUMN([.C44])+3;0) -> 0 | D44: of:=VLOOKUP([Group.$I44]&[Group.$L44]&[Group.$K44];[Parts.$A$1:.$V$1000];COLUMN([.D44])+3;0) -> 0 | E44: of:=VLOOKUP([Group.$I44]&[Group.$L44]&[Group.$K44];[Parts.$A$1:.$V$1000];COLUMN([.E44])+3;0) -> 0 | F44: of:=VLOOKUP([Group.$I44]&[Group.$L44]&[Group.$K44];[Parts.$A$1:.$V$1000];COLUMN([.F44])+3;0) -> 0 | G44: of:=VLOOKUP([Group.$I44]&[Group.$L44]&[Group.$K44];[Parts.$A$1:.$V$1000];COLUMN([.G44])+3;0) -> 0 | H44: of:=[Group.M44] -> 1 | J44: of:=[Group.I44] -> STAR | K44: of:=[Group.K44] -> CONN_1 | L44: of:=[Group.$I44]&[Group.$L44]&[Group.$K44] -> STARConnect:1pinCONN_1
A45: of:=VLOOKUP([Group.$I45]&[Group.$L45]&[Group.$K45];[Parts.$A$1:.$V$1000];COLUMN([.A45])+3;0) -> C&K Components | B45: of:=VLOOKUP([Group.$I45]&[Group.$L45]&[Group.$K45];[Parts.$A$1:.$V$1000];COLUMN([.B45])+3;0) -> OS102011MA1QN1 | C45: of:=VLOOKUP([Group.$I45]&[Group.$L45]&[Group.$K45];[Parts.$A$1:.$V$1000];COLUMN([.C45])+3;0) -> 1201431 | D45: of:=VLOOKUP([Group.$I45]&[Group.$L45]&[Group.$K45];[Parts.$A$1:.$V$1000];COLUMN([.D45])+3;0) -> 0 | E45: of:=VLOOKUP([Group.$I45]&[Group.$L45]&[Group.$K45];[Parts.$A$1:.$V$1000];COLUMN([.E45])+3;0) -> 171.42 | F45: of:=VLOOKUP([Group.$I45]&[Group.$L45]&[Group.$K45];[Parts.$A$1:.$V$1000];COLUMN([.F45])+3;0) -> 5 | G45: of:=VLOOKUP([Group.$I45]&[Group.$L45]&[Group.$K45];[Parts.$A$1:.$V$1000];COLUMN([.G45])+3;0) -> 1 | H45: of:=[Group.M45] -> 1 | J45: of:=[Group.I45] -> SW | K45: of:=[Group.K45] -> OS102011MA1QN1 | L45: of:=[Group.$I45]&[Group.$L45]&[Group.$K45] -> SWBenchBudEE:BB_switchOS102011MA1QN1
A46: of:=VLOOKUP([Group.$I46]&[Group.$L46]&[Group.$K46];[Parts.$A$1:.$V$1000];COLUMN([.A46])+3;0) -> TE Connectivity | B46: of:=VLOOKUP([Group.$I46]&[Group.$L46]&[Group.$K46];[Parts.$A$1:.$V$1000];COLUMN([.B46])+3;0) -> MINISMDC050F-2 | C46: of:=VLOOKUP([Group.$I46]&[Group.$L46]&[Group.$K46];[Parts.$A$1:.$V$1000];COLUMN([.C46])+3;0) -> 1175839 | D46: of:=VLOOKUP([Group.$I46]&[Group.$L46]&[Group.$K46];[Parts.$A$1:.$V$1000];COLUMN([.D46])+3;0) -> 0 | E46: of:=VLOOKUP([Group.$I46]&[Group.$L46]&[Group.$K46];[Parts.$A$1:.$V$1000];COLUMN([.E46])+3;0) -> 110.47 | F46: of:=VLOOKUP([Group.$I46]&[Group.$L46]&[Group.$K46];[Parts.$A$1:.$V$1000];COLUMN([.F46])+3;0) -> 5 | G46: of:=VLOOKUP([Group.$I46]&[Group.$L46]&[Group.$K46];[Parts.$A$1:.$V$1000];COLUMN([.G46])+3;0) -> 4 | H46: of:=[Group.M46] -> 5 | J46: of:=[Group.I46] -> TH | K46: of:=[Group.K46] -> MINISMDC050F-2 | L46: of:=[Group.$I46]&[Group.$L46]&[Group.$K46] -> THSMD_Packages:SM1812MINISMDC050F-2
A47: of:=VLOOKUP([Group.$I47]&[Group.$L47]&[Group.$K47];[Parts.$A$1:.$V$1000];COLUMN([.A47])+3;0) -> 0 | B47: of:=VLOOKUP([Group.$I47]&[Group.$L47]&[Group.$K47];[Parts.$A$1:.$V$1000];COLUMN([.B47])+3;0) -> 0 | C47: of:=VLOOKUP([Group.$I47]&[Group.$L47]&[Group.$K47];[Parts.$A$1:.$V$1000];COLUMN([.C47])+3;0) -> 0 | D47: of:=VLOOKUP([Group.$I47]&[Group.$L47]&[Group.$K47];[Parts.$A$1:.$V$1000];COLUMN([.D47])+3;0) -> 0 | E47: of:=VLOOKUP([Group.$I47]&[Group.$L47]&[Group.$K47];[Parts.$A$1:.$V$1000];COLUMN([.E47])+3;0) -> 0 | F47: of:=VLOOKUP([Group.$I47]&[Group.$L47]&[Group.$K47];[Parts.$A$1:.$V$1000];COLUMN([.F47])+3;0) -> 0 | G47: of:=VLOOKUP([Group.$I47]&[Group.$L47]&[Group.$K47];[Parts.$A$1:.$V$1000];COLUMN([.G47])+3;0) -> 0 | H47: of:=[Group.M47] -> 1 | J47: of:=[Group.I47] -> TP | K47: of:=[Group.K47] -> +12P | L47: of:=[Group.$I47]&[Group.$L47]&[Group.$K47] -> TPBenchBudEE:TestPointTH+12P
A48: of:=VLOOKUP([Group.$I48]&[Group.$L48]&[Group.$K48];[Parts.$A$1:.$V$1000];COLUMN([.A48])+3;0) -> 0 | B48: of:=VLOOKUP([Group.$I48]&[Group.$L48]&[Group.$K48];[Parts.$A$1:.$V$1000];COLUMN([.B48])+3;0) -> 0 | C48: of:=VLOOKUP([Group.$I48]&[Group.$L48]&[Group.$K48];[Parts.$A$1:.$V$1000];COLUMN([.C48])+3;0) -> 0 | D48: of:=VLOOKUP([Group.$I48]&[Group.$L48]&[Group.$K48];[Parts.$A$1:.$V$1000];COLUMN([.D48])+3;0) -> 0 | E48: of:=VLOOKUP([Group.$I48]&[Group.$L48]&[Group.$K48];[Parts.$A$1:.$V$1000];COLUMN([.E48])+3;0) -> 0 | F48: of:=VLOOKUP([Group.$I48]&[Group.$L48]&[Group.$K48];[Parts.$A$1:.$V$1000];COLUMN([.F48])+3;0) -> 0 | G48: of:=VLOOKUP([Group.$I48]&[Group.$L48]&[Group.$K48];[Parts.$A$1:.$V$1000];COLUMN([.G48])+3;0) -> 0 | H48: of:=[Group.M48] -> 1 | J48: of:=[Group.I48] -> TP | K48: of:=[Group.K48] -> +5V | L48: of:=[Group.$I48]&[Group.$L48]&[Group.$K48] -> TPBenchBudEE:TestPointTH+5V
A49: of:=VLOOKUP([Group.$I49]&[Group.$L49]&[Group.$K49];[Parts.$A$1:.$V$1000];COLUMN([.A49])+3;0) -> 0 | B49: of:=VLOOKUP([Group.$I49]&[Group.$L49]&[Group.$K49];[Parts.$A$1:.$V$1000];COLUMN([.B49])+3;0) -> 0 | C49: of:=VLOOKUP([Group.$I49]&[Group.$L49]&[Group.$K49];[Parts.$A$1:.$V$1000];COLUMN([.C49])+3;0) -> 0 | D49: of:=VLOOKUP([Group.$I49]&[Group.$L49]&[Group.$K49];[Parts.$A$1:.$V$1000];COLUMN([.D49])+3;0) -> 0 | E49: of:=VLOOKUP([Group.$I49]&[Group.$L49]&[Group.$K49];[Parts.$A$1:.$V$1000];COLUMN([.E49])+3;0) -> 0 | F49: of:=VLOOKUP([Group.$I49]&[Group.$L49]&[Group.$K49];[Parts.$A$1:.$V$1000];COLUMN([.F49])+3;0) -> 0 | G49: of:=VLOOKUP([Group.$I49]&[Group.$L49]&[Group.$K49];[Parts.$A$1:.$V$1000];COLUMN([.G49])+3;0) -> 0 | H49: of:=[Group.M49] -> 1 | J49: of:=[Group.I49] -> TP | K49: of:=[Group.K49] -> AGND | L49: of:=[Group.$I49]&[Group.$L49]&[Group.$K49] -> TPBenchBudEE:TestPointTHAGND
A50: of:=VLOOKUP([Group.$I50]&[Group.$L50]&[Group.$K50];[Parts.$A$1:.$V$1000];COLUMN([.A50])+3;0) -> 0 | B50: of:=VLOOKUP([Group.$I50]&[Group.$L50]&[Group.$K50];[Parts.$A$1:.$V$1000];COLUMN([.B50])+3;0) -> 0 | C50: of:=VLOOKUP([Group.$I50]&[Group.$L50]&[Group.$K50];[Parts.$A$1:.$V$1000];COLUMN([.C50])+3;0) -> 0 | D50: of:=VLOOKUP([Group.$I50]&[Group.$L50]&[Group.$K50];[Parts.$A$1:.$V$1000];COLUMN([.D50])+3;0) -> 0 | E50: of:=VLOOKUP([Group.$I50]&[Group.$L50]&[Group.$K50];[Parts.$A$1:.$V$1000];COLUMN([.E50])+3;0) -> 0 | F50: of:=VLOOKUP([Group.$I50]&[Group.$L50]&[Group.$K50];[Parts.$A$1:.$V$1000];COLUMN([.F50])+3;0) -> 0 | G50: of:=VLOOKUP([Group.$I50]&[Group.$L50]&[Group.$K50];[Parts.$A$1:.$V$1000];COLUMN([.G50])+3;0) -> 0 | H50: of:=[Group.M50] -> 1 | J50: of:=[Group.I50] -> TP | K50: of:=[Group.K50] -> CH0+ | L50: of:=[Group.$I50]&[Group.$L50]&[Group.$K50] -> TPBenchBudEE:TestPointTHCH0+
A51: of:=VLOOKUP([Group.$I51]&[Group.$L51]&[Group.$K51];[Parts.$A$1:.$V$1000];COLUMN([.A51])+3;0) -> 0 | B51: of:=VLOOKUP([Group.$I51]&[Group.$L51]&[Group.$K51];[Parts.$A$1:.$V$1000];COLUMN([.B51])+3;0) -> 0 | C51: of:=VLOOKUP([Group.$I51]&[Group.$L51]&[Group.$K51];[Parts.$A$1:.$V$1000];COLUMN([.C51])+3;0) -> 0 | D51: of:=VLOOKUP([Group.$I51]&[Group.$L51]&[Group.$K51];[Parts.$A$1:.$V$1000];COLUMN([.D51])+3;0) -> 0 | E51: of:=VLOOKUP([Group.$I51]&[Group.$L51]&[Group.$K51];[Parts.$A$1:.$V$1000];COLUMN([.E51])+3;0) -> 0 | F51: of:=VLOOKUP([Group.$I51]&[Group.$L51]&[Group.$K51];[Parts.$A$1:.$V$1000];COLUMN([.F51])+3;0) -> 0 | G51: of:=VLOOKUP([Group.$I51]&[Group.$L51]&[Group.$K51];[Parts.$A$1:.$V$1000];COLUMN([.G51])+3;0) -> 0 | H51: of:=[Group.M51] -> 1 | J51: of:=[Group.I51] -> TP | K51: of:=[Group.K51] -> CH1+ | L51: of:=[Group.$I51]&[Group.$L51]&[Group.$K51] -> TPBenchBudEE:TestPointTHCH1+
A52: of:=VLOOKUP([Group.$I52]&[Group.$L52]&[Group.$K52];[Parts.$A$1:.$V$1000];COLUMN([.A52])+3;0) -> 0 | B52: of:=VLOOKUP([Group.$I52]&[Group.$L52]&[Group.$K52];[Parts.$A$1:.$V$1000];COLUMN([.B52])+3;0) -> 0 | C52: of:=VLOOKUP([Group.$I52]&[Group.$L52]&[Group.$K52];[Parts.$A$1:.$V$1000];COLUMN([.C52])+3;0) -> 0 | D52: of:=VLOOKUP([Group.$I52]&[Group.$L52]&[Group.$K52];[Parts.$A$1:.$V$1000];COLUMN([.D52])+3;0) -> 0 | E52: of:=VLOOKUP([Group.$I52]&[Group.$L52]&[Group.$K52];[Parts.$A$1:.$V$1000];COLUMN([.E52])+3;0) -> 0 | F52: of:=VLOOKUP([Group.$I52]&[Group.$L52]&[Group.$K52];[Parts.$A$1:.$V$1000];COLUMN([.F52])+3;0) -> 0 | G52: of:=VLOOKUP([Group.$I52]&[Group.$L52]&[Group.$K52];[Parts.$A$1:.$V$1000];COLUMN([.G52])+3;0) -> 0 | H52: of:=[Group.M52] -> 1 | J52: of:=[Group.I52] -> TP | K52: of:=[Group.K52] -> DAC_OUT | L52: of:=[Group.$I52]&[Group.$L52]&[Group.$K52] -> TPBenchBudEE:TestPointTHDAC_OUT
A53: of:=VLOOKUP([Group.$I53]&[Group.$L53]&[Group.$K53];[Parts.$A$1:.$V$1000];COLUMN([.A53])+3;0) -> 0 | B53: of:=VLOOKUP([Group.$I53]&[Group.$L53]&[Group.$K53];[Parts.$A$1:.$V$1000];COLUMN([.B53])+3;0) -> 0 | C53: of:=VLOOKUP([Group.$I53]&[Group.$L53]&[Group.$K53];[Parts.$A$1:.$V$1000];COLUMN([.C53])+3;0) -> 0 | D53: of:=VLOOKUP([Group.$I53]&[Group.$L53]&[Group.$K53];[Parts.$A$1:.$V$1000];COLUMN([.D53])+3;0) -> 0 | E53: of:=VLOOKUP([Group.$I53]&[Group.$L53]&[Group.$K53];[Parts.$A$1:.$V$1000];COLUMN([.E53])+3;0) -> 0 | F53: of:=VLOOKUP([Group.$I53]&[Group.$L53]&[Group.$K53];[Parts.$A$1:.$V$1000];COLUMN([.F53])+3;0) -> 0 | G53: of:=VLOOKUP([Group.$I53]&[Group.$L53]&[Group.$K53];[Parts.$A$1:.$V$1000];COLUMN([.G53])+3;0) -> 0 | H53: of:=[Group.M53] -> 1 | J53: of:=[Group.I53] -> TP | K53: of:=[Group.K53] -> GND_PWR | L53: of:=[Group.$I53]&[Group.$L53]&[Group.$K53] -> TPBenchBudEE:TestPointTHGND_PWR
A54: of:=VLOOKUP([Group.$I54]&[Group.$L54]&[Group.$K54];[Parts.$A$1:.$V$1000];COLUMN([.A54])+3;0) -> 0 | B54: of:=VLOOKUP([Group.$I54]&[Group.$L54]&[Group.$K54];[Parts.$A$1:.$V$1000];COLUMN([.B54])+3;0) -> 0 | C54: of:=VLOOKUP([Group.$I54]&[Group.$L54]&[Group.$K54];[Parts.$A$1:.$V$1000];COLUMN([.C54])+3;0) -> 0 | D54: of:=VLOOKUP([Group.$I54]&[Group.$L54]&[Group.$K54];[Parts.$A$1:.$V$1000];COLUMN([.D54])+3;0) -> 0 | E54: of:=VLOOKUP([Group.$I54]&[Group.$L54]&[Group.$K54];[Parts.$A$1:.$V$1000];COLUMN([.E54])+3;0) -> 0 | F54: of:=VLOOKUP([Group.$I54]&[Group.$L54]&[Group.$K54];[Parts.$A$1:.$V$1000];COLUMN([.F54])+3;0) -> 0 | G54: of:=VLOOKUP([Group.$I54]&[Group.$L54]&[Group.$K54];[Parts.$A$1:.$V$1000];COLUMN([.G54])+3;0) -> 0 | H54: of:=[Group.M54] -> 1 | J54: of:=[Group.I54] -> TP | K54: of:=[Group.K54] -> RLY_LOW | L54: of:=[Group.$I54]&[Group.$L54]&[Group.$K54] -> TPBenchBudEE:TestPointTHRLY_LOW
A55: of:=VLOOKUP([Group.$I55]&[Group.$L55]&[Group.$K55];[Parts.$A$1:.$V$1000];COLUMN([.A55])+3;0) -> Avago Technologies | B55: of:=VLOOKUP([Group.$I55]&[Group.$L55]&[Group.$K55];[Parts.$A$1:.$V$1000];COLUMN([.B55])+3;0) -> ACPL-217-500E | C55: of:=VLOOKUP([Group.$I55]&[Group.$L55]&[Group.$K55];[Parts.$A$1:.$V$1000];COLUMN([.C55])+3;0) -> 1602614 | D55: of:=VLOOKUP([Group.$I55]&[Group.$L55]&[Group.$K55];[Parts.$A$1:.$V$1000];COLUMN([.D55])+3;0) -> 0 | E55: of:=VLOOKUP([Group.$I55]&[Group.$L55]&[Group.$K55];[Parts.$A$1:.$V$1000];COLUMN([.E55])+3;0) -> 91.8 | F55: of:=VLOOKUP([Group.$I55]&[Group.$L55]&[Group.$K55];[Parts.$A$1:.$V$1000];COLUMN([.F55])+3;0) -> 1 | G55: of:=VLOOKUP([Group.$I55]&[Group.$L55]&[Group.$K55];[Parts.$A$1:.$V$1000];COLUMN([.G55])+3;0) -> 1 | H55: of:=[Group.M55] -> 1 | J55: of:=[Group.I55] -> U | K55: of:=[Group.K55] -> ACPL-217-500E | L55: of:=[Group.$I55]&[Group.$L55]&[Group.$K55] -> UBenchBudEE:4-SMDACPL-217-500E
A56: of:=VLOOKUP([Group.$I56]&[Group.$L56]&[Group.$K56];[Parts.$A$1:.$V$1000];COLUMN([.A56])+3;0) -> ON Semiconductor | B56: of:=VLOOKUP([Group.$I56]&[Group.$L56]&[Group.$K56];[Parts.$A$1:.$V$1000];COLUMN([.B56])+3;0) -> LM317TG | C56: of:=VLOOKUP([Group.$I56]&[Group.$L56]&[Group.$K56];[Parts.$A$1:.$V$1000];COLUMN([.C56])+3;0) -> 1652293 | D56: of:=VLOOKUP([Group.$I56]&[Group.$L56]&[Group.$K56];[Parts.$A$1:.$V$1000];COLUMN([.D56])+3;0) -> 0 | E56: of:=VLOOKUP([Group.$I56]&[Group.$L56]&[Group.$K56];[Parts.$A$1:.$V$1000];COLUMN([.E56])+3;0) -> 186.66 | F56: of:=VLOOKUP([Group.$I56]&[Group.$L56]&[Group.$K56];[Parts.$A$1:.$V$1000];COLUMN([.F56])+3;0) -> 1 | G56: of:=VLOOKUP([Group.$I56]&[Group.$L56]&[Group.$K56];[Parts.$A$1:.$V$1000];COLUMN([.G56])+3;0) -> 2 | H56: of:=[Group.M56] -> 2 | J56: of:=[Group.I56] -> U | K56: of:=[Group.K56] -> LM317TG | L56: of:=[Group.$I56]&[Group.$L56]&[Group.$K56] -> UTransistors_TO-220:TO-220_Neutral123_VerticalLM317TG
A57: of:=VLOOKUP([Group.$I57]&[Group.$L57]&[Group.$K57];[Parts.$A$1:.$V$1000];COLUMN([.A57])+3;0) -> ON Semiconductor | B57: of:=VLOOKUP([Group.$I57]&[Group.$L57]&[Group.$K57];[Parts.$A$1:.$V$1000];COLUMN([.B57])+3;0) -> LM337TG | C57: of:=VLOOKUP([Group.$I57]&[Group.$L57]&[Group.$K57];[Parts.$A$1:.$V$1000];COLUMN([.C57])+3;0) -> 1211104 | D57: of:=VLOOKUP([Group.$I57]&[Group.$L57]&[Group.$K57];[Parts.$A$1:.$V$1000];COLUMN([.D57])+3;0) -> 0 | E57: of:=VLOOKUP([Group.$I57]&[Group.$L57]&[Group.$K57];[Parts.$A$1:.$V$1000];COLUMN([.E57])+3;0) -> 236.18 | F57: of:=VLOOKUP([Group.$I57]&[Group.$L57]&[Group.$K57];[Parts.$A$1:.$V$1000];COLUMN([.F57])+3;0) -> 1 | G57: of:=VLOOKUP([Group.$I57]&[Group.$L57]&[Group.$K57];[Parts.$A$1:.$V$1000];COLUMN([.G57])+3;0) -> 2 | H57: of:=[Group.M57] -> 2 | J57: of:=[Group.I57] -> U | K57: of:=[Group.K57] -> LM337TG | L57: of:=[Group.$I57]&[Group.$L57]&[Group.$K57] -> UTransistors_TO-220:TO-220_Neutral123_VerticalLM337TG
A58: of:=VLOOKUP([Group.$I58]&[Group.$L58]&[Group.$K58];[Parts.$A$1:.$V$1000];COLUMN([.A58])+3;0) -> Texas Instruments | B58: of:=VLOOKUP([Group.$I58]&[Group.$L58]&[Group.$K58];[Parts.$A$1:.$V$1000];COLUMN([.B58])+3;0) -> LMT84DCKT | C58: of:=VLOOKUP([Group.$I58]&[Group.$L58]&[Group.$K58];[Parts.$A$1:.$V$1000];COLUMN([.C58])+3;0) -> 2314386 | D58: of:=VLOOKUP([Group.$I58]&[Group.$L58]&[Group.$K58];[Parts.$A$1:.$V$1000];COLUMN([.D58])+3;0) -> 0 | E58: of:=VLOOKUP([Group.$I58]&[Group.$L58]&[Group.$K58];[Parts.$A$1:.$V$1000];COLUMN([.E58])+3;0) -> 148.56 | F58: of:=VLOOKUP([Group.$I58]&[Group.$L58]&[Group.$K58];[Parts.$A$1:.$V$1000];COLUMN([.F58])+3;0) -> 1 | G58: of:=VLOOKUP([Group.$I58]&[Group.$L58]&[Group.$K58];[Parts.$A$1:.$V$1000];COLUMN([.G58])+3;0) -> 1 | H58: of:=[Group.M58] -> 1 | J58: of:=[Group.I58] -> U | K58: of:=[Group.K58] -> LMT84DCKT | L58: of:=[Group.$I58]&[Group.$L58]&[Group.$K58] -> USMD_Packages:SOT353LMT84DCKT
A59: of:=VLOOKUP([Group.$I59]&[Group.$L59]&[Group.$K59];[Parts.$A$1:.$V$1000];COLUMN([.A59])+3;0) -> Microchip | B59: of:=VLOOKUP([Group.$I59]&[Group.$L59]&[Group.$K59];[Parts.$A$1:.$V$1000];COLUMN([.B59])+3;0) -> MCP3901A0-I/SS | C59: of:=VLOOKUP([Group.$I59]&[Group.$L59]&[Group.$K59];[Parts.$A$1:.$V$1000];COLUMN([.C59])+3;0) -> 0 | D59: of:=VLOOKUP([Group.$I59]&[Group.$L59]&[Group.$K59];[Parts.$A$1:.$V$1000];COLUMN([.D59])+3;0) -> 0 | E59: of:=VLOOKUP([Group.$I59]&[Group.$L59]&[Group.$K59];[Parts.$A$1:.$V$1000];COLUMN([.E59])+3;0) -> 450 | F59: of:=VLOOKUP([Group.$I59]&[Group.$L59]&[Group.$K59];[Parts.$A$1:.$V$1000];COLUMN([.F59])+3;0) -> 5 | G59: of:=VLOOKUP([Group.$I59]&[Group.$L59]&[Group.$K59];[Parts.$A$1:.$V$1000];COLUMN([.G59])+3;0) -> 1 | H59: of:=[Group.M59] -> 1 | J59: of:=[Group.I59] -> U | K59: of:=[Group.K59] -> MCP3901A0-I/SS | L59: of:=[Group.$I59]&[Group.$L59]&[Group.$K59] -> USMD_Packages:SSOP20MCP3901A0-I/SS
A60: of:=VLOOKUP([Group.$I60]&[Group.$L60]&[Group.$K60];[Parts.$A$1:.$V$1000];COLUMN([.A60])+3;0) -> Microchip | B60: of:=VLOOKUP([Group.$I60]&[Group.$L60]&[Group.$K60];[Parts.$A$1:.$V$1000];COLUMN([.B60])+3;0) -> MCP4801-E/SN | C60: of:=VLOOKUP([Group.$I60]&[Group.$L60]&[Group.$K60];[Parts.$A$1:.$V$1000];COLUMN([.C60])+3;0) -> 0 | D60: of:=VLOOKUP([Group.$I60]&[Group.$L60]&[Group.$K60];[Parts.$A$1:.$V$1000];COLUMN([.D60])+3;0) -> 0 | E60: of:=VLOOKUP([Group.$I60]&[Group.$L60]&[Group.$K60];[Parts.$A$1:.$V$1000];COLUMN([.E60])+3;0) -> 250 | F60: of:=VLOOKUP([Group.$I60]&[Group.$L60]&[Group.$K60];[Parts.$A$1:.$V$1000];COLUMN([.F60])+3;0) -> 5 | G60: of:=VLOOKUP([Group.$I60]&[Group.$L60]&[Group.$K60];[Parts.$A$1:.$V$1000];COLUMN([.G60])+3;0) -> 1 | H60: of:=[Group.M60] -> 1 | J60: of:=[Group.I60] -> U | K60: of:=[Group.K60] -> MCP4801-E/SN | L60: of:=[Group.$I60]&[Group.$L60]&[Group.$K60] -> USMD_Packages:SO8NMCP4801-E/SN
A61: of:=VLOOKUP([Group.$I61]&[Group.$L61]&[Group.$K61];[Parts.$A$1:.$V$1000];COLUMN([.A61])+3;0) -> Texas Instruments | B61: of:=VLOOKUP([Group.$I61]&[Group.$L61]&[Group.$K61];[Parts.$A$1:.$V$1000];COLUMN([.B61])+3;0) -> OPA4170AID | C61: of:=VLOOKUP([Group.$I61]&[Group.$L61]&[Group.$K61];[Parts.$A$1:.$V$1000];COLUMN([.C61])+3;0) -> 2382790 | D61: of:=VLOOKUP([Group.$I61]&[Group.$L61]&[Group.$K61];[Parts.$A$1:.$V$1000];COLUMN([.D61])+3;0) -> 0 | E61: of:=VLOOKUP([Group.$I61]&[Group.$L61]&[Group.$K61];[Parts.$A$1:.$V$1000];COLUMN([.E61])+3;0) -> 735.2 | F61: of:=VLOOKUP([Group.$I61]&[Group.$L61]&[Group.$K61];[Parts.$A$1:.$V$1000];COLUMN([.F61])+3;0) -> 1 | G61: of:=VLOOKUP([Group.$I61]&[Group.$L61]&[Group.$K61];[Parts.$A$1:.$V$1000];COLUMN([.G61])+3;0) -> 1 | H61: of:=[Group.M61] -> 1 | J61: of:=[Group.I61] -> U | K61: of:=[Group.K61] -> OPA4170AID | L61: of:=[Group.$I61]&[Group.$L61]&[Group.$K61] -> USMD_Packages:SO14EOPA4170AID
A62: of:=VLOOKUP([Group.$I62]&[Group.$L62]&[Group.$K62];[Parts.$A$1:.$V$1000];COLUMN([.A62])+3;0) -> Taiwan Semiconductor | B62: of:=VLOOKUP([Group.$I62]&[Group.$L62]&[Group.$K62];[Parts.$A$1:.$V$1000];COLUMN([.B62])+3;0) -> TS19371CX6 RF | C62: of:=VLOOKUP([Group.$I62]&[Group.$L62]&[Group.$K62];[Parts.$A$1:.$V$1000];COLUMN([.C62])+3;0) -> 1824780 | D62: of:=VLOOKUP([Group.$I62]&[Group.$L62]&[Group.$K62];[Parts.$A$1:.$V$1000];COLUMN([.D62])+3;0) -> 0 | E62: of:=VLOOKUP([Group.$I62]&[Group.$L62]&[Group.$K62];[Parts.$A$1:.$V$1000];COLUMN([.E62])+3;0) -> 319.98 | F62: of:=VLOOKUP([Group.$I62]&[Group.$L62]&[Group.$K62];[Parts.$A$1:.$V$1000];COLUMN([.F62])+3;0) -> 1 | G62: of:=VLOOKUP([Group.$I62]&[Group.$L62]&[Group.$K62];[Parts.$A$1:.$V$1000];COLUMN([.G62])+3;0) -> 1 | H62: of:=[Group.M62] -> 1 | J62: of:=[Group.I62] -> U | K62: of:=[Group.K62] -> TS19371CX6 RF | L62: of:=[Group.$I62]&[Group.$L62]&[Group.$K62] -> USMD_Packages:SOT23_6TS19371CX6 RF
A63: of:=VLOOKUP([Group.$I63]&[Group.$L63]&[Group.$K63];[Parts.$A$1:.$V$1000];COLUMN([.A63])+3;0) -> 0 | B63: of:=VLOOKUP([Group.$I63]&[Group.$L63]&[Group.$K63];[Parts.$A$1:.$V$1000];COLUMN([.B63])+3;0) -> 0 | C63: of:=VLOOKUP([Group.$I63]&[Group.$L63]&[Group.$K63];[Parts.$A$1:.$V$1000];COLUMN([.C63])+3;0) -> 0 | D63: of:=VLOOKUP([Group.$I63]&[Group.$L63]&[Group.$K63];[Parts.$A$1:.$V$1000];COLUMN([.D63])+3;0) -> 0 | E63: of:=VLOOKUP([Group.$I63]&[Group.$L63]&[Group.$K63];[Parts.$A$1:.$V$1000];COLUMN([.E63])+3;0) -> 0 | F63: of:=VLOOKUP([Group.$I63]&[Group.$L63]&[Group.$K63];[Parts.$A$1:.$V$1000];COLUMN([.F63])+3;0) -> 0 | G63: of:=VLOOKUP([Group.$I63]&[Group.$L63]&[Group.$K63];[Parts.$A$1:.$V$1000];COLUMN([.G63])+3;0) -> 0

Sheet: Group
A1: of:=IF(ISBLANK(['BenchBudEE.csv'.A1]);"";['BenchBudEE.csv'.A1]) -> Reference | B1: of:=IF(ISBLANK(['BenchBudEE.csv'.B1]);"";['BenchBudEE.csv'.B1]) ->  Value | C1: of:=IF(ISBLANK(['BenchBudEE.csv'.C1]);"";['BenchBudEE.csv'.C1]) ->  Footprint | D1: of:=IF(ISBLANK(['BenchBudEE.csv'.D1]);"";['BenchBudEE.csv'.D1]) ->  Datasheet | E1: of:=IF(ISBLANK(['BenchBudEE.csv'.E1]);"";['BenchBudEE.csv'.E1]) ->  MFG Name | F1: of:=IF(ISBLANK(['BenchBudEE.csv'.F1]);"";['BenchBudEE.csv'.F1]) ->  MFG Part Number | G1: Type | I1: Type | J1: Reference1 | K1: Value | L1: Footprint | M1: Quantity | N1: 2
A2: of:=IF(ISBLANK(['BenchBudEE.csv'.A137]);"";['BenchBudEE.csv'.A137]) -> ARD1 | B2: of:=IF(ISBLANK(['BenchBudEE.csv'.B137]);"";['BenchBudEE.csv'.B137]) -> A000066 | C2: of:=IF(ISBLANK(['BenchBudEE.csv'.C137]);"";['BenchBudEE.csv'.C137]) -> BenchBudEE:Arduino | D2: of:=IF(ISBLANK(['BenchBudEE.csv'.D137]);"";['BenchBudEE.csv'.D137]) ->  | E2: of:=IF(ISBLANK(['BenchBudEE.csv'.E137]);"";['BenchBudEE.csv'.E137]) ->  | F2: of:=IF(ISBLANK(['BenchBudEE.csv'.F137]);"";['BenchBudEE.csv'.F137]) ->  | G2: of:=IF(ISNUMBER(SEARCH("[0-9]";[.A2]));MID([.A2];1;SEARCH("[0-9]";[.A2])-1);"") -> ARD | I2: of:=IF(ISNUMBER(SEARCH("[0-9]";[.J2]));MID([.J2];1;SEARCH("[0-9]";[.J2])-1);"") -> ARD | J2: of:=INDIRECT("A"&[.N1]) -> ARD1 | K2: of:=INDIRECT("B"&[.N1]) -> A000066 | L2: of:=INDIRECT("C"&[.N1]) -> BenchBudEE:Arduino | M2: of:=[.N2]-[.N1] -> 1 | N2: of:=MIN(IF(INDIRECT("B"&[.N1]&":B999")<>INDIRECT("B"&[.N1]);ROW(INDIRECT("B"&[.N1]&":B999"));9999);IF(INDIRECT("C"&[.N1]&":C999")<>INDIRECT("C"&[.N1]);ROW(INDIRECT("C"&[.N1]&":C999"));9999)) -> 3 | P2: of:=VLOOKUP([.I2]&[.L2]&[.K2];[Parts.A1:.V88];6;0) -> 2075382
A3: of:=IF(ISBLANK(['BenchBudEE.csv'.A67]);"";['BenchBudEE.csv'.A67]) -> C18 | B3: of:=IF(ISBLANK(['BenchBudEE.csv'.B67]);"";['BenchBudEE.csv'.B67]) -> .01u | C3: of:=IF(ISBLANK(['BenchBudEE.csv'.C67]);"";['BenchBudEE.csv'.C67]) -> Capacitors_SMD:c_0805 | D3: of:=IF(ISBLANK(['BenchBudEE.csv'.D67]);"";['BenchBudEE.csv'.D67]) ->  | E3: of:=IF(ISBLANK(['BenchBudEE.csv'.E67]);"";['BenchBudEE.csv'.E67]) ->  | F3: of:=IF(ISBLANK(['BenchBudEE.csv'.F67]);"";['BenchBudEE.csv'.F67]) ->  | G3: of:=IF(ISNUMBER(SEARCH("[0-9]";[.A3]));MID([.A3];1;SEARCH("[0-9]";[.A3])-1);"") -> C | I3: of:=IF(ISNUMBER(SEARCH("[0-9]";[.J3]));MID([.J3];1;SEARCH("[0-9]";[.J3])-1);"") -> C | J3: of:=INDIRECT("A"&[.N2]) -> C18 | K3: of:=INDIRECT("B"&[.N2]) -> .01u | L3: of:=INDIRECT("C"&[.N2]) -> Capacitors_SMD:c_0805 | M3: of:=[.N3]-[.N2] -> 4 | N3: of:=MIN(IF(INDIRECT("B"&[.N2]&":B999")<>INDIRECT("B"&[.N2]);ROW(INDIRECT("B"&[.N2]&":B999"));9999);IF(INDIRECT("C"&[.N2]&":C999")<>INDIRECT("C"&[.N2]);ROW(INDIRECT("C"&[.N2]&":C999"));9999)) -> 7 | P3: of:=[.I2]&[.L2]&[.K2] -> ARDBenchBudEE:ArduinoA000066
A4: of:=IF(ISBLANK(['BenchBudEE.csv'.A66]);"";['BenchBudEE.csv'.A66]) -> C19 | B4: of:=IF(ISBLANK(['BenchBudEE.csv'.B66]);"";['BenchBudEE.csv'.B66]) -> .01u | C4: of:=IF(ISBLANK(['BenchBudEE.csv'.C66]);"";['BenchBudEE.csv'.C66]) -> Capacitors_SMD:c_0805 | D4: of:=IF(ISBLANK(['BenchBudEE.csv'.D66]);"";['BenchBudEE.csv'.D66]) ->  | E4: of:=IF(ISBLANK(['BenchBudEE.csv'.E66]);"";['BenchBudEE.csv'.E66]) ->  | F4: of:=IF(ISBLANK(['BenchBudEE.csv'.F66]);"";['BenchBudEE.csv'.F66]) ->  | G4: of:=IF(ISNUMBER(SEARCH("[0-9]";[.A4]));MID([.A4];1;SEARCH("[0-9]";[.A4])-1);"") -> C | I4: of:=IF(ISNUMBER(SEARCH("[0-9]";[.J4]));MID([.J4];1;SEARCH("[0-9]";[.J4])-1);"") -> C | J4: of:=INDIRECT("A"&[.N3]) -> C7 | K4: of:=INDIRECT("B"&[.N3]) -> 100p | L4: of:=INDIRECT("C"&[.N3]) -> Capacitors_SMD:c_0805 | M4: of:=[.N4]-[.N3] -> 1 | N4: of:=MIN(IF(INDIRECT("B"&[.N3]&":B999")<>INDIRECT("B"&[.N3]);ROW(INDIRECT("B"&[.N3]&":B999"));9999);IF(INDIRECT("C"&[.N3]&":C999")<>INDIRECT("C"&[.N3]);ROW(INDIRECT("C"&[.N3]&":C999"));9999)) -> 8
A5: of:=IF(ISBLANK(['BenchBudEE.csv'.A70]);"";['BenchBudEE.csv'.A70]) -> C20 | B5: of:=IF(ISBLANK(['BenchBudEE.csv'.B70]);"";['BenchBudEE.csv'.B70]) -> .01u | C5: of:=IF(ISBLANK(['BenchBudEE.csv'.C70]);"";['BenchBudEE.csv'.C70]) -> Capacitors_SMD:c_0805 | D5: of:=IF(ISBLANK(['BenchBudEE.csv'.D70]);"";['BenchBudEE.csv'.D70]) ->  | E5: of:=IF(ISBLANK(['BenchBudEE.csv'.E70]);"";['BenchBudEE.csv'.E70]) ->  | F5: of:=IF(ISBLANK(['BenchBudEE.csv'.F70]);"";['BenchBudEE.csv'.F70]) ->  | G5: of:=IF(ISNUMBER(SEARCH("[0-9]";[.A5]));MID([.A5];1;SEARCH("[0-9]";[.A5])-1);"") -> C | I5: of:=IF(ISNUMBER(SEARCH("[0-9]";[.J5]));MID([.J5];1;SEARCH("[0-9]";[.J5])-1);"") -> C | J5: of:=INDIRECT("A"&[.N4]) -> C14 | K5: of:=INDIRECT("B"&[.N4]) -> 10u | L5: of:=INDIRECT("C"&[.N4]) -> Capacitors_SMD:c_0805 | M5: of:=[.N5]-[.N4] -> 8 | N5: of:=MIN(IF(INDIRECT("B"&[.N4]&":B999")<>INDIRECT("B"&[.N4]);ROW(INDIRECT("B"&[.N4]&":B999"));9999);IF(INDIRECT("C"&[.N4]&":C999")<>INDIRECT("C"&[.N4]);ROW(INDIRECT("C"&[.N4]&":C999"));9999)) -> 16
A6: of:=IF(ISBLANK(['BenchBudEE.csv'.A71]);"";['BenchBudEE.csv'.A71]) -> C21 | B6: of:=IF(ISBLANK(['BenchBudEE.csv'.B71]);"";['BenchBudEE.csv'.B71]) -> .01u | C6: of:=IF(ISBLANK(['BenchBudEE.csv'.C71]);"";['BenchBudEE.csv'.C71]) -> Capacitors_SMD:c_0805 | D6: of:=IF(ISBLANK(['BenchBudEE.csv'.D71]);"";['BenchBudEE.csv'.D71]) ->  | E6: of:=IF(ISBLANK(['BenchBudEE.csv'.E71]);"";['BenchBudEE.csv'.E71]) ->  | F6: of:=IF(ISBLANK(['BenchBudEE.csv'.F71]);"";['BenchBudEE.csv'.F71]) ->  | G6: of:=IF(ISNUMBER(SEARCH("[0-9]";[.A6]));MID([.A6];1;SEARCH("[0-9]";[.A6])-1);"") -> C | I6: of:=IF(ISNUMBER(SEARCH("[0-9]";[.J6]));MID([.J6];1;SEARCH("[0-9]";[.J6])-1);"") -> C | J6: of:=INDIRECT("A"&[.N5]) -> C13 | K6: of:=INDIRECT("B"&[.N5]) -> 10u | L6: of:=INDIRECT("C"&[.N5]) -> Capacitors_SMD:c_1206 | M6: of:=[.N6]-[.N5] -> 3 | N6: of:=MIN(IF(INDIRECT("B"&[.N5]&":B999")<>INDIRECT("B"&[.N5]);ROW(INDIRECT("B"&[.N5]&":B999"));9999);IF(INDIRECT("C"&[.N5]&":C999")<>INDIRECT("C"&[.N5]);ROW(INDIRECT("C"&[.N5]&":C999"));9999)) -> 19
A7: of:=IF(ISBLANK(['BenchBudEE.csv'.A114]);"";['BenchBudEE.csv'.A114]) -> C7 | B7: of:=IF(ISBLANK(['BenchBudEE.csv'.B114]);"";['BenchBudEE.csv'.B114]) -> 100p | C7: of:=IF(ISBLANK(['BenchBudEE.csv'.C114]);"";['BenchBudEE.csv'.C114]) -> Capacitors_SMD:c_0805 | D7: of:=IF(ISBLANK(['BenchBudEE.csv'.D114]);"";['BenchBudEE.csv'.D114]) ->  | E7: of:=IF(ISBLANK(['BenchBudEE.csv'.E114]);"";['BenchBudEE.csv'.E114]) ->  | F7: of:=IF(ISBLANK(['BenchBudEE.csv'.F114]);"";['BenchBudEE.csv'.F114]) ->  | G7: of:=IF(ISNUMBER(SEARCH("[0-9]";[.A7]));MID([.A7];1;SEARCH("[0-9]";[.A7])-1);"") -> C | I7: of:=IF(ISNUMBER(SEARCH("[0-9]";[.J7]));MID([.J7];1;SEARCH("[0-9]";[.J7])-1);"") -> C | J7: of:=INDIRECT("A"&[.N6]) -> C26 | K7: of:=INDIRECT("B"&[.N6]) -> 10u | L7: Capacitors_SMD:c_1206 | M7: of:=[.N7]-[.N6] -> 4 | N7: of:=MIN(IF(INDIRECT("B"&[.N6]&":B999")<>INDIRECT("B"&[.N6]);ROW(INDIRECT("B"&[.N6]&":B999"));9999);IF(INDIRECT("C"&[.N6]&":C999")<>INDIRECT("C"&[.N6]);ROW(INDIRECT("C"&[.N6]&":C999"));9999)) -> 23
A8: of:=IF(ISBLANK(['BenchBudEE.csv'.A64]);"";['BenchBudEE.csv'.A64]) -> C14 | B8: of:=IF(ISBLANK(['BenchBudEE.csv'.B64]);"";['BenchBudEE.csv'.B64]) -> 10u | C8: of:=IF(ISBLANK(['BenchBudEE.csv'.C64]);"";['BenchBudEE.csv'.C64]) -> Capacitors_SMD:c_0805 | D8: of:=IF(ISBLANK(['BenchBudEE.csv'.D64]);"";['BenchBudEE.csv'.D64]) ->  | E8: of:=IF(ISBLANK(['BenchBudEE.csv'.E64]);"";['BenchBudEE.csv'.E64]) ->  | F8: of:=IF(ISBLANK(['BenchBudEE.csv'.F64]);"";['BenchBudEE.csv'.F64]) ->  | G8: of:=IF(ISNUMBER(SEARCH("[0-9]";[.A8]));MID([.A8];1;SEARCH("[0-9]";[.A8])-1);"") -> C | I8: of:=IF(ISNUMBER(SEARCH("[0-9]";[.J8]));MID([.J8];1;SEARCH("[0-9]";[.J8])-1);"") -> C | J8: of:=INDIRECT("A"&[.N7]) -> C1 | K8: of:=INDIRECT("B"&[.N7]) -> 1u | L8: of:=INDIRECT("C"&[.N7]) -> Capacitors_SMD:c_0805 | M8: of:=[.N8]-[.N7] -> 10 | N8: of:=MIN(IF(INDIRECT("B"&[.N7]&":B999")<>INDIRECT("B"&[.N7]);ROW(INDIRECT("B"&[.N7]&":B999"));9999);IF(INDIRECT("C"&[.N7]&":C999")<>INDIRECT("C"&[.N7]);ROW(INDIRECT("C"&[.N7]&":C999"));9999)) -> 33
A9: of:=IF(ISBLANK(['BenchBudEE.csv'.A63]);"";['BenchBudEE.csv'.A63]) -> C15 | B9: of:=IF(ISBLANK(['BenchBudEE.csv'.B63]);"";['BenchBudEE.csv'.B63]) -> 10u | C9: of:=IF(ISBLANK(['BenchBudEE.csv'.C63]);"";['BenchBudEE.csv'.C63]) -> Capacitors_SMD:c_0805 | D9: of:=IF(ISBLANK(['BenchBudEE.csv'.D63]);"";['BenchBudEE.csv'.D63]) ->  | E9: of:=IF(ISBLANK(['BenchBudEE.csv'.E63]);"";['BenchBudEE.csv'.E63]) ->  | F9: of:=IF(ISBLANK(['BenchBudEE.csv'.F63]);"";['BenchBudEE.csv'.F63]) ->  | G9: of:=IF(ISNUMBER(SEARCH("[0-9]";[.A9]));MID([.A9];1;SEARCH("[0-9]";[.A9])-1);"") -> C | I9: of:=IF(ISNUMBER(SEARCH("[0-9]";[.J9]));MID([.J9];1;SEARCH("[0-9]";[.J9])-1);"") -> C | J9: of:=INDIRECT("A"&[.N8]) -> C30 | K9: of:=INDIRECT("B"&[.N8]) -> NOPOP | L9: of:=INDIRECT("C"&[.N8]) -> Capacitors_SMD:c_0805 | M9: of:=[.N9]-[.N8] -> 3 | N9: of:=MIN(IF(INDIRECT("B"&[.N8]&":B999")<>INDIRECT("B"&[.N8]);ROW(INDIRECT("B"&[.N8]&":B999"));9999);IF(INDIRECT("C"&[.N8]&":C999")<>INDIRECT("C"&[.N8]);ROW(INDIRECT("C"&[.N8]&":C999"));9999)) -> 36
A10: of:=IF(ISBLANK(['BenchBudEE.csv'.A65]);"";['BenchBudEE.csv'.A65]) -> C16 | B10: of:=IF(ISBLANK(['BenchBudEE.csv'.B65]);"";['BenchBudEE.csv'.B65]) -> 10u | C10: of:=IF(ISBLANK(['BenchBudEE.csv'.C65]);"";['BenchBudEE.csv'.C65]) -> Capacitors_SMD:c_0805 | D10: of:=IF(ISBLANK(['BenchBudEE.csv'.D65]);"";['BenchBudEE.csv'.D65]) ->  | E10: of:=IF(ISBLANK(['BenchBudEE.csv'.E65]);"";['BenchBudEE.csv'.E65]) ->  | F10: of:=IF(ISBLANK(['BenchBudEE.csv'.F65]);"";['BenchBudEE.csv'.F65]) ->  | G10: of:=IF(ISNUMBER(SEARCH("[0-9]";[.A10]));MID([.A10];1;SEARCH("[0-9]";[.A10])-1);"") -> C | I10: of:=IF(ISNUMBER(SEARCH("[0-9]";[.J10]));MID([.J10];1;SEARCH("[0-9]";[.J10])-1);"") -> D | J10: of:=INDIRECT("A"&[.N9]) -> D3 | K10: of:=INDIRECT("B"&[.N9]) -> B0540WS-7 | L10: of:=INDIRECT("C"&[.N9]) -> BenchBudEE:SOD-323 | M10: of:=[.N10]-[.N9] -> 1 | N10: of:=MIN(IF(INDIRECT("B"&[.N9]&":B999")<>INDIRECT("B"&[.N9]);ROW(INDIRECT("B"&[.N9]&":B999"));9999);IF(INDIRECT("C"&[.N9]&":C999")<>INDIRECT("C"&[.N9]);ROW(INDIRECT("C"&[.N9]&":C999"));9999)) -> 37
A11: of:=IF(ISBLANK(['BenchBudEE.csv'.A62]);"";['BenchBudEE.csv'.A62]) -> C17 | B11: of:=IF(ISBLANK(['BenchBudEE.csv'.B62]);"";['BenchBudEE.csv'.B62]) -> 10u | C11: of:=IF(ISBLANK(['BenchBudEE.csv'.C62]);"";['BenchBudEE.csv'.C62]) -> Capacitors_SMD:c_0805 | D11: of:=IF(ISBLANK(['BenchBudEE.csv'.D62]);"";['BenchBudEE.csv'.D62]) ->  | E11: of:=IF(ISBLANK(['BenchBudEE.csv'.E62]);"";['BenchBudEE.csv'.E62]) ->  | F11: of:=IF(ISBLANK(['BenchBudEE.csv'.F62]);"";['BenchBudEE.csv'.F62]) ->  | G11: of:=IF(ISNUMBER(SEARCH("[0-9]";[.A11]));MID([.A11];1;SEARCH("[0-9]";[.A11])-1);"") -> C | I11: of:=IF(ISNUMBER(SEARCH("[0-9]";[.J11]));MID([.J11];1;SEARCH("[0-9]";[.J11])-1);"") -> D | J11: of:=INDIRECT("A"&[.N10]) -> D1 | K11: of:=INDIRECT("B"&[.N10]) -> KP-1608CGCK | L11: of:=INDIRECT("C"&[.N10]) -> LEDs:LED-0603 | M11: of:=[.N11]-[.N10] -> 1 | N11: of:=MIN(IF(INDIRECT("B"&[.N10]&":B999")<>INDIRECT("B"&[.N10]);ROW(INDIRECT("B"&[.N10]&":B999"));9999);IF(INDIRECT("C"&[.N10]&":C999")<>INDIRECT("C"&[.N10]);ROW(INDIRECT("C"&[.N10]&":C999"));9999)) -> 38
A12: of:=IF(ISBLANK(['BenchBudEE.csv'.A73]);"";['BenchBudEE.csv'.A73]) -> C22 | B12: of:=IF(ISBLANK(['BenchBudEE.csv'.B73]);"";['BenchBudEE.csv'.B73]) -> 10u | C12: of:=IF(ISBLANK(['BenchBudEE.csv'.C73]);"";['BenchBudEE.csv'.C73]) -> Capacitors_SMD:c_0805 | D12: of:=IF(ISBLANK(['BenchBudEE.csv'.D73]);"";['BenchBudEE.csv'.D73]) ->  | E12: of:=IF(ISBLANK(['BenchBudEE.csv'.E73]);"";['BenchBudEE.csv'.E73]) ->  | F12: of:=IF(ISBLANK(['BenchBudEE.csv'.F73]);"";['BenchBudEE.csv'.F73]) ->  | G12: of:=IF(ISNUMBER(SEARCH("[0-9]";[.A12]));MID([.A12];1;SEARCH("[0-9]";[.A12])-1);"") -> C | I12: of:=IF(ISNUMBER(SEARCH("[0-9]";[.J12]));MID([.J12];1;SEARCH("[0-9]";[.J12])-1);"") -> D | J12: of:=INDIRECT("A"&[.N11]) -> D10 | K12: of:=INDIRECT("B"&[.N11]) -> MMBD914-7-F | L12: of:=INDIRECT("C"&[.N11]) -> BenchBudEE:SOT23-DIODE | M12: of:=[.N12]-[.N11] -> 8 | N12: of:=MIN(IF(INDIRECT("B"&[.N11]&":B999")<>INDIRECT("B"&[.N11]);ROW(INDIRECT("B"&[.N11]&":B999"));9999);IF(INDIRECT("C"&[.N11]&":C999")<>INDIRECT("C"&[.N11]);ROW(INDIRECT("C"&[.N11]&":C999"));9999)) -> 46
A13: of:=IF(ISBLANK(['BenchBudEE.csv'.A74]);"";['BenchBudEE.csv'.A74]) -> C23 | B13: of:=IF(ISBLANK(['BenchBudEE.csv'.B74]);"";['BenchBudEE.csv'.B74]) -> 10u | C13: of:=IF(ISBLANK(['BenchBudEE.csv'.C74]);"";['BenchBudEE.csv'.C74]) -> Capacitors_SMD:c_0805 | D13: of:=IF(ISBLANK(['BenchBudEE.csv'.D74]);"";['BenchBudEE.csv'.D74]) ->  | E13: of:=IF(ISBLANK(['BenchBudEE.csv'.E74]);"";['BenchBudEE.csv'.E74]) ->  | F13: of:=IF(ISBLANK(['BenchBudEE.csv'.F74]);"";['BenchBudEE.csv'.F74]) ->  | G13: of:=IF(ISNUMBER(SEARCH("[0-9]";[.A13]));MID([.A13];1;SEARCH("[0-9]";[.A13])-1);"") -> C | I13: of:=IF(ISNUMBER(SEARCH("[0-9]";[.J13]));MID([.J13];1;SEARCH("[0-9]";[.J13])-1);"") -> D | J13: of:=INDIRECT("A"&[.N12]) -> D2 | K13: of:=INDIRECT("B"&[.N12]) -> S1M-13-F | L13: of:=INDIRECT("C"&[.N12]) -> Diodes_SMD:Diode-SMA_Standard | M13: of:=[.N13]-[.N12] -> 2 | N13: of:=MIN(IF(INDIRECT("B"&[.N12]&":B999")<>INDIRECT("B"&[.N12]);ROW(INDIRECT("B"&[.N12]&":B999"));9999);IF(INDIRECT("C"&[.N12]&":C999")<>INDIRECT("C"&[.N12]);ROW(INDIRECT("C"&[.N12]&":C999"));9999)) -> 48
A14: of:=IF(ISBLANK(['BenchBudEE.csv'.A68]);"";['BenchBudEE.csv'.A68]) -> C24 | B14: of:=IF(ISBLANK(['BenchBudEE.csv'.B68]);"";['BenchBudEE.csv'.B68]) -> 10u | C14: of:=IF(ISBLANK(['BenchBudEE.csv'.C68]);"";['BenchBudEE.csv'.C68]) -> Capacitors_SMD:c_0805 | D14: of:=IF(ISBLANK(['BenchBudEE.csv'.D68]);"";['BenchBudEE.csv'.D68]) ->  | E14: of:=IF(ISBLANK(['BenchBudEE.csv'.E68]);"";['BenchBudEE.csv'.E68]) ->  | F14: of:=IF(ISBLANK(['BenchBudEE.csv'.F68]);"";['BenchBudEE.csv'.F68]) ->  | G14: of:=IF(ISNUMBER(SEARCH("[0-9]";[.A14]));MID([.A14];1;SEARCH("[0-9]";[.A14])-1);"") -> C | I14: of:=IF(ISNUMBER(SEARCH("[0-9]";[.J14]));MID([.J14];1;SEARCH("[0-9]";[.J14])-1);"") -> JP | J14: of:=INDIRECT("A"&[.N13]) -> JP1 | K14: of:=INDIRECT("B"&[.N13]) -> JUMPER | L14: of:=INDIRECT("C"&[.N13]) -> BenchBudEE:GND_POINT | M14: of:=[.N14]-[.N13] -> 4 | N14: of:=MIN(IF(INDIRECT("B"&[.N13]&":B999")<>INDIRECT("B"&[.N13]);ROW(INDIRECT("B"&[.N13]&":B999"));9999);IF(INDIRECT("C"&[.N13]&":C999")<>INDIRECT("C"&[.N13]);ROW(INDIRECT("C"&[.N13]&":C999"));9999)) -> 52
A15: of:=IF(ISBLANK(['BenchBudEE.csv'.A69]);"";['BenchBudEE.csv'.A69]) -> C25 | B15: of:=IF(ISBLANK(['BenchBudEE.csv'.B69]);"";['BenchBudEE.csv'.B69]) -> 10u | C15: of:=IF(ISBLANK(['BenchBudEE.csv'.C69]);"";['BenchBudEE.csv'.C69]) -> Capacitors_SMD:c_0805 | D15: of:=IF(ISBLANK(['BenchBudEE.csv'.D69]);"";['BenchBudEE.csv'.D69]) ->  | E15: of:=IF(ISBLANK(['BenchBudEE.csv'.E69]);"";['BenchBudEE.csv'.E69]) ->  | F15: of:=IF(ISBLANK(['BenchBudEE.csv'.F69]);"";['BenchBudEE.csv'.F69]) ->  | G15: of:=IF(ISNUMBER(SEARCH("[0-9]";[.A15]));MID([.A15];1;SEARCH("[0-9]";[.A15])-1);"") -> C | I15: of:=IF(ISNUMBER(SEARCH("[0-9]";[.J15]));MID([.J15];1;SEARCH("[0-9]";[.J15])-1);"") -> K | J15: of:=INDIRECT("A"&[.N14]) -> K1 | K15: of:=INDIRECT("B"&[.N14]) -> G5LA-1 12DC | L15: of:=INDIRECT("C"&[.N14]) -> BenchBudEE:TE-SPDT | M15: of:=[.N15]-[.N14] -> 1 | N15: of:=MIN(IF(INDIRECT("B"&[.N14]&":B999")<>INDIRECT("B"&[.N14]);ROW(INDIRECT("B"&[.N14]&":B999"));9999);IF(INDIRECT("C"&[.N14]&":C999")<>INDIRECT("C"&[.N14]);ROW(INDIRECT("C"&[.N14]&":C999"));9999)) -> 53
A16: of:=IF(ISBLANK(['BenchBudEE.csv'.A32]);"";['BenchBudEE.csv'.A32]) -> C13 | B16: of:=IF(ISBLANK(['BenchBudEE.csv'.B32]);"";['BenchBudEE.csv'.B32]) -> 10u | C16: of:=IF(ISBLANK(['BenchBudEE.csv'.C32]);"";['BenchBudEE.csv'.C32]) -> Capacitors_SMD:c_1206 | D16: of:=IF(ISBLANK(['BenchBudEE.csv'.D32]);"";['BenchBudEE.csv'.D32]) ->  | E16: of:=IF(ISBLANK(['BenchBudEE.csv'.E32]);"";['BenchBudEE.csv'.E32]) ->  | F16: of:=IF(ISBLANK(['BenchBudEE.csv'.F32]);"";['BenchBudEE.csv'.F32]) ->  | G16: of:=IF(ISNUMBER(SEARCH("[0-9]";[.A16]));MID([.A16];1;SEARCH("[0-9]";[.A16])-1);"") -> C | I16: of:=IF(ISNUMBER(SEARCH("[0-9]";[.J16]));MID([.J16];1;SEARCH("[0-9]";[.J16])-1);"") -> K | J16: of:=INDIRECT("A"&[.N15]) -> K2 | K16: of:=INDIRECT("B"&[.N15]) -> SPC20484 | L16: of:=INDIRECT("C"&[.N15]) -> Pin_Headers:Pin_Header_Straight_1x03 | M16: of:=[.N16]-[.N15] -> 2 | N16: of:=MIN(IF(INDIRECT("B"&[.N15]&":B999")<>INDIRECT("B"&[.N15]);ROW(INDIRECT("B"&[.N15]&":B999"));9999);IF(INDIRECT("C"&[.N15]&":C999")<>INDIRECT("C"&[.N15]);ROW(INDIRECT("C"&[.N15]&":C999"));9999)) -> 55
A17: of:=IF(ISBLANK(['BenchBudEE.csv'.A26]);"";['BenchBudEE.csv'.A26]) -> C3 | B17: of:=IF(ISBLANK(['BenchBudEE.csv'.B26]);"";['BenchBudEE.csv'.B26]) -> 10u | C17: of:=IF(ISBLANK(['BenchBudEE.csv'.C26]);"";['BenchBudEE.csv'.C26]) -> Capacitors_SMD:c_1206 | D17: of:=IF(ISBLANK(['BenchBudEE.csv'.D26]);"";['BenchBudEE.csv'.D26]) ->  | E17: of:=IF(ISBLANK(['BenchBudEE.csv'.E26]);"";['BenchBudEE.csv'.E26]) ->  | F17: of:=IF(ISBLANK(['BenchBudEE.csv'.F26]);"";['BenchBudEE.csv'.F26]) ->  | G17: of:=IF(ISNUMBER(SEARCH("[0-9]";[.A17]));MID([.A17];1;SEARCH("[0-9]";[.A17])-1);"") -> C | I17: of:=IF(ISNUMBER(SEARCH("[0-9]";[.J17]));MID([.J17];1;SEARCH("[0-9]";[.J17])-1);"") -> L | J17: of:=INDIRECT("A"&[.N16]) -> L5 | K17: of:=INDIRECT("B"&[.N16]) -> 1u | L17: of:=INDIRECT("C"&[.N16]) -> SMD_Packages:SM0805 | M17: of:=[.N17]-[.N16] -> 1 | N17: of:=MIN(IF(INDIRECT("B"&[.N16]&":B999")<>INDIRECT("B"&[.N16]);ROW(INDIRECT("B"&[.N16]&":B999"));9999);IF(INDIRECT("C"&[.N16]&":C999")<>INDIRECT("C"&[.N16]);ROW(INDIRECT("C"&[.N16]&":C999"));9999)) -> 56
A18: of:=IF(ISBLANK(['BenchBudEE.csv'.A25]);"";['BenchBudEE.csv'.A25]) -> C4 | B18: of:=IF(ISBLANK(['BenchBudEE.csv'.B25]);"";['BenchBudEE.csv'.B25]) -> 10u | C18: of:=IF(ISBLANK(['BenchBudEE.csv'.C25]);"";['BenchBudEE.csv'.C25]) -> Capacitors_SMD:c_1206 | D18: of:=IF(ISBLANK(['BenchBudEE.csv'.D25]);"";['BenchBudEE.csv'.D25]) ->  | E18: of:=IF(ISBLANK(['BenchBudEE.csv'.E25]);"";['BenchBudEE.csv'.E25]) ->  | F18: of:=IF(ISBLANK(['BenchBudEE.csv'.F25]);"";['BenchBudEE.csv'.F25]) ->  | G18: of:=IF(ISNUMBER(SEARCH("[0-9]";[.A18]));MID([.A18];1;SEARCH("[0-9]";[.A18])-1);"") -> C | I18: of:=IF(ISNUMBER(SEARCH("[0-9]";[.J18]));MID([.J18];1;SEARCH("[0-9]";[.J18])-1);"") -> L | J18: of:=INDIRECT("A"&[.N17]) -> L1 | K18: of:=INDIRECT("B"&[.N17]) -> 22u | L18: of:=INDIRECT("C"&[.N17]) -> BenchBudEE:NR4012 | M18: of:=[.N18]-[.N17] -> 1 | N18: of:=MIN(IF(INDIRECT("B"&[.N17]&":B999")<>INDIRECT("B"&[.N17]);ROW(INDIRECT("B"&[.N17]&":B999"));9999);IF(INDIRECT("C"&[.N17]&":C999")<>INDIRECT("C"&[.N17]);ROW(INDIRECT("C"&[.N17]&":C999"));9999)) -> 57
A19: of:=IF(ISBLANK(['BenchBudEE.csv'.A42]);"";['BenchBudEE.csv'.A42]) -> C26 | B19: of:=IF(ISBLANK(['BenchBudEE.csv'.B42]);"";['BenchBudEE.csv'.B42]) -> 10u | C19: of:=IF(ISBLANK(['BenchBudEE.csv'.C42]);"";['BenchBudEE.csv'.C42]) -> Capacitors_SMD:c_1210 | D19: of:=IF(ISBLANK(['BenchBudEE.csv'.D42]);"";['BenchBudEE.csv'.D42]) ->  | E19: of:=IF(ISBLANK(['BenchBudEE.csv'.E42]);"";['BenchBudEE.csv'.E42]) ->  | F19: of:=IF(ISBLANK(['BenchBudEE.csv'.F42]);"";['BenchBudEE.csv'.F42]) ->  | G19: of:=IF(ISNUMBER(SEARCH("[0-9]";[.A19]));MID([.A19];1;SEARCH("[0-9]";[.A19])-1);"") -> C | I19: of:=IF(ISNUMBER(SEARCH("[0-9]";[.J19]));MID([.J19];1;SEARCH("[0-9]";[.J19])-1);"") -> L | J19: of:=INDIRECT("A"&[.N18]) -> L2 | K19: of:=INDIRECT("B"&[.N18]) -> CM322522-220KL | L19: of:=INDIRECT("C"&[.N18]) -> SMD_Packages:SM1210L | M19: of:=[.N19]-[.N18] -> 3 | N19: of:=MIN(IF(INDIRECT("B"&[.N18]&":B999")<>INDIRECT("B"&[.N18]);ROW(INDIRECT("B"&[.N18]&":B999"));9999);IF(INDIRECT("C"&[.N18]&":C999")<>INDIRECT("C"&[.N18]);ROW(INDIRECT("C"&[.N18]&":C999"));9999)) -> 60
A20: of:=IF(ISBLANK(['BenchBudEE.csv'.A43]);"";['BenchBudEE.csv'.A43]) -> C27 | B20: of:=IF(ISBLANK(['BenchBudEE.csv'.B43]);"";['BenchBudEE.csv'.B43]) -> 10u | C20: of:=IF(ISBLANK(['BenchBudEE.csv'.C43]);"";['BenchBudEE.csv'.C43]) -> Capacitors_SMD:c_1210 | D20: of:=IF(ISBLANK(['BenchBudEE.csv'.D43]);"";['BenchBudEE.csv'.D43]) ->  | E20: of:=IF(ISBLANK(['BenchBudEE.csv'.E43]);"";['BenchBudEE.csv'.E43]) ->  | F20: of:=IF(ISBLANK(['BenchBudEE.csv'.F43]);"";['BenchBudEE.csv'.F43]) ->  | G20: of:=IF(ISNUMBER(SEARCH("[0-9]";[.A20]));MID([.A20];1;SEARCH("[0-9]";[.A20])-1);"") -> C | I20: of:=IF(ISNUMBER(SEARCH("[0-9]";[.J20]));MID([.J20];1;SEARCH("[0-9]";[.J20])-1);"") -> P | J20: of:=INDIRECT("A"&[.N19]) -> P5 | K20: of:=INDIRECT("B"&[.N19]) -> 20.501M/3 | L20: of:=INDIRECT("C"&[.N19]) -> BenchBudEE:3pinTB | M20: of:=[.N20]-[.N19] -> 1 | N20: of:=MIN(IF(INDIRECT("B"&[.N19]&":B999")<>INDIRECT("B"&[.N19]);ROW(INDIRECT("B"&[.N19]&":B999"));9999);IF(INDIRECT("C"&[.N19]&":C999")<>INDIRECT("C"&[.N19]);ROW(INDIRECT("C"&[.N19]&":C999"));9999)) -> 61
A21: of:=IF(ISBLANK(['BenchBudEE.csv'.A44]);"";['BenchBudEE.csv'.A44]) -> C28 | B21: of:=IF(ISBLANK(['BenchBudEE.csv'.B44]);"";['BenchBudEE.csv'.B44]) -> 10u | C21: of:=IF(ISBLANK(['BenchBudEE.csv'.C44]);"";['BenchBudEE.csv'.C44]) -> Capacitors_SMD:c_1210 | D21: of:=IF(ISBLANK(['BenchBudEE.csv'.D44]);"";['BenchBudEE.csv'.D44]) ->  | E21: of:=IF(ISBLANK(['BenchBudEE.csv'.E44]);"";['BenchBudEE.csv'.E44]) ->  | F21: of:=IF(ISBLANK(['BenchBudEE.csv'.F44]);"";['BenchBudEE.csv'.F44]) ->  | G21: of:=IF(ISNUMBER(SEARCH("[0-9]";[.A21]));MID([.A21];1;SEARCH("[0-9]";[.A21])-1);"") -> C | I21: of:=IF(ISNUMBER(SEARCH("[0-9]";[.J21]));MID([.J21];1;SEARCH("[0-9]";[.J21])-1);"") -> P | J21: of:=INDIRECT("A"&[.N20]) -> P1 | K21: of:=INDIRECT("B"&[.N20]) -> 39-30-1240 | L21: of:=INDIRECT("C"&[.N20]) -> BenchBudEE:ATX_Header | M21: of:=[.N21]-[.N20] -> 1 | N21: of:=MIN(IF(INDIRECT("B"&[.N20]&":B999")<>INDIRECT("B"&[.N20]);ROW(INDIRECT("B"&[.N20]&":B999"));9999);IF(INDIRECT("C"&[.N20]&":C999")<>INDIRECT("C"&[.N20]);ROW(INDIRECT("C"&[.N20]&":C999"));9999)) -> 62
A22: of:=IF(ISBLANK(['BenchBudEE.csv'.A45]);"";['BenchBudEE.csv'.A45]) -> C29 | B22: of:=IF(ISBLANK(['BenchBudEE.csv'.B45]);"";['BenchBudEE.csv'.B45]) -> 10u | C22: of:=IF(ISBLANK(['BenchBudEE.csv'.C45]);"";['BenchBudEE.csv'.C45]) -> Capacitors_SMD:c_1210 | D22: of:=IF(ISBLANK(['BenchBudEE.csv'.D45]);"";['BenchBudEE.csv'.D45]) ->  | E22: of:=IF(ISBLANK(['BenchBudEE.csv'.E45]);"";['BenchBudEE.csv'.E45]) ->  | F22: of:=IF(ISBLANK(['BenchBudEE.csv'.F45]);"";['BenchBudEE.csv'.F45]) ->  | G22: of:=IF(ISNUMBER(SEARCH("[0-9]";[.A22]));MID([.A22];1;SEARCH("[0-9]";[.A22])-1);"") -> C | I22: of:=IF(ISNUMBER(SEARCH("[0-9]";[.J22]));MID([.J22];1;SEARCH("[0-9]";[.J22])-1);"") -> P | J22: of:=INDIRECT("A"&[.N21]) -> P4 | K22: of:=INDIRECT("B"&[.N21]) -> CTB0355/12 | L22: of:=INDIRECT("C"&[.N21]) -> BenchBudEE:12pinTB | M22: of:=[.N22]-[.N21] -> 1 | N22: of:=MIN(IF(INDIRECT("B"&[.N21]&":B999")<>INDIRECT("B"&[.N21]);ROW(INDIRECT("B"&[.N21]&":B999"));9999);IF(INDIRECT("C"&[.N21]&":C999")<>INDIRECT("C"&[.N21]);ROW(INDIRECT("C"&[.N21]&":C999"));9999)) -> 63
A23: of:=IF(ISBLANK(['BenchBudEE.csv'.A16]);"";['BenchBudEE.csv'.A16]) -> C1 | B23: of:=IF(ISBLANK(['BenchBudEE.csv'.B16]);"";['BenchBudEE.csv'.B16]) -> 1u | C23: of:=IF(ISBLANK(['BenchBudEE.csv'.C16]);"";['BenchBudEE.csv'.C16]) -> Capacitors_SMD:c_0805 | D23: of:=IF(ISBLANK(['BenchBudEE.csv'.D16]);"";['BenchBudEE.csv'.D16]) ->  | E23: of:=IF(ISBLANK(['BenchBudEE.csv'.E16]);"";['BenchBudEE.csv'.E16]) ->  | F23: of:=IF(ISBLANK(['BenchBudEE.csv'.F16]);"";['BenchBudEE.csv'.F16]) ->  | G23: of:=IF(ISNUMBER(SEARCH("[0-9]";[.A23]));MID([.A23];1;SEARCH("[0-9]";[.A23])-1);"") -> C | I23: of:=IF(ISNUMBER(SEARCH("[0-9]";[.J23]));MID([.J23];1;SEARCH("[0-9]";[.J23])-1);"") -> P | J23: of:=INDIRECT("A"&[.N22]) -> P6 | K23: of:=INDIRECT("B"&[.N22]) -> MC33282 | L23: of:=INDIRECT("C"&[.N22]) -> BenchBudEE:V8508H | M23: of:=[.N23]-[.N22] -> 2 | N23: of:=MIN(IF(INDIRECT("B"&[.N22]&":B999")<>INDIRECT("B"&[.N22]);ROW(INDIRECT("B"&[.N22]&":B999"));9999);IF(INDIRECT("C"&[.N22]&":C999")<>INDIRECT("C"&[.N22]);ROW(INDIRECT("C"&[.N22]&":C999"));9999)) -> 65
A24: of:=IF(ISBLANK(['BenchBudEE.csv'.A120]);"";['BenchBudEE.csv'.A120]) -> C10 | B24: of:=IF(ISBLANK(['BenchBudEE.csv'.B120]);"";['BenchBudEE.csv'.B120]) -> 1u | C24: of:=IF(ISBLANK(['BenchBudEE.csv'.C120]);"";['BenchBudEE.csv'.C120]) -> Capacitors_SMD:c_0805 | D24: of:=IF(ISBLANK(['BenchBudEE.csv'.D120]);"";['BenchBudEE.csv'.D120]) ->  | E24: of:=IF(ISBLANK(['BenchBudEE.csv'.E120]);"";['BenchBudEE.csv'.E120]) ->  | F24: of:=IF(ISBLANK(['BenchBudEE.csv'.F120]);"";['BenchBudEE.csv'.F120]) ->  | G24: of:=IF(ISNUMBER(SEARCH("[0-9]";[.A24]));MID([.A24];1;SEARCH("[0-9]";[.A24])-1);"") -> C | I24: of:=IF(ISNUMBER(SEARCH("[0-9]";[.J24]));MID([.J24];1;SEARCH("[0-9]";[.J24])-1);"") -> P | J24: of:=INDIRECT("A"&[.N23]) -> P3 | K24: of:=INDIRECT("B"&[.N23]) -> SPC20484 | L24: of:=INDIRECT("C"&[.N23]) -> Pin_Headers:Pin_Header_Straight_2x03 | M24: of:=[.N24]-[.N23] -> 1 | N24: of:=MIN(IF(INDIRECT("B"&[.N23]&":B999")<>INDIRECT("B"&[.N23]);ROW(INDIRECT("B"&[.N23]&":B999"));9999);IF(INDIRECT("C"&[.N23]&":C999")<>INDIRECT("C"&[.N23]);ROW(INDIRECT("C"&[.N23]&":C999"));9999)) -> 66
A25: of:=IF(ISBLANK(['BenchBudEE.csv'.A96]);"";['BenchBudEE.csv'.A96]) -> C11 | B25: of:=IF(ISBLANK(['BenchBudEE.csv'.B96]);"";['BenchBudEE.csv'.B96]) -> 1u | C25: of:=IF(ISBLANK(['BenchBudEE.csv'.C96]);"";['BenchBudEE.csv'.C96]) -> Capacitors_SMD:c_0805 | D25: of:=IF(ISBLANK(['BenchBudEE.csv'.D96]);"";['BenchBudEE.csv'.D96]) ->  | E25: of:=IF(ISBLANK(['BenchBudEE.csv'.E96]);"";['BenchBudEE.csv'.E96]) ->  | F25: of:=IF(ISBLANK(['BenchBudEE.csv'.F96]);"";['BenchBudEE.csv'.F96]) ->  | G25: of:=IF(ISNUMBER(SEARCH("[0-9]";[.A25]));MID([.A25];1;SEARCH("[0-9]";[.A25])-1);"") -> C | I25: of:=IF(ISNUMBER(SEARCH("[0-9]";[.J25]));MID([.J25];1;SEARCH("[0-9]";[.J25])-1);"") -> Q | J25: of:=INDIRECT("A"&[.N24]) -> Q2 | K25: of:=INDIRECT("B"&[.N24]) -> 2N7002 | L25: of:=INDIRECT("C"&[.N24]) -> SMD_Packages:SOT23EBC | M25: of:=[.N25]-[.N24] -> 1 | N25: of:=MIN(IF(INDIRECT("B"&[.N24]&":B999")<>INDIRECT("B"&[.N24]);ROW(INDIRECT("B"&[.N24]&":B999"));9999);IF(INDIRECT("C"&[.N24]&":C999")<>INDIRECT("C"&[.N24]);ROW(INDIRECT("C"&[.N24]&":C999"));9999)) -> 67
A26: of:=IF(ISBLANK(['BenchBudEE.csv'.A97]);"";['BenchBudEE.csv'.A97]) -> C12 | B26: of:=IF(ISBLANK(['BenchBudEE.csv'.B97]);"";['BenchBudEE.csv'.B97]) -> 1u | C26: of:=IF(ISBLANK(['BenchBudEE.csv'.C97]);"";['BenchBudEE.csv'.C97]) -> Capacitors_SMD:c_0805 | D26: of:=IF(ISBLANK(['BenchBudEE.csv'.D97]);"";['BenchBudEE.csv'.D97]) ->  | E26: of:=IF(ISBLANK(['BenchBudEE.csv'.E97]);"";['BenchBudEE.csv'.E97]) ->  | F26: of:=IF(ISBLANK(['BenchBudEE.csv'.F97]);"";['BenchBudEE.csv'.F97]) ->  | G26: of:=IF(ISNUMBER(SEARCH("[0-9]";[.A26]));MID([.A26];1;SEARCH("[0-9]";[.A26])-1);"") -> C | I26: of:=IF(ISNUMBER(SEARCH("[0-9]";[.J26]));MID([.J26];1;SEARCH("[0-9]";[.J26])-1);"") -> Q | J26: of:=INDIRECT("A"&[.N25]) -> Q3 | K26: of:=INDIRECT("B"&[.N25]) -> FDD6630A | L26: of:=INDIRECT("C"&[.N25]) -> SMD_Packages:DPAK2 | M26: of:=[.N26]-[.N25] -> 2 | N26: of:=MIN(IF(INDIRECT("B"&[.N25]&":B999")<>INDIRECT("B"&[.N25]);ROW(INDIRECT("B"&[.N25]&":B999"));9999);IF(INDIRECT("C"&[.N25]&":C999")<>INDIRECT("C"&[.N25]);ROW(INDIRECT("C"&[.N25]&":C999"));9999)) -> 69
A27: of:=IF(ISBLANK(['BenchBudEE.csv'.A17]);"";['BenchBudEE.csv'.A17]) -> C2 | B27: of:=IF(ISBLANK(['BenchBudEE.csv'.B17]);"";['BenchBudEE.csv'.B17]) -> 1u | C27: of:=IF(ISBLANK(['BenchBudEE.csv'.C17]);"";['BenchBudEE.csv'.C17]) -> Capacitors_SMD:c_0805 | D27: of:=IF(ISBLANK(['BenchBudEE.csv'.D17]);"";['BenchBudEE.csv'.D17]) ->  | E27: of:=IF(ISBLANK(['BenchBudEE.csv'.E17]);"";['BenchBudEE.csv'.E17]) ->  | F27: of:=IF(ISBLANK(['BenchBudEE.csv'.F17]);"";['BenchBudEE.csv'.F17]) ->  | G27: of:=IF(ISNUMBER(SEARCH("[0-9]";[.A27]));MID([.A27];1;SEARCH("[0-9]";[.A27])-1);"") -> C | I27: of:=IF(ISNUMBER(SEARCH("[0-9]";[.J27]));MID([.J27];1;SEARCH("[0-9]";[.J27])-1);"") -> Q | J27: of:=INDIRECT("A"&[.N26]) -> Q1 | K27: of:=INDIRECT("B"&[.N26]) -> MMBT3904-7-F | L27: of:=INDIRECT("C"&[.N26]) -> SMD_Packages:SOT23EBC | M27: of:=[.N27]-[.N26] -> 1 | N27: of:=MIN(IF(INDIRECT("B"&[.N26]&":B999")<>INDIRECT("B"&[.N26]);ROW(INDIRECT("B"&[.N26]&":B999"));9999);IF(INDIRECT("C"&[.N26]&":C999")<>INDIRECT("C"&[.N26]);ROW(INDIRECT("C"&[.N26]&":C999"));9999)) -> 70
A28: of:=IF(ISBLANK(['BenchBudEE.csv'.A105]);"";['BenchBudEE.csv'.A105]) -> C33 | B28: of:=IF(ISBLANK(['BenchBudEE.csv'.B105]);"";['BenchBudEE.csv'.B105]) -> 1u | C28: of:=IF(ISBLANK(['BenchBudEE.csv'.C105]);"";['BenchBudEE.csv'.C105]) -> Capacitors_SMD:c_0805 | D28: of:=IF(ISBLANK(['BenchBudEE.csv'.D105]);"";['BenchBudEE.csv'.D105]) ->  | E28: of:=IF(ISBLANK(['BenchBudEE.csv'.E105]);"";['BenchBudEE.csv'.E105]) ->  | F28: of:=IF(ISBLANK(['BenchBudEE.csv'.F105]);"";['BenchBudEE.csv'.F105]) ->  | G28: of:=IF(ISNUMBER(SEARCH("[0-9]";[.A28]));MID([.A28];1;SEARCH("[0-9]";[.A28])-1);"") -> C | I28: of:=IF(ISNUMBER(SEARCH("[0-9]";[.J28]));MID([.J28];1;SEARCH("[0-9]";[.J28])-1);"") -> R | J28: of:=INDIRECT("A"&[.N27]) -> R13 | K28: of:=INDIRECT("B"&[.N27]) -> 0 | L28: of:=INDIRECT("C"&[.N27]) -> BenchBudEE:Resistor_SMD0805_Blob | M28: of:=[.N28]-[.N27] -> 22 | N28: of:=MIN(IF(INDIRECT("B"&[.N27]&":B999")<>INDIRECT("B"&[.N27]);ROW(INDIRECT("B"&[.N27]&":B999"));9999);IF(INDIRECT("C"&[.N27]&":C999")<>INDIRECT("C"&[.N27]);ROW(INDIRECT("C"&[.N27]&":C999"));9999)) -> 92
A29: of:=IF(ISBLANK(['BenchBudEE.csv'.A124]);"";['BenchBudEE.csv'.A124]) -> C5 | B29: of:=IF(ISBLANK(['BenchBudEE.csv'.B124]);"";['BenchBudEE.csv'.B124]) -> 1u | C29: of:=IF(ISBLANK(['BenchBudEE.csv'.C124]);"";['BenchBudEE.csv'.C124]) -> Capacitors_SMD:c_0805 | D29: of:=IF(ISBLANK(['BenchBudEE.csv'.D124]);"";['BenchBudEE.csv'.D124]) ->  | E29: of:=IF(ISBLANK(['BenchBudEE.csv'.E124]);"";['BenchBudEE.csv'.E124]) ->  | F29: of:=IF(ISBLANK(['BenchBudEE.csv'.F124]);"";['BenchBudEE.csv'.F124]) ->  | G29: of:=IF(ISNUMBER(SEARCH("[0-9]";[.A29]));MID([.A29];1;SEARCH("[0-9]";[.A29])-1);"") -> C | I29: of:=IF(ISNUMBER(SEARCH("[0-9]";[.J29]));MID([.J29];1;SEARCH("[0-9]";[.J29])-1);"") -> R | J29: of:=INDIRECT("A"&[.N28]) -> R19 | K29: of:=INDIRECT("B"&[.N28]) -> 0 | L29: of:=INDIRECT("C"&[.N28]) -> SMD_Packages:SM0805 | M29: of:=[.N29]-[.N28] -> 15 | N29: of:=MIN(IF(INDIRECT("B"&[.N28]&":B999")<>INDIRECT("B"&[.N28]);ROW(INDIRECT("B"&[.N28]&":B999"));9999);IF(INDIRECT("C"&[.N28]&":C999")<>INDIRECT("C"&[.N28]);ROW(INDIRECT("C"&[.N28]&":C999"));9999)) -> 107
A30: of:=IF(ISBLANK(['BenchBudEE.csv'.A123]);"";['BenchBudEE.csv'.A123]) -> C6 | B30: of:=IF(ISBLANK(['BenchBudEE.csv'.B123]);"";['BenchBudEE.csv'.B123]) -> 1u | C30: of:=IF(ISBLANK(['BenchBudEE.csv'.C123]);"";['BenchBudEE.csv'.C123]) -> Capacitors_SMD:c_0805 | D30: of:=IF(ISBLANK(['BenchBudEE.csv'.D123]);"";['BenchBudEE.csv'.D123]) ->  | E30: of:=IF(ISBLANK(['BenchBudEE.csv'.E123]);"";['BenchBudEE.csv'.E123]) ->  | F30: of:=IF(ISBLANK(['BenchBudEE.csv'.F123]);"";['BenchBudEE.csv'.F123]) ->  | G30: of:=IF(ISNUMBER(SEARCH("[0-9]";[.A30]));MID([.A30];1;SEARCH("[0-9]";[.A30])-1);"") -> C | I30: of:=IF(ISNUMBER(SEARCH("[0-9]";[.J30]));MID([.J30];1;SEARCH("[0-9]";[.J30])-1);"") -> R | J30: of:=INDIRECT("A"&[.N29]) -> R20 | K30: of:=INDIRECT("B"&[.N29]) -> 1 | L30: of:=INDIRECT("C"&[.N29]) -> SMD_Packages:SM1206 | M30: of:=[.N30]-[.N29] -> 1 | N30: of:=MIN(IF(INDIRECT("B"&[.N29]&":B999")<>INDIRECT("B"&[.N29]);ROW(INDIRECT("B"&[.N29]&":B999"));9999);IF(INDIRECT("C"&[.N29]&":C999")<>INDIRECT("C"&[.N29]);ROW(INDIRECT("C"&[.N29]&":C999"));9999)) -> 108
A31: of:=IF(ISBLANK(['BenchBudEE.csv'.A121]);"";['BenchBudEE.csv'.A121]) -> C8 | B31: of:=IF(ISBLANK(['BenchBudEE.csv'.B121]);"";['BenchBudEE.csv'.B121]) -> 1u | C31: of:=IF(ISBLANK(['BenchBudEE.csv'.C121]);"";['BenchBudEE.csv'.C121]) -> Capacitors_SMD:c_0805 | D31: of:=IF(ISBLANK(['BenchBudEE.csv'.D121]);"";['BenchBudEE.csv'.D121]) ->  | E31: of:=IF(ISBLANK(['BenchBudEE.csv'.E121]);"";['BenchBudEE.csv'.E121]) ->  | F31: of:=IF(ISBLANK(['BenchBudEE.csv'.F121]);"";['BenchBudEE.csv'.F121]) ->  | G31: of:=IF(ISNUMBER(SEARCH("[0-9]";[.A31]));MID([.A31];1;SEARCH("[0-9]";[.A31])-1);"") -> C | I31: of:=IF(ISNUMBER(SEARCH("[0-9]";[.J31]));MID([.J31];1;SEARCH("[0-9]";[.J31])-1);"") -> R | J31: of:=INDIRECT("A"&[.N30]) -> R7 | K31: of:=INDIRECT("B"&[.N30]) -> 4.87 | L31: of:=INDIRECT("C"&[.N30]) -> SMD_Packages:SM0805 | M31: of:=[.N31]-[.N30] -> 1 | N31: of:=MIN(IF(INDIRECT("B"&[.N30]&":B999")<>INDIRECT("B"&[.N30]);ROW(INDIRECT("B"&[.N30]&":B999"));9999);IF(INDIRECT("C"&[.N30]&":C999")<>INDIRECT("C"&[.N30]);ROW(INDIRECT("C"&[.N30]&":C999"));9999)) -> 109
A32: of:=IF(ISBLANK(['BenchBudEE.csv'.A122]);"";['BenchBudEE.csv'.A122]) -> C9 | B32: of:=IF(ISBLANK(['BenchBudEE.csv'.B122]);"";['BenchBudEE.csv'.B122]) -> 1u | C32: of:=IF(ISBLANK(['BenchBudEE.csv'.C122]);"";['BenchBudEE.csv'.C122]) -> Capacitors_SMD:c_0805 | D32: of:=IF(ISBLANK(['BenchBudEE.csv'.D122]);"";['BenchBudEE.csv'.D122]) ->  | E32: of:=IF(ISBLANK(['BenchBudEE.csv'.E122]);"";['BenchBudEE.csv'.E122]) ->  | F32: of:=IF(ISBLANK(['BenchBudEE.csv'.F122]);"";['BenchBudEE.csv'.F122]) ->  | G32: of:=IF(ISNUMBER(SEARCH("[0-9]";[.A32]));MID([.A32];1;SEARCH("[0-9]";[.A32])-1);"") -> C | I32: of:=IF(ISNUMBER(SEARCH("[0-9]";[.J32]));MID([.J32];1;SEARCH("[0-9]";[.J32])-1);"") -> R | J32: of:=INDIRECT("A"&[.N31]) -> R26 | K32: of:=INDIRECT("B"&[.N31]) -> 10 | L32: of:=INDIRECT("C"&[.N31]) -> SMD_Packages:SM0805 | M32: of:=[.N32]-[.N31] -> 1 | N32: of:=MIN(IF(INDIRECT("B"&[.N31]&":B999")<>INDIRECT("B"&[.N31]);ROW(INDIRECT("B"&[.N31]&":B999"));9999);IF(INDIRECT("C"&[.N31]&":C999")<>INDIRECT("C"&[.N31]);ROW(INDIRECT("C"&[.N31]&":C999"));9999)) -> 110
A33: of:=IF(ISBLANK(['BenchBudEE.csv'.A128]);"";['BenchBudEE.csv'.A128]) -> C30 | B33: of:=IF(ISBLANK(['BenchBudEE.csv'.B128]);"";['BenchBudEE.csv'.B128]) -> NOPOP | C33: of:=IF(ISBLANK(['BenchBudEE.csv'.C128]);"";['BenchBudEE.csv'.C128]) -> Capacitors_SMD:c_0805 | D33: of:=IF(ISBLANK(['BenchBudEE.csv'.D128]);"";['BenchBudEE.csv'.D128]) ->  | E33: of:=IF(ISBLANK(['BenchBudEE.csv'.E128]);"";['BenchBudEE.csv'.E128]) ->  | F33: of:=IF(ISBLANK(['BenchBudEE.csv'.F128]);"";['BenchBudEE.csv'.F128]) ->  | G33: of:=IF(ISNUMBER(SEARCH("[0-9]";[.A33]));MID([.A33];1;SEARCH("[0-9]";[.A33])-1);"") -> C | I33: of:=IF(ISNUMBER(SEARCH("[0-9]";[.J33]));MID([.J33];1;SEARCH("[0-9]";[.J33])-1);"") -> R | J33: of:=INDIRECT("A"&[.N32]) -> R3 | K33: of:=INDIRECT("B"&[.N32]) -> 100 | L33: of:=INDIRECT("C"&[.N32]) -> SMD_Packages:SM0805 | M33: of:=[.N33]-[.N32] -> 2 | N33: of:=MIN(IF(INDIRECT("B"&[.N32]&":B999")<>INDIRECT("B"&[.N32]);ROW(INDIRECT("B"&[.N32]&":B999"));9999);IF(INDIRECT("C"&[.N32]&":C999")<>INDIRECT("C"&[.N32]);ROW(INDIRECT("C"&[.N32]&":C999"));9999)) -> 112
A34: of:=IF(ISBLANK(['BenchBudEE.csv'.A129]);"";['BenchBudEE.csv'.A129]) -> C31 | B34: of:=IF(ISBLANK(['BenchBudEE.csv'.B129]);"";['BenchBudEE.csv'.B129]) -> NOPOP | C34: of:=IF(ISBLANK(['BenchBudEE.csv'.C129]);"";['BenchBudEE.csv'.C129]) -> Capacitors_SMD:c_0805 | D34: of:=IF(ISBLANK(['BenchBudEE.csv'.D129]);"";['BenchBudEE.csv'.D129]) ->  | E34: of:=IF(ISBLANK(['BenchBudEE.csv'.E129]);"";['BenchBudEE.csv'.E129]) ->  | F34: of:=IF(ISBLANK(['BenchBudEE.csv'.F129]);"";['BenchBudEE.csv'.F129]) ->  | G34: of:=IF(ISNUMBER(SEARCH("[0-9]";[.A34]));MID([.A34];1;SEARCH("[0-9]";[.A34])-1);"") -> C | I34: of:=IF(ISNUMBER(SEARCH("[0-9]";[.J34]));MID([.J34];1;SEARCH("[0-9]";[.J34])-1);"") -> R | J34: of:=INDIRECT("A"&[.N33]) -> R1 | K34: of:=INDIRECT("B"&[.N33]) -> 200 | L34: of:=INDIRECT("C"&[.N33]) -> SMD_Packages:SM0805 | M34: of:=[.N34]-[.N33] -> 2 | N34: of:=MIN(IF(INDIRECT("B"&[.N33]&":B999")<>INDIRECT("B"&[.N33]);ROW(INDIRECT("B"&[.N33]&":B999"));9999);IF(INDIRECT("C"&[.N33]&":C999")<>INDIRECT("C"&[.N33]);ROW(INDIRECT("C"&[.N33]&":C999"));9999)) -> 114
A35: of:=IF(ISBLANK(['BenchBudEE.csv'.A103]);"";['BenchBudEE.csv'.A103]) -> C32 | B35: of:=IF(ISBLANK(['BenchBudEE.csv'.B103]);"";['BenchBudEE.csv'.B103]) -> NOPOP | C35: of:=IF(ISBLANK(['BenchBudEE.csv'.C103]);"";['BenchBudEE.csv'.C103]) -> Capacitors_SMD:c_0805 | D35: of:=IF(ISBLANK(['BenchBudEE.csv'.D103]);"";['BenchBudEE.csv'.D103]) ->  | E35: of:=IF(ISBLANK(['BenchBudEE.csv'.E103]);"";['BenchBudEE.csv'.E103]) ->  | F35: of:=IF(ISBLANK(['BenchBudEE.csv'.F103]);"";['BenchBudEE.csv'.F103]) ->  | G35: of:=IF(ISNUMBER(SEARCH("[0-9]";[.A35]));MID([.A35];1;SEARCH("[0-9]";[.A35])-1);"") -> C | I35: of:=IF(ISNUMBER(SEARCH("[0-9]";[.J35]));MID([.J35];1;SEARCH("[0-9]";[.J35])-1);"") -> R | J35: of:=INDIRECT("A"&[.N34]) -> R10 | K35: of:=INDIRECT("B"&[.N34]) -> 715 | L35: of:=INDIRECT("C"&[.N34]) -> SMD_Packages:SM0805 | M35: of:=[.N35]-[.N34] -> 2 | N35: of:=MIN(IF(INDIRECT("B"&[.N34]&":B999")<>INDIRECT("B"&[.N34]);ROW(INDIRECT("B"&[.N34]&":B999"));9999);IF(INDIRECT("C"&[.N34]&":C999")<>INDIRECT("C"&[.N34]);ROW(INDIRECT("C"&[.N34]&":C999"));9999)) -> 116
A36: of:=IF(ISBLANK(['BenchBudEE.csv'.A19]);"";['BenchBudEE.csv'.A19]) -> D3 | B36: of:=IF(ISBLANK(['BenchBudEE.csv'.B19]);"";['BenchBudEE.csv'.B19]) -> B0540WS-7 | C36: of:=IF(ISBLANK(['BenchBudEE.csv'.C19]);"";['BenchBudEE.csv'.C19]) -> BenchBudEE:SOD-323 | D36: of:=IF(ISBLANK(['BenchBudEE.csv'.D19]);"";['BenchBudEE.csv'.D19]) ->  | E36: of:=IF(ISBLANK(['BenchBudEE.csv'.E19]);"";['BenchBudEE.csv'.E19]) ->  | F36: of:=IF(ISBLANK(['BenchBudEE.csv'.F19]);"";['BenchBudEE.csv'.F19]) -> BO540WS-7 | G36: of:=IF(ISNUMBER(SEARCH("[0-9]";[.A36]));MID([.A36];1;SEARCH("[0-9]";[.A36])-1);"") -> D | I36: of:=IF(ISNUMBER(SEARCH("[0-9]";[.J36]));MID([.J36];1;SEARCH("[0-9]";[.J36])-1);"") -> R | J36: of:=INDIRECT("A"&[.N35]) -> R51 | K36: of:=INDIRECT("B"&[.N35]) -> 1.3K | L36: of:=INDIRECT("C"&[.N35]) -> SMD_Packages:SM0805 | M36: of:=[.N36]-[.N35] -> 2 | N36: of:=MIN(IF(INDIRECT("B"&[.N35]&":B999")<>INDIRECT("B"&[.N35]);ROW(INDIRECT("B"&[.N35]&":B999"));9999);IF(INDIRECT("C"&[.N35]&":C999")<>INDIRECT("C"&[.N35]);ROW(INDIRECT("C"&[.N35]&":C999"));9999)) -> 118
A37: of:=IF(ISBLANK(['BenchBudEE.csv'.A4]);"";['BenchBudEE.csv'.A4]) -> D1 | B37: of:=IF(ISBLANK(['BenchBudEE.csv'.B4]);"";['BenchBudEE.csv'.B4]) -> KP-1608CGCK | C37: of:=IF(ISBLANK(['BenchBudEE.csv'.C4]);"";['BenchBudEE.csv'.C4]) -> LEDs:LED-0603 | D37: of:=IF(ISBLANK(['BenchBudEE.csv'.D4]);"";['BenchBudEE.csv'.D4]) ->  | E37: of:=IF(ISBLANK(['BenchBudEE.csv'.E4]);"";['BenchBudEE.csv'.E4]) ->  | F37: of:=IF(ISBLANK(['BenchBudEE.csv'.F4]);"";['BenchBudEE.csv'.F4]) ->  | G37: of:=IF(ISNUMBER(SEARCH("[0-9]";[.A37]));MID([.A37];1;SEARCH("[0-9]";[.A37])-1);"") -> D | I37: of:=IF(ISNUMBER(SEARCH("[0-9]";[.J37]));MID([.J37];1;SEARCH("[0-9]";[.J37])-1);"") -> R | J37: of:=INDIRECT("A"&[.N36]) -> R15 | K37: of:=INDIRECT("B"&[.N36]) -> 1K | L37: of:=INDIRECT("C"&[.N36]) -> SMD_Packages:SM0805 | M37: of:=[.N37]-[.N36] -> 5 | N37: of:=MIN(IF(INDIRECT("B"&[.N36]&":B999")<>INDIRECT("B"&[.N36]);ROW(INDIRECT("B"&[.N36]&":B999"));9999);IF(INDIRECT("C"&[.N36]&":C999")<>INDIRECT("C"&[.N36]);ROW(INDIRECT("C"&[.N36]&":C999"));9999)) -> 123
A38: of:=IF(ISBLANK(['BenchBudEE.csv'.A76]);"";['BenchBudEE.csv'.A76]) -> D10 | B38: of:=IF(ISBLANK(['BenchBudEE.csv'.B76]);"";['BenchBudEE.csv'.B76]) -> MMBD914-7-F | C38: of:=IF(ISBLANK(['BenchBudEE.csv'.C76]);"";['BenchBudEE.csv'.C76]) -> BenchBudEE:SOT23-DIODE | D38: of:=IF(ISBLANK(['BenchBudEE.csv'.D76]);"";['BenchBudEE.csv'.D76]) ->  | E38: of:=IF(ISBLANK(['BenchBudEE.csv'.E76]);"";['BenchBudEE.csv'.E76]) -> Diodes Inc | F38: of:=IF(ISBLANK(['BenchBudEE.csv'.F76]);"";['BenchBudEE.csv'.F76]) -> MMBD914-7-F | G38: of:=IF(ISNUMBER(SEARCH("[0-9]";[.A38]));MID([.A38];1;SEARCH("[0-9]";[.A38])-1);"") -> D | I38: of:=IF(ISNUMBER(SEARCH("[0-9]";[.J38]));MID([.J38];1;SEARCH("[0-9]";[.J38])-1);"") -> R | J38: of:=INDIRECT("A"&[.N37]) -> R23 | K38: of:=INDIRECT("B"&[.N37]) -> 200K | L38: of:=INDIRECT("C"&[.N37]) -> SMD_Packages:SM1206 | M38: of:=[.N38]-[.N37] -> 2 | N38: of:=MIN(IF(INDIRECT("B"&[.N37]&":B999")<>INDIRECT("B"&[.N37]);ROW(INDIRECT("B"&[.N37]&":B999"));9999);IF(INDIRECT("C"&[.N37]&":C999")<>INDIRECT("C"&[.N37]);ROW(INDIRECT("C"&[.N37]&":C999"));9999)) -> 125
A39: of:=IF(ISBLANK(['BenchBudEE.csv'.A80]);"";['BenchBudEE.csv'.A80]) -> D11 | B39: of:=IF(ISBLANK(['BenchBudEE.csv'.B80]);"";['BenchBudEE.csv'.B80]) -> MMBD914-7-F | C39: of:=IF(ISBLANK(['BenchBudEE.csv'.C80]);"";['BenchBudEE.csv'.C80]) -> BenchBudEE:SOT23-DIODE | D39: of:=IF(ISBLANK(['BenchBudEE.csv'.D80]);"";['BenchBudEE.csv'.D80]) ->  | E39: of:=IF(ISBLANK(['BenchBudEE.csv'.E80]);"";['BenchBudEE.csv'.E80]) -> Diodes Inc | F39: of:=IF(ISBLANK(['BenchBudEE.csv'.F80]);"";['BenchBudEE.csv'.F80]) -> MMBD914-7-F | G39: of:=IF(ISNUMBER(SEARCH("[0-9]";[.A39]));MID([.A39];1;SEARCH("[0-9]";[.A39])-1);"") -> D | I39: of:=IF(ISNUMBER(SEARCH("[0-9]";[.J39]));MID([.J39];1;SEARCH("[0-9]";[.J39])-1);"") -> R | J39: of:=INDIRECT("A"&[.N38]) -> R16 | K39: of:=INDIRECT("B"&[.N38]) -> 3K | L39: of:=INDIRECT("C"&[.N38]) -> SMD_Packages:SM0805 | M39: of:=[.N39]-[.N38] -> 2 | N39: of:=MIN(IF(INDIRECT("B"&[.N38]&":B999")<>INDIRECT("B"&[.N38]);ROW(INDIRECT("B"&[.N38]&":B999"));9999);IF(INDIRECT("C"&[.N38]&":C999")<>INDIRECT("C"&[.N38]);ROW(INDIRECT("C"&[.N38]&":C999"));9999)) -> 127
A40: of:=IF(ISBLANK(['BenchBudEE.csv'.A72]);"";['BenchBudEE.csv'.A72]) -> D12 | B40: of:=IF(ISBLANK(['BenchBudEE.csv'.B72]);"";['BenchBudEE.csv'.B72]) -> MMBD914-7-F | C40: of:=IF(ISBLANK(['BenchBudEE.csv'.C72]);"";['BenchBudEE.csv'.C72]) -> BenchBudEE:SOT23-DIODE | D40: of:=IF(ISBLANK(['BenchBudEE.csv'.D72]);"";['BenchBudEE.csv'.D72]) ->  | E40: of:=IF(ISBLANK(['BenchBudEE.csv'.E72]);"";['BenchBudEE.csv'.E72]) -> Diodes Inc | F40: of:=IF(ISBLANK(['BenchBudEE.csv'.F72]);"";['BenchBudEE.csv'.F72]) -> MMBD914-7-F | G40: of:=IF(ISNUMBER(SEARCH("[0-9]";[.A40]));MID([.A40];1;SEARCH("[0-9]";[.A40])-1);"") -> D | I40: of:=IF(ISNUMBER(SEARCH("[0-9]";[.J40]));MID([.J40];1;SEARCH("[0-9]";[.J40])-1);"") -> R | J40: of:=INDIRECT("A"&[.N39]) -> R12 | K40: of:=INDIRECT("B"&[.N39]) -> 3310C-1-502L | L40: of:=INDIRECT("C"&[.N39]) -> BenchBudEE:EVUE3K | M40: of:=[.N40]-[.N39] -> 2 | N40: of:=MIN(IF(INDIRECT("B"&[.N39]&":B999")<>INDIRECT("B"&[.N39]);ROW(INDIRECT("B"&[.N39]&":B999"));9999);IF(INDIRECT("C"&[.N39]&":C999")<>INDIRECT("C"&[.N39]);ROW(INDIRECT("C"&[.N39]&":C999"));9999)) -> 129
A41: of:=IF(ISBLANK(['BenchBudEE.csv'.A79]);"";['BenchBudEE.csv'.A79]) -> D5 | B41: of:=IF(ISBLANK(['BenchBudEE.csv'.B79]);"";['BenchBudEE.csv'.B79]) -> MMBD914-7-F | C41: of:=IF(ISBLANK(['BenchBudEE.csv'.C79]);"";['BenchBudEE.csv'.C79]) -> BenchBudEE:SOT23-DIODE | D41: of:=IF(ISBLANK(['BenchBudEE.csv'.D79]);"";['BenchBudEE.csv'.D79]) ->  | E41: of:=IF(ISBLANK(['BenchBudEE.csv'.E79]);"";['BenchBudEE.csv'.E79]) -> Diodes Inc | F41: of:=IF(ISBLANK(['BenchBudEE.csv'.F79]);"";['BenchBudEE.csv'.F79]) -> MMBD914-7-F | G41: of:=IF(ISNUMBER(SEARCH("[0-9]";[.A41]));MID([.A41];1;SEARCH("[0-9]";[.A41])-1);"") -> D | I41: of:=IF(ISNUMBER(SEARCH("[0-9]";[.J41]));MID([.J41];1;SEARCH("[0-9]";[.J41])-1);"") -> R | J41: of:=INDIRECT("A"&[.N40]) -> R25 | K41: of:=INDIRECT("B"&[.N40]) -> 5K | L41: of:=INDIRECT("C"&[.N40]) -> SMD_Packages:SM0805 | M41: of:=[.N41]-[.N40] -> 2 | N41: of:=MIN(IF(INDIRECT("B"&[.N40]&":B999")<>INDIRECT("B"&[.N40]);ROW(INDIRECT("B"&[.N40]&":B999"));9999);IF(INDIRECT("C"&[.N40]&":C999")<>INDIRECT("C"&[.N40]);ROW(INDIRECT("C"&[.N40]&":C999"));9999)) -> 131
A42: of:=IF(ISBLANK(['BenchBudEE.csv'.A77]);"";['BenchBudEE.csv'.A77]) -> D6 | B42: of:=IF(ISBLANK(['BenchBudEE.csv'.B77]);"";['BenchBudEE.csv'.B77]) -> MMBD914-7-F | C42: of:=IF(ISBLANK(['BenchBudEE.csv'.C77]);"";['BenchBudEE.csv'.C77]) -> BenchBudEE:SOT23-DIODE | D42: of:=IF(ISBLANK(['BenchBudEE.csv'.D77]);"";['BenchBudEE.csv'.D77]) ->  | E42: of:=IF(ISBLANK(['BenchBudEE.csv'.E77]);"";['BenchBudEE.csv'.E77]) -> Diodes Inc | F42: of:=IF(ISBLANK(['BenchBudEE.csv'.F77]);"";['BenchBudEE.csv'.F77]) -> MMBD914-7-F | G42: of:=IF(ISNUMBER(SEARCH("[0-9]";[.A42]));MID([.A42];1;SEARCH("[0-9]";[.A42])-1);"") -> D | I42: of:=IF(ISNUMBER(SEARCH("[0-9]";[.J42]));MID([.J42];1;SEARCH("[0-9]";[.J42])-1);"") -> R | J42: of:=INDIRECT("A"&[.N41]) -> R21 | K42: of:=INDIRECT("B"&[.N41]) -> 5K | L42: of:=INDIRECT("C"&[.N41]) -> SMD_Packages:SM1206 | M42: of:=[.N42]-[.N41] -> 2 | N42: of:=MIN(IF(INDIRECT("B"&[.N41]&":B999")<>INDIRECT("B"&[.N41]);ROW(INDIRECT("B"&[.N41]&":B999"));9999);IF(INDIRECT("C"&[.N41]&":C999")<>INDIRECT("C"&[.N41]);ROW(INDIRECT("C"&[.N41]&":C999"));9999)) -> 133
A43: of:=IF(ISBLANK(['BenchBudEE.csv'.A75]);"";['BenchBudEE.csv'.A75]) -> D7 | B43: of:=IF(ISBLANK(['BenchBudEE.csv'.B75]);"";['BenchBudEE.csv'.B75]) -> MMBD914-7-F | C43: of:=IF(ISBLANK(['BenchBudEE.csv'.C75]);"";['BenchBudEE.csv'.C75]) -> BenchBudEE:SOT23-DIODE | D43: of:=IF(ISBLANK(['BenchBudEE.csv'.D75]);"";['BenchBudEE.csv'.D75]) ->  | E43: of:=IF(ISBLANK(['BenchBudEE.csv'.E75]);"";['BenchBudEE.csv'.E75]) -> Diodes Inc | F43: of:=IF(ISBLANK(['BenchBudEE.csv'.F75]);"";['BenchBudEE.csv'.F75]) -> MMBD914-7-F | G43: of:=IF(ISNUMBER(SEARCH("[0-9]";[.A43]));MID([.A43];1;SEARCH("[0-9]";[.A43])-1);"") -> D | I43: of:=IF(ISNUMBER(SEARCH("[0-9]";[.J43]));MID([.J43];1;SEARCH("[0-9]";[.J43])-1);"") -> R | J43: of:=INDIRECT("A"&[.N42]) -> R52 | K43: of:=INDIRECT("B"&[.N42]) -> 9.1K | L43: of:=INDIRECT("C"&[.N42]) -> SMD_Packages:SM0805 | M43: of:=[.N43]-[.N42] -> 2 | N43: of:=MIN(IF(INDIRECT("B"&[.N42]&":B999")<>INDIRECT("B"&[.N42]);ROW(INDIRECT("B"&[.N42]&":B999"));9999);IF(INDIRECT("C"&[.N42]&":C999")<>INDIRECT("C"&[.N42]);ROW(INDIRECT("C"&[.N42]&":C999"));9999)) -> 135
A44: of:=IF(ISBLANK(['BenchBudEE.csv'.A81]);"";['BenchBudEE.csv'.A81]) -> D8 | B44: of:=IF(ISBLANK(['BenchBudEE.csv'.B81]);"";['BenchBudEE.csv'.B81]) -> MMBD914-7-F | C44: of:=IF(ISBLANK(['BenchBudEE.csv'.C81]);"";['BenchBudEE.csv'.C81]) -> BenchBudEE:SOT23-DIODE | D44: of:=IF(ISBLANK(['BenchBudEE.csv'.D81]);"";['BenchBudEE.csv'.D81]) ->  | E44: of:=IF(ISBLANK(['BenchBudEE.csv'.E81]);"";['BenchBudEE.csv'.E81]) -> Diodes Inc | F44: of:=IF(ISBLANK(['BenchBudEE.csv'.F81]);"";['BenchBudEE.csv'.F81]) -> MMBD914-7-F | G44: of:=IF(ISNUMBER(SEARCH("[0-9]";[.A44]));MID([.A44];1;SEARCH("[0-9]";[.A44])-1);"") -> D | I44: of:=IF(ISNUMBER(SEARCH("[0-9]";[.J44]));MID([.J44];1;SEARCH("[0-9]";[.J44])-1);"") -> STAR | J44: of:=INDIRECT("A"&[.N43]) -> STAR1 | K44: of:=INDIRECT("B"&[.N43]) -> CONN_1 | L44: of:=INDIRECT("C"&[.N43]) -> Connect:1pin | M44: of:=[.N44]-[.N43] -> 1 | N44: of:=MIN(IF(INDIRECT("B"&[.N43]&":B999")<>INDIRECT("B"&[.N43]);ROW(INDIRECT("B"&[.N43]&":B999"));9999);IF(INDIRECT("C"&[.N43]&":C999")<>INDIRECT("C"&[.N43]);ROW(INDIRECT("C"&[.N43]&":C999"));9999)) -> 136
A45: of:=IF(ISBLANK(['BenchBudEE.csv'.A78]);"";['BenchBudEE.csv'.A78]) -> D9 | B45: of:=IF(ISBLANK(['BenchBudEE.csv'.B78]);"";['BenchBudEE.csv'.B78]) -> MMBD914-7-F | C45: of:=IF(ISBLANK(['BenchBudEE.csv'.C78]);"";['BenchBudEE.csv'.C78]) -> BenchBudEE:SOT23-DIODE | D45: of:=IF(ISBLANK(['BenchBudEE.csv'.D78]);"";['BenchBudEE.csv'.D78]) ->  | E45: of:=IF(ISBLANK(['BenchBudEE.csv'.E78]);"";['BenchBudEE.csv'.E78]) -> Diodes Inc | F45: of:=IF(ISBLANK(['BenchBudEE.csv'.F78]);"";['BenchBudEE.csv'.F78]) -> MMBD914-7-F | G45: of:=IF(ISNUMBER(SEARCH("[0-9]";[.A45]));MID([.A45];1;SEARCH("[0-9]";[.A45])-1);"") -> D | I45: of:=IF(ISNUMBER(SEARCH("[0-9]";[.J45]));MID([.J45];1;SEARCH("[0-9]";[.J45])-1);"") -> SW | J45: of:=INDIRECT("A"&[.N44]) -> SW1 | K45: of:=INDIRECT("B"&[.N44]) -> OS102011MA1QN1 | L45: of:=INDIRECT("C"&[.N44]) -> BenchBudEE:BB_switch | M45: of:=[.N45]-[.N44] -> 1 | N45: of:=MIN(IF(INDIRECT("B"&[.N44]&":B999")<>INDIRECT("B"&[.N44]);ROW(INDIRECT("B"&[.N44]&":B999"));9999);IF(INDIRECT("C"&[.N44]&":C999")<>INDIRECT("C"&[.N44]);ROW(INDIRECT("C"&[.N44]&":C999"));9999)) -> 137
A46: of:=IF(ISBLANK(['BenchBudEE.csv'.A10]);"";['BenchBudEE.csv'.A10]) -> D2 | B46: of:=IF(ISBLANK(['BenchBudEE.csv'.B10]);"";['BenchBudEE.csv'.B10]) -> S1M-13-F | C46: of:=IF(ISBLANK(['BenchBudEE.csv'.C10]);"";['BenchBudEE.csv'.C10]) -> Diodes_SMD:Diode-SMA_Standard | D46: of:=IF(ISBLANK(['BenchBudEE.csv'.D10]);"";['BenchBudEE.csv'.D10]) ->  | E46: of:=IF(ISBLANK(['BenchBudEE.csv'.E10]);"";['BenchBudEE.csv'.E10]) ->  | F46: of:=IF(ISBLANK(['BenchBudEE.csv'.F10]);"";['BenchBudEE.csv'.F10]) ->  | G46: of:=IF(ISNUMBER(SEARCH("[0-9]";[.A46]));MID([.A46];1;SEARCH("[0-9]";[.A46])-1);"") -> D | I46: of:=IF(ISNUMBER(SEARCH("[0-9]";[.J46]));MID([.J46];1;SEARCH("[0-9]";[.J46])-1);"") -> TH | J46: of:=INDIRECT("A"&[.N45]) -> TH1 | K46: of:=INDIRECT("B"&[.N45]) -> MINISMDC050F-2 | L46: of:=INDIRECT("C"&[.N45]) -> SMD_Packages:SM1812 | M46: of:=[.N46]-[.N45] -> 5 | N46: of:=MIN(IF(INDIRECT("B"&[.N45]&":B999")<>INDIRECT("B"&[.N45]);ROW(INDIRECT("B"&[.N45]&":B999"));9999);IF(INDIRECT("C"&[.N45]&":C999")<>INDIRECT("C"&[.N45]);ROW(INDIRECT("C"&[.N45]&":C999"));9999)) -> 142
A47: of:=IF(ISBLANK(['BenchBudEE.csv'.A94]);"";['BenchBudEE.csv'.A94]) -> D4 | B47: of:=IF(ISBLANK(['BenchBudEE.csv'.B94]);"";['BenchBudEE.csv'.B94]) -> S1M-13-F | C47: of:=IF(ISBLANK(['BenchBudEE.csv'.C94]);"";['BenchBudEE.csv'.C94]) -> Diodes_SMD:Diode-SMA_Standard | D47: of:=IF(ISBLANK(['BenchBudEE.csv'.D94]);"";['BenchBudEE.csv'.D94]) ->  | E47: of:=IF(ISBLANK(['BenchBudEE.csv'.E94]);"";['BenchBudEE.csv'.E94]) -> Diodes Inc | F47: of:=IF(ISBLANK(['BenchBudEE.csv'.F94]);"";['BenchBudEE.csv'.F94]) -> B130-13-F | G47: of:=IF(ISNUMBER(SEARCH("[0-9]";[.A47]));MID([.A47];1;SEARCH("[0-9]";[.A47])-1);"") -> D | I47: of:=IF(ISNUMBER(SEARCH("[0-9]";[.J47]));MID([.J47];1;SEARCH("[0-9]";[.J47])-1);"") -> TP | J47: of:=INDIRECT("A"&[.N46]) -> TP1 | K47: of:=INDIRECT("B"&[.N46]) -> +12P | L47: of:=INDIRECT("C"&[.N46]) -> BenchBudEE:TestPointTH | M47: of:=[.N47]-[.N46] -> 1 | N47: of:=MIN(IF(INDIRECT("B"&[.N46]&":B999")<>INDIRECT("B"&[.N46]);ROW(INDIRECT("B"&[.N46]&":B999"));9999);IF(INDIRECT("C"&[.N46]&":C999")<>INDIRECT("C"&[.N46]);ROW(INDIRECT("C"&[.N46]&":C999"));9999)) -> 143
A48: of:=IF(ISBLANK(['BenchBudEE.csv'.A35]);"";['BenchBudEE.csv'.A35]) -> JP1 | B48: of:=IF(ISBLANK(['BenchBudEE.csv'.B35]);"";['BenchBudEE.csv'.B35]) -> JUMPER | C48: of:=IF(ISBLANK(['BenchBudEE.csv'.C35]);"";['BenchBudEE.csv'.C35]) -> BenchBudEE:GND_POINT | D48: of:=IF(ISBLANK(['BenchBudEE.csv'.D35]);"";['BenchBudEE.csv'.D35]) ->  | E48: of:=IF(ISBLANK(['BenchBudEE.csv'.E35]);"";['BenchBudEE.csv'.E35]) ->  | F48: of:=IF(ISBLANK(['BenchBudEE.csv'.F35]);"";['BenchBudEE.csv'.F35]) ->  | G48: of:=IF(ISNUMBER(SEARCH("[0-9]";[.A48]));MID([.A48];1;SEARCH("[0-9]";[.A48])-1);"") -> JP | I48: of:=IF(ISNUMBER(SEARCH("[0-9]";[.J48]));MID([.J48];1;SEARCH("[0-9]";[.J48])-1);"") -> TP | J48: of:=INDIRECT("A"&[.N47]) -> TP8 | K48: of:=INDIRECT("B"&[.N47]) -> +5V | L48: of:=INDIRECT("C"&[.N47]) -> BenchBudEE:TestPointTH | M48: of:=[.N48]-[.N47] -> 1 | N48: of:=MIN(IF(INDIRECT("B"&[.N47]&":B999")<>INDIRECT("B"&[.N47]);ROW(INDIRECT("B"&[.N47]&":B999"));9999);IF(INDIRECT("C"&[.N47]&":C999")<>INDIRECT("C"&[.N47]);ROW(INDIRECT("C"&[.N47]&":C999"));9999)) -> 144
A49: of:=IF(ISBLANK(['BenchBudEE.csv'.A36]);"";['BenchBudEE.csv'.A36]) -> JP2 | B49: of:=IF(ISBLANK(['BenchBudEE.csv'.B36]);"";['BenchBudEE.csv'.B36]) -> JUMPER | C49: of:=IF(ISBLANK(['BenchBudEE.csv'.C36]);"";['BenchBudEE.csv'.C36]) -> BenchBudEE:GND_POINT | D49: of:=IF(ISBLANK(['BenchBudEE.csv'.D36]);"";['BenchBudEE.csv'.D36]) ->  | E49: of:=IF(ISBLANK(['BenchBudEE.csv'.E36]);"";['BenchBudEE.csv'.E36]) ->  | F49: of:=IF(ISBLANK(['BenchBudEE.csv'.F36]);"";['BenchBudEE.csv'.F36]) ->  | G49: of:=IF(ISNUMBER(SEARCH("[0-9]";[.A49]));MID([.A49];1;SEARCH("[0-9]";[.A49])-1);"") -> JP | I49: of:=IF(ISNUMBER(SEARCH("[0-9]";[.J49]));MID([.J49];1;SEARCH("[0-9]";[.J49])-1);"") -> TP | J49: of:=INDIRECT("A"&[.N48]) -> TP3 | K49: of:=INDIRECT("B"&[.N48]) -> AGND | L49: of:=INDIRECT("C"&[.N48]) -> BenchBudEE:TestPointTH | M49: of:=[.N49]-[.N48] -> 1 | N49: of:=MIN(IF(INDIRECT("B"&[.N48]&":B999")<>INDIRECT("B"&[.N48]);ROW(INDIRECT("B"&[.N48]&":B999"));9999);IF(INDIRECT("C"&[.N48]&":C999")<>INDIRECT("C"&[.N48]);ROW(INDIRECT("C"&[.N48]&":C999"));9999)) -> 145
A50: of:=IF(ISBLANK(['BenchBudEE.csv'.A37]);"";['BenchBudEE.csv'.A37]) -> JP3 | B50: of:=IF(ISBLANK(['BenchBudEE.csv'.B37]);"";['BenchBudEE.csv'.B37]) -> JUMPER | C50: of:=IF(ISBLANK(['BenchBudEE.csv'.C37]);"";['BenchBudEE.csv'.C37]) -> BenchBudEE:GND_POINT | D50: of:=IF(ISBLANK(['BenchBudEE.csv'.D37]);"";['BenchBudEE.csv'.D37]) ->  | E50: of:=IF(ISBLANK(['BenchBudEE.csv'.E37]);"";['BenchBudEE.csv'.E37]) ->  | F50: of:=IF(ISBLANK(['BenchBudEE.csv'.F37]);"";['BenchBudEE.csv'.F37]) ->  | G50: of:=IF(ISNUMBER(SEARCH("[0-9]";[.A50]));MID([.A50];1;SEARCH("[0-9]";[.A50])-1);"") -> JP | I50: of:=IF(ISNUMBER(SEARCH("[0-9]";[.J50]));MID([.J50];1;SEARCH("[0-9]";[.J50])-1);"") -> TP | J50: of:=INDIRECT("A"&[.N49]) -> TP10 | K50: of:=INDIRECT("B"&[.N49]) -> CH0+ | L50: of:=INDIRECT("C"&[.N49]) -> BenchBudEE:TestPointTH | M50: of:=[.N50]-[.N49] -> 1 | N50: of:=MIN(IF(INDIRECT("B"&[.N49]&":B999")<>INDIRECT("B"&[.N49]);ROW(INDIRECT("B"&[.N49]&":B999"));9999);IF(INDIRECT("C"&[.N49]&":C999")<>INDIRECT("C"&[.N49]);ROW(INDIRECT("C"&[.N49]&":C999"));9999)) -> 146
A51: of:=IF(ISBLANK(['BenchBudEE.csv'.A38]);"";['BenchBudEE.csv'.A38]) -> JP4 | B51: of:=IF(ISBLANK(['BenchBudEE.csv'.B38]);"";['BenchBudEE.csv'.B38]) -> JUMPER | C51: of:=IF(ISBLANK(['BenchBudEE.csv'.C38]);"";['BenchBudEE.csv'.C38]) -> BenchBudEE:GND_POINT | D51: of:=IF(ISBLANK(['BenchBudEE.csv'.D38]);"";['BenchBudEE.csv'.D38]) ->  | E51: of:=IF(ISBLANK(['BenchBudEE.csv'.E38]);"";['BenchBudEE.csv'.E38]) ->  | F51: of:=IF(ISBLANK(['BenchBudEE.csv'.F38]);"";['BenchBudEE.csv'.F38]) ->  | G51: of:=IF(ISNUMBER(SEARCH("[0-9]";[.A51]));MID([.A51];1;SEARCH("[0-9]";[.A51])-1);"") -> JP | I51: of:=IF(ISNUMBER(SEARCH("[0-9]";[.J51]));MID([.J51];1;SEARCH("[0-9]";[.J51])-1);"") -> TP | J51: of:=INDIRECT("A"&[.N50]) -> TP9 | K51: of:=INDIRECT("B"&[.N50]) -> CH1+ | L51: of:=INDIRECT("C"&[.N50]) -> BenchBudEE:TestPointTH | M51: of:=[.N51]-[.N50] -> 1 | N51: of:=MIN(IF(INDIRECT("B"&[.N50]&":B999")<>INDIRECT("B"&[.N50]);ROW(INDIRECT("B"&[.N50]&":B999"));9999);IF(INDIRECT("C"&[.N50]&":C999")<>INDIRECT("C"&[.N50]);ROW(INDIRECT("C"&[.N50]&":C999"));9999)) -> 147
A52: of:=IF(ISBLANK(['BenchBudEE.csv'.A5]);"";['BenchBudEE.csv'.A5]) -> K1 | B52: of:=IF(ISBLANK(['BenchBudEE.csv'.B5]);"";['BenchBudEE.csv'.B5]) -> G5LA-1 12DC | C52: of:=IF(ISBLANK(['BenchBudEE.csv'.C5]);"";['BenchBudEE.csv'.C5]) -> BenchBudEE:TE-SPDT | D52: of:=IF(ISBLANK(['BenchBudEE.csv'.D5]);"";['BenchBudEE.csv'.D5]) ->  | E52: of:=IF(ISBLANK(['BenchBudEE.csv'.E5]);"";['BenchBudEE.csv'.E5]) ->  | F52: of:=IF(ISBLANK(['BenchBudEE.csv'.F5]);"";['BenchBudEE.csv'.F5]) ->  | G52: of:=IF(ISNUMBER(SEARCH("[0-9]";[.A52]));MID([.A52];1;SEARCH("[0-9]";[.A52])-1);"") -> K | I52: of:=IF(ISNUMBER(SEARCH("[0-9]";[.J52]));MID([.J52];1;SEARCH("[0-9]";[.J52])-1);"") -> TP | J52: of:=INDIRECT("A"&[.N51]) -> TP7 | K52: of:=INDIRECT("B"&[.N51]) -> DAC_OUT | L52: of:=INDIRECT("C"&[.N51]) -> BenchBudEE:TestPointTH | M52: of:=[.N52]-[.N51] -> 1 | N52: of:=MIN(IF(INDIRECT("B"&[.N51]&":B999")<>INDIRECT("B"&[.N51]);ROW(INDIRECT("B"&[.N51]&":B999"));9999);IF(INDIRECT("C"&[.N51]&":C999")<>INDIRECT("C"&[.N51]);ROW(INDIRECT("C"&[.N51]&":C999"));9999)) -> 148
A53: of:=IF(ISBLANK(['BenchBudEE.csv'.A88]);"";['BenchBudEE.csv'.A88]) -> K2 | B53: of:=IF(ISBLANK(['BenchBudEE.csv'.B88]);"";['BenchBudEE.csv'.B88]) -> SPC20484 | C53: of:=IF(ISBLANK(['BenchBudEE.csv'.C88]);"";['BenchBudEE.csv'.C88]) -> Pin_Headers:Pin_Header_Straight_1x03 | D53: of:=IF(ISBLANK(['BenchBudEE.csv'.D88]);"";['BenchBudEE.csv'.D88]) ->  | E53: of:=IF(ISBLANK(['BenchBudEE.csv'.E88]);"";['BenchBudEE.csv'.E88]) ->  | F53: of:=IF(ISBLANK(['BenchBudEE.csv'.F88]);"";['BenchBudEE.csv'.F88]) ->  | G53: of:=IF(ISNUMBER(SEARCH("[0-9]";[.A53]));MID([.A53];1;SEARCH("[0-9]";[.A53])-1);"") -> K | I53: of:=IF(ISNUMBER(SEARCH("[0-9]";[.J53]));MID([.J53];1;SEARCH("[0-9]";[.J53])-1);"") -> TP | J53: of:=INDIRECT("A"&[.N52]) -> TP6 | K53: of:=INDIRECT("B"&[.N52]) -> GND_PWR | L53: of:=INDIRECT("C"&[.N52]) -> BenchBudEE:TestPointTH | M53: of:=[.N53]-[.N52] -> 1 | N53: of:=MIN(IF(INDIRECT("B"&[.N52]&":B999")<>INDIRECT("B"&[.N52]);ROW(INDIRECT("B"&[.N52]&":B999"));9999);IF(INDIRECT("C"&[.N52]&":C999")<>INDIRECT("C"&[.N52]);ROW(INDIRECT("C"&[.N52]&":C999"));9999)) -> 149
A54: of:=IF(ISBLANK(['BenchBudEE.csv'.A87]);"";['BenchBudEE.csv'.A87]) -> K3 | B54: of:=IF(ISBLANK(['BenchBudEE.csv'.B87]);"";['BenchBudEE.csv'.B87]) -> SPC20484 | C54: of:=IF(ISBLANK(['BenchBudEE.csv'.C87]);"";['BenchBudEE.csv'.C87]) -> Pin_Headers:Pin_Header_Straight_1x03 | D54: of:=IF(ISBLANK(['BenchBudEE.csv'.D87]);"";['BenchBudEE.csv'.D87]) ->  | E54: of:=IF(ISBLANK(['BenchBudEE.csv'.E87]);"";['BenchBudEE.csv'.E87]) ->  | F54: of:=IF(ISBLANK(['BenchBudEE.csv'.F87]);"";['BenchBudEE.csv'.F87]) ->  | G54: of:=IF(ISNUMBER(SEARCH("[0-9]";[.A54]));MID([.A54];1;SEARCH("[0-9]";[.A54])-1);"") -> K | I54: of:=IF(ISNUMBER(SEARCH("[0-9]";[.J54]));MID([.J54];1;SEARCH("[0-9]";[.J54])-1);"") -> TP | J54: of:=INDIRECT("A"&[.N53]) -> TP2 | K54: of:=INDIRECT("B"&[.N53]) -> RLY_LOW | L54: of:=INDIRECT("C"&[.N53]) -> BenchBudEE:TestPointTH | M54: of:=[.N54]-[.N53] -> 1 | N54: of:=MIN(IF(INDIRECT("B"&[.N53]&":B999")<>INDIRECT("B"&[.N53]);ROW(INDIRECT("B"&[.N53]&":B999"));9999);IF(INDIRECT("C"&[.N53]&":C999")<>INDIRECT("C"&[.N53]);ROW(INDIRECT("C"&[.N53]&":C999"));9999)) -> 150
A55: of:=IF(ISBLANK(['BenchBudEE.csv'.A127]);"";['BenchBudEE.csv'.A127]) -> L5 | B55: of:=IF(ISBLANK(['BenchBudEE.csv'.B127]);"";['BenchBudEE.csv'.B127]) -> 1u | C55: of:=IF(ISBLANK(['BenchBudEE.csv'.C127]);"";['BenchBudEE.csv'.C127]) -> SMD_Packages:SM0805 | D55: of:=IF(ISBLANK(['BenchBudEE.csv'.D127]);"";['BenchBudEE.csv'.D127]) ->  | E55: of:=IF(ISBLANK(['BenchBudEE.csv'.E127]);"";['BenchBudEE.csv'.E127]) ->  | F55: of:=IF(ISBLANK(['BenchBudEE.csv'.F127]);"";['BenchBudEE.csv'.F127]) ->  | G55: of:=IF(ISNUMBER(SEARCH("[0-9]";[.A55]));MID([.A55];1;SEARCH("[0-9]";[.A55])-1);"") -> L | I55: of:=IF(ISNUMBER(SEARCH("[0-9]";[.J55]));MID([.J55];1;SEARCH("[0-9]";[.J55])-1);"") -> U | J55: of:=INDIRECT("A"&[.N54]) -> U1 | K55: of:=INDIRECT("B"&[.N54]) -> ACPL-217-500E | L55: of:=INDIRECT("C"&[.N54]) -> BenchBudEE:4-SMD | M55: of:=[.N55]-[.N54] -> 1 | N55: of:=MIN(IF(INDIRECT("B"&[.N54]&":B999")<>INDIRECT("B"&[.N54]);ROW(INDIRECT("B"&[.N54]&":B999"));9999);IF(INDIRECT("C"&[.N54]&":C999")<>INDIRECT("C"&[.N54]);ROW(INDIRECT("C"&[.N54]&":C999"));9999)) -> 151
A56: of:=IF(ISBLANK(['BenchBudEE.csv'.A18]);"";['BenchBudEE.csv'.A18]) -> L1 | B56: of:=IF(ISBLANK(['BenchBudEE.csv'.B18]);"";['BenchBudEE.csv'.B18]) -> 22u | C56: of:=IF(ISBLANK(['BenchBudEE.csv'.C18]);"";['BenchBudEE.csv'.C18]) -> BenchBudEE:NR4012 | D56: of:=IF(ISBLANK(['BenchBudEE.csv'.D18]);"";['BenchBudEE.csv'.D18]) ->  | E56: of:=IF(ISBLANK(['BenchBudEE.csv'.E18]);"";['BenchBudEE.csv'.E18]) ->  | F56: of:=IF(ISBLANK(['BenchBudEE.csv'.F18]);"";['BenchBudEE.csv'.F18]) -> NR4012T220M | G56: of:=IF(ISNUMBER(SEARCH("[0-9]";[.A56]));MID([.A56];1;SEARCH("[0-9]";[.A56])-1);"") -> L | I56: of:=IF(ISNUMBER(SEARCH("[0-9]";[.J56]));MID([.J56];1;SEARCH("[0-9]";[.J56])-1);"") -> U | J56: of:=INDIRECT("A"&[.N55]) -> U3 | K56: of:=INDIRECT("B"&[.N55]) -> LM317TG | L56: of:=INDIRECT("C"&[.N55]) -> Transistors_TO-220:TO-220_Neutral123_Vertical | M56: of:=[.N56]-[.N55] -> 2 | N56: of:=MIN(IF(INDIRECT("B"&[.N55]&":B999")<>INDIRECT("B"&[.N55]);ROW(INDIRECT("B"&[.N55]&":B999"));9999);IF(INDIRECT("C"&[.N55]&":C999")<>INDIRECT("C"&[.N55]);ROW(INDIRECT("C"&[.N55]&":C999"));9999)) -> 153
A57: of:=IF(ISBLANK(['BenchBudEE.csv'.A33]);"";['BenchBudEE.csv'.A33]) -> L2 | B57: of:=IF(ISBLANK(['BenchBudEE.csv'.B33]);"";['BenchBudEE.csv'.B33]) -> CM322522-220KL | C57: of:=IF(ISBLANK(['BenchBudEE.csv'.C33]);"";['BenchBudEE.csv'.C33]) -> SMD_Packages:SM1210L | D57: of:=IF(ISBLANK(['BenchBudEE.csv'.D33]);"";['BenchBudEE.csv'.D33]) ->  | E57: of:=IF(ISBLANK(['BenchBudEE.csv'.E33]);"";['BenchBudEE.csv'.E33]) -> Bourns | F57: of:=IF(ISBLANK(['BenchBudEE.csv'.F33]);"";['BenchBudEE.csv'.F33]) ->  | G57: of:=IF(ISNUMBER(SEARCH("[0-9]";[.A57]));MID([.A57];1;SEARCH("[0-9]";[.A57])-1);"") -> L | I57: of:=IF(ISNUMBER(SEARCH("[0-9]";[.J57]));MID([.J57];1;SEARCH("[0-9]";[.J57])-1);"") -> U | J57: of:=INDIRECT("A"&[.N56]) -> U5 | K57: of:=INDIRECT("B"&[.N56]) -> LM337TG | L57: of:=INDIRECT("C"&[.N56]) -> Transistors_TO-220:TO-220_Neutral123_Vertical | M57: of:=[.N57]-[.N56] -> 2 | N57: of:=MIN(IF(INDIRECT("B"&[.N56]&":B999")<>INDIRECT("B"&[.N56]);ROW(INDIRECT("B"&[.N56]&":B999"));9999);IF(INDIRECT("C"&[.N56]&":C999")<>INDIRECT("C"&[.N56]);ROW(INDIRECT("C"&[.N56]&":C999"));9999)) -> 155
A58: of:=IF(ISBLANK(['BenchBudEE.csv'.A24]);"";['BenchBudEE.csv'.A24]) -> L3 | B58: of:=IF(ISBLANK(['BenchBudEE.csv'.B24]);"";['BenchBudEE.csv'.B24]) -> CM322522-220KL | C58: of:=IF(ISBLANK(['BenchBudEE.csv'.C24]);"";['BenchBudEE.csv'.C24]) -> SMD_Packages:SM1210L | D58: of:=IF(ISBLANK(['BenchBudEE.csv'.D24]);"";['BenchBudEE.csv'.D24]) ->  | E58: of:=IF(ISBLANK(['BenchBudEE.csv'.E24]);"";['BenchBudEE.csv'.E24]) -> Bourns | F58: of:=IF(ISBLANK(['BenchBudEE.csv'.F24]);"";['BenchBudEE.csv'.F24]) ->  | G58: of:=IF(ISNUMBER(SEARCH("[0-9]";[.A58]));MID([.A58];1;SEARCH("[0-9]";[.A58])-1);"") -> L | I58: of:=IF(ISNUMBER(SEARCH("[0-9]";[.J58]));MID([.J58];1;SEARCH("[0-9]";[.J58])-1);"") -> U | J58: of:=INDIRECT("A"&[.N57]) -> U10 | K58: of:=INDIRECT("B"&[.N57]) -> LMT84DCKT | L58: of:=INDIRECT("C"&[.N57]) -> SMD_Packages:SOT353 | M58: of:=[.N58]-[.N57] -> 1 | N58: of:=MIN(IF(INDIRECT("B"&[.N57]&":B999")<>INDIRECT("B"&[.N57]);ROW(INDIRECT("B"&[.N57]&":B999"));9999);IF(INDIRECT("C"&[.N57]&":C999")<>INDIRECT("C"&[.N57]);ROW(INDIRECT("C"&[.N57]&":C999"));9999)) -> 156
A59: of:=IF(ISBLANK(['BenchBudEE.csv'.A31]);"";['BenchBudEE.csv'.A31]) -> L4 | B59: of:=IF(ISBLANK(['BenchBudEE.csv'.B31]);"";['BenchBudEE.csv'.B31]) -> CM322522-220KL | C59: of:=IF(ISBLANK(['BenchBudEE.csv'.C31]);"";['BenchBudEE.csv'.C31]) -> SMD_Packages:SM1210L | D59: of:=IF(ISBLANK(['BenchBudEE.csv'.D31]);"";['BenchBudEE.csv'.D31]) ->  | E59: of:=IF(ISBLANK(['BenchBudEE.csv'.E31]);"";['BenchBudEE.csv'.E31]) -> Bourns | F59: of:=IF(ISBLANK(['BenchBudEE.csv'.F31]);"";['BenchBudEE.csv'.F31]) ->  | G59: of:=IF(ISNUMBER(SEARCH("[0-9]";[.A59]));MID([.A59];1;SEARCH("[0-9]";[.A59])-1);"") -> L | I59: of:=IF(ISNUMBER(SEARCH("[0-9]";[.J59]));MID([.J59];1;SEARCH("[0-9]";[.J59])-1);"") -> U | J59: of:=INDIRECT("A"&[.N58]) -> U9 | K59: of:=INDIRECT("B"&[.N58]) -> MCP3901A0-I/SS | L59: of:=INDIRECT("C"&[.N58]) -> SMD_Packages:SSOP20 | M59: of:=[.N59]-[.N58] -> 1 | N59: of:=MIN(IF(INDIRECT("B"&[.N58]&":B999")<>INDIRECT("B"&[.N58]);ROW(INDIRECT("B"&[.N58]&":B999"));9999);IF(INDIRECT("C"&[.N58]&":C999")<>INDIRECT("C"&[.N58]);ROW(INDIRECT("C"&[.N58]&":C999"));9999)) -> 157
A60: of:=IF(ISBLANK(['BenchBudEE.csv'.A40]);"";['BenchBudEE.csv'.A40]) -> P5 | B60: of:=IF(ISBLANK(['BenchBudEE.csv'.B40]);"";['BenchBudEE.csv'.B40]) -> 20.501M/3 | C60: of:=IF(ISBLANK(['BenchBudEE.csv'.C40]);"";['BenchBudEE.csv'.C40]) -> BenchBudEE:3pinTB | D60: of:=IF(ISBLANK(['BenchBudEE.csv'.D40]);"";['BenchBudEE.csv'.D40]) ->  | E60: of:=IF(ISBLANK(['BenchBudEE.csv'.E40]);"";['BenchBudEE.csv'.E40]) -> Phoenix | F60: of:=IF(ISBLANK(['BenchBudEE.csv'.F40]);"";['BenchBudEE.csv'.F40]) -> 1935174 | G60: of:=IF(ISNUMBER(SEARCH("[0-9]";[.A60]));MID([.A60];1;SEARCH("[0-9]";[.A60])-1);"") -> P | I60: of:=IF(ISNUMBER(SEARCH("[0-9]";[.J60]));MID([.J60];1;SEARCH("[0-9]";[.J60])-1);"") -> U | J60: of:=INDIRECT("A"&[.N59]) -> U8 | K60: of:=INDIRECT("B"&[.N59]) -> MCP4801-E/SN | L60: of:=INDIRECT("C"&[.N59]) -> SMD_Packages:SO8N | M60: of:=[.N60]-[.N59] -> 1 | N60: of:=MIN(IF(INDIRECT("B"&[.N59]&":B999")<>INDIRECT("B"&[.N59]);ROW(INDIRECT("B"&[.N59]&":B999"));9999);IF(INDIRECT("C"&[.N59]&":C999")<>INDIRECT("C"&[.N59]);ROW(INDIRECT("C"&[.N59]&":C999"));9999)) -> 158
A61: of:=IF(ISBLANK(['BenchBudEE.csv'.A21]);"";['BenchBudEE.csv'.A21]) -> P1 | B61: of:=IF(ISBLANK(['BenchBudEE.csv'.B21]);"";['BenchBudEE.csv'.B21]) -> 39-30-1240 | C61: of:=IF(ISBLANK(['BenchBudEE.csv'.C21]);"";['BenchBudEE.csv'.C21]) -> BenchBudEE:ATX_Header | D61: of:=IF(ISBLANK(['BenchBudEE.csv'.D21]);"";['BenchBudEE.csv'.D21]) ->  | E61: of:=IF(ISBLANK(['BenchBudEE.csv'.E21]);"";['BenchBudEE.csv'.E21]) -> Molex | F61: of:=IF(ISBLANK(['BenchBudEE.csv'.F21]);"";['BenchBudEE.csv'.F21]) -> 39-30-1240 | G61: of:=IF(ISNUMBER(SEARCH("[0-9]";[.A61]));MID([.A61];1;SEARCH("[0-9]";[.A61])-1);"") -> P | I61: of:=IF(ISNUMBER(SEARCH("[0-9]";[.J61]));MID([.J61];1;SEARCH("[0-9]";[.J61])-1);"") -> U | J61: of:=INDIRECT("A"&[.N60]) -> U11 | K61: of:=INDIRECT("B"&[.N60]) -> OPA4170AID | L61: of:=INDIRECT("C"&[.N60]) -> SMD_Packages:SO14E | M61: of:=[.N61]-[.N60] -> 1 | N61: of:=MIN(IF(INDIRECT("B"&[.N60]&":B999")<>INDIRECT("B"&[.N60]);ROW(INDIRECT("B"&[.N60]&":B999"));9999);IF(INDIRECT("C"&[.N60]&":C999")<>INDIRECT("C"&[.N60]);ROW(INDIRECT("C"&[.N60]&":C999"));9999)) -> 159
A62: of:=IF(ISBLANK(['BenchBudEE.csv'.A39]);"";['BenchBudEE.csv'.A39]) -> P4 | B62: of:=IF(ISBLANK(['BenchBudEE.csv'.B39]);"";['BenchBudEE.csv'.B39]) -> CTB0355/12 | C62: of:=IF(ISBLANK(['BenchBudEE.csv'.C39]);"";['BenchBudEE.csv'.C39]) -> BenchBudEE:12pinTB | D62: of:=IF(ISBLANK(['BenchBudEE.csv'.D39]);"";['BenchBudEE.csv'.D39]) ->  | E62: of:=IF(ISBLANK(['BenchBudEE.csv'.E39]);"";['BenchBudEE.csv'.E39]) -> On Shore | F62: of:=IF(ISBLANK(['BenchBudEE.csv'.F39]);"";['BenchBudEE.csv'.F39]) -> OSTTE120104 | G62: of:=IF(ISNUMBER(SEARCH("[0-9]";[.A62]));MID([.A62];1;SEARCH("[0-9]";[.A62])-1);"") -> P | I62: of:=IF(ISNUMBER(SEARCH("[0-9]";[.J62]));MID([.J62];1;SEARCH("[0-9]";[.J62])-1);"") -> U | J62: of:=INDIRECT("A"&[.N61]) -> U2 | K62: of:=INDIRECT("B"&[.N61]) -> TS19371CX6 RF | L62: of:=INDIRECT("C"&[.N61]) -> SMD_Packages:SOT23_6 | M62: of:=[.N62]-[.N61] -> 1 | N62: of:=MIN(IF(INDIRECT("B"&[.N61]&":B999")<>INDIRECT("B"&[.N61]);ROW(INDIRECT("B"&[.N61]&":B999"));9999);IF(INDIRECT("C"&[.N61]&":C999")<>INDIRECT("C"&[.N61]);ROW(INDIRECT("C"&[.N61]&":C999"));9999)) -> 160
A63: of:=IF(ISBLANK(['BenchBudEE.csv'.A83]);"";['BenchBudEE.csv'.A83]) -> P6 | B63: of:=IF(ISBLANK(['BenchBudEE.csv'.B83]);"";['BenchBudEE.csv'.B83]) -> MC33282 | C63: of:=IF(ISBLANK(['BenchBudEE.csv'.C83]);"";['BenchBudEE.csv'.C83]) -> BenchBudEE:V8508H | D63: of:=IF(ISBLANK(['BenchBudEE.csv'.D83]);"";['BenchBudEE.csv'.D83]) ->  | E63: of:=IF(ISBLANK(['BenchBudEE.csv'.E83]);"";['BenchBudEE.csv'.E83]) ->  | F63: of:=IF(ISBLANK(['BenchBudEE.csv'.F83]);"";['BenchBudEE.csv'.F83]) ->  | G63: of:=IF(ISNUMBER(SEARCH("[0-9]";[.A63]));MID([.A63];1;SEARCH("[0-9]";[.A63])-1);"") -> P
A64: of:=IF(ISBLANK(['BenchBudEE.csv'.A85]);"";['BenchBudEE.csv'.A85]) -> P7 | B64: of:=IF(ISBLANK(['BenchBudEE.csv'.B85]);"";['BenchBudEE.csv'.B85]) -> MC33282 | C64: of:=IF(ISBLANK(['BenchBudEE.csv'.C85]);"";['BenchBudEE.csv'.C85]) -> BenchBudEE:V8508H | D64: of:=IF(ISBLANK(['BenchBudEE.csv'.D85]);"";['BenchBudEE.csv'.D85]) ->  | E64: of:=IF(ISBLANK(['BenchBudEE.csv'.E85]);"";['BenchBudEE.csv'.E85]) ->  | F64: of:=IF(ISBLANK(['BenchBudEE.csv'.F85]);"";['BenchBudEE.csv'.F85]) ->  | G64: of:=IF(ISNUMBER(SEARCH("[0-9]";[.A64]));MID([.A64];1;SEARCH("[0-9]";[.A64])-1);"") -> P
A65: of:=IF(ISBLANK(['BenchBudEE.csv'.A115]);"";['BenchBudEE.csv'.A115]) -> P3 | B65: of:=IF(ISBLANK(['BenchBudEE.csv'.B115]);"";['BenchBudEE.csv'.B115]) -> SPC20484 | C65: of:=IF(ISBLANK(['BenchBudEE.csv'.C115]);"";['BenchBudEE.csv'.C115]) -> Pin_Headers:Pin_Header_Straight_2x03 | D65: of:=IF(ISBLANK(['BenchBudEE.csv'.D115]);"";['BenchBudEE.csv'.D115]) ->  | E65: of:=IF(ISBLANK(['BenchBudEE.csv'.E115]);"";['BenchBudEE.csv'.E115]) ->  | F65: of:=IF(ISBLANK(['BenchBudEE.csv'.F115]);"";['BenchBudEE.csv'.F115]) ->  | G65: of:=IF(ISNUMBER(SEARCH("[0-9]";[.A65]));MID([.A65];1;SEARCH("[0-9]";[.A65])-1);"") -> P
A66: of:=IF(ISBLANK(['BenchBudEE.csv'.A100]);"";['BenchBudEE.csv'.A100]) -> Q2 | B66: of:=IF(ISBLANK(['BenchBudEE.csv'.B100]);"";['BenchBudEE.csv'.B100]) -> 2N7002 | C66: of:=IF(ISBLANK(['BenchBudEE.csv'.C100]);"";['BenchBudEE.csv'.C100]) -> SMD_Packages:SOT23EBC | D66: of:=IF(ISBLANK(['BenchBudEE.csv'.D100]);"";['BenchBudEE.csv'.D100]) ->  | E66: of:=IF(ISBLANK(['BenchBudEE.csv'.E100]);"";['BenchBudEE.csv'.E100]) -> Diodes Inc | F66: of:=IF(ISBLANK(['BenchBudEE.csv'.F100]);"";['BenchBudEE.csv'.F100]) -> DMN65D8L-7 | G66: of:=IF(ISNUMBER(SEARCH("[0-9]";[.A66]));MID([.A66];1;SEARCH("[0-9]";[.A66])-1);"") -> Q
A67: of:=IF(ISBLANK(['BenchBudEE.csv'.A99]);"";['BenchBudEE.csv'.A99]) -> Q3 | B67: of:=IF(ISBLANK(['BenchBudEE.csv'.B99]);"";['BenchBudEE.csv'.B99]) -> FDD6630A | C67: of:=IF(ISBLANK(['BenchBudEE.csv'.C99]);"";['BenchBudEE.csv'.C99]) -> SMD_Packages:DPAK2 | D67: of:=IF(ISBLANK(['BenchBudEE.csv'.D99]);"";['BenchBudEE.csv'.D99]) ->  | E67: of:=IF(ISBLANK(['BenchBudEE.csv'.E99]);"";['BenchBudEE.csv'.E99]) -> Alpha and Omega | F67: of:=IF(ISBLANK(['BenchBudEE.csv'.F99]);"";['BenchBudEE.csv'.F99]) -> AOD476 | G67: of:=IF(ISNUMBER(SEARCH("[0-9]";[.A67]));MID([.A67];1;SEARCH("[0-9]";[.A67])-1);"") -> Q
A68: of:=IF(ISBLANK(['BenchBudEE.csv'.A98]);"";['BenchBudEE.csv'.A98]) -> Q4 | B68: of:=IF(ISBLANK(['BenchBudEE.csv'.B98]);"";['BenchBudEE.csv'.B98]) -> FDD6630A | C68: of:=IF(ISBLANK(['BenchBudEE.csv'.C98]);"";['BenchBudEE.csv'.C98]) -> SMD_Packages:DPAK2 | D68: of:=IF(ISBLANK(['BenchBudEE.csv'.D98]);"";['BenchBudEE.csv'.D98]) ->  | E68: of:=IF(ISBLANK(['BenchBudEE.csv'.E98]);"";['BenchBudEE.csv'.E98]) -> Alpha and Omega | F68: of:=IF(ISBLANK(['BenchBudEE.csv'.F98]);"";['BenchBudEE.csv'.F98]) -> AOD476 | G68: of:=IF(ISNUMBER(SEARCH("[0-9]";[.A68]));MID([.A68];1;SEARCH("[0-9]";[.A68])-1);"") -> Q
A69: of:=IF(ISBLANK(['BenchBudEE.csv'.A3]);"";['BenchBudEE.csv'.A3]) -> Q1 | B69: of:=IF(ISBLANK(['BenchBudEE.csv'.B3]);"";['BenchBudEE.csv'.B3]) -> MMBT3904-7-F | C69: of:=IF(ISBLANK(['BenchBudEE.csv'.C3]);"";['BenchBudEE.csv'.C3]) -> SMD_Packages:SOT23EBC | D69: of:=IF(ISBLANK(['BenchBudEE.csv'.D3]);"";['BenchBudEE.csv'.D3]) ->  | E69: of:=IF(ISBLANK(['BenchBudEE.csv'.E3]);"";['BenchBudEE.csv'.E3]) -> Diodes Inc | F69: of:=IF(ISBLANK(['BenchBudEE.csv'.F3]);"";['BenchBudEE.csv'.F3]) -> MMBT3904-7-F | G69: of:=IF(ISNUMBER(SEARCH("[0-9]";[.A69]));MID([.A69];1;SEARCH("[0-9]";[.A69])-1);"") -> Q
A70: of:=IF(ISBLANK(['BenchBudEE.csv'.A157]);"";['BenchBudEE.csv'.A157]) -> R13 | B70: of:=IF(ISBLANK(['BenchBudEE.csv'.B157]);"";['BenchBudEE.csv'.B157]) -> 0 | C70: of:=IF(ISBLANK(['BenchBudEE.csv'.C157]);"";['BenchBudEE.csv'.C157]) -> BenchBudEE:Resistor_SMD0805_Blob | D70: of:=IF(ISBLANK(['BenchBudEE.csv'.D157]);"";['BenchBudEE.csv'.D157]) ->  | E70: of:=IF(ISBLANK(['BenchBudEE.csv'.E157]);"";['BenchBudEE.csv'.E157]) ->  | F70: of:=IF(ISBLANK(['BenchBudEE.csv'.F157]);"";['BenchBudEE.csv'.F157]) ->  | G70: of:=IF(ISNUMBER(SEARCH("[0-9]";[.A70]));MID([.A70];1;SEARCH("[0-9]";[.A70])-1);"") -> R
A71: of:=IF(ISBLANK(['BenchBudEE.csv'.A158]);"";['BenchBudEE.csv'.A158]) -> R14 | B71: of:=IF(ISBLANK(['BenchBudEE.csv'.B158]);"";['BenchBudEE.csv'.B158]) -> 0 | C71: of:=IF(ISBLANK(['BenchBudEE.csv'.C158]);"";['BenchBudEE.csv'.C158]) -> BenchBudEE:Resistor_SMD0805_Blob | D71: of:=IF(ISBLANK(['BenchBudEE.csv'.D158]);"";['BenchBudEE.csv'.D158]) ->  | E71: of:=IF(ISBLANK(['BenchBudEE.csv'.E158]);"";['BenchBudEE.csv'.E158]) ->  | F71: of:=IF(ISBLANK(['BenchBudEE.csv'.F158]);"";['BenchBudEE.csv'.F158]) ->  | G71: of:=IF(ISNUMBER(SEARCH("[0-9]";[.A71]));MID([.A71];1;SEARCH("[0-9]";[.A71])-1);"") -> R
A72: of:=IF(ISBLANK(['BenchBudEE.csv'.A152]);"";['BenchBudEE.csv'.A152]) -> R28 | B72: of:=IF(ISBLANK(['BenchBudEE.csv'.B152]);"";['BenchBudEE.csv'.B152]) -> 0 | C72: of:=IF(ISBLANK(['BenchBudEE.csv'.C152]);"";['BenchBudEE.csv'.C152]) -> BenchBudEE:Resistor_SMD0805_Blob | D72: of:=IF(ISBLANK(['BenchBudEE.csv'.D152]);"";['BenchBudEE.csv'.D152]) ->  | E72: of:=IF(ISBLANK(['BenchBudEE.csv'.E152]);"";['BenchBudEE.csv'.E152]) ->  | F72: of:=IF(ISBLANK(['BenchBudEE.csv'.F152]);"";['BenchBudEE.csv'.F152]) ->  | G72: of:=IF(ISNUMBER(SEARCH("[0-9]";[.A72]));MID([.A72];1;SEARCH("[0-9]";[.A72])-1);"") -> R
A73: of:=IF(ISBLANK(['BenchBudEE.csv'.A143]);"";['BenchBudEE.csv'.A143]) -> R29 | B73: of:=IF(ISBLANK(['BenchBudEE.csv'.B143]);"";['BenchBudEE.csv'.B143]) -> 0 | C73: of:=IF(ISBLANK(['BenchBudEE.csv'.C143]);"";['BenchBudEE.csv'.C143]) -> BenchBudEE:Resistor_SMD0805_Blob | D73: of:=IF(ISBLANK(['BenchBudEE.csv'.D143]);"";['BenchBudEE.csv'.D143]) ->  | E73: of:=IF(ISBLANK(['BenchBudEE.csv'.E143]);"";['BenchBudEE.csv'.E143]) ->  | F73: of:=IF(ISBLANK(['BenchBudEE.csv'.F143]);"";['BenchBudEE.csv'.F143]) ->  | G73: of:=IF(ISNUMBER(SEARCH("[0-9]";[.A73]));MID([.A73];1;SEARCH("[0-9]";[.A73])-1);"") -> R
A74: of:=IF(ISBLANK(['BenchBudEE.csv'.A142]);"";['BenchBudEE.csv'.A142]) -> R30 | B74: of:=IF(ISBLANK(['BenchBudEE.csv'.B142]);"";['BenchBudEE.csv'.B142]) -> 0 | C74: of:=IF(ISBLANK(['BenchBudEE.csv'.C142]);"";['BenchBudEE.csv'.C142]) -> BenchBudEE:Resistor_SMD0805_Blob | D74: of:=IF(ISBLANK(['BenchBudEE.csv'.D142]);"";['BenchBudEE.csv'.D142]) ->  | E74: of:=IF(ISBLANK(['BenchBudEE.csv'.E142]);"";['BenchBudEE.csv'.E142]) ->  | F74: of:=IF(ISBLANK(['BenchBudEE.csv'.F142]);"";['BenchBudEE.csv'.F142]) ->  | G74: of:=IF(ISNUMBER(SEARCH("[0-9]";[.A74]));MID([.A74];1;SEARCH("[0-9]";[.A74])-1);"") -> R
A75: of:=IF(ISBLANK(['BenchBudEE.csv'.A141]);"";['BenchBudEE.csv'.A141]) -> R31 | B75: of:=IF(ISBLANK(['BenchBudEE.csv'.B141]);"";['BenchBudEE.csv'.B141]) -> 0 | C75: of:=IF(ISBLANK(['BenchBudEE.csv'.C141]);"";['BenchBudEE.csv'.C141]) -> BenchBudEE:Resistor_SMD0805_Blob | D75: of:=IF(ISBLANK(['BenchBudEE.csv'.D141]);"";['BenchBudEE.csv'.D141]) ->  | E75: of:=IF(ISBLANK(['BenchBudEE.csv'.E141]);"";['BenchBudEE.csv'.E141]) ->  | F75: of:=IF(ISBLANK(['BenchBudEE.csv'.F141]);"";['BenchBudEE.csv'.F141]) ->  | G75: of:=IF(ISNUMBER(SEARCH("[0-9]";[.A75]));MID([.A75];1;SEARCH("[0-9]";[.A75])-1);"") -> R
A76: of:=IF(ISBLANK(['BenchBudEE.csv'.A140]);"";['BenchBudEE.csv'.A140]) -> R32 | B76: of:=IF(ISBLANK(['BenchBudEE.csv'.B140]);"";['BenchBudEE.csv'.B140]) -> 0 | C76: of:=IF(ISBLANK(['BenchBudEE.csv'.C140]);"";['BenchBudEE.csv'.C140]) -> BenchBudEE:Resistor_SMD0805_Blob | D76: of:=IF(ISBLANK(['BenchBudEE.csv'.D140]);"";['BenchBudEE.csv'.D140]) ->  | E76: of:=IF(ISBLANK(['BenchBudEE.csv'.E140]);"";['BenchBudEE.csv'.E140]) ->  | F76: of:=IF(ISBLANK(['BenchBudEE.csv'.F140]);"";['BenchBudEE.csv'.F140]) ->  | G76: of:=IF(ISNUMBER(SEARCH("[0-9]";[.A76]));MID([.A76];1;SEARCH("[0-9]";[.A76])-1);"") -> R
A77: of:=IF(ISBLANK(['BenchBudEE.csv'.A145]);"";['BenchBudEE.csv'.A145]) -> R33 | B77: of:=IF(ISBLANK(['BenchBudEE.csv'.B145]);"";['BenchBudEE.csv'.B145]) -> 0 | C77: of:=IF(ISBLANK(['BenchBudEE.csv'.C145]);"";['BenchBudEE.csv'.C145]) -> BenchBudEE:Resistor_SMD0805_Blob | D77: of:=IF(ISBLANK(['BenchBudEE.csv'.D145]);"";['BenchBudEE.csv'.D145]) ->  | E77: of:=IF(ISBLANK(['BenchBudEE.csv'.E145]);"";['BenchBudEE.csv'.E145]) ->  | F77: of:=IF(ISBLANK(['BenchBudEE.csv'.F145]);"";['BenchBudEE.csv'.F145]) ->  | G77: of:=IF(ISNUMBER(SEARCH("[0-9]";[.A77]));MID([.A77];1;SEARCH("[0-9]";[.A77])-1);"") -> R
A78: of:=IF(ISBLANK(['BenchBudEE.csv'.A144]);"";['BenchBudEE.csv'.A144]) -> R34 | B78: of:=IF(ISBLANK(['BenchBudEE.csv'.B144]);"";['BenchBudEE.csv'.B144]) -> 0 | C78: of:=IF(ISBLANK(['BenchBudEE.csv'.C144]);"";['BenchBudEE.csv'.C144]) -> BenchBudEE:Resistor_SMD0805_Blob | D78: of:=IF(ISBLANK(['BenchBudEE.csv'.D144]);"";['BenchBudEE.csv'.D144]) ->  | E78: of:=IF(ISBLANK(['BenchBudEE.csv'.E144]);"";['BenchBudEE.csv'.E144]) ->  | F78: of:=IF(ISBLANK(['BenchBudEE.csv'.F144]);"";['BenchBudEE.csv'.F144]) ->  | G78: of:=IF(ISNUMBER(SEARCH("[0-9]";[.A78]));MID([.A78];1;SEARCH("[0-9]";[.A78])-1);"") -> R
A79: of:=IF(ISBLANK(['BenchBudEE.csv'.A147]);"";['BenchBudEE.csv'.A147]) -> R35 | B79: of:=IF(ISBLANK(['BenchBudEE.csv'.B147]);"";['BenchBudEE.csv'.B147]) -> 0 | C79: of:=IF(ISBLANK(['BenchBudEE.csv'.C147]);"";['BenchBudEE.csv'.C147]) -> BenchBudEE:Resistor_SMD0805_Blob | D79: of:=IF(ISBLANK(['BenchBudEE.csv'.D147]);"";['BenchBudEE.csv'.D147]) ->  | E79: of:=IF(ISBLANK(['BenchBudEE.csv'.E147]);"";['BenchBudEE.csv'.E147]) ->  | F79: of:=IF(ISBLANK(['BenchBudEE.csv'.F147]);"";['BenchBudEE.csv'.F147]) ->  | G79: of:=IF(ISNUMBER(SEARCH("[0-9]";[.A79]));MID([.A79];1;SEARCH("[0-9]";[.A79])-1);"") -> R
A80: of:=IF(ISBLANK(['BenchBudEE.csv'.A138]);"";['BenchBudEE.csv'.A138]) -> R36 | B80: of:=IF(ISBLANK(['BenchBudEE.csv'.B138]);"";['BenchBudEE.csv'.B138]) -> 0 | C80: of:=IF(ISBLANK(['BenchBudEE.csv'.C138]);"";['BenchBudEE.csv'.C138]) -> BenchBudEE:Resistor_SMD0805_Blob | D80: of:=IF(ISBLANK(['BenchBudEE.csv'.D138]);"";['BenchBudEE.csv'.D138]) ->  | E80: of:=IF(ISBLANK(['BenchBudEE.csv'.E138]);"";['BenchBudEE.csv'.E138]) ->  | F80: of:=IF(ISBLANK(['BenchBudEE.csv'.F138]);"";['BenchBudEE.csv'.F138]) ->  | G80: of:=IF(ISNUMBER(SEARCH("[0-9]";[.A80]));MID([.A80];1;SEARCH("[0-9]";[.A80])-1);"") -> R
A81: of:=IF(ISBLANK(['BenchBudEE.csv'.A149]);"";['BenchBudEE.csv'.A149]) -> R37 | B81: of:=IF(ISBLANK(['BenchBudEE.csv'.B149]);"";['BenchBudEE.csv'.B149]) -> 0 | C81: of:=IF(ISBLANK(['BenchBudEE.csv'.C149]);"";['BenchBudEE.csv'.C149]) -> BenchBudEE:Resistor_SMD0805_Blob | D81: of:=IF(ISBLANK(['BenchBudEE.csv'.D149]);"";['BenchBudEE.csv'.D149]) ->  | E81: of:=IF(ISBLANK(['BenchBudEE.csv'.E149]);"";['BenchBudEE.csv'.E149]) ->  | F81: of:=IF(ISBLANK(['BenchBudEE.csv'.F149]);"";['BenchBudEE.csv'.F149]) ->  | G81: of:=IF(ISNUMBER(SEARCH("[0-9]";[.A81]));MID([.A81];1;SEARCH("[0-9]";[.A81])-1);"") -> R
A82: of:=IF(ISBLANK(['BenchBudEE.csv'.A150]);"";['BenchBudEE.csv'.A150]) -> R38 | B82: of:=IF(ISBLANK(['BenchBudEE.csv'.B150]);"";['BenchBudEE.csv'.B150]) -> 0 | C82: of:=IF(ISBLANK(['BenchBudEE.csv'.C150]);"";['BenchBudEE.csv'.C150]) -> BenchBudEE:Resistor_SMD0805_Blob | D82: of:=IF(ISBLANK(['BenchBudEE.csv'.D150]);"";['BenchBudEE.csv'.D150]) ->  | E82: of:=IF(ISBLANK(['BenchBudEE.csv'.E150]);"";['BenchBudEE.csv'.E150]) ->  | F82: of:=IF(ISBLANK(['BenchBudEE.csv'.F150]);"";['BenchBudEE.csv'.F150]) ->  | G82: of:=IF(ISNUMBER(SEARCH("[0-9]";[.A82]));MID([.A82];1;SEARCH("[0-9]";[.A82])-1);"") -> R
A83: of:=IF(ISBLANK(['BenchBudEE.csv'.A146]);"";['BenchBudEE.csv'.A146]) -> R39 | B83: of:=IF(ISBLANK(['BenchBudEE.csv'.B146]);"";['BenchBudEE.csv'.B146]) -> 0 | C83: of:=IF(ISBLANK(['BenchBudEE.csv'.C146]);"";['BenchBudEE.csv'.C146]) -> BenchBudEE:Resistor_SMD0805_Blob | D83: of:=IF(ISBLANK(['BenchBudEE.csv'.D146]);"";['BenchBudEE.csv'.D146]) ->  | E83: of:=IF(ISBLANK(['BenchBudEE.csv'.E146]);"";['BenchBudEE.csv'.E146]) ->  | F83: of:=IF(ISBLANK(['BenchBudEE.csv'.F146]);"";['BenchBudEE.csv'.F146]) ->  | G83: of:=IF(ISNUMBER(SEARCH("[0-9]";[.A83]));MID([.A83];1;SEARCH("[0-9]";[.A83])-1);"") -> R
A84: of:=IF(ISBLANK(['BenchBudEE.csv'.A139]);"";['BenchBudEE.csv'.A139]) -> R40 | B84: of:=IF(ISBLANK(['BenchBudEE.csv'.B139]);"";['BenchBudEE.csv'.B139]) -> 0 | C84: of:=IF(ISBLANK(['BenchBudEE.csv'.C139]);"";['BenchBudEE.csv'.C139]) -> BenchBudEE:Resistor_SMD0805_Blob | D84: of:=IF(ISBLANK(['BenchBudEE.csv'.D139]);"";['BenchBudEE.csv'.D139]) ->  | E84: of:=IF(ISBLANK(['BenchBudEE.csv'.E139]);"";['BenchBudEE.csv'.E139]) ->  | F84: of:=IF(ISBLANK(['BenchBudEE.csv'.F139]);"";['BenchBudEE.csv'.F139]) ->  | G84: of:=IF(ISNUMBER(SEARCH("[0-9]";[.A84]));MID([.A84];1;SEARCH("[0-9]";[.A84])-1);"") -> R
A85: of:=IF(ISBLANK(['BenchBudEE.csv'.A151]);"";['BenchBudEE.csv'.A151]) -> R41 | B85: of:=IF(ISBLANK(['BenchBudEE.csv'.B151]);"";['BenchBudEE.csv'.B151]) -> 0 | C85: of:=IF(ISBLANK(['BenchBudEE.csv'.C151]);"";['BenchBudEE.csv'.C151]) -> BenchBudEE:Resistor_SMD0805_Blob | D85: of:=IF(ISBLANK(['BenchBudEE.csv'.D151]);"";['BenchBudEE.csv'.D151]) ->  | E85: of:=IF(ISBLANK(['BenchBudEE.csv'.E151]);"";['BenchBudEE.csv'.E151]) ->  | F85: of:=IF(ISBLANK(['BenchBudEE.csv'.F151]);"";['BenchBudEE.csv'.F151]) ->  | G85: of:=IF(ISNUMBER(SEARCH("[0-9]";[.A85]));MID([.A85];1;SEARCH("[0-9]";[.A85])-1);"") -> R
A86: of:=IF(ISBLANK(['BenchBudEE.csv'.A148]);"";['BenchBudEE.csv'.A148]) -> R42 | B86: of:=IF(ISBLANK(['BenchBudEE.csv'.B148]);"";['BenchBudEE.csv'.B148]) -> 0 | C86: of:=IF(ISBLANK(['BenchBudEE.csv'.C148]);"";['BenchBudEE.csv'.C148]) -> BenchBudEE:Resistor_SMD0805_Blob | D86: of:=IF(ISBLANK(['BenchBudEE.csv'.D148]);"";['BenchBudEE.csv'.D148]) ->  | E86: of:=IF(ISBLANK(['BenchBudEE.csv'.E148]);"";['BenchBudEE.csv'.E148]) ->  | F86: of:=IF(ISBLANK(['BenchBudEE.csv'.F148]);"";['BenchBudEE.csv'.F148]) ->  | G86: of:=IF(ISNUMBER(SEARCH("[0-9]";[.A86]));MID([.A86];1;SEARCH("[0-9]";[.A86])-1);"") -> R
A87: of:=IF(ISBLANK(['BenchBudEE.csv'.A153]);"";['BenchBudEE.csv'.A153]) -> R45 | B87: of:=IF(ISBLANK(['BenchBudEE.csv'.B153]);"";['BenchBudEE.csv'.B153]) -> 0 | C87: of:=IF(ISBLANK(['BenchBudEE.csv'.C153]);"";['BenchBudEE.csv'.C153]) -> BenchBudEE:Resistor_SMD0805_Blob | D87: of:=IF(ISBLANK(['BenchBudEE.csv'.D153]);"";['BenchBudEE.csv'.D153]) ->  | E87: of:=IF(ISBLANK(['BenchBudEE.csv'.E153]);"";['BenchBudEE.csv'.E153]) ->  | F87: of:=IF(ISBLANK(['BenchBudEE.csv'.F153]);"";['BenchBudEE.csv'.F153]) ->  | G87: of:=IF(ISNUMBER(SEARCH("[0-9]";[.A87]));MID([.A87];1;SEARCH("[0-9]";[.A87])-1);"") -> R
A88: of:=IF(ISBLANK(['BenchBudEE.csv'.A154]);"";['BenchBudEE.csv'.A154]) -> R46 | B88: of:=IF(ISBLANK(['BenchBudEE.csv'.B154]);"";['BenchBudEE.csv'.B154]) -> 0 | C88: of:=IF(ISBLANK(['BenchBudEE.csv'.C154]);"";['BenchBudEE.csv'.C154]) -> BenchBudEE:Resistor_SMD0805_Blob | D88: of:=IF(ISBLANK(['BenchBudEE.csv'.D154]);"";['BenchBudEE.csv'.D154]) ->  | E88: of:=IF(ISBLANK(['BenchBudEE.csv'.E154]);"";['BenchBudEE.csv'.E154]) ->  | F88: of:=IF(ISBLANK(['BenchBudEE.csv'.F154]);"";['BenchBudEE.csv'.F154]) ->  | G88: of:=IF(ISNUMBER(SEARCH("[0-9]";[.A88]));MID([.A88];1;SEARCH("[0-9]";[.A88])-1);"") -> R
A89: of:=IF(ISBLANK(['BenchBudEE.csv'.A155]);"";['BenchBudEE.csv'.A155]) -> R49 | B89: of:=IF(ISBLANK(['BenchBudEE.csv'.B155]);"";['BenchBudEE.csv'.B155]) -> 0 | C89: of:=IF(ISBLANK(['BenchBudEE.csv'.C155]);"";['BenchBudEE.csv'.C155]) -> BenchBudEE:Resistor_SMD0805_Blob | D89: of:=IF(ISBLANK(['BenchBudEE.csv'.D155]);"";['BenchBudEE.csv'.D155]) ->  | E89: of:=IF(ISBLANK(['BenchBudEE.csv'.E155]);"";['BenchBudEE.csv'.E155]) ->  | F89: of:=IF(ISBLANK(['BenchBudEE.csv'.F155]);"";['BenchBudEE.csv'.F155]) ->  | G89: of:=IF(ISNUMBER(SEARCH("[0-9]";[.A89]));MID([.A89];1;SEARCH("[0-9]";[.A89])-1);"") -> R
A90: of:=IF(ISBLANK(['BenchBudEE.csv'.A156]);"";['BenchBudEE.csv'.A156]) -> R50 | B90: of:=IF(ISBLANK(['BenchBudEE.csv'.B156]);"";['BenchBudEE.csv'.B156]) -> 0 | C90: of:=IF(ISBLANK(['BenchBudEE.csv'.C156]);"";['BenchBudEE.csv'.C156]) -> BenchBudEE:Resistor_SMD0805_Blob | D90: of:=IF(ISBLANK(['BenchBudEE.csv'.D156]);"";['BenchBudEE.csv'.D156]) ->  | E90: of:=IF(ISBLANK(['BenchBudEE.csv'.E156]);"";['BenchBudEE.csv'.E156]) ->  | F90: of:=IF(ISBLANK(['BenchBudEE.csv'.F156]);"";['BenchBudEE.csv'.F156]) ->  | G90: of:=IF(ISNUMBER(SEARCH("[0-9]";[.A90]));MID([.A90];1;SEARCH("[0-9]";[.A90])-1);"") -> R
A91: of:=IF(ISBLANK(['BenchBudEE.csv'.A159]);"";['BenchBudEE.csv'.A159]) -> R55 | B91: of:=IF(ISBLANK(['BenchBudEE.csv'.B159]);"";['BenchBudEE.csv'.B159]) -> 0 | C91: of:=IF(ISBLANK(['BenchBudEE.csv'.C159]);"";['BenchBudEE.csv'.C159]) -> BenchBudEE:Resistor_SMD0805_Blob | D91: of:=IF(ISBLANK(['BenchBudEE.csv'.D159]);"";['BenchBudEE.csv'.D159]) ->  | E91: of:=IF(ISBLANK(['BenchBudEE.csv'.E159]);"";['BenchBudEE.csv'.E159]) ->  | F91: of:=IF(ISBLANK(['BenchBudEE.csv'.F159]);"";['BenchBudEE.csv'.F159]) ->  | G91: of:=IF(ISNUMBER(SEARCH("[0-9]";[.A91]));MID([.A91];1;SEARCH("[0-9]";[.A91])-1);"") -> R
A92: of:=IF(ISBLANK(['BenchBudEE.csv'.A92]);"";['BenchBudEE.csv'.A92]) -> R19 | B92: of:=IF(ISBLANK(['BenchBudEE.csv'.B92]);"";['BenchBudEE.csv'.B92]) -> 0 | C92: of:=IF(ISBLANK(['BenchBudEE.csv'.C92]);"";['BenchBudEE.csv'.C92]) -> SMD_Packages:SM0805 | D92: of:=IF(ISBLANK(['BenchBudEE.csv'.D92]);"";['BenchBudEE.csv'.D92]) ->  | E92: of:=IF(ISBLANK(['BenchBudEE.csv'.E92]);"";['BenchBudEE.csv'.E92]) ->  | F92: of:=IF(ISBLANK(['BenchBudEE.csv'.F92]);"";['BenchBudEE.csv'.F92]) ->  | G92: of:=IF(ISNUMBER(SEARCH("[0-9]";[.A92]));MID([.A92];1;SEARCH("[0-9]";[.A92])-1);"") -> R
A93: of:=IF(ISBLANK(['BenchBudEE.csv'.A8]);"";['BenchBudEE.csv'.A8]) -> R4 | B93: of:=IF(ISBLANK(['BenchBudEE.csv'.B8]);"";['BenchBudEE.csv'.B8]) -> 0 | C93: of:=IF(ISBLANK(['BenchBudEE.csv'.C8]);"";['BenchBudEE.csv'.C8]) -> SMD_Packages:SM0805 | D93: of:=IF(ISBLANK(['BenchBudEE.csv'.D8]);"";['BenchBudEE.csv'.D8]) ->  | E93: of:=IF(ISBLANK(['BenchBudEE.csv'.E8]);"";['BenchBudEE.csv'.E8]) ->  | F93: of:=IF(ISBLANK(['BenchBudEE.csv'.F8]);"";['BenchBudEE.csv'.F8]) ->  | G93: of:=IF(ISNUMBER(SEARCH("[0-9]";[.A93]));MID([.A93];1;SEARCH("[0-9]";[.A93])-1);"") -> R
A94: of:=IF(ISBLANK(['BenchBudEE.csv'.A126]);"";['BenchBudEE.csv'.A126]) -> R47 | B94: of:=IF(ISBLANK(['BenchBudEE.csv'.B126]);"";['BenchBudEE.csv'.B126]) -> 0 | C94: of:=IF(ISBLANK(['BenchBudEE.csv'.C126]);"";['BenchBudEE.csv'.C126]) -> SMD_Packages:SM0805 | D94: of:=IF(ISBLANK(['BenchBudEE.csv'.D126]);"";['BenchBudEE.csv'.D126]) ->  | E94: of:=IF(ISBLANK(['BenchBudEE.csv'.E126]);"";['BenchBudEE.csv'.E126]) ->  | F94: of:=IF(ISBLANK(['BenchBudEE.csv'.F126]);"";['BenchBudEE.csv'.F126]) ->  | G94: of:=IF(ISNUMBER(SEARCH("[0-9]";[.A94]));MID([.A94];1;SEARCH("[0-9]";[.A94])-1);"") -> R
A95: of:=IF(ISBLANK(['BenchBudEE.csv'.A125]);"";['BenchBudEE.csv'.A125]) -> R48 | B95: of:=IF(ISBLANK(['BenchBudEE.csv'.B125]);"";['BenchBudEE.csv'.B125]) -> 0 | C95: of:=IF(ISBLANK(['BenchBudEE.csv'.C125]);"";['BenchBudEE.csv'.C125]) -> SMD_Packages:SM0805 | D95: of:=IF(ISBLANK(['BenchBudEE.csv'.D125]);"";['BenchBudEE.csv'.D125]) ->  | E95: of:=IF(ISBLANK(['BenchBudEE.csv'.E125]);"";['BenchBudEE.csv'.E125]) ->  | F95: of:=IF(ISBLANK(['BenchBudEE.csv'.F125]);"";['BenchBudEE.csv'.F125]) ->  | G95: of:=IF(ISNUMBER(SEARCH("[0-9]";[.A95]));MID([.A95];1;SEARCH("[0-9]";[.A95])-1);"") -> R
A96: of:=IF(ISBLANK(['BenchBudEE.csv'.A12]);"";['BenchBudEE.csv'.A12]) -> R5 | B96: of:=IF(ISBLANK(['BenchBudEE.csv'.B12]);"";['BenchBudEE.csv'.B12]) -> 0 | C96: of:=IF(ISBLANK(['BenchBudEE.csv'.C12]);"";['BenchBudEE.csv'.C12]) -> SMD_Packages:SM0805 | D96: of:=IF(ISBLANK(['BenchBudEE.csv'.D12]);"";['BenchBudEE.csv'.D12]) ->  | E96: of:=IF(ISBLANK(['BenchBudEE.csv'.E12]);"";['BenchBudEE.csv'.E12]) ->  | F96: of:=IF(ISBLANK(['BenchBudEE.csv'.F12]);"";['BenchBudEE.csv'.F12]) ->  | G96: of:=IF(ISNUMBER(SEARCH("[0-9]";[.A96]));MID([.A96];1;SEARCH("[0-9]";[.A96])-1);"") -> R
A97: of:=IF(ISBLANK(['BenchBudEE.csv'.A41]);"";['BenchBudEE.csv'.A41]) -> R56 | B97: of:=IF(ISBLANK(['BenchBudEE.csv'.B41]);"";['BenchBudEE.csv'.B41]) -> 0 | C97: of:=IF(ISBLANK(['BenchBudEE.csv'.C41]);"";['BenchBudEE.csv'.C41]) -> SMD_Packages:SM0805 | D97: of:=IF(ISBLANK(['BenchBudEE.csv'.D41]);"";['BenchBudEE.csv'.D41]) ->  | E97: of:=IF(ISBLANK(['BenchBudEE.csv'.E41]);"";['BenchBudEE.csv'.E41]) ->  | F97: of:=IF(ISBLANK(['BenchBudEE.csv'.F41]);"";['BenchBudEE.csv'.F41]) ->  | G97: of:=IF(ISNUMBER(SEARCH("[0-9]";[.A97]));MID([.A97];1;SEARCH("[0-9]";[.A97])-1);"") -> R
A98: of:=IF(ISBLANK(['BenchBudEE.csv'.A82]);"";['BenchBudEE.csv'.A82]) -> R57 | B98: of:=IF(ISBLANK(['BenchBudEE.csv'.B82]);"";['BenchBudEE.csv'.B82]) -> 0 | C98: of:=IF(ISBLANK(['BenchBudEE.csv'.C82]);"";['BenchBudEE.csv'.C82]) -> SMD_Packages:SM0805 | D98: of:=IF(ISBLANK(['BenchBudEE.csv'.D82]);"";['BenchBudEE.csv'.D82]) ->  | E98: of:=IF(ISBLANK(['BenchBudEE.csv'.E82]);"";['BenchBudEE.csv'.E82]) ->  | F98: of:=IF(ISBLANK(['BenchBudEE.csv'.F82]);"";['BenchBudEE.csv'.F82]) ->  | G98: of:=IF(ISNUMBER(SEARCH("[0-9]";[.A98]));MID([.A98];1;SEARCH("[0-9]";[.A98])-1);"") -> R
A99: of:=IF(ISBLANK(['BenchBudEE.csv'.A84]);"";['BenchBudEE.csv'.A84]) -> R58 | B99: of:=IF(ISBLANK(['BenchBudEE.csv'.B84]);"";['BenchBudEE.csv'.B84]) -> 0 | C99: of:=IF(ISBLANK(['BenchBudEE.csv'.C84]);"";['BenchBudEE.csv'.C84]) -> SMD_Packages:SM0805 | D99: of:=IF(ISBLANK(['BenchBudEE.csv'.D84]);"";['BenchBudEE.csv'.D84]) ->  | E99: of:=IF(ISBLANK(['BenchBudEE.csv'.E84]);"";['BenchBudEE.csv'.E84]) ->  | F99: of:=IF(ISBLANK(['BenchBudEE.csv'.F84]);"";['BenchBudEE.csv'.F84]) ->  | G99: of:=IF(ISNUMBER(SEARCH("[0-9]";[.A99]));MID([.A99];1;SEARCH("[0-9]";[.A99])-1);"") -> R
A100: of:=IF(ISBLANK(['BenchBudEE.csv'.A106]);"";['BenchBudEE.csv'.A106]) -> R59 | B100: of:=IF(ISBLANK(['BenchBudEE.csv'.B106]);"";['BenchBudEE.csv'.B106]) -> 0 | C100: of:=IF(ISBLANK(['BenchBudEE.csv'.C106]);"";['BenchBudEE.csv'.C106]) -> SMD_Packages:SM0805 | D100: of:=IF(ISBLANK(['BenchBudEE.csv'.D106]);"";['BenchBudEE.csv'.D106]) ->  | E100: of:=IF(ISBLANK(['BenchBudEE.csv'.E106]);"";['BenchBudEE.csv'.E106]) ->  | F100: of:=IF(ISBLANK(['BenchBudEE.csv'.F106]);"";['BenchBudEE.csv'.F106]) ->  | G100: of:=IF(ISNUMBER(SEARCH("[0-9]";[.A100]));MID([.A100];1;SEARCH("[0-9]";[.A100])-1);"") -> R
A101: of:=IF(ISBLANK(['BenchBudEE.csv'.A6]);"";['BenchBudEE.csv'.A6]) -> R6 | B101: of:=IF(ISBLANK(['BenchBudEE.csv'.B6]);"";['BenchBudEE.csv'.B6]) -> 0 | C101: of:=IF(ISBLANK(['BenchBudEE.csv'.C6]);"";['BenchBudEE.csv'.C6]) -> SMD_Packages:SM0805 | D101: of:=IF(ISBLANK(['BenchBudEE.csv'.D6]);"";['BenchBudEE.csv'.D6]) ->  | E101: of:=IF(ISBLANK(['BenchBudEE.csv'.E6]);"";['BenchBudEE.csv'.E6]) ->  | F101: of:=IF(ISBLANK(['BenchBudEE.csv'.F6]);"";['BenchBudEE.csv'.F6]) ->  | G101: of:=IF(ISNUMBER(SEARCH("[0-9]";[.A101]));MID([.A101];1;SEARCH("[0-9]";[.A101])-1);"") -> R
A102: of:=IF(ISBLANK(['BenchBudEE.csv'.A102]);"";['BenchBudEE.csv'.A102]) -> R60 | B102: of:=IF(ISBLANK(['BenchBudEE.csv'.B102]);"";['BenchBudEE.csv'.B102]) -> 0 | C102: of:=IF(ISBLANK(['BenchBudEE.csv'.C102]);"";['BenchBudEE.csv'.C102]) -> SMD_Packages:SM0805 | D102: of:=IF(ISBLANK(['BenchBudEE.csv'.D102]);"";['BenchBudEE.csv'.D102]) ->  | E102: of:=IF(ISBLANK(['BenchBudEE.csv'.E102]);"";['BenchBudEE.csv'.E102]) ->  | F102: of:=IF(ISBLANK(['BenchBudEE.csv'.F102]);"";['BenchBudEE.csv'.F102]) ->  | G102: of:=IF(ISNUMBER(SEARCH("[0-9]";[.A102]));MID([.A102];1;SEARCH("[0-9]";[.A102])-1);"") -> R
A103: of:=IF(ISBLANK(['BenchBudEE.csv'.A104]);"";['BenchBudEE.csv'.A104]) -> R61 | B103: of:=IF(ISBLANK(['BenchBudEE.csv'.B104]);"";['BenchBudEE.csv'.B104]) -> 0 | C103: of:=IF(ISBLANK(['BenchBudEE.csv'.C104]);"";['BenchBudEE.csv'.C104]) -> SMD_Packages:SM0805 | D103: of:=IF(ISBLANK(['BenchBudEE.csv'.D104]);"";['BenchBudEE.csv'.D104]) ->  | E103: of:=IF(ISBLANK(['BenchBudEE.csv'.E104]);"";['BenchBudEE.csv'.E104]) ->  | F103: of:=IF(ISBLANK(['BenchBudEE.csv'.F104]);"";['BenchBudEE.csv'.F104]) ->  | G103: of:=IF(ISNUMBER(SEARCH("[0-9]";[.A103]));MID([.A103];1;SEARCH("[0-9]";[.A103])-1);"") -> R
A104: of:=IF(ISBLANK(['BenchBudEE.csv'.A134]);"";['BenchBudEE.csv'.A134]) -> R63 | B104: of:=IF(ISBLANK(['BenchBudEE.csv'.B134]);"";['BenchBudEE.csv'.B134]) -> 0 | C104: of:=IF(ISBLANK(['BenchBudEE.csv'.C134]);"";['BenchBudEE.csv'.C134]) -> SMD_Packages:SM0805 | D104: of:=IF(ISBLANK(['BenchBudEE.csv'.D134]);"";['BenchBudEE.csv'.D134]) ->  | E104: of:=IF(ISBLANK(['BenchBudEE.csv'.E134]);"";['BenchBudEE.csv'.E134]) ->  | F104: of:=IF(ISBLANK(['BenchBudEE.csv'.F134]);"";['BenchBudEE.csv'.F134]) ->  | G104: of:=IF(ISNUMBER(SEARCH("[0-9]";[.A104]));MID([.A104];1;SEARCH("[0-9]";[.A104])-1);"") -> R
A105: of:=IF(ISBLANK(['BenchBudEE.csv'.A130]);"";['BenchBudEE.csv'.A130]) -> R65 | B105: of:=IF(ISBLANK(['BenchBudEE.csv'.B130]);"";['BenchBudEE.csv'.B130]) -> 0 | C105: of:=IF(ISBLANK(['BenchBudEE.csv'.C130]);"";['BenchBudEE.csv'.C130]) -> SMD_Packages:SM0805 | D105: of:=IF(ISBLANK(['BenchBudEE.csv'.D130]);"";['BenchBudEE.csv'.D130]) ->  | E105: of:=IF(ISBLANK(['BenchBudEE.csv'.E130]);"";['BenchBudEE.csv'.E130]) ->  | F105: of:=IF(ISBLANK(['BenchBudEE.csv'.F130]);"";['BenchBudEE.csv'.F130]) ->  | G105: of:=IF(ISNUMBER(SEARCH("[0-9]";[.A105]));MID([.A105];1;SEARCH("[0-9]";[.A105])-1);"") -> R
A106: of:=IF(ISBLANK(['BenchBudEE.csv'.A23]);"";['BenchBudEE.csv'.A23]) -> R8 | B106: of:=IF(ISBLANK(['BenchBudEE.csv'.B23]);"";['BenchBudEE.csv'.B23]) -> 0 | C106: of:=IF(ISBLANK(['BenchBudEE.csv'.C23]);"";['BenchBudEE.csv'.C23]) -> SMD_Packages:SM0805 | D106: of:=IF(ISBLANK(['BenchBudEE.csv'.D23]);"";['BenchBudEE.csv'.D23]) ->  | E106: of:=IF(ISBLANK(['BenchBudEE.csv'.E23]);"";['BenchBudEE.csv'.E23]) ->  | F106: of:=IF(ISBLANK(['BenchBudEE.csv'.F23]);"";['BenchBudEE.csv'.F23]) ->  | G106: of:=IF(ISNUMBER(SEARCH("[0-9]";[.A106]));MID([.A106];1;SEARCH("[0-9]";[.A106])-1);"") -> R
A107: of:=IF(ISBLANK(['BenchBudEE.csv'.A91]);"";['BenchBudEE.csv'.A91]) -> R20 | B107: of:=IF(ISBLANK(['BenchBudEE.csv'.B91]);"";['BenchBudEE.csv'.B91]) -> 1 | C107: of:=IF(ISBLANK(['BenchBudEE.csv'.C91]);"";['BenchBudEE.csv'.C91]) -> SMD_Packages:SM1206 | D107: of:=IF(ISBLANK(['BenchBudEE.csv'.D91]);"";['BenchBudEE.csv'.D91]) ->  | E107: of:=IF(ISBLANK(['BenchBudEE.csv'.E91]);"";['BenchBudEE.csv'.E91]) ->  | F107: of:=IF(ISBLANK(['BenchBudEE.csv'.F91]);"";['BenchBudEE.csv'.F91]) ->  | G107: of:=IF(ISNUMBER(SEARCH("[0-9]";[.A107]));MID([.A107];1;SEARCH("[0-9]";[.A107])-1);"") -> R
A108: of:=IF(ISBLANK(['BenchBudEE.csv'.A20]);"";['BenchBudEE.csv'.A20]) -> R7 | B108: of:=IF(ISBLANK(['BenchBudEE.csv'.B20]);"";['BenchBudEE.csv'.B20]) -> 4.87 | C108: of:=IF(ISBLANK(['BenchBudEE.csv'.C20]);"";['BenchBudEE.csv'.C20]) -> SMD_Packages:SM0805 | D108: of:=IF(ISBLANK(['BenchBudEE.csv'.D20]);"";['BenchBudEE.csv'.D20]) ->  | E108: of:=IF(ISBLANK(['BenchBudEE.csv'.E20]);"";['BenchBudEE.csv'.E20]) ->  | F108: of:=IF(ISBLANK(['BenchBudEE.csv'.F20]);"";['BenchBudEE.csv'.F20]) ->  | G108: of:=IF(ISNUMBER(SEARCH("[0-9]";[.A108]));MID([.A108];1;SEARCH("[0-9]";[.A108])-1);"") -> R
A109: of:=IF(ISBLANK(['BenchBudEE.csv'.A116]);"";['BenchBudEE.csv'.A116]) -> R26 | B109: of:=IF(ISBLANK(['BenchBudEE.csv'.B116]);"";['BenchBudEE.csv'.B116]) -> 10 | C109: of:=IF(ISBLANK(['BenchBudEE.csv'.C116]);"";['BenchBudEE.csv'.C116]) -> SMD_Packages:SM0805 | D109: of:=IF(ISBLANK(['BenchBudEE.csv'.D116]);"";['BenchBudEE.csv'.D116]) ->  | E109: of:=IF(ISBLANK(['BenchBudEE.csv'.E116]);"";['BenchBudEE.csv'.E116]) ->  | F109: of:=IF(ISBLANK(['BenchBudEE.csv'.F116]);"";['BenchBudEE.csv'.F116]) ->  | G109: of:=IF(ISNUMBER(SEARCH("[0-9]";[.A109]));MID([.A109];1;SEARCH("[0-9]";[.A109])-1);"") -> R
A110: of:=IF(ISBLANK(['BenchBudEE.csv'.A2]);"";['BenchBudEE.csv'.A2]) -> R3 | B110: of:=IF(ISBLANK(['BenchBudEE.csv'.B2]);"";['BenchBudEE.csv'.B2]) -> 100 | C110: of:=IF(ISBLANK(['BenchBudEE.csv'.C2]);"";['BenchBudEE.csv'.C2]) -> SMD_Packages:SM0805 | D110: of:=IF(ISBLANK(['BenchBudEE.csv'.D2]);"";['BenchBudEE.csv'.D2]) ->  | E110: of:=IF(ISBLANK(['BenchBudEE.csv'.E2]);"";['BenchBudEE.csv'.E2]) ->  | F110: of:=IF(ISBLANK(['BenchBudEE.csv'.F2]);"";['BenchBudEE.csv'.F2]) ->  | G110: of:=IF(ISNUMBER(SEARCH("[0-9]";[.A110]));MID([.A110];1;SEARCH("[0-9]";[.A110])-1);"") -> R
A111: of:=IF(ISBLANK(['BenchBudEE.csv'.A117]);"";['BenchBudEE.csv'.A117]) -> R43 | B111: of:=IF(ISBLANK(['BenchBudEE.csv'.B117]);"";['BenchBudEE.csv'.B117]) -> 100 | C111: of:=IF(ISBLANK(['BenchBudEE.csv'.C117]);"";['BenchBudEE.csv'.C117]) -> SMD_Packages:SM0805 | D111: of:=IF(ISBLANK(['BenchBudEE.csv'.D117]);"";['BenchBudEE.csv'.D117]) ->  | E111: of:=IF(ISBLANK(['BenchBudEE.csv'.E117]);"";['BenchBudEE.csv'.E117]) ->  | F111: of:=IF(ISBLANK(['BenchBudEE.csv'.F117]);"";['BenchBudEE.csv'.F117]) ->  | G111: of:=IF(ISNUMBER(SEARCH("[0-9]";[.A111]));MID([.A111];1;SEARCH("[0-9]";[.A111])-1);"") -> R
A112: of:=IF(ISBLANK(['BenchBudEE.csv'.A9]);"";['BenchBudEE.csv'.A9]) -> R1 | B112: of:=IF(ISBLANK(['BenchBudEE.csv'.B9]);"";['BenchBudEE.csv'.B9]) -> 200 | C112: of:=IF(ISBLANK(['BenchBudEE.csv'.C9]);"";['BenchBudEE.csv'.C9]) -> SMD_Packages:SM0805 | D112: of:=IF(ISBLANK(['BenchBudEE.csv'.D9]);"";['BenchBudEE.csv'.D9]) ->  | E112: of:=IF(ISBLANK(['BenchBudEE.csv'.E9]);"";['BenchBudEE.csv'.E9]) ->  | F112: of:=IF(ISBLANK(['BenchBudEE.csv'.F9]);"";['BenchBudEE.csv'.F9]) ->  | G112: of:=IF(ISNUMBER(SEARCH("[0-9]";[.A112]));MID([.A112];1;SEARCH("[0-9]";[.A112])-1);"") -> R
A113: of:=IF(ISBLANK(['BenchBudEE.csv'.A7]);"";['BenchBudEE.csv'.A7]) -> R2 | B113: of:=IF(ISBLANK(['BenchBudEE.csv'.B7]);"";['BenchBudEE.csv'.B7]) -> 200 | C113: of:=IF(ISBLANK(['BenchBudEE.csv'.C7]);"";['BenchBudEE.csv'.C7]) -> SMD_Packages:SM0805 | D113: of:=IF(ISBLANK(['BenchBudEE.csv'.D7]);"";['BenchBudEE.csv'.D7]) ->  | E113: of:=IF(ISBLANK(['BenchBudEE.csv'.E7]);"";['BenchBudEE.csv'.E7]) ->  | F113: of:=IF(ISBLANK(['BenchBudEE.csv'.F7]);"";['BenchBudEE.csv'.F7]) ->  | G113: of:=IF(ISNUMBER(SEARCH("[0-9]";[.A113]));MID([.A113];1;SEARCH("[0-9]";[.A113])-1);"") -> R
A114: of:=IF(ISBLANK(['BenchBudEE.csv'.A48]);"";['BenchBudEE.csv'.A48]) -> R10 | B114: of:=IF(ISBLANK(['BenchBudEE.csv'.B48]);"";['BenchBudEE.csv'.B48]) -> 715 | C114: of:=IF(ISBLANK(['BenchBudEE.csv'.C48]);"";['BenchBudEE.csv'.C48]) -> SMD_Packages:SM0805 | D114: of:=IF(ISBLANK(['BenchBudEE.csv'.D48]);"";['BenchBudEE.csv'.D48]) ->  | E114: of:=IF(ISBLANK(['BenchBudEE.csv'.E48]);"";['BenchBudEE.csv'.E48]) ->  | F114: of:=IF(ISBLANK(['BenchBudEE.csv'.F48]);"";['BenchBudEE.csv'.F48]) ->  | G114: of:=IF(ISNUMBER(SEARCH("[0-9]";[.A114]));MID([.A114];1;SEARCH("[0-9]";[.A114])-1);"") -> R
A115: of:=IF(ISBLANK(['BenchBudEE.csv'.A46]);"";['BenchBudEE.csv'.A46]) -> R11 | B115: of:=IF(ISBLANK(['BenchBudEE.csv'.B46]);"";['BenchBudEE.csv'.B46]) -> 715 | C115: of:=IF(ISBLANK(['BenchBudEE.csv'.C46]);"";['BenchBudEE.csv'.C46]) -> SMD_Packages:SM0805 | D115: of:=IF(ISBLANK(['BenchBudEE.csv'.D46]);"";['BenchBudEE.csv'.D46]) ->  | E115: of:=IF(ISBLANK(['BenchBudEE.csv'.E46]);"";['BenchBudEE.csv'.E46]) ->  | F115: of:=IF(ISBLANK(['BenchBudEE.csv'.F46]);"";['BenchBudEE.csv'.F46]) ->  | G115: of:=IF(ISNUMBER(SEARCH("[0-9]";[.A115]));MID([.A115];1;SEARCH("[0-9]";[.A115])-1);"") -> R
A116: of:=IF(ISBLANK(['BenchBudEE.csv'.A56]);"";['BenchBudEE.csv'.A56]) -> R51 | B116: of:=IF(ISBLANK(['BenchBudEE.csv'.B56]);"";['BenchBudEE.csv'.B56]) -> 1.3K | C116: of:=IF(ISBLANK(['BenchBudEE.csv'.C56]);"";['BenchBudEE.csv'.C56]) -> SMD_Packages:SM0805 | D116: of:=IF(ISBLANK(['BenchBudEE.csv'.D56]);"";['BenchBudEE.csv'.D56]) ->  | E116: of:=IF(ISBLANK(['BenchBudEE.csv'.E56]);"";['BenchBudEE.csv'.E56]) ->  | F116: of:=IF(ISBLANK(['BenchBudEE.csv'.F56]);"";['BenchBudEE.csv'.F56]) ->  | G116: of:=IF(ISNUMBER(SEARCH("[0-9]";[.A116]));MID([.A116];1;SEARCH("[0-9]";[.A116])-1);"") -> R
A117: of:=IF(ISBLANK(['BenchBudEE.csv'.A59]);"";['BenchBudEE.csv'.A59]) -> R54 | B117: of:=IF(ISBLANK(['BenchBudEE.csv'.B59]);"";['BenchBudEE.csv'.B59]) -> 1.3K | C117: of:=IF(ISBLANK(['BenchBudEE.csv'.C59]);"";['BenchBudEE.csv'.C59]) -> SMD_Packages:SM0805 | D117: of:=IF(ISBLANK(['BenchBudEE.csv'.D59]);"";['BenchBudEE.csv'.D59]) ->  | E117: of:=IF(ISBLANK(['BenchBudEE.csv'.E59]);"";['BenchBudEE.csv'.E59]) ->  | F117: of:=IF(ISBLANK(['BenchBudEE.csv'.F59]);"";['BenchBudEE.csv'.F59]) ->  | G117: of:=IF(ISNUMBER(SEARCH("[0-9]";[.A117]));MID([.A117];1;SEARCH("[0-9]";[.A117])-1);"") -> R
A118: of:=IF(ISBLANK(['BenchBudEE.csv'.A49]);"";['BenchBudEE.csv'.A49]) -> R15 | B118: of:=IF(ISBLANK(['BenchBudEE.csv'.B49]);"";['BenchBudEE.csv'.B49]) -> 1K | C118: of:=IF(ISBLANK(['BenchBudEE.csv'.C49]);"";['BenchBudEE.csv'.C49]) -> SMD_Packages:SM0805 | D118: of:=IF(ISBLANK(['BenchBudEE.csv'.D49]);"";['BenchBudEE.csv'.D49]) ->  | E118: of:=IF(ISBLANK(['BenchBudEE.csv'.E49]);"";['BenchBudEE.csv'.E49]) ->  | F118: of:=IF(ISBLANK(['BenchBudEE.csv'.F49]);"";['BenchBudEE.csv'.F49]) ->  | G118: of:=IF(ISNUMBER(SEARCH("[0-9]";[.A118]));MID([.A118];1;SEARCH("[0-9]";[.A118])-1);"") -> R
A119: of:=IF(ISBLANK(['BenchBudEE.csv'.A51]);"";['BenchBudEE.csv'.A51]) -> R18 | B119: of:=IF(ISBLANK(['BenchBudEE.csv'.B51]);"";['BenchBudEE.csv'.B51]) -> 1K | C119: of:=IF(ISBLANK(['BenchBudEE.csv'.C51]);"";['BenchBudEE.csv'.C51]) -> SMD_Packages:SM0805 | D119: of:=IF(ISBLANK(['BenchBudEE.csv'.D51]);"";['BenchBudEE.csv'.D51]) ->  | E119: of:=IF(ISBLANK(['BenchBudEE.csv'.E51]);"";['BenchBudEE.csv'.E51]) ->  | F119: of:=IF(ISBLANK(['BenchBudEE.csv'.F51]);"";['BenchBudEE.csv'.F51]) ->  | G119: of:=IF(ISNUMBER(SEARCH("[0-9]";[.A119]));MID([.A119];1;SEARCH("[0-9]";[.A119])-1);"") -> R
A120: of:=IF(ISBLANK(['BenchBudEE.csv'.A118]);"";['BenchBudEE.csv'.A118]) -> R44 | B120: of:=IF(ISBLANK(['BenchBudEE.csv'.B118]);"";['BenchBudEE.csv'.B118]) -> 1K | C120: of:=IF(ISBLANK(['BenchBudEE.csv'.C118]);"";['BenchBudEE.csv'.C118]) -> SMD_Packages:SM0805 | D120: of:=IF(ISBLANK(['BenchBudEE.csv'.D118]);"";['BenchBudEE.csv'.D118]) ->  | E120: of:=IF(ISBLANK(['BenchBudEE.csv'.E118]);"";['BenchBudEE.csv'.E118]) ->  | F120: of:=IF(ISBLANK(['BenchBudEE.csv'.F118]);"";['BenchBudEE.csv'.F118]) ->  | G120: of:=IF(ISNUMBER(SEARCH("[0-9]";[.A120]));MID([.A120];1;SEARCH("[0-9]";[.A120])-1);"") -> R
A121: of:=IF(ISBLANK(['BenchBudEE.csv'.A136]);"";['BenchBudEE.csv'.A136]) -> R62 | B121: of:=IF(ISBLANK(['BenchBudEE.csv'.B136]);"";['BenchBudEE.csv'.B136]) -> 1K | C121: of:=IF(ISBLANK(['BenchBudEE.csv'.C136]);"";['BenchBudEE.csv'.C136]) -> SMD_Packages:SM0805 | D121: of:=IF(ISBLANK(['BenchBudEE.csv'.D136]);"";['BenchBudEE.csv'.D136]) ->  | E121: of:=IF(ISBLANK(['BenchBudEE.csv'.E136]);"";['BenchBudEE.csv'.E136]) ->  | F121: of:=IF(ISBLANK(['BenchBudEE.csv'.F136]);"";['BenchBudEE.csv'.F136]) ->  | G121: of:=IF(ISNUMBER(SEARCH("[0-9]";[.A121]));MID([.A121];1;SEARCH("[0-9]";[.A121])-1);"") -> R
A122: of:=IF(ISBLANK(['BenchBudEE.csv'.A135]);"";['BenchBudEE.csv'.A135]) -> R64 | B122: of:=IF(ISBLANK(['BenchBudEE.csv'.B135]);"";['BenchBudEE.csv'.B135]) -> 1K | C122: of:=IF(ISBLANK(['BenchBudEE.csv'.C135]);"";['BenchBudEE.csv'.C135]) -> SMD_Packages:SM0805 | D122: of:=IF(ISBLANK(['BenchBudEE.csv'.D135]);"";['BenchBudEE.csv'.D135]) ->  | E122: of:=IF(ISBLANK(['BenchBudEE.csv'.E135]);"";['BenchBudEE.csv'.E135]) ->  | F122: of:=IF(ISBLANK(['BenchBudEE.csv'.F135]);"";['BenchBudEE.csv'.F135]) ->  | G122: of:=IF(ISNUMBER(SEARCH("[0-9]";[.A122]));MID([.A122];1;SEARCH("[0-9]";[.A122])-1);"") -> R
A123: of:=IF(ISBLANK(['BenchBudEE.csv'.A109]);"";['BenchBudEE.csv'.A109]) -> R23 | B123: of:=IF(ISBLANK(['BenchBudEE.csv'.B109]);"";['BenchBudEE.csv'.B109]) -> 200K | C123: of:=IF(ISBLANK(['BenchBudEE.csv'.C109]);"";['BenchBudEE.csv'.C109]) -> SMD_Packages:SM1206 | D123: of:=IF(ISBLANK(['BenchBudEE.csv'.D109]);"";['BenchBudEE.csv'.D109]) ->  | E123: of:=IF(ISBLANK(['BenchBudEE.csv'.E109]);"";['BenchBudEE.csv'.E109]) ->  | F123: of:=IF(ISBLANK(['BenchBudEE.csv'.F109]);"";['BenchBudEE.csv'.F109]) ->  | G123: of:=IF(ISNUMBER(SEARCH("[0-9]";[.A123]));MID([.A123];1;SEARCH("[0-9]";[.A123])-1);"") -> R
A124: of:=IF(ISBLANK(['BenchBudEE.csv'.A111]);"";['BenchBudEE.csv'.A111]) -> R24 | B124: of:=IF(ISBLANK(['BenchBudEE.csv'.B111]);"";['BenchBudEE.csv'.B111]) -> 200K | C124: of:=IF(ISBLANK(['BenchBudEE.csv'.C111]);"";['BenchBudEE.csv'.C111]) -> SMD_Packages:SM1206 | D124: of:=IF(ISBLANK(['BenchBudEE.csv'.D111]);"";['BenchBudEE.csv'.D111]) ->  | E124: of:=IF(ISBLANK(['BenchBudEE.csv'.E111]);"";['BenchBudEE.csv'.E111]) ->  | F124: of:=IF(ISBLANK(['BenchBudEE.csv'.F111]);"";['BenchBudEE.csv'.F111]) ->  | G124: of:=IF(ISNUMBER(SEARCH("[0-9]";[.A124]));MID([.A124];1;SEARCH("[0-9]";[.A124])-1);"") -> R
A125: of:=IF(ISBLANK(['BenchBudEE.csv'.A50]);"";['BenchBudEE.csv'.A50]) -> R16 | B125: of:=IF(ISBLANK(['BenchBudEE.csv'.B50]);"";['BenchBudEE.csv'.B50]) -> 3K | C125: of:=IF(ISBLANK(['BenchBudEE.csv'.C50]);"";['BenchBudEE.csv'.C50]) -> SMD_Packages:SM0805 | D125: of:=IF(ISBLANK(['BenchBudEE.csv'.D50]);"";['BenchBudEE.csv'.D50]) ->  | E125: of:=IF(ISBLANK(['BenchBudEE.csv'.E50]);"";['BenchBudEE.csv'.E50]) ->  | F125: of:=IF(ISBLANK(['BenchBudEE.csv'.F50]);"";['BenchBudEE.csv'.F50]) ->  | G125: of:=IF(ISNUMBER(SEARCH("[0-9]";[.A125]));MID([.A125];1;SEARCH("[0-9]";[.A125])-1);"") -> R
A126: of:=IF(ISBLANK(['BenchBudEE.csv'.A52]);"";['BenchBudEE.csv'.A52]) -> R17 | B126: of:=IF(ISBLANK(['BenchBudEE.csv'.B52]);"";['BenchBudEE.csv'.B52]) -> 3K | C126: of:=IF(ISBLANK(['BenchBudEE.csv'.C52]);"";['BenchBudEE.csv'.C52]) -> SMD_Packages:SM0805 | D126: of:=IF(ISBLANK(['BenchBudEE.csv'.D52]);"";['BenchBudEE.csv'.D52]) ->  | E126: of:=IF(ISBLANK(['BenchBudEE.csv'.E52]);"";['BenchBudEE.csv'.E52]) ->  | F126: of:=IF(ISBLANK(['BenchBudEE.csv'.F52]);"";['BenchBudEE.csv'.F52]) ->  | G126: of:=IF(ISNUMBER(SEARCH("[0-9]";[.A126]));MID([.A126];1;SEARCH("[0-9]";[.A126])-1);"") -> R
A127: of:=IF(ISBLANK(['BenchBudEE.csv'.A53]);"";['BenchBudEE.csv'.A53]) -> R12 | B127: of:=IF(ISBLANK(['BenchBudEE.csv'.B53]);"";['BenchBudEE.csv'.B53]) -> 3310C-1-502L | C127: of:=IF(ISBLANK(['BenchBudEE.csv'.C53]);"";['BenchBudEE.csv'.C53]) -> BenchBudEE:EVUE3K | D127: of:=IF(ISBLANK(['BenchBudEE.csv'.D53]);"";['BenchBudEE.csv'.D53]) ->  | E127: of:=IF(ISBLANK(['BenchBudEE.csv'.E53]);"";['BenchBudEE.csv'.E53]) ->  | F127: of:=IF(ISBLANK(['BenchBudEE.csv'.F53]);"";['BenchBudEE.csv'.F53]) ->  | G127: of:=IF(ISNUMBER(SEARCH("[0-9]";[.A127]));MID([.A127];1;SEARCH("[0-9]";[.A127])-1);"") -> R
A128: of:=IF(ISBLANK(['BenchBudEE.csv'.A54]);"";['BenchBudEE.csv'.A54]) -> R9 | B128: of:=IF(ISBLANK(['BenchBudEE.csv'.B54]);"";['BenchBudEE.csv'.B54]) -> 3310C-1-502L | C128: of:=IF(ISBLANK(['BenchBudEE.csv'.C54]);"";['BenchBudEE.csv'.C54]) -> BenchBudEE:EVUE3K | D128: of:=IF(ISBLANK(['BenchBudEE.csv'.D54]);"";['BenchBudEE.csv'.D54]) ->  | E128: of:=IF(ISBLANK(['BenchBudEE.csv'.E54]);"";['BenchBudEE.csv'.E54]) ->  | F128: of:=IF(ISBLANK(['BenchBudEE.csv'.F54]);"";['BenchBudEE.csv'.F54]) ->  | G128: of:=IF(ISNUMBER(SEARCH("[0-9]";[.A128]));MID([.A128];1;SEARCH("[0-9]";[.A128])-1);"") -> R
A129: of:=IF(ISBLANK(['BenchBudEE.csv'.A107]);"";['BenchBudEE.csv'.A107]) -> R25 | B129: of:=IF(ISBLANK(['BenchBudEE.csv'.B107]);"";['BenchBudEE.csv'.B107]) -> 5K | C129: of:=IF(ISBLANK(['BenchBudEE.csv'.C107]);"";['BenchBudEE.csv'.C107]) -> SMD_Packages:SM0805 | D129: of:=IF(ISBLANK(['BenchBudEE.csv'.D107]);"";['BenchBudEE.csv'.D107]) ->  | E129: of:=IF(ISBLANK(['BenchBudEE.csv'.E107]);"";['BenchBudEE.csv'.E107]) ->  | F129: of:=IF(ISBLANK(['BenchBudEE.csv'.F107]);"";['BenchBudEE.csv'.F107]) ->  | G129: of:=IF(ISNUMBER(SEARCH("[0-9]";[.A129]));MID([.A129];1;SEARCH("[0-9]";[.A129])-1);"") -> R
A130: of:=IF(ISBLANK(['BenchBudEE.csv'.A108]);"";['BenchBudEE.csv'.A108]) -> R27 | B130: of:=IF(ISBLANK(['BenchBudEE.csv'.B108]);"";['BenchBudEE.csv'.B108]) -> 5K | C130: of:=IF(ISBLANK(['BenchBudEE.csv'.C108]);"";['BenchBudEE.csv'.C108]) -> SMD_Packages:SM0805 | D130: of:=IF(ISBLANK(['BenchBudEE.csv'.D108]);"";['BenchBudEE.csv'.D108]) ->  | E130: of:=IF(ISBLANK(['BenchBudEE.csv'.E108]);"";['BenchBudEE.csv'.E108]) ->  | F130: of:=IF(ISBLANK(['BenchBudEE.csv'.F108]);"";['BenchBudEE.csv'.F108]) ->  | G130: of:=IF(ISNUMBER(SEARCH("[0-9]";[.A130]));MID([.A130];1;SEARCH("[0-9]";[.A130])-1);"") -> R
A131: of:=IF(ISBLANK(['BenchBudEE.csv'.A110]);"";['BenchBudEE.csv'.A110]) -> R21 | B131: of:=IF(ISBLANK(['BenchBudEE.csv'.B110]);"";['BenchBudEE.csv'.B110]) -> 5K | C131: of:=IF(ISBLANK(['BenchBudEE.csv'.C110]);"";['BenchBudEE.csv'.C110]) -> SMD_Packages:SM1206 | D131: of:=IF(ISBLANK(['BenchBudEE.csv'.D110]);"";['BenchBudEE.csv'.D110]) ->  | E131: of:=IF(ISBLANK(['BenchBudEE.csv'.E110]);"";['BenchBudEE.csv'.E110]) ->  | F131: of:=IF(ISBLANK(['BenchBudEE.csv'.F110]);"";['BenchBudEE.csv'.F110]) ->  | G131: of:=IF(ISNUMBER(SEARCH("[0-9]";[.A131]));MID([.A131];1;SEARCH("[0-9]";[.A131])-1);"") -> R
A132: of:=IF(ISBLANK(['BenchBudEE.csv'.A112]);"";['BenchBudEE.csv'.A112]) -> R22 | B132: of:=IF(ISBLANK(['BenchBudEE.csv'.B112]);"";['BenchBudEE.csv'.B112]) -> 5K | C132: of:=IF(ISBLANK(['BenchBudEE.csv'.C112]);"";['BenchBudEE.csv'.C112]) -> SMD_Packages:SM1206 | D132: of:=IF(ISBLANK(['BenchBudEE.csv'.D112]);"";['BenchBudEE.csv'.D112]) ->  | E132: of:=IF(ISBLANK(['BenchBudEE.csv'.E112]);"";['BenchBudEE.csv'.E112]) ->  | F132: of:=IF(ISBLANK(['BenchBudEE.csv'.F112]);"";['BenchBudEE.csv'.F112]) ->  | G132: of:=IF(ISNUMBER(SEARCH("[0-9]";[.A132]));MID([.A132];1;SEARCH("[0-9]";[.A132])-1);"") -> R
A133: of:=IF(ISBLANK(['BenchBudEE.csv'.A57]);"";['BenchBudEE.csv'.A57]) -> R52 | B133: of:=IF(ISBLANK(['BenchBudEE.csv'.B57]);"";['BenchBudEE.csv'.B57]) -> 9.1K | C133: of:=IF(ISBLANK(['BenchBudEE.csv'.C57]);"";['BenchBudEE.csv'.C57]) -> SMD_Packages:SM0805 | D133: of:=IF(ISBLANK(['BenchBudEE.csv'.D57]);"";['BenchBudEE.csv'.D57]) ->  | E133: of:=IF(ISBLANK(['BenchBudEE.csv'.E57]);"";['BenchBudEE.csv'.E57]) ->  | F133: of:=IF(ISBLANK(['BenchBudEE.csv'.F57]);"";['BenchBudEE.csv'.F57]) ->  | G133: of:=IF(ISNUMBER(SEARCH("[0-9]";[.A133]));MID([.A133];1;SEARCH("[0-9]";[.A133])-1);"") -> R
A134: of:=IF(ISBLANK(['BenchBudEE.csv'.A60]);"";['BenchBudEE.csv'.A60]) -> R53 | B134: of:=IF(ISBLANK(['BenchBudEE.csv'.B60]);"";['BenchBudEE.csv'.B60]) -> 9.1K | C134: of:=IF(ISBLANK(['BenchBudEE.csv'.C60]);"";['BenchBudEE.csv'.C60]) -> SMD_Packages:SM0805 | D134: of:=IF(ISBLANK(['BenchBudEE.csv'.D60]);"";['BenchBudEE.csv'.D60]) ->  | E134: of:=IF(ISBLANK(['BenchBudEE.csv'.E60]);"";['BenchBudEE.csv'.E60]) ->  | F134: of:=IF(ISBLANK(['BenchBudEE.csv'.F60]);"";['BenchBudEE.csv'.F60]) ->  | G134: of:=IF(ISNUMBER(SEARCH("[0-9]";[.A134]));MID([.A134];1;SEARCH("[0-9]";[.A134])-1);"") -> R
A135: of:=IF(ISBLANK(['BenchBudEE.csv'.A34]);"";['BenchBudEE.csv'.A34]) -> STAR1 | B135: of:=IF(ISBLANK(['BenchBudEE.csv'.B34]);"";['BenchBudEE.csv'.B34]) -> CONN_1 | C135: of:=IF(ISBLANK(['BenchBudEE.csv'.C34]);"";['BenchBudEE.csv'.C34]) -> Connect:1pin | D135: of:=IF(ISBLANK(['BenchBudEE.csv'.D34]);"";['BenchBudEE.csv'.D34]) ->  | E135: of:=IF(ISBLANK(['BenchBudEE.csv'.E34]);"";['BenchBudEE.csv'.E34]) ->  | F135: of:=IF(ISBLANK(['BenchBudEE.csv'.F34]);"";['BenchBudEE.csv'.F34]) ->  | G135: of:=IF(ISNUMBER(SEARCH("[0-9]";[.A135]));MID([.A135];1;SEARCH("[0-9]";[.A135])-1);"") -> STAR
A136: of:=IF(ISBLANK(['BenchBudEE.csv'.A22]);"";['BenchBudEE.csv'.A22]) -> SW1 | B136: of:=IF(ISBLANK(['BenchBudEE.csv'.B22]);"";['BenchBudEE.csv'.B22]) -> OS102011MA1QN1 | C136: of:=IF(ISBLANK(['BenchBudEE.csv'.C22]);"";['BenchBudEE.csv'.C22]) -> BenchBudEE:BB_switch | D136: of:=IF(ISBLANK(['BenchBudEE.csv'.D22]);"";['BenchBudEE.csv'.D22]) ->  | E136: of:=IF(ISBLANK(['BenchBudEE.csv'.E22]);"";['BenchBudEE.csv'.E22]) -> C&K Components | F136: of:=IF(ISBLANK(['BenchBudEE.csv'.F22]);"";['BenchBudEE.csv'.F22]) -> OS102011MA1QN1 | G136: of:=IF(ISNUMBER(SEARCH("[0-9]";[.A136]));MID([.A136];1;SEARCH("[0-9]";[.A136])-1);"") -> SW
A137: of:=IF(ISBLANK(['BenchBudEE.csv'.A27]);"";['BenchBudEE.csv'.A27]) -> TH1 | B137: of:=IF(ISBLANK(['BenchBudEE.csv'.B27]);"";['BenchBudEE.csv'.B27]) -> MINISMDC050F-2 | C137: of:=IF(ISBLANK(['BenchBudEE.csv'.C27]);"";['BenchBudEE.csv'.C27]) -> SMD_Packages:SM1812 | D137: of:=IF(ISBLANK(['BenchBudEE.csv'.D27]);"";['BenchBudEE.csv'.D27]) ->  | E137: of:=IF(ISBLANK(['BenchBudEE.csv'.E27]);"";['BenchBudEE.csv'.E27]) -> TE Connectivity | F137: of:=IF(ISBLANK(['BenchBudEE.csv'.F27]);"";['BenchBudEE.csv'.F27]) -> MINISMDC050F-2 | G137: of:=IF(ISNUMBER(SEARCH("[0-9]";[.A137]));MID([.A137];1;SEARCH("[0-9]";[.A137])-1);"") -> TH
A138: of:=IF(ISBLANK(['BenchBudEE.csv'.A28]);"";['BenchBudEE.csv'.A28]) -> TH2 | B138: of:=IF(ISBLANK(['BenchBudEE.csv'.B28]);"";['BenchBudEE.csv'.B28]) -> MINISMDC050F-2 | C138: of:=IF(ISBLANK(['BenchBudEE.csv'.C28]);"";['BenchBudEE.csv'.C28]) -> SMD_Packages:SM1812 | D138: of:=IF(ISBLANK(['BenchBudEE.csv'.D28]);"";['BenchBudEE.csv'.D28]) ->  | E138: of:=IF(ISBLANK(['BenchBudEE.csv'.E28]);"";['BenchBudEE.csv'.E28]) -> TE Connectivity | F138: of:=IF(ISBLANK(['BenchBudEE.csv'.F28]);"";['BenchBudEE.csv'.F28]) -> MINISMDC050F-2 | G138: of:=IF(ISNUMBER(SEARCH("[0-9]";[.A138]));MID([.A138];1;SEARCH("[0-9]";[.A138])-1);"") -> TH
A139: of:=IF(ISBLANK(['BenchBudEE.csv'.A29]);"";['BenchBudEE.csv'.A29]) -> TH3 | B139: of:=IF(ISBLANK(['BenchBudEE.csv'.B29]);"";['BenchBudEE.csv'.B29]) -> MINISMDC050F-2 | C139: of:=IF(ISBLANK(['BenchBudEE.csv'.C29]);"";['BenchBudEE.csv'.C29]) -> SMD_Packages:SM1812 | D139: of:=IF(ISBLANK(['BenchBudEE.csv'.D29]);"";['BenchBudEE.csv'.D29]) ->  | E139: of:=IF(ISBLANK(['BenchBudEE.csv'.E29]);"";['BenchBudEE.csv'.E29]) -> TE Connectivity | F139: of:=IF(ISBLANK(['BenchBudEE.csv'.F29]);"";['BenchBudEE.csv'.F29]) -> MINISMDC050F-2 | G139: of:=IF(ISNUMBER(SEARCH("[0-9]";[.A139]));MID([.A139];1;SEARCH("[0-9]";[.A139])-1);"") -> TH
A140: of:=IF(ISBLANK(['BenchBudEE.csv'.A30]);"";['BenchBudEE.csv'.A30]) -> TH4 | B140: of:=IF(ISBLANK(['BenchBudEE.csv'.B30]);"";['BenchBudEE.csv'.B30]) -> MINISMDC050F-2 | C140: of:=IF(ISBLANK(['BenchBudEE.csv'.C30]);"";['BenchBudEE.csv'.C30]) -> SMD_Packages:SM1812 | D140: of:=IF(ISBLANK(['BenchBudEE.csv'.D30]);"";['BenchBudEE.csv'.D30]) ->  | E140: of:=IF(ISBLANK(['BenchBudEE.csv'.E30]);"";['BenchBudEE.csv'.E30]) -> TE Connectivity | F140: of:=IF(ISBLANK(['BenchBudEE.csv'.F30]);"";['BenchBudEE.csv'.F30]) -> MINISMDC050F-2 | G140: of:=IF(ISNUMBER(SEARCH("[0-9]";[.A140]));MID([.A140];1;SEARCH("[0-9]";[.A140])-1);"") -> TH
A141: of:=IF(ISBLANK(['BenchBudEE.csv'.A93]);"";['BenchBudEE.csv'.A93]) -> TH5 | B141: of:=IF(ISBLANK(['BenchBudEE.csv'.B93]);"";['BenchBudEE.csv'.B93]) -> MINISMDC050F-2 | C141: of:=IF(ISBLANK(['BenchBudEE.csv'.C93]);"";['BenchBudEE.csv'.C93]) -> SMD_Packages:SM1812 | D141: of:=IF(ISBLANK(['BenchBudEE.csv'.D93]);"";['BenchBudEE.csv'.D93]) ->  | E141: of:=IF(ISBLANK(['BenchBudEE.csv'.E93]);"";['BenchBudEE.csv'.E93]) -> TE Connectivity | F141: of:=IF(ISBLANK(['BenchBudEE.csv'.F93]);"";['BenchBudEE.csv'.F93]) -> MINISMDC050F-2 | G141: of:=IF(ISNUMBER(SEARCH("[0-9]";[.A141]));MID([.A141];1;SEARCH("[0-9]";[.A141])-1);"") -> TH
A142: of:=IF(ISBLANK(['BenchBudEE.csv'.A14]);"";['BenchBudEE.csv'.A14]) -> TP1 | B142: of:=IF(ISBLANK(['BenchBudEE.csv'.B14]);"";['BenchBudEE.csv'.B14]) -> +12P | C142: of:=IF(ISBLANK(['BenchBudEE.csv'.C14]);"";['BenchBudEE.csv'.C14]) -> BenchBudEE:TestPointTH | D142: of:=IF(ISBLANK(['BenchBudEE.csv'.D14]);"";['BenchBudEE.csv'.D14]) ->  | E142: of:=IF(ISBLANK(['BenchBudEE.csv'.E14]);"";['BenchBudEE.csv'.E14]) ->  | F142: of:=IF(ISBLANK(['BenchBudEE.csv'.F14]);"";['BenchBudEE.csv'.F14]) ->  | G142: of:=IF(ISNUMBER(SEARCH("[0-9]";[.A142]));MID([.A142];1;SEARCH("[0-9]";[.A142])-1);"") -> TP
A143: of:=IF(ISBLANK(['BenchBudEE.csv'.A133]);"";['BenchBudEE.csv'.A133]) -> TP8 | B143: of:=IF(ISBLANK(['BenchBudEE.csv'.B133]);"";['BenchBudEE.csv'.B133]) -> +5V | C143: of:=IF(ISBLANK(['BenchBudEE.csv'.C133]);"";['BenchBudEE.csv'.C133]) -> BenchBudEE:TestPointTH | D143: of:=IF(ISBLANK(['BenchBudEE.csv'.D133]);"";['BenchBudEE.csv'.D133]) ->  | E143: of:=IF(ISBLANK(['BenchBudEE.csv'.E133]);"";['BenchBudEE.csv'.E133]) ->  | F143: of:=IF(ISBLANK(['BenchBudEE.csv'.F133]);"";['BenchBudEE.csv'.F133]) ->  | G143: of:=IF(ISNUMBER(SEARCH("[0-9]";[.A143]));MID([.A143];1;SEARCH("[0-9]";[.A143])-1);"") -> TP
A144: of:=IF(ISBLANK(['BenchBudEE.csv'.A89]);"";['BenchBudEE.csv'.A89]) -> TP3 | B144: of:=IF(ISBLANK(['BenchBudEE.csv'.B89]);"";['BenchBudEE.csv'.B89]) -> AGND | C144: of:=IF(ISBLANK(['BenchBudEE.csv'.C89]);"";['BenchBudEE.csv'.C89]) -> BenchBudEE:TestPointTH | D144: of:=IF(ISBLANK(['BenchBudEE.csv'.D89]);"";['BenchBudEE.csv'.D89]) ->  | E144: of:=IF(ISBLANK(['BenchBudEE.csv'.E89]);"";['BenchBudEE.csv'.E89]) ->  | F144: of:=IF(ISBLANK(['BenchBudEE.csv'.F89]);"";['BenchBudEE.csv'.F89]) ->  | G144: of:=IF(ISNUMBER(SEARCH("[0-9]";[.A144]));MID([.A144];1;SEARCH("[0-9]";[.A144])-1);"") -> TP
A145: of:=IF(ISBLANK(['BenchBudEE.csv'.A131]);"";['BenchBudEE.csv'.A131]) -> TP10 | B145: of:=IF(ISBLANK(['BenchBudEE.csv'.B131]);"";['BenchBudEE.csv'.B131]) -> CH0+ | C145: of:=IF(ISBLANK(['BenchBudEE.csv'.C131]);"";['BenchBudEE.csv'.C131]) -> BenchBudEE:TestPointTH | D145: of:=IF(ISBLANK(['BenchBudEE.csv'.D131]);"";['BenchBudEE.csv'.D131]) ->  | E145: of:=IF(ISBLANK(['BenchBudEE.csv'.E131]);"";['BenchBudEE.csv'.E131]) ->  | F145: of:=IF(ISBLANK(['BenchBudEE.csv'.F131]);"";['BenchBudEE.csv'.F131]) ->  | G145: of:=IF(ISNUMBER(SEARCH("[0-9]";[.A145]));MID([.A145];1;SEARCH("[0-9]";[.A145])-1);"") -> TP
A146: of:=IF(ISBLANK(['BenchBudEE.csv'.A132]);"";['BenchBudEE.csv'.A132]) -> TP9 | B146: of:=IF(ISBLANK(['BenchBudEE.csv'.B132]);"";['BenchBudEE.csv'.B132]) -> CH1+ | C146: of:=IF(ISBLANK(['BenchBudEE.csv'.C132]);"";['BenchBudEE.csv'.C132]) -> BenchBudEE:TestPointTH | D146: of:=IF(ISBLANK(['BenchBudEE.csv'.D132]);"";['BenchBudEE.csv'.D132]) ->  | E146: of:=IF(ISBLANK(['BenchBudEE.csv'.E132]);"";['BenchBudEE.csv'.E132]) ->  | F146: of:=IF(ISBLANK(['BenchBudEE.csv'.F132]);"";['BenchBudEE.csv'.F132]) ->  | G146: of:=IF(ISNUMBER(SEARCH("[0-9]";[.A146]));MID([.A146];1;SEARCH("[0-9]";[.A146])-1);"") -> TP
A147: of:=IF(ISBLANK(['BenchBudEE.csv'.A101]);"";['BenchBudEE.csv'.A101]) -> TP7 | B147: of:=IF(ISBLANK(['BenchBudEE.csv'.B101]);"";['BenchBudEE.csv'.B101]) -> DAC_OUT | C147: of:=IF(ISBLANK(['BenchBudEE.csv'.C101]);"";['BenchBudEE.csv'.C101]) -> BenchBudEE:TestPointTH | D147: of:=IF(ISBLANK(['BenchBudEE.csv'.D101]);"";['BenchBudEE.csv'.D101]) ->  | E147: of:=IF(ISBLANK(['BenchBudEE.csv'.E101]);"";['BenchBudEE.csv'.E101]) ->  | F147: of:=IF(ISBLANK(['BenchBudEE.csv'.F101]);"";['BenchBudEE.csv'.F101]) ->  | G147: of:=IF(ISNUMBER(SEARCH("[0-9]";[.A147]));MID([.A147];1;SEARCH("[0-9]";[.A147])-1);"") -> TP
A148: of:=IF(ISBLANK(['BenchBudEE.csv'.A86]);"";['BenchBudEE.csv'.A86]) -> TP6 | B148: of:=IF(ISBLANK(['BenchBudEE.csv'.B86]);"";['BenchBudEE.csv'.B86]) -> GND_PWR | C148: of:=IF(ISBLANK(['BenchBudEE.csv'.C86]);"";['BenchBudEE.csv'.C86]) -> BenchBudEE:TestPointTH | D148: of:=IF(ISBLANK(['BenchBudEE.csv'.D86]);"";['BenchBudEE.csv'.D86]) ->  | E148: of:=IF(ISBLANK(['BenchBudEE.csv'.E86]);"";['BenchBudEE.csv'.E86]) ->  | F148: of:=IF(ISBLANK(['BenchBudEE.csv'.F86]);"";['BenchBudEE.csv'.F86]) ->  | G148: of:=IF(ISNUMBER(SEARCH("[0-9]";[.A148]));MID([.A148];1;SEARCH("[0-9]";[.A148])-1);"") -> TP
A149: of:=IF(ISBLANK(['BenchBudEE.csv'.A13]);"";['BenchBudEE.csv'.A13]) -> TP2 | B149: of:=IF(ISBLANK(['BenchBudEE.csv'.B13]);"";['BenchBudEE.csv'.B13]) -> RLY_LOW | C149: of:=IF(ISBLANK(['BenchBudEE.csv'.C13]);"";['BenchBudEE.csv'.C13]) -> BenchBudEE:TestPointTH | D149: of:=IF(ISBLANK(['BenchBudEE.csv'.D13]);"";['BenchBudEE.csv'.D13]) ->  | E149: of:=IF(ISBLANK(['BenchBudEE.csv'.E13]);"";['BenchBudEE.csv'.E13]) ->  | F149: of:=IF(ISBLANK(['BenchBudEE.csv'.F13]);"";['BenchBudEE.csv'.F13]) ->  | G149: of:=IF(ISNUMBER(SEARCH("[0-9]";[.A149]));MID([.A149];1;SEARCH("[0-9]";[.A149])-1);"") -> TP
A150: of:=IF(ISBLANK(['BenchBudEE.csv'.A11]);"";['BenchBudEE.csv'.A11]) -> U1 | B150: of:=IF(ISBLANK(['BenchBudEE.csv'.B11]);"";['BenchBudEE.csv'.B11]) -> ACPL-217-500E | C150: of:=IF(ISBLANK(['BenchBudEE.csv'.C11]);"";['BenchBudEE.csv'.C11]) -> BenchBudEE:4-SMD | D150: of:=IF(ISBLANK(['BenchBudEE.csv'.D11]);"";['BenchBudEE.csv'.D11]) ->  | E150: of:=IF(ISBLANK(['BenchBudEE.csv'.E11]);"";['BenchBudEE.csv'.E11]) ->  | F150: of:=IF(ISBLANK(['BenchBudEE.csv'.F11]);"";['BenchBudEE.csv'.F11]) -> LTV-816S | G150: of:=IF(ISNUMBER(SEARCH("[0-9]";[.A150]));MID([.A150];1;SEARCH("[0-9]";[.A150])-1);"") -> U
A151: of:=IF(ISBLANK(['BenchBudEE.csv'.A47]);"";['BenchBudEE.csv'.A47]) -> U3 | B151: of:=IF(ISBLANK(['BenchBudEE.csv'.B47]);"";['BenchBudEE.csv'.B47]) -> LM317TG | C151: of:=IF(ISBLANK(['BenchBudEE.csv'.C47]);"";['BenchBudEE.csv'.C47]) -> Transistors_TO-220:TO-220_Neutral123_Vertical | D151: of:=IF(ISBLANK(['BenchBudEE.csv'.D47]);"";['BenchBudEE.csv'.D47]) ->  | E151: of:=IF(ISBLANK(['BenchBudEE.csv'.E47]);"";['BenchBudEE.csv'.E47]) ->  | F151: of:=IF(ISBLANK(['BenchBudEE.csv'.F47]);"";['BenchBudEE.csv'.F47]) ->  | G151: of:=IF(ISNUMBER(SEARCH("[0-9]";[.A151]));MID([.A151];1;SEARCH("[0-9]";[.A151])-1);"") -> U
A152: of:=IF(ISBLANK(['BenchBudEE.csv'.A55]);"";['BenchBudEE.csv'.A55]) -> U4 | B152: of:=IF(ISBLANK(['BenchBudEE.csv'.B55]);"";['BenchBudEE.csv'.B55]) -> LM317TG | C152: of:=IF(ISBLANK(['BenchBudEE.csv'.C55]);"";['BenchBudEE.csv'.C55]) -> Transistors_TO-220:TO-220_Neutral123_Vertical | D152: of:=IF(ISBLANK(['BenchBudEE.csv'.D55]);"";['BenchBudEE.csv'.D55]) ->  | E152: of:=IF(ISBLANK(['BenchBudEE.csv'.E55]);"";['BenchBudEE.csv'.E55]) ->  | F152: of:=IF(ISBLANK(['BenchBudEE.csv'.F55]);"";['BenchBudEE.csv'.F55]) ->  | G152: of:=IF(ISNUMBER(SEARCH("[0-9]";[.A152]));MID([.A152];1;SEARCH("[0-9]";[.A152])-1);"") -> U
A153: of:=IF(ISBLANK(['BenchBudEE.csv'.A61]);"";['BenchBudEE.csv'.A61]) -> U5 | B153: of:=IF(ISBLANK(['BenchBudEE.csv'.B61]);"";['BenchBudEE.csv'.B61]) -> LM337TG | C153: of:=IF(ISBLANK(['BenchBudEE.csv'.C61]);"";['BenchBudEE.csv'.C61]) -> Transistors_TO-220:TO-220_Neutral123_Vertical | D153: of:=IF(ISBLANK(['BenchBudEE.csv'.D61]);"";['BenchBudEE.csv'.D61]) ->  | E153: of:=IF(ISBLANK(['BenchBudEE.csv'.E61]);"";['BenchBudEE.csv'.E61]) ->  | F153: of:=IF(ISBLANK(['BenchBudEE.csv'.F61]);"";['BenchBudEE.csv'.F61]) ->  | G153: of:=IF(ISNUMBER(SEARCH("[0-9]";[.A153]));MID([.A153];1;SEARCH("[0-9]";[.A153])-1);"") -> U
A154: of:=IF(ISBLANK(['BenchBudEE.csv'.A58]);"";['BenchBudEE.csv'.A58]) -> U6 | B154: of:=IF(ISBLANK(['BenchBudEE.csv'.B58]);"";['BenchBudEE.csv'.B58]) -> LM337TG | C154: of:=IF(ISBLANK(['BenchBudEE.csv'.C58]);"";['BenchBudEE.csv'.C58]) -> Transistors_TO-220:TO-220_Neutral123_Vertical | D154: of:=IF(ISBLANK(['BenchBudEE.csv'.D58]);"";['BenchBudEE.csv'.D58]) ->  | E154: of:=IF(ISBLANK(['BenchBudEE.csv'.E58]);"";['BenchBudEE.csv'.E58]) ->  | F154: of:=IF(ISBLANK(['BenchBudEE.csv'.F58]);"";['BenchBudEE.csv'.F58]) ->  | G154: of:=IF(ISNUMBER(SEARCH("[0-9]";[.A154]));MID([.A154];1;SEARCH("[0-9]";[.A154])-1);"") -> U
A155: of:=IF(ISBLANK(['BenchBudEE.csv'.A119]);"";['BenchBudEE.csv'.A119]) -> U10 | B155: of:=IF(ISBLANK(['BenchBudEE.csv'.B119]);"";['BenchBudEE.csv'.B119]) -> LMT84DCKT | C155: of:=IF(ISBLANK(['BenchBudEE.csv'.C119]);"";['BenchBudEE.csv'.C119]) -> SMD_Packages:SOT353 | D155: of:=IF(ISBLANK(['BenchBudEE.csv'.D119]);"";['BenchBudEE.csv'.D119]) ->  | E155: of:=IF(ISBLANK(['BenchBudEE.csv'.E119]);"";['BenchBudEE.csv'.E119]) ->  | F155: of:=IF(ISBLANK(['BenchBudEE.csv'.F119]);"";['BenchBudEE.csv'.F119]) ->  | G155: of:=IF(ISNUMBER(SEARCH("[0-9]";[.A155]));MID([.A155];1;SEARCH("[0-9]";[.A155])-1);"") -> U
A156: of:=IF(ISBLANK(['BenchBudEE.csv'.A113]);"";['BenchBudEE.csv'.A113]) -> U9 | B156: of:=IF(ISBLANK(['BenchBudEE.csv'.B113]);"";['BenchBudEE.csv'.B113]) -> MCP3901A0-I/SS | C156: of:=IF(ISBLANK(['BenchBudEE.csv'.C113]);"";['BenchBudEE.csv'.C113]) -> SMD_Packages:SSOP20 | D156: of:=IF(ISBLANK(['BenchBudEE.csv'.D113]);"";['BenchBudEE.csv'.D113]) ->  | E156: of:=IF(ISBLANK(['BenchBudEE.csv'.E113]);"";['BenchBudEE.csv'.E113]) ->  | F156: of:=IF(ISBLANK(['BenchBudEE.csv'.F113]);"";['BenchBudEE.csv'.F113]) ->  | G156: of:=IF(ISNUMBER(SEARCH("[0-9]";[.A156]));MID([.A156];1;SEARCH("[0-9]";[.A156])-1);"") -> U
A157: of:=IF(ISBLANK(['BenchBudEE.csv'.A95]);"";['BenchBudEE.csv'.A95]) -> U8 | B157: of:=IF(ISBLANK(['BenchBudEE.csv'.B95]);"";['BenchBudEE.csv'.B95]) -> MCP4801-E/SN | C157: of:=IF(ISBLANK(['BenchBudEE.csv'.C95]);"";['BenchBudEE.csv'.C95]) -> SMD_Packages:SO8N | D157: of:=IF(ISBLANK(['BenchBudEE.csv'.D95]);"";['BenchBudEE.csv'.D95]) ->  | E157: of:=IF(ISBLANK(['BenchBudEE.csv'.E95]);"";['BenchBudEE.csv'.E95]) ->  | F157: of:=IF(ISBLANK(['BenchBudEE.csv'.F95]);"";['BenchBudEE.csv'.F95]) ->  | G157: of:=IF(ISNUMBER(SEARCH("[0-9]";[.A157]));MID([.A157];1;SEARCH("[0-9]";[.A157])-1);"") -> U
A158: of:=IF(ISBLANK(['BenchBudEE.csv'.A90]);"";['BenchBudEE.csv'.A90]) -> U11 | B158: of:=IF(ISBLANK(['BenchBudEE.csv'.B90]);"";['BenchBudEE.csv'.B90]) -> OPA4170AID | C158: of:=IF(ISBLANK(['BenchBudEE.csv'.C90]);"";['BenchBudEE.csv'.C90]) -> SMD_Packages:SO14E | D158: of:=IF(ISBLANK(['BenchBudEE.csv'.D90]);"";['BenchBudEE.csv'.D90]) ->  | E158: of:=IF(ISBLANK(['BenchBudEE.csv'.E90]);"";['BenchBudEE.csv'.E90]) ->  | F158: of:=IF(ISBLANK(['BenchBudEE.csv'.F90]);"";['BenchBudEE.csv'.F90]) ->  | G158: of:=IF(ISNUMBER(SEARCH("[0-9]";[.A158]));MID([.A158];1;SEARCH("[0-9]";[.A158])-1);"") -> U
A159: of:=IF(ISBLANK(['BenchBudEE.csv'.A15]);"";['BenchBudEE.csv'.A15]) -> U2 | B159: of:=IF(ISBLANK(['BenchBudEE.csv'.B15]);"";['BenchBudEE.csv'.B15]) -> TS19371CX6 RF | C159: of:=IF(ISBLANK(['BenchBudEE.csv'.C15]);"";['BenchBudEE.csv'.C15]) -> SMD_Packages:SOT23_6 | D159: of:=IF(ISBLANK(['BenchBudEE.csv'.D15]);"";['BenchBudEE.csv'.D15]) ->  | E159: of:=IF(ISBLANK(['BenchBudEE.csv'.E15]);"";['BenchBudEE.csv'.E15]) ->  | F159: of:=IF(ISBLANK(['BenchBudEE.csv'.F15]);"";['BenchBudEE.csv'.F15]) ->  | G159: of:=IF(ISNUMBER(SEARCH("[0-9]";[.A159]));MID([.A159];1;SEARCH("[0-9]";[.A159])-1);"") -> U
A160: of:=IF(ISBLANK(['BenchBudEE.csv'.A160]);"";['BenchBudEE.csv'.A160]) ->  | B160: of:=IF(ISBLANK(['BenchBudEE.csv'.B160]);"";['BenchBudEE.csv'.B160]) ->  | C160: of:=IF(ISBLANK(['BenchBudEE.csv'.C295]);"";MID(['BenchBudEE.csv'.C295];SEARCH(":";['BenchBudEE.csv'.C295])+1;100)) ->  | D160: of:=IF(ISBLANK(['BenchBudEE.csv'.D160]);"";['BenchBudEE.csv'.D160]) ->  | E160: of:=IF(ISBLANK(['BenchBudEE.csv'.E160]);"";['BenchBudEE.csv'.E160]) ->  | F160: of:=IF(ISBLANK(['BenchBudEE.csv'.F160]);"";['BenchBudEE.csv'.F160]) ->  | G160: of:=IF(ISNUMBER(SEARCH("[0-9]";[.A160]));MID([.A160];1;SEARCH("[0-9]";[.A160])-1);"") -> 
A161: of:=IF(ISBLANK(['BenchBudEE.csv'.A161]);"";['BenchBudEE.csv'.A161]) ->  | B161: of:=IF(ISBLANK(['BenchBudEE.csv'.B161]);"";['BenchBudEE.csv'.B161]) ->  | C161: of:=IF(ISBLANK(['BenchBudEE.csv'.C296]);"";MID(['BenchBudEE.csv'.C296];SEARCH(":";['BenchBudEE.csv'.C296])+1;100)) ->  | D161: of:=IF(ISBLANK(['BenchBudEE.csv'.D161]);"";['BenchBudEE.csv'.D161]) ->  | E161: of:=IF(ISBLANK(['BenchBudEE.csv'.E161]);"";['BenchBudEE.csv'.E161]) ->  | F161: of:=IF(ISBLANK(['BenchBudEE.csv'.F161]);"";['BenchBudEE.csv'.F161]) ->  | G161: of:=IF(ISNUMBER(SEARCH("[0-9]";[.A161]));MID([.A161];1;SEARCH("[0-9]";[.A161])-1);"") -> 
A162: of:=IF(ISBLANK(['BenchBudEE.csv'.A162]);"";['BenchBudEE.csv'.A162]) ->  | B162: of:=IF(ISBLANK(['BenchBudEE.csv'.B162]);"";['BenchBudEE.csv'.B162]) ->  | C162: of:=IF(ISBLANK(['BenchBudEE.csv'.C297]);"";MID(['BenchBudEE.csv'.C297];SEARCH(":";['BenchBudEE.csv'.C297])+1;100)) ->  | D162: of:=IF(ISBLANK(['BenchBudEE.csv'.D162]);"";['BenchBudEE.csv'.D162]) ->  | E162: of:=IF(ISBLANK(['BenchBudEE.csv'.E162]);"";['BenchBudEE.csv'.E162]) ->  | F162: of:=IF(ISBLANK(['BenchBudEE.csv'.F162]);"";['BenchBudEE.csv'.F162]) ->  | G162: of:=IF(ISNUMBER(SEARCH("[0-9]";[.A162]));MID([.A162];1;SEARCH("[0-9]";[.A162])-1);"") -> 
A163: of:=IF(ISBLANK(['BenchBudEE.csv'.A163]);"";['BenchBudEE.csv'.A163]) ->  | B163: of:=IF(ISBLANK(['BenchBudEE.csv'.B163]);"";['BenchBudEE.csv'.B163]) ->  | C163: of:=IF(ISBLANK(['BenchBudEE.csv'.C298]);"";MID(['BenchBudEE.csv'.C298];SEARCH(":";['BenchBudEE.csv'.C298])+1;100)) ->  | D163: of:=IF(ISBLANK(['BenchBudEE.csv'.D163]);"";['BenchBudEE.csv'.D163]) ->  | E163: of:=IF(ISBLANK(['BenchBudEE.csv'.E163]);"";['BenchBudEE.csv'.E163]) ->  | F163: of:=IF(ISBLANK(['BenchBudEE.csv'.F163]);"";['BenchBudEE.csv'.F163]) ->  | G163: of:=IF(ISNUMBER(SEARCH("[0-9]";[.A163]));MID([.A163];1;SEARCH("[0-9]";[.A163])-1);"") -> 
A164: of:=IF(ISBLANK(['BenchBudEE.csv'.A164]);"";['BenchBudEE.csv'.A164]) ->  | B164: of:=IF(ISBLANK(['BenchBudEE.csv'.B164]);"";['BenchBudEE.csv'.B164]) ->  | C164: of:=IF(ISBLANK(['BenchBudEE.csv'.C299]);"";MID(['BenchBudEE.csv'.C299];SEARCH(":";['BenchBudEE.csv'.C299])+1;100)) ->  | D164: of:=IF(ISBLANK(['BenchBudEE.csv'.D164]);"";['BenchBudEE.csv'.D164]) ->  | E164: of:=IF(ISBLANK(['BenchBudEE.csv'.E164]);"";['BenchBudEE.csv'.E164]) ->  | F164: of:=IF(ISBLANK(['BenchBudEE.csv'.F164]);"";['BenchBudEE.csv'.F164]) ->  | G164: of:=IF(ISNUMBER(SEARCH("[0-9]";[.A164]));MID([.A164];1;SEARCH("[0-9]";[.A164])-1);"") -> 
A165: of:=IF(ISBLANK(['BenchBudEE.csv'.A165]);"";['BenchBudEE.csv'.A165]) ->  | B165: of:=IF(ISBLANK(['BenchBudEE.csv'.B165]);"";['BenchBudEE.csv'.B165]) ->  | C165: of:=IF(ISBLANK(['BenchBudEE.csv'.C300]);"";MID(['BenchBudEE.csv'.C300];SEARCH(":";['BenchBudEE.csv'.C300])+1;100)) ->  | D165: of:=IF(ISBLANK(['BenchBudEE.csv'.D165]);"";['BenchBudEE.csv'.D165]) ->  | E165: of:=IF(ISBLANK(['BenchBudEE.csv'.E165]);"";['BenchBudEE.csv'.E165]) ->  | F165: of:=IF(ISBLANK(['BenchBudEE.csv'.F165]);"";['BenchBudEE.csv'.F165]) ->  | G165: of:=IF(ISNUMBER(SEARCH("[0-9]";[.A165]));MID([.A165];1;SEARCH("[0-9]";[.A165])-1);"") -> 
A166: of:=IF(ISBLANK(['BenchBudEE.csv'.A166]);"";['BenchBudEE.csv'.A166]) ->  | B166: of:=IF(ISBLANK(['BenchBudEE.csv'.B166]);"";['BenchBudEE.csv'.B166]) ->  | C166: of:=IF(ISBLANK(['BenchBudEE.csv'.C301]);"";MID(['BenchBudEE.csv'.C301];SEARCH(":";['BenchBudEE.csv'.C301])+1;100)) ->  | D166: of:=IF(ISBLANK(['BenchBudEE.csv'.D166]);"";['BenchBudEE.csv'.D166]) ->  | E166: of:=IF(ISBLANK(['BenchBudEE.csv'.E166]);"";['BenchBudEE.csv'.E166]) ->  | F166: of:=IF(ISBLANK(['BenchBudEE.csv'.F166]);"";['BenchBudEE.csv'.F166]) ->  | G166: of:=IF(ISNUMBER(SEARCH("[0-9]";[.A166]));MID([.A166];1;SEARCH("[0-9]";[.A166])-1);"") -> 
A167: of:=IF(ISBLANK(['BenchBudEE.csv'.A167]);"";['BenchBudEE.csv'.A167]) ->  | B167: of:=IF(ISBLANK(['BenchBudEE.csv'.B167]);"";['BenchBudEE.csv'.B167]) ->  | C167: of:=IF(ISBLANK(['BenchBudEE.csv'.C302]);"";MID(['BenchBudEE.csv'.C302];SEARCH(":";['BenchBudEE.csv'.C302])+1;100)) ->  | D167: of:=IF(ISBLANK(['BenchBudEE.csv'.D167]);"";['BenchBudEE.csv'.D167]) ->  | E167: of:=IF(ISBLANK(['BenchBudEE.csv'.E167]);"";['BenchBudEE.csv'.E167]) ->  | F167: of:=IF(ISBLANK(['BenchBudEE.csv'.F167]);"";['BenchBudEE.csv'.F167]) ->  | G167: of:=IF(ISNUMBER(SEARCH("[0-9]";[.A167]));MID([.A167];1;SEARCH("[0-9]";[.A167])-1);"") -> 
A168: of:=IF(ISBLANK(['BenchBudEE.csv'.A168]);"";['BenchBudEE.csv'.A168]) ->  | B168: of:=IF(ISBLANK(['BenchBudEE.csv'.B168]);"";['BenchBudEE.csv'.B168]) ->  | C168: of:=IF(ISBLANK(['BenchBudEE.csv'.C303]);"";MID(['BenchBudEE.csv'.C303];SEARCH(":";['BenchBudEE.csv'.C303])+1;100)) ->  | D168: of:=IF(ISBLANK(['BenchBudEE.csv'.D168]);"";['BenchBudEE.csv'.D168]) ->  | E168: of:=IF(ISBLANK(['BenchBudEE.csv'.E168]);"";['BenchBudEE.csv'.E168]) ->  | F168: of:=IF(ISBLANK(['BenchBudEE.csv'.F168]);"";['BenchBudEE.csv'.F168]) ->  | G168: of:=IF(ISNUMBER(SEARCH("[0-9]";[.A168]));MID([.A168];1;SEARCH("[0-9]";[.A168])-1);"") -> 
A169: of:=IF(ISBLANK(['BenchBudEE.csv'.A169]);"";['BenchBudEE.csv'.A169]) ->  | B169: of:=IF(ISBLANK(['BenchBudEE.csv'.B169]);"";['BenchBudEE.csv'.B169]) ->  | C169: of:=IF(ISBLANK(['BenchBudEE.csv'.C304]);"";MID(['BenchBudEE.csv'.C304];SEARCH(":";['BenchBudEE.csv'.C304])+1;100)) ->  | D169: of:=IF(ISBLANK(['BenchBudEE.csv'.D169]);"";['BenchBudEE.csv'.D169]) ->  | E169: of:=IF(ISBLANK(['BenchBudEE.csv'.E169]);"";['BenchBudEE.csv'.E169]) ->  | F169: of:=IF(ISBLANK(['BenchBudEE.csv'.F169]);"";['BenchBudEE.csv'.F169]) ->  | G169: of:=IF(ISNUMBER(SEARCH("[0-9]";[.A169]));MID([.A169];1;SEARCH("[0-9]";[.A169])-1);"") -> 
A170: of:=IF(ISBLANK(['BenchBudEE.csv'.A170]);"";['BenchBudEE.csv'.A170]) ->  | B170: of:=IF(ISBLANK(['BenchBudEE.csv'.B170]);"";['BenchBudEE.csv'.B170]) ->  | C170: of:=IF(ISBLANK(['BenchBudEE.csv'.C305]);"";MID(['BenchBudEE.csv'.C305];SEARCH(":";['BenchBudEE.csv'.C305])+1;100)) ->  | D170: of:=IF(ISBLANK(['BenchBudEE.csv'.D170]);"";['BenchBudEE.csv'.D170]) ->  | E170: of:=IF(ISBLANK(['BenchBudEE.csv'.E170]);"";['BenchBudEE.csv'.E170]) ->  | F170: of:=IF(ISBLANK(['BenchBudEE.csv'.F170]);"";['BenchBudEE.csv'.F170]) ->  | G170: of:=IF(ISNUMBER(SEARCH("[0-9]";[.A170]));MID([.A170];1;SEARCH("[0-9]";[.A170])-1);"") -> 
A171: of:=IF(ISBLANK(['BenchBudEE.csv'.A171]);"";['BenchBudEE.csv'.A171]) ->  | B171: of:=IF(ISBLANK(['BenchBudEE.csv'.B171]);"";['BenchBudEE.csv'.B171]) ->  | C171: of:=IF(ISBLANK(['BenchBudEE.csv'.C306]);"";MID(['BenchBudEE.csv'.C306];SEARCH(":";['BenchBudEE.csv'.C306])+1;100)) ->  | D171: of:=IF(ISBLANK(['BenchBudEE.csv'.D171]);"";['BenchBudEE.csv'.D171]) ->  | E171: of:=IF(ISBLANK(['BenchBudEE.csv'.E171]);"";['BenchBudEE.csv'.E171]) ->  | F171: of:=IF(ISBLANK(['BenchBudEE.csv'.F171]);"";['BenchBudEE.csv'.F171]) ->  | G171: of:=IF(ISNUMBER(SEARCH("[0-9]";[.A171]));MID([.A171];1;SEARCH("[0-9]";[.A171])-1);"") -> 
A172: of:=IF(ISBLANK(['BenchBudEE.csv'.A172]);"";['BenchBudEE.csv'.A172]) ->  | B172: of:=IF(ISBLANK(['BenchBudEE.csv'.B172]);"";['BenchBudEE.csv'.B172]) ->  | C172: of:=IF(ISBLANK(['BenchBudEE.csv'.C307]);"";MID(['BenchBudEE.csv'.C307];SEARCH(":";['BenchBudEE.csv'.C307])+1;100)) ->  | D172: of:=IF(ISBLANK(['BenchBudEE.csv'.D172]);"";['BenchBudEE.csv'.D172]) ->  | E172: of:=IF(ISBLANK(['BenchBudEE.csv'.E172]);"";['BenchBudEE.csv'.E172]) ->  | F172: of:=IF(ISBLANK(['BenchBudEE.csv'.F172]);"";['BenchBudEE.csv'.F172]) ->  | G172: of:=IF(ISNUMBER(SEARCH("[0-9]";[.A172]));MID([.A172];1;SEARCH("[0-9]";[.A172])-1);"") -> 
A173: of:=IF(ISBLANK(['BenchBudEE.csv'.A173]);"";['BenchBudEE.csv'.A173]) ->  | B173: of:=IF(ISBLANK(['BenchBudEE.csv'.B173]);"";['BenchBudEE.csv'.B173]) ->  | C173: of:=IF(ISBLANK(['BenchBudEE.csv'.C308]);"";MID(['BenchBudEE.csv'.C308];SEARCH(":";['BenchBudEE.csv'.C308])+1;100)) ->  | D173: of:=IF(ISBLANK(['BenchBudEE.csv'.D173]);"";['BenchBudEE.csv'.D173]) ->  | E173: of:=IF(ISBLANK(['BenchBudEE.csv'.E173]);"";['BenchBudEE.csv'.E173]) ->  | F173: of:=IF(ISBLANK(['BenchBudEE.csv'.F173]);"";['BenchBudEE.csv'.F173]) ->  | G173: of:=IF(ISNUMBER(SEARCH("[0-9]";[.A173]));MID([.A173];1;SEARCH("[0-9]";[.A173])-1);"") -> 
A174: of:=IF(ISBLANK(['BenchBudEE.csv'.A174]);"";['BenchBudEE.csv'.A174]) ->  | B174: of:=IF(ISBLANK(['BenchBudEE.csv'.B174]);"";['BenchBudEE.csv'.B174]) ->  | C174: of:=IF(ISBLANK(['BenchBudEE.csv'.C309]);"";MID(['BenchBudEE.csv'.C309];SEARCH(":";['BenchBudEE.csv'.C309])+1;100)) ->  | D174: of:=IF(ISBLANK(['BenchBudEE.csv'.D174]);"";['BenchBudEE.csv'.D174]) ->  | E174: of:=IF(ISBLANK(['BenchBudEE.csv'.E174]);"";['BenchBudEE.csv'.E174]) ->  | F174: of:=IF(ISBLANK(['BenchBudEE.csv'.F174]);"";['BenchBudEE.csv'.F174]) ->  | G174: of:=IF(ISNUMBER(SEARCH("[0-9]";[.A174]));MID([.A174];1;SEARCH("[0-9]";[.A174])-1);"") -> 
A175: of:=IF(ISBLANK(['BenchBudEE.csv'.A175]);"";['BenchBudEE.csv'.A175]) ->  | B175: of:=IF(ISBLANK(['BenchBudEE.csv'.B175]);"";['BenchBudEE.csv'.B175]) ->  | C175: of:=IF(ISBLANK(['BenchBudEE.csv'.C310]);"";MID(['BenchBudEE.csv'.C310];SEARCH(":";['BenchBudEE.csv'.C310])+1;100)) ->  | D175: of:=IF(ISBLANK(['BenchBudEE.csv'.D175]);"";['BenchBudEE.csv'.D175]) ->  | E175: of:=IF(ISBLANK(['BenchBudEE.csv'.E175]);"";['BenchBudEE.csv'.E175]) ->  | F175: of:=IF(ISBLANK(['BenchBudEE.csv'.F175]);"";['BenchBudEE.csv'.F175]) ->  | G175: of:=IF(ISNUMBER(SEARCH("[0-9]";[.A175]));MID([.A175];1;SEARCH("[0-9]";[.A175])-1);"") -> 
A176: of:=IF(ISBLANK(['BenchBudEE.csv'.A176]);"";['BenchBudEE.csv'.A176]) ->  | B176: of:=IF(ISBLANK(['BenchBudEE.csv'.B176]);"";['BenchBudEE.csv'.B176]) ->  | C176: of:=IF(ISBLANK(['BenchBudEE.csv'.C311]);"";MID(['BenchBudEE.csv'.C311];SEARCH(":";['BenchBudEE.csv'.C311])+1;100)) ->  | D176: of:=IF(ISBLANK(['BenchBudEE.csv'.D176]);"";['BenchBudEE.csv'.D176]) ->  | E176: of:=IF(ISBLANK(['BenchBudEE.csv'.E176]);"";['BenchBudEE.csv'.E176]) ->  | F176: of:=IF(ISBLANK(['BenchBudEE.csv'.F176]);"";['BenchBudEE.csv'.F176]) ->  | G176: of:=IF(ISNUMBER(SEARCH("[0-9]";[.A176]));MID([.A176];1;SEARCH("[0-9]";[.A176])-1);"") -> 
A177: of:=IF(ISBLANK(['BenchBudEE.csv'.A177]);"";['BenchBudEE.csv'.A177]) ->  | B177: of:=IF(ISBLANK(['BenchBudEE.csv'.B177]);"";['BenchBudEE.csv'.B177]) ->  | C177: of:=IF(ISBLANK(['BenchBudEE.csv'.C312]);"";MID(['BenchBudEE.csv'.C312];SEARCH(":";['BenchBudEE.csv'.C312])+1;100)) ->  | D177: of:=IF(ISBLANK(['BenchBudEE.csv'.D177]);"";['BenchBudEE.csv'.D177]) ->  | E177: of:=IF(ISBLANK(['BenchBudEE.csv'.E177]);"";['BenchBudEE.csv'.E177]) ->  | F177: of:=IF(ISBLANK(['BenchBudEE.csv'.F177]);"";['BenchBudEE.csv'.F177]) ->  | G177: of:=IF(ISNUMBER(SEARCH("[0-9]";[.A177]));MID([.A177];1;SEARCH("[0-9]";[.A177])-1);"") -> 
A178: of:=IF(ISBLANK(['BenchBudEE.csv'.A178]);"";['BenchBudEE.csv'.A178]) ->  | B178: of:=IF(ISBLANK(['BenchBudEE.csv'.B178]);"";['BenchBudEE.csv'.B178]) ->  | C178: of:=IF(ISBLANK(['BenchBudEE.csv'.C313]);"";MID(['BenchBudEE.csv'.C313];SEARCH(":";['BenchBudEE.csv'.C313])+1;100)) ->  | D178: of:=IF(ISBLANK(['BenchBudEE.csv'.D178]);"";['BenchBudEE.csv'.D178]) ->  | E178: of:=IF(ISBLANK(['BenchBudEE.csv'.E178]);"";['BenchBudEE.csv'.E178]) ->  | F178: of:=IF(ISBLANK(['BenchBudEE.csv'.F178]);"";['BenchBudEE.csv'.F178]) ->  | G178: of:=IF(ISNUMBER(SEARCH("[0-9]";[.A178]));MID([.A178];1;SEARCH("[0-9]";[.A178])-1);"") -> 
A179: of:=IF(ISBLANK(['BenchBudEE.csv'.A179]);"";['BenchBudEE.csv'.A179]) ->  | B179: of:=IF(ISBLANK(['BenchBudEE.csv'.B179]);"";['BenchBudEE.csv'.B179]) ->  | C179: of:=IF(ISBLANK(['BenchBudEE.csv'.C314]);"";MID(['BenchBudEE.csv'.C314];SEARCH(":";['BenchBudEE.csv'.C314])+1;100)) ->  | D179: of:=IF(ISBLANK(['BenchBudEE.csv'.D179]);"";['BenchBudEE.csv'.D179]) ->  | E179: of:=IF(ISBLANK(['BenchBudEE.csv'.E179]);"";['BenchBudEE.csv'.E179]) ->  | F179: of:=IF(ISBLANK(['BenchBudEE.csv'.F179]);"";['BenchBudEE.csv'.F179]) ->  | G179: of:=IF(ISNUMBER(SEARCH("[0-9]";[.A179]));MID([.A179];1;SEARCH("[0-9]";[.A179])-1);"") -> 
A180: of:=IF(ISBLANK(['BenchBudEE.csv'.A180]);"";['BenchBudEE.csv'.A180]) ->  | B180: of:=IF(ISBLANK(['BenchBudEE.csv'.B180]);"";['BenchBudEE.csv'.B180]) ->  | C180: of:=IF(ISBLANK(['BenchBudEE.csv'.C315]);"";MID(['BenchBudEE.csv'.C315];SEARCH(":";['BenchBudEE.csv'.C315])+1;100)) ->  | D180: of:=IF(ISBLANK(['BenchBudEE.csv'.D180]);"";['BenchBudEE.csv'.D180]) ->  | E180: of:=IF(ISBLANK(['BenchBudEE.csv'.E180]);"";['BenchBudEE.csv'.E180]) ->  | F180: of:=IF(ISBLANK(['BenchBudEE.csv'.F180]);"";['BenchBudEE.csv'.F180]) ->  | G180: of:=IF(ISNUMBER(SEARCH("[0-9]";[.A180]));MID([.A180];1;SEARCH("[0-9]";[.A180])-1);"") -> 
A181: of:=IF(ISBLANK(['BenchBudEE.csv'.A181]);"";['BenchBudEE.csv'.A181]) ->  | B181: of:=IF(ISBLANK(['BenchBudEE.csv'.B181]);"";['BenchBudEE.csv'.B181]) ->  | C181: of:=IF(ISBLANK(['BenchBudEE.csv'.C316]);"";MID(['BenchBudEE.csv'.C316];SEARCH(":";['BenchBudEE.csv'.C316])+1;100)) ->  | D181: of:=IF(ISBLANK(['BenchBudEE.csv'.D181]);"";['BenchBudEE.csv'.D181]) ->  | E181: of:=IF(ISBLANK(['BenchBudEE.csv'.E181]);"";['BenchBudEE.csv'.E181]) ->  | F181: of:=IF(ISBLANK(['BenchBudEE.csv'.F181]);"";['BenchBudEE.csv'.F181]) ->  | G181: of:=IF(ISNUMBER(SEARCH("[0-9]";[.A181]));MID([.A181];1;SEARCH("[0-9]";[.A181])-1);"") -> 
A182: of:=IF(ISBLANK(['BenchBudEE.csv'.A182]);"";['BenchBudEE.csv'.A182]) ->  | B182: of:=IF(ISBLANK(['BenchBudEE.csv'.B182]);"";['BenchBudEE.csv'.B182]) ->  | C182: of:=IF(ISBLANK(['BenchBudEE.csv'.C317]);"";MID(['BenchBudEE.csv'.C317];SEARCH(":";['BenchBudEE.csv'.C317])+1;100)) ->  | D182: of:=IF(ISBLANK(['BenchBudEE.csv'.D182]);"";['BenchBudEE.csv'.D182]) ->  | E182: of:=IF(ISBLANK(['BenchBudEE.csv'.E182]);"";['BenchBudEE.csv'.E182]) ->  | F182: of:=IF(ISBLANK(['BenchBudEE.csv'.F182]);"";['BenchBudEE.csv'.F182]) ->  | G182: of:=IF(ISNUMBER(SEARCH("[0-9]";[.A182]));MID([.A182];1;SEARCH("[0-9]";[.A182])-1);"") -> 
A183: of:=IF(ISBLANK(['BenchBudEE.csv'.A183]);"";['BenchBudEE.csv'.A183]) ->  | B183: of:=IF(ISBLANK(['BenchBudEE.csv'.B183]);"";['BenchBudEE.csv'.B183]) ->  | C183: of:=IF(ISBLANK(['BenchBudEE.csv'.C318]);"";MID(['BenchBudEE.csv'.C318];SEARCH(":";['BenchBudEE.csv'.C318])+1;100)) ->  | D183: of:=IF(ISBLANK(['BenchBudEE.csv'.D183]);"";['BenchBudEE.csv'.D183]) ->  | E183: of:=IF(ISBLANK(['BenchBudEE.csv'.E183]);"";['BenchBudEE.csv'.E183]) ->  | F183: of:=IF(ISBLANK(['BenchBudEE.csv'.F183]);"";['BenchBudEE.csv'.F183]) ->  | G183: of:=IF(ISNUMBER(SEARCH("[0-9]";[.A183]));MID([.A183];1;SEARCH("[0-9]";[.A183])-1);"") -> 
A184: of:=IF(ISBLANK(['BenchBudEE.csv'.A184]);"";['BenchBudEE.csv'.A184]) ->  | B184: of:=IF(ISBLANK(['BenchBudEE.csv'.B184]);"";['BenchBudEE.csv'.B184]) ->  | C184: of:=IF(ISBLANK(['BenchBudEE.csv'.C319]);"";MID(['BenchBudEE.csv'.C319];SEARCH(":";['BenchBudEE.csv'.C319])+1;100)) ->  | D184: of:=IF(ISBLANK(['BenchBudEE.csv'.D184]);"";['BenchBudEE.csv'.D184]) ->  | E184: of:=IF(ISBLANK(['BenchBudEE.csv'.E184]);"";['BenchBudEE.csv'.E184]) ->  | F184: of:=IF(ISBLANK(['BenchBudEE.csv'.F184]);"";['BenchBudEE.csv'.F184]) ->  | G184: of:=IF(ISNUMBER(SEARCH("[0-9]";[.A184]));MID([.A184];1;SEARCH("[0-9]";[.A184])-1);"") -> 
A185: of:=IF(ISBLANK(['BenchBudEE.csv'.A185]);"";['BenchBudEE.csv'.A185]) ->  | B185: of:=IF(ISBLANK(['BenchBudEE.csv'.B185]);"";['BenchBudEE.csv'.B185]) ->  | C185: of:=IF(ISBLANK(['BenchBudEE.csv'.C320]);"";MID(['BenchBudEE.csv'.C320];SEARCH(":";['BenchBudEE.csv'.C320])+1;100)) ->  | D185: of:=IF(ISBLANK(['BenchBudEE.csv'.D185]);"";['BenchBudEE.csv'.D185]) ->  | E185: of:=IF(ISBLANK(['BenchBudEE.csv'.E185]);"";['BenchBudEE.csv'.E185]) ->  | F185: of:=IF(ISBLANK(['BenchBudEE.csv'.F185]);"";['BenchBudEE.csv'.F185]) ->  | G185: of:=IF(ISNUMBER(SEARCH("[0-9]";[.A185]));MID([.A185];1;SEARCH("[0-9]";[.A185])-1);"") -> 
A186: of:=IF(ISBLANK(['BenchBudEE.csv'.A186]);"";['BenchBudEE.csv'.A186]) ->  | B186: of:=IF(ISBLANK(['BenchBudEE.csv'.B186]);"";['BenchBudEE.csv'.B186]) ->  | C186: of:=IF(ISBLANK(['BenchBudEE.csv'.C321]);"";MID(['BenchBudEE.csv'.C321];SEARCH(":";['BenchBudEE.csv'.C321])+1;100)) ->  | D186: of:=IF(ISBLANK(['BenchBudEE.csv'.D186]);"";['BenchBudEE.csv'.D186]) ->  | E186: of:=IF(ISBLANK(['BenchBudEE.csv'.E186]);"";['BenchBudEE.csv'.E186]) ->  | F186: of:=IF(ISBLANK(['BenchBudEE.csv'.F186]);"";['BenchBudEE.csv'.F186]) ->  | G186: of:=IF(ISNUMBER(SEARCH("[0-9]";[.A186]));MID([.A186];1;SEARCH("[0-9]";[.A186])-1);"") -> 
A187: of:=IF(ISBLANK(['BenchBudEE.csv'.A187]);"";['BenchBudEE.csv'.A187]) ->  | B187: of:=IF(ISBLANK(['BenchBudEE.csv'.B187]);"";['BenchBudEE.csv'.B187]) ->  | C187: of:=IF(ISBLANK(['BenchBudEE.csv'.C322]);"";MID(['BenchBudEE.csv'.C322];SEARCH(":";['BenchBudEE.csv'.C322])+1;100)) ->  | D187: of:=IF(ISBLANK(['BenchBudEE.csv'.D187]);"";['BenchBudEE.csv'.D187]) ->  | E187: of:=IF(ISBLANK(['BenchBudEE.csv'.E187]);"";['BenchBudEE.csv'.E187]) ->  | F187: of:=IF(ISBLANK(['BenchBudEE.csv'.F187]);"";['BenchBudEE.csv'.F187]) ->  | G187: of:=IF(ISNUMBER(SEARCH("[0-9]";[.A187]));MID([.A187];1;SEARCH("[0-9]";[.A187])-1);"") -> 
A188: of:=IF(ISBLANK(['BenchBudEE.csv'.A188]);"";['BenchBudEE.csv'.A188]) ->  | B188: of:=IF(ISBLANK(['BenchBudEE.csv'.B188]);"";['BenchBudEE.csv'.B188]) ->  | C188: of:=IF(ISBLANK(['BenchBudEE.csv'.C323]);"";MID(['BenchBudEE.csv'.C323];SEARCH(":";['BenchBudEE.csv'.C323])+1;100)) ->  | D188: of:=IF(ISBLANK(['BenchBudEE.csv'.D188]);"";['BenchBudEE.csv'.D188]) ->  | E188: of:=IF(ISBLANK(['BenchBudEE.csv'.E188]);"";['BenchBudEE.csv'.E188]) ->  | F188: of:=IF(ISBLANK(['BenchBudEE.csv'.F188]);"";['BenchBudEE.csv'.F188]) ->  | G188: of:=IF(ISNUMBER(SEARCH("[0-9]";[.A188]));MID([.A188];1;SEARCH("[0-9]";[.A188])-1);"") -> 
A189: of:=IF(ISBLANK(['BenchBudEE.csv'.A189]);"";['BenchBudEE.csv'.A189]) ->  | B189: of:=IF(ISBLANK(['BenchBudEE.csv'.B189]);"";['BenchBudEE.csv'.B189]) ->  | C189: of:=IF(ISBLANK(['BenchBudEE.csv'.C324]);"";MID(['BenchBudEE.csv'.C324];SEARCH(":";['BenchBudEE.csv'.C324])+1;100)) ->  | D189: of:=IF(ISBLANK(['BenchBudEE.csv'.D189]);"";['BenchBudEE.csv'.D189]) ->  | E189: of:=IF(ISBLANK(['BenchBudEE.csv'.E189]);"";['BenchBudEE.csv'.E189]) ->  | F189: of:=IF(ISBLANK(['BenchBudEE.csv'.F189]);"";['BenchBudEE.csv'.F189]) ->  | G189: of:=IF(ISNUMBER(SEARCH("[0-9]";[.A189]));MID([.A189];1;SEARCH("[0-9]";[.A189])-1);"") -> 
A190: of:=IF(ISBLANK(['BenchBudEE.csv'.A190]);"";['BenchBudEE.csv'.A190]) ->  | B190: of:=IF(ISBLANK(['BenchBudEE.csv'.B190]);"";['BenchBudEE.csv'.B190]) ->  | C190: of:=IF(ISBLANK(['BenchBudEE.csv'.C325]);"";MID(['BenchBudEE.csv'.C325];SEARCH(":";['BenchBudEE.csv'.C325])+1;100)) ->  | D190: of:=IF(ISBLANK(['BenchBudEE.csv'.D190]);"";['BenchBudEE.csv'.D190]) ->  | E190: of:=IF(ISBLANK(['BenchBudEE.csv'.E190]);"";['BenchBudEE.csv'.E190]) ->  | F190: of:=IF(ISBLANK(['BenchBudEE.csv'.F190]);"";['BenchBudEE.csv'.F190]) ->  | G190: of:=IF(ISNUMBER(SEARCH("[0-9]";[.A190]));MID([.A190];1;SEARCH("[0-9]";[.A190])-1);"") -> 
A191: of:=IF(ISBLANK(['BenchBudEE.csv'.A191]);"";['BenchBudEE.csv'.A191]) ->  | B191: of:=IF(ISBLANK(['BenchBudEE.csv'.B191]);"";['BenchBudEE.csv'.B191]) ->  | C191: of:=IF(ISBLANK(['BenchBudEE.csv'.C326]);"";MID(['BenchBudEE.csv'.C326];SEARCH(":";['BenchBudEE.csv'.C326])+1;100)) ->  | D191: of:=IF(ISBLANK(['BenchBudEE.csv'.D191]);"";['BenchBudEE.csv'.D191]) ->  | E191: of:=IF(ISBLANK(['BenchBudEE.csv'.E191]);"";['BenchBudEE.csv'.E191]) ->  | F191: of:=IF(ISBLANK(['BenchBudEE.csv'.F191]);"";['BenchBudEE.csv'.F191]) ->  | G191: of:=IF(ISNUMBER(SEARCH("[0-9]";[.A191]));MID([.A191];1;SEARCH("[0-9]";[.A191])-1);"") -> 
A192: of:=IF(ISBLANK(['BenchBudEE.csv'.A192]);"";['BenchBudEE.csv'.A192]) ->  | B192: of:=IF(ISBLANK(['BenchBudEE.csv'.B192]);"";['BenchBudEE.csv'.B192]) ->  | C192: of:=IF(ISBLANK(['BenchBudEE.csv'.C327]);"";MID(['BenchBudEE.csv'.C327];SEARCH(":";['BenchBudEE.csv'.C327])+1;100)) ->  | D192: of:=IF(ISBLANK(['BenchBudEE.csv'.D192]);"";['BenchBudEE.csv'.D192]) ->  | E192: of:=IF(ISBLANK(['BenchBudEE.csv'.E192]);"";['BenchBudEE.csv'.E192]) ->  | F192: of:=IF(ISBLANK(['BenchBudEE.csv'.F192]);"";['BenchBudEE.csv'.F192]) ->  | G192: of:=IF(ISNUMBER(SEARCH("[0-9]";[.A192]));MID([.A192];1;SEARCH("[0-9]";[.A192])-1);"") -> 
A193: of:=IF(ISBLANK(['BenchBudEE.csv'.A193]);"";['BenchBudEE.csv'.A193]) ->  | B193: of:=IF(ISBLANK(['BenchBudEE.csv'.B193]);"";['BenchBudEE.csv'.B193]) ->  | C193: of:=IF(ISBLANK(['BenchBudEE.csv'.C328]);"";MID(['BenchBudEE.csv'.C328];SEARCH(":";['BenchBudEE.csv'.C328])+1;100)) ->  | D193: of:=IF(ISBLANK(['BenchBudEE.csv'.D193]);"";['BenchBudEE.csv'.D193]) ->  | E193: of:=IF(ISBLANK(['BenchBudEE.csv'.E193]);"";['BenchBudEE.csv'.E193]) ->  | F193: of:=IF(ISBLANK(['BenchBudEE.csv'.F193]);"";['BenchBudEE.csv'.F193]) ->  | G193: of:=IF(ISNUMBER(SEARCH("[0-9]";[.A193]));MID([.A193];1;SEARCH("[0-9]";[.A193])-1);"") -> 
A194: of:=IF(ISBLANK(['BenchBudEE.csv'.A194]);"";['BenchBudEE.csv'.A194]) ->  | B194: of:=IF(ISBLANK(['BenchBudEE.csv'.B194]);"";['BenchBudEE.csv'.B194]) ->  | C194: of:=IF(ISBLANK(['BenchBudEE.csv'.C329]);"";MID(['BenchBudEE.csv'.C329];SEARCH(":";['BenchBudEE.csv'.C329])+1;100)) ->  | D194: of:=IF(ISBLANK(['BenchBudEE.csv'.D194]);"";['BenchBudEE.csv'.D194]) ->  | E194: of:=IF(ISBLANK(['BenchBudEE.csv'.E194]);"";['BenchBudEE.csv'.E194]) ->  | F194: of:=IF(ISBLANK(['BenchBudEE.csv'.F194]);"";['BenchBudEE.csv'.F194]) ->  | G194: of:=IF(ISNUMBER(SEARCH("[0-9]";[.A194]));MID([.A194];1;SEARCH("[0-9]";[.A194])-1);"") -> 
A195: of:=IF(ISBLANK(['BenchBudEE.csv'.A195]);"";['BenchBudEE.csv'.A195]) ->  | B195: of:=IF(ISBLANK(['BenchBudEE.csv'.B195]);"";['BenchBudEE.csv'.B195]) ->  | C195: of:=IF(ISBLANK(['BenchBudEE.csv'.C330]);"";MID(['BenchBudEE.csv'.C330];SEARCH(":";['BenchBudEE.csv'.C330])+1;100)) ->  | D195: of:=IF(ISBLANK(['BenchBudEE.csv'.D195]);"";['BenchBudEE.csv'.D195]) ->  | E195: of:=IF(ISBLANK(['BenchBudEE.csv'.E195]);"";['BenchBudEE.csv'.E195]) ->  | F195: of:=IF(ISBLANK(['BenchBudEE.csv'.F195]);"";['BenchBudEE.csv'.F195]) ->  | G195: of:=IF(ISNUMBER(SEARCH("[0-9]";[.A195]));MID([.A195];1;SEARCH("[0-9]";[.A195])-1);"") -> 
A196: of:=IF(ISBLANK(['BenchBudEE.csv'.A196]);"";['BenchBudEE.csv'.A196]) ->  | B196: of:=IF(ISBLANK(['BenchBudEE.csv'.B196]);"";['BenchBudEE.csv'.B196]) ->  | C196: of:=IF(ISBLANK(['BenchBudEE.csv'.C331]);"";MID(['BenchBudEE.csv'.C331];SEARCH(":";['BenchBudEE.csv'.C331])+1;100)) ->  | D196: of:=IF(ISBLANK(['BenchBudEE.csv'.D196]);"";['BenchBudEE.csv'.D196]) ->  | E196: of:=IF(ISBLANK(['BenchBudEE.csv'.E196]);"";['BenchBudEE.csv'.E196]) ->  | F196: of:=IF(ISBLANK(['BenchBudEE.csv'.F196]);"";['BenchBudEE.csv'.F196]) ->  | G196: of:=IF(ISNUMBER(SEARCH("[0-9]";[.A196]));MID([.A196];1;SEARCH("[0-9]";[.A196])-1);"") -> 
A197: of:=IF(ISBLANK(['BenchBudEE.csv'.A197]);"";['BenchBudEE.csv'.A197]) ->  | B197: of:=IF(ISBLANK(['BenchBudEE.csv'.B197]);"";['BenchBudEE.csv'.B197]) ->  | C197: of:=IF(ISBLANK(['BenchBudEE.csv'.C332]);"";MID(['BenchBudEE.csv'.C332];SEARCH(":";['BenchBudEE.csv'.C332])+1;100)) ->  | D197: of:=IF(ISBLANK(['BenchBudEE.csv'.D197]);"";['BenchBudEE.csv'.D197]) ->  | E197: of:=IF(ISBLANK(['BenchBudEE.csv'.E197]);"";['BenchBudEE.csv'.E197]) ->  | F197: of:=IF(ISBLANK(['BenchBudEE.csv'.F197]);"";['BenchBudEE.csv'.F197]) ->  | G197: of:=IF(ISNUMBER(SEARCH("[0-9]";[.A197]));MID([.A197];1;SEARCH("[0-9]";[.A197])-1);"") -> 
A198: of:=IF(ISBLANK(['BenchBudEE.csv'.A198]);"";['BenchBudEE.csv'.A198]) ->  | B198: of:=IF(ISBLANK(['BenchBudEE.csv'.B198]);"";['BenchBudEE.csv'.B198]) ->  | C198: of:=IF(ISBLANK(['BenchBudEE.csv'.C333]);"";MID(['BenchBudEE.csv'.C333];SEARCH(":";['BenchBudEE.csv'.C333])+1;100)) ->  | D198: of:=IF(ISBLANK(['BenchBudEE.csv'.D198]);"";['BenchBudEE.csv'.D198]) ->  | E198: of:=IF(ISBLANK(['BenchBudEE.csv'.E198]);"";['BenchBudEE.csv'.E198]) ->  | F198: of:=IF(ISBLANK(['BenchBudEE.csv'.F198]);"";['BenchBudEE.csv'.F198]) ->  | G198: of:=IF(ISNUMBER(SEARCH("[0-9]";[.A198]));MID([.A198];1;SEARCH("[0-9]";[.A198])-1);"") -> 
A199: of:=IF(ISBLANK(['BenchBudEE.csv'.A199]);"";['BenchBudEE.csv'.A199]) ->  | B199: of:=IF(ISBLANK(['BenchBudEE.csv'.B199]);"";['BenchBudEE.csv'.B199]) ->  | C199: of:=IF(ISBLANK(['BenchBudEE.csv'.C334]);"";MID(['BenchBudEE.csv'.C334];SEARCH(":";['BenchBudEE.csv'.C334])+1;100)) ->  | D199: of:=IF(ISBLANK(['BenchBudEE.csv'.D199]);"";['BenchBudEE.csv'.D199]) ->  | E199: of:=IF(ISBLANK(['BenchBudEE.csv'.E199]);"";['BenchBudEE.csv'.E199]) ->  | F199: of:=IF(ISBLANK(['BenchBudEE.csv'.F199]);"";['BenchBudEE.csv'.F199]) ->  | G199: of:=IF(ISNUMBER(SEARCH("[0-9]";[.A199]));MID([.A199];1;SEARCH("[0-9]";[.A199])-1);"") -> 
A200: of:=IF(ISBLANK(['BenchBudEE.csv'.A200]);"";['BenchBudEE.csv'.A200]) ->  | B200: of:=IF(ISBLANK(['BenchBudEE.csv'.B200]);"";['BenchBudEE.csv'.B200]) ->  | C200: of:=IF(ISBLANK(['BenchBudEE.csv'.C335]);"";MID(['BenchBudEE.csv'.C335];SEARCH(":";['BenchBudEE.csv'.C335])+1;100)) ->  | D200: of:=IF(ISBLANK(['BenchBudEE.csv'.D200]);"";['BenchBudEE.csv'.D200]) ->  | E200: of:=IF(ISBLANK(['BenchBudEE.csv'.E200]);"";['BenchBudEE.csv'.E200]) ->  | F200: of:=IF(ISBLANK(['BenchBudEE.csv'.F200]);"";['BenchBudEE.csv'.F200]) ->  | G200: of:=IF(ISNUMBER(SEARCH("[0-9]";[.A200]));MID([.A200];1;SEARCH("[0-9]";[.A200])-1);"") -> 
A201: of:=IF(ISBLANK(['BenchBudEE.csv'.A201]);"";['BenchBudEE.csv'.A201]) ->  | B201: of:=IF(ISBLANK(['BenchBudEE.csv'.B201]);"";['BenchBudEE.csv'.B201]) ->  | C201: of:=IF(ISBLANK(['BenchBudEE.csv'.C336]);"";MID(['BenchBudEE.csv'.C336];SEARCH(":";['BenchBudEE.csv'.C336])+1;100)) ->  | D201: of:=IF(ISBLANK(['BenchBudEE.csv'.D201]);"";['BenchBudEE.csv'.D201]) ->  | E201: of:=IF(ISBLANK(['BenchBudEE.csv'.E201]);"";['BenchBudEE.csv'.E201]) ->  | F201: of:=IF(ISBLANK(['BenchBudEE.csv'.F201]);"";['BenchBudEE.csv'.F201]) ->  | G201: of:=IF(ISNUMBER(SEARCH("[0-9]";[.A201]));MID([.A201];1;SEARCH("[0-9]";[.A201])-1);"") -> 
A202: of:=IF(ISBLANK(['BenchBudEE.csv'.A202]);"";['BenchBudEE.csv'.A202]) ->  | B202: of:=IF(ISBLANK(['BenchBudEE.csv'.B202]);"";['BenchBudEE.csv'.B202]) ->  | C202: of:=IF(ISBLANK(['BenchBudEE.csv'.C337]);"";MID(['BenchBudEE.csv'.C337];SEARCH(":";['BenchBudEE.csv'.C337])+1;100)) ->  | D202: of:=IF(ISBLANK(['BenchBudEE.csv'.D202]);"";['BenchBudEE.csv'.D202]) ->  | E202: of:=IF(ISBLANK(['BenchBudEE.csv'.E202]);"";['BenchBudEE.csv'.E202]) ->  | F202: of:=IF(ISBLANK(['BenchBudEE.csv'.F202]);"";['BenchBudEE.csv'.F202]) ->  | G202: of:=IF(ISNUMBER(SEARCH("[0-9]";[.A202]));MID([.A202];1;SEARCH("[0-9]";[.A202])-1);"") -> 
A203: of:=IF(ISBLANK(['BenchBudEE.csv'.A203]);"";['BenchBudEE.csv'.A203]) ->  | B203: of:=IF(ISBLANK(['BenchBudEE.csv'.B203]);"";['BenchBudEE.csv'.B203]) ->  | C203: of:=IF(ISBLANK(['BenchBudEE.csv'.C338]);"";MID(['BenchBudEE.csv'.C338];SEARCH(":";['BenchBudEE.csv'.C338])+1;100)) ->  | D203: of:=IF(ISBLANK(['BenchBudEE.csv'.D203]);"";['BenchBudEE.csv'.D203]) ->  | E203: of:=IF(ISBLANK(['BenchBudEE.csv'.E203]);"";['BenchBudEE.csv'.E203]) ->  | F203: of:=IF(ISBLANK(['BenchBudEE.csv'.F203]);"";['BenchBudEE.csv'.F203]) ->  | G203: of:=IF(ISNUMBER(SEARCH("[0-9]";[.A203]));MID([.A203];1;SEARCH("[0-9]";[.A203])-1);"") -> 
A204: of:=IF(ISBLANK(['BenchBudEE.csv'.A204]);"";['BenchBudEE.csv'.A204]) ->  | B204: of:=IF(ISBLANK(['BenchBudEE.csv'.B204]);"";['BenchBudEE.csv'.B204]) ->  | C204: of:=IF(ISBLANK(['BenchBudEE.csv'.C339]);"";MID(['BenchBudEE.csv'.C339];SEARCH(":";['BenchBudEE.csv'.C339])+1;100)) ->  | D204: of:=IF(ISBLANK(['BenchBudEE.csv'.D204]);"";['BenchBudEE.csv'.D204]) ->  | E204: of:=IF(ISBLANK(['BenchBudEE.csv'.E204]);"";['BenchBudEE.csv'.E204]) ->  | F204: of:=IF(ISBLANK(['BenchBudEE.csv'.F204]);"";['BenchBudEE.csv'.F204]) ->  | G204: of:=IF(ISNUMBER(SEARCH("[0-9]";[.A204]));MID([.A204];1;SEARCH("[0-9]";[.A204])-1);"") -> 
A205: of:=IF(ISBLANK(['BenchBudEE.csv'.A205]);"";['BenchBudEE.csv'.A205]) ->  | B205: of:=IF(ISBLANK(['BenchBudEE.csv'.B205]);"";['BenchBudEE.csv'.B205]) ->  | C205: of:=IF(ISBLANK(['BenchBudEE.csv'.C340]);"";MID(['BenchBudEE.csv'.C340];SEARCH(":";['BenchBudEE.csv'.C340])+1;100)) ->  | D205: of:=IF(ISBLANK(['BenchBudEE.csv'.D205]);"";['BenchBudEE.csv'.D205]) ->  | E205: of:=IF(ISBLANK(['BenchBudEE.csv'.E205]);"";['BenchBudEE.csv'.E205]) ->  | F205: of:=IF(ISBLANK(['BenchBudEE.csv'.F205]);"";['BenchBudEE.csv'.F205]) ->  | G205: of:=IF(ISNUMBER(SEARCH("[0-9]";[.A205]));MID([.A205];1;SEARCH("[0-9]";[.A205])-1);"") -> 
A206: of:=IF(ISBLANK(['BenchBudEE.csv'.A206]);"";['BenchBudEE.csv'.A206]) ->  | B206: of:=IF(ISBLANK(['BenchBudEE.csv'.B206]);"";['BenchBudEE.csv'.B206]) ->  | C206: of:=IF(ISBLANK(['BenchBudEE.csv'.C341]);"";MID(['BenchBudEE.csv'.C341];SEARCH(":";['BenchBudEE.csv'.C341])+1;100)) ->  | D206: of:=IF(ISBLANK(['BenchBudEE.csv'.D206]);"";['BenchBudEE.csv'.D206]) ->  | E206: of:=IF(ISBLANK(['BenchBudEE.csv'.E206]);"";['BenchBudEE.csv'.E206]) ->  | F206: of:=IF(ISBLANK(['BenchBudEE.csv'.F206]);"";['BenchBudEE.csv'.F206]) ->  | G206: of:=IF(ISNUMBER(SEARCH("[0-9]";[.A206]));MID([.A206];1;SEARCH("[0-9]";[.A206])-1);"") -> 
A207: of:=IF(ISBLANK(['BenchBudEE.csv'.A207]);"";['BenchBudEE.csv'.A207]) ->  | B207: of:=IF(ISBLANK(['BenchBudEE.csv'.B207]);"";['BenchBudEE.csv'.B207]) ->  | C207: of:=IF(ISBLANK(['BenchBudEE.csv'.C342]);"";MID(['BenchBudEE.csv'.C342];SEARCH(":";['BenchBudEE.csv'.C342])+1;100)) ->  | D207: of:=IF(ISBLANK(['BenchBudEE.csv'.D207]);"";['BenchBudEE.csv'.D207]) ->  | E207: of:=IF(ISBLANK(['BenchBudEE.csv'.E207]);"";['BenchBudEE.csv'.E207]) ->  | F207: of:=IF(ISBLANK(['BenchBudEE.csv'.F207]);"";['BenchBudEE.csv'.F207]) ->  | G207: of:=IF(ISNUMBER(SEARCH("[0-9]";[.A207]));MID([.A207];1;SEARCH("[0-9]";[.A207])-1);"") -> 
A208: of:=IF(ISBLANK(['BenchBudEE.csv'.A208]);"";['BenchBudEE.csv'.A208]) ->  | B208: of:=IF(ISBLANK(['BenchBudEE.csv'.B208]);"";['BenchBudEE.csv'.B208]) ->  | C208: of:=IF(ISBLANK(['BenchBudEE.csv'.C343]);"";MID(['BenchBudEE.csv'.C343];SEARCH(":";['BenchBudEE.csv'.C343])+1;100)) ->  | D208: of:=IF(ISBLANK(['BenchBudEE.csv'.D208]);"";['BenchBudEE.csv'.D208]) ->  | E208: of:=IF(ISBLANK(['BenchBudEE.csv'.E208]);"";['BenchBudEE.csv'.E208]) ->  | F208: of:=IF(ISBLANK(['BenchBudEE.csv'.F208]);"";['BenchBudEE.csv'.F208]) ->  | G208: of:=IF(ISNUMBER(SEARCH("[0-9]";[.A208]));MID([.A208];1;SEARCH("[0-9]";[.A208])-1);"") -> 
A209: of:=IF(ISBLANK(['BenchBudEE.csv'.A209]);"";['BenchBudEE.csv'.A209]) ->  | B209: of:=IF(ISBLANK(['BenchBudEE.csv'.B209]);"";['BenchBudEE.csv'.B209]) ->  | C209: of:=IF(ISBLANK(['BenchBudEE.csv'.C344]);"";MID(['BenchBudEE.csv'.C344];SEARCH(":";['BenchBudEE.csv'.C344])+1;100)) ->  | D209: of:=IF(ISBLANK(['BenchBudEE.csv'.D209]);"";['BenchBudEE.csv'.D209]) ->  | E209: of:=IF(ISBLANK(['BenchBudEE.csv'.E209]);"";['BenchBudEE.csv'.E209]) ->  | F209: of:=IF(ISBLANK(['BenchBudEE.csv'.F209]);"";['BenchBudEE.csv'.F209]) ->  | G209: of:=IF(ISNUMBER(SEARCH("[0-9]";[.A209]));MID([.A209];1;SEARCH("[0-9]";[.A209])-1);"") -> 
A210: of:=IF(ISBLANK(['BenchBudEE.csv'.A210]);"";['BenchBudEE.csv'.A210]) ->  | B210: of:=IF(ISBLANK(['BenchBudEE.csv'.B210]);"";['BenchBudEE.csv'.B210]) ->  | C210: of:=IF(ISBLANK(['BenchBudEE.csv'.C345]);"";MID(['BenchBudEE.csv'.C345];SEARCH(":";['BenchBudEE.csv'.C345])+1;100)) ->  | D210: of:=IF(ISBLANK(['BenchBudEE.csv'.D210]);"";['BenchBudEE.csv'.D210]) ->  | E210: of:=IF(ISBLANK(['BenchBudEE.csv'.E210]);"";['BenchBudEE.csv'.E210]) ->  | F210: of:=IF(ISBLANK(['BenchBudEE.csv'.F210]);"";['BenchBudEE.csv'.F210]) ->  | G210: of:=IF(ISNUMBER(SEARCH("[0-9]";[.A210]));MID([.A210];1;SEARCH("[0-9]";[.A210])-1);"") -> 
A211: of:=IF(ISBLANK(['BenchBudEE.csv'.A211]);"";['BenchBudEE.csv'.A211]) ->  | B211: of:=IF(ISBLANK(['BenchBudEE.csv'.B211]);"";['BenchBudEE.csv'.B211]) ->  | C211: of:=IF(ISBLANK(['BenchBudEE.csv'.C346]);"";MID(['BenchBudEE.csv'.C346];SEARCH(":";['BenchBudEE.csv'.C346])+1;100)) ->  | D211: of:=IF(ISBLANK(['BenchBudEE.csv'.D211]);"";['BenchBudEE.csv'.D211]) ->  | E211: of:=IF(ISBLANK(['BenchBudEE.csv'.E211]);"";['BenchBudEE.csv'.E211]) ->  | F211: of:=IF(ISBLANK(['BenchBudEE.csv'.F211]);"";['BenchBudEE.csv'.F211]) ->  | G211: of:=IF(ISNUMBER(SEARCH("[0-9]";[.A211]));MID([.A211];1;SEARCH("[0-9]";[.A211])-1);"") -> 
A212: of:=IF(ISBLANK(['BenchBudEE.csv'.A212]);"";['BenchBudEE.csv'.A212]) ->  | B212: of:=IF(ISBLANK(['BenchBudEE.csv'.B212]);"";['BenchBudEE.csv'.B212]) ->  | C212: of:=IF(ISBLANK(['BenchBudEE.csv'.C347]);"";MID(['BenchBudEE.csv'.C347];SEARCH(":";['BenchBudEE.csv'.C347])+1;100)) ->  | D212: of:=IF(ISBLANK(['BenchBudEE.csv'.D212]);"";['BenchBudEE.csv'.D212]) ->  | E212: of:=IF(ISBLANK(['BenchBudEE.csv'.E212]);"";['BenchBudEE.csv'.E212]) ->  | F212: of:=IF(ISBLANK(['BenchBudEE.csv'.F212]);"";['BenchBudEE.csv'.F212]) ->  | G212: of:=IF(ISNUMBER(SEARCH("[0-9]";[.A212]));MID([.A212];1;SEARCH("[0-9]";[.A212])-1);"") -> 
A213: of:=IF(ISBLANK(['BenchBudEE.csv'.A213]);"";['BenchBudEE.csv'.A213]) ->  | B213: of:=IF(ISBLANK(['BenchBudEE.csv'.B213]);"";['BenchBudEE.csv'.B213]) ->  | C213: of:=IF(ISBLANK(['BenchBudEE.csv'.C348]);"";MID(['BenchBudEE.csv'.C348];SEARCH(":";['BenchBudEE.csv'.C348])+1;100)) ->  | D213: of:=IF(ISBLANK(['BenchBudEE.csv'.D213]);"";['BenchBudEE.csv'.D213]) ->  | E213: of:=IF(ISBLANK(['BenchBudEE.csv'.E213]);"";['BenchBudEE.csv'.E213]) ->  | F213: of:=IF(ISBLANK(['BenchBudEE.csv'.F213]);"";['BenchBudEE.csv'.F213]) ->  | G213: of:=IF(ISNUMBER(SEARCH("[0-9]";[.A213]));MID([.A213];1;SEARCH("[0-9]";[.A213])-1);"") -> 
A214: of:=IF(ISBLANK(['BenchBudEE.csv'.A214]);"";['BenchBudEE.csv'.A214]) ->  | B214: of:=IF(ISBLANK(['BenchBudEE.csv'.B214]);"";['BenchBudEE.csv'.B214]) ->  | C214: of:=IF(ISBLANK(['BenchBudEE.csv'.C349]);"";MID(['BenchBudEE.csv'.C349];SEARCH(":";['BenchBudEE.csv'.C349])+1;100)) ->  | D214: of:=IF(ISBLANK(['BenchBudEE.csv'.D214]);"";['BenchBudEE.csv'.D214]) ->  | E214: of:=IF(ISBLANK(['BenchBudEE.csv'.E214]);"";['BenchBudEE.csv'.E214]) ->  | F214: of:=IF(ISBLANK(['BenchBudEE.csv'.F214]);"";['BenchBudEE.csv'.F214]) ->  | G214: of:=IF(ISNUMBER(SEARCH("[0-9]";[.A214]));MID([.A214];1;SEARCH("[0-9]";[.A214])-1);"") -> 
A215: of:=IF(ISBLANK(['BenchBudEE.csv'.A215]);"";['BenchBudEE.csv'.A215]) ->  | B215: of:=IF(ISBLANK(['BenchBudEE.csv'.B215]);"";['BenchBudEE.csv'.B215]) ->  | C215: of:=IF(ISBLANK(['BenchBudEE.csv'.C350]);"";MID(['BenchBudEE.csv'.C350];SEARCH(":";['BenchBudEE.csv'.C350])+1;100)) ->  | D215: of:=IF(ISBLANK(['BenchBudEE.csv'.D215]);"";['BenchBudEE.csv'.D215]) ->  | E215: of:=IF(ISBLANK(['BenchBudEE.csv'.E215]);"";['BenchBudEE.csv'.E215]) ->  | F215: of:=IF(ISBLANK(['BenchBudEE.csv'.F215]);"";['BenchBudEE.csv'.F215]) ->  | G215: of:=IF(ISNUMBER(SEARCH("[0-9]";[.A215]));MID([.A215];1;SEARCH("[0-9]";[.A215])-1);"") -> 
A216: of:=IF(ISBLANK(['BenchBudEE.csv'.A216]);"";['BenchBudEE.csv'.A216]) ->  | B216: of:=IF(ISBLANK(['BenchBudEE.csv'.B216]);"";['BenchBudEE.csv'.B216]) ->  | C216: of:=IF(ISBLANK(['BenchBudEE.csv'.C351]);"";MID(['BenchBudEE.csv'.C351];SEARCH(":";['BenchBudEE.csv'.C351])+1;100)) ->  | D216: of:=IF(ISBLANK(['BenchBudEE.csv'.D216]);"";['BenchBudEE.csv'.D216]) ->  | E216: of:=IF(ISBLANK(['BenchBudEE.csv'.E216]);"";['BenchBudEE.csv'.E216]) ->  | F216: of:=IF(ISBLANK(['BenchBudEE.csv'.F216]);"";['BenchBudEE.csv'.F216]) ->  | G216: of:=IF(ISNUMBER(SEARCH("[0-9]";[.A216]));MID([.A216];1;SEARCH("[0-9]";[.A216])-1);"") -> 
A217: of:=IF(ISBLANK(['BenchBudEE.csv'.A217]);"";['BenchBudEE.csv'.A217]) ->  | B217: of:=IF(ISBLANK(['BenchBudEE.csv'.B217]);"";['BenchBudEE.csv'.B217]) ->  | C217: of:=IF(ISBLANK(['BenchBudEE.csv'.C352]);"";MID(['BenchBudEE.csv'.C352];SEARCH(":";['BenchBudEE.csv'.C352])+1;100)) ->  | D217: of:=IF(ISBLANK(['BenchBudEE.csv'.D217]);"";['BenchBudEE.csv'.D217]) ->  | E217: of:=IF(ISBLANK(['BenchBudEE.csv'.E217]);"";['BenchBudEE.csv'.E217]) ->  | F217: of:=IF(ISBLANK(['BenchBudEE.csv'.F217]);"";['BenchBudEE.csv'.F217]) ->  | G217: of:=IF(ISNUMBER(SEARCH("[0-9]";[.A217]));MID([.A217];1;SEARCH("[0-9]";[.A217])-1);"") -> 
A218: of:=IF(ISBLANK(['BenchBudEE.csv'.A218]);"";['BenchBudEE.csv'.A218]) ->  | B218: of:=IF(ISBLANK(['BenchBudEE.csv'.B218]);"";['BenchBudEE.csv'.B218]) ->  | C218: of:=IF(ISBLANK(['BenchBudEE.csv'.C353]);"";MID(['BenchBudEE.csv'.C353];SEARCH(":";['BenchBudEE.csv'.C353])+1;100)) ->  | D218: of:=IF(ISBLANK(['BenchBudEE.csv'.D218]);"";['BenchBudEE.csv'.D218]) ->  | E218: of:=IF(ISBLANK(['BenchBudEE.csv'.E218]);"";['BenchBudEE.csv'.E218]) ->  | F218: of:=IF(ISBLANK(['BenchBudEE.csv'.F218]);"";['BenchBudEE.csv'.F218]) ->  | G218: of:=IF(ISNUMBER(SEARCH("[0-9]";[.A218]));MID([.A218];1;SEARCH("[0-9]";[.A218])-1);"") -> 
A219: of:=IF(ISBLANK(['BenchBudEE.csv'.A219]);"";['BenchBudEE.csv'.A219]) ->  | B219: of:=IF(ISBLANK(['BenchBudEE.csv'.B219]);"";['BenchBudEE.csv'.B219]) ->  | C219: of:=IF(ISBLANK(['BenchBudEE.csv'.C354]);"";MID(['BenchBudEE.csv'.C354];SEARCH(":";['BenchBudEE.csv'.C354])+1;100)) ->  | D219: of:=IF(ISBLANK(['BenchBudEE.csv'.D219]);"";['BenchBudEE.csv'.D219]) ->  | E219: of:=IF(ISBLANK(['BenchBudEE.csv'.E219]);"";['BenchBudEE.csv'.E219]) ->  | F219: of:=IF(ISBLANK(['BenchBudEE.csv'.F219]);"";['BenchBudEE.csv'.F219]) ->  | G219: of:=IF(ISNUMBER(SEARCH("[0-9]";[.A219]));MID([.A219];1;SEARCH("[0-9]";[.A219])-1);"") -> 
A220: of:=IF(ISBLANK(['BenchBudEE.csv'.A220]);"";['BenchBudEE.csv'.A220]) ->  | B220: of:=IF(ISBLANK(['BenchBudEE.csv'.B220]);"";['BenchBudEE.csv'.B220]) ->  | C220: of:=IF(ISBLANK(['BenchBudEE.csv'.C355]);"";MID(['BenchBudEE.csv'.C355];SEARCH(":";['BenchBudEE.csv'.C355])+1;100)) ->  | D220: of:=IF(ISBLANK(['BenchBudEE.csv'.D220]);"";['BenchBudEE.csv'.D220]) ->  | E220: of:=IF(ISBLANK(['BenchBudEE.csv'.E220]);"";['BenchBudEE.csv'.E220]) ->  | F220: of:=IF(ISBLANK(['BenchBudEE.csv'.F220]);"";['BenchBudEE.csv'.F220]) ->  | G220: of:=IF(ISNUMBER(SEARCH("[0-9]";[.A220]));MID([.A220];1;SEARCH("[0-9]";[.A220])-1);"") -> 
A221: of:=IF(ISBLANK(['BenchBudEE.csv'.A221]);"";['BenchBudEE.csv'.A221]) ->  | B221: of:=IF(ISBLANK(['BenchBudEE.csv'.B221]);"";['BenchBudEE.csv'.B221]) ->  | C221: of:=IF(ISBLANK(['BenchBudEE.csv'.C356]);"";MID(['BenchBudEE.csv'.C356];SEARCH(":";['BenchBudEE.csv'.C356])+1;100)) ->  | D221: of:=IF(ISBLANK(['BenchBudEE.csv'.D221]);"";['BenchBudEE.csv'.D221]) ->  | E221: of:=IF(ISBLANK(['BenchBudEE.csv'.E221]);"";['BenchBudEE.csv'.E221]) ->  | F221: of:=IF(ISBLANK(['BenchBudEE.csv'.F221]);"";['BenchBudEE.csv'.F221]) ->  | G221: of:=IF(ISNUMBER(SEARCH("[0-9]";[.A221]));MID([.A221];1;SEARCH("[0-9]";[.A221])-1);"") -> 
A222: of:=IF(ISBLANK(['BenchBudEE.csv'.A222]);"";['BenchBudEE.csv'.A222]) ->  | B222: of:=IF(ISBLANK(['BenchBudEE.csv'.B222]);"";['BenchBudEE.csv'.B222]) ->  | C222: of:=IF(ISBLANK(['BenchBudEE.csv'.C357]);"";MID(['BenchBudEE.csv'.C357];SEARCH(":";['BenchBudEE.csv'.C357])+1;100)) ->  | D222: of:=IF(ISBLANK(['BenchBudEE.csv'.D222]);"";['BenchBudEE.csv'.D222]) ->  | E222: of:=IF(ISBLANK(['BenchBudEE.csv'.E222]);"";['BenchBudEE.csv'.E222]) ->  | F222: of:=IF(ISBLANK(['BenchBudEE.csv'.F222]);"";['BenchBudEE.csv'.F222]) ->  | G222: of:=IF(ISNUMBER(SEARCH("[0-9]";[.A222]));MID([.A222];1;SEARCH("[0-9]";[.A222])-1);"") -> 
A223: of:=IF(ISBLANK(['BenchBudEE.csv'.A223]);"";['BenchBudEE.csv'.A223]) ->  | B223: of:=IF(ISBLANK(['BenchBudEE.csv'.B223]);"";['BenchBudEE.csv'.B223]) ->  | C223: of:=IF(ISBLANK(['BenchBudEE.csv'.C358]);"";MID(['BenchBudEE.csv'.C358];SEARCH(":";['BenchBudEE.csv'.C358])+1;100)) ->  | D223: of:=IF(ISBLANK(['BenchBudEE.csv'.D223]);"";['BenchBudEE.csv'.D223]) ->  | E223: of:=IF(ISBLANK(['BenchBudEE.csv'.E223]);"";['BenchBudEE.csv'.E223]) ->  | F223: of:=IF(ISBLANK(['BenchBudEE.csv'.F223]);"";['BenchBudEE.csv'.F223]) ->  | G223: of:=IF(ISNUMBER(SEARCH("[0-9]";[.A223]));MID([.A223];1;SEARCH("[0-9]";[.A223])-1);"") -> 
A224: of:=IF(ISBLANK(['BenchBudEE.csv'.A224]);"";['BenchBudEE.csv'.A224]) ->  | B224: of:=IF(ISBLANK(['BenchBudEE.csv'.B224]);"";['BenchBudEE.csv'.B224]) ->  | C224: of:=IF(ISBLANK(['BenchBudEE.csv'.C359]);"";MID(['BenchBudEE.csv'.C359];SEARCH(":";['BenchBudEE.csv'.C359])+1;100)) ->  | D224: of:=IF(ISBLANK(['BenchBudEE.csv'.D224]);"";['BenchBudEE.csv'.D224]) ->  | E224: of:=IF(ISBLANK(['BenchBudEE.csv'.E224]);"";['BenchBudEE.csv'.E224]) ->  | F224: of:=IF(ISBLANK(['BenchBudEE.csv'.F224]);"";['BenchBudEE.csv'.F224]) ->  | G224: of:=IF(ISNUMBER(SEARCH("[0-9]";[.A224]));MID([.A224];1;SEARCH("[0-9]";[.A224])-1);"") -> 
A225: of:=IF(ISBLANK(['BenchBudEE.csv'.A225]);"";['BenchBudEE.csv'.A225]) ->  | B225: of:=IF(ISBLANK(['BenchBudEE.csv'.B225]);"";['BenchBudEE.csv'.B225]) ->  | C225: of:=IF(ISBLANK(['BenchBudEE.csv'.C360]);"";MID(['BenchBudEE.csv'.C360];SEARCH(":";['BenchBudEE.csv'.C360])+1;100)) ->  | D225: of:=IF(ISBLANK(['BenchBudEE.csv'.D225]);"";['BenchBudEE.csv'.D225]) ->  | E225: of:=IF(ISBLANK(['BenchBudEE.csv'.E225]);"";['BenchBudEE.csv'.E225]) ->  | F225: of:=IF(ISBLANK(['BenchBudEE.csv'.F225]);"";['BenchBudEE.csv'.F225]) ->  | G225: of:=IF(ISNUMBER(SEARCH("[0-9]";[.A225]));MID([.A225];1;SEARCH("[0-9]";[.A225])-1);"") -> 
A226: of:=IF(ISBLANK(['BenchBudEE.csv'.A226]);"";['BenchBudEE.csv'.A226]) ->  | B226: of:=IF(ISBLANK(['BenchBudEE.csv'.B226]);"";['BenchBudEE.csv'.B226]) ->  | C226: of:=IF(ISBLANK(['BenchBudEE.csv'.C361]);"";MID(['BenchBudEE.csv'.C361];SEARCH(":";['BenchBudEE.csv'.C361])+1;100)) ->  | D226: of:=IF(ISBLANK(['BenchBudEE.csv'.D226]);"";['BenchBudEE.csv'.D226]) ->  | E226: of:=IF(ISBLANK(['BenchBudEE.csv'.E226]);"";['BenchBudEE.csv'.E226]) ->  | F226: of:=IF(ISBLANK(['BenchBudEE.csv'.F226]);"";['BenchBudEE.csv'.F226]) ->  | G226: of:=IF(ISNUMBER(SEARCH("[0-9]";[.A226]));MID([.A226];1;SEARCH("[0-9]";[.A226])-1);"") -> 
A227: of:=IF(ISBLANK(['BenchBudEE.csv'.A227]);"";['BenchBudEE.csv'.A227]) ->  | B227: of:=IF(ISBLANK(['BenchBudEE.csv'.B227]);"";['BenchBudEE.csv'.B227]) ->  | C227: of:=IF(ISBLANK(['BenchBudEE.csv'.C362]);"";MID(['BenchBudEE.csv'.C362];SEARCH(":";['BenchBudEE.csv'.C362])+1;100)) ->  | D227: of:=IF(ISBLANK(['BenchBudEE.csv'.D227]);"";['BenchBudEE.csv'.D227]) ->  | E227: of:=IF(ISBLANK(['BenchBudEE.csv'.E227]);"";['BenchBudEE.csv'.E227]) ->  | F227: of:=IF(ISBLANK(['BenchBudEE.csv'.F227]);"";['BenchBudEE.csv'.F227]) ->  | G227: of:=IF(ISNUMBER(SEARCH("[0-9]";[.A227]));MID([.A227];1;SEARCH("[0-9]";[.A227])-1);"") -> 
A228: of:=IF(ISBLANK(['BenchBudEE.csv'.A228]);"";['BenchBudEE.csv'.A228]) ->  | B228: of:=IF(ISBLANK(['BenchBudEE.csv'.B228]);"";['BenchBudEE.csv'.B228]) ->  | C228: of:=IF(ISBLANK(['BenchBudEE.csv'.C363]);"";MID(['BenchBudEE.csv'.C363];SEARCH(":";['BenchBudEE.csv'.C363])+1;100)) ->  | D228: of:=IF(ISBLANK(['BenchBudEE.csv'.D228]);"";['BenchBudEE.csv'.D228]) ->  | E228: of:=IF(ISBLANK(['BenchBudEE.csv'.E228]);"";['BenchBudEE.csv'.E228]) ->  | F228: of:=IF(ISBLANK(['BenchBudEE.csv'.F228]);"";['BenchBudEE.csv'.F228]) ->  | G228: of:=IF(ISNUMBER(SEARCH("[0-9]";[.A228]));MID([.A228];1;SEARCH("[0-9]";[.A228])-1);"") -> 
A229: of:=IF(ISBLANK(['BenchBudEE.csv'.A229]);"";['BenchBudEE.csv'.A229]) ->  | B229: of:=IF(ISBLANK(['BenchBudEE.csv'.B229]);"";['BenchBudEE.csv'.B229]) ->  | C229: of:=IF(ISBLANK(['BenchBudEE.csv'.C364]);"";MID(['BenchBudEE.csv'.C364];SEARCH(":";['BenchBudEE.csv'.C364])+1;100)) ->  | D229: of:=IF(ISBLANK(['BenchBudEE.csv'.D229]);"";['BenchBudEE.csv'.D229]) ->  | E229: of:=IF(ISBLANK(['BenchBudEE.csv'.E229]);"";['BenchBudEE.csv'.E229]) ->  | F229: of:=IF(ISBLANK(['BenchBudEE.csv'.F229]);"";['BenchBudEE.csv'.F229]) ->  | G229: of:=IF(ISNUMBER(SEARCH("[0-9]";[.A229]));MID([.A229];1;SEARCH("[0-9]";[.A229])-1);"") -> 
A230: of:=IF(ISBLANK(['BenchBudEE.csv'.A230]);"";['BenchBudEE.csv'.A230]) ->  | B230: of:=IF(ISBLANK(['BenchBudEE.csv'.B230]);"";['BenchBudEE.csv'.B230]) ->  | C230: of:=IF(ISBLANK(['BenchBudEE.csv'.C365]);"";MID(['BenchBudEE.csv'.C365];SEARCH(":";['BenchBudEE.csv'.C365])+1;100)) ->  | D230: of:=IF(ISBLANK(['BenchBudEE.csv'.D230]);"";['BenchBudEE.csv'.D230]) ->  | E230: of:=IF(ISBLANK(['BenchBudEE.csv'.E230]);"";['BenchBudEE.csv'.E230]) ->  | F230: of:=IF(ISBLANK(['BenchBudEE.csv'.F230]);"";['BenchBudEE.csv'.F230]) ->  | G230: of:=IF(ISNUMBER(SEARCH("[0-9]";[.A230]));MID([.A230];1;SEARCH("[0-9]";[.A230])-1);"") -> 
A231: of:=IF(ISBLANK(['BenchBudEE.csv'.A231]);"";['BenchBudEE.csv'.A231]) ->  | B231: of:=IF(ISBLANK(['BenchBudEE.csv'.B231]);"";['BenchBudEE.csv'.B231]) ->  | C231: of:=IF(ISBLANK(['BenchBudEE.csv'.C366]);"";MID(['BenchBudEE.csv'.C366];SEARCH(":";['BenchBudEE.csv'.C366])+1;100)) ->  | D231: of:=IF(ISBLANK(['BenchBudEE.csv'.D231]);"";['BenchBudEE.csv'.D231]) ->  | E231: of:=IF(ISBLANK(['BenchBudEE.csv'.E231]);"";['BenchBudEE.csv'.E231]) ->  | F231: of:=IF(ISBLANK(['BenchBudEE.csv'.F231]);"";['BenchBudEE.csv'.F231]) ->  | G231: of:=IF(ISNUMBER(SEARCH("[0-9]";[.A231]));MID([.A231];1;SEARCH("[0-9]";[.A231])-1);"") -> 
A232: of:=IF(ISBLANK(['BenchBudEE.csv'.A232]);"";['BenchBudEE.csv'.A232]) ->  | B232: of:=IF(ISBLANK(['BenchBudEE.csv'.B232]);"";['BenchBudEE.csv'.B232]) ->  | C232: of:=IF(ISBLANK(['BenchBudEE.csv'.C367]);"";MID(['BenchBudEE.csv'.C367];SEARCH(":";['BenchBudEE.csv'.C367])+1;100)) ->  | D232: of:=IF(ISBLANK(['BenchBudEE.csv'.D232]);"";['BenchBudEE.csv'.D232]) ->  | E232: of:=IF(ISBLANK(['BenchBudEE.csv'.E232]);"";['BenchBudEE.csv'.E232]) ->  | F232: of:=IF(ISBLANK(['BenchBudEE.csv'.F232]);"";['BenchBudEE.csv'.F232]) ->  | G232: of:=IF(ISNUMBER(SEARCH("[0-9]";[.A232]));MID([.A232];1;SEARCH("[0-9]";[.A232])-1);"") -> 
A233: of:=IF(ISBLANK(['BenchBudEE.csv'.A233]);"";['BenchBudEE.csv'.A233]) ->  | B233: of:=IF(ISBLANK(['BenchBudEE.csv'.B233]);"";['BenchBudEE.csv'.B233]) ->  | C233: of:=IF(ISBLANK(['BenchBudEE.csv'.C368]);"";MID(['BenchBudEE.csv'.C368];SEARCH(":";['BenchBudEE.csv'.C368])+1;100)) ->  | D233: of:=IF(ISBLANK(['BenchBudEE.csv'.D233]);"";['BenchBudEE.csv'.D233]) ->  | E233: of:=IF(ISBLANK(['BenchBudEE.csv'.E233]);"";['BenchBudEE.csv'.E233]) ->  | F233: of:=IF(ISBLANK(['BenchBudEE.csv'.F233]);"";['BenchBudEE.csv'.F233]) ->  | G233: of:=IF(ISNUMBER(SEARCH("[0-9]";[.A233]));MID([.A233];1;SEARCH("[0-9]";[.A233])-1);"") -> 
A234: of:=IF(ISBLANK(['BenchBudEE.csv'.A234]);"";['BenchBudEE.csv'.A234]) ->  | B234: of:=IF(ISBLANK(['BenchBudEE.csv'.B234]);"";['BenchBudEE.csv'.B234]) ->  | C234: of:=IF(ISBLANK(['BenchBudEE.csv'.C369]);"";MID(['BenchBudEE.csv'.C369];SEARCH(":";['BenchBudEE.csv'.C369])+1;100)) ->  | D234: of:=IF(ISBLANK(['BenchBudEE.csv'.D234]);"";['BenchBudEE.csv'.D234]) ->  | E234: of:=IF(ISBLANK(['BenchBudEE.csv'.E234]);"";['BenchBudEE.csv'.E234]) ->  | F234: of:=IF(ISBLANK(['BenchBudEE.csv'.F234]);"";['BenchBudEE.csv'.F234]) ->  | G234: of:=IF(ISNUMBER(SEARCH("[0-9]";[.A234]));MID([.A234];1;SEARCH("[0-9]";[.A234])-1);"") -> 
A235: of:=IF(ISBLANK(['BenchBudEE.csv'.A235]);"";['BenchBudEE.csv'.A235]) ->  | B235: of:=IF(ISBLANK(['BenchBudEE.csv'.B235]);"";['BenchBudEE.csv'.B235]) ->  | C235: of:=IF(ISBLANK(['BenchBudEE.csv'.C370]);"";MID(['BenchBudEE.csv'.C370];SEARCH(":";['BenchBudEE.csv'.C370])+1;100)) ->  | D235: of:=IF(ISBLANK(['BenchBudEE.csv'.D235]);"";['BenchBudEE.csv'.D235]) ->  | E235: of:=IF(ISBLANK(['BenchBudEE.csv'.E235]);"";['BenchBudEE.csv'.E235]) ->  | F235: of:=IF(ISBLANK(['BenchBudEE.csv'.F235]);"";['BenchBudEE.csv'.F235]) ->  | G235: of:=IF(ISNUMBER(SEARCH("[0-9]";[.A235]));MID([.A235];1;SEARCH("[0-9]";[.A235])-1);"") -> 
A236: of:=IF(ISBLANK(['BenchBudEE.csv'.A236]);"";['BenchBudEE.csv'.A236]) ->  | B236: of:=IF(ISBLANK(['BenchBudEE.csv'.B236]);"";['BenchBudEE.csv'.B236]) ->  | C236: of:=IF(ISBLANK(['BenchBudEE.csv'.C371]);"";MID(['BenchBudEE.csv'.C371];SEARCH(":";['BenchBudEE.csv'.C371])+1;100)) ->  | D236: of:=IF(ISBLANK(['BenchBudEE.csv'.D236]);"";['BenchBudEE.csv'.D236]) ->  | E236: of:=IF(ISBLANK(['BenchBudEE.csv'.E236]);"";['BenchBudEE.csv'.E236]) ->  | F236: of:=IF(ISBLANK(['BenchBudEE.csv'.F236]);"";['BenchBudEE.csv'.F236]) ->  | G236: of:=IF(ISNUMBER(SEARCH("[0-9]";[.A236]));MID([.A236];1;SEARCH("[0-9]";[.A236])-1);"") -> 
A237: of:=IF(ISBLANK(['BenchBudEE.csv'.A237]);"";['BenchBudEE.csv'.A237]) ->  | B237: of:=IF(ISBLANK(['BenchBudEE.csv'.B237]);"";['BenchBudEE.csv'.B237]) ->  | C237: of:=IF(ISBLANK(['BenchBudEE.csv'.C372]);"";MID(['BenchBudEE.csv'.C372];SEARCH(":";['BenchBudEE.csv'.C372])+1;100)) ->  | D237: of:=IF(ISBLANK(['BenchBudEE.csv'.D237]);"";['BenchBudEE.csv'.D237]) ->  | E237: of:=IF(ISBLANK(['BenchBudEE.csv'.E237]);"";['BenchBudEE.csv'.E237]) ->  | F237: of:=IF(ISBLANK(['BenchBudEE.csv'.F237]);"";['BenchBudEE.csv'.F237]) ->  | G237: of:=IF(ISNUMBER(SEARCH("[0-9]";[.A237]));MID([.A237];1;SEARCH("[0-9]";[.A237])-1);"") -> 
A238: of:=IF(ISBLANK(['BenchBudEE.csv'.A238]);"";['BenchBudEE.csv'.A238]) ->  | B238: of:=IF(ISBLANK(['BenchBudEE.csv'.B238]);"";['BenchBudEE.csv'.B238]) ->  | C238: of:=IF(ISBLANK(['BenchBudEE.csv'.C373]);"";MID(['BenchBudEE.csv'.C373];SEARCH(":";['BenchBudEE.csv'.C373])+1;100)) ->  | D238: of:=IF(ISBLANK(['BenchBudEE.csv'.D238]);"";['BenchBudEE.csv'.D238]) ->  | E238: of:=IF(ISBLANK(['BenchBudEE.csv'.E238]);"";['BenchBudEE.csv'.E238]) ->  | F238: of:=IF(ISBLANK(['BenchBudEE.csv'.F238]);"";['BenchBudEE.csv'.F238]) ->  | G238: of:=IF(ISNUMBER(SEARCH("[0-9]";[.A238]));MID([.A238];1;SEARCH("[0-9]";[.A238])-1);"") -> 
A239: of:=IF(ISBLANK(['BenchBudEE.csv'.A239]);"";['BenchBudEE.csv'.A239]) ->  | B239: of:=IF(ISBLANK(['BenchBudEE.csv'.B239]);"";['BenchBudEE.csv'.B239]) ->  | C239: of:=IF(ISBLANK(['BenchBudEE.csv'.C374]);"";MID(['BenchBudEE.csv'.C374];SEARCH(":";['BenchBudEE.csv'.C374])+1;100)) ->  | D239: of:=IF(ISBLANK(['BenchBudEE.csv'.D239]);"";['BenchBudEE.csv'.D239]) ->  | E239: of:=IF(ISBLANK(['BenchBudEE.csv'.E239]);"";['BenchBudEE.csv'.E239]) ->  | F239: of:=IF(ISBLANK(['BenchBudEE.csv'.F239]);"";['BenchBudEE.csv'.F239]) ->  | G239: of:=IF(ISNUMBER(SEARCH("[0-9]";[.A239]));MID([.A239];1;SEARCH("[0-9]";[.A239])-1);"") -> 
A240: of:=IF(ISBLANK(['BenchBudEE.csv'.A240]);"";['BenchBudEE.csv'.A240]) ->  | B240: of:=IF(ISBLANK(['BenchBudEE.csv'.B240]);"";['BenchBudEE.csv'.B240]) ->  | C240: of:=IF(ISBLANK(['BenchBudEE.csv'.C375]);"";MID(['BenchBudEE.csv'.C375];SEARCH(":";['BenchBudEE.csv'.C375])+1;100)) ->  | D240: of:=IF(ISBLANK(['BenchBudEE.csv'.D240]);"";['BenchBudEE.csv'.D240]) ->  | E240: of:=IF(ISBLANK(['BenchBudEE.csv'.E240]);"";['BenchBudEE.csv'.E240]) ->  | F240: of:=IF(ISBLANK(['BenchBudEE.csv'.F240]);"";['BenchBudEE.csv'.F240]) ->  | G240: of:=IF(ISNUMBER(SEARCH("[0-9]";[.A240]));MID([.A240];1;SEARCH("[0-9]";[.A240])-1);"") -> 
A241: of:=IF(ISBLANK(['BenchBudEE.csv'.A241]);"";['BenchBudEE.csv'.A241]) ->  | B241: of:=IF(ISBLANK(['BenchBudEE.csv'.B241]);"";['BenchBudEE.csv'.B241]) ->  | C241: of:=IF(ISBLANK(['BenchBudEE.csv'.C376]);"";MID(['BenchBudEE.csv'.C376];SEARCH(":";['BenchBudEE.csv'.C376])+1;100)) ->  | D241: of:=IF(ISBLANK(['BenchBudEE.csv'.D241]);"";['BenchBudEE.csv'.D241]) ->  | E241: of:=IF(ISBLANK(['BenchBudEE.csv'.E241]);"";['BenchBudEE.csv'.E241]) ->  | F241: of:=IF(ISBLANK(['BenchBudEE.csv'.F241]);"";['BenchBudEE.csv'.F241]) ->  | G241: of:=IF(ISNUMBER(SEARCH("[0-9]";[.A241]));MID([.A241];1;SEARCH("[0-9]";[.A241])-1);"") -> 
A242: of:=IF(ISBLANK(['BenchBudEE.csv'.A242]);"";['BenchBudEE.csv'.A242]) ->  | B242: of:=IF(ISBLANK(['BenchBudEE.csv'.B242]);"";['BenchBudEE.csv'.B242]) ->  | C242: of:=IF(ISBLANK(['BenchBudEE.csv'.C377]);"";MID(['BenchBudEE.csv'.C377];SEARCH(":";['BenchBudEE.csv'.C377])+1;100)) ->  | D242: of:=IF(ISBLANK(['BenchBudEE.csv'.D242]);"";['BenchBudEE.csv'.D242]) ->  | E242: of:=IF(ISBLANK(['BenchBudEE.csv'.E242]);"";['BenchBudEE.csv'.E242]) ->  | F242: of:=IF(ISBLANK(['BenchBudEE.csv'.F242]);"";['BenchBudEE.csv'.F242]) ->  | G242: of:=IF(ISNUMBER(SEARCH("[0-9]";[.A242]));MID([.A242];1;SEARCH("[0-9]";[.A242])-1);"") -> 
A243: of:=IF(ISBLANK(['BenchBudEE.csv'.A243]);"";['BenchBudEE.csv'.A243]) ->  | B243: of:=IF(ISBLANK(['BenchBudEE.csv'.B243]);"";['BenchBudEE.csv'.B243]) ->  | C243: of:=IF(ISBLANK(['BenchBudEE.csv'.C378]);"";MID(['BenchBudEE.csv'.C378];SEARCH(":";['BenchBudEE.csv'.C378])+1;100)) ->  | D243: of:=IF(ISBLANK(['BenchBudEE.csv'.D243]);"";['BenchBudEE.csv'.D243]) ->  | E243: of:=IF(ISBLANK(['BenchBudEE.csv'.E243]);"";['BenchBudEE.csv'.E243]) ->  | F243: of:=IF(ISBLANK(['BenchBudEE.csv'.F243]);"";['BenchBudEE.csv'.F243]) ->  | G243: of:=IF(ISNUMBER(SEARCH("[0-9]";[.A243]));MID([.A243];1;SEARCH("[0-9]";[.A243])-1);"") -> 
A244: of:=IF(ISBLANK(['BenchBudEE.csv'.A244]);"";['BenchBudEE.csv'.A244]) ->  | B244: of:=IF(ISBLANK(['BenchBudEE.csv'.B244]);"";['BenchBudEE.csv'.B244]) ->  | C244: of:=IF(ISBLANK(['BenchBudEE.csv'.C379]);"";MID(['BenchBudEE.csv'.C379];SEARCH(":";['BenchBudEE.csv'.C379])+1;100)) ->  | D244: of:=IF(ISBLANK(['BenchBudEE.csv'.D244]);"";['BenchBudEE.csv'.D244]) ->  | E244: of:=IF(ISBLANK(['BenchBudEE.csv'.E244]);"";['BenchBudEE.csv'.E244]) ->  | F244: of:=IF(ISBLANK(['BenchBudEE.csv'.F244]);"";['BenchBudEE.csv'.F244]) ->  | G244: of:=IF(ISNUMBER(SEARCH("[0-9]";[.A244]));MID([.A244];1;SEARCH("[0-9]";[.A244])-1);"") -> 
A245: of:=IF(ISBLANK(['BenchBudEE.csv'.A245]);"";['BenchBudEE.csv'.A245]) ->  | B245: of:=IF(ISBLANK(['BenchBudEE.csv'.B245]);"";['BenchBudEE.csv'.B245]) ->  | C245: of:=IF(ISBLANK(['BenchBudEE.csv'.C380]);"";MID(['BenchBudEE.csv'.C380];SEARCH(":";['BenchBudEE.csv'.C380])+1;100)) ->  | D245: of:=IF(ISBLANK(['BenchBudEE.csv'.D245]);"";['BenchBudEE.csv'.D245]) ->  | E245: of:=IF(ISBLANK(['BenchBudEE.csv'.E245]);"";['BenchBudEE.csv'.E245]) ->  | F245: of:=IF(ISBLANK(['BenchBudEE.csv'.F245]);"";['BenchBudEE.csv'.F245]) ->  | G245: of:=IF(ISNUMBER(SEARCH("[0-9]";[.A245]));MID([.A245];1;SEARCH("[0-9]";[.A245])-1);"") -> 
A246: of:=IF(ISBLANK(['BenchBudEE.csv'.A246]);"";['BenchBudEE.csv'.A246]) ->  | B246: of:=IF(ISBLANK(['BenchBudEE.csv'.B246]);"";['BenchBudEE.csv'.B246]) ->  | C246: of:=IF(ISBLANK(['BenchBudEE.csv'.C381]);"";MID(['BenchBudEE.csv'.C381];SEARCH(":";['BenchBudEE.csv'.C381])+1;100)) ->  | D246: of:=IF(ISBLANK(['BenchBudEE.csv'.D246]);"";['BenchBudEE.csv'.D246]) ->  | E246: of:=IF(ISBLANK(['BenchBudEE.csv'.E246]);"";['BenchBudEE.csv'.E246]) ->  | F246: of:=IF(ISBLANK(['BenchBudEE.csv'.F246]);"";['BenchBudEE.csv'.F246]) ->  | G246: of:=IF(ISNUMBER(SEARCH("[0-9]";[.A246]));MID([.A246];1;SEARCH("[0-9]";[.A246])-1);"") -> 
A247: of:=IF(ISBLANK(['BenchBudEE.csv'.A247]);"";['BenchBudEE.csv'.A247]) ->  | B247: of:=IF(ISBLANK(['BenchBudEE.csv'.B247]);"";['BenchBudEE.csv'.B247]) ->  | C247: of:=IF(ISBLANK(['BenchBudEE.csv'.C382]);"";MID(['BenchBudEE.csv'.C382];SEARCH(":";['BenchBudEE.csv'.C382])+1;100)) ->  | D247: of:=IF(ISBLANK(['BenchBudEE.csv'.D247]);"";['BenchBudEE.csv'.D247]) ->  | E247: of:=IF(ISBLANK(['BenchBudEE.csv'.E247]);"";['BenchBudEE.csv'.E247]) ->  | F247: of:=IF(ISBLANK(['BenchBudEE.csv'.F247]);"";['BenchBudEE.csv'.F247]) ->  | G247: of:=IF(ISNUMBER(SEARCH("[0-9]";[.A247]));MID([.A247];1;SEARCH("[0-9]";[.A247])-1);"") -> 
A248: of:=IF(ISBLANK(['BenchBudEE.csv'.A248]);"";['BenchBudEE.csv'.A248]) ->  | B248: of:=IF(ISBLANK(['BenchBudEE.csv'.B248]);"";['BenchBudEE.csv'.B248]) ->  | C248: of:=IF(ISBLANK(['BenchBudEE.csv'.C383]);"";MID(['BenchBudEE.csv'.C383];SEARCH(":";['BenchBudEE.csv'.C383])+1;100)) ->  | D248: of:=IF(ISBLANK(['BenchBudEE.csv'.D248]);"";['BenchBudEE.csv'.D248]) ->  | E248: of:=IF(ISBLANK(['BenchBudEE.csv'.E248]);"";['BenchBudEE.csv'.E248]) ->  | F248: of:=IF(ISBLANK(['BenchBudEE.csv'.F248]);"";['BenchBudEE.csv'.F248]) ->  | G248: of:=IF(ISNUMBER(SEARCH("[0-9]";[.A248]));MID([.A248];1;SEARCH("[0-9]";[.A248])-1);"") -> 
A249: of:=IF(ISBLANK(['BenchBudEE.csv'.A249]);"";['BenchBudEE.csv'.A249]) ->  | B249: of:=IF(ISBLANK(['BenchBudEE.csv'.B249]);"";['BenchBudEE.csv'.B249]) ->  | C249: of:=IF(ISBLANK(['BenchBudEE.csv'.C384]);"";MID(['BenchBudEE.csv'.C384];SEARCH(":";['BenchBudEE.csv'.C384])+1;100)) ->  | D249: of:=IF(ISBLANK(['BenchBudEE.csv'.D249]);"";['BenchBudEE.csv'.D249]) ->  | E249: of:=IF(ISBLANK(['BenchBudEE.csv'.E249]);"";['BenchBudEE.csv'.E249]) ->  | F249: of:=IF(ISBLANK(['BenchBudEE.csv'.F249]);"";['BenchBudEE.csv'.F249]) ->  | G249: of:=IF(ISNUMBER(SEARCH("[0-9]";[.A249]));MID([.A249];1;SEARCH("[0-9]";[.A249])-1);"") -> 
A250: of:=IF(ISBLANK(['BenchBudEE.csv'.A250]);"";['BenchBudEE.csv'.A250]) ->  | B250: of:=IF(ISBLANK(['BenchBudEE.csv'.B250]);"";['BenchBudEE.csv'.B250]) ->  | C250: of:=IF(ISBLANK(['BenchBudEE.csv'.C385]);"";MID(['BenchBudEE.csv'.C385];SEARCH(":";['BenchBudEE.csv'.C385])+1;100)) ->  | D250: of:=IF(ISBLANK(['BenchBudEE.csv'.D250]);"";['BenchBudEE.csv'.D250]) ->  | E250: of:=IF(ISBLANK(['BenchBudEE.csv'.E250]);"";['BenchBudEE.csv'.E250]) ->  | F250: of:=IF(ISBLANK(['BenchBudEE.csv'.F250]);"";['BenchBudEE.csv'.F250]) ->  | G250: of:=IF(ISNUMBER(SEARCH("[0-9]";[.A250]));MID([.A250];1;SEARCH("[0-9]";[.A250])-1);"") -> 
A251: of:=IF(ISBLANK(['BenchBudEE.csv'.A251]);"";['BenchBudEE.csv'.A251]) ->  | B251: of:=IF(ISBLANK(['BenchBudEE.csv'.B251]);"";['BenchBudEE.csv'.B251]) ->  | C251: of:=IF(ISBLANK(['BenchBudEE.csv'.C386]);"";MID(['BenchBudEE.csv'.C386];SEARCH(":";['BenchBudEE.csv'.C386])+1;100)) ->  | D251: of:=IF(ISBLANK(['BenchBudEE.csv'.D251]);"";['BenchBudEE.csv'.D251]) ->  | E251: of:=IF(ISBLANK(['BenchBudEE.csv'.E251]);"";['BenchBudEE.csv'.E251]) ->  | F251: of:=IF(ISBLANK(['BenchBudEE.csv'.F251]);"";['BenchBudEE.csv'.F251]) ->  | G251: of:=IF(ISNUMBER(SEARCH("[0-9]";[.A251]));MID([.A251];1;SEARCH("[0-9]";[.A251])-1);"") -> 
A252: of:=IF(ISBLANK(['BenchBudEE.csv'.A252]);"";['BenchBudEE.csv'.A252]) ->  | B252: of:=IF(ISBLANK(['BenchBudEE.csv'.B252]);"";['BenchBudEE.csv'.B252]) ->  | C252: of:=IF(ISBLANK(['BenchBudEE.csv'.C387]);"";MID(['BenchBudEE.csv'.C387];SEARCH(":";['BenchBudEE.csv'.C387])+1;100)) ->  | D252: of:=IF(ISBLANK(['BenchBudEE.csv'.D252]);"";['BenchBudEE.csv'.D252]) ->  | E252: of:=IF(ISBLANK(['BenchBudEE.csv'.E252]);"";['BenchBudEE.csv'.E252]) ->  | F252: of:=IF(ISBLANK(['BenchBudEE.csv'.F252]);"";['BenchBudEE.csv'.F252]) ->  | G252: of:=IF(ISNUMBER(SEARCH("[0-9]";[.A252]));MID([.A252];1;SEARCH("[0-9]";[.A252])-1);"") -> 
A253: of:=IF(ISBLANK(['BenchBudEE.csv'.A253]);"";['BenchBudEE.csv'.A253]) ->  | B253: of:=IF(ISBLANK(['BenchBudEE.csv'.B253]);"";['BenchBudEE.csv'.B253]) ->  | C253: of:=IF(ISBLANK(['BenchBudEE.csv'.C388]);"";MID(['BenchBudEE.csv'.C388];SEARCH(":";['BenchBudEE.csv'.C388])+1;100)) ->  | D253: of:=IF(ISBLANK(['BenchBudEE.csv'.D253]);"";['BenchBudEE.csv'.D253]) ->  | E253: of:=IF(ISBLANK(['BenchBudEE.csv'.E253]);"";['BenchBudEE.csv'.E253]) ->  | F253: of:=IF(ISBLANK(['BenchBudEE.csv'.F253]);"";['BenchBudEE.csv'.F253]) ->  | G253: of:=IF(ISNUMBER(SEARCH("[0-9]";[.A253]));MID([.A253];1;SEARCH("[0-9]";[.A253])-1);"") -> 
A254: of:=IF(ISBLANK(['BenchBudEE.csv'.A254]);"";['BenchBudEE.csv'.A254]) ->  | B254: of:=IF(ISBLANK(['BenchBudEE.csv'.B254]);"";['BenchBudEE.csv'.B254]) ->  | C254: of:=IF(ISBLANK(['BenchBudEE.csv'.C389]);"";MID(['BenchBudEE.csv'.C389];SEARCH(":";['BenchBudEE.csv'.C389])+1;100)) ->  | D254: of:=IF(ISBLANK(['BenchBudEE.csv'.D254]);"";['BenchBudEE.csv'.D254]) ->  | E254: of:=IF(ISBLANK(['BenchBudEE.csv'.E254]);"";['BenchBudEE.csv'.E254]) ->  | F254: of:=IF(ISBLANK(['BenchBudEE.csv'.F254]);"";['BenchBudEE.csv'.F254]) ->  | G254: of:=IF(ISNUMBER(SEARCH("[0-9]";[.A254]));MID([.A254];1;SEARCH("[0-9]";[.A254])-1);"") -> 
A255: of:=IF(ISBLANK(['BenchBudEE.csv'.A255]);"";['BenchBudEE.csv'.A255]) ->  | B255: of:=IF(ISBLANK(['BenchBudEE.csv'.B255]);"";['BenchBudEE.csv'.B255]) ->  | C255: of:=IF(ISBLANK(['BenchBudEE.csv'.C390]);"";MID(['BenchBudEE.csv'.C390];SEARCH(":";['BenchBudEE.csv'.C390])+1;100)) ->  | D255: of:=IF(ISBLANK(['BenchBudEE.csv'.D255]);"";['BenchBudEE.csv'.D255]) ->  | E255: of:=IF(ISBLANK(['BenchBudEE.csv'.E255]);"";['BenchBudEE.csv'.E255]) ->  | F255: of:=IF(ISBLANK(['BenchBudEE.csv'.F255]);"";['BenchBudEE.csv'.F255]) ->  | G255: of:=IF(ISNUMBER(SEARCH("[0-9]";[.A255]));MID([.A255];1;SEARCH("[0-9]";[.A255])-1);"") -> 
A256: of:=IF(ISBLANK(['BenchBudEE.csv'.A256]);"";['BenchBudEE.csv'.A256]) ->  | B256: of:=IF(ISBLANK(['BenchBudEE.csv'.B256]);"";['BenchBudEE.csv'.B256]) ->  | C256: of:=IF(ISBLANK(['BenchBudEE.csv'.C391]);"";MID(['BenchBudEE.csv'.C391];SEARCH(":";['BenchBudEE.csv'.C391])+1;100)) ->  | D256: of:=IF(ISBLANK(['BenchBudEE.csv'.D256]);"";['BenchBudEE.csv'.D256]) ->  | E256: of:=IF(ISBLANK(['BenchBudEE.csv'.E256]);"";['BenchBudEE.csv'.E256]) ->  | F256: of:=IF(ISBLANK(['BenchBudEE.csv'.F256]);"";['BenchBudEE.csv'.F256]) ->  | G256: of:=IF(ISNUMBER(SEARCH("[0-9]";[.A256]));MID([.A256];1;SEARCH("[0-9]";[.A256])-1);"") -> 
A257: of:=IF(ISBLANK(['BenchBudEE.csv'.A257]);"";['BenchBudEE.csv'.A257]) ->  | B257: of:=IF(ISBLANK(['BenchBudEE.csv'.B257]);"";['BenchBudEE.csv'.B257]) ->  | C257: of:=IF(ISBLANK(['BenchBudEE.csv'.C392]);"";MID(['BenchBudEE.csv'.C392];SEARCH(":";['BenchBudEE.csv'.C392])+1;100)) ->  | D257: of:=IF(ISBLANK(['BenchBudEE.csv'.D257]);"";['BenchBudEE.csv'.D257]) ->  | E257: of:=IF(ISBLANK(['BenchBudEE.csv'.E257]);"";['BenchBudEE.csv'.E257]) ->  | F257: of:=IF(ISBLANK(['BenchBudEE.csv'.F257]);"";['BenchBudEE.csv'.F257]) ->  | G257: of:=IF(ISNUMBER(SEARCH("[0-9]";[.A257]));MID([.A257];1;SEARCH("[0-9]";[.A257])-1);"") -> 
A258: of:=IF(ISBLANK(['BenchBudEE.csv'.A258]);"";['BenchBudEE.csv'.A258]) ->  | B258: of:=IF(ISBLANK(['BenchBudEE.csv'.B258]);"";['BenchBudEE.csv'.B258]) ->  | C258: of:=IF(ISBLANK(['BenchBudEE.csv'.C393]);"";MID(['BenchBudEE.csv'.C393];SEARCH(":";['BenchBudEE.csv'.C393])+1;100)) ->  | D258: of:=IF(ISBLANK(['BenchBudEE.csv'.D258]);"";['BenchBudEE.csv'.D258]) ->  | E258: of:=IF(ISBLANK(['BenchBudEE.csv'.E258]);"";['BenchBudEE.csv'.E258]) ->  | F258: of:=IF(ISBLANK(['BenchBudEE.csv'.F258]);"";['BenchBudEE.csv'.F258]) ->  | G258: of:=IF(ISNUMBER(SEARCH("[0-9]";[.A258]));MID([.A258];1;SEARCH("[0-9]";[.A258])-1);"") -> 
A259: of:=IF(ISBLANK(['BenchBudEE.csv'.A259]);"";['BenchBudEE.csv'.A259]) ->  | B259: of:=IF(ISBLANK(['BenchBudEE.csv'.B259]);"";['BenchBudEE.csv'.B259]) ->  | C259: of:=IF(ISBLANK(['BenchBudEE.csv'.C394]);"";MID(['BenchBudEE.csv'.C394];SEARCH(":";['BenchBudEE.csv'.C394])+1;100)) ->  | D259: of:=IF(ISBLANK(['BenchBudEE.csv'.D259]);"";['BenchBudEE.csv'.D259]) ->  | E259: of:=IF(ISBLANK(['BenchBudEE.csv'.E259]);"";['BenchBudEE.csv'.E259]) ->  | F259: of:=IF(ISBLANK(['BenchBudEE.csv'.F259]);"";['BenchBudEE.csv'.F259]) ->  | G259: of:=IF(ISNUMBER(SEARCH("[0-9]";[.A259]));MID([.A259];1;SEARCH("[0-9]";[.A259])-1);"") -> 
A260: of:=IF(ISBLANK(['BenchBudEE.csv'.A260]);"";['BenchBudEE.csv'.A260]) ->  | B260: of:=IF(ISBLANK(['BenchBudEE.csv'.B260]);"";['BenchBudEE.csv'.B260]) ->  | C260: of:=IF(ISBLANK(['BenchBudEE.csv'.C395]);"";MID(['BenchBudEE.csv'.C395];SEARCH(":";['BenchBudEE.csv'.C395])+1;100)) ->  | D260: of:=IF(ISBLANK(['BenchBudEE.csv'.D260]);"";['BenchBudEE.csv'.D260]) ->  | E260: of:=IF(ISBLANK(['BenchBudEE.csv'.E260]);"";['BenchBudEE.csv'.E260]) ->  | F260: of:=IF(ISBLANK(['BenchBudEE.csv'.F260]);"";['BenchBudEE.csv'.F260]) ->  | G260: of:=IF(ISNUMBER(SEARCH("[0-9]";[.A260]));MID([.A260];1;SEARCH("[0-9]";[.A260])-1);"") -> 
A261: of:=IF(ISBLANK(['BenchBudEE.csv'.A261]);"";['BenchBudEE.csv'.A261]) ->  | B261: of:=IF(ISBLANK(['BenchBudEE.csv'.B261]);"";['BenchBudEE.csv'.B261]) ->  | C261: of:=IF(ISBLANK(['BenchBudEE.csv'.C396]);"";MID(['BenchBudEE.csv'.C396];SEARCH(":";['BenchBudEE.csv'.C396])+1;100)) ->  | D261: of:=IF(ISBLANK(['BenchBudEE.csv'.D261]);"";['BenchBudEE.csv'.D261]) ->  | E261: of:=IF(ISBLANK(['BenchBudEE.csv'.E261]);"";['BenchBudEE.csv'.E261]) ->  | F261: of:=IF(ISBLANK(['BenchBudEE.csv'.F261]);"";['BenchBudEE.csv'.F261]) ->  | G261: of:=IF(ISNUMBER(SEARCH("[0-9]";[.A261]));MID([.A261];1;SEARCH("[0-9]";[.A261])-1);"") -> 
A262: of:=IF(ISBLANK(['BenchBudEE.csv'.A262]);"";['BenchBudEE.csv'.A262]) ->  | B262: of:=IF(ISBLANK(['BenchBudEE.csv'.B262]);"";['BenchBudEE.csv'.B262]) ->  | C262: of:=IF(ISBLANK(['BenchBudEE.csv'.C397]);"";MID(['BenchBudEE.csv'.C397];SEARCH(":";['BenchBudEE.csv'.C397])+1;100)) ->  | D262: of:=IF(ISBLANK(['BenchBudEE.csv'.D262]);"";['BenchBudEE.csv'.D262]) ->  | E262: of:=IF(ISBLANK(['BenchBudEE.csv'.E262]);"";['BenchBudEE.csv'.E262]) ->  | F262: of:=IF(ISBLANK(['BenchBudEE.csv'.F262]);"";['BenchBudEE.csv'.F262]) ->  | G262: of:=IF(ISNUMBER(SEARCH("[0-9]";[.A262]));MID([.A262];1;SEARCH("[0-9]";[.A262])-1);"") -> 
A263: of:=IF(ISBLANK(['BenchBudEE.csv'.A263]);"";['BenchBudEE.csv'.A263]) ->  | B263: of:=IF(ISBLANK(['BenchBudEE.csv'.B263]);"";['BenchBudEE.csv'.B263]) ->  | C263: of:=IF(ISBLANK(['BenchBudEE.csv'.C398]);"";MID(['BenchBudEE.csv'.C398];SEARCH(":";['BenchBudEE.csv'.C398])+1;100)) ->  | D263: of:=IF(ISBLANK(['BenchBudEE.csv'.D263]);"";['BenchBudEE.csv'.D263]) ->  | E263: of:=IF(ISBLANK(['BenchBudEE.csv'.E263]);"";['BenchBudEE.csv'.E263]) ->  | F263: of:=IF(ISBLANK(['BenchBudEE.csv'.F263]);"";['BenchBudEE.csv'.F263]) ->  | G263: of:=IF(ISNUMBER(SEARCH("[0-9]";[.A263]));MID([.A263];1;SEARCH("[0-9]";[.A263])-1);"") -> 
A264: of:=IF(ISBLANK(['BenchBudEE.csv'.A264]);"";['BenchBudEE.csv'.A264]) ->  | B264: of:=IF(ISBLANK(['BenchBudEE.csv'.B264]);"";['BenchBudEE.csv'.B264]) ->  | C264: of:=IF(ISBLANK(['BenchBudEE.csv'.C399]);"";MID(['BenchBudEE.csv'.C399];SEARCH(":";['BenchBudEE.csv'.C399])+1;100)) ->  | D264: of:=IF(ISBLANK(['BenchBudEE.csv'.D264]);"";['BenchBudEE.csv'.D264]) ->  | E264: of:=IF(ISBLANK(['BenchBudEE.csv'.E264]);"";['BenchBudEE.csv'.E264]) ->  | F264: of:=IF(ISBLANK(['BenchBudEE.csv'.F264]);"";['BenchBudEE.csv'.F264]) ->  | G264: of:=IF(ISNUMBER(SEARCH("[0-9]";[.A264]));MID([.A264];1;SEARCH("[0-9]";[.A264])-1);"") -> 
A265: of:=IF(ISBLANK(['BenchBudEE.csv'.A265]);"";['BenchBudEE.csv'.A265]) ->  | B265: of:=IF(ISBLANK(['BenchBudEE.csv'.B265]);"";['BenchBudEE.csv'.B265]) ->  | C265: of:=IF(ISBLANK(['BenchBudEE.csv'.C400]);"";MID(['BenchBudEE.csv'.C400];SEARCH(":";['BenchBudEE.csv'.C400])+1;100)) ->  | D265: of:=IF(ISBLANK(['BenchBudEE.csv'.D265]);"";['BenchBudEE.csv'.D265]) ->  | E265: of:=IF(ISBLANK(['BenchBudEE.csv'.E265]);"";['BenchBudEE.csv'.E265]) ->  | F265: of:=IF(ISBLANK(['BenchBudEE.csv'.F265]);"";['BenchBudEE.csv'.F265]) ->  | G265: of:=IF(ISNUMBER(SEARCH("[0-9]";[.A265]));MID([.A265];1;SEARCH("[0-9]";[.A265])-1);"") -> 
A266: of:=IF(ISBLANK(['BenchBudEE.csv'.A266]);"";['BenchBudEE.csv'.A266]) ->  | B266: of:=IF(ISBLANK(['BenchBudEE.csv'.B266]);"";['BenchBudEE.csv'.B266]) ->  | C266: of:=IF(ISBLANK(['BenchBudEE.csv'.C401]);"";MID(['BenchBudEE.csv'.C401];SEARCH(":";['BenchBudEE.csv'.C401])+1;100)) ->  | D266: of:=IF(ISBLANK(['BenchBudEE.csv'.D266]);"";['BenchBudEE.csv'.D266]) ->  | E266: of:=IF(ISBLANK(['BenchBudEE.csv'.E266]);"";['BenchBudEE.csv'.E266]) ->  | F266: of:=IF(ISBLANK(['BenchBudEE.csv'.F266]);"";['BenchBudEE.csv'.F266]) ->  | G266: of:=IF(ISNUMBER(SEARCH("[0-9]";[.A266]));MID([.A266];1;SEARCH("[0-9]";[.A266])-1);"") -> 
A267: of:=IF(ISBLANK(['BenchBudEE.csv'.A267]);"";['BenchBudEE.csv'.A267]) ->  | B267: of:=IF(ISBLANK(['BenchBudEE.csv'.B267]);"";['BenchBudEE.csv'.B267]) ->  | C267: of:=IF(ISBLANK(['BenchBudEE.csv'.C402]);"";MID(['BenchBudEE.csv'.C402];SEARCH(":";['BenchBudEE.csv'.C402])+1;100)) ->  | D267: of:=IF(ISBLANK(['BenchBudEE.csv'.D267]);"";['BenchBudEE.csv'.D267]) ->  | E267: of:=IF(ISBLANK(['BenchBudEE.csv'.E267]);"";['BenchBudEE.csv'.E267]) ->  | F267: of:=IF(ISBLANK(['BenchBudEE.csv'.F267]);"";['BenchBudEE.csv'.F267]) ->  | G267: of:=IF(ISNUMBER(SEARCH("[0-9]";[.A267]));MID([.A267];1;SEARCH("[0-9]";[.A267])-1);"") -> 
A268: of:=IF(ISBLANK(['BenchBudEE.csv'.A268]);"";['BenchBudEE.csv'.A268]) ->  | B268: of:=IF(ISBLANK(['BenchBudEE.csv'.B268]);"";['BenchBudEE.csv'.B268]) ->  | C268: of:=IF(ISBLANK(['BenchBudEE.csv'.C403]);"";MID(['BenchBudEE.csv'.C403];SEARCH(":";['BenchBudEE.csv'.C403])+1;100)) ->  | D268: of:=IF(ISBLANK(['BenchBudEE.csv'.D268]);"";['BenchBudEE.csv'.D268]) ->  | E268: of:=IF(ISBLANK(['BenchBudEE.csv'.E268]);"";['BenchBudEE.csv'.E268]) ->  | F268: of:=IF(ISBLANK(['BenchBudEE.csv'.F268]);"";['BenchBudEE.csv'.F268]) ->  | G268: of:=IF(ISNUMBER(SEARCH("[0-9]";[.A268]));MID([.A268];1;SEARCH("[0-9]";[.A268])-1);"") -> 
A269: of:=IF(ISBLANK(['BenchBudEE.csv'.A269]);"";['BenchBudEE.csv'.A269]) ->  | B269: of:=IF(ISBLANK(['BenchBudEE.csv'.B269]);"";['BenchBudEE.csv'.B269]) ->  | C269: of:=IF(ISBLANK(['BenchBudEE.csv'.C404]);"";MID(['BenchBudEE.csv'.C404];SEARCH(":";['BenchBudEE.csv'.C404])+1;100)) ->  | D269: of:=IF(ISBLANK(['BenchBudEE.csv'.D269]);"";['BenchBudEE.csv'.D269]) ->  | E269: of:=IF(ISBLANK(['BenchBudEE.csv'.E269]);"";['BenchBudEE.csv'.E269]) ->  | F269: of:=IF(ISBLANK(['BenchBudEE.csv'.F269]);"";['BenchBudEE.csv'.F269]) ->  | G269: of:=IF(ISNUMBER(SEARCH("[0-9]";[.A269]));MID([.A269];1;SEARCH("[0-9]";[.A269])-1);"") -> 
A270: of:=IF(ISBLANK(['BenchBudEE.csv'.A270]);"";['BenchBudEE.csv'.A270]) ->  | B270: of:=IF(ISBLANK(['BenchBudEE.csv'.B270]);"";['BenchBudEE.csv'.B270]) ->  | C270: of:=IF(ISBLANK(['BenchBudEE.csv'.C405]);"";MID(['BenchBudEE.csv'.C405];SEARCH(":";['BenchBudEE.csv'.C405])+1;100)) ->  | D270: of:=IF(ISBLANK(['BenchBudEE.csv'.D270]);"";['BenchBudEE.csv'.D270]) ->  | E270: of:=IF(ISBLANK(['BenchBudEE.csv'.E270]);"";['BenchBudEE.csv'.E270]) ->  | F270: of:=IF(ISBLANK(['BenchBudEE.csv'.F270]);"";['BenchBudEE.csv'.F270]) ->  | G270: of:=IF(ISNUMBER(SEARCH("[0-9]";[.A270]));MID([.A270];1;SEARCH("[0-9]";[.A270])-1);"") -> 
A271: of:=IF(ISBLANK(['BenchBudEE.csv'.A271]);"";['BenchBudEE.csv'.A271]) ->  | B271: of:=IF(ISBLANK(['BenchBudEE.csv'.B271]);"";['BenchBudEE.csv'.B271]) ->  | C271: of:=IF(ISBLANK(['BenchBudEE.csv'.C406]);"";MID(['BenchBudEE.csv'.C406];SEARCH(":";['BenchBudEE.csv'.C406])+1;100)) ->  | D271: of:=IF(ISBLANK(['BenchBudEE.csv'.D271]);"";['BenchBudEE.csv'.D271]) ->  | E271: of:=IF(ISBLANK(['BenchBudEE.csv'.E271]);"";['BenchBudEE.csv'.E271]) ->  | F271: of:=IF(ISBLANK(['BenchBudEE.csv'.F271]);"";['BenchBudEE.csv'.F271]) ->  | G271: of:=IF(ISNUMBER(SEARCH("[0-9]";[.A271]));MID([.A271];1;SEARCH("[0-9]";[.A271])-1);"") -> 
A272: of:=IF(ISBLANK(['BenchBudEE.csv'.A272]);"";['BenchBudEE.csv'.A272]) ->  | B272: of:=IF(ISBLANK(['BenchBudEE.csv'.B272]);"";['BenchBudEE.csv'.B272]) ->  | C272: of:=IF(ISBLANK(['BenchBudEE.csv'.C407]);"";MID(['BenchBudEE.csv'.C407];SEARCH(":";['BenchBudEE.csv'.C407])+1;100)) ->  | D272: of:=IF(ISBLANK(['BenchBudEE.csv'.D272]);"";['BenchBudEE.csv'.D272]) ->  | E272: of:=IF(ISBLANK(['BenchBudEE.csv'.E272]);"";['BenchBudEE.csv'.E272]) ->  | F272: of:=IF(ISBLANK(['BenchBudEE.csv'.F272]);"";['BenchBudEE.csv'.F272]) ->  | G272: of:=IF(ISNUMBER(SEARCH("[0-9]";[.A272]));MID([.A272];1;SEARCH("[0-9]";[.A272])-1);"") -> 
A273: of:=IF(ISBLANK(['BenchBudEE.csv'.A273]);"";['BenchBudEE.csv'.A273]) ->  | B273: of:=IF(ISBLANK(['BenchBudEE.csv'.B273]);"";['BenchBudEE.csv'.B273]) ->  | C273: of:=IF(ISBLANK(['BenchBudEE.csv'.C408]);"";MID(['BenchBudEE.csv'.C408];SEARCH(":";['BenchBudEE.csv'.C408])+1;100)) ->  | D273: of:=IF(ISBLANK(['BenchBudEE.csv'.D273]);"";['BenchBudEE.csv'.D273]) ->  | E273: of:=IF(ISBLANK(['BenchBudEE.csv'.E273]);"";['BenchBudEE.csv'.E273]) ->  | F273: of:=IF(ISBLANK(['BenchBudEE.csv'.F273]);"";['BenchBudEE.csv'.F273]) ->  | G273: of:=IF(ISNUMBER(SEARCH("[0-9]";[.A273]));MID([.A273];1;SEARCH("[0-9]";[.A273])-1);"") -> 
A274: of:=IF(ISBLANK(['BenchBudEE.csv'.A274]);"";['BenchBudEE.csv'.A274]) ->  | B274: of:=IF(ISBLANK(['BenchBudEE.csv'.B274]);"";['BenchBudEE.csv'.B274]) ->  | C274: of:=IF(ISBLANK(['BenchBudEE.csv'.C409]);"";MID(['BenchBudEE.csv'.C409];SEARCH(":";['BenchBudEE.csv'.C409])+1;100)) ->  | D274: of:=IF(ISBLANK(['BenchBudEE.csv'.D274]);"";['BenchBudEE.csv'.D274]) ->  | E274: of:=IF(ISBLANK(['BenchBudEE.csv'.E274]);"";['BenchBudEE.csv'.E274]) ->  | F274: of:=IF(ISBLANK(['BenchBudEE.csv'.F274]);"";['BenchBudEE.csv'.F274]) ->  | G274: of:=IF(ISNUMBER(SEARCH("[0-9]";[.A274]));MID([.A274];1;SEARCH("[0-9]";[.A274])-1);"") -> 
A275: of:=IF(ISBLANK(['BenchBudEE.csv'.A275]);"";['BenchBudEE.csv'.A275]) ->  | B275: of:=IF(ISBLANK(['BenchBudEE.csv'.B275]);"";['BenchBudEE.csv'.B275]) ->  | C275: of:=IF(ISBLANK(['BenchBudEE.csv'.C410]);"";MID(['BenchBudEE.csv'.C410];SEARCH(":";['BenchBudEE.csv'.C410])+1;100)) ->  | D275: of:=IF(ISBLANK(['BenchBudEE.csv'.D275]);"";['BenchBudEE.csv'.D275]) ->  | E275: of:=IF(ISBLANK(['BenchBudEE.csv'.E275]);"";['BenchBudEE.csv'.E275]) ->  | F275: of:=IF(ISBLANK(['BenchBudEE.csv'.F275]);"";['BenchBudEE.csv'.F275]) ->  | G275: of:=IF(ISNUMBER(SEARCH("[0-9]";[.A275]));MID([.A275];1;SEARCH("[0-9]";[.A275])-1);"") -> 
A276: of:=IF(ISBLANK(['BenchBudEE.csv'.A276]);"";['BenchBudEE.csv'.A276]) ->  | B276: of:=IF(ISBLANK(['BenchBudEE.csv'.B276]);"";['BenchBudEE.csv'.B276]) ->  | C276: of:=IF(ISBLANK(['BenchBudEE.csv'.C411]);"";MID(['BenchBudEE.csv'.C411];SEARCH(":";['BenchBudEE.csv'.C411])+1;100)) ->  | D276: of:=IF(ISBLANK(['BenchBudEE.csv'.D276]);"";['BenchBudEE.csv'.D276]) ->  | E276: of:=IF(ISBLANK(['BenchBudEE.csv'.E276]);"";['BenchBudEE.csv'.E276]) ->  | F276: of:=IF(ISBLANK(['BenchBudEE.csv'.F276]);"";['BenchBudEE.csv'.F276]) ->  | G276: of:=IF(ISNUMBER(SEARCH("[0-9]";[.A276]));MID([.A276];1;SEARCH("[0-9]";[.A276])-1);"") -> 
A277: of:=IF(ISBLANK(['BenchBudEE.csv'.A277]);"";['BenchBudEE.csv'.A277]) ->  | B277: of:=IF(ISBLANK(['BenchBudEE.csv'.B277]);"";['BenchBudEE.csv'.B277]) ->  | C277: of:=IF(ISBLANK(['BenchBudEE.csv'.C412]);"";MID(['BenchBudEE.csv'.C412];SEARCH(":";['BenchBudEE.csv'.C412])+1;100)) ->  | D277: of:=IF(ISBLANK(['BenchBudEE.csv'.D277]);"";['BenchBudEE.csv'.D277]) ->  | E277: of:=IF(ISBLANK(['BenchBudEE.csv'.E277]);"";['BenchBudEE.csv'.E277]) ->  | F277: of:=IF(ISBLANK(['BenchBudEE.csv'.F277]);"";['BenchBudEE.csv'.F277]) ->  | G277: of:=IF(ISNUMBER(SEARCH("[0-9]";[.A277]));MID([.A277];1;SEARCH("[0-9]";[.A277])-1);"") -> 
A278: of:=IF(ISBLANK(['BenchBudEE.csv'.A278]);"";['BenchBudEE.csv'.A278]) ->  | B278: of:=IF(ISBLANK(['BenchBudEE.csv'.B278]);"";['BenchBudEE.csv'.B278]) ->  | C278: of:=IF(ISBLANK(['BenchBudEE.csv'.C413]);"";MID(['BenchBudEE.csv'.C413];SEARCH(":";['BenchBudEE.csv'.C413])+1;100)) ->  | D278: of:=IF(ISBLANK(['BenchBudEE.csv'.D278]);"";['BenchBudEE.csv'.D278]) ->  | E278: of:=IF(ISBLANK(['BenchBudEE.csv'.E278]);"";['BenchBudEE.csv'.E278]) ->  | F278: of:=IF(ISBLANK(['BenchBudEE.csv'.F278]);"";['BenchBudEE.csv'.F278]) ->  | G278: of:=IF(ISNUMBER(SEARCH("[0-9]";[.A278]));MID([.A278];1;SEARCH("[0-9]";[.A278])-1);"") -> 
A279: of:=IF(ISBLANK(['BenchBudEE.csv'.A279]);"";['BenchBudEE.csv'.A279]) ->  | B279: of:=IF(ISBLANK(['BenchBudEE.csv'.B279]);"";['BenchBudEE.csv'.B279]) ->  | C279: of:=IF(ISBLANK(['BenchBudEE.csv'.C414]);"";MID(['BenchBudEE.csv'.C414];SEARCH(":";['BenchBudEE.csv'.C414])+1;100)) ->  | D279: of:=IF(ISBLANK(['BenchBudEE.csv'.D279]);"";['BenchBudEE.csv'.D279]) ->  | E279: of:=IF(ISBLANK(['BenchBudEE.csv'.E279]);"";['BenchBudEE.csv'.E279]) ->  | F279: of:=IF(ISBLANK(['BenchBudEE.csv'.F279]);"";['BenchBudEE.csv'.F279]) ->  | G279: of:=IF(ISNUMBER(SEARCH("[0-9]";[.A279]));MID([.A279];1;SEARCH("[0-9]";[.A279])-1);"") -> 
A280: of:=IF(ISBLANK(['BenchBudEE.csv'.A280]);"";['BenchBudEE.csv'.A280]) ->  | B280: of:=IF(ISBLANK(['BenchBudEE.csv'.B280]);"";['BenchBudEE.csv'.B280]) ->  | C280: of:=IF(ISBLANK(['BenchBudEE.csv'.C415]);"";MID(['BenchBudEE.csv'.C415];SEARCH(":";['BenchBudEE.csv'.C415])+1;100)) ->  | D280: of:=IF(ISBLANK(['BenchBudEE.csv'.D280]);"";['BenchBudEE.csv'.D280]) ->  | E280: of:=IF(ISBLANK(['BenchBudEE.csv'.E280]);"";['BenchBudEE.csv'.E280]) ->  | F280: of:=IF(ISBLANK(['BenchBudEE.csv'.F280]);"";['BenchBudEE.csv'.F280]) ->  | G280: of:=IF(ISNUMBER(SEARCH("[0-9]";[.A280]));MID([.A280];1;SEARCH("[0-9]";[.A280])-1);"") -> 
A281: of:=IF(ISBLANK(['BenchBudEE.csv'.A281]);"";['BenchBudEE.csv'.A281]) ->  | B281: of:=IF(ISBLANK(['BenchBudEE.csv'.B281]);"";['BenchBudEE.csv'.B281]) ->  | C281: of:=IF(ISBLANK(['BenchBudEE.csv'.C416]);"";MID(['BenchBudEE.csv'.C416];SEARCH(":";['BenchBudEE.csv'.C416])+1;100)) ->  | D281: of:=IF(ISBLANK(['BenchBudEE.csv'.D281]);"";['BenchBudEE.csv'.D281]) ->  | E281: of:=IF(ISBLANK(['BenchBudEE.csv'.E281]);"";['BenchBudEE.csv'.E281]) ->  | F281: of:=IF(ISBLANK(['BenchBudEE.csv'.F281]);"";['BenchBudEE.csv'.F281]) ->  | G281: of:=IF(ISNUMBER(SEARCH("[0-9]";[.A281]));MID([.A281];1;SEARCH("[0-9]";[.A281])-1);"") -> 
A282: of:=IF(ISBLANK(['BenchBudEE.csv'.A282]);"";['BenchBudEE.csv'.A282]) ->  | B282: of:=IF(ISBLANK(['BenchBudEE.csv'.B282]);"";['BenchBudEE.csv'.B282]) ->  | C282: of:=IF(ISBLANK(['BenchBudEE.csv'.C417]);"";MID(['BenchBudEE.csv'.C417];SEARCH(":";['BenchBudEE.csv'.C417])+1;100)) ->  | D282: of:=IF(ISBLANK(['BenchBudEE.csv'.D282]);"";['BenchBudEE.csv'.D282]) ->  | E282: of:=IF(ISBLANK(['BenchBudEE.csv'.E282]);"";['BenchBudEE.csv'.E282]) ->  | F282: of:=IF(ISBLANK(['BenchBudEE.csv'.F282]);"";['BenchBudEE.csv'.F282]) ->  | G282: of:=IF(ISNUMBER(SEARCH("[0-9]";[.A282]));MID([.A282];1;SEARCH("[0-9]";[.A282])-1);"") -> 
A283: of:=IF(ISBLANK(['BenchBudEE.csv'.A283]);"";['BenchBudEE.csv'.A283]) ->  | B283: of:=IF(ISBLANK(['BenchBudEE.csv'.B283]);"";['BenchBudEE.csv'.B283]) ->  | C283: of:=IF(ISBLANK(['BenchBudEE.csv'.C418]);"";MID(['BenchBudEE.csv'.C418];SEARCH(":";['BenchBudEE.csv'.C418])+1;100)) ->  | D283: of:=IF(ISBLANK(['BenchBudEE.csv'.D283]);"";['BenchBudEE.csv'.D283]) ->  | E283: of:=IF(ISBLANK(['BenchBudEE.csv'.E283]);"";['BenchBudEE.csv'.E283]) ->  | F283: of:=IF(ISBLANK(['BenchBudEE.csv'.F283]);"";['BenchBudEE.csv'.F283]) ->  | G283: of:=IF(ISNUMBER(SEARCH("[0-9]";[.A283]));MID([.A283];1;SEARCH("[0-9]";[.A283])-1);"") -> 
A284: of:=IF(ISBLANK(['BenchBudEE.csv'.A284]);"";['BenchBudEE.csv'.A284]) ->  | B284: of:=IF(ISBLANK(['BenchBudEE.csv'.B284]);"";['BenchBudEE.csv'.B284]) ->  | C284: of:=IF(ISBLANK(['BenchBudEE.csv'.C419]);"";MID(['BenchBudEE.csv'.C419];SEARCH(":";['BenchBudEE.csv'.C419])+1;100)) ->  | D284: of:=IF(ISBLANK(['BenchBudEE.csv'.D284]);"";['BenchBudEE.csv'.D284]) ->  | E284: of:=IF(ISBLANK(['BenchBudEE.csv'.E284]);"";['BenchBudEE.csv'.E284]) ->  | F284: of:=IF(ISBLANK(['BenchBudEE.csv'.F284]);"";['BenchBudEE.csv'.F284]) ->  | G284: of:=IF(ISNUMBER(SEARCH("[0-9]";[.A284]));MID([.A284];1;SEARCH("[0-9]";[.A284])-1);"") -> 
A285: of:=IF(ISBLANK(['BenchBudEE.csv'.A285]);"";['BenchBudEE.csv'.A285]) ->  | B285: of:=IF(ISBLANK(['BenchBudEE.csv'.B285]);"";['BenchBudEE.csv'.B285]) ->  | C285: of:=IF(ISBLANK(['BenchBudEE.csv'.C420]);"";MID(['BenchBudEE.csv'.C420];SEARCH(":";['BenchBudEE.csv'.C420])+1;100)) ->  | D285: of:=IF(ISBLANK(['BenchBudEE.csv'.D285]);"";['BenchBudEE.csv'.D285]) ->  | E285: of:=IF(ISBLANK(['BenchBudEE.csv'.E285]);"";['BenchBudEE.csv'.E285]) ->  | F285: of:=IF(ISBLANK(['BenchBudEE.csv'.F285]);"";['BenchBudEE.csv'.F285]) ->  | G285: of:=IF(ISNUMBER(SEARCH("[0-9]";[.A285]));MID([.A285];1;SEARCH("[0-9]";[.A285])-1);"") -> 
A286: of:=IF(ISBLANK(['BenchBudEE.csv'.A286]);"";['BenchBudEE.csv'.A286]) ->  | B286: of:=IF(ISBLANK(['BenchBudEE.csv'.B286]);"";['BenchBudEE.csv'.B286]) ->  | C286: of:=IF(ISBLANK(['BenchBudEE.csv'.C421]);"";MID(['BenchBudEE.csv'.C421];SEARCH(":";['BenchBudEE.csv'.C421])+1;100)) ->  | D286: of:=IF(ISBLANK(['BenchBudEE.csv'.D286]);"";['BenchBudEE.csv'.D286]) ->  | E286: of:=IF(ISBLANK(['BenchBudEE.csv'.E286]);"";['BenchBudEE.csv'.E286]) ->  | F286: of:=IF(ISBLANK(['BenchBudEE.csv'.F286]);"";['BenchBudEE.csv'.F286]) ->  | G286: of:=IF(ISNUMBER(SEARCH("[0-9]";[.A286]));MID([.A286];1;SEARCH("[0-9]";[.A286])-1);"") -> 
A287: of:=IF(ISBLANK(['BenchBudEE.csv'.A287]);"";['BenchBudEE.csv'.A287]) ->  | B287: of:=IF(ISBLANK(['BenchBudEE.csv'.B287]);"";['BenchBudEE.csv'.B287]) ->  | C287: of:=IF(ISBLANK(['BenchBudEE.csv'.C422]);"";MID(['BenchBudEE.csv'.C422];SEARCH(":";['BenchBudEE.csv'.C422])+1;100)) ->  | D287: of:=IF(ISBLANK(['BenchBudEE.csv'.D287]);"";['BenchBudEE.csv'.D287]) ->  | E287: of:=IF(ISBLANK(['BenchBudEE.csv'.E287]);"";['BenchBudEE.csv'.E287]) ->  | F287: of:=IF(ISBLANK(['BenchBudEE.csv'.F287]);"";['BenchBudEE.csv'.F287]) ->  | G287: of:=IF(ISNUMBER(SEARCH("[0-9]";[.A287]));MID([.A287];1;SEARCH("[0-9]";[.A287])-1);"") -> 
A288: of:=IF(ISBLANK(['BenchBudEE.csv'.A288]);"";['BenchBudEE.csv'.A288]) ->  | B288: of:=IF(ISBLANK(['BenchBudEE.csv'.B288]);"";['BenchBudEE.csv'.B288]) ->  | C288: of:=IF(ISBLANK(['BenchBudEE.csv'.C423]);"";MID(['BenchBudEE.csv'.C423];SEARCH(":";['BenchBudEE.csv'.C423])+1;100)) ->  | D288: of:=IF(ISBLANK(['BenchBudEE.csv'.D288]);"";['BenchBudEE.csv'.D288]) ->  | E288: of:=IF(ISBLANK(['BenchBudEE.csv'.E288]);"";['BenchBudEE.csv'.E288]) ->  | F288: of:=IF(ISBLANK(['BenchBudEE.csv'.F288]);"";['BenchBudEE.csv'.F288]) ->  | G288: of:=IF(ISNUMBER(SEARCH("[0-9]";[.A288]));MID([.A288];1;SEARCH("[0-9]";[.A288])-1);"") -> 
A289: of:=IF(ISBLANK(['BenchBudEE.csv'.A289]);"";['BenchBudEE.csv'.A289]) ->  | B289: of:=IF(ISBLANK(['BenchBudEE.csv'.B289]);"";['BenchBudEE.csv'.B289]) ->  | C289: of:=IF(ISBLANK(['BenchBudEE.csv'.C424]);"";MID(['BenchBudEE.csv'.C424];SEARCH(":";['BenchBudEE.csv'.C424])+1;100)) ->  | D289: of:=IF(ISBLANK(['BenchBudEE.csv'.D289]);"";['BenchBudEE.csv'.D289]) ->  | E289: of:=IF(ISBLANK(['BenchBudEE.csv'.E289]);"";['BenchBudEE.csv'.E289]) ->  | F289: of:=IF(ISBLANK(['BenchBudEE.csv'.F289]);"";['BenchBudEE.csv'.F289]) ->  | G289: of:=IF(ISNUMBER(SEARCH("[0-9]";[.A289]));MID([.A289];1;SEARCH("[0-9]";[.A289])-1);"") -> 
A290: of:=IF(ISBLANK(['BenchBudEE.csv'.A290]);"";['BenchBudEE.csv'.A290]) ->  | B290: of:=IF(ISBLANK(['BenchBudEE.csv'.B290]);"";['BenchBudEE.csv'.B290]) ->  | C290: of:=IF(ISBLANK(['BenchBudEE.csv'.C425]);"";MID(['BenchBudEE.csv'.C425];SEARCH(":";['BenchBudEE.csv'.C425])+1;100)) ->  | D290: of:=IF(ISBLANK(['BenchBudEE.csv'.D290]);"";['BenchBudEE.csv'.D290]) ->  | E290: of:=IF(ISBLANK(['BenchBudEE.csv'.E290]);"";['BenchBudEE.csv'.E290]) ->  | F290: of:=IF(ISBLANK(['BenchBudEE.csv'.F290]);"";['BenchBudEE.csv'.F290]) ->  | G290: of:=IF(ISNUMBER(SEARCH("[0-9]";[.A290]));MID([.A290];1;SEARCH("[0-9]";[.A290])-1);"") -> 
A291: of:=IF(ISBLANK(['BenchBudEE.csv'.A291]);"";['BenchBudEE.csv'.A291]) ->  | B291: of:=IF(ISBLANK(['BenchBudEE.csv'.B291]);"";['BenchBudEE.csv'.B291]) ->  | C291: of:=IF(ISBLANK(['BenchBudEE.csv'.C426]);"";MID(['BenchBudEE.csv'.C426];SEARCH(":";['BenchBudEE.csv'.C426])+1;100)) ->  | D291: of:=IF(ISBLANK(['BenchBudEE.csv'.D291]);"";['BenchBudEE.csv'.D291]) ->  | E291: of:=IF(ISBLANK(['BenchBudEE.csv'.E291]);"";['BenchBudEE.csv'.E291]) ->  | F291: of:=IF(ISBLANK(['BenchBudEE.csv'.F291]);"";['BenchBudEE.csv'.F291]) ->  | G291: of:=IF(ISNUMBER(SEARCH("[0-9]";[.A291]));MID([.A291];1;SEARCH("[0-9]";[.A291])-1);"") -> 
A292: of:=IF(ISBLANK(['BenchBudEE.csv'.A292]);"";['BenchBudEE.csv'.A292]) ->  | B292: of:=IF(ISBLANK(['BenchBudEE.csv'.B292]);"";['BenchBudEE.csv'.B292]) ->  | C292: of:=IF(ISBLANK(['BenchBudEE.csv'.C427]);"";MID(['BenchBudEE.csv'.C427];SEARCH(":";['BenchBudEE.csv'.C427])+1;100)) ->  | D292: of:=IF(ISBLANK(['BenchBudEE.csv'.D292]);"";['BenchBudEE.csv'.D292]) ->  | E292: of:=IF(ISBLANK(['BenchBudEE.csv'.E292]);"";['BenchBudEE.csv'.E292]) ->  | F292: of:=IF(ISBLANK(['BenchBudEE.csv'.F292]);"";['BenchBudEE.csv'.F292]) ->  | G292: of:=IF(ISNUMBER(SEARCH("[0-9]";[.A292]));MID([.A292];1;SEARCH("[0-9]";[.A292])-1);"") -> 
A293: of:=IF(ISBLANK(['BenchBudEE.csv'.A293]);"";['BenchBudEE.csv'.A293]) ->  | B293: of:=IF(ISBLANK(['BenchBudEE.csv'.B293]);"";['BenchBudEE.csv'.B293]) ->  | C293: of:=IF(ISBLANK(['BenchBudEE.csv'.C428]);"";MID(['BenchBudEE.csv'.C428];SEARCH(":";['BenchBudEE.csv'.C428])+1;100)) ->  | D293: of:=IF(ISBLANK(['BenchBudEE.csv'.D293]);"";['BenchBudEE.csv'.D293]) ->  | E293: of:=IF(ISBLANK(['BenchBudEE.csv'.E293]);"";['BenchBudEE.csv'.E293]) ->  | F293: of:=IF(ISBLANK(['BenchBudEE.csv'.F293]);"";['BenchBudEE.csv'.F293]) ->  | G293: of:=IF(ISNUMBER(SEARCH("[0-9]";[.A293]));MID([.A293];1;SEARCH("[0-9]";[.A293])-1);"") -> 
A294: of:=IF(ISBLANK(['BenchBudEE.csv'.A294]);"";['BenchBudEE.csv'.A294]) ->  | B294: of:=IF(ISBLANK(['BenchBudEE.csv'.B294]);"";['BenchBudEE.csv'.B294]) ->  | C294: of:=IF(ISBLANK(['BenchBudEE.csv'.C429]);"";MID(['BenchBudEE.csv'.C429];SEARCH(":";['BenchBudEE.csv'.C429])+1;100)) ->  | D294: of:=IF(ISBLANK(['BenchBudEE.csv'.D294]);"";['BenchBudEE.csv'.D294]) ->  | E294: of:=IF(ISBLANK(['BenchBudEE.csv'.E294]);"";['BenchBudEE.csv'.E294]) ->  | F294: of:=IF(ISBLANK(['BenchBudEE.csv'.F294]);"";['BenchBudEE.csv'.F294]) ->  | G294: of:=IF(ISNUMBER(SEARCH("[0-9]";[.A294]));MID([.A294];1;SEARCH("[0-9]";[.A294])-1);"") -> 
A295: of:=IF(ISBLANK(['BenchBudEE.csv'.A295]);"";['BenchBudEE.csv'.A295]) ->  | B295: of:=IF(ISBLANK(['BenchBudEE.csv'.B295]);"";['BenchBudEE.csv'.B295]) ->  | C295: of:=IF(ISBLANK(['BenchBudEE.csv'.C430]);"";MID(['BenchBudEE.csv'.C430];SEARCH(":";['BenchBudEE.csv'.C430])+1;100)) ->  | D295: of:=IF(ISBLANK(['BenchBudEE.csv'.D295]);"";['BenchBudEE.csv'.D295]) ->  | E295: of:=IF(ISBLANK(['BenchBudEE.csv'.E295]);"";['BenchBudEE.csv'.E295]) ->  | F295: of:=IF(ISBLANK(['BenchBudEE.csv'.F295]);"";['BenchBudEE.csv'.F295]) ->  | G295: of:=IF(ISNUMBER(SEARCH("[0-9]";[.A295]));MID([.A295];1;SEARCH("[0-9]";[.A295])-1);"") -> 
A296: of:=IF(ISBLANK(['BenchBudEE.csv'.A296]);"";['BenchBudEE.csv'.A296]) ->  | B296: of:=IF(ISBLANK(['BenchBudEE.csv'.B296]);"";['BenchBudEE.csv'.B296]) ->  | C296: of:=IF(ISBLANK(['BenchBudEE.csv'.C431]);"";MID(['BenchBudEE.csv'.C431];SEARCH(":";['BenchBudEE.csv'.C431])+1;100)) ->  | D296: of:=IF(ISBLANK(['BenchBudEE.csv'.D296]);"";['BenchBudEE.csv'.D296]) ->  | E296: of:=IF(ISBLANK(['BenchBudEE.csv'.E296]);"";['BenchBudEE.csv'.E296]) ->  | F296: of:=IF(ISBLANK(['BenchBudEE.csv'.F296]);"";['BenchBudEE.csv'.F296]) ->  | G296: of:=IF(ISNUMBER(SEARCH("[0-9]";[.A296]));MID([.A296];1;SEARCH("[0-9]";[.A296])-1);"") -> 
A297: of:=IF(ISBLANK(['BenchBudEE.csv'.A297]);"";['BenchBudEE.csv'.A297]) ->  | B297: of:=IF(ISBLANK(['BenchBudEE.csv'.B297]);"";['BenchBudEE.csv'.B297]) ->  | C297: of:=IF(ISBLANK(['BenchBudEE.csv'.C432]);"";MID(['BenchBudEE.csv'.C432];SEARCH(":";['BenchBudEE.csv'.C432])+1;100)) ->  | D297: of:=IF(ISBLANK(['BenchBudEE.csv'.D297]);"";['BenchBudEE.csv'.D297]) ->  | E297: of:=IF(ISBLANK(['BenchBudEE.csv'.E297]);"";['BenchBudEE.csv'.E297]) ->  | F297: of:=IF(ISBLANK(['BenchBudEE.csv'.F297]);"";['BenchBudEE.csv'.F297]) ->  | G297: of:=IF(ISNUMBER(SEARCH("[0-9]";[.A297]));MID([.A297];1;SEARCH("[0-9]";[.A297])-1);"") -> 
A298: of:=IF(ISBLANK(['BenchBudEE.csv'.A298]);"";['BenchBudEE.csv'.A298]) ->  | B298: of:=IF(ISBLANK(['BenchBudEE.csv'.B298]);"";['BenchBudEE.csv'.B298]) ->  | C298: of:=IF(ISBLANK(['BenchBudEE.csv'.C433]);"";MID(['BenchBudEE.csv'.C433];SEARCH(":";['BenchBudEE.csv'.C433])+1;100)) ->  | D298: of:=IF(ISBLANK(['BenchBudEE.csv'.D298]);"";['BenchBudEE.csv'.D298]) ->  | E298: of:=IF(ISBLANK(['BenchBudEE.csv'.E298]);"";['BenchBudEE.csv'.E298]) ->  | F298: of:=IF(ISBLANK(['BenchBudEE.csv'.F298]);"";['BenchBudEE.csv'.F298]) ->  | G298: of:=IF(ISNUMBER(SEARCH("[0-9]";[.A298]));MID([.A298];1;SEARCH("[0-9]";[.A298])-1);"") -> 
A299: of:=IF(ISBLANK(['BenchBudEE.csv'.A299]);"";['BenchBudEE.csv'.A299]) ->  | B299: of:=IF(ISBLANK(['BenchBudEE.csv'.B299]);"";['BenchBudEE.csv'.B299]) ->  | C299: of:=IF(ISBLANK(['BenchBudEE.csv'.C434]);"";MID(['BenchBudEE.csv'.C434];SEARCH(":";['BenchBudEE.csv'.C434])+1;100)) ->  | D299: of:=IF(ISBLANK(['BenchBudEE.csv'.D299]);"";['BenchBudEE.csv'.D299]) ->  | E299: of:=IF(ISBLANK(['BenchBudEE.csv'.E299]);"";['BenchBudEE.csv'.E299]) ->  | F299: of:=IF(ISBLANK(['BenchBudEE.csv'.F299]);"";['BenchBudEE.csv'.F299]) ->  | G299: of:=IF(ISNUMBER(SEARCH("[0-9]";[.A299]));MID([.A299];1;SEARCH("[0-9]";[.A299])-1);"") -> 
A300: of:=IF(ISBLANK(['BenchBudEE.csv'.A300]);"";['BenchBudEE.csv'.A300]) ->  | B300: of:=IF(ISBLANK(['BenchBudEE.csv'.B300]);"";['BenchBudEE.csv'.B300]) ->  | C300: of:=IF(ISBLANK(['BenchBudEE.csv'.C435]);"";MID(['BenchBudEE.csv'.C435];SEARCH(":";['BenchBudEE.csv'.C435])+1;100)) ->  | D300: of:=IF(ISBLANK(['BenchBudEE.csv'.D300]);"";['BenchBudEE.csv'.D300]) ->  | E300: of:=IF(ISBLANK(['BenchBudEE.csv'.E300]);"";['BenchBudEE.csv'.E300]) ->  | F300: of:=IF(ISBLANK(['BenchBudEE.csv'.F300]);"";['BenchBudEE.csv'.F300]) ->  | G300: of:=IF(ISNUMBER(SEARCH("[0-9]";[.A300]));MID([.A300];1;SEARCH("[0-9]";[.A300])-1);"") -> 
A301: of:=IF(ISBLANK(['BenchBudEE.csv'.A301]);"";['BenchBudEE.csv'.A301]) ->  | B301: of:=IF(ISBLANK(['BenchBudEE.csv'.B301]);"";['BenchBudEE.csv'.B301]) ->  | C301: of:=IF(ISBLANK(['BenchBudEE.csv'.C436]);"";MID(['BenchBudEE.csv'.C436];SEARCH(":";['BenchBudEE.csv'.C436])+1;100)) ->  | D301: of:=IF(ISBLANK(['BenchBudEE.csv'.D301]);"";['BenchBudEE.csv'.D301]) ->  | E301: of:=IF(ISBLANK(['BenchBudEE.csv'.E301]);"";['BenchBudEE.csv'.E301]) ->  | F301: of:=IF(ISBLANK(['BenchBudEE.csv'.F301]);"";['BenchBudEE.csv'.F301]) ->  | G301: of:=IF(ISNUMBER(SEARCH("[0-9]";[.A301]));MID([.A301];1;SEARCH("[0-9]";[.A301])-1);"") -> 
A302: of:=IF(ISBLANK(['BenchBudEE.csv'.A302]);"";['BenchBudEE.csv'.A302]) ->  | B302: of:=IF(ISBLANK(['BenchBudEE.csv'.B302]);"";['BenchBudEE.csv'.B302]) ->  | C302: of:=IF(ISBLANK(['BenchBudEE.csv'.C437]);"";MID(['BenchBudEE.csv'.C437];SEARCH(":";['BenchBudEE.csv'.C437])+1;100)) ->  | D302: of:=IF(ISBLANK(['BenchBudEE.csv'.D302]);"";['BenchBudEE.csv'.D302]) ->  | E302: of:=IF(ISBLANK(['BenchBudEE.csv'.E302]);"";['BenchBudEE.csv'.E302]) ->  | F302: of:=IF(ISBLANK(['BenchBudEE.csv'.F302]);"";['BenchBudEE.csv'.F302]) ->  | G302: of:=IF(ISNUMBER(SEARCH("[0-9]";[.A302]));MID([.A302];1;SEARCH("[0-9]";[.A302])-1);"") -> 
A303: of:=IF(ISBLANK(['BenchBudEE.csv'.A303]);"";['BenchBudEE.csv'.A303]) ->  | B303: of:=IF(ISBLANK(['BenchBudEE.csv'.B303]);"";['BenchBudEE.csv'.B303]) ->  | C303: of:=IF(ISBLANK(['BenchBudEE.csv'.C438]);"";MID(['BenchBudEE.csv'.C438];SEARCH(":";['BenchBudEE.csv'.C438])+1;100)) ->  | D303: of:=IF(ISBLANK(['BenchBudEE.csv'.D303]);"";['BenchBudEE.csv'.D303]) ->  | E303: of:=IF(ISBLANK(['BenchBudEE.csv'.E303]);"";['BenchBudEE.csv'.E303]) ->  | F303: of:=IF(ISBLANK(['BenchBudEE.csv'.F303]);"";['BenchBudEE.csv'.F303]) ->  | G303: of:=IF(ISNUMBER(SEARCH("[0-9]";[.A303]));MID([.A303];1;SEARCH("[0-9]";[.A303])-1);"") -> 
A304: of:=IF(ISBLANK(['BenchBudEE.csv'.A304]);"";['BenchBudEE.csv'.A304]) ->  | B304: of:=IF(ISBLANK(['BenchBudEE.csv'.B304]);"";['BenchBudEE.csv'.B304]) ->  | C304: of:=IF(ISBLANK(['BenchBudEE.csv'.C439]);"";MID(['BenchBudEE.csv'.C439];SEARCH(":";['BenchBudEE.csv'.C439])+1;100)) ->  | D304: of:=IF(ISBLANK(['BenchBudEE.csv'.D304]);"";['BenchBudEE.csv'.D304]) ->  | E304: of:=IF(ISBLANK(['BenchBudEE.csv'.E304]);"";['BenchBudEE.csv'.E304]) ->  | F304: of:=IF(ISBLANK(['BenchBudEE.csv'.F304]);"";['BenchBudEE.csv'.F304]) ->  | G304: of:=IF(ISNUMBER(SEARCH("[0-9]";[.A304]));MID([.A304];1;SEARCH("[0-9]";[.A304])-1);"") -> 
A305: of:=IF(ISBLANK(['BenchBudEE.csv'.A305]);"";['BenchBudEE.csv'.A305]) ->  | B305: of:=IF(ISBLANK(['BenchBudEE.csv'.B305]);"";['BenchBudEE.csv'.B305]) ->  | C305: of:=IF(ISBLANK(['BenchBudEE.csv'.C440]);"";MID(['BenchBudEE.csv'.C440];SEARCH(":";['BenchBudEE.csv'.C440])+1;100)) ->  | D305: of:=IF(ISBLANK(['BenchBudEE.csv'.D305]);"";['BenchBudEE.csv'.D305]) ->  | E305: of:=IF(ISBLANK(['BenchBudEE.csv'.E305]);"";['BenchBudEE.csv'.E305]) ->  | F305: of:=IF(ISBLANK(['BenchBudEE.csv'.F305]);"";['BenchBudEE.csv'.F305]) ->  | G305: of:=IF(ISNUMBER(SEARCH("[0-9]";[.A305]));MID([.A305];1;SEARCH("[0-9]";[.A305])-1);"") -> 
A306: of:=IF(ISBLANK(['BenchBudEE.csv'.A306]);"";['BenchBudEE.csv'.A306]) ->  | B306: of:=IF(ISBLANK(['BenchBudEE.csv'.B306]);"";['BenchBudEE.csv'.B306]) ->  | C306: of:=IF(ISBLANK(['BenchBudEE.csv'.C441]);"";MID(['BenchBudEE.csv'.C441];SEARCH(":";['BenchBudEE.csv'.C441])+1;100)) ->  | D306: of:=IF(ISBLANK(['BenchBudEE.csv'.D306]);"";['BenchBudEE.csv'.D306]) ->  | E306: of:=IF(ISBLANK(['BenchBudEE.csv'.E306]);"";['BenchBudEE.csv'.E306]) ->  | F306: of:=IF(ISBLANK(['BenchBudEE.csv'.F306]);"";['BenchBudEE.csv'.F306]) ->  | G306: of:=IF(ISNUMBER(SEARCH("[0-9]";[.A306]));MID([.A306];1;SEARCH("[0-9]";[.A306])-1);"") -> 
A307: of:=IF(ISBLANK(['BenchBudEE.csv'.A307]);"";['BenchBudEE.csv'.A307]) ->  | B307: of:=IF(ISBLANK(['BenchBudEE.csv'.B307]);"";['BenchBudEE.csv'.B307]) ->  | C307: of:=IF(ISBLANK(['BenchBudEE.csv'.C442]);"";MID(['BenchBudEE.csv'.C442];SEARCH(":";['BenchBudEE.csv'.C442])+1;100)) ->  | D307: of:=IF(ISBLANK(['BenchBudEE.csv'.D307]);"";['BenchBudEE.csv'.D307]) ->  | E307: of:=IF(ISBLANK(['BenchBudEE.csv'.E307]);"";['BenchBudEE.csv'.E307]) ->  | F307: of:=IF(ISBLANK(['BenchBudEE.csv'.F307]);"";['BenchBudEE.csv'.F307]) ->  | G307: of:=IF(ISNUMBER(SEARCH("[0-9]";[.A307]));MID([.A307];1;SEARCH("[0-9]";[.A307])-1);"") -> 
A308: of:=IF(ISBLANK(['BenchBudEE.csv'.A308]);"";['BenchBudEE.csv'.A308]) ->  | B308: of:=IF(ISBLANK(['BenchBudEE.csv'.B308]);"";['BenchBudEE.csv'.B308]) ->  | C308: of:=IF(ISBLANK(['BenchBudEE.csv'.C443]);"";MID(['BenchBudEE.csv'.C443];SEARCH(":";['BenchBudEE.csv'.C443])+1;100)) ->  | D308: of:=IF(ISBLANK(['BenchBudEE.csv'.D308]);"";['BenchBudEE.csv'.D308]) ->  | E308: of:=IF(ISBLANK(['BenchBudEE.csv'.E308]);"";['BenchBudEE.csv'.E308]) ->  | F308: of:=IF(ISBLANK(['BenchBudEE.csv'.F308]);"";['BenchBudEE.csv'.F308]) ->  | G308: of:=IF(ISNUMBER(SEARCH("[0-9]";[.A308]));MID([.A308];1;SEARCH("[0-9]";[.A308])-1);"") -> 
A309: of:=IF(ISBLANK(['BenchBudEE.csv'.A309]);"";['BenchBudEE.csv'.A309]) ->  | B309: of:=IF(ISBLANK(['BenchBudEE.csv'.B309]);"";['BenchBudEE.csv'.B309]) ->  | C309: of:=IF(ISBLANK(['BenchBudEE.csv'.C444]);"";MID(['BenchBudEE.csv'.C444];SEARCH(":";['BenchBudEE.csv'.C444])+1;100)) ->  | D309: of:=IF(ISBLANK(['BenchBudEE.csv'.D309]);"";['BenchBudEE.csv'.D309]) ->  | E309: of:=IF(ISBLANK(['BenchBudEE.csv'.E309]);"";['BenchBudEE.csv'.E309]) ->  | F309: of:=IF(ISBLANK(['BenchBudEE.csv'.F309]);"";['BenchBudEE.csv'.F309]) ->  | G309: of:=IF(ISNUMBER(SEARCH("[0-9]";[.A309]));MID([.A309];1;SEARCH("[0-9]";[.A309])-1);"") -> 
A310: of:=IF(ISBLANK(['BenchBudEE.csv'.A310]);"";['BenchBudEE.csv'.A310]) ->  | B310: of:=IF(ISBLANK(['BenchBudEE.csv'.B310]);"";['BenchBudEE.csv'.B310]) ->  | C310: of:=IF(ISBLANK(['BenchBudEE.csv'.C445]);"";MID(['BenchBudEE.csv'.C445];SEARCH(":";['BenchBudEE.csv'.C445])+1;100)) ->  | D310: of:=IF(ISBLANK(['BenchBudEE.csv'.D310]);"";['BenchBudEE.csv'.D310]) ->  | E310: of:=IF(ISBLANK(['BenchBudEE.csv'.E310]);"";['BenchBudEE.csv'.E310]) ->  | F310: of:=IF(ISBLANK(['BenchBudEE.csv'.F310]);"";['BenchBudEE.csv'.F310]) ->  | G310: of:=IF(ISNUMBER(SEARCH("[0-9]";[.A310]));MID([.A310];1;SEARCH("[0-9]";[.A310])-1);"") -> 
A311: of:=IF(ISBLANK(['BenchBudEE.csv'.A311]);"";['BenchBudEE.csv'.A311]) ->  | B311: of:=IF(ISBLANK(['BenchBudEE.csv'.B311]);"";['BenchBudEE.csv'.B311]) ->  | C311: of:=IF(ISBLANK(['BenchBudEE.csv'.C446]);"";MID(['BenchBudEE.csv'.C446];SEARCH(":";['BenchBudEE.csv'.C446])+1;100)) ->  | D311: of:=IF(ISBLANK(['BenchBudEE.csv'.D311]);"";['BenchBudEE.csv'.D311]) ->  | E311: of:=IF(ISBLANK(['BenchBudEE.csv'.E311]);"";['BenchBudEE.csv'.E311]) ->  | F311: of:=IF(ISBLANK(['BenchBudEE.csv'.F311]);"";['BenchBudEE.csv'.F311]) ->  | G311: of:=IF(ISNUMBER(SEARCH("[0-9]";[.A311]));MID([.A311];1;SEARCH("[0-9]";[.A311])-1);"") -> 
A312: of:=IF(ISBLANK(['BenchBudEE.csv'.A312]);"";['BenchBudEE.csv'.A312]) ->  | B312: of:=IF(ISBLANK(['BenchBudEE.csv'.B312]);"";['BenchBudEE.csv'.B312]) ->  | C312: of:=IF(ISBLANK(['BenchBudEE.csv'.C447]);"";MID(['BenchBudEE.csv'.C447];SEARCH(":";['BenchBudEE.csv'.C447])+1;100)) ->  | D312: of:=IF(ISBLANK(['BenchBudEE.csv'.D312]);"";['BenchBudEE.csv'.D312]) ->  | E312: of:=IF(ISBLANK(['BenchBudEE.csv'.E312]);"";['BenchBudEE.csv'.E312]) ->  | F312: of:=IF(ISBLANK(['BenchBudEE.csv'.F312]);"";['BenchBudEE.csv'.F312]) ->  | G312: of:=IF(ISNUMBER(SEARCH("[0-9]";[.A312]));MID([.A312];1;SEARCH("[0-9]";[.A312])-1);"") -> 
A313: of:=IF(ISBLANK(['BenchBudEE.csv'.A313]);"";['BenchBudEE.csv'.A313]) ->  | B313: of:=IF(ISBLANK(['BenchBudEE.csv'.B313]);"";['BenchBudEE.csv'.B313]) ->  | C313: of:=IF(ISBLANK(['BenchBudEE.csv'.C448]);"";MID(['BenchBudEE.csv'.C448];SEARCH(":";['BenchBudEE.csv'.C448])+1;100)) ->  | D313: of:=IF(ISBLANK(['BenchBudEE.csv'.D313]);"";['BenchBudEE.csv'.D313]) ->  | E313: of:=IF(ISBLANK(['BenchBudEE.csv'.E313]);"";['BenchBudEE.csv'.E313]) ->  | F313: of:=IF(ISBLANK(['BenchBudEE.csv'.F313]);"";['BenchBudEE.csv'.F313]) ->  | G313: of:=IF(ISNUMBER(SEARCH("[0-9]";[.A313]));MID([.A313];1;SEARCH("[0-9]";[.A313])-1);"") -> 
A314: of:=IF(ISBLANK(['BenchBudEE.csv'.A314]);"";['BenchBudEE.csv'.A314]) ->  | B314: of:=IF(ISBLANK(['BenchBudEE.csv'.B314]);"";['BenchBudEE.csv'.B314]) ->  | C314: of:=IF(ISBLANK(['BenchBudEE.csv'.C449]);"";MID(['BenchBudEE.csv'.C449];SEARCH(":";['BenchBudEE.csv'.C449])+1;100)) ->  | D314: of:=IF(ISBLANK(['BenchBudEE.csv'.D314]);"";['BenchBudEE.csv'.D314]) ->  | E314: of:=IF(ISBLANK(['BenchBudEE.csv'.E314]);"";['BenchBudEE.csv'.E314]) ->  | F314: of:=IF(ISBLANK(['BenchBudEE.csv'.F314]);"";['BenchBudEE.csv'.F314]) ->  | G314: of:=IF(ISNUMBER(SEARCH("[0-9]";[.A314]));MID([.A314];1;SEARCH("[0-9]";[.A314])-1);"") -> 
A315: of:=IF(ISBLANK(['BenchBudEE.csv'.A315]);"";['BenchBudEE.csv'.A315]) ->  | B315: of:=IF(ISBLANK(['BenchBudEE.csv'.B315]);"";['BenchBudEE.csv'.B315]) ->  | C315: of:=IF(ISBLANK(['BenchBudEE.csv'.C450]);"";MID(['BenchBudEE.csv'.C450];SEARCH(":";['BenchBudEE.csv'.C450])+1;100)) ->  | D315: of:=IF(ISBLANK(['BenchBudEE.csv'.D315]);"";['BenchBudEE.csv'.D315]) ->  | E315: of:=IF(ISBLANK(['BenchBudEE.csv'.E315]);"";['BenchBudEE.csv'.E315]) ->  | F315: of:=IF(ISBLANK(['BenchBudEE.csv'.F315]);"";['BenchBudEE.csv'.F315]) ->  | G315: of:=IF(ISNUMBER(SEARCH("[0-9]";[.A315]));MID([.A315];1;SEARCH("[0-9]";[.A315])-1);"") -> 
A316: of:=IF(ISBLANK(['BenchBudEE.csv'.A316]);"";['BenchBudEE.csv'.A316]) ->  | B316: of:=IF(ISBLANK(['BenchBudEE.csv'.B316]);"";['BenchBudEE.csv'.B316]) ->  | C316: of:=IF(ISBLANK(['BenchBudEE.csv'.C451]);"";MID(['BenchBudEE.csv'.C451];SEARCH(":";['BenchBudEE.csv'.C451])+1;100)) ->  | D316: of:=IF(ISBLANK(['BenchBudEE.csv'.D316]);"";['BenchBudEE.csv'.D316]) ->  | E316: of:=IF(ISBLANK(['BenchBudEE.csv'.E316]);"";['BenchBudEE.csv'.E316]) ->  | F316: of:=IF(ISBLANK(['BenchBudEE.csv'.F316]);"";['BenchBudEE.csv'.F316]) ->  | G316: of:=IF(ISNUMBER(SEARCH("[0-9]";[.A316]));MID([.A316];1;SEARCH("[0-9]";[.A316])-1);"") -> 
A317: of:=IF(ISBLANK(['BenchBudEE.csv'.A317]);"";['BenchBudEE.csv'.A317]) ->  | B317: of:=IF(ISBLANK(['BenchBudEE.csv'.B317]);"";['BenchBudEE.csv'.B317]) ->  | C317: of:=IF(ISBLANK(['BenchBudEE.csv'.C452]);"";MID(['BenchBudEE.csv'.C452];SEARCH(":";['BenchBudEE.csv'.C452])+1;100)) ->  | D317: of:=IF(ISBLANK(['BenchBudEE.csv'.D317]);"";['BenchBudEE.csv'.D317]) ->  | E317: of:=IF(ISBLANK(['BenchBudEE.csv'.E317]);"";['BenchBudEE.csv'.E317]) ->  | F317: of:=IF(ISBLANK(['BenchBudEE.csv'.F317]);"";['BenchBudEE.csv'.F317]) ->  | G317: of:=IF(ISNUMBER(SEARCH("[0-9]";[.A317]));MID([.A317];1;SEARCH("[0-9]";[.A317])-1);"") -> 
A318: of:=IF(ISBLANK(['BenchBudEE.csv'.A318]);"";['BenchBudEE.csv'.A318]) ->  | B318: of:=IF(ISBLANK(['BenchBudEE.csv'.B318]);"";['BenchBudEE.csv'.B318]) ->  | C318: of:=IF(ISBLANK(['BenchBudEE.csv'.C453]);"";MID(['BenchBudEE.csv'.C453];SEARCH(":";['BenchBudEE.csv'.C453])+1;100)) ->  | D318: of:=IF(ISBLANK(['BenchBudEE.csv'.D318]);"";['BenchBudEE.csv'.D318]) ->  | E318: of:=IF(ISBLANK(['BenchBudEE.csv'.E318]);"";['BenchBudEE.csv'.E318]) ->  | F318: of:=IF(ISBLANK(['BenchBudEE.csv'.F318]);"";['BenchBudEE.csv'.F318]) ->  | G318: of:=IF(ISNUMBER(SEARCH("[0-9]";[.A318]));MID([.A318];1;SEARCH("[0-9]";[.A318])-1);"") -> 
A319: of:=IF(ISBLANK(['BenchBudEE.csv'.A319]);"";['BenchBudEE.csv'.A319]) ->  | B319: of:=IF(ISBLANK(['BenchBudEE.csv'.B319]);"";['BenchBudEE.csv'.B319]) ->  | C319: of:=IF(ISBLANK(['BenchBudEE.csv'.C454]);"";MID(['BenchBudEE.csv'.C454];SEARCH(":";['BenchBudEE.csv'.C454])+1;100)) ->  | D319: of:=IF(ISBLANK(['BenchBudEE.csv'.D319]);"";['BenchBudEE.csv'.D319]) ->  | E319: of:=IF(ISBLANK(['BenchBudEE.csv'.E319]);"";['BenchBudEE.csv'.E319]) ->  | F319: of:=IF(ISBLANK(['BenchBudEE.csv'.F319]);"";['BenchBudEE.csv'.F319]) ->  | G319: of:=IF(ISNUMBER(SEARCH("[0-9]";[.A319]));MID([.A319];1;SEARCH("[0-9]";[.A319])-1);"") -> 
A320: of:=IF(ISBLANK(['BenchBudEE.csv'.A320]);"";['BenchBudEE.csv'.A320]) ->  | B320: of:=IF(ISBLANK(['BenchBudEE.csv'.B320]);"";['BenchBudEE.csv'.B320]) ->  | C320: of:=IF(ISBLANK(['BenchBudEE.csv'.C455]);"";MID(['BenchBudEE.csv'.C455];SEARCH(":";['BenchBudEE.csv'.C455])+1;100)) ->  | D320: of:=IF(ISBLANK(['BenchBudEE.csv'.D320]);"";['BenchBudEE.csv'.D320]) ->  | E320: of:=IF(ISBLANK(['BenchBudEE.csv'.E320]);"";['BenchBudEE.csv'.E320]) ->  | F320: of:=IF(ISBLANK(['BenchBudEE.csv'.F320]);"";['BenchBudEE.csv'.F320]) ->  | G320: of:=IF(ISNUMBER(SEARCH("[0-9]";[.A320]));MID([.A320];1;SEARCH("[0-9]";[.A320])-1);"") -> 
A321: of:=IF(ISBLANK(['BenchBudEE.csv'.A321]);"";['BenchBudEE.csv'.A321]) ->  | B321: of:=IF(ISBLANK(['BenchBudEE.csv'.B321]);"";['BenchBudEE.csv'.B321]) ->  | C321: of:=IF(ISBLANK(['BenchBudEE.csv'.C456]);"";MID(['BenchBudEE.csv'.C456];SEARCH(":";['BenchBudEE.csv'.C456])+1;100)) ->  | D321: of:=IF(ISBLANK(['BenchBudEE.csv'.D321]);"";['BenchBudEE.csv'.D321]) ->  | E321: of:=IF(ISBLANK(['BenchBudEE.csv'.E321]);"";['BenchBudEE.csv'.E321]) ->  | F321: of:=IF(ISBLANK(['BenchBudEE.csv'.F321]);"";['BenchBudEE.csv'.F321]) ->  | G321: of:=IF(ISNUMBER(SEARCH("[0-9]";[.A321]));MID([.A321];1;SEARCH("[0-9]";[.A321])-1);"") -> 
A322: of:=IF(ISBLANK(['BenchBudEE.csv'.A322]);"";['BenchBudEE.csv'.A322]) ->  | B322: of:=IF(ISBLANK(['BenchBudEE.csv'.B322]);"";['BenchBudEE.csv'.B322]) ->  | C322: of:=IF(ISBLANK(['BenchBudEE.csv'.C457]);"";MID(['BenchBudEE.csv'.C457];SEARCH(":";['BenchBudEE.csv'.C457])+1;100)) ->  | D322: of:=IF(ISBLANK(['BenchBudEE.csv'.D322]);"";['BenchBudEE.csv'.D322]) ->  | E322: of:=IF(ISBLANK(['BenchBudEE.csv'.E322]);"";['BenchBudEE.csv'.E322]) ->  | F322: of:=IF(ISBLANK(['BenchBudEE.csv'.F322]);"";['BenchBudEE.csv'.F322]) ->  | G322: of:=IF(ISNUMBER(SEARCH("[0-9]";[.A322]));MID([.A322];1;SEARCH("[0-9]";[.A322])-1);"") -> 
A323: of:=IF(ISBLANK(['BenchBudEE.csv'.A323]);"";['BenchBudEE.csv'.A323]) ->  | B323: of:=IF(ISBLANK(['BenchBudEE.csv'.B323]);"";['BenchBudEE.csv'.B323]) ->  | C323: of:=IF(ISBLANK(['BenchBudEE.csv'.C458]);"";MID(['BenchBudEE.csv'.C458];SEARCH(":";['BenchBudEE.csv'.C458])+1;100)) ->  | D323: of:=IF(ISBLANK(['BenchBudEE.csv'.D323]);"";['BenchBudEE.csv'.D323]) ->  | E323: of:=IF(ISBLANK(['BenchBudEE.csv'.E323]);"";['BenchBudEE.csv'.E323]) ->  | F323: of:=IF(ISBLANK(['BenchBudEE.csv'.F323]);"";['BenchBudEE.csv'.F323]) ->  | G323: of:=IF(ISNUMBER(SEARCH("[0-9]";[.A323]));MID([.A323];1;SEARCH("[0-9]";[.A323])-1);"") -> 
A324: of:=IF(ISBLANK(['BenchBudEE.csv'.A324]);"";['BenchBudEE.csv'.A324]) ->  | B324: of:=IF(ISBLANK(['BenchBudEE.csv'.B324]);"";['BenchBudEE.csv'.B324]) ->  | C324: of:=IF(ISBLANK(['BenchBudEE.csv'.C459]);"";MID(['BenchBudEE.csv'.C459];SEARCH(":";['BenchBudEE.csv'.C459])+1;100)) ->  | D324: of:=IF(ISBLANK(['BenchBudEE.csv'.D324]);"";['BenchBudEE.csv'.D324]) ->  | E324: of:=IF(ISBLANK(['BenchBudEE.csv'.E324]);"";['BenchBudEE.csv'.E324]) ->  | F324: of:=IF(ISBLANK(['BenchBudEE.csv'.F324]);"";['BenchBudEE.csv'.F324]) ->  | G324: of:=IF(ISNUMBER(SEARCH("[0-9]";[.A324]));MID([.A324];1;SEARCH("[0-9]";[.A324])-1);"") -> 
A325: of:=IF(ISBLANK(['BenchBudEE.csv'.A325]);"";['BenchBudEE.csv'.A325]) ->  | B325: of:=IF(ISBLANK(['BenchBudEE.csv'.B325]);"";['BenchBudEE.csv'.B325]) ->  | C325: of:=IF(ISBLANK(['BenchBudEE.csv'.C460]);"";MID(['BenchBudEE.csv'.C460];SEARCH(":";['BenchBudEE.csv'.C460])+1;100)) ->  | D325: of:=IF(ISBLANK(['BenchBudEE.csv'.D325]);"";['BenchBudEE.csv'.D325]) ->  | E325: of:=IF(ISBLANK(['BenchBudEE.csv'.E325]);"";['BenchBudEE.csv'.E325]) ->  | F325: of:=IF(ISBLANK(['BenchBudEE.csv'.F325]);"";['BenchBudEE.csv'.F325]) ->  | G325: of:=IF(ISNUMBER(SEARCH("[0-9]";[.A325]));MID([.A325];1;SEARCH("[0-9]";[.A325])-1);"") -> 
A326: of:=IF(ISBLANK(['BenchBudEE.csv'.A326]);"";['BenchBudEE.csv'.A326]) ->  | B326: of:=IF(ISBLANK(['BenchBudEE.csv'.B326]);"";['BenchBudEE.csv'.B326]) ->  | C326: of:=IF(ISBLANK(['BenchBudEE.csv'.C461]);"";MID(['BenchBudEE.csv'.C461];SEARCH(":";['BenchBudEE.csv'.C461])+1;100)) ->  | D326: of:=IF(ISBLANK(['BenchBudEE.csv'.D326]);"";['BenchBudEE.csv'.D326]) ->  | E326: of:=IF(ISBLANK(['BenchBudEE.csv'.E326]);"";['BenchBudEE.csv'.E326]) ->  | F326: of:=IF(ISBLANK(['BenchBudEE.csv'.F326]);"";['BenchBudEE.csv'.F326]) ->  | G326: of:=IF(ISNUMBER(SEARCH("[0-9]";[.A326]));MID([.A326];1;SEARCH("[0-9]";[.A326])-1);"") -> 
A327: of:=IF(ISBLANK(['BenchBudEE.csv'.A327]);"";['BenchBudEE.csv'.A327]) ->  | B327: of:=IF(ISBLANK(['BenchBudEE.csv'.B327]);"";['BenchBudEE.csv'.B327]) ->  | C327: of:=IF(ISBLANK(['BenchBudEE.csv'.C462]);"";MID(['BenchBudEE.csv'.C462];SEARCH(":";['BenchBudEE.csv'.C462])+1;100)) ->  | D327: of:=IF(ISBLANK(['BenchBudEE.csv'.D327]);"";['BenchBudEE.csv'.D327]) ->  | E327: of:=IF(ISBLANK(['BenchBudEE.csv'.E327]);"";['BenchBudEE.csv'.E327]) ->  | F327: of:=IF(ISBLANK(['BenchBudEE.csv'.F327]);"";['BenchBudEE.csv'.F327]) ->  | G327: of:=IF(ISNUMBER(SEARCH("[0-9]";[.A327]));MID([.A327];1;SEARCH("[0-9]";[.A327])-1);"") -> 
A328: of:=IF(ISBLANK(['BenchBudEE.csv'.A328]);"";['BenchBudEE.csv'.A328]) ->  | B328: of:=IF(ISBLANK(['BenchBudEE.csv'.B328]);"";['BenchBudEE.csv'.B328]) ->  | C328: of:=IF(ISBLANK(['BenchBudEE.csv'.C463]);"";MID(['BenchBudEE.csv'.C463];SEARCH(":";['BenchBudEE.csv'.C463])+1;100)) ->  | D328: of:=IF(ISBLANK(['BenchBudEE.csv'.D328]);"";['BenchBudEE.csv'.D328]) ->  | E328: of:=IF(ISBLANK(['BenchBudEE.csv'.E328]);"";['BenchBudEE.csv'.E328]) ->  | F328: of:=IF(ISBLANK(['BenchBudEE.csv'.F328]);"";['BenchBudEE.csv'.F328]) ->  | G328: of:=IF(ISNUMBER(SEARCH("[0-9]";[.A328]));MID([.A328];1;SEARCH("[0-9]";[.A328])-1);"") -> 
A329: of:=IF(ISBLANK(['BenchBudEE.csv'.A329]);"";['BenchBudEE.csv'.A329]) ->  | B329: of:=IF(ISBLANK(['BenchBudEE.csv'.B329]);"";['BenchBudEE.csv'.B329]) ->  | C329: of:=IF(ISBLANK(['BenchBudEE.csv'.C464]);"";MID(['BenchBudEE.csv'.C464];SEARCH(":";['BenchBudEE.csv'.C464])+1;100)) ->  | D329: of:=IF(ISBLANK(['BenchBudEE.csv'.D329]);"";['BenchBudEE.csv'.D329]) ->  | E329: of:=IF(ISBLANK(['BenchBudEE.csv'.E329]);"";['BenchBudEE.csv'.E329]) ->  | F329: of:=IF(ISBLANK(['BenchBudEE.csv'.F329]);"";['BenchBudEE.csv'.F329]) ->  | G329: of:=IF(ISNUMBER(SEARCH("[0-9]";[.A329]));MID([.A329];1;SEARCH("[0-9]";[.A329])-1);"") -> 
A330: of:=IF(ISBLANK(['BenchBudEE.csv'.A330]);"";['BenchBudEE.csv'.A330]) ->  | B330: of:=IF(ISBLANK(['BenchBudEE.csv'.B330]);"";['BenchBudEE.csv'.B330]) ->  | C330: of:=IF(ISBLANK(['BenchBudEE.csv'.C465]);"";MID(['BenchBudEE.csv'.C465];SEARCH(":";['BenchBudEE.csv'.C465])+1;100)) ->  | D330: of:=IF(ISBLANK(['BenchBudEE.csv'.D330]);"";['BenchBudEE.csv'.D330]) ->  | E330: of:=IF(ISBLANK(['BenchBudEE.csv'.E330]);"";['BenchBudEE.csv'.E330]) ->  | F330: of:=IF(ISBLANK(['BenchBudEE.csv'.F330]);"";['BenchBudEE.csv'.F330]) ->  | G330: of:=IF(ISNUMBER(SEARCH("[0-9]";[.A330]));MID([.A330];1;SEARCH("[0-9]";[.A330])-1);"") -> 
A331: of:=IF(ISBLANK(['BenchBudEE.csv'.A331]);"";['BenchBudEE.csv'.A331]) ->  | B331: of:=IF(ISBLANK(['BenchBudEE.csv'.B331]);"";['BenchBudEE.csv'.B331]) ->  | C331: of:=IF(ISBLANK(['BenchBudEE.csv'.C466]);"";MID(['BenchBudEE.csv'.C466];SEARCH(":";['BenchBudEE.csv'.C466])+1;100)) ->  | D331: of:=IF(ISBLANK(['BenchBudEE.csv'.D331]);"";['BenchBudEE.csv'.D331]) ->  | E331: of:=IF(ISBLANK(['BenchBudEE.csv'.E331]);"";['BenchBudEE.csv'.E331]) ->  | F331: of:=IF(ISBLANK(['BenchBudEE.csv'.F331]);"";['BenchBudEE.csv'.F331]) ->  | G331: of:=IF(ISNUMBER(SEARCH("[0-9]";[.A331]));MID([.A331];1;SEARCH("[0-9]";[.A331])-1);"") -> 
A332: of:=IF(ISBLANK(['BenchBudEE.csv'.A332]);"";['BenchBudEE.csv'.A332]) ->  | B332: of:=IF(ISBLANK(['BenchBudEE.csv'.B332]);"";['BenchBudEE.csv'.B332]) ->  | C332: of:=IF(ISBLANK(['BenchBudEE.csv'.C467]);"";MID(['BenchBudEE.csv'.C467];SEARCH(":";['BenchBudEE.csv'.C467])+1;100)) ->  | D332: of:=IF(ISBLANK(['BenchBudEE.csv'.D332]);"";['BenchBudEE.csv'.D332]) ->  | E332: of:=IF(ISBLANK(['BenchBudEE.csv'.E332]);"";['BenchBudEE.csv'.E332]) ->  | F332: of:=IF(ISBLANK(['BenchBudEE.csv'.F332]);"";['BenchBudEE.csv'.F332]) ->  | G332: of:=IF(ISNUMBER(SEARCH("[0-9]";[.A332]));MID([.A332];1;SEARCH("[0-9]";[.A332])-1);"") -> 
A333: of:=IF(ISBLANK(['BenchBudEE.csv'.A333]);"";['BenchBudEE.csv'.A333]) ->  | B333: of:=IF(ISBLANK(['BenchBudEE.csv'.B333]);"";['BenchBudEE.csv'.B333]) ->  | C333: of:=IF(ISBLANK(['BenchBudEE.csv'.C468]);"";MID(['BenchBudEE.csv'.C468];SEARCH(":";['BenchBudEE.csv'.C468])+1;100)) ->  | D333: of:=IF(ISBLANK(['BenchBudEE.csv'.D333]);"";['BenchBudEE.csv'.D333]) ->  | E333: of:=IF(ISBLANK(['BenchBudEE.csv'.E333]);"";['BenchBudEE.csv'.E333]) ->  | F333: of:=IF(ISBLANK(['BenchBudEE.csv'.F333]);"";['BenchBudEE.csv'.F333]) ->  | G333: of:=IF(ISNUMBER(SEARCH("[0-9]";[.A333]));MID([.A333];1;SEARCH("[0-9]";[.A333])-1);"") -> 
A334: of:=IF(ISBLANK(['BenchBudEE.csv'.A334]);"";['BenchBudEE.csv'.A334]) ->  | B334: of:=IF(ISBLANK(['BenchBudEE.csv'.B334]);"";['BenchBudEE.csv'.B334]) ->  | C334: of:=IF(ISBLANK(['BenchBudEE.csv'.C469]);"";MID(['BenchBudEE.csv'.C469];SEARCH(":";['BenchBudEE.csv'.C469])+1;100)) ->  | D334: of:=IF(ISBLANK(['BenchBudEE.csv'.D334]);"";['BenchBudEE.csv'.D334]) ->  | E334: of:=IF(ISBLANK(['BenchBudEE.csv'.E334]);"";['BenchBudEE.csv'.E334]) ->  | F334: of:=IF(ISBLANK(['BenchBudEE.csv'.F334]);"";['BenchBudEE.csv'.F334]) ->  | G334: of:=IF(ISNUMBER(SEARCH("[0-9]";[.A334]));MID([.A334];1;SEARCH("[0-9]";[.A334])-1);"") -> 
A335: of:=IF(ISBLANK(['BenchBudEE.csv'.A335]);"";['BenchBudEE.csv'.A335]) ->  | B335: of:=IF(ISBLANK(['BenchBudEE.csv'.B335]);"";['BenchBudEE.csv'.B335]) ->  | C335: of:=IF(ISBLANK(['BenchBudEE.csv'.C470]);"";MID(['BenchBudEE.csv'.C470];SEARCH(":";['BenchBudEE.csv'.C470])+1;100)) ->  | D335: of:=IF(ISBLANK(['BenchBudEE.csv'.D335]);"";['BenchBudEE.csv'.D335]) ->  | E335: of:=IF(ISBLANK(['BenchBudEE.csv'.E335]);"";['BenchBudEE.csv'.E335]) ->  | F335: of:=IF(ISBLANK(['BenchBudEE.csv'.F335]);"";['BenchBudEE.csv'.F335]) ->  | G335: of:=IF(ISNUMBER(SEARCH("[0-9]";[.A335]));MID([.A335];1;SEARCH("[0-9]";[.A335])-1);"") -> 
A336: of:=IF(ISBLANK(['BenchBudEE.csv'.A336]);"";['BenchBudEE.csv'.A336]) ->  | B336: of:=IF(ISBLANK(['BenchBudEE.csv'.B336]);"";['BenchBudEE.csv'.B336]) ->  | C336: of:=IF(ISBLANK(['BenchBudEE.csv'.C471]);"";MID(['BenchBudEE.csv'.C471];SEARCH(":";['BenchBudEE.csv'.C471])+1;100)) ->  | D336: of:=IF(ISBLANK(['BenchBudEE.csv'.D336]);"";['BenchBudEE.csv'.D336]) ->  | E336: of:=IF(ISBLANK(['BenchBudEE.csv'.E336]);"";['BenchBudEE.csv'.E336]) ->  | F336: of:=IF(ISBLANK(['BenchBudEE.csv'.F336]);"";['BenchBudEE.csv'.F336]) ->  | G336: of:=IF(ISNUMBER(SEARCH("[0-9]";[.A336]));MID([.A336];1;SEARCH("[0-9]";[.A336])-1);"") -> 
A337: of:=IF(ISBLANK(['BenchBudEE.csv'.A337]);"";['BenchBudEE.csv'.A337]) ->  | B337: of:=IF(ISBLANK(['BenchBudEE.csv'.B337]);"";['BenchBudEE.csv'.B337]) ->  | C337: of:=IF(ISBLANK(['BenchBudEE.csv'.C472]);"";MID(['BenchBudEE.csv'.C472];SEARCH(":";['BenchBudEE.csv'.C472])+1;100)) ->  | D337: of:=IF(ISBLANK(['BenchBudEE.csv'.D337]);"";['BenchBudEE.csv'.D337]) ->  | E337: of:=IF(ISBLANK(['BenchBudEE.csv'.E337]);"";['BenchBudEE.csv'.E337]) ->  | F337: of:=IF(ISBLANK(['BenchBudEE.csv'.F337]);"";['BenchBudEE.csv'.F337]) ->  | G337: of:=IF(ISNUMBER(SEARCH("[0-9]";[.A337]));MID([.A337];1;SEARCH("[0-9]";[.A337])-1);"") -> 
A338: of:=IF(ISBLANK(['BenchBudEE.csv'.A338]);"";['BenchBudEE.csv'.A338]) ->  | B338: of:=IF(ISBLANK(['BenchBudEE.csv'.B338]);"";['BenchBudEE.csv'.B338]) ->  | C338: of:=IF(ISBLANK(['BenchBudEE.csv'.C473]);"";MID(['BenchBudEE.csv'.C473];SEARCH(":";['BenchBudEE.csv'.C473])+1;100)) ->  | D338: of:=IF(ISBLANK(['BenchBudEE.csv'.D338]);"";['BenchBudEE.csv'.D338]) ->  | E338: of:=IF(ISBLANK(['BenchBudEE.csv'.E338]);"";['BenchBudEE.csv'.E338]) ->  | F338: of:=IF(ISBLANK(['BenchBudEE.csv'.F338]);"";['BenchBudEE.csv'.F338]) ->  | G338: of:=IF(ISNUMBER(SEARCH("[0-9]";[.A338]));MID([.A338];1;SEARCH("[0-9]";[.A338])-1);"") -> 
A339: of:=IF(ISBLANK(['BenchBudEE.csv'.A339]);"";['BenchBudEE.csv'.A339]) ->  | B339: of:=IF(ISBLANK(['BenchBudEE.csv'.B339]);"";['BenchBudEE.csv'.B339]) ->  | C339: of:=IF(ISBLANK(['BenchBudEE.csv'.C474]);"";MID(['BenchBudEE.csv'.C474];SEARCH(":";['BenchBudEE.csv'.C474])+1;100)) ->  | D339: of:=IF(ISBLANK(['BenchBudEE.csv'.D339]);"";['BenchBudEE.csv'.D339]) ->  | E339: of:=IF(ISBLANK(['BenchBudEE.csv'.E339]);"";['BenchBudEE.csv'.E339]) ->  | F339: of:=IF(ISBLANK(['BenchBudEE.csv'.F339]);"";['BenchBudEE.csv'.F339]) ->  | G339: of:=IF(ISNUMBER(SEARCH("[0-9]";[.A339]));MID([.A339];1;SEARCH("[0-9]";[.A339])-1);"") -> 
A340: of:=IF(ISBLANK(['BenchBudEE.csv'.A340]);"";['BenchBudEE.csv'.A340]) ->  | B340: of:=IF(ISBLANK(['BenchBudEE.csv'.B340]);"";['BenchBudEE.csv'.B340]) ->  | C340: of:=IF(ISBLANK(['BenchBudEE.csv'.C475]);"";MID(['BenchBudEE.csv'.C475];SEARCH(":";['BenchBudEE.csv'.C475])+1;100)) ->  | D340: of:=IF(ISBLANK(['BenchBudEE.csv'.D340]);"";['BenchBudEE.csv'.D340]) ->  | E340: of:=IF(ISBLANK(['BenchBudEE.csv'.E340]);"";['BenchBudEE.csv'.E340]) ->  | F340: of:=IF(ISBLANK(['BenchBudEE.csv'.F340]);"";['BenchBudEE.csv'.F340]) ->  | G340: of:=IF(ISNUMBER(SEARCH("[0-9]";[.A340]));MID([.A340];1;SEARCH("[0-9]";[.A340])-1);"") -> 
A341: of:=IF(ISBLANK(['BenchBudEE.csv'.A341]);"";['BenchBudEE.csv'.A341]) ->  | B341: of:=IF(ISBLANK(['BenchBudEE.csv'.B341]);"";['BenchBudEE.csv'.B341]) ->  | C341: of:=IF(ISBLANK(['BenchBudEE.csv'.C476]);"";MID(['BenchBudEE.csv'.C476];SEARCH(":";['BenchBudEE.csv'.C476])+1;100)) ->  | D341: of:=IF(ISBLANK(['BenchBudEE.csv'.D341]);"";['BenchBudEE.csv'.D341]) ->  | E341: of:=IF(ISBLANK(['BenchBudEE.csv'.E341]);"";['BenchBudEE.csv'.E341]) ->  | F341: of:=IF(ISBLANK(['BenchBudEE.csv'.F341]);"";['BenchBudEE.csv'.F341]) ->  | G341: of:=IF(ISNUMBER(SEARCH("[0-9]";[.A341]));MID([.A341];1;SEARCH("[0-9]";[.A341])-1);"") -> 
A342: of:=IF(ISBLANK(['BenchBudEE.csv'.A342]);"";['BenchBudEE.csv'.A342]) ->  | B342: of:=IF(ISBLANK(['BenchBudEE.csv'.B342]);"";['BenchBudEE.csv'.B342]) ->  | C342: of:=IF(ISBLANK(['BenchBudEE.csv'.C477]);"";MID(['BenchBudEE.csv'.C477];SEARCH(":";['BenchBudEE.csv'.C477])+1;100)) ->  | D342: of:=IF(ISBLANK(['BenchBudEE.csv'.D342]);"";['BenchBudEE.csv'.D342]) ->  | E342: of:=IF(ISBLANK(['BenchBudEE.csv'.E342]);"";['BenchBudEE.csv'.E342]) ->  | F342: of:=IF(ISBLANK(['BenchBudEE.csv'.F342]);"";['BenchBudEE.csv'.F342]) ->  | G342: of:=IF(ISNUMBER(SEARCH("[0-9]";[.A342]));MID([.A342];1;SEARCH("[0-9]";[.A342])-1);"") -> 
A343: of:=IF(ISBLANK(['BenchBudEE.csv'.A343]);"";['BenchBudEE.csv'.A343]) ->  | B343: of:=IF(ISBLANK(['BenchBudEE.csv'.B343]);"";['BenchBudEE.csv'.B343]) ->  | C343: of:=IF(ISBLANK(['BenchBudEE.csv'.C478]);"";MID(['BenchBudEE.csv'.C478];SEARCH(":";['BenchBudEE.csv'.C478])+1;100)) ->  | D343: of:=IF(ISBLANK(['BenchBudEE.csv'.D343]);"";['BenchBudEE.csv'.D343]) ->  | E343: of:=IF(ISBLANK(['BenchBudEE.csv'.E343]);"";['BenchBudEE.csv'.E343]) ->  | F343: of:=IF(ISBLANK(['BenchBudEE.csv'.F343]);"";['BenchBudEE.csv'.F343]) ->  | G343: of:=IF(ISNUMBER(SEARCH("[0-9]";[.A343]));MID([.A343];1;SEARCH("[0-9]";[.A343])-1);"") -> 
A344: of:=IF(ISBLANK(['BenchBudEE.csv'.A344]);"";['BenchBudEE.csv'.A344]) ->  | B344: of:=IF(ISBLANK(['BenchBudEE.csv'.B344]);"";['BenchBudEE.csv'.B344]) ->  | C344: of:=IF(ISBLANK(['BenchBudEE.csv'.C479]);"";MID(['BenchBudEE.csv'.C479];SEARCH(":";['BenchBudEE.csv'.C479])+1;100)) ->  | D344: of:=IF(ISBLANK(['BenchBudEE.csv'.D344]);"";['BenchBudEE.csv'.D344]) ->  | E344: of:=IF(ISBLANK(['BenchBudEE.csv'.E344]);"";['BenchBudEE.csv'.E344]) ->  | F344: of:=IF(ISBLANK(['BenchBudEE.csv'.F344]);"";['BenchBudEE.csv'.F344]) ->  | G344: of:=IF(ISNUMBER(SEARCH("[0-9]";[.A344]));MID([.A344];1;SEARCH("[0-9]";[.A344])-1);"") -> 
A345: of:=IF(ISBLANK(['BenchBudEE.csv'.A345]);"";['BenchBudEE.csv'.A345]) ->  | B345: of:=IF(ISBLANK(['BenchBudEE.csv'.B345]);"";['BenchBudEE.csv'.B345]) ->  | C345: of:=IF(ISBLANK(['BenchBudEE.csv'.C480]);"";MID(['BenchBudEE.csv'.C480];SEARCH(":";['BenchBudEE.csv'.C480])+1;100)) ->  | D345: of:=IF(ISBLANK(['BenchBudEE.csv'.D345]);"";['BenchBudEE.csv'.D345]) ->  | E345: of:=IF(ISBLANK(['BenchBudEE.csv'.E345]);"";['BenchBudEE.csv'.E345]) ->  | F345: of:=IF(ISBLANK(['BenchBudEE.csv'.F345]);"";['BenchBudEE.csv'.F345]) ->  | G345: of:=IF(ISNUMBER(SEARCH("[0-9]";[.A345]));MID([.A345];1;SEARCH("[0-9]";[.A345])-1);"") -> 
A346: of:=IF(ISBLANK(['BenchBudEE.csv'.A346]);"";['BenchBudEE.csv'.A346]) ->  | B346: of:=IF(ISBLANK(['BenchBudEE.csv'.B346]);"";['BenchBudEE.csv'.B346]) ->  | C346: of:=IF(ISBLANK(['BenchBudEE.csv'.C481]);"";MID(['BenchBudEE.csv'.C481];SEARCH(":";['BenchBudEE.csv'.C481])+1;100)) ->  | D346: of:=IF(ISBLANK(['BenchBudEE.csv'.D346]);"";['BenchBudEE.csv'.D346]) ->  | E346: of:=IF(ISBLANK(['BenchBudEE.csv'.E346]);"";['BenchBudEE.csv'.E346]) ->  | F346: of:=IF(ISBLANK(['BenchBudEE.csv'.F346]);"";['BenchBudEE.csv'.F346]) ->  | G346: of:=IF(ISNUMBER(SEARCH("[0-9]";[.A346]));MID([.A346];1;SEARCH("[0-9]";[.A346])-1);"") -> 
A347: of:=IF(ISBLANK(['BenchBudEE.csv'.A347]);"";['BenchBudEE.csv'.A347]) ->  | B347: of:=IF(ISBLANK(['BenchBudEE.csv'.B347]);"";['BenchBudEE.csv'.B347]) ->  | C347: of:=IF(ISBLANK(['BenchBudEE.csv'.C482]);"";MID(['BenchBudEE.csv'.C482];SEARCH(":";['BenchBudEE.csv'.C482])+1;100)) ->  | D347: of:=IF(ISBLANK(['BenchBudEE.csv'.D347]);"";['BenchBudEE.csv'.D347]) ->  | E347: of:=IF(ISBLANK(['BenchBudEE.csv'.E347]);"";['BenchBudEE.csv'.E347]) ->  | F347: of:=IF(ISBLANK(['BenchBudEE.csv'.F347]);"";['BenchBudEE.csv'.F347]) ->  | G347: of:=IF(ISNUMBER(SEARCH("[0-9]";[.A347]));MID([.A347];1;SEARCH("[0-9]";[.A347])-1);"") -> 
A348: of:=IF(ISBLANK(['BenchBudEE.csv'.A348]);"";['BenchBudEE.csv'.A348]) ->  | B348: of:=IF(ISBLANK(['BenchBudEE.csv'.B348]);"";['BenchBudEE.csv'.B348]) ->  | C348: of:=IF(ISBLANK(['BenchBudEE.csv'.C483]);"";MID(['BenchBudEE.csv'.C483];SEARCH(":";['BenchBudEE.csv'.C483])+1;100)) ->  | D348: of:=IF(ISBLANK(['BenchBudEE.csv'.D348]);"";['BenchBudEE.csv'.D348]) ->  | E348: of:=IF(ISBLANK(['BenchBudEE.csv'.E348]);"";['BenchBudEE.csv'.E348]) ->  | F348: of:=IF(ISBLANK(['BenchBudEE.csv'.F348]);"";['BenchBudEE.csv'.F348]) ->  | G348: of:=IF(ISNUMBER(SEARCH("[0-9]";[.A348]));MID([.A348];1;SEARCH("[0-9]";[.A348])-1);"") -> 
A349: of:=IF(ISBLANK(['BenchBudEE.csv'.A349]);"";['BenchBudEE.csv'.A349]) ->  | B349: of:=IF(ISBLANK(['BenchBudEE.csv'.B349]);"";['BenchBudEE.csv'.B349]) ->  | C349: of:=IF(ISBLANK(['BenchBudEE.csv'.C484]);"";MID(['BenchBudEE.csv'.C484];SEARCH(":";['BenchBudEE.csv'.C484])+1;100)) ->  | D349: of:=IF(ISBLANK(['BenchBudEE.csv'.D349]);"";['BenchBudEE.csv'.D349]) ->  | E349: of:=IF(ISBLANK(['BenchBudEE.csv'.E349]);"";['BenchBudEE.csv'.E349]) ->  | F349: of:=IF(ISBLANK(['BenchBudEE.csv'.F349]);"";['BenchBudEE.csv'.F349]) ->  | G349: of:=IF(ISNUMBER(SEARCH("[0-9]";[.A349]));MID([.A349];1;SEARCH("[0-9]";[.A349])-1);"") -> 
A350: of:=IF(ISBLANK(['BenchBudEE.csv'.A350]);"";['BenchBudEE.csv'.A350]) ->  | B350: of:=IF(ISBLANK(['BenchBudEE.csv'.B350]);"";['BenchBudEE.csv'.B350]) ->  | C350: of:=IF(ISBLANK(['BenchBudEE.csv'.C485]);"";MID(['BenchBudEE.csv'.C485];SEARCH(":";['BenchBudEE.csv'.C485])+1;100)) ->  | D350: of:=IF(ISBLANK(['BenchBudEE.csv'.D350]);"";['BenchBudEE.csv'.D350]) ->  | E350: of:=IF(ISBLANK(['BenchBudEE.csv'.E350]);"";['BenchBudEE.csv'.E350]) ->  | F350: of:=IF(ISBLANK(['BenchBudEE.csv'.F350]);"";['BenchBudEE.csv'.F350]) ->  | G350: of:=IF(ISNUMBER(SEARCH("[0-9]";[.A350]));MID([.A350];1;SEARCH("[0-9]";[.A350])-1);"") -> 
A351: of:=IF(ISBLANK(['BenchBudEE.csv'.A351]);"";['BenchBudEE.csv'.A351]) ->  | B351: of:=IF(ISBLANK(['BenchBudEE.csv'.B351]);"";['BenchBudEE.csv'.B351]) ->  | C351: of:=IF(ISBLANK(['BenchBudEE.csv'.C486]);"";MID(['BenchBudEE.csv'.C486];SEARCH(":";['BenchBudEE.csv'.C486])+1;100)) ->  | D351: of:=IF(ISBLANK(['BenchBudEE.csv'.D351]);"";['BenchBudEE.csv'.D351]) ->  | E351: of:=IF(ISBLANK(['BenchBudEE.csv'.E351]);"";['BenchBudEE.csv'.E351]) ->  | F351: of:=IF(ISBLANK(['BenchBudEE.csv'.F351]);"";['BenchBudEE.csv'.F351]) ->  | G351: of:=IF(ISNUMBER(SEARCH("[0-9]";[.A351]));MID([.A351];1;SEARCH("[0-9]";[.A351])-1);"") -> 
A352: of:=IF(ISBLANK(['BenchBudEE.csv'.A352]);"";['BenchBudEE.csv'.A352]) ->  | B352: of:=IF(ISBLANK(['BenchBudEE.csv'.B352]);"";['BenchBudEE.csv'.B352]) ->  | C352: of:=IF(ISBLANK(['BenchBudEE.csv'.C487]);"";MID(['BenchBudEE.csv'.C487];SEARCH(":";['BenchBudEE.csv'.C487])+1;100)) ->  | D352: of:=IF(ISBLANK(['BenchBudEE.csv'.D352]);"";['BenchBudEE.csv'.D352]) ->  | E352: of:=IF(ISBLANK(['BenchBudEE.csv'.E352]);"";['BenchBudEE.csv'.E352]) ->  | F352: of:=IF(ISBLANK(['BenchBudEE.csv'.F352]);"";['BenchBudEE.csv'.F352]) ->  | G352: of:=IF(ISNUMBER(SEARCH("[0-9]";[.A352]));MID([.A352];1;SEARCH("[0-9]";[.A352])-1);"") -> 
A353: of:=IF(ISBLANK(['BenchBudEE.csv'.A353]);"";['BenchBudEE.csv'.A353]) ->  | B353: of:=IF(ISBLANK(['BenchBudEE.csv'.B353]);"";['BenchBudEE.csv'.B353]) ->  | C353: of:=IF(ISBLANK(['BenchBudEE.csv'.C488]);"";MID(['BenchBudEE.csv'.C488];SEARCH(":";['BenchBudEE.csv'.C488])+1;100)) ->  | D353: of:=IF(ISBLANK(['BenchBudEE.csv'.D353]);"";['BenchBudEE.csv'.D353]) ->  | E353: of:=IF(ISBLANK(['BenchBudEE.csv'.E353]);"";['BenchBudEE.csv'.E353]) ->  | F353: of:=IF(ISBLANK(['BenchBudEE.csv'.F353]);"";['BenchBudEE.csv'.F353]) ->  | G353: of:=IF(ISNUMBER(SEARCH("[0-9]";[.A353]));MID([.A353];1;SEARCH("[0-9]";[.A353])-1);"") -> 
A354: of:=IF(ISBLANK(['BenchBudEE.csv'.A354]);"";['BenchBudEE.csv'.A354]) ->  | B354: of:=IF(ISBLANK(['BenchBudEE.csv'.B354]);"";['BenchBudEE.csv'.B354]) ->  | C354: of:=IF(ISBLANK(['BenchBudEE.csv'.C489]);"";MID(['BenchBudEE.csv'.C489];SEARCH(":";['BenchBudEE.csv'.C489])+1;100)) ->  | D354: of:=IF(ISBLANK(['BenchBudEE.csv'.D354]);"";['BenchBudEE.csv'.D354]) ->  | E354: of:=IF(ISBLANK(['BenchBudEE.csv'.E354]);"";['BenchBudEE.csv'.E354]) ->  | F354: of:=IF(ISBLANK(['BenchBudEE.csv'.F354]);"";['BenchBudEE.csv'.F354]) ->  | G354: of:=IF(ISNUMBER(SEARCH("[0-9]";[.A354]));MID([.A354];1;SEARCH("[0-9]";[.A354])-1);"") -> 
A355: of:=IF(ISBLANK(['BenchBudEE.csv'.A355]);"";['BenchBudEE.csv'.A355]) ->  | B355: of:=IF(ISBLANK(['BenchBudEE.csv'.B355]);"";['BenchBudEE.csv'.B355]) ->  | C355: of:=IF(ISBLANK(['BenchBudEE.csv'.C490]);"";MID(['BenchBudEE.csv'.C490];SEARCH(":";['BenchBudEE.csv'.C490])+1;100)) ->  | D355: of:=IF(ISBLANK(['BenchBudEE.csv'.D355]);"";['BenchBudEE.csv'.D355]) ->  | E355: of:=IF(ISBLANK(['BenchBudEE.csv'.E355]);"";['BenchBudEE.csv'.E355]) ->  | F355: of:=IF(ISBLANK(['BenchBudEE.csv'.F355]);"";['BenchBudEE.csv'.F355]) ->  | G355: of:=IF(ISNUMBER(SEARCH("[0-9]";[.A355]));MID([.A355];1;SEARCH("[0-9]";[.A355])-1);"") -> 
A356: of:=IF(ISBLANK(['BenchBudEE.csv'.A356]);"";['BenchBudEE.csv'.A356]) ->  | B356: of:=IF(ISBLANK(['BenchBudEE.csv'.B356]);"";['BenchBudEE.csv'.B356]) ->  | C356: of:=IF(ISBLANK(['BenchBudEE.csv'.C491]);"";MID(['BenchBudEE.csv'.C491];SEARCH(":";['BenchBudEE.csv'.C491])+1;100)) ->  | D356: of:=IF(ISBLANK(['BenchBudEE.csv'.D356]);"";['BenchBudEE.csv'.D356]) ->  | E356: of:=IF(ISBLANK(['BenchBudEE.csv'.E356]);"";['BenchBudEE.csv'.E356]) ->  | F356: of:=IF(ISBLANK(['BenchBudEE.csv'.F356]);"";['BenchBudEE.csv'.F356]) ->  | G356: of:=IF(ISNUMBER(SEARCH("[0-9]";[.A356]));MID([.A356];1;SEARCH("[0-9]";[.A356])-1);"") -> 
A357: of:=IF(ISBLANK(['BenchBudEE.csv'.A357]);"";['BenchBudEE.csv'.A357]) ->  | B357: of:=IF(ISBLANK(['BenchBudEE.csv'.B357]);"";['BenchBudEE.csv'.B357]) ->  | C357: of:=IF(ISBLANK(['BenchBudEE.csv'.C492]);"";MID(['BenchBudEE.csv'.C492];SEARCH(":";['BenchBudEE.csv'.C492])+1;100)) ->  | D357: of:=IF(ISBLANK(['BenchBudEE.csv'.D357]);"";['BenchBudEE.csv'.D357]) ->  | E357: of:=IF(ISBLANK(['BenchBudEE.csv'.E357]);"";['BenchBudEE.csv'.E357]) ->  | F357: of:=IF(ISBLANK(['BenchBudEE.csv'.F357]);"";['BenchBudEE.csv'.F357]) ->  | G357: of:=IF(ISNUMBER(SEARCH("[0-9]";[.A357]));MID([.A357];1;SEARCH("[0-9]";[.A357])-1);"") -> 
A358: of:=IF(ISBLANK(['BenchBudEE.csv'.A358]);"";['BenchBudEE.csv'.A358]) ->  | B358: of:=IF(ISBLANK(['BenchBudEE.csv'.B358]);"";['BenchBudEE.csv'.B358]) ->  | C358: of:=IF(ISBLANK(['BenchBudEE.csv'.C493]);"";MID(['BenchBudEE.csv'.C493];SEARCH(":";['BenchBudEE.csv'.C493])+1;100)) ->  | D358: of:=IF(ISBLANK(['BenchBudEE.csv'.D358]);"";['BenchBudEE.csv'.D358]) ->  | E358: of:=IF(ISBLANK(['BenchBudEE.csv'.E358]);"";['BenchBudEE.csv'.E358]) ->  | F358: of:=IF(ISBLANK(['BenchBudEE.csv'.F358]);"";['BenchBudEE.csv'.F358]) ->  | G358: of:=IF(ISNUMBER(SEARCH("[0-9]";[.A358]));MID([.A358];1;SEARCH("[0-9]";[.A358])-1);"") -> 
A359: of:=IF(ISBLANK(['BenchBudEE.csv'.A359]);"";['BenchBudEE.csv'.A359]) ->  | B359: of:=IF(ISBLANK(['BenchBudEE.csv'.B359]);"";['BenchBudEE.csv'.B359]) ->  | C359: of:=IF(ISBLANK(['BenchBudEE.csv'.C494]);"";MID(['BenchBudEE.csv'.C494];SEARCH(":";['BenchBudEE.csv'.C494])+1;100)) ->  | D359: of:=IF(ISBLANK(['BenchBudEE.csv'.D359]);"";['BenchBudEE.csv'.D359]) ->  | E359: of:=IF(ISBLANK(['BenchBudEE.csv'.E359]);"";['BenchBudEE.csv'.E359]) ->  | F359: of:=IF(ISBLANK(['BenchBudEE.csv'.F359]);"";['BenchBudEE.csv'.F359]) ->  | G359: of:=IF(ISNUMBER(SEARCH("[0-9]";[.A359]));MID([.A359];1;SEARCH("[0-9]";[.A359])-1);"") -> 
A360: of:=IF(ISBLANK(['BenchBudEE.csv'.A360]);"";['BenchBudEE.csv'.A360]) ->  | B360: of:=IF(ISBLANK(['BenchBudEE.csv'.B360]);"";['BenchBudEE.csv'.B360]) ->  | C360: of:=IF(ISBLANK(['BenchBudEE.csv'.C495]);"";MID(['BenchBudEE.csv'.C495];SEARCH(":";['BenchBudEE.csv'.C495])+1;100)) ->  | D360: of:=IF(ISBLANK(['BenchBudEE.csv'.D360]);"";['BenchBudEE.csv'.D360]) ->  | E360: of:=IF(ISBLANK(['BenchBudEE.csv'.E360]);"";['BenchBudEE.csv'.E360]) ->  | F360: of:=IF(ISBLANK(['BenchBudEE.csv'.F360]);"";['BenchBudEE.csv'.F360]) ->  | G360: of:=IF(ISNUMBER(SEARCH("[0-9]";[.A360]));MID([.A360];1;SEARCH("[0-9]";[.A360])-1);"") -> 
A361: of:=IF(ISBLANK(['BenchBudEE.csv'.A361]);"";['BenchBudEE.csv'.A361]) ->  | B361: of:=IF(ISBLANK(['BenchBudEE.csv'.B361]);"";['BenchBudEE.csv'.B361]) ->  | C361: of:=IF(ISBLANK(['BenchBudEE.csv'.C496]);"";MID(['BenchBudEE.csv'.C496];SEARCH(":";['BenchBudEE.csv'.C496])+1;100)) ->  | D361: of:=IF(ISBLANK(['BenchBudEE.csv'.D361]);"";['BenchBudEE.csv'.D361]) ->  | E361: of:=IF(ISBLANK(['BenchBudEE.csv'.E361]);"";['BenchBudEE.csv'.E361]) ->  | F361: of:=IF(ISBLANK(['BenchBudEE.csv'.F361]);"";['BenchBudEE.csv'.F361]) ->  | G361: of:=IF(ISNUMBER(SEARCH("[0-9]";[.A361]));MID([.A361];1;SEARCH("[0-9]";[.A361])-1);"") -> 
A362: of:=IF(ISBLANK(['BenchBudEE.csv'.A362]);"";['BenchBudEE.csv'.A362]) ->  | B362: of:=IF(ISBLANK(['BenchBudEE.csv'.B362]);"";['BenchBudEE.csv'.B362]) ->  | C362: of:=IF(ISBLANK(['BenchBudEE.csv'.C497]);"";MID(['BenchBudEE.csv'.C497];SEARCH(":";['BenchBudEE.csv'.C497])+1;100)) ->  | D362: of:=IF(ISBLANK(['BenchBudEE.csv'.D362]);"";['BenchBudEE.csv'.D362]) ->  | E362: of:=IF(ISBLANK(['BenchBudEE.csv'.E362]);"";['BenchBudEE.csv'.E362]) ->  | F362: of:=IF(ISBLANK(['BenchBudEE.csv'.F362]);"";['BenchBudEE.csv'.F362]) ->  | G362: of:=IF(ISNUMBER(SEARCH("[0-9]";[.A362]));MID([.A362];1;SEARCH("[0-9]";[.A362])-1);"") -> 
A363: of:=IF(ISBLANK(['BenchBudEE.csv'.A363]);"";['BenchBudEE.csv'.A363]) ->  | B363: of:=IF(ISBLANK(['BenchBudEE.csv'.B363]);"";['BenchBudEE.csv'.B363]) ->  | C363: of:=IF(ISBLANK(['BenchBudEE.csv'.C498]);"";MID(['BenchBudEE.csv'.C498];SEARCH(":";['BenchBudEE.csv'.C498])+1;100)) ->  | D363: of:=IF(ISBLANK(['BenchBudEE.csv'.D363]);"";['BenchBudEE.csv'.D363]) ->  | E363: of:=IF(ISBLANK(['BenchBudEE.csv'.E363]);"";['BenchBudEE.csv'.E363]) ->  | F363: of:=IF(ISBLANK(['BenchBudEE.csv'.F363]);"";['BenchBudEE.csv'.F363]) ->  | G363: of:=IF(ISNUMBER(SEARCH("[0-9]";[.A363]));MID([.A363];1;SEARCH("[0-9]";[.A363])-1);"") -> 
A364: of:=IF(ISBLANK(['BenchBudEE.csv'.A364]);"";['BenchBudEE.csv'.A364]) ->  | B364: of:=IF(ISBLANK(['BenchBudEE.csv'.B364]);"";['BenchBudEE.csv'.B364]) ->  | C364: of:=IF(ISBLANK(['BenchBudEE.csv'.C499]);"";MID(['BenchBudEE.csv'.C499];SEARCH(":";['BenchBudEE.csv'.C499])+1;100)) ->  | D364: of:=IF(ISBLANK(['BenchBudEE.csv'.D364]);"";['BenchBudEE.csv'.D364]) ->  | E364: of:=IF(ISBLANK(['BenchBudEE.csv'.E364]);"";['BenchBudEE.csv'.E364]) ->  | F364: of:=IF(ISBLANK(['BenchBudEE.csv'.F364]);"";['BenchBudEE.csv'.F364]) ->  | G364: of:=IF(ISNUMBER(SEARCH("[0-9]";[.A364]));MID([.A364];1;SEARCH("[0-9]";[.A364])-1);"") -> 
A365: of:=IF(ISBLANK(['BenchBudEE.csv'.A365]);"";['BenchBudEE.csv'.A365]) ->  | B365: of:=IF(ISBLANK(['BenchBudEE.csv'.B365]);"";['BenchBudEE.csv'.B365]) ->  | C365: of:=IF(ISBLANK(['BenchBudEE.csv'.C500]);"";MID(['BenchBudEE.csv'.C500];SEARCH(":";['BenchBudEE.csv'.C500])+1;100)) ->  | D365: of:=IF(ISBLANK(['BenchBudEE.csv'.D365]);"";['BenchBudEE.csv'.D365]) ->  | E365: of:=IF(ISBLANK(['BenchBudEE.csv'.E365]);"";['BenchBudEE.csv'.E365]) ->  | F365: of:=IF(ISBLANK(['BenchBudEE.csv'.F365]);"";['BenchBudEE.csv'.F365]) ->  | G365: of:=IF(ISNUMBER(SEARCH("[0-9]";[.A365]));MID([.A365];1;SEARCH("[0-9]";[.A365])-1);"") -> 
A366: of:=IF(ISBLANK(['BenchBudEE.csv'.A366]);"";['BenchBudEE.csv'.A366]) ->  | B366: of:=IF(ISBLANK(['BenchBudEE.csv'.B366]);"";['BenchBudEE.csv'.B366]) ->  | C366: of:=IF(ISBLANK(['BenchBudEE.csv'.C501]);"";MID(['BenchBudEE.csv'.C501];SEARCH(":";['BenchBudEE.csv'.C501])+1;100)) ->  | D366: of:=IF(ISBLANK(['BenchBudEE.csv'.D366]);"";['BenchBudEE.csv'.D366]) ->  | E366: of:=IF(ISBLANK(['BenchBudEE.csv'.E366]);"";['BenchBudEE.csv'.E366]) ->  | F366: of:=IF(ISBLANK(['BenchBudEE.csv'.F366]);"";['BenchBudEE.csv'.F366]) ->  | G366: of:=IF(ISNUMBER(SEARCH("[0-9]";[.A366]));MID([.A366];1;SEARCH("[0-9]";[.A366])-1);"") -> 
A367: of:=IF(ISBLANK(['BenchBudEE.csv'.A367]);"";['BenchBudEE.csv'.A367]) ->  | B367: of:=IF(ISBLANK(['BenchBudEE.csv'.B367]);"";['BenchBudEE.csv'.B367]) ->  | C367: of:=IF(ISBLANK(['BenchBudEE.csv'.C502]);"";MID(['BenchBudEE.csv'.C502];SEARCH(":";['BenchBudEE.csv'.C502])+1;100)) ->  | D367: of:=IF(ISBLANK(['BenchBudEE.csv'.D367]);"";['BenchBudEE.csv'.D367]) ->  | E367: of:=IF(ISBLANK(['BenchBudEE.csv'.E367]);"";['BenchBudEE.csv'.E367]) ->  | F367: of:=IF(ISBLANK(['BenchBudEE.csv'.F367]);"";['BenchBudEE.csv'.F367]) ->  | G367: of:=IF(ISNUMBER(SEARCH("[0-9]";[.A367]));MID([.A367];1;SEARCH("[0-9]";[.A367])-1);"") -> 
A368: of:=IF(ISBLANK(['BenchBudEE.csv'.A368]);"";['BenchBudEE.csv'.A368]) ->  | B368: of:=IF(ISBLANK(['BenchBudEE.csv'.B368]);"";['BenchBudEE.csv'.B368]) ->  | C368: of:=IF(ISBLANK(['BenchBudEE.csv'.C503]);"";MID(['BenchBudEE.csv'.C503];SEARCH(":";['BenchBudEE.csv'.C503])+1;100)) ->  | D368: of:=IF(ISBLANK(['BenchBudEE.csv'.D368]);"";['BenchBudEE.csv'.D368]) ->  | E368: of:=IF(ISBLANK(['BenchBudEE.csv'.E368]);"";['BenchBudEE.csv'.E368]) ->  | F368: of:=IF(ISBLANK(['BenchBudEE.csv'.F368]);"";['BenchBudEE.csv'.F368]) ->  | G368: of:=IF(ISNUMBER(SEARCH("[0-9]";[.A368]));MID([.A368];1;SEARCH("[0-9]";[.A368])-1);"") -> 
A369: of:=IF(ISBLANK(['BenchBudEE.csv'.A369]);"";['BenchBudEE.csv'.A369]) ->  | B369: of:=IF(ISBLANK(['BenchBudEE.csv'.B369]);"";['BenchBudEE.csv'.B369]) ->  | C369: of:=IF(ISBLANK(['BenchBudEE.csv'.C504]);"";MID(['BenchBudEE.csv'.C504];SEARCH(":";['BenchBudEE.csv'.C504])+1;100)) ->  | D369: of:=IF(ISBLANK(['BenchBudEE.csv'.D369]);"";['BenchBudEE.csv'.D369]) ->  | E369: of:=IF(ISBLANK(['BenchBudEE.csv'.E369]);"";['BenchBudEE.csv'.E369]) ->  | F369: of:=IF(ISBLANK(['BenchBudEE.csv'.F369]);"";['BenchBudEE.csv'.F369]) ->  | G369: of:=IF(ISNUMBER(SEARCH("[0-9]";[.A369]));MID([.A369];1;SEARCH("[0-9]";[.A369])-1);"") -> 
A370: of:=IF(ISBLANK(['BenchBudEE.csv'.A370]);"";['BenchBudEE.csv'.A370]) ->  | B370: of:=IF(ISBLANK(['BenchBudEE.csv'.B370]);"";['BenchBudEE.csv'.B370]) ->  | C370: of:=IF(ISBLANK(['BenchBudEE.csv'.C505]);"";MID(['BenchBudEE.csv'.C505];SEARCH(":";['BenchBudEE.csv'.C505])+1;100)) ->  | D370: of:=IF(ISBLANK(['BenchBudEE.csv'.D370]);"";['BenchBudEE.csv'.D370]) ->  | E370: of:=IF(ISBLANK(['BenchBudEE.csv'.E370]);"";['BenchBudEE.csv'.E370]) ->  | F370: of:=IF(ISBLANK(['BenchBudEE.csv'.F370]);"";['BenchBudEE.csv'.F370]) ->  | G370: of:=IF(ISNUMBER(SEARCH("[0-9]";[.A370]));MID([.A370];1;SEARCH("[0-9]";[.A370])-1);"") -> 
A371: of:=IF(ISBLANK(['BenchBudEE.csv'.A371]);"";['BenchBudEE.csv'.A371]) ->  | B371: of:=IF(ISBLANK(['BenchBudEE.csv'.B371]);"";['BenchBudEE.csv'.B371]) ->  | C371: of:=IF(ISBLANK(['BenchBudEE.csv'.C506]);"";MID(['BenchBudEE.csv'.C506];SEARCH(":";['BenchBudEE.csv'.C506])+1;100)) ->  | D371: of:=IF(ISBLANK(['BenchBudEE.csv'.D371]);"";['BenchBudEE.csv'.D371]) ->  | E371: of:=IF(ISBLANK(['BenchBudEE.csv'.E371]);"";['BenchBudEE.csv'.E371]) ->  | F371: of:=IF(ISBLANK(['BenchBudEE.csv'.F371]);"";['BenchBudEE.csv'.F371]) ->  | G371: of:=IF(ISNUMBER(SEARCH("[0-9]";[.A371]));MID([.A371];1;SEARCH("[0-9]";[.A371])-1);"") -> 
A372: of:=IF(ISBLANK(['BenchBudEE.csv'.A372]);"";['BenchBudEE.csv'.A372]) ->  | B372: of:=IF(ISBLANK(['BenchBudEE.csv'.B372]);"";['BenchBudEE.csv'.B372]) ->  | C372: of:=IF(ISBLANK(['BenchBudEE.csv'.C507]);"";MID(['BenchBudEE.csv'.C507];SEARCH(":";['BenchBudEE.csv'.C507])+1;100)) ->  | D372: of:=IF(ISBLANK(['BenchBudEE.csv'.D372]);"";['BenchBudEE.csv'.D372]) ->  | E372: of:=IF(ISBLANK(['BenchBudEE.csv'.E372]);"";['BenchBudEE.csv'.E372]) ->  | F372: of:=IF(ISBLANK(['BenchBudEE.csv'.F372]);"";['BenchBudEE.csv'.F372]) ->  | G372: of:=IF(ISNUMBER(SEARCH("[0-9]";[.A372]));MID([.A372];1;SEARCH("[0-9]";[.A372])-1);"") -> 
A373: of:=IF(ISBLANK(['BenchBudEE.csv'.A373]);"";['BenchBudEE.csv'.A373]) ->  | B373: of:=IF(ISBLANK(['BenchBudEE.csv'.B373]);"";['BenchBudEE.csv'.B373]) ->  | C373: of:=IF(ISBLANK(['BenchBudEE.csv'.C508]);"";MID(['BenchBudEE.csv'.C508];SEARCH(":";['BenchBudEE.csv'.C508])+1;100)) ->  | D373: of:=IF(ISBLANK(['BenchBudEE.csv'.D373]);"";['BenchBudEE.csv'.D373]) ->  | E373: of:=IF(ISBLANK(['BenchBudEE.csv'.E373]);"";['BenchBudEE.csv'.E373]) ->  | F373: of:=IF(ISBLANK(['BenchBudEE.csv'.F373]);"";['BenchBudEE.csv'.F373]) ->  | G373: of:=IF(ISNUMBER(SEARCH("[0-9]";[.A373]));MID([.A373];1;SEARCH("[0-9]";[.A373])-1);"") -> 
A374: of:=IF(ISBLANK(['BenchBudEE.csv'.A374]);"";['BenchBudEE.csv'.A374]) ->  | B374: of:=IF(ISBLANK(['BenchBudEE.csv'.B374]);"";['BenchBudEE.csv'.B374]) ->  | C374: of:=IF(ISBLANK(['BenchBudEE.csv'.C509]);"";MID(['BenchBudEE.csv'.C509];SEARCH(":";['BenchBudEE.csv'.C509])+1;100)) ->  | D374: of:=IF(ISBLANK(['BenchBudEE.csv'.D374]);"";['BenchBudEE.csv'.D374]) ->  | E374: of:=IF(ISBLANK(['BenchBudEE.csv'.E374]);"";['BenchBudEE.csv'.E374]) ->  | F374: of:=IF(ISBLANK(['BenchBudEE.csv'.F374]);"";['BenchBudEE.csv'.F374]) ->  | G374: of:=IF(ISNUMBER(SEARCH("[0-9]";[.A374]));MID([.A374];1;SEARCH("[0-9]";[.A374])-1);"") -> 
A375: of:=IF(ISBLANK(['BenchBudEE.csv'.A375]);"";['BenchBudEE.csv'.A375]) ->  | B375: of:=IF(ISBLANK(['BenchBudEE.csv'.B375]);"";['BenchBudEE.csv'.B375]) ->  | C375: of:=IF(ISBLANK(['BenchBudEE.csv'.C510]);"";MID(['BenchBudEE.csv'.C510];SEARCH(":";['BenchBudEE.csv'.C510])+1;100)) ->  | D375: of:=IF(ISBLANK(['BenchBudEE.csv'.D375]);"";['BenchBudEE.csv'.D375]) ->  | E375: of:=IF(ISBLANK(['BenchBudEE.csv'.E375]);"";['BenchBudEE.csv'.E375]) ->  | F375: of:=IF(ISBLANK(['BenchBudEE.csv'.F375]);"";['BenchBudEE.csv'.F375]) ->  | G375: of:=IF(ISNUMBER(SEARCH("[0-9]";[.A375]));MID([.A375];1;SEARCH("[0-9]";[.A375])-1);"") -> 
A376: of:=IF(ISBLANK(['BenchBudEE.csv'.A376]);"";['BenchBudEE.csv'.A376]) ->  | B376: of:=IF(ISBLANK(['BenchBudEE.csv'.B376]);"";['BenchBudEE.csv'.B376]) ->  | C376: of:=IF(ISBLANK(['BenchBudEE.csv'.C511]);"";MID(['BenchBudEE.csv'.C511];SEARCH(":";['BenchBudEE.csv'.C511])+1;100)) ->  | D376: of:=IF(ISBLANK(['BenchBudEE.csv'.D376]);"";['BenchBudEE.csv'.D376]) ->  | E376: of:=IF(ISBLANK(['BenchBudEE.csv'.E376]);"";['BenchBudEE.csv'.E376]) ->  | F376: of:=IF(ISBLANK(['BenchBudEE.csv'.F376]);"";['BenchBudEE.csv'.F376]) ->  | G376: of:=IF(ISNUMBER(SEARCH("[0-9]";[.A376]));MID([.A376];1;SEARCH("[0-9]";[.A376])-1);"") -> 
A377: of:=IF(ISBLANK(['BenchBudEE.csv'.A377]);"";['BenchBudEE.csv'.A377]) ->  | B377: of:=IF(ISBLANK(['BenchBudEE.csv'.B377]);"";['BenchBudEE.csv'.B377]) ->  | C377: of:=IF(ISBLANK(['BenchBudEE.csv'.C512]);"";MID(['BenchBudEE.csv'.C512];SEARCH(":";['BenchBudEE.csv'.C512])+1;100)) ->  | D377: of:=IF(ISBLANK(['BenchBudEE.csv'.D377]);"";['BenchBudEE.csv'.D377]) ->  | E377: of:=IF(ISBLANK(['BenchBudEE.csv'.E377]);"";['BenchBudEE.csv'.E377]) ->  | F377: of:=IF(ISBLANK(['BenchBudEE.csv'.F377]);"";['BenchBudEE.csv'.F377]) ->  | G377: of:=IF(ISNUMBER(SEARCH("[0-9]";[.A377]));MID([.A377];1;SEARCH("[0-9]";[.A377])-1);"") -> 
A378: of:=IF(ISBLANK(['BenchBudEE.csv'.A378]);"";['BenchBudEE.csv'.A378]) ->  | B378: of:=IF(ISBLANK(['BenchBudEE.csv'.B378]);"";['BenchBudEE.csv'.B378]) ->  | C378: of:=IF(ISBLANK(['BenchBudEE.csv'.C513]);"";MID(['BenchBudEE.csv'.C513];SEARCH(":";['BenchBudEE.csv'.C513])+1;100)) ->  | D378: of:=IF(ISBLANK(['BenchBudEE.csv'.D378]);"";['BenchBudEE.csv'.D378]) ->  | E378: of:=IF(ISBLANK(['BenchBudEE.csv'.E378]);"";['BenchBudEE.csv'.E378]) ->  | F378: of:=IF(ISBLANK(['BenchBudEE.csv'.F378]);"";['BenchBudEE.csv'.F378]) ->  | G378: of:=IF(ISNUMBER(SEARCH("[0-9]";[.A378]));MID([.A378];1;SEARCH("[0-9]";[.A378])-1);"") -> 
A379: of:=IF(ISBLANK(['BenchBudEE.csv'.A379]);"";['BenchBudEE.csv'.A379]) ->  | B379: of:=IF(ISBLANK(['BenchBudEE.csv'.B379]);"";['BenchBudEE.csv'.B379]) ->  | C379: of:=IF(ISBLANK(['BenchBudEE.csv'.C514]);"";MID(['BenchBudEE.csv'.C514];SEARCH(":";['BenchBudEE.csv'.C514])+1;100)) ->  | D379: of:=IF(ISBLANK(['BenchBudEE.csv'.D379]);"";['BenchBudEE.csv'.D379]) ->  | E379: of:=IF(ISBLANK(['BenchBudEE.csv'.E379]);"";['BenchBudEE.csv'.E379]) ->  | F379: of:=IF(ISBLANK(['BenchBudEE.csv'.F379]);"";['BenchBudEE.csv'.F379]) ->  | G379: of:=IF(ISNUMBER(SEARCH("[0-9]";[.A379]));MID([.A379];1;SEARCH("[0-9]";[.A379])-1);"") -> 
A380: of:=IF(ISBLANK(['BenchBudEE.csv'.A380]);"";['BenchBudEE.csv'.A380]) ->  | B380: of:=IF(ISBLANK(['BenchBudEE.csv'.B380]);"";['BenchBudEE.csv'.B380]) ->  | C380: of:=IF(ISBLANK(['BenchBudEE.csv'.C515]);"";MID(['BenchBudEE.csv'.C515];SEARCH(":";['BenchBudEE.csv'.C515])+1;100)) ->  | D380: of:=IF(ISBLANK(['BenchBudEE.csv'.D380]);"";['BenchBudEE.csv'.D380]) ->  | E380: of:=IF(ISBLANK(['BenchBudEE.csv'.E380]);"";['BenchBudEE.csv'.E380]) ->  | F380: of:=IF(ISBLANK(['BenchBudEE.csv'.F380]);"";['BenchBudEE.csv'.F380]) ->  | G380: of:=IF(ISNUMBER(SEARCH("[0-9]";[.A380]));MID([.A380];1;SEARCH("[0-9]";[.A380])-1);"") -> 
A381: of:=IF(ISBLANK(['BenchBudEE.csv'.A381]);"";['BenchBudEE.csv'.A381]) ->  | B381: of:=IF(ISBLANK(['BenchBudEE.csv'.B381]);"";['BenchBudEE.csv'.B381]) ->  | C381: of:=IF(ISBLANK(['BenchBudEE.csv'.C516]);"";MID(['BenchBudEE.csv'.C516];SEARCH(":";['BenchBudEE.csv'.C516])+1;100)) ->  | D381: of:=IF(ISBLANK(['BenchBudEE.csv'.D381]);"";['BenchBudEE.csv'.D381]) ->  | E381: of:=IF(ISBLANK(['BenchBudEE.csv'.E381]);"";['BenchBudEE.csv'.E381]) ->  | F381: of:=IF(ISBLANK(['BenchBudEE.csv'.F381]);"";['BenchBudEE.csv'.F381]) ->  | G381: of:=IF(ISNUMBER(SEARCH("[0-9]";[.A381]));MID([.A381];1;SEARCH("[0-9]";[.A381])-1);"") -> 
A382: of:=IF(ISBLANK(['BenchBudEE.csv'.A382]);"";['BenchBudEE.csv'.A382]) ->  | B382: of:=IF(ISBLANK(['BenchBudEE.csv'.B382]);"";['BenchBudEE.csv'.B382]) ->  | C382: of:=IF(ISBLANK(['BenchBudEE.csv'.C517]);"";MID(['BenchBudEE.csv'.C517];SEARCH(":";['BenchBudEE.csv'.C517])+1;100)) ->  | D382: of:=IF(ISBLANK(['BenchBudEE.csv'.D382]);"";['BenchBudEE.csv'.D382]) ->  | E382: of:=IF(ISBLANK(['BenchBudEE.csv'.E382]);"";['BenchBudEE.csv'.E382]) ->  | F382: of:=IF(ISBLANK(['BenchBudEE.csv'.F382]);"";['BenchBudEE.csv'.F382]) ->  | G382: of:=IF(ISNUMBER(SEARCH("[0-9]";[.A382]));MID([.A382];1;SEARCH("[0-9]";[.A382])-1);"") -> 
A383: of:=IF(ISBLANK(['BenchBudEE.csv'.A383]);"";['BenchBudEE.csv'.A383]) ->  | B383: of:=IF(ISBLANK(['BenchBudEE.csv'.B383]);"";['BenchBudEE.csv'.B383]) ->  | C383: of:=IF(ISBLANK(['BenchBudEE.csv'.C518]);"";MID(['BenchBudEE.csv'.C518];SEARCH(":";['BenchBudEE.csv'.C518])+1;100)) ->  | D383: of:=IF(ISBLANK(['BenchBudEE.csv'.D383]);"";['BenchBudEE.csv'.D383]) ->  | E383: of:=IF(ISBLANK(['BenchBudEE.csv'.E383]);"";['BenchBudEE.csv'.E383]) ->  | F383: of:=IF(ISBLANK(['BenchBudEE.csv'.F383]);"";['BenchBudEE.csv'.F383]) ->  | G383: of:=IF(ISNUMBER(SEARCH("[0-9]";[.A383]));MID([.A383];1;SEARCH("[0-9]";[.A383])-1);"") -> 
A384: of:=IF(ISBLANK(['BenchBudEE.csv'.A384]);"";['BenchBudEE.csv'.A384]) ->  | B384: of:=IF(ISBLANK(['BenchBudEE.csv'.B384]);"";['BenchBudEE.csv'.B384]) ->  | C384: of:=IF(ISBLANK(['BenchBudEE.csv'.C519]);"";MID(['BenchBudEE.csv'.C519];SEARCH(":";['BenchBudEE.csv'.C519])+1;100)) ->  | D384: of:=IF(ISBLANK(['BenchBudEE.csv'.D384]);"";['BenchBudEE.csv'.D384]) ->  | E384: of:=IF(ISBLANK(['BenchBudEE.csv'.E384]);"";['BenchBudEE.csv'.E384]) ->  | F384: of:=IF(ISBLANK(['BenchBudEE.csv'.F384]);"";['BenchBudEE.csv'.F384]) ->  | G384: of:=IF(ISNUMBER(SEARCH("[0-9]";[.A384]));MID([.A384];1;SEARCH("[0-9]";[.A384])-1);"") -> 
A385: of:=IF(ISBLANK(['BenchBudEE.csv'.A385]);"";['BenchBudEE.csv'.A385]) ->  | B385: of:=IF(ISBLANK(['BenchBudEE.csv'.B385]);"";['BenchBudEE.csv'.B385]) ->  | C385: of:=IF(ISBLANK(['BenchBudEE.csv'.C520]);"";MID(['BenchBudEE.csv'.C520];SEARCH(":";['BenchBudEE.csv'.C520])+1;100)) ->  | D385: of:=IF(ISBLANK(['BenchBudEE.csv'.D385]);"";['BenchBudEE.csv'.D385]) ->  | E385: of:=IF(ISBLANK(['BenchBudEE.csv'.E385]);"";['BenchBudEE.csv'.E385]) ->  | F385: of:=IF(ISBLANK(['BenchBudEE.csv'.F385]);"";['BenchBudEE.csv'.F385]) ->  | G385: of:=IF(ISNUMBER(SEARCH("[0-9]";[.A385]));MID([.A385];1;SEARCH("[0-9]";[.A385])-1);"") -> 
A386: of:=IF(ISBLANK(['BenchBudEE.csv'.A386]);"";['BenchBudEE.csv'.A386]) ->  | B386: of:=IF(ISBLANK(['BenchBudEE.csv'.B386]);"";['BenchBudEE.csv'.B386]) ->  | C386: of:=IF(ISBLANK(['BenchBudEE.csv'.C521]);"";MID(['BenchBudEE.csv'.C521];SEARCH(":";['BenchBudEE.csv'.C521])+1;100)) ->  | D386: of:=IF(ISBLANK(['BenchBudEE.csv'.D386]);"";['BenchBudEE.csv'.D386]) ->  | E386: of:=IF(ISBLANK(['BenchBudEE.csv'.E386]);"";['BenchBudEE.csv'.E386]) ->  | F386: of:=IF(ISBLANK(['BenchBudEE.csv'.F386]);"";['BenchBudEE.csv'.F386]) ->  | G386: of:=IF(ISNUMBER(SEARCH("[0-9]";[.A386]));MID([.A386];1;SEARCH("[0-9]";[.A386])-1);"") -> 
A387: of:=IF(ISBLANK(['BenchBudEE.csv'.A387]);"";['BenchBudEE.csv'.A387]) ->  | B387: of:=IF(ISBLANK(['BenchBudEE.csv'.B387]);"";['BenchBudEE.csv'.B387]) ->  | C387: of:=IF(ISBLANK(['BenchBudEE.csv'.C522]);"";MID(['BenchBudEE.csv'.C522];SEARCH(":";['BenchBudEE.csv'.C522])+1;100)) ->  | D387: of:=IF(ISBLANK(['BenchBudEE.csv'.D387]);"";['BenchBudEE.csv'.D387]) ->  | E387: of:=IF(ISBLANK(['BenchBudEE.csv'.E387]);"";['BenchBudEE.csv'.E387]) ->  | F387: of:=IF(ISBLANK(['BenchBudEE.csv'.F387]);"";['BenchBudEE.csv'.F387]) ->  | G387: of:=IF(ISNUMBER(SEARCH("[0-9]";[.A387]));MID([.A387];1;SEARCH("[0-9]";[.A387])-1);"") -> 
A388: of:=IF(ISBLANK(['BenchBudEE.csv'.A388]);"";['BenchBudEE.csv'.A388]) ->  | B388: of:=IF(ISBLANK(['BenchBudEE.csv'.B388]);"";['BenchBudEE.csv'.B388]) ->  | C388: of:=IF(ISBLANK(['BenchBudEE.csv'.C523]);"";MID(['BenchBudEE.csv'.C523];SEARCH(":";['BenchBudEE.csv'.C523])+1;100)) ->  | D388: of:=IF(ISBLANK(['BenchBudEE.csv'.D388]);"";['BenchBudEE.csv'.D388]) ->  | E388: of:=IF(ISBLANK(['BenchBudEE.csv'.E388]);"";['BenchBudEE.csv'.E388]) ->  | F388: of:=IF(ISBLANK(['BenchBudEE.csv'.F388]);"";['BenchBudEE.csv'.F388]) ->  | G388: of:=IF(ISNUMBER(SEARCH("[0-9]";[.A388]));MID([.A388];1;SEARCH("[0-9]";[.A388])-1);"") -> 
A389: of:=IF(ISBLANK(['BenchBudEE.csv'.A389]);"";['BenchBudEE.csv'.A389]) ->  | B389: of:=IF(ISBLANK(['BenchBudEE.csv'.B389]);"";['BenchBudEE.csv'.B389]) ->  | C389: of:=IF(ISBLANK(['BenchBudEE.csv'.C524]);"";MID(['BenchBudEE.csv'.C524];SEARCH(":";['BenchBudEE.csv'.C524])+1;100)) ->  | D389: of:=IF(ISBLANK(['BenchBudEE.csv'.D389]);"";['BenchBudEE.csv'.D389]) ->  | E389: of:=IF(ISBLANK(['BenchBudEE.csv'.E389]);"";['BenchBudEE.csv'.E389]) ->  | F389: of:=IF(ISBLANK(['BenchBudEE.csv'.F389]);"";['BenchBudEE.csv'.F389]) ->  | G389: of:=IF(ISNUMBER(SEARCH("[0-9]";[.A389]));MID([.A389];1;SEARCH("[0-9]";[.A389])-1);"") -> 
A390: of:=IF(ISBLANK(['BenchBudEE.csv'.A390]);"";['BenchBudEE.csv'.A390]) ->  | B390: of:=IF(ISBLANK(['BenchBudEE.csv'.B390]);"";['BenchBudEE.csv'.B390]) ->  | C390: of:=IF(ISBLANK(['BenchBudEE.csv'.C525]);"";MID(['BenchBudEE.csv'.C525];SEARCH(":";['BenchBudEE.csv'.C525])+1;100)) ->  | D390: of:=IF(ISBLANK(['BenchBudEE.csv'.D390]);"";['BenchBudEE.csv'.D390]) ->  | E390: of:=IF(ISBLANK(['BenchBudEE.csv'.E390]);"";['BenchBudEE.csv'.E390]) ->  | F390: of:=IF(ISBLANK(['BenchBudEE.csv'.F390]);"";['BenchBudEE.csv'.F390]) ->  | G390: of:=IF(ISNUMBER(SEARCH("[0-9]";[.A390]));MID([.A390];1;SEARCH("[0-9]";[.A390])-1);"") -> 
A391: of:=IF(ISBLANK(['BenchBudEE.csv'.A391]);"";['BenchBudEE.csv'.A391]) ->  | B391: of:=IF(ISBLANK(['BenchBudEE.csv'.B391]);"";['BenchBudEE.csv'.B391]) ->  | C391: of:=IF(ISBLANK(['BenchBudEE.csv'.C526]);"";MID(['BenchBudEE.csv'.C526];SEARCH(":";['BenchBudEE.csv'.C526])+1;100)) ->  | D391: of:=IF(ISBLANK(['BenchBudEE.csv'.D391]);"";['BenchBudEE.csv'.D391]) ->  | E391: of:=IF(ISBLANK(['BenchBudEE.csv'.E391]);"";['BenchBudEE.csv'.E391]) ->  | F391: of:=IF(ISBLANK(['BenchBudEE.csv'.F391]);"";['BenchBudEE.csv'.F391]) ->  | G391: of:=IF(ISNUMBER(SEARCH("[0-9]";[.A391]));MID([.A391];1;SEARCH("[0-9]";[.A391])-1);"") -> 
A392: of:=IF(ISBLANK(['BenchBudEE.csv'.A392]);"";['BenchBudEE.csv'.A392]) ->  | B392: of:=IF(ISBLANK(['BenchBudEE.csv'.B392]);"";['BenchBudEE.csv'.B392]) ->  | C392: of:=IF(ISBLANK(['BenchBudEE.csv'.C527]);"";MID(['BenchBudEE.csv'.C527];SEARCH(":";['BenchBudEE.csv'.C527])+1;100)) ->  | D392: of:=IF(ISBLANK(['BenchBudEE.csv'.D392]);"";['BenchBudEE.csv'.D392]) ->  | E392: of:=IF(ISBLANK(['BenchBudEE.csv'.E392]);"";['BenchBudEE.csv'.E392]) ->  | F392: of:=IF(ISBLANK(['BenchBudEE.csv'.F392]);"";['BenchBudEE.csv'.F392]) ->  | G392: of:=IF(ISNUMBER(SEARCH("[0-9]";[.A392]));MID([.A392];1;SEARCH("[0-9]";[.A392])-1);"") -> 
A393: of:=IF(ISBLANK(['BenchBudEE.csv'.A393]);"";['BenchBudEE.csv'.A393]) ->  | B393: of:=IF(ISBLANK(['BenchBudEE.csv'.B393]);"";['BenchBudEE.csv'.B393]) ->  | C393: of:=IF(ISBLANK(['BenchBudEE.csv'.C528]);"";MID(['BenchBudEE.csv'.C528];SEARCH(":";['BenchBudEE.csv'.C528])+1;100)) ->  | D393: of:=IF(ISBLANK(['BenchBudEE.csv'.D393]);"";['BenchBudEE.csv'.D393]) ->  | E393: of:=IF(ISBLANK(['BenchBudEE.csv'.E393]);"";['BenchBudEE.csv'.E393]) ->  | F393: of:=IF(ISBLANK(['BenchBudEE.csv'.F393]);"";['BenchBudEE.csv'.F393]) ->  | G393: of:=IF(ISNUMBER(SEARCH("[0-9]";[.A393]));MID([.A393];1;SEARCH("[0-9]";[.A393])-1);"") -> 
A394: of:=IF(ISBLANK(['BenchBudEE.csv'.A394]);"";['BenchBudEE.csv'.A394]) ->  | B394: of:=IF(ISBLANK(['BenchBudEE.csv'.B394]);"";['BenchBudEE.csv'.B394]) ->  | C394: of:=IF(ISBLANK(['BenchBudEE.csv'.C529]);"";MID(['BenchBudEE.csv'.C529];SEARCH(":";['BenchBudEE.csv'.C529])+1;100)) ->  | D394: of:=IF(ISBLANK(['BenchBudEE.csv'.D394]);"";['BenchBudEE.csv'.D394]) ->  | E394: of:=IF(ISBLANK(['BenchBudEE.csv'.E394]);"";['BenchBudEE.csv'.E394]) ->  | F394: of:=IF(ISBLANK(['BenchBudEE.csv'.F394]);"";['BenchBudEE.csv'.F394]) ->  | G394: of:=IF(ISNUMBER(SEARCH("[0-9]";[.A394]));MID([.A394];1;SEARCH("[0-9]";[.A394])-1);"") -> 
A395: of:=IF(ISBLANK(['BenchBudEE.csv'.A395]);"";['BenchBudEE.csv'.A395]) ->  | B395: of:=IF(ISBLANK(['BenchBudEE.csv'.B395]);"";['BenchBudEE.csv'.B395]) ->  | C395: of:=IF(ISBLANK(['BenchBudEE.csv'.C530]);"";MID(['BenchBudEE.csv'.C530];SEARCH(":";['BenchBudEE.csv'.C530])+1;100)) ->  | D395: of:=IF(ISBLANK(['BenchBudEE.csv'.D395]);"";['BenchBudEE.csv'.D395]) ->  | E395: of:=IF(ISBLANK(['BenchBudEE.csv'.E395]);"";['BenchBudEE.csv'.E395]) ->  | F395: of:=IF(ISBLANK(['BenchBudEE.csv'.F395]);"";['BenchBudEE.csv'.F395]) ->  | G395: of:=IF(ISNUMBER(SEARCH("[0-9]";[.A395]));MID([.A395];1;SEARCH("[0-9]";[.A395])-1);"") -> 
A396: of:=IF(ISBLANK(['BenchBudEE.csv'.A396]);"";['BenchBudEE.csv'.A396]) ->  | B396: of:=IF(ISBLANK(['BenchBudEE.csv'.B396]);"";['BenchBudEE.csv'.B396]) ->  | C396: of:=IF(ISBLANK(['BenchBudEE.csv'.C531]);"";MID(['BenchBudEE.csv'.C531];SEARCH(":";['BenchBudEE.csv'.C531])+1;100)) ->  | D396: of:=IF(ISBLANK(['BenchBudEE.csv'.D396]);"";['BenchBudEE.csv'.D396]) ->  | E396: of:=IF(ISBLANK(['BenchBudEE.csv'.E396]);"";['BenchBudEE.csv'.E396]) ->  | F396: of:=IF(ISBLANK(['BenchBudEE.csv'.F396]);"";['BenchBudEE.csv'.F396]) ->  | G396: of:=IF(ISNUMBER(SEARCH("[0-9]";[.A396]));MID([.A396];1;SEARCH("[0-9]";[.A396])-1);"") -> 
A397: of:=IF(ISBLANK(['BenchBudEE.csv'.A397]);"";['BenchBudEE.csv'.A397]) ->  | B397: of:=IF(ISBLANK(['BenchBudEE.csv'.B397]);"";['BenchBudEE.csv'.B397]) ->  | C397: of:=IF(ISBLANK(['BenchBudEE.csv'.C532]);"";MID(['BenchBudEE.csv'.C532];SEARCH(":";['BenchBudEE.csv'.C532])+1;100)) ->  | D397: of:=IF(ISBLANK(['BenchBudEE.csv'.D397]);"";['BenchBudEE.csv'.D397]) ->  | E397: of:=IF(ISBLANK(['BenchBudEE.csv'.E397]);"";['BenchBudEE.csv'.E397]) ->  | F397: of:=IF(ISBLANK(['BenchBudEE.csv'.F397]);"";['BenchBudEE.csv'.F397]) ->  | G397: of:=IF(ISNUMBER(SEARCH("[0-9]";[.A397]));MID([.A397];1;SEARCH("[0-9]";[.A397])-1);"") -> 
A398: of:=IF(ISBLANK(['BenchBudEE.csv'.A398]);"";['BenchBudEE.csv'.A398]) ->  | B398: of:=IF(ISBLANK(['BenchBudEE.csv'.B398]);"";['BenchBudEE.csv'.B398]) ->  | C398: of:=IF(ISBLANK(['BenchBudEE.csv'.C533]);"";MID(['BenchBudEE.csv'.C533];SEARCH(":";['BenchBudEE.csv'.C533])+1;100)) ->  | D398: of:=IF(ISBLANK(['BenchBudEE.csv'.D398]);"";['BenchBudEE.csv'.D398]) ->  | E398: of:=IF(ISBLANK(['BenchBudEE.csv'.E398]);"";['BenchBudEE.csv'.E398]) ->  | F398: of:=IF(ISBLANK(['BenchBudEE.csv'.F398]);"";['BenchBudEE.csv'.F398]) ->  | G398: of:=IF(ISNUMBER(SEARCH("[0-9]";[.A398]));MID([.A398];1;SEARCH("[0-9]";[.A398])-1);"") -> 
A399: of:=IF(ISBLANK(['BenchBudEE.csv'.A399]);"";['BenchBudEE.csv'.A399]) ->  | B399: of:=IF(ISBLANK(['BenchBudEE.csv'.B399]);"";['BenchBudEE.csv'.B399]) ->  | C399: of:=IF(ISBLANK(['BenchBudEE.csv'.C534]);"";MID(['BenchBudEE.csv'.C534];SEARCH(":";['BenchBudEE.csv'.C534])+1;100)) ->  | D399: of:=IF(ISBLANK(['BenchBudEE.csv'.D399]);"";['BenchBudEE.csv'.D399]) ->  | E399: of:=IF(ISBLANK(['BenchBudEE.csv'.E399]);"";['BenchBudEE.csv'.E399]) ->  | F399: of:=IF(ISBLANK(['BenchBudEE.csv'.F399]);"";['BenchBudEE.csv'.F399]) ->  | G399: of:=IF(ISNUMBER(SEARCH("[0-9]";[.A399]));MID([.A399];1;SEARCH("[0-9]";[.A399])-1);"") -> 
A400: of:=IF(ISBLANK(['BenchBudEE.csv'.A400]);"";['BenchBudEE.csv'.A400]) ->  | B400: of:=IF(ISBLANK(['BenchBudEE.csv'.B400]);"";['BenchBudEE.csv'.B400]) ->  | C400: of:=IF(ISBLANK(['BenchBudEE.csv'.C535]);"";MID(['BenchBudEE.csv'.C535];SEARCH(":";['BenchBudEE.csv'.C535])+1;100)) ->  | D400: of:=IF(ISBLANK(['BenchBudEE.csv'.D400]);"";['BenchBudEE.csv'.D400]) ->  | E400: of:=IF(ISBLANK(['BenchBudEE.csv'.E400]);"";['BenchBudEE.csv'.E400]) ->  | F400: of:=IF(ISBLANK(['BenchBudEE.csv'.F400]);"";['BenchBudEE.csv'.F400]) ->  | G400: of:=IF(ISNUMBER(SEARCH("[0-9]";[.A400]));MID([.A400];1;SEARCH("[0-9]";[.A400])-1);"") -> 
A401: of:=IF(ISBLANK(['BenchBudEE.csv'.A401]);"";['BenchBudEE.csv'.A401]) ->  | B401: of:=IF(ISBLANK(['BenchBudEE.csv'.B401]);"";['BenchBudEE.csv'.B401]) ->  | C401: of:=IF(ISBLANK(['BenchBudEE.csv'.C536]);"";MID(['BenchBudEE.csv'.C536];SEARCH(":";['BenchBudEE.csv'.C536])+1;100)) ->  | D401: of:=IF(ISBLANK(['BenchBudEE.csv'.D401]);"";['BenchBudEE.csv'.D401]) ->  | E401: of:=IF(ISBLANK(['BenchBudEE.csv'.E401]);"";['BenchBudEE.csv'.E401]) ->  | F401: of:=IF(ISBLANK(['BenchBudEE.csv'.F401]);"";['BenchBudEE.csv'.F401]) ->  | G401: of:=IF(ISNUMBER(SEARCH("[0-9]";[.A401]));MID([.A401];1;SEARCH("[0-9]";[.A401])-1);"") -> 
A402: of:=IF(ISBLANK(['BenchBudEE.csv'.A402]);"";['BenchBudEE.csv'.A402]) ->  | B402: of:=IF(ISBLANK(['BenchBudEE.csv'.B402]);"";['BenchBudEE.csv'.B402]) ->  | C402: of:=IF(ISBLANK(['BenchBudEE.csv'.C537]);"";MID(['BenchBudEE.csv'.C537];SEARCH(":";['BenchBudEE.csv'.C537])+1;100)) ->  | D402: of:=IF(ISBLANK(['BenchBudEE.csv'.D402]);"";['BenchBudEE.csv'.D402]) ->  | E402: of:=IF(ISBLANK(['BenchBudEE.csv'.E402]);"";['BenchBudEE.csv'.E402]) ->  | F402: of:=IF(ISBLANK(['BenchBudEE.csv'.F402]);"";['BenchBudEE.csv'.F402]) ->  | G402: of:=IF(ISNUMBER(SEARCH("[0-9]";[.A402]));MID([.A402];1;SEARCH("[0-9]";[.A402])-1);"") -> 
A403: of:=IF(ISBLANK(['BenchBudEE.csv'.A403]);"";['BenchBudEE.csv'.A403]) ->  | B403: of:=IF(ISBLANK(['BenchBudEE.csv'.B403]);"";['BenchBudEE.csv'.B403]) ->  | C403: of:=IF(ISBLANK(['BenchBudEE.csv'.C538]);"";MID(['BenchBudEE.csv'.C538];SEARCH(":";['BenchBudEE.csv'.C538])+1;100)) ->  | D403: of:=IF(ISBLANK(['BenchBudEE.csv'.D403]);"";['BenchBudEE.csv'.D403]) ->  | E403: of:=IF(ISBLANK(['BenchBudEE.csv'.E403]);"";['BenchBudEE.csv'.E403]) ->  | F403: of:=IF(ISBLANK(['BenchBudEE.csv'.F403]);"";['BenchBudEE.csv'.F403]) ->  | G403: of:=IF(ISNUMBER(SEARCH("[0-9]";[.A403]));MID([.A403];1;SEARCH("[0-9]";[.A403])-1);"") -> 
A404: of:=IF(ISBLANK(['BenchBudEE.csv'.A404]);"";['BenchBudEE.csv'.A404]) ->  | B404: of:=IF(ISBLANK(['BenchBudEE.csv'.B404]);"";['BenchBudEE.csv'.B404]) ->  | C404: of:=IF(ISBLANK(['BenchBudEE.csv'.C539]);"";MID(['BenchBudEE.csv'.C539];SEARCH(":";['BenchBudEE.csv'.C539])+1;100)) ->  | D404: of:=IF(ISBLANK(['BenchBudEE.csv'.D404]);"";['BenchBudEE.csv'.D404]) ->  | E404: of:=IF(ISBLANK(['BenchBudEE.csv'.E404]);"";['BenchBudEE.csv'.E404]) ->  | F404: of:=IF(ISBLANK(['BenchBudEE.csv'.F404]);"";['BenchBudEE.csv'.F404]) ->  | G404: of:=IF(ISNUMBER(SEARCH("[0-9]";[.A404]));MID([.A404];1;SEARCH("[0-9]";[.A404])-1);"") -> 
A405: of:=IF(ISBLANK(['BenchBudEE.csv'.A405]);"";['BenchBudEE.csv'.A405]) ->  | B405: of:=IF(ISBLANK(['BenchBudEE.csv'.B405]);"";['BenchBudEE.csv'.B405]) ->  | C405: of:=IF(ISBLANK(['BenchBudEE.csv'.C540]);"";MID(['BenchBudEE.csv'.C540];SEARCH(":";['BenchBudEE.csv'.C540])+1;100)) ->  | D405: of:=IF(ISBLANK(['BenchBudEE.csv'.D405]);"";['BenchBudEE.csv'.D405]) ->  | E405: of:=IF(ISBLANK(['BenchBudEE.csv'.E405]);"";['BenchBudEE.csv'.E405]) ->  | F405: of:=IF(ISBLANK(['BenchBudEE.csv'.F405]);"";['BenchBudEE.csv'.F405]) ->  | G405: of:=IF(ISNUMBER(SEARCH("[0-9]";[.A405]));MID([.A405];1;SEARCH("[0-9]";[.A405])-1);"") -> 
A406: of:=IF(ISBLANK(['BenchBudEE.csv'.A406]);"";['BenchBudEE.csv'.A406]) ->  | B406: of:=IF(ISBLANK(['BenchBudEE.csv'.B406]);"";['BenchBudEE.csv'.B406]) ->  | C406: of:=IF(ISBLANK(['BenchBudEE.csv'.C541]);"";MID(['BenchBudEE.csv'.C541];SEARCH(":";['BenchBudEE.csv'.C541])+1;100)) ->  | D406: of:=IF(ISBLANK(['BenchBudEE.csv'.D406]);"";['BenchBudEE.csv'.D406]) ->  | E406: of:=IF(ISBLANK(['BenchBudEE.csv'.E406]);"";['BenchBudEE.csv'.E406]) ->  | F406: of:=IF(ISBLANK(['BenchBudEE.csv'.F406]);"";['BenchBudEE.csv'.F406]) ->  | G406: of:=IF(ISNUMBER(SEARCH("[0-9]";[.A406]));MID([.A406];1;SEARCH("[0-9]";[.A406])-1);"") -> 
A407: of:=IF(ISBLANK(['BenchBudEE.csv'.A407]);"";['BenchBudEE.csv'.A407]) ->  | B407: of:=IF(ISBLANK(['BenchBudEE.csv'.B407]);"";['BenchBudEE.csv'.B407]) ->  | C407: of:=IF(ISBLANK(['BenchBudEE.csv'.C542]);"";MID(['BenchBudEE.csv'.C542];SEARCH(":";['BenchBudEE.csv'.C542])+1;100)) ->  | D407: of:=IF(ISBLANK(['BenchBudEE.csv'.D407]);"";['BenchBudEE.csv'.D407]) ->  | E407: of:=IF(ISBLANK(['BenchBudEE.csv'.E407]);"";['BenchBudEE.csv'.E407]) ->  | F407: of:=IF(ISBLANK(['BenchBudEE.csv'.F407]);"";['BenchBudEE.csv'.F407]) ->  | G407: of:=IF(ISNUMBER(SEARCH("[0-9]";[.A407]));MID([.A407];1;SEARCH("[0-9]";[.A407])-1);"") -> 
A408: of:=IF(ISBLANK(['BenchBudEE.csv'.A408]);"";['BenchBudEE.csv'.A408]) ->  | B408: of:=IF(ISBLANK(['BenchBudEE.csv'.B408]);"";['BenchBudEE.csv'.B408]) ->  | C408: of:=IF(ISBLANK(['BenchBudEE.csv'.C543]);"";MID(['BenchBudEE.csv'.C543];SEARCH(":";['BenchBudEE.csv'.C543])+1;100)) ->  | D408: of:=IF(ISBLANK(['BenchBudEE.csv'.D408]);"";['BenchBudEE.csv'.D408]) ->  | E408: of:=IF(ISBLANK(['BenchBudEE.csv'.E408]);"";['BenchBudEE.csv'.E408]) ->  | F408: of:=IF(ISBLANK(['BenchBudEE.csv'.F408]);"";['BenchBudEE.csv'.F408]) ->  | G408: of:=IF(ISNUMBER(SEARCH("[0-9]";[.A408]));MID([.A408];1;SEARCH("[0-9]";[.A408])-1);"") -> 
A409: of:=IF(ISBLANK(['BenchBudEE.csv'.A409]);"";['BenchBudEE.csv'.A409]) ->  | B409: of:=IF(ISBLANK(['BenchBudEE.csv'.B409]);"";['BenchBudEE.csv'.B409]) ->  | C409: of:=IF(ISBLANK(['BenchBudEE.csv'.C544]);"";MID(['BenchBudEE.csv'.C544];SEARCH(":";['BenchBudEE.csv'.C544])+1;100)) ->  | D409: of:=IF(ISBLANK(['BenchBudEE.csv'.D409]);"";['BenchBudEE.csv'.D409]) ->  | E409: of:=IF(ISBLANK(['BenchBudEE.csv'.E409]);"";['BenchBudEE.csv'.E409]) ->  | F409: of:=IF(ISBLANK(['BenchBudEE.csv'.F409]);"";['BenchBudEE.csv'.F409]) ->  | G409: of:=IF(ISNUMBER(SEARCH("[0-9]";[.A409]));MID([.A409];1;SEARCH("[0-9]";[.A409])-1);"") -> 
A410: of:=IF(ISBLANK(['BenchBudEE.csv'.A410]);"";['BenchBudEE.csv'.A410]) ->  | B410: of:=IF(ISBLANK(['BenchBudEE.csv'.B410]);"";['BenchBudEE.csv'.B410]) ->  | C410: of:=IF(ISBLANK(['BenchBudEE.csv'.C545]);"";MID(['BenchBudEE.csv'.C545];SEARCH(":";['BenchBudEE.csv'.C545])+1;100)) ->  | D410: of:=IF(ISBLANK(['BenchBudEE.csv'.D410]);"";['BenchBudEE.csv'.D410]) ->  | E410: of:=IF(ISBLANK(['BenchBudEE.csv'.E410]);"";['BenchBudEE.csv'.E410]) ->  | F410: of:=IF(ISBLANK(['BenchBudEE.csv'.F410]);"";['BenchBudEE.csv'.F410]) ->  | G410: of:=IF(ISNUMBER(SEARCH("[0-9]";[.A410]));MID([.A410];1;SEARCH("[0-9]";[.A410])-1);"") -> 
A411: of:=IF(ISBLANK(['BenchBudEE.csv'.A411]);"";['BenchBudEE.csv'.A411]) ->  | B411: of:=IF(ISBLANK(['BenchBudEE.csv'.B411]);"";['BenchBudEE.csv'.B411]) ->  | C411: of:=IF(ISBLANK(['BenchBudEE.csv'.C546]);"";MID(['BenchBudEE.csv'.C546];SEARCH(":";['BenchBudEE.csv'.C546])+1;100)) ->  | D411: of:=IF(ISBLANK(['BenchBudEE.csv'.D411]);"";['BenchBudEE.csv'.D411]) ->  | E411: of:=IF(ISBLANK(['BenchBudEE.csv'.E411]);"";['BenchBudEE.csv'.E411]) ->  | F411: of:=IF(ISBLANK(['BenchBudEE.csv'.F411]);"";['BenchBudEE.csv'.F411]) ->  | G411: of:=IF(ISNUMBER(SEARCH("[0-9]";[.A411]));MID([.A411];1;SEARCH("[0-9]";[.A411])-1);"") -> 
A412: of:=IF(ISBLANK(['BenchBudEE.csv'.A412]);"";['BenchBudEE.csv'.A412]) ->  | B412: of:=IF(ISBLANK(['BenchBudEE.csv'.B412]);"";['BenchBudEE.csv'.B412]) ->  | C412: of:=IF(ISBLANK(['BenchBudEE.csv'.C547]);"";MID(['BenchBudEE.csv'.C547];SEARCH(":";['BenchBudEE.csv'.C547])+1;100)) ->  | D412: of:=IF(ISBLANK(['BenchBudEE.csv'.D412]);"";['BenchBudEE.csv'.D412]) ->  | E412: of:=IF(ISBLANK(['BenchBudEE.csv'.E412]);"";['BenchBudEE.csv'.E412]) ->  | F412: of:=IF(ISBLANK(['BenchBudEE.csv'.F412]);"";['BenchBudEE.csv'.F412]) ->  | G412: of:=IF(ISNUMBER(SEARCH("[0-9]";[.A412]));MID([.A412];1;SEARCH("[0-9]";[.A412])-1);"") -> 
A413: of:=IF(ISBLANK(['BenchBudEE.csv'.A413]);"";['BenchBudEE.csv'.A413]) ->  | B413: of:=IF(ISBLANK(['BenchBudEE.csv'.B413]);"";['BenchBudEE.csv'.B413]) ->  | C413: of:=IF(ISBLANK(['BenchBudEE.csv'.C548]);"";MID(['BenchBudEE.csv'.C548];SEARCH(":";['BenchBudEE.csv'.C548])+1;100)) ->  | D413: of:=IF(ISBLANK(['BenchBudEE.csv'.D413]);"";['BenchBudEE.csv'.D413]) ->  | E413: of:=IF(ISBLANK(['BenchBudEE.csv'.E413]);"";['BenchBudEE.csv'.E413]) ->  | F413: of:=IF(ISBLANK(['BenchBudEE.csv'.F413]);"";['BenchBudEE.csv'.F413]) ->  | G413: of:=IF(ISNUMBER(SEARCH("[0-9]";[.A413]));MID([.A413];1;SEARCH("[0-9]";[.A413])-1);"") -> 
A414: of:=IF(ISBLANK(['BenchBudEE.csv'.A414]);"";['BenchBudEE.csv'.A414]) ->  | B414: of:=IF(ISBLANK(['BenchBudEE.csv'.B414]);"";['BenchBudEE.csv'.B414]) ->  | C414: of:=IF(ISBLANK(['BenchBudEE.csv'.C549]);"";MID(['BenchBudEE.csv'.C549];SEARCH(":";['BenchBudEE.csv'.C549])+1;100)) ->  | D414: of:=IF(ISBLANK(['BenchBudEE.csv'.D414]);"";['BenchBudEE.csv'.D414]) ->  | E414: of:=IF(ISBLANK(['BenchBudEE.csv'.E414]);"";['BenchBudEE.csv'.E414]) ->  | F414: of:=IF(ISBLANK(['BenchBudEE.csv'.F414]);"";['BenchBudEE.csv'.F414]) ->  | G414: of:=IF(ISNUMBER(SEARCH("[0-9]";[.A414]));MID([.A414];1;SEARCH("[0-9]";[.A414])-1);"") -> 
A415: of:=IF(ISBLANK(['BenchBudEE.csv'.A415]);"";['BenchBudEE.csv'.A415]) ->  | B415: of:=IF(ISBLANK(['BenchBudEE.csv'.B415]);"";['BenchBudEE.csv'.B415]) ->  | C415: of:=IF(ISBLANK(['BenchBudEE.csv'.C550]);"";MID(['BenchBudEE.csv'.C550];SEARCH(":";['BenchBudEE.csv'.C550])+1;100)) ->  | D415: of:=IF(ISBLANK(['BenchBudEE.csv'.D415]);"";['BenchBudEE.csv'.D415]) ->  | E415: of:=IF(ISBLANK(['BenchBudEE.csv'.E415]);"";['BenchBudEE.csv'.E415]) ->  | F415: of:=IF(ISBLANK(['BenchBudEE.csv'.F415]);"";['BenchBudEE.csv'.F415]) ->  | G415: of:=IF(ISNUMBER(SEARCH("[0-9]";[.A415]));MID([.A415];1;SEARCH("[0-9]";[.A415])-1);"") -> 
A416: of:=IF(ISBLANK(['BenchBudEE.csv'.A416]);"";['BenchBudEE.csv'.A416]) ->  | B416: of:=IF(ISBLANK(['BenchBudEE.csv'.B416]);"";['BenchBudEE.csv'.B416]) ->  | C416: of:=IF(ISBLANK(['BenchBudEE.csv'.C551]);"";MID(['BenchBudEE.csv'.C551];SEARCH(":";['BenchBudEE.csv'.C551])+1;100)) ->  | D416: of:=IF(ISBLANK(['BenchBudEE.csv'.D416]);"";['BenchBudEE.csv'.D416]) ->  | E416: of:=IF(ISBLANK(['BenchBudEE.csv'.E416]);"";['BenchBudEE.csv'.E416]) ->  | F416: of:=IF(ISBLANK(['BenchBudEE.csv'.F416]);"";['BenchBudEE.csv'.F416]) ->  | G416: of:=IF(ISNUMBER(SEARCH("[0-9]";[.A416]));MID([.A416];1;SEARCH("[0-9]";[.A416])-1);"") -> 
A417: of:=IF(ISBLANK(['BenchBudEE.csv'.A417]);"";['BenchBudEE.csv'.A417]) ->  | B417: of:=IF(ISBLANK(['BenchBudEE.csv'.B417]);"";['BenchBudEE.csv'.B417]) ->  | C417: of:=IF(ISBLANK(['BenchBudEE.csv'.C552]);"";MID(['BenchBudEE.csv'.C552];SEARCH(":";['BenchBudEE.csv'.C552])+1;100)) ->  | D417: of:=IF(ISBLANK(['BenchBudEE.csv'.D417]);"";['BenchBudEE.csv'.D417]) ->  | E417: of:=IF(ISBLANK(['BenchBudEE.csv'.E417]);"";['BenchBudEE.csv'.E417]) ->  | F417: of:=IF(ISBLANK(['BenchBudEE.csv'.F417]);"";['BenchBudEE.csv'.F417]) ->  | G417: of:=IF(ISNUMBER(SEARCH("[0-9]";[.A417]));MID([.A417];1;SEARCH("[0-9]";[.A417])-1);"") -> 
A418: of:=IF(ISBLANK(['BenchBudEE.csv'.A418]);"";['BenchBudEE.csv'.A418]) ->  | B418: of:=IF(ISBLANK(['BenchBudEE.csv'.B418]);"";['BenchBudEE.csv'.B418]) ->  | C418: of:=IF(ISBLANK(['BenchBudEE.csv'.C553]);"";MID(['BenchBudEE.csv'.C553];SEARCH(":";['BenchBudEE.csv'.C553])+1;100)) ->  | D418: of:=IF(ISBLANK(['BenchBudEE.csv'.D418]);"";['BenchBudEE.csv'.D418]) ->  | E418: of:=IF(ISBLANK(['BenchBudEE.csv'.E418]);"";['BenchBudEE.csv'.E418]) ->  | F418: of:=IF(ISBLANK(['BenchBudEE.csv'.F418]);"";['BenchBudEE.csv'.F418]) ->  | G418: of:=IF(ISNUMBER(SEARCH("[0-9]";[.A418]));MID([.A418];1;SEARCH("[0-9]";[.A418])-1);"") -> 
A419: of:=IF(ISBLANK(['BenchBudEE.csv'.A419]);"";['BenchBudEE.csv'.A419]) ->  | B419: of:=IF(ISBLANK(['BenchBudEE.csv'.B419]);"";['BenchBudEE.csv'.B419]) ->  | C419: of:=IF(ISBLANK(['BenchBudEE.csv'.C554]);"";MID(['BenchBudEE.csv'.C554];SEARCH(":";['BenchBudEE.csv'.C554])+1;100)) ->  | D419: of:=IF(ISBLANK(['BenchBudEE.csv'.D419]);"";['BenchBudEE.csv'.D419]) ->  | E419: of:=IF(ISBLANK(['BenchBudEE.csv'.E419]);"";['BenchBudEE.csv'.E419]) ->  | F419: of:=IF(ISBLANK(['BenchBudEE.csv'.F419]);"";['BenchBudEE.csv'.F419]) ->  | G419: of:=IF(ISNUMBER(SEARCH("[0-9]";[.A419]));MID([.A419];1;SEARCH("[0-9]";[.A419])-1);"") -> 
A420: of:=IF(ISBLANK(['BenchBudEE.csv'.A420]);"";['BenchBudEE.csv'.A420]) ->  | B420: of:=IF(ISBLANK(['BenchBudEE.csv'.B420]);"";['BenchBudEE.csv'.B420]) ->  | C420: of:=IF(ISBLANK(['BenchBudEE.csv'.C555]);"";MID(['BenchBudEE.csv'.C555];SEARCH(":";['BenchBudEE.csv'.C555])+1;100)) ->  | D420: of:=IF(ISBLANK(['BenchBudEE.csv'.D420]);"";['BenchBudEE.csv'.D420]) ->  | E420: of:=IF(ISBLANK(['BenchBudEE.csv'.E420]);"";['BenchBudEE.csv'.E420]) ->  | F420: of:=IF(ISBLANK(['BenchBudEE.csv'.F420]);"";['BenchBudEE.csv'.F420]) ->  | G420: of:=IF(ISNUMBER(SEARCH("[0-9]";[.A420]));MID([.A420];1;SEARCH("[0-9]";[.A420])-1);"") -> 
A421: of:=IF(ISBLANK(['BenchBudEE.csv'.A421]);"";['BenchBudEE.csv'.A421]) ->  | B421: of:=IF(ISBLANK(['BenchBudEE.csv'.B421]);"";['BenchBudEE.csv'.B421]) ->  | C421: of:=IF(ISBLANK(['BenchBudEE.csv'.C556]);"";MID(['BenchBudEE.csv'.C556];SEARCH(":";['BenchBudEE.csv'.C556])+1;100)) ->  | D421: of:=IF(ISBLANK(['BenchBudEE.csv'.D421]);"";['BenchBudEE.csv'.D421]) ->  | E421: of:=IF(ISBLANK(['BenchBudEE.csv'.E421]);"";['BenchBudEE.csv'.E421]) ->  | F421: of:=IF(ISBLANK(['BenchBudEE.csv'.F421]);"";['BenchBudEE.csv'.F421]) ->  | G421: of:=IF(ISNUMBER(SEARCH("[0-9]";[.A421]));MID([.A421];1;SEARCH("[0-9]";[.A421])-1);"") -> 
A422: of:=IF(ISBLANK(['BenchBudEE.csv'.A422]);"";['BenchBudEE.csv'.A422]) ->  | B422: of:=IF(ISBLANK(['BenchBudEE.csv'.B422]);"";['BenchBudEE.csv'.B422]) ->  | C422: of:=IF(ISBLANK(['BenchBudEE.csv'.C557]);"";MID(['BenchBudEE.csv'.C557];SEARCH(":";['BenchBudEE.csv'.C557])+1;100)) ->  | D422: of:=IF(ISBLANK(['BenchBudEE.csv'.D422]);"";['BenchBudEE.csv'.D422]) ->  | E422: of:=IF(ISBLANK(['BenchBudEE.csv'.E422]);"";['BenchBudEE.csv'.E422]) ->  | F422: of:=IF(ISBLANK(['BenchBudEE.csv'.F422]);"";['BenchBudEE.csv'.F422]) ->  | G422: of:=IF(ISNUMBER(SEARCH("[0-9]";[.A422]));MID([.A422];1;SEARCH("[0-9]";[.A422])-1);"") -> 
A423: of:=IF(ISBLANK(['BenchBudEE.csv'.A423]);"";['BenchBudEE.csv'.A423]) ->  | B423: of:=IF(ISBLANK(['BenchBudEE.csv'.B423]);"";['BenchBudEE.csv'.B423]) ->  | C423: of:=IF(ISBLANK(['BenchBudEE.csv'.C558]);"";MID(['BenchBudEE.csv'.C558];SEARCH(":";['BenchBudEE.csv'.C558])+1;100)) ->  | D423: of:=IF(ISBLANK(['BenchBudEE.csv'.D423]);"";['BenchBudEE.csv'.D423]) ->  | E423: of:=IF(ISBLANK(['BenchBudEE.csv'.E423]);"";['BenchBudEE.csv'.E423]) ->  | F423: of:=IF(ISBLANK(['BenchBudEE.csv'.F423]);"";['BenchBudEE.csv'.F423]) ->  | G423: of:=IF(ISNUMBER(SEARCH("[0-9]";[.A423]));MID([.A423];1;SEARCH("[0-9]";[.A423])-1);"") -> 
A424: of:=IF(ISBLANK(['BenchBudEE.csv'.A424]);"";['BenchBudEE.csv'.A424]) ->  | B424: of:=IF(ISBLANK(['BenchBudEE.csv'.B424]);"";['BenchBudEE.csv'.B424]) ->  | C424: of:=IF(ISBLANK(['BenchBudEE.csv'.C559]);"";MID(['BenchBudEE.csv'.C559];SEARCH(":";['BenchBudEE.csv'.C559])+1;100)) ->  | D424: of:=IF(ISBLANK(['BenchBudEE.csv'.D424]);"";['BenchBudEE.csv'.D424]) ->  | E424: of:=IF(ISBLANK(['BenchBudEE.csv'.E424]);"";['BenchBudEE.csv'.E424]) ->  | F424: of:=IF(ISBLANK(['BenchBudEE.csv'.F424]);"";['BenchBudEE.csv'.F424]) ->  | G424: of:=IF(ISNUMBER(SEARCH("[0-9]";[.A424]));MID([.A424];1;SEARCH("[0-9]";[.A424])-1);"") -> 
A425: of:=IF(ISBLANK(['BenchBudEE.csv'.A425]);"";['BenchBudEE.csv'.A425]) ->  | B425: of:=IF(ISBLANK(['BenchBudEE.csv'.B425]);"";['BenchBudEE.csv'.B425]) ->  | C425: of:=IF(ISBLANK(['BenchBudEE.csv'.C560]);"";MID(['BenchBudEE.csv'.C560];SEARCH(":";['BenchBudEE.csv'.C560])+1;100)) ->  | D425: of:=IF(ISBLANK(['BenchBudEE.csv'.D425]);"";['BenchBudEE.csv'.D425]) ->  | E425: of:=IF(ISBLANK(['BenchBudEE.csv'.E425]);"";['BenchBudEE.csv'.E425]) ->  | F425: of:=IF(ISBLANK(['BenchBudEE.csv'.F425]);"";['BenchBudEE.csv'.F425]) ->  | G425: of:=IF(ISNUMBER(SEARCH("[0-9]";[.A425]));MID([.A425];1;SEARCH("[0-9]";[.A425])-1);"") -> 
A426: of:=IF(ISBLANK(['BenchBudEE.csv'.A426]);"";['BenchBudEE.csv'.A426]) ->  | B426: of:=IF(ISBLANK(['BenchBudEE.csv'.B426]);"";['BenchBudEE.csv'.B426]) ->  | C426: of:=IF(ISBLANK(['BenchBudEE.csv'.C561]);"";MID(['BenchBudEE.csv'.C561];SEARCH(":";['BenchBudEE.csv'.C561])+1;100)) ->  | D426: of:=IF(ISBLANK(['BenchBudEE.csv'.D426]);"";['BenchBudEE.csv'.D426]) ->  | E426: of:=IF(ISBLANK(['BenchBudEE.csv'.E426]);"";['BenchBudEE.csv'.E426]) ->  | F426: of:=IF(ISBLANK(['BenchBudEE.csv'.F426]);"";['BenchBudEE.csv'.F426]) ->  | G426: of:=IF(ISNUMBER(SEARCH("[0-9]";[.A426]));MID([.A426];1;SEARCH("[0-9]";[.A426])-1);"") -> 
A427: of:=IF(ISBLANK(['BenchBudEE.csv'.A427]);"";['BenchBudEE.csv'.A427]) ->  | B427: of:=IF(ISBLANK(['BenchBudEE.csv'.B427]);"";['BenchBudEE.csv'.B427]) ->  | C427: of:=IF(ISBLANK(['BenchBudEE.csv'.C562]);"";MID(['BenchBudEE.csv'.C562];SEARCH(":";['BenchBudEE.csv'.C562])+1;100)) ->  | D427: of:=IF(ISBLANK(['BenchBudEE.csv'.D427]);"";['BenchBudEE.csv'.D427]) ->  | E427: of:=IF(ISBLANK(['BenchBudEE.csv'.E427]);"";['BenchBudEE.csv'.E427]) ->  | F427: of:=IF(ISBLANK(['BenchBudEE.csv'.F427]);"";['BenchBudEE.csv'.F427]) ->  | G427: of:=IF(ISNUMBER(SEARCH("[0-9]";[.A427]));MID([.A427];1;SEARCH("[0-9]";[.A427])-1);"") -> 
A428: of:=IF(ISBLANK(['BenchBudEE.csv'.A428]);"";['BenchBudEE.csv'.A428]) ->  | B428: of:=IF(ISBLANK(['BenchBudEE.csv'.B428]);"";['BenchBudEE.csv'.B428]) ->  | C428: of:=IF(ISBLANK(['BenchBudEE.csv'.C563]);"";MID(['BenchBudEE.csv'.C563];SEARCH(":";['BenchBudEE.csv'.C563])+1;100)) ->  | D428: of:=IF(ISBLANK(['BenchBudEE.csv'.D428]);"";['BenchBudEE.csv'.D428]) ->  | E428: of:=IF(ISBLANK(['BenchBudEE.csv'.E428]);"";['BenchBudEE.csv'.E428]) ->  | F428: of:=IF(ISBLANK(['BenchBudEE.csv'.F428]);"";['BenchBudEE.csv'.F428]) ->  | G428: of:=IF(ISNUMBER(SEARCH("[0-9]";[.A428]));MID([.A428];1;SEARCH("[0-9]";[.A428])-1);"") -> 
A429: of:=IF(ISBLANK(['BenchBudEE.csv'.A429]);"";['BenchBudEE.csv'.A429]) ->  | B429: of:=IF(ISBLANK(['BenchBudEE.csv'.B429]);"";['BenchBudEE.csv'.B429]) ->  | C429: of:=IF(ISBLANK(['BenchBudEE.csv'.C564]);"";MID(['BenchBudEE.csv'.C564];SEARCH(":";['BenchBudEE.csv'.C564])+1;100)) ->  | D429: of:=IF(ISBLANK(['BenchBudEE.csv'.D429]);"";['BenchBudEE.csv'.D429]) ->  | E429: of:=IF(ISBLANK(['BenchBudEE.csv'.E429]);"";['BenchBudEE.csv'.E429]) ->  | F429: of:=IF(ISBLANK(['BenchBudEE.csv'.F429]);"";['BenchBudEE.csv'.F429]) ->  | G429: of:=IF(ISNUMBER(SEARCH("[0-9]";[.A429]));MID([.A429];1;SEARCH("[0-9]";[.A429])-1);"") -> 
A430: of:=IF(ISBLANK(['BenchBudEE.csv'.A430]);"";['BenchBudEE.csv'.A430]) ->  | B430: of:=IF(ISBLANK(['BenchBudEE.csv'.B430]);"";['BenchBudEE.csv'.B430]) ->  | C430: of:=IF(ISBLANK(['BenchBudEE.csv'.C565]);"";MID(['BenchBudEE.csv'.C565];SEARCH(":";['BenchBudEE.csv'.C565])+1;100)) ->  | D430: of:=IF(ISBLANK(['BenchBudEE.csv'.D430]);"";['BenchBudEE.csv'.D430]) ->  | E430: of:=IF(ISBLANK(['BenchBudEE.csv'.E430]);"";['BenchBudEE.csv'.E430]) ->  | F430: of:=IF(ISBLANK(['BenchBudEE.csv'.F430]);"";['BenchBudEE.csv'.F430]) ->  | G430: of:=IF(ISNUMBER(SEARCH("[0-9]";[.A430]));MID([.A430];1;SEARCH("[0-9]";[.A430])-1);"") -> 
A431: of:=IF(ISBLANK(['BenchBudEE.csv'.A431]);"";['BenchBudEE.csv'.A431]) ->  | B431: of:=IF(ISBLANK(['BenchBudEE.csv'.B431]);"";['BenchBudEE.csv'.B431]) ->  | C431: of:=IF(ISBLANK(['BenchBudEE.csv'.C566]);"";MID(['BenchBudEE.csv'.C566];SEARCH(":";['BenchBudEE.csv'.C566])+1;100)) ->  | D431: of:=IF(ISBLANK(['BenchBudEE.csv'.D431]);"";['BenchBudEE.csv'.D431]) ->  | E431: of:=IF(ISBLANK(['BenchBudEE.csv'.E431]);"";['BenchBudEE.csv'.E431]) ->  | F431: of:=IF(ISBLANK(['BenchBudEE.csv'.F431]);"";['BenchBudEE.csv'.F431]) ->  | G431: of:=IF(ISNUMBER(SEARCH("[0-9]";[.A431]));MID([.A431];1;SEARCH("[0-9]";[.A431])-1);"") -> 
A432: of:=IF(ISBLANK(['BenchBudEE.csv'.A432]);"";['BenchBudEE.csv'.A432]) ->  | B432: of:=IF(ISBLANK(['BenchBudEE.csv'.B432]);"";['BenchBudEE.csv'.B432]) ->  | C432: of:=IF(ISBLANK(['BenchBudEE.csv'.C567]);"";MID(['BenchBudEE.csv'.C567];SEARCH(":";['BenchBudEE.csv'.C567])+1;100)) ->  | D432: of:=IF(ISBLANK(['BenchBudEE.csv'.D432]);"";['BenchBudEE.csv'.D432]) ->  | E432: of:=IF(ISBLANK(['BenchBudEE.csv'.E432]);"";['BenchBudEE.csv'.E432]) ->  | F432: of:=IF(ISBLANK(['BenchBudEE.csv'.F432]);"";['BenchBudEE.csv'.F432]) ->  | G432: of:=IF(ISNUMBER(SEARCH("[0-9]";[.A432]));MID([.A432];1;SEARCH("[0-9]";[.A432])-1);"") -> 
A433: of:=IF(ISBLANK(['BenchBudEE.csv'.A433]);"";['BenchBudEE.csv'.A433]) ->  | B433: of:=IF(ISBLANK(['BenchBudEE.csv'.B433]);"";['BenchBudEE.csv'.B433]) ->  | C433: of:=IF(ISBLANK(['BenchBudEE.csv'.C568]);"";MID(['BenchBudEE.csv'.C568];SEARCH(":";['BenchBudEE.csv'.C568])+1;100)) ->  | D433: of:=IF(ISBLANK(['BenchBudEE.csv'.D433]);"";['BenchBudEE.csv'.D433]) ->  | E433: of:=IF(ISBLANK(['BenchBudEE.csv'.E433]);"";['BenchBudEE.csv'.E433]) ->  | F433: of:=IF(ISBLANK(['BenchBudEE.csv'.F433]);"";['BenchBudEE.csv'.F433]) ->  | G433: of:=IF(ISNUMBER(SEARCH("[0-9]";[.A433]));MID([.A433];1;SEARCH("[0-9]";[.A433])-1);"") -> 
A434: of:=IF(ISBLANK(['BenchBudEE.csv'.A434]);"";['BenchBudEE.csv'.A434]) ->  | B434: of:=IF(ISBLANK(['BenchBudEE.csv'.B434]);"";['BenchBudEE.csv'.B434]) ->  | C434: of:=IF(ISBLANK(['BenchBudEE.csv'.C569]);"";MID(['BenchBudEE.csv'.C569];SEARCH(":";['BenchBudEE.csv'.C569])+1;100)) ->  | D434: of:=IF(ISBLANK(['BenchBudEE.csv'.D434]);"";['BenchBudEE.csv'.D434]) ->  | E434: of:=IF(ISBLANK(['BenchBudEE.csv'.E434]);"";['BenchBudEE.csv'.E434]) ->  | F434: of:=IF(ISBLANK(['BenchBudEE.csv'.F434]);"";['BenchBudEE.csv'.F434]) ->  | G434: of:=IF(ISNUMBER(SEARCH("[0-9]";[.A434]));MID([.A434];1;SEARCH("[0-9]";[.A434])-1);"") -> 
A435: of:=IF(ISBLANK(['BenchBudEE.csv'.A435]);"";['BenchBudEE.csv'.A435]) ->  | B435: of:=IF(ISBLANK(['BenchBudEE.csv'.B435]);"";['BenchBudEE.csv'.B435]) ->  | C435: of:=IF(ISBLANK(['BenchBudEE.csv'.C570]);"";MID(['BenchBudEE.csv'.C570];SEARCH(":";['BenchBudEE.csv'.C570])+1;100)) ->  | D435: of:=IF(ISBLANK(['BenchBudEE.csv'.D435]);"";['BenchBudEE.csv'.D435]) ->  | E435: of:=IF(ISBLANK(['BenchBudEE.csv'.E435]);"";['BenchBudEE.csv'.E435]) ->  | F435: of:=IF(ISBLANK(['BenchBudEE.csv'.F435]);"";['BenchBudEE.csv'.F435]) ->  | G435: of:=IF(ISNUMBER(SEARCH("[0-9]";[.A435]));MID([.A435];1;SEARCH("[0-9]";[.A435])-1);"") -> 
A436: of:=IF(ISBLANK(['BenchBudEE.csv'.A436]);"";['BenchBudEE.csv'.A436]) ->  | B436: of:=IF(ISBLANK(['BenchBudEE.csv'.B436]);"";['BenchBudEE.csv'.B436]) ->  | C436: of:=IF(ISBLANK(['BenchBudEE.csv'.C571]);"";MID(['BenchBudEE.csv'.C571];SEARCH(":";['BenchBudEE.csv'.C571])+1;100)) ->  | D436: of:=IF(ISBLANK(['BenchBudEE.csv'.D436]);"";['BenchBudEE.csv'.D436]) ->  | E436: of:=IF(ISBLANK(['BenchBudEE.csv'.E436]);"";['BenchBudEE.csv'.E436]) ->  | F436: of:=IF(ISBLANK(['BenchBudEE.csv'.F436]);"";['BenchBudEE.csv'.F436]) ->  | G436: of:=IF(ISNUMBER(SEARCH("[0-9]";[.A436]));MID([.A436];1;SEARCH("[0-9]";[.A436])-1);"") -> 
A437: of:=IF(ISBLANK(['BenchBudEE.csv'.A437]);"";['BenchBudEE.csv'.A437]) ->  | B437: of:=IF(ISBLANK(['BenchBudEE.csv'.B437]);"";['BenchBudEE.csv'.B437]) ->  | C437: of:=IF(ISBLANK(['BenchBudEE.csv'.C572]);"";MID(['BenchBudEE.csv'.C572];SEARCH(":";['BenchBudEE.csv'.C572])+1;100)) ->  | D437: of:=IF(ISBLANK(['BenchBudEE.csv'.D437]);"";['BenchBudEE.csv'.D437]) ->  | E437: of:=IF(ISBLANK(['BenchBudEE.csv'.E437]);"";['BenchBudEE.csv'.E437]) ->  | F437: of:=IF(ISBLANK(['BenchBudEE.csv'.F437]);"";['BenchBudEE.csv'.F437]) ->  | G437: of:=IF(ISNUMBER(SEARCH("[0-9]";[.A437]));MID([.A437];1;SEARCH("[0-9]";[.A437])-1);"") -> 
A438: of:=IF(ISBLANK(['BenchBudEE.csv'.A438]);"";['BenchBudEE.csv'.A438]) ->  | B438: of:=IF(ISBLANK(['BenchBudEE.csv'.B438]);"";['BenchBudEE.csv'.B438]) ->  | C438: of:=IF(ISBLANK(['BenchBudEE.csv'.C573]);"";MID(['BenchBudEE.csv'.C573];SEARCH(":";['BenchBudEE.csv'.C573])+1;100)) ->  | D438: of:=IF(ISBLANK(['BenchBudEE.csv'.D438]);"";['BenchBudEE.csv'.D438]) ->  | E438: of:=IF(ISBLANK(['BenchBudEE.csv'.E438]);"";['BenchBudEE.csv'.E438]) ->  | F438: of:=IF(ISBLANK(['BenchBudEE.csv'.F438]);"";['BenchBudEE.csv'.F438]) ->  | G438: of:=IF(ISNUMBER(SEARCH("[0-9]";[.A438]));MID([.A438];1;SEARCH("[0-9]";[.A438])-1);"") -> 
A439: of:=IF(ISBLANK(['BenchBudEE.csv'.A439]);"";['BenchBudEE.csv'.A439]) ->  | B439: of:=IF(ISBLANK(['BenchBudEE.csv'.B439]);"";['BenchBudEE.csv'.B439]) ->  | C439: of:=IF(ISBLANK(['BenchBudEE.csv'.C574]);"";MID(['BenchBudEE.csv'.C574];SEARCH(":";['BenchBudEE.csv'.C574])+1;100)) ->  | D439: of:=IF(ISBLANK(['BenchBudEE.csv'.D439]);"";['BenchBudEE.csv'.D439]) ->  | E439: of:=IF(ISBLANK(['BenchBudEE.csv'.E439]);"";['BenchBudEE.csv'.E439]) ->  | F439: of:=IF(ISBLANK(['BenchBudEE.csv'.F439]);"";['BenchBudEE.csv'.F439]) ->  | G439: of:=IF(ISNUMBER(SEARCH("[0-9]";[.A439]));MID([.A439];1;SEARCH("[0-9]";[.A439])-1);"") -> 
A440: of:=IF(ISBLANK(['BenchBudEE.csv'.A440]);"";['BenchBudEE.csv'.A440]) ->  | B440: of:=IF(ISBLANK(['BenchBudEE.csv'.B440]);"";['BenchBudEE.csv'.B440]) ->  | C440: of:=IF(ISBLANK(['BenchBudEE.csv'.C575]);"";MID(['BenchBudEE.csv'.C575];SEARCH(":";['BenchBudEE.csv'.C575])+1;100)) ->  | D440: of:=IF(ISBLANK(['BenchBudEE.csv'.D440]);"";['BenchBudEE.csv'.D440]) ->  | E440: of:=IF(ISBLANK(['BenchBudEE.csv'.E440]);"";['BenchBudEE.csv'.E440]) ->  | F440: of:=IF(ISBLANK(['BenchBudEE.csv'.F440]);"";['BenchBudEE.csv'.F440]) ->  | G440: of:=IF(ISNUMBER(SEARCH("[0-9]";[.A440]));MID([.A440];1;SEARCH("[0-9]";[.A440])-1);"") -> 
A441: of:=IF(ISBLANK(['BenchBudEE.csv'.A441]);"";['BenchBudEE.csv'.A441]) ->  | B441: of:=IF(ISBLANK(['BenchBudEE.csv'.B441]);"";['BenchBudEE.csv'.B441]) ->  | C441: of:=IF(ISBLANK(['BenchBudEE.csv'.C576]);"";MID(['BenchBudEE.csv'.C576];SEARCH(":";['BenchBudEE.csv'.C576])+1;100)) ->  | D441: of:=IF(ISBLANK(['BenchBudEE.csv'.D441]);"";['BenchBudEE.csv'.D441]) ->  | E441: of:=IF(ISBLANK(['BenchBudEE.csv'.E441]);"";['BenchBudEE.csv'.E441]) ->  | F441: of:=IF(ISBLANK(['BenchBudEE.csv'.F441]);"";['BenchBudEE.csv'.F441]) ->  | G441: of:=IF(ISNUMBER(SEARCH("[0-9]";[.A441]));MID([.A441];1;SEARCH("[0-9]";[.A441])-1);"") -> 
A442: of:=IF(ISBLANK(['BenchBudEE.csv'.A442]);"";['BenchBudEE.csv'.A442]) ->  | B442: of:=IF(ISBLANK(['BenchBudEE.csv'.B442]);"";['BenchBudEE.csv'.B442]) ->  | C442: of:=IF(ISBLANK(['BenchBudEE.csv'.C577]);"";MID(['BenchBudEE.csv'.C577];SEARCH(":";['BenchBudEE.csv'.C577])+1;100)) ->  | D442: of:=IF(ISBLANK(['BenchBudEE.csv'.D442]);"";['BenchBudEE.csv'.D442]) ->  | E442: of:=IF(ISBLANK(['BenchBudEE.csv'.E442]);"";['BenchBudEE.csv'.E442]) ->  | F442: of:=IF(ISBLANK(['BenchBudEE.csv'.F442]);"";['BenchBudEE.csv'.F442]) ->  | G442: of:=IF(ISNUMBER(SEARCH("[0-9]";[.A442]));MID([.A442];1;SEARCH("[0-9]";[.A442])-1);"") -> 
A443: of:=IF(ISBLANK(['BenchBudEE.csv'.A443]);"";['BenchBudEE.csv'.A443]) ->  | B443: of:=IF(ISBLANK(['BenchBudEE.csv'.B443]);"";['BenchBudEE.csv'.B443]) ->  | C443: of:=IF(ISBLANK(['BenchBudEE.csv'.C578]);"";MID(['BenchBudEE.csv'.C578];SEARCH(":";['BenchBudEE.csv'.C578])+1;100)) ->  | D443: of:=IF(ISBLANK(['BenchBudEE.csv'.D443]);"";['BenchBudEE.csv'.D443]) ->  | E443: of:=IF(ISBLANK(['BenchBudEE.csv'.E443]);"";['BenchBudEE.csv'.E443]) ->  | F443: of:=IF(ISBLANK(['BenchBudEE.csv'.F443]);"";['BenchBudEE.csv'.F443]) ->  | G443: of:=IF(ISNUMBER(SEARCH("[0-9]";[.A443]));MID([.A443];1;SEARCH("[0-9]";[.A443])-1);"") -> 
A444: of:=IF(ISBLANK(['BenchBudEE.csv'.A444]);"";['BenchBudEE.csv'.A444]) ->  | B444: of:=IF(ISBLANK(['BenchBudEE.csv'.B444]);"";['BenchBudEE.csv'.B444]) ->  | C444: of:=IF(ISBLANK(['BenchBudEE.csv'.C579]);"";MID(['BenchBudEE.csv'.C579];SEARCH(":";['BenchBudEE.csv'.C579])+1;100)) ->  | D444: of:=IF(ISBLANK(['BenchBudEE.csv'.D444]);"";['BenchBudEE.csv'.D444]) ->  | E444: of:=IF(ISBLANK(['BenchBudEE.csv'.E444]);"";['BenchBudEE.csv'.E444]) ->  | F444: of:=IF(ISBLANK(['BenchBudEE.csv'.F444]);"";['BenchBudEE.csv'.F444]) ->  | G444: of:=IF(ISNUMBER(SEARCH("[0-9]";[.A444]));MID([.A444];1;SEARCH("[0-9]";[.A444])-1);"") -> 
A445: of:=IF(ISBLANK(['BenchBudEE.csv'.A445]);"";['BenchBudEE.csv'.A445]) ->  | B445: of:=IF(ISBLANK(['BenchBudEE.csv'.B445]);"";['BenchBudEE.csv'.B445]) ->  | C445: of:=IF(ISBLANK(['BenchBudEE.csv'.C580]);"";MID(['BenchBudEE.csv'.C580];SEARCH(":";['BenchBudEE.csv'.C580])+1;100)) ->  | D445: of:=IF(ISBLANK(['BenchBudEE.csv'.D445]);"";['BenchBudEE.csv'.D445]) ->  | E445: of:=IF(ISBLANK(['BenchBudEE.csv'.E445]);"";['BenchBudEE.csv'.E445]) ->  | F445: of:=IF(ISBLANK(['BenchBudEE.csv'.F445]);"";['BenchBudEE.csv'.F445]) ->  | G445: of:=IF(ISNUMBER(SEARCH("[0-9]";[.A445]));MID([.A445];1;SEARCH("[0-9]";[.A445])-1);"") -> 
A446: of:=IF(ISBLANK(['BenchBudEE.csv'.A446]);"";['BenchBudEE.csv'.A446]) ->  | B446: of:=IF(ISBLANK(['BenchBudEE.csv'.B446]);"";['BenchBudEE.csv'.B446]) ->  | C446: of:=IF(ISBLANK(['BenchBudEE.csv'.C581]);"";MID(['BenchBudEE.csv'.C581];SEARCH(":";['BenchBudEE.csv'.C581])+1;100)) ->  | D446: of:=IF(ISBLANK(['BenchBudEE.csv'.D446]);"";['BenchBudEE.csv'.D446]) ->  | E446: of:=IF(ISBLANK(['BenchBudEE.csv'.E446]);"";['BenchBudEE.csv'.E446]) ->  | F446: of:=IF(ISBLANK(['BenchBudEE.csv'.F446]);"";['BenchBudEE.csv'.F446]) ->  | G446: of:=IF(ISNUMBER(SEARCH("[0-9]";[.A446]));MID([.A446];1;SEARCH("[0-9]";[.A446])-1);"") -> 
A447: of:=IF(ISBLANK(['BenchBudEE.csv'.A447]);"";['BenchBudEE.csv'.A447]) ->  | B447: of:=IF(ISBLANK(['BenchBudEE.csv'.B447]);"";['BenchBudEE.csv'.B447]) ->  | C447: of:=IF(ISBLANK(['BenchBudEE.csv'.C582]);"";MID(['BenchBudEE.csv'.C582];SEARCH(":";['BenchBudEE.csv'.C582])+1;100)) ->  | D447: of:=IF(ISBLANK(['BenchBudEE.csv'.D447]);"";['BenchBudEE.csv'.D447]) ->  | E447: of:=IF(ISBLANK(['BenchBudEE.csv'.E447]);"";['BenchBudEE.csv'.E447]) ->  | F447: of:=IF(ISBLANK(['BenchBudEE.csv'.F447]);"";['BenchBudEE.csv'.F447]) ->  | G447: of:=IF(ISNUMBER(SEARCH("[0-9]";[.A447]));MID([.A447];1;SEARCH("[0-9]";[.A447])-1);"") -> 
A448: of:=IF(ISBLANK(['BenchBudEE.csv'.A448]);"";['BenchBudEE.csv'.A448]) ->  | B448: of:=IF(ISBLANK(['BenchBudEE.csv'.B448]);"";['BenchBudEE.csv'.B448]) ->  | C448: of:=IF(ISBLANK(['BenchBudEE.csv'.C583]);"";MID(['BenchBudEE.csv'.C583];SEARCH(":";['BenchBudEE.csv'.C583])+1;100)) ->  | D448: of:=IF(ISBLANK(['BenchBudEE.csv'.D448]);"";['BenchBudEE.csv'.D448]) ->  | E448: of:=IF(ISBLANK(['BenchBudEE.csv'.E448]);"";['BenchBudEE.csv'.E448]) ->  | F448: of:=IF(ISBLANK(['BenchBudEE.csv'.F448]);"";['BenchBudEE.csv'.F448]) ->  | G448: of:=IF(ISNUMBER(SEARCH("[0-9]";[.A448]));MID([.A448];1;SEARCH("[0-9]";[.A448])-1);"") -> 
A449: of:=IF(ISBLANK(['BenchBudEE.csv'.A449]);"";['BenchBudEE.csv'.A449]) ->  | B449: of:=IF(ISBLANK(['BenchBudEE.csv'.B449]);"";['BenchBudEE.csv'.B449]) ->  | C449: of:=IF(ISBLANK(['BenchBudEE.csv'.C584]);"";MID(['BenchBudEE.csv'.C584];SEARCH(":";['BenchBudEE.csv'.C584])+1;100)) ->  | D449: of:=IF(ISBLANK(['BenchBudEE.csv'.D449]);"";['BenchBudEE.csv'.D449]) ->  | E449: of:=IF(ISBLANK(['BenchBudEE.csv'.E449]);"";['BenchBudEE.csv'.E449]) ->  | F449: of:=IF(ISBLANK(['BenchBudEE.csv'.F449]);"";['BenchBudEE.csv'.F449]) ->  | G449: of:=IF(ISNUMBER(SEARCH("[0-9]";[.A449]));MID([.A449];1;SEARCH("[0-9]";[.A449])-1);"") -> 
A450: of:=IF(ISBLANK(['BenchBudEE.csv'.A450]);"";['BenchBudEE.csv'.A450]) ->  | B450: of:=IF(ISBLANK(['BenchBudEE.csv'.B450]);"";['BenchBudEE.csv'.B450]) ->  | C450: of:=IF(ISBLANK(['BenchBudEE.csv'.C585]);"";MID(['BenchBudEE.csv'.C585];SEARCH(":";['BenchBudEE.csv'.C585])+1;100)) ->  | D450: of:=IF(ISBLANK(['BenchBudEE.csv'.D450]);"";['BenchBudEE.csv'.D450]) ->  | E450: of:=IF(ISBLANK(['BenchBudEE.csv'.E450]);"";['BenchBudEE.csv'.E450]) ->  | F450: of:=IF(ISBLANK(['BenchBudEE.csv'.F450]);"";['BenchBudEE.csv'.F450]) ->  | G450: of:=IF(ISNUMBER(SEARCH("[0-9]";[.A450]));MID([.A450];1;SEARCH("[0-9]";[.A450])-1);"") -> 
A451: of:=IF(ISBLANK(['BenchBudEE.csv'.A451]);"";['BenchBudEE.csv'.A451]) ->  | B451: of:=IF(ISBLANK(['BenchBudEE.csv'.B451]);"";['BenchBudEE.csv'.B451]) ->  | C451: of:=IF(ISBLANK(['BenchBudEE.csv'.C586]);"";MID(['BenchBudEE.csv'.C586];SEARCH(":";['BenchBudEE.csv'.C586])+1;100)) ->  | D451: of:=IF(ISBLANK(['BenchBudEE.csv'.D451]);"";['BenchBudEE.csv'.D451]) ->  | E451: of:=IF(ISBLANK(['BenchBudEE.csv'.E451]);"";['BenchBudEE.csv'.E451]) ->  | F451: of:=IF(ISBLANK(['BenchBudEE.csv'.F451]);"";['BenchBudEE.csv'.F451]) ->  | G451: of:=IF(ISNUMBER(SEARCH("[0-9]";[.A451]));MID([.A451];1;SEARCH("[0-9]";[.A451])-1);"") -> 
A452: of:=IF(ISBLANK(['BenchBudEE.csv'.A452]);"";['BenchBudEE.csv'.A452]) ->  | B452: of:=IF(ISBLANK(['BenchBudEE.csv'.B452]);"";['BenchBudEE.csv'.B452]) ->  | C452: of:=IF(ISBLANK(['BenchBudEE.csv'.C587]);"";MID(['BenchBudEE.csv'.C587];SEARCH(":";['BenchBudEE.csv'.C587])+1;100)) ->  | D452: of:=IF(ISBLANK(['BenchBudEE.csv'.D452]);"";['BenchBudEE.csv'.D452]) ->  | E452: of:=IF(ISBLANK(['BenchBudEE.csv'.E452]);"";['BenchBudEE.csv'.E452]) ->  | F452: of:=IF(ISBLANK(['BenchBudEE.csv'.F452]);"";['BenchBudEE.csv'.F452]) ->  | G452: of:=IF(ISNUMBER(SEARCH("[0-9]";[.A452]));MID([.A452];1;SEARCH("[0-9]";[.A452])-1);"") -> 
A453: of:=IF(ISBLANK(['BenchBudEE.csv'.A453]);"";['BenchBudEE.csv'.A453]) ->  | B453: of:=IF(ISBLANK(['BenchBudEE.csv'.B453]);"";['BenchBudEE.csv'.B453]) ->  | C453: of:=IF(ISBLANK(['BenchBudEE.csv'.C588]);"";MID(['BenchBudEE.csv'.C588];SEARCH(":";['BenchBudEE.csv'.C588])+1;100)) ->  | D453: of:=IF(ISBLANK(['BenchBudEE.csv'.D453]);"";['BenchBudEE.csv'.D453]) ->  | E453: of:=IF(ISBLANK(['BenchBudEE.csv'.E453]);"";['BenchBudEE.csv'.E453]) ->  | F453: of:=IF(ISBLANK(['BenchBudEE.csv'.F453]);"";['BenchBudEE.csv'.F453]) ->  | G453: of:=IF(ISNUMBER(SEARCH("[0-9]";[.A453]));MID([.A453];1;SEARCH("[0-9]";[.A453])-1);"") -> 
A454: of:=IF(ISBLANK(['BenchBudEE.csv'.A454]);"";['BenchBudEE.csv'.A454]) ->  | B454: of:=IF(ISBLANK(['BenchBudEE.csv'.B454]);"";['BenchBudEE.csv'.B454]) ->  | C454: of:=IF(ISBLANK(['BenchBudEE.csv'.C589]);"";MID(['BenchBudEE.csv'.C589];SEARCH(":";['BenchBudEE.csv'.C589])+1;100)) ->  | D454: of:=IF(ISBLANK(['BenchBudEE.csv'.D454]);"";['BenchBudEE.csv'.D454]) ->  | E454: of:=IF(ISBLANK(['BenchBudEE.csv'.E454]);"";['BenchBudEE.csv'.E454]) ->  | F454: of:=IF(ISBLANK(['BenchBudEE.csv'.F454]);"";['BenchBudEE.csv'.F454]) ->  | G454: of:=IF(ISNUMBER(SEARCH("[0-9]";[.A454]));MID([.A454];1;SEARCH("[0-9]";[.A454])-1);"") -> 
A455: of:=IF(ISBLANK(['BenchBudEE.csv'.A455]);"";['BenchBudEE.csv'.A455]) ->  | B455: of:=IF(ISBLANK(['BenchBudEE.csv'.B455]);"";['BenchBudEE.csv'.B455]) ->  | C455: of:=IF(ISBLANK(['BenchBudEE.csv'.C590]);"";MID(['BenchBudEE.csv'.C590];SEARCH(":";['BenchBudEE.csv'.C590])+1;100)) ->  | D455: of:=IF(ISBLANK(['BenchBudEE.csv'.D455]);"";['BenchBudEE.csv'.D455]) ->  | E455: of:=IF(ISBLANK(['BenchBudEE.csv'.E455]);"";['BenchBudEE.csv'.E455]) ->  | F455: of:=IF(ISBLANK(['BenchBudEE.csv'.F455]);"";['BenchBudEE.csv'.F455]) ->  | G455: of:=IF(ISNUMBER(SEARCH("[0-9]";[.A455]));MID([.A455];1;SEARCH("[0-9]";[.A455])-1);"") -> 
A456: of:=IF(ISBLANK(['BenchBudEE.csv'.A456]);"";['BenchBudEE.csv'.A456]) ->  | B456: of:=IF(ISBLANK(['BenchBudEE.csv'.B456]);"";['BenchBudEE.csv'.B456]) ->  | C456: of:=IF(ISBLANK(['BenchBudEE.csv'.C591]);"";MID(['BenchBudEE.csv'.C591];SEARCH(":";['BenchBudEE.csv'.C591])+1;100)) ->  | D456: of:=IF(ISBLANK(['BenchBudEE.csv'.D456]);"";['BenchBudEE.csv'.D456]) ->  | E456: of:=IF(ISBLANK(['BenchBudEE.csv'.E456]);"";['BenchBudEE.csv'.E456]) ->  | F456: of:=IF(ISBLANK(['BenchBudEE.csv'.F456]);"";['BenchBudEE.csv'.F456]) ->  | G456: of:=IF(ISNUMBER(SEARCH("[0-9]";[.A456]));MID([.A456];1;SEARCH("[0-9]";[.A456])-1);"") -> 
A457: of:=IF(ISBLANK(['BenchBudEE.csv'.A457]);"";['BenchBudEE.csv'.A457]) ->  | B457: of:=IF(ISBLANK(['BenchBudEE.csv'.B457]);"";['BenchBudEE.csv'.B457]) ->  | C457: of:=IF(ISBLANK(['BenchBudEE.csv'.C592]);"";MID(['BenchBudEE.csv'.C592];SEARCH(":";['BenchBudEE.csv'.C592])+1;100)) ->  | D457: of:=IF(ISBLANK(['BenchBudEE.csv'.D457]);"";['BenchBudEE.csv'.D457]) ->  | E457: of:=IF(ISBLANK(['BenchBudEE.csv'.E457]);"";['BenchBudEE.csv'.E457]) ->  | F457: of:=IF(ISBLANK(['BenchBudEE.csv'.F457]);"";['BenchBudEE.csv'.F457]) ->  | G457: of:=IF(ISNUMBER(SEARCH("[0-9]";[.A457]));MID([.A457];1;SEARCH("[0-9]";[.A457])-1);"") -> 
A458: of:=IF(ISBLANK(['BenchBudEE.csv'.A458]);"";['BenchBudEE.csv'.A458]) ->  | B458: of:=IF(ISBLANK(['BenchBudEE.csv'.B458]);"";['BenchBudEE.csv'.B458]) ->  | C458: of:=IF(ISBLANK(['BenchBudEE.csv'.C593]);"";MID(['BenchBudEE.csv'.C593];SEARCH(":";['BenchBudEE.csv'.C593])+1;100)) ->  | D458: of:=IF(ISBLANK(['BenchBudEE.csv'.D458]);"";['BenchBudEE.csv'.D458]) ->  | E458: of:=IF(ISBLANK(['BenchBudEE.csv'.E458]);"";['BenchBudEE.csv'.E458]) ->  | F458: of:=IF(ISBLANK(['BenchBudEE.csv'.F458]);"";['BenchBudEE.csv'.F458]) ->  | G458: of:=IF(ISNUMBER(SEARCH("[0-9]";[.A458]));MID([.A458];1;SEARCH("[0-9]";[.A458])-1);"") -> 
A459: of:=IF(ISBLANK(['BenchBudEE.csv'.A459]);"";['BenchBudEE.csv'.A459]) ->  | B459: of:=IF(ISBLANK(['BenchBudEE.csv'.B459]);"";['BenchBudEE.csv'.B459]) ->  | C459: of:=IF(ISBLANK(['BenchBudEE.csv'.C594]);"";MID(['BenchBudEE.csv'.C594];SEARCH(":";['BenchBudEE.csv'.C594])+1;100)) ->  | D459: of:=IF(ISBLANK(['BenchBudEE.csv'.D459]);"";['BenchBudEE.csv'.D459]) ->  | E459: of:=IF(ISBLANK(['BenchBudEE.csv'.E459]);"";['BenchBudEE.csv'.E459]) ->  | F459: of:=IF(ISBLANK(['BenchBudEE.csv'.F459]);"";['BenchBudEE.csv'.F459]) ->  | G459: of:=IF(ISNUMBER(SEARCH("[0-9]";[.A459]));MID([.A459];1;SEARCH("[0-9]";[.A459])-1);"") -> 
A460: of:=IF(ISBLANK(['BenchBudEE.csv'.A460]);"";['BenchBudEE.csv'.A460]) ->  | B460: of:=IF(ISBLANK(['BenchBudEE.csv'.B460]);"";['BenchBudEE.csv'.B460]) ->  | C460: of:=IF(ISBLANK(['BenchBudEE.csv'.C595]);"";MID(['BenchBudEE.csv'.C595];SEARCH(":";['BenchBudEE.csv'.C595])+1;100)) ->  | D460: of:=IF(ISBLANK(['BenchBudEE.csv'.D460]);"";['BenchBudEE.csv'.D460]) ->  | E460: of:=IF(ISBLANK(['BenchBudEE.csv'.E460]);"";['BenchBudEE.csv'.E460]) ->  | F460: of:=IF(ISBLANK(['BenchBudEE.csv'.F460]);"";['BenchBudEE.csv'.F460]) ->  | G460: of:=IF(ISNUMBER(SEARCH("[0-9]";[.A460]));MID([.A460];1;SEARCH("[0-9]";[.A460])-1);"") -> 
A461: of:=IF(ISBLANK(['BenchBudEE.csv'.A461]);"";['BenchBudEE.csv'.A461]) ->  | B461: of:=IF(ISBLANK(['BenchBudEE.csv'.B461]);"";['BenchBudEE.csv'.B461]) ->  | C461: of:=IF(ISBLANK(['BenchBudEE.csv'.C596]);"";MID(['BenchBudEE.csv'.C596];SEARCH(":";['BenchBudEE.csv'.C596])+1;100)) ->  | D461: of:=IF(ISBLANK(['BenchBudEE.csv'.D461]);"";['BenchBudEE.csv'.D461]) ->  | E461: of:=IF(ISBLANK(['BenchBudEE.csv'.E461]);"";['BenchBudEE.csv'.E461]) ->  | F461: of:=IF(ISBLANK(['BenchBudEE.csv'.F461]);"";['BenchBudEE.csv'.F461]) ->  | G461: of:=IF(ISNUMBER(SEARCH("[0-9]";[.A461]));MID([.A461];1;SEARCH("[0-9]";[.A461])-1);"") -> 
A462: of:=IF(ISBLANK(['BenchBudEE.csv'.A462]);"";['BenchBudEE.csv'.A462]) ->  | B462: of:=IF(ISBLANK(['BenchBudEE.csv'.B462]);"";['BenchBudEE.csv'.B462]) ->  | C462: of:=IF(ISBLANK(['BenchBudEE.csv'.C597]);"";MID(['BenchBudEE.csv'.C597];SEARCH(":";['BenchBudEE.csv'.C597])+1;100)) ->  | D462: of:=IF(ISBLANK(['BenchBudEE.csv'.D462]);"";['BenchBudEE.csv'.D462]) ->  | E462: of:=IF(ISBLANK(['BenchBudEE.csv'.E462]);"";['BenchBudEE.csv'.E462]) ->  | F462: of:=IF(ISBLANK(['BenchBudEE.csv'.F462]);"";['BenchBudEE.csv'.F462]) ->  | G462: of:=IF(ISNUMBER(SEARCH("[0-9]";[.A462]));MID([.A462];1;SEARCH("[0-9]";[.A462])-1);"") -> 
A463: of:=IF(ISBLANK(['BenchBudEE.csv'.A463]);"";['BenchBudEE.csv'.A463]) ->  | B463: of:=IF(ISBLANK(['BenchBudEE.csv'.B463]);"";['BenchBudEE.csv'.B463]) ->  | C463: of:=IF(ISBLANK(['BenchBudEE.csv'.C598]);"";MID(['BenchBudEE.csv'.C598];SEARCH(":";['BenchBudEE.csv'.C598])+1;100)) ->  | D463: of:=IF(ISBLANK(['BenchBudEE.csv'.D463]);"";['BenchBudEE.csv'.D463]) ->  | E463: of:=IF(ISBLANK(['BenchBudEE.csv'.E463]);"";['BenchBudEE.csv'.E463]) ->  | F463: of:=IF(ISBLANK(['BenchBudEE.csv'.F463]);"";['BenchBudEE.csv'.F463]) ->  | G463: of:=IF(ISNUMBER(SEARCH("[0-9]";[.A463]));MID([.A463];1;SEARCH("[0-9]";[.A463])-1);"") -> 
A464: of:=IF(ISBLANK(['BenchBudEE.csv'.A464]);"";['BenchBudEE.csv'.A464]) ->  | B464: of:=IF(ISBLANK(['BenchBudEE.csv'.B464]);"";['BenchBudEE.csv'.B464]) ->  | C464: of:=IF(ISBLANK(['BenchBudEE.csv'.C599]);"";MID(['BenchBudEE.csv'.C599];SEARCH(":";['BenchBudEE.csv'.C599])+1;100)) ->  | D464: of:=IF(ISBLANK(['BenchBudEE.csv'.D464]);"";['BenchBudEE.csv'.D464]) ->  | E464: of:=IF(ISBLANK(['BenchBudEE.csv'.E464]);"";['BenchBudEE.csv'.E464]) ->  | F464: of:=IF(ISBLANK(['BenchBudEE.csv'.F464]);"";['BenchBudEE.csv'.F464]) ->  | G464: of:=IF(ISNUMBER(SEARCH("[0-9]";[.A464]));MID([.A464];1;SEARCH("[0-9]";[.A464])-1);"") -> 
A465: of:=IF(ISBLANK(['BenchBudEE.csv'.A465]);"";['BenchBudEE.csv'.A465]) ->  | B465: of:=IF(ISBLANK(['BenchBudEE.csv'.B465]);"";['BenchBudEE.csv'.B465]) ->  | C465: of:=IF(ISBLANK(['BenchBudEE.csv'.C600]);"";MID(['BenchBudEE.csv'.C600];SEARCH(":";['BenchBudEE.csv'.C600])+1;100)) ->  | D465: of:=IF(ISBLANK(['BenchBudEE.csv'.D465]);"";['BenchBudEE.csv'.D465]) ->  | E465: of:=IF(ISBLANK(['BenchBudEE.csv'.E465]);"";['BenchBudEE.csv'.E465]) ->  | F465: of:=IF(ISBLANK(['BenchBudEE.csv'.F465]);"";['BenchBudEE.csv'.F465]) ->  | G465: of:=IF(ISNUMBER(SEARCH("[0-9]";[.A465]));MID([.A465];1;SEARCH("[0-9]";[.A465])-1);"") -> 
A466: of:=IF(ISBLANK(['BenchBudEE.csv'.A466]);"";['BenchBudEE.csv'.A466]) ->  | B466: of:=IF(ISBLANK(['BenchBudEE.csv'.B466]);"";['BenchBudEE.csv'.B466]) ->  | C466: of:=IF(ISBLANK(['BenchBudEE.csv'.C601]);"";MID(['BenchBudEE.csv'.C601];SEARCH(":";['BenchBudEE.csv'.C601])+1;100)) ->  | D466: of:=IF(ISBLANK(['BenchBudEE.csv'.D466]);"";['BenchBudEE.csv'.D466]) ->  | E466: of:=IF(ISBLANK(['BenchBudEE.csv'.E466]);"";['BenchBudEE.csv'.E466]) ->  | F466: of:=IF(ISBLANK(['BenchBudEE.csv'.F466]);"";['BenchBudEE.csv'.F466]) ->  | G466: of:=IF(ISNUMBER(SEARCH("[0-9]";[.A466]));MID([.A466];1;SEARCH("[0-9]";[.A466])-1);"") -> 
A467: of:=IF(ISBLANK(['BenchBudEE.csv'.A467]);"";['BenchBudEE.csv'.A467]) ->  | B467: of:=IF(ISBLANK(['BenchBudEE.csv'.B467]);"";['BenchBudEE.csv'.B467]) ->  | C467: of:=IF(ISBLANK(['BenchBudEE.csv'.C602]);"";MID(['BenchBudEE.csv'.C602];SEARCH(":";['BenchBudEE.csv'.C602])+1;100)) ->  | D467: of:=IF(ISBLANK(['BenchBudEE.csv'.D467]);"";['BenchBudEE.csv'.D467]) ->  | E467: of:=IF(ISBLANK(['BenchBudEE.csv'.E467]);"";['BenchBudEE.csv'.E467]) ->  | F467: of:=IF(ISBLANK(['BenchBudEE.csv'.F467]);"";['BenchBudEE.csv'.F467]) ->  | G467: of:=IF(ISNUMBER(SEARCH("[0-9]";[.A467]));MID([.A467];1;SEARCH("[0-9]";[.A467])-1);"") -> 
A468: of:=IF(ISBLANK(['BenchBudEE.csv'.A468]);"";['BenchBudEE.csv'.A468]) ->  | B468: of:=IF(ISBLANK(['BenchBudEE.csv'.B468]);"";['BenchBudEE.csv'.B468]) ->  | C468: of:=IF(ISBLANK(['BenchBudEE.csv'.C603]);"";MID(['BenchBudEE.csv'.C603];SEARCH(":";['BenchBudEE.csv'.C603])+1;100)) ->  | D468: of:=IF(ISBLANK(['BenchBudEE.csv'.D468]);"";['BenchBudEE.csv'.D468]) ->  | E468: of:=IF(ISBLANK(['BenchBudEE.csv'.E468]);"";['BenchBudEE.csv'.E468]) ->  | F468: of:=IF(ISBLANK(['BenchBudEE.csv'.F468]);"";['BenchBudEE.csv'.F468]) ->  | G468: of:=IF(ISNUMBER(SEARCH("[0-9]";[.A468]));MID([.A468];1;SEARCH("[0-9]";[.A468])-1);"") -> 
A469: of:=IF(ISBLANK(['BenchBudEE.csv'.A469]);"";['BenchBudEE.csv'.A469]) ->  | B469: of:=IF(ISBLANK(['BenchBudEE.csv'.B469]);"";['BenchBudEE.csv'.B469]) ->  | C469: of:=IF(ISBLANK(['BenchBudEE.csv'.C604]);"";MID(['BenchBudEE.csv'.C604];SEARCH(":";['BenchBudEE.csv'.C604])+1;100)) ->  | D469: of:=IF(ISBLANK(['BenchBudEE.csv'.D469]);"";['BenchBudEE.csv'.D469]) ->  | E469: of:=IF(ISBLANK(['BenchBudEE.csv'.E469]);"";['BenchBudEE.csv'.E469]) ->  | F469: of:=IF(ISBLANK(['BenchBudEE.csv'.F469]);"";['BenchBudEE.csv'.F469]) ->  | G469: of:=IF(ISNUMBER(SEARCH("[0-9]";[.A469]));MID([.A469];1;SEARCH("[0-9]";[.A469])-1);"") -> 
A470: of:=IF(ISBLANK(['BenchBudEE.csv'.A470]);"";['BenchBudEE.csv'.A470]) ->  | B470: of:=IF(ISBLANK(['BenchBudEE.csv'.B470]);"";['BenchBudEE.csv'.B470]) ->  | C470: of:=IF(ISBLANK(['BenchBudEE.csv'.C605]);"";MID(['BenchBudEE.csv'.C605];SEARCH(":";['BenchBudEE.csv'.C605])+1;100)) ->  | D470: of:=IF(ISBLANK(['BenchBudEE.csv'.D470]);"";['BenchBudEE.csv'.D470]) ->  | E470: of:=IF(ISBLANK(['BenchBudEE.csv'.E470]);"";['BenchBudEE.csv'.E470]) ->  | F470: of:=IF(ISBLANK(['BenchBudEE.csv'.F470]);"";['BenchBudEE.csv'.F470]) ->  | G470: of:=IF(ISNUMBER(SEARCH("[0-9]";[.A470]));MID([.A470];1;SEARCH("[0-9]";[.A470])-1);"") -> 
A471: of:=IF(ISBLANK(['BenchBudEE.csv'.A471]);"";['BenchBudEE.csv'.A471]) ->  | B471: of:=IF(ISBLANK(['BenchBudEE.csv'.B471]);"";['BenchBudEE.csv'.B471]) ->  | C471: of:=IF(ISBLANK(['BenchBudEE.csv'.C606]);"";MID(['BenchBudEE.csv'.C606];SEARCH(":";['BenchBudEE.csv'.C606])+1;100)) ->  | D471: of:=IF(ISBLANK(['BenchBudEE.csv'.D471]);"";['BenchBudEE.csv'.D471]) ->  | E471: of:=IF(ISBLANK(['BenchBudEE.csv'.E471]);"";['BenchBudEE.csv'.E471]) ->  | F471: of:=IF(ISBLANK(['BenchBudEE.csv'.F471]);"";['BenchBudEE.csv'.F471]) ->  | G471: of:=IF(ISNUMBER(SEARCH("[0-9]";[.A471]));MID([.A471];1;SEARCH("[0-9]";[.A471])-1);"") -> 
A472: of:=IF(ISBLANK(['BenchBudEE.csv'.A472]);"";['BenchBudEE.csv'.A472]) ->  | B472: of:=IF(ISBLANK(['BenchBudEE.csv'.B472]);"";['BenchBudEE.csv'.B472]) ->  | C472: of:=IF(ISBLANK(['BenchBudEE.csv'.C607]);"";MID(['BenchBudEE.csv'.C607];SEARCH(":";['BenchBudEE.csv'.C607])+1;100)) ->  | D472: of:=IF(ISBLANK(['BenchBudEE.csv'.D472]);"";['BenchBudEE.csv'.D472]) ->  | E472: of:=IF(ISBLANK(['BenchBudEE.csv'.E472]);"";['BenchBudEE.csv'.E472]) ->  | F472: of:=IF(ISBLANK(['BenchBudEE.csv'.F472]);"";['BenchBudEE.csv'.F472]) ->  | G472: of:=IF(ISNUMBER(SEARCH("[0-9]";[.A472]));MID([.A472];1;SEARCH("[0-9]";[.A472])-1);"") -> 
A473: of:=IF(ISBLANK(['BenchBudEE.csv'.A473]);"";['BenchBudEE.csv'.A473]) ->  | B473: of:=IF(ISBLANK(['BenchBudEE.csv'.B473]);"";['BenchBudEE.csv'.B473]) ->  | C473: of:=IF(ISBLANK(['BenchBudEE.csv'.C608]);"";MID(['BenchBudEE.csv'.C608];SEARCH(":";['BenchBudEE.csv'.C608])+1;100)) ->  | D473: of:=IF(ISBLANK(['BenchBudEE.csv'.D473]);"";['BenchBudEE.csv'.D473]) ->  | E473: of:=IF(ISBLANK(['BenchBudEE.csv'.E473]);"";['BenchBudEE.csv'.E473]) ->  | F473: of:=IF(ISBLANK(['BenchBudEE.csv'.F473]);"";['BenchBudEE.csv'.F473]) ->  | G473: of:=IF(ISNUMBER(SEARCH("[0-9]";[.A473]));MID([.A473];1;SEARCH("[0-9]";[.A473])-1);"") -> 
A474: of:=IF(ISBLANK(['BenchBudEE.csv'.A474]);"";['BenchBudEE.csv'.A474]) ->  | B474: of:=IF(ISBLANK(['BenchBudEE.csv'.B474]);"";['BenchBudEE.csv'.B474]) ->  | C474: of:=IF(ISBLANK(['BenchBudEE.csv'.C609]);"";MID(['BenchBudEE.csv'.C609];SEARCH(":";['BenchBudEE.csv'.C609])+1;100)) ->  | D474: of:=IF(ISBLANK(['BenchBudEE.csv'.D474]);"";['BenchBudEE.csv'.D474]) ->  | E474: of:=IF(ISBLANK(['BenchBudEE.csv'.E474]);"";['BenchBudEE.csv'.E474]) ->  | F474: of:=IF(ISBLANK(['BenchBudEE.csv'.F474]);"";['BenchBudEE.csv'.F474]) ->  | G474: of:=IF(ISNUMBER(SEARCH("[0-9]";[.A474]));MID([.A474];1;SEARCH("[0-9]";[.A474])-1);"") -> 
A475: of:=IF(ISBLANK(['BenchBudEE.csv'.A475]);"";['BenchBudEE.csv'.A475]) ->  | B475: of:=IF(ISBLANK(['BenchBudEE.csv'.B475]);"";['BenchBudEE.csv'.B475]) ->  | C475: of:=IF(ISBLANK(['BenchBudEE.csv'.C610]);"";MID(['BenchBudEE.csv'.C610];SEARCH(":";['BenchBudEE.csv'.C610])+1;100)) ->  | D475: of:=IF(ISBLANK(['BenchBudEE.csv'.D475]);"";['BenchBudEE.csv'.D475]) ->  | E475: of:=IF(ISBLANK(['BenchBudEE.csv'.E475]);"";['BenchBudEE.csv'.E475]) ->  | F475: of:=IF(ISBLANK(['BenchBudEE.csv'.F475]);"";['BenchBudEE.csv'.F475]) ->  | G475: of:=IF(ISNUMBER(SEARCH("[0-9]";[.A475]));MID([.A475];1;SEARCH("[0-9]";[.A475])-1);"") -> 
A476: of:=IF(ISBLANK(['BenchBudEE.csv'.A476]);"";['BenchBudEE.csv'.A476]) ->  | B476: of:=IF(ISBLANK(['BenchBudEE.csv'.B476]);"";['BenchBudEE.csv'.B476]) ->  | C476: of:=IF(ISBLANK(['BenchBudEE.csv'.C611]);"";MID(['BenchBudEE.csv'.C611];SEARCH(":";['BenchBudEE.csv'.C611])+1;100)) ->  | D476: of:=IF(ISBLANK(['BenchBudEE.csv'.D476]);"";['BenchBudEE.csv'.D476]) ->  | E476: of:=IF(ISBLANK(['BenchBudEE.csv'.E476]);"";['BenchBudEE.csv'.E476]) ->  | F476: of:=IF(ISBLANK(['BenchBudEE.csv'.F476]);"";['BenchBudEE.csv'.F476]) ->  | G476: of:=IF(ISNUMBER(SEARCH("[0-9]";[.A476]));MID([.A476];1;SEARCH("[0-9]";[.A476])-1);"") -> 
A477: of:=IF(ISBLANK(['BenchBudEE.csv'.A477]);"";['BenchBudEE.csv'.A477]) ->  | B477: of:=IF(ISBLANK(['BenchBudEE.csv'.B477]);"";['BenchBudEE.csv'.B477]) ->  | C477: of:=IF(ISBLANK(['BenchBudEE.csv'.C612]);"";MID(['BenchBudEE.csv'.C612];SEARCH(":";['BenchBudEE.csv'.C612])+1;100)) ->  | D477: of:=IF(ISBLANK(['BenchBudEE.csv'.D477]);"";['BenchBudEE.csv'.D477]) ->  | E477: of:=IF(ISBLANK(['BenchBudEE.csv'.E477]);"";['BenchBudEE.csv'.E477]) ->  | F477: of:=IF(ISBLANK(['BenchBudEE.csv'.F477]);"";['BenchBudEE.csv'.F477]) ->  | G477: of:=IF(ISNUMBER(SEARCH("[0-9]";[.A477]));MID([.A477];1;SEARCH("[0-9]";[.A477])-1);"") -> 
A478: of:=IF(ISBLANK(['BenchBudEE.csv'.A478]);"";['BenchBudEE.csv'.A478]) ->  | B478: of:=IF(ISBLANK(['BenchBudEE.csv'.B478]);"";['BenchBudEE.csv'.B478]) ->  | C478: of:=IF(ISBLANK(['BenchBudEE.csv'.C613]);"";MID(['BenchBudEE.csv'.C613];SEARCH(":";['BenchBudEE.csv'.C613])+1;100)) ->  | D478: of:=IF(ISBLANK(['BenchBudEE.csv'.D478]);"";['BenchBudEE.csv'.D478]) ->  | E478: of:=IF(ISBLANK(['BenchBudEE.csv'.E478]);"";['BenchBudEE.csv'.E478]) ->  | F478: of:=IF(ISBLANK(['BenchBudEE.csv'.F478]);"";['BenchBudEE.csv'.F478]) ->  | G478: of:=IF(ISNUMBER(SEARCH("[0-9]";[.A478]));MID([.A478];1;SEARCH("[0-9]";[.A478])-1);"") -> 
A479: of:=IF(ISBLANK(['BenchBudEE.csv'.A479]);"";['BenchBudEE.csv'.A479]) ->  | B479: of:=IF(ISBLANK(['BenchBudEE.csv'.B479]);"";['BenchBudEE.csv'.B479]) ->  | C479: of:=IF(ISBLANK(['BenchBudEE.csv'.C614]);"";MID(['BenchBudEE.csv'.C614];SEARCH(":";['BenchBudEE.csv'.C614])+1;100)) ->  | D479: of:=IF(ISBLANK(['BenchBudEE.csv'.D479]);"";['BenchBudEE.csv'.D479]) ->  | E479: of:=IF(ISBLANK(['BenchBudEE.csv'.E479]);"";['BenchBudEE.csv'.E479]) ->  | F479: of:=IF(ISBLANK(['BenchBudEE.csv'.F479]);"";['BenchBudEE.csv'.F479]) ->  | G479: of:=IF(ISNUMBER(SEARCH("[0-9]";[.A479]));MID([.A479];1;SEARCH("[0-9]";[.A479])-1);"") -> 
A480: of:=IF(ISBLANK(['BenchBudEE.csv'.A480]);"";['BenchBudEE.csv'.A480]) ->  | B480: of:=IF(ISBLANK(['BenchBudEE.csv'.B480]);"";['BenchBudEE.csv'.B480]) ->  | C480: of:=IF(ISBLANK(['BenchBudEE.csv'.C615]);"";MID(['BenchBudEE.csv'.C615];SEARCH(":";['BenchBudEE.csv'.C615])+1;100)) ->  | D480: of:=IF(ISBLANK(['BenchBudEE.csv'.D480]);"";['BenchBudEE.csv'.D480]) ->  | E480: of:=IF(ISBLANK(['BenchBudEE.csv'.E480]);"";['BenchBudEE.csv'.E480]) ->  | F480: of:=IF(ISBLANK(['BenchBudEE.csv'.F480]);"";['BenchBudEE.csv'.F480]) ->  | G480: of:=IF(ISNUMBER(SEARCH("[0-9]";[.A480]));MID([.A480];1;SEARCH("[0-9]";[.A480])-1);"") -> 
A481: of:=IF(ISBLANK(['BenchBudEE.csv'.A481]);"";['BenchBudEE.csv'.A481]) ->  | B481: of:=IF(ISBLANK(['BenchBudEE.csv'.B481]);"";['BenchBudEE.csv'.B481]) ->  | C481: of:=IF(ISBLANK(['BenchBudEE.csv'.C616]);"";MID(['BenchBudEE.csv'.C616];SEARCH(":";['BenchBudEE.csv'.C616])+1;100)) ->  | D481: of:=IF(ISBLANK(['BenchBudEE.csv'.D481]);"";['BenchBudEE.csv'.D481]) ->  | E481: of:=IF(ISBLANK(['BenchBudEE.csv'.E481]);"";['BenchBudEE.csv'.E481]) ->  | F481: of:=IF(ISBLANK(['BenchBudEE.csv'.F481]);"";['BenchBudEE.csv'.F481]) ->  | G481: of:=IF(ISNUMBER(SEARCH("[0-9]";[.A481]));MID([.A481];1;SEARCH("[0-9]";[.A481])-1);"") -> 
A482: of:=IF(ISBLANK(['BenchBudEE.csv'.A482]);"";['BenchBudEE.csv'.A482]) ->  | B482: of:=IF(ISBLANK(['BenchBudEE.csv'.B482]);"";['BenchBudEE.csv'.B482]) ->  | C482: of:=IF(ISBLANK(['BenchBudEE.csv'.C617]);"";MID(['BenchBudEE.csv'.C617];SEARCH(":";['BenchBudEE.csv'.C617])+1;100)) ->  | D482: of:=IF(ISBLANK(['BenchBudEE.csv'.D482]);"";['BenchBudEE.csv'.D482]) ->  | E482: of:=IF(ISBLANK(['BenchBudEE.csv'.E482]);"";['BenchBudEE.csv'.E482]) ->  | F482: of:=IF(ISBLANK(['BenchBudEE.csv'.F482]);"";['BenchBudEE.csv'.F482]) ->  | G482: of:=IF(ISNUMBER(SEARCH("[0-9]";[.A482]));MID([.A482];1;SEARCH("[0-9]";[.A482])-1);"") -> 
A483: of:=IF(ISBLANK(['BenchBudEE.csv'.A483]);"";['BenchBudEE.csv'.A483]) ->  | B483: of:=IF(ISBLANK(['BenchBudEE.csv'.B483]);"";['BenchBudEE.csv'.B483]) ->  | C483: of:=IF(ISBLANK(['BenchBudEE.csv'.C618]);"";MID(['BenchBudEE.csv'.C618];SEARCH(":";['BenchBudEE.csv'.C618])+1;100)) ->  | D483: of:=IF(ISBLANK(['BenchBudEE.csv'.D483]);"";['BenchBudEE.csv'.D483]) ->  | E483: of:=IF(ISBLANK(['BenchBudEE.csv'.E483]);"";['BenchBudEE.csv'.E483]) ->  | F483: of:=IF(ISBLANK(['BenchBudEE.csv'.F483]);"";['BenchBudEE.csv'.F483]) ->  | G483: of:=IF(ISNUMBER(SEARCH("[0-9]";[.A483]));MID([.A483];1;SEARCH("[0-9]";[.A483])-1);"") -> 
A484: of:=IF(ISBLANK(['BenchBudEE.csv'.A484]);"";['BenchBudEE.csv'.A484]) ->  | B484: of:=IF(ISBLANK(['BenchBudEE.csv'.B484]);"";['BenchBudEE.csv'.B484]) ->  | C484: of:=IF(ISBLANK(['BenchBudEE.csv'.C619]);"";MID(['BenchBudEE.csv'.C619];SEARCH(":";['BenchBudEE.csv'.C619])+1;100)) ->  | D484: of:=IF(ISBLANK(['BenchBudEE.csv'.D484]);"";['BenchBudEE.csv'.D484]) ->  | E484: of:=IF(ISBLANK(['BenchBudEE.csv'.E484]);"";['BenchBudEE.csv'.E484]) ->  | F484: of:=IF(ISBLANK(['BenchBudEE.csv'.F484]);"";['BenchBudEE.csv'.F484]) ->  | G484: of:=IF(ISNUMBER(SEARCH("[0-9]";[.A484]));MID([.A484];1;SEARCH("[0-9]";[.A484])-1);"") -> 
A485: of:=IF(ISBLANK(['BenchBudEE.csv'.A485]);"";['BenchBudEE.csv'.A485]) ->  | B485: of:=IF(ISBLANK(['BenchBudEE.csv'.B485]);"";['BenchBudEE.csv'.B485]) ->  | C485: of:=IF(ISBLANK(['BenchBudEE.csv'.C620]);"";MID(['BenchBudEE.csv'.C620];SEARCH(":";['BenchBudEE.csv'.C620])+1;100)) ->  | D485: of:=IF(ISBLANK(['BenchBudEE.csv'.D485]);"";['BenchBudEE.csv'.D485]) ->  | E485: of:=IF(ISBLANK(['BenchBudEE.csv'.E485]);"";['BenchBudEE.csv'.E485]) ->  | F485: of:=IF(ISBLANK(['BenchBudEE.csv'.F485]);"";['BenchBudEE.csv'.F485]) ->  | G485: of:=IF(ISNUMBER(SEARCH("[0-9]";[.A485]));MID([.A485];1;SEARCH("[0-9]";[.A485])-1);"") -> 
A486: of:=IF(ISBLANK(['BenchBudEE.csv'.A486]);"";['BenchBudEE.csv'.A486]) ->  | B486: of:=IF(ISBLANK(['BenchBudEE.csv'.B486]);"";['BenchBudEE.csv'.B486]) ->  | C486: of:=IF(ISBLANK(['BenchBudEE.csv'.C621]);"";MID(['BenchBudEE.csv'.C621];SEARCH(":";['BenchBudEE.csv'.C621])+1;100)) ->  | D486: of:=IF(ISBLANK(['BenchBudEE.csv'.D486]);"";['BenchBudEE.csv'.D486]) ->  | E486: of:=IF(ISBLANK(['BenchBudEE.csv'.E486]);"";['BenchBudEE.csv'.E486]) ->  | F486: of:=IF(ISBLANK(['BenchBudEE.csv'.F486]);"";['BenchBudEE.csv'.F486]) ->  | G486: of:=IF(ISNUMBER(SEARCH("[0-9]";[.A486]));MID([.A486];1;SEARCH("[0-9]";[.A486])-1);"") -> 
A487: of:=IF(ISBLANK(['BenchBudEE.csv'.A487]);"";['BenchBudEE.csv'.A487]) ->  | B487: of:=IF(ISBLANK(['BenchBudEE.csv'.B487]);"";['BenchBudEE.csv'.B487]) ->  | C487: of:=IF(ISBLANK(['BenchBudEE.csv'.C622]);"";MID(['BenchBudEE.csv'.C622];SEARCH(":";['BenchBudEE.csv'.C622])+1;100)) ->  | D487: of:=IF(ISBLANK(['BenchBudEE.csv'.D487]);"";['BenchBudEE.csv'.D487]) ->  | E487: of:=IF(ISBLANK(['BenchBudEE.csv'.E487]);"";['BenchBudEE.csv'.E487]) ->  | F487: of:=IF(ISBLANK(['BenchBudEE.csv'.F487]);"";['BenchBudEE.csv'.F487]) ->  | G487: of:=IF(ISNUMBER(SEARCH("[0-9]";[.A487]));MID([.A487];1;SEARCH("[0-9]";[.A487])-1);"") -> 
A488: of:=IF(ISBLANK(['BenchBudEE.csv'.A488]);"";['BenchBudEE.csv'.A488]) ->  | B488: of:=IF(ISBLANK(['BenchBudEE.csv'.B488]);"";['BenchBudEE.csv'.B488]) ->  | C488: of:=IF(ISBLANK(['BenchBudEE.csv'.C623]);"";MID(['BenchBudEE.csv'.C623];SEARCH(":";['BenchBudEE.csv'.C623])+1;100)) ->  | D488: of:=IF(ISBLANK(['BenchBudEE.csv'.D488]);"";['BenchBudEE.csv'.D488]) ->  | E488: of:=IF(ISBLANK(['BenchBudEE.csv'.E488]);"";['BenchBudEE.csv'.E488]) ->  | F488: of:=IF(ISBLANK(['BenchBudEE.csv'.F488]);"";['BenchBudEE.csv'.F488]) ->  | G488: of:=IF(ISNUMBER(SEARCH("[0-9]";[.A488]));MID([.A488];1;SEARCH("[0-9]";[.A488])-1);"") -> 
A489: of:=IF(ISBLANK(['BenchBudEE.csv'.A489]);"";['BenchBudEE.csv'.A489]) ->  | B489: of:=IF(ISBLANK(['BenchBudEE.csv'.B489]);"";['BenchBudEE.csv'.B489]) ->  | C489: of:=IF(ISBLANK(['BenchBudEE.csv'.C624]);"";MID(['BenchBudEE.csv'.C624];SEARCH(":";['BenchBudEE.csv'.C624])+1;100)) ->  | D489: of:=IF(ISBLANK(['BenchBudEE.csv'.D489]);"";['BenchBudEE.csv'.D489]) ->  | E489: of:=IF(ISBLANK(['BenchBudEE.csv'.E489]);"";['BenchBudEE.csv'.E489]) ->  | F489: of:=IF(ISBLANK(['BenchBudEE.csv'.F489]);"";['BenchBudEE.csv'.F489]) ->  | G489: of:=IF(ISNUMBER(SEARCH("[0-9]";[.A489]));MID([.A489];1;SEARCH("[0-9]";[.A489])-1);"") -> 
A490: of:=IF(ISBLANK(['BenchBudEE.csv'.A490]);"";['BenchBudEE.csv'.A490]) ->  | B490: of:=IF(ISBLANK(['BenchBudEE.csv'.B490]);"";['BenchBudEE.csv'.B490]) ->  | C490: of:=IF(ISBLANK(['BenchBudEE.csv'.C625]);"";MID(['BenchBudEE.csv'.C625];SEARCH(":";['BenchBudEE.csv'.C625])+1;100)) ->  | D490: of:=IF(ISBLANK(['BenchBudEE.csv'.D490]);"";['BenchBudEE.csv'.D490]) ->  | E490: of:=IF(ISBLANK(['BenchBudEE.csv'.E490]);"";['BenchBudEE.csv'.E490]) ->  | F490: of:=IF(ISBLANK(['BenchBudEE.csv'.F490]);"";['BenchBudEE.csv'.F490]) ->  | G490: of:=IF(ISNUMBER(SEARCH("[0-9]";[.A490]));MID([.A490];1;SEARCH("[0-9]";[.A490])-1);"") -> 
A491: of:=IF(ISBLANK(['BenchBudEE.csv'.A491]);"";['BenchBudEE.csv'.A491]) ->  | B491: of:=IF(ISBLANK(['BenchBudEE.csv'.B491]);"";['BenchBudEE.csv'.B491]) ->  | C491: of:=IF(ISBLANK(['BenchBudEE.csv'.C626]);"";MID(['BenchBudEE.csv'.C626];SEARCH(":";['BenchBudEE.csv'.C626])+1;100)) ->  | D491: of:=IF(ISBLANK(['BenchBudEE.csv'.D491]);"";['BenchBudEE.csv'.D491]) ->  | E491: of:=IF(ISBLANK(['BenchBudEE.csv'.E491]);"";['BenchBudEE.csv'.E491]) ->  | F491: of:=IF(ISBLANK(['BenchBudEE.csv'.F491]);"";['BenchBudEE.csv'.F491]) ->  | G491: of:=IF(ISNUMBER(SEARCH("[0-9]";[.A491]));MID([.A491];1;SEARCH("[0-9]";[.A491])-1);"") -> 
A492: of:=IF(ISBLANK(['BenchBudEE.csv'.A492]);"";['BenchBudEE.csv'.A492]) ->  | B492: of:=IF(ISBLANK(['BenchBudEE.csv'.B492]);"";['BenchBudEE.csv'.B492]) ->  | C492: of:=IF(ISBLANK(['BenchBudEE.csv'.C627]);"";MID(['BenchBudEE.csv'.C627];SEARCH(":";['BenchBudEE.csv'.C627])+1;100)) ->  | D492: of:=IF(ISBLANK(['BenchBudEE.csv'.D492]);"";['BenchBudEE.csv'.D492]) ->  | E492: of:=IF(ISBLANK(['BenchBudEE.csv'.E492]);"";['BenchBudEE.csv'.E492]) ->  | F492: of:=IF(ISBLANK(['BenchBudEE.csv'.F492]);"";['BenchBudEE.csv'.F492]) ->  | G492: of:=IF(ISNUMBER(SEARCH("[0-9]";[.A492]));MID([.A492];1;SEARCH("[0-9]";[.A492])-1);"") -> 
A493: of:=IF(ISBLANK(['BenchBudEE.csv'.A493]);"";['BenchBudEE.csv'.A493]) ->  | B493: of:=IF(ISBLANK(['BenchBudEE.csv'.B493]);"";['BenchBudEE.csv'.B493]) ->  | C493: of:=IF(ISBLANK(['BenchBudEE.csv'.C628]);"";MID(['BenchBudEE.csv'.C628];SEARCH(":";['BenchBudEE.csv'.C628])+1;100)) ->  | D493: of:=IF(ISBLANK(['BenchBudEE.csv'.D493]);"";['BenchBudEE.csv'.D493]) ->  | E493: of:=IF(ISBLANK(['BenchBudEE.csv'.E493]);"";['BenchBudEE.csv'.E493]) ->  | F493: of:=IF(ISBLANK(['BenchBudEE.csv'.F493]);"";['BenchBudEE.csv'.F493]) ->  | G493: of:=IF(ISNUMBER(SEARCH("[0-9]";[.A493]));MID([.A493];1;SEARCH("[0-9]";[.A493])-1);"") -> 
A494: of:=IF(ISBLANK(['BenchBudEE.csv'.A494]);"";['BenchBudEE.csv'.A494]) ->  | B494: of:=IF(ISBLANK(['BenchBudEE.csv'.B494]);"";['BenchBudEE.csv'.B494]) ->  | C494: of:=IF(ISBLANK(['BenchBudEE.csv'.C629]);"";MID(['BenchBudEE.csv'.C629];SEARCH(":";['BenchBudEE.csv'.C629])+1;100)) ->  | D494: of:=IF(ISBLANK(['BenchBudEE.csv'.D494]);"";['BenchBudEE.csv'.D494]) ->  | E494: of:=IF(ISBLANK(['BenchBudEE.csv'.E494]);"";['BenchBudEE.csv'.E494]) ->  | F494: of:=IF(ISBLANK(['BenchBudEE.csv'.F494]);"";['BenchBudEE.csv'.F494]) ->  | G494: of:=IF(ISNUMBER(SEARCH("[0-9]";[.A494]));MID([.A494];1;SEARCH("[0-9]";[.A494])-1);"") -> 
A495: of:=IF(ISBLANK(['BenchBudEE.csv'.A495]);"";['BenchBudEE.csv'.A495]) ->  | B495: of:=IF(ISBLANK(['BenchBudEE.csv'.B495]);"";['BenchBudEE.csv'.B495]) ->  | C495: of:=IF(ISBLANK(['BenchBudEE.csv'.C630]);"";MID(['BenchBudEE.csv'.C630];SEARCH(":";['BenchBudEE.csv'.C630])+1;100)) ->  | D495: of:=IF(ISBLANK(['BenchBudEE.csv'.D495]);"";['BenchBudEE.csv'.D495]) ->  | E495: of:=IF(ISBLANK(['BenchBudEE.csv'.E495]);"";['BenchBudEE.csv'.E495]) ->  | F495: of:=IF(ISBLANK(['BenchBudEE.csv'.F495]);"";['BenchBudEE.csv'.F495]) ->  | G495: of:=IF(ISNUMBER(SEARCH("[0-9]";[.A495]));MID([.A495];1;SEARCH("[0-9]";[.A495])-1);"") -> 
A496: of:=IF(ISBLANK(['BenchBudEE.csv'.A496]);"";['BenchBudEE.csv'.A496]) ->  | B496: of:=IF(ISBLANK(['BenchBudEE.csv'.B496]);"";['BenchBudEE.csv'.B496]) ->  | C496: of:=IF(ISBLANK(['BenchBudEE.csv'.C631]);"";MID(['BenchBudEE.csv'.C631];SEARCH(":";['BenchBudEE.csv'.C631])+1;100)) ->  | D496: of:=IF(ISBLANK(['BenchBudEE.csv'.D496]);"";['BenchBudEE.csv'.D496]) ->  | E496: of:=IF(ISBLANK(['BenchBudEE.csv'.E496]);"";['BenchBudEE.csv'.E496]) ->  | F496: of:=IF(ISBLANK(['BenchBudEE.csv'.F496]);"";['BenchBudEE.csv'.F496]) ->  | G496: of:=IF(ISNUMBER(SEARCH("[0-9]";[.A496]));MID([.A496];1;SEARCH("[0-9]";[.A496])-1);"") -> 
A497: of:=IF(ISBLANK(['BenchBudEE.csv'.A497]);"";['BenchBudEE.csv'.A497]) ->  | B497: of:=IF(ISBLANK(['BenchBudEE.csv'.B497]);"";['BenchBudEE.csv'.B497]) ->  | C497: of:=IF(ISBLANK(['BenchBudEE.csv'.C632]);"";MID(['BenchBudEE.csv'.C632];SEARCH(":";['BenchBudEE.csv'.C632])+1;100)) ->  | D497: of:=IF(ISBLANK(['BenchBudEE.csv'.D497]);"";['BenchBudEE.csv'.D497]) ->  | E497: of:=IF(ISBLANK(['BenchBudEE.csv'.E497]);"";['BenchBudEE.csv'.E497]) ->  | F497: of:=IF(ISBLANK(['BenchBudEE.csv'.F497]);"";['BenchBudEE.csv'.F497]) ->  | G497: of:=IF(ISNUMBER(SEARCH("[0-9]";[.A497]));MID([.A497];1;SEARCH("[0-9]";[.A497])-1);"") -> 
A498: of:=IF(ISBLANK(['BenchBudEE.csv'.A498]);"";['BenchBudEE.csv'.A498]) ->  | B498: of:=IF(ISBLANK(['BenchBudEE.csv'.B498]);"";['BenchBudEE.csv'.B498]) ->  | C498: of:=IF(ISBLANK(['BenchBudEE.csv'.C633]);"";MID(['BenchBudEE.csv'.C633];SEARCH(":";['BenchBudEE.csv'.C633])+1;100)) ->  | D498: of:=IF(ISBLANK(['BenchBudEE.csv'.D498]);"";['BenchBudEE.csv'.D498]) ->  | E498: of:=IF(ISBLANK(['BenchBudEE.csv'.E498]);"";['BenchBudEE.csv'.E498]) ->  | F498: of:=IF(ISBLANK(['BenchBudEE.csv'.F498]);"";['BenchBudEE.csv'.F498]) ->  | G498: of:=IF(ISNUMBER(SEARCH("[0-9]";[.A498]));MID([.A498];1;SEARCH("[0-9]";[.A498])-1);"") -> 
A499: of:=IF(ISBLANK(['BenchBudEE.csv'.A499]);"";['BenchBudEE.csv'.A499]) ->  | B499: of:=IF(ISBLANK(['BenchBudEE.csv'.B499]);"";['BenchBudEE.csv'.B499]) ->  | C499: of:=IF(ISBLANK(['BenchBudEE.csv'.C634]);"";MID(['BenchBudEE.csv'.C634];SEARCH(":";['BenchBudEE.csv'.C634])+1;100)) ->  | D499: of:=IF(ISBLANK(['BenchBudEE.csv'.D499]);"";['BenchBudEE.csv'.D499]) ->  | E499: of:=IF(ISBLANK(['BenchBudEE.csv'.E499]);"";['BenchBudEE.csv'.E499]) ->  | F499: of:=IF(ISBLANK(['BenchBudEE.csv'.F499]);"";['BenchBudEE.csv'.F499]) ->  | G499: of:=IF(ISNUMBER(SEARCH("[0-9]";[.A499]));MID([.A499];1;SEARCH("[0-9]";[.A499])-1);"") -> 
A500: of:=IF(ISBLANK(['BenchBudEE.csv'.A500]);"";['BenchBudEE.csv'.A500]) ->  | B500: of:=IF(ISBLANK(['BenchBudEE.csv'.B500]);"";['BenchBudEE.csv'.B500]) ->  | C500: of:=IF(ISBLANK(['BenchBudEE.csv'.C635]);"";MID(['BenchBudEE.csv'.C635];SEARCH(":";['BenchBudEE.csv'.C635])+1;100)) ->  | D500: of:=IF(ISBLANK(['BenchBudEE.csv'.D500]);"";['BenchBudEE.csv'.D500]) ->  | E500: of:=IF(ISBLANK(['BenchBudEE.csv'.E500]);"";['BenchBudEE.csv'.E500]) ->  | F500: of:=IF(ISBLANK(['BenchBudEE.csv'.F500]);"";['BenchBudEE.csv'.F500]) ->  | G500: of:=IF(ISNUMBER(SEARCH("[0-9]";[.A500]));MID([.A500];1;SEARCH("[0-9]";[.A500])-1);"") -> 
A501: of:=IF(ISBLANK(['BenchBudEE.csv'.A501]);"";['BenchBudEE.csv'.A501]) ->  | B501: of:=IF(ISBLANK(['BenchBudEE.csv'.B501]);"";['BenchBudEE.csv'.B501]) ->  | C501: of:=IF(ISBLANK(['BenchBudEE.csv'.C636]);"";MID(['BenchBudEE.csv'.C636];SEARCH(":";['BenchBudEE.csv'.C636])+1;100)) ->  | D501: of:=IF(ISBLANK(['BenchBudEE.csv'.D501]);"";['BenchBudEE.csv'.D501]) ->  | E501: of:=IF(ISBLANK(['BenchBudEE.csv'.E501]);"";['BenchBudEE.csv'.E501]) ->  | F501: of:=IF(ISBLANK(['BenchBudEE.csv'.F501]);"";['BenchBudEE.csv'.F501]) ->  | G501: of:=IF(ISNUMBER(SEARCH("[0-9]";[.A501]));MID([.A501];1;SEARCH("[0-9]";[.A501])-1);"") -> 
A502: of:=IF(ISBLANK(['BenchBudEE.csv'.A502]);"";['BenchBudEE.csv'.A502]) ->  | B502: of:=IF(ISBLANK(['BenchBudEE.csv'.B502]);"";['BenchBudEE.csv'.B502]) ->  | C502: of:=IF(ISBLANK(['BenchBudEE.csv'.C637]);"";MID(['BenchBudEE.csv'.C637];SEARCH(":";['BenchBudEE.csv'.C637])+1;100)) ->  | D502: of:=IF(ISBLANK(['BenchBudEE.csv'.D502]);"";['BenchBudEE.csv'.D502]) ->  | E502: of:=IF(ISBLANK(['BenchBudEE.csv'.E502]);"";['BenchBudEE.csv'.E502]) ->  | F502: of:=IF(ISBLANK(['BenchBudEE.csv'.F502]);"";['BenchBudEE.csv'.F502]) ->  | G502: of:=IF(ISNUMBER(SEARCH("[0-9]";[.A502]));MID([.A502];1;SEARCH("[0-9]";[.A502])-1);"") -> 
A503: of:=IF(ISBLANK(['BenchBudEE.csv'.A503]);"";['BenchBudEE.csv'.A503]) ->  | B503: of:=IF(ISBLANK(['BenchBudEE.csv'.B503]);"";['BenchBudEE.csv'.B503]) ->  | C503: of:=IF(ISBLANK(['BenchBudEE.csv'.C638]);"";MID(['BenchBudEE.csv'.C638];SEARCH(":";['BenchBudEE.csv'.C638])+1;100)) ->  | D503: of:=IF(ISBLANK(['BenchBudEE.csv'.D503]);"";['BenchBudEE.csv'.D503]) ->  | E503: of:=IF(ISBLANK(['BenchBudEE.csv'.E503]);"";['BenchBudEE.csv'.E503]) ->  | F503: of:=IF(ISBLANK(['BenchBudEE.csv'.F503]);"";['BenchBudEE.csv'.F503]) ->  | G503: of:=IF(ISNUMBER(SEARCH("[0-9]";[.A503]));MID([.A503];1;SEARCH("[0-9]";[.A503])-1);"") -> 
A504: of:=IF(ISBLANK(['BenchBudEE.csv'.A504]);"";['BenchBudEE.csv'.A504]) ->  | B504: of:=IF(ISBLANK(['BenchBudEE.csv'.B504]);"";['BenchBudEE.csv'.B504]) ->  | C504: of:=IF(ISBLANK(['BenchBudEE.csv'.C639]);"";MID(['BenchBudEE.csv'.C639];SEARCH(":";['BenchBudEE.csv'.C639])+1;100)) ->  | D504: of:=IF(ISBLANK(['BenchBudEE.csv'.D504]);"";['BenchBudEE.csv'.D504]) ->  | E504: of:=IF(ISBLANK(['BenchBudEE.csv'.E504]);"";['BenchBudEE.csv'.E504]) ->  | F504: of:=IF(ISBLANK(['BenchBudEE.csv'.F504]);"";['BenchBudEE.csv'.F504]) ->  | G504: of:=IF(ISNUMBER(SEARCH("[0-9]";[.A504]));MID([.A504];1;SEARCH("[0-9]";[.A504])-1);"") -> 
A505: of:=IF(ISBLANK(['BenchBudEE.csv'.A505]);"";['BenchBudEE.csv'.A505]) ->  | B505: of:=IF(ISBLANK(['BenchBudEE.csv'.B505]);"";['BenchBudEE.csv'.B505]) ->  | C505: of:=IF(ISBLANK(['BenchBudEE.csv'.C640]);"";MID(['BenchBudEE.csv'.C640];SEARCH(":";['BenchBudEE.csv'.C640])+1;100)) ->  | D505: of:=IF(ISBLANK(['BenchBudEE.csv'.D505]);"";['BenchBudEE.csv'.D505]) ->  | E505: of:=IF(ISBLANK(['BenchBudEE.csv'.E505]);"";['BenchBudEE.csv'.E505]) ->  | F505: of:=IF(ISBLANK(['BenchBudEE.csv'.F505]);"";['BenchBudEE.csv'.F505]) ->  | G505: of:=IF(ISNUMBER(SEARCH("[0-9]";[.A505]));MID([.A505];1;SEARCH("[0-9]";[.A505])-1);"") -> 
A506: of:=IF(ISBLANK(['BenchBudEE.csv'.A506]);"";['BenchBudEE.csv'.A506]) ->  | B506: of:=IF(ISBLANK(['BenchBudEE.csv'.B506]);"";['BenchBudEE.csv'.B506]) ->  | C506: of:=IF(ISBLANK(['BenchBudEE.csv'.C641]);"";MID(['BenchBudEE.csv'.C641];SEARCH(":";['BenchBudEE.csv'.C641])+1;100)) ->  | D506: of:=IF(ISBLANK(['BenchBudEE.csv'.D506]);"";['BenchBudEE.csv'.D506]) ->  | E506: of:=IF(ISBLANK(['BenchBudEE.csv'.E506]);"";['BenchBudEE.csv'.E506]) ->  | F506: of:=IF(ISBLANK(['BenchBudEE.csv'.F506]);"";['BenchBudEE.csv'.F506]) ->  | G506: of:=IF(ISNUMBER(SEARCH("[0-9]";[.A506]));MID([.A506];1;SEARCH("[0-9]";[.A506])-1);"") -> 
A507: of:=IF(ISBLANK(['BenchBudEE.csv'.A507]);"";['BenchBudEE.csv'.A507]) ->  | B507: of:=IF(ISBLANK(['BenchBudEE.csv'.B507]);"";['BenchBudEE.csv'.B507]) ->  | C507: of:=IF(ISBLANK(['BenchBudEE.csv'.C642]);"";MID(['BenchBudEE.csv'.C642];SEARCH(":";['BenchBudEE.csv'.C642])+1;100)) ->  | D507: of:=IF(ISBLANK(['BenchBudEE.csv'.D507]);"";['BenchBudEE.csv'.D507]) ->  | E507: of:=IF(ISBLANK(['BenchBudEE.csv'.E507]);"";['BenchBudEE.csv'.E507]) ->  | F507: of:=IF(ISBLANK(['BenchBudEE.csv'.F507]);"";['BenchBudEE.csv'.F507]) ->  | G507: of:=IF(ISNUMBER(SEARCH("[0-9]";[.A507]));MID([.A507];1;SEARCH("[0-9]";[.A507])-1);"") -> 
A508: of:=IF(ISBLANK(['BenchBudEE.csv'.A508]);"";['BenchBudEE.csv'.A508]) ->  | B508: of:=IF(ISBLANK(['BenchBudEE.csv'.B508]);"";['BenchBudEE.csv'.B508]) ->  | C508: of:=IF(ISBLANK(['BenchBudEE.csv'.C643]);"";MID(['BenchBudEE.csv'.C643];SEARCH(":";['BenchBudEE.csv'.C643])+1;100)) ->  | D508: of:=IF(ISBLANK(['BenchBudEE.csv'.D508]);"";['BenchBudEE.csv'.D508]) ->  | E508: of:=IF(ISBLANK(['BenchBudEE.csv'.E508]);"";['BenchBudEE.csv'.E508]) ->  | F508: of:=IF(ISBLANK(['BenchBudEE.csv'.F508]);"";['BenchBudEE.csv'.F508]) ->  | G508: of:=IF(ISNUMBER(SEARCH("[0-9]";[.A508]));MID([.A508];1;SEARCH("[0-9]";[.A508])-1);"") -> 
A509: of:=IF(ISBLANK(['BenchBudEE.csv'.A509]);"";['BenchBudEE.csv'.A509]) ->  | B509: of:=IF(ISBLANK(['BenchBudEE.csv'.B509]);"";['BenchBudEE.csv'.B509]) ->  | C509: of:=IF(ISBLANK(['BenchBudEE.csv'.C644]);"";MID(['BenchBudEE.csv'.C644];SEARCH(":";['BenchBudEE.csv'.C644])+1;100)) ->  | D509: of:=IF(ISBLANK(['BenchBudEE.csv'.D509]);"";['BenchBudEE.csv'.D509]) ->  | E509: of:=IF(ISBLANK(['BenchBudEE.csv'.E509]);"";['BenchBudEE.csv'.E509]) ->  | F509: of:=IF(ISBLANK(['BenchBudEE.csv'.F509]);"";['BenchBudEE.csv'.F509]) ->  | G509: of:=IF(ISNUMBER(SEARCH("[0-9]";[.A509]));MID([.A509];1;SEARCH("[0-9]";[.A509])-1);"") -> 
A510: of:=IF(ISBLANK(['BenchBudEE.csv'.A510]);"";['BenchBudEE.csv'.A510]) ->  | B510: of:=IF(ISBLANK(['BenchBudEE.csv'.B510]);"";['BenchBudEE.csv'.B510]) ->  | C510: of:=IF(ISBLANK(['BenchBudEE.csv'.C645]);"";MID(['BenchBudEE.csv'.C645];SEARCH(":";['BenchBudEE.csv'.C645])+1;100)) ->  | D510: of:=IF(ISBLANK(['BenchBudEE.csv'.D510]);"";['BenchBudEE.csv'.D510]) ->  | E510: of:=IF(ISBLANK(['BenchBudEE.csv'.E510]);"";['BenchBudEE.csv'.E510]) ->  | F510: of:=IF(ISBLANK(['BenchBudEE.csv'.F510]);"";['BenchBudEE.csv'.F510]) ->  | G510: of:=IF(ISNUMBER(SEARCH("[0-9]";[.A510]));MID([.A510];1;SEARCH("[0-9]";[.A510])-1);"") -> 
A511: of:=IF(ISBLANK(['BenchBudEE.csv'.A511]);"";['BenchBudEE.csv'.A511]) ->  | B511: of:=IF(ISBLANK(['BenchBudEE.csv'.B511]);"";['BenchBudEE.csv'.B511]) ->  | C511: of:=IF(ISBLANK(['BenchBudEE.csv'.C646]);"";MID(['BenchBudEE.csv'.C646];SEARCH(":";['BenchBudEE.csv'.C646])+1;100)) ->  | D511: of:=IF(ISBLANK(['BenchBudEE.csv'.D511]);"";['BenchBudEE.csv'.D511]) ->  | E511: of:=IF(ISBLANK(['BenchBudEE.csv'.E511]);"";['BenchBudEE.csv'.E511]) ->  | F511: of:=IF(ISBLANK(['BenchBudEE.csv'.F511]);"";['BenchBudEE.csv'.F511]) ->  | G511: of:=IF(ISNUMBER(SEARCH("[0-9]";[.A511]));MID([.A511];1;SEARCH("[0-9]";[.A511])-1);"") -> 
A512: of:=IF(ISBLANK(['BenchBudEE.csv'.A512]);"";['BenchBudEE.csv'.A512]) ->  | B512: of:=IF(ISBLANK(['BenchBudEE.csv'.B512]);"";['BenchBudEE.csv'.B512]) ->  | C512: of:=IF(ISBLANK(['BenchBudEE.csv'.C647]);"";MID(['BenchBudEE.csv'.C647];SEARCH(":";['BenchBudEE.csv'.C647])+1;100)) ->  | D512: of:=IF(ISBLANK(['BenchBudEE.csv'.D512]);"";['BenchBudEE.csv'.D512]) ->  | E512: of:=IF(ISBLANK(['BenchBudEE.csv'.E512]);"";['BenchBudEE.csv'.E512]) ->  | F512: of:=IF(ISBLANK(['BenchBudEE.csv'.F512]);"";['BenchBudEE.csv'.F512]) ->  | G512: of:=IF(ISNUMBER(SEARCH("[0-9]";[.A512]));MID([.A512];1;SEARCH("[0-9]";[.A512])-1);"") -> 
A513: of:=IF(ISBLANK(['BenchBudEE.csv'.A513]);"";['BenchBudEE.csv'.A513]) ->  | B513: of:=IF(ISBLANK(['BenchBudEE.csv'.B513]);"";['BenchBudEE.csv'.B513]) ->  | C513: of:=IF(ISBLANK(['BenchBudEE.csv'.C648]);"";MID(['BenchBudEE.csv'.C648];SEARCH(":";['BenchBudEE.csv'.C648])+1;100)) ->  | D513: of:=IF(ISBLANK(['BenchBudEE.csv'.D513]);"";['BenchBudEE.csv'.D513]) ->  | E513: of:=IF(ISBLANK(['BenchBudEE.csv'.E513]);"";['BenchBudEE.csv'.E513]) ->  | F513: of:=IF(ISBLANK(['BenchBudEE.csv'.F513]);"";['BenchBudEE.csv'.F513]) ->  | G513: of:=IF(ISNUMBER(SEARCH("[0-9]";[.A513]));MID([.A513];1;SEARCH("[0-9]";[.A513])-1);"") -> 
A514: of:=IF(ISBLANK(['BenchBudEE.csv'.A514]);"";['BenchBudEE.csv'.A514]) ->  | B514: of:=IF(ISBLANK(['BenchBudEE.csv'.B514]);"";['BenchBudEE.csv'.B514]) ->  | C514: of:=IF(ISBLANK(['BenchBudEE.csv'.C649]);"";MID(['BenchBudEE.csv'.C649];SEARCH(":";['BenchBudEE.csv'.C649])+1;100)) ->  | D514: of:=IF(ISBLANK(['BenchBudEE.csv'.D514]);"";['BenchBudEE.csv'.D514]) ->  | E514: of:=IF(ISBLANK(['BenchBudEE.csv'.E514]);"";['BenchBudEE.csv'.E514]) ->  | F514: of:=IF(ISBLANK(['BenchBudEE.csv'.F514]);"";['BenchBudEE.csv'.F514]) ->  | G514: of:=IF(ISNUMBER(SEARCH("[0-9]";[.A514]));MID([.A514];1;SEARCH("[0-9]";[.A514])-1);"") -> 
A515: of:=IF(ISBLANK(['BenchBudEE.csv'.A515]);"";['BenchBudEE.csv'.A515]) ->  | B515: of:=IF(ISBLANK(['BenchBudEE.csv'.B515]);"";['BenchBudEE.csv'.B515]) ->  | C515: of:=IF(ISBLANK(['BenchBudEE.csv'.C650]);"";MID(['BenchBudEE.csv'.C650];SEARCH(":";['BenchBudEE.csv'.C650])+1;100)) ->  | D515: of:=IF(ISBLANK(['BenchBudEE.csv'.D515]);"";['BenchBudEE.csv'.D515]) ->  | E515: of:=IF(ISBLANK(['BenchBudEE.csv'.E515]);"";['BenchBudEE.csv'.E515]) ->  | F515: of:=IF(ISBLANK(['BenchBudEE.csv'.F515]);"";['BenchBudEE.csv'.F515]) ->  | G515: of:=IF(ISNUMBER(SEARCH("[0-9]";[.A515]));MID([.A515];1;SEARCH("[0-9]";[.A515])-1);"") -> 
A516: of:=IF(ISBLANK(['BenchBudEE.csv'.A516]);"";['BenchBudEE.csv'.A516]) ->  | B516: of:=IF(ISBLANK(['BenchBudEE.csv'.B516]);"";['BenchBudEE.csv'.B516]) ->  | C516: of:=IF(ISBLANK(['BenchBudEE.csv'.C651]);"";MID(['BenchBudEE.csv'.C651];SEARCH(":";['BenchBudEE.csv'.C651])+1;100)) ->  | D516: of:=IF(ISBLANK(['BenchBudEE.csv'.D516]);"";['BenchBudEE.csv'.D516]) ->  | E516: of:=IF(ISBLANK(['BenchBudEE.csv'.E516]);"";['BenchBudEE.csv'.E516]) ->  | F516: of:=IF(ISBLANK(['BenchBudEE.csv'.F516]);"";['BenchBudEE.csv'.F516]) ->  | G516: of:=IF(ISNUMBER(SEARCH("[0-9]";[.A516]));MID([.A516];1;SEARCH("[0-9]";[.A516])-1);"") -> 
A517: of:=IF(ISBLANK(['BenchBudEE.csv'.A517]);"";['BenchBudEE.csv'.A517]) ->  | B517: of:=IF(ISBLANK(['BenchBudEE.csv'.B517]);"";['BenchBudEE.csv'.B517]) ->  | C517: of:=IF(ISBLANK(['BenchBudEE.csv'.C652]);"";MID(['BenchBudEE.csv'.C652];SEARCH(":";['BenchBudEE.csv'.C652])+1;100)) ->  | D517: of:=IF(ISBLANK(['BenchBudEE.csv'.D517]);"";['BenchBudEE.csv'.D517]) ->  | E517: of:=IF(ISBLANK(['BenchBudEE.csv'.E517]);"";['BenchBudEE.csv'.E517]) ->  | F517: of:=IF(ISBLANK(['BenchBudEE.csv'.F517]);"";['BenchBudEE.csv'.F517]) ->  | G517: of:=IF(ISNUMBER(SEARCH("[0-9]";[.A517]));MID([.A517];1;SEARCH("[0-9]";[.A517])-1);"") -> 
A518: of:=IF(ISBLANK(['BenchBudEE.csv'.A518]);"";['BenchBudEE.csv'.A518]) ->  | B518: of:=IF(ISBLANK(['BenchBudEE.csv'.B518]);"";['BenchBudEE.csv'.B518]) ->  | C518: of:=IF(ISBLANK(['BenchBudEE.csv'.C653]);"";MID(['BenchBudEE.csv'.C653];SEARCH(":";['BenchBudEE.csv'.C653])+1;100)) ->  | D518: of:=IF(ISBLANK(['BenchBudEE.csv'.D518]);"";['BenchBudEE.csv'.D518]) ->  | E518: of:=IF(ISBLANK(['BenchBudEE.csv'.E518]);"";['BenchBudEE.csv'.E518]) ->  | F518: of:=IF(ISBLANK(['BenchBudEE.csv'.F518]);"";['BenchBudEE.csv'.F518]) ->  | G518: of:=IF(ISNUMBER(SEARCH("[0-9]";[.A518]));MID([.A518];1;SEARCH("[0-9]";[.A518])-1);"") -> 
A519: of:=IF(ISBLANK(['BenchBudEE.csv'.A519]);"";['BenchBudEE.csv'.A519]) ->  | B519: of:=IF(ISBLANK(['BenchBudEE.csv'.B519]);"";['BenchBudEE.csv'.B519]) ->  | C519: of:=IF(ISBLANK(['BenchBudEE.csv'.C654]);"";MID(['BenchBudEE.csv'.C654];SEARCH(":";['BenchBudEE.csv'.C654])+1;100)) ->  | D519: of:=IF(ISBLANK(['BenchBudEE.csv'.D519]);"";['BenchBudEE.csv'.D519]) ->  | E519: of:=IF(ISBLANK(['BenchBudEE.csv'.E519]);"";['BenchBudEE.csv'.E519]) ->  | F519: of:=IF(ISBLANK(['BenchBudEE.csv'.F519]);"";['BenchBudEE.csv'.F519]) ->  | G519: of:=IF(ISNUMBER(SEARCH("[0-9]";[.A519]));MID([.A519];1;SEARCH("[0-9]";[.A519])-1);"") -> 
A520: of:=IF(ISBLANK(['BenchBudEE.csv'.A520]);"";['BenchBudEE.csv'.A520]) ->  | B520: of:=IF(ISBLANK(['BenchBudEE.csv'.B520]);"";['BenchBudEE.csv'.B520]) ->  | C520: of:=IF(ISBLANK(['BenchBudEE.csv'.C655]);"";MID(['BenchBudEE.csv'.C655];SEARCH(":";['BenchBudEE.csv'.C655])+1;100)) ->  | D520: of:=IF(ISBLANK(['BenchBudEE.csv'.D520]);"";['BenchBudEE.csv'.D520]) ->  | E520: of:=IF(ISBLANK(['BenchBudEE.csv'.E520]);"";['BenchBudEE.csv'.E520]) ->  | F520: of:=IF(ISBLANK(['BenchBudEE.csv'.F520]);"";['BenchBudEE.csv'.F520]) ->  | G520: of:=IF(ISNUMBER(SEARCH("[0-9]";[.A520]));MID([.A520];1;SEARCH("[0-9]";[.A520])-1);"") -> 
A521: of:=IF(ISBLANK(['BenchBudEE.csv'.A521]);"";['BenchBudEE.csv'.A521]) ->  | B521: of:=IF(ISBLANK(['BenchBudEE.csv'.B521]);"";['BenchBudEE.csv'.B521]) ->  | C521: of:=IF(ISBLANK(['BenchBudEE.csv'.C656]);"";MID(['BenchBudEE.csv'.C656];SEARCH(":";['BenchBudEE.csv'.C656])+1;100)) ->  | D521: of:=IF(ISBLANK(['BenchBudEE.csv'.D521]);"";['BenchBudEE.csv'.D521]) ->  | E521: of:=IF(ISBLANK(['BenchBudEE.csv'.E521]);"";['BenchBudEE.csv'.E521]) ->  | F521: of:=IF(ISBLANK(['BenchBudEE.csv'.F521]);"";['BenchBudEE.csv'.F521]) ->  | G521: of:=IF(ISNUMBER(SEARCH("[0-9]";[.A521]));MID([.A521];1;SEARCH("[0-9]";[.A521])-1);"") -> 
A522: of:=IF(ISBLANK(['BenchBudEE.csv'.A522]);"";['BenchBudEE.csv'.A522]) ->  | B522: of:=IF(ISBLANK(['BenchBudEE.csv'.B522]);"";['BenchBudEE.csv'.B522]) ->  | C522: of:=IF(ISBLANK(['BenchBudEE.csv'.C657]);"";MID(['BenchBudEE.csv'.C657];SEARCH(":";['BenchBudEE.csv'.C657])+1;100)) ->  | D522: of:=IF(ISBLANK(['BenchBudEE.csv'.D522]);"";['BenchBudEE.csv'.D522]) ->  | E522: of:=IF(ISBLANK(['BenchBudEE.csv'.E522]);"";['BenchBudEE.csv'.E522]) ->  | F522: of:=IF(ISBLANK(['BenchBudEE.csv'.F522]);"";['BenchBudEE.csv'.F522]) ->  | G522: of:=IF(ISNUMBER(SEARCH("[0-9]";[.A522]));MID([.A522];1;SEARCH("[0-9]";[.A522])-1);"") -> 
A523: of:=IF(ISBLANK(['BenchBudEE.csv'.A523]);"";['BenchBudEE.csv'.A523]) ->  | B523: of:=IF(ISBLANK(['BenchBudEE.csv'.B523]);"";['BenchBudEE.csv'.B523]) ->  | C523: of:=IF(ISBLANK(['BenchBudEE.csv'.C658]);"";MID(['BenchBudEE.csv'.C658];SEARCH(":";['BenchBudEE.csv'.C658])+1;100)) ->  | D523: of:=IF(ISBLANK(['BenchBudEE.csv'.D523]);"";['BenchBudEE.csv'.D523]) ->  | E523: of:=IF(ISBLANK(['BenchBudEE.csv'.E523]);"";['BenchBudEE.csv'.E523]) ->  | F523: of:=IF(ISBLANK(['BenchBudEE.csv'.F523]);"";['BenchBudEE.csv'.F523]) ->  | G523: of:=IF(ISNUMBER(SEARCH("[0-9]";[.A523]));MID([.A523];1;SEARCH("[0-9]";[.A523])-1);"") -> 
A524: of:=IF(ISBLANK(['BenchBudEE.csv'.A524]);"";['BenchBudEE.csv'.A524]) ->  | B524: of:=IF(ISBLANK(['BenchBudEE.csv'.B524]);"";['BenchBudEE.csv'.B524]) ->  | C524: of:=IF(ISBLANK(['BenchBudEE.csv'.C659]);"";MID(['BenchBudEE.csv'.C659];SEARCH(":";['BenchBudEE.csv'.C659])+1;100)) ->  | D524: of:=IF(ISBLANK(['BenchBudEE.csv'.D524]);"";['BenchBudEE.csv'.D524]) ->  | E524: of:=IF(ISBLANK(['BenchBudEE.csv'.E524]);"";['BenchBudEE.csv'.E524]) ->  | F524: of:=IF(ISBLANK(['BenchBudEE.csv'.F524]);"";['BenchBudEE.csv'.F524]) ->  | G524: of:=IF(ISNUMBER(SEARCH("[0-9]";[.A524]));MID([.A524];1;SEARCH("[0-9]";[.A524])-1);"") -> 
A525: of:=IF(ISBLANK(['BenchBudEE.csv'.A525]);"";['BenchBudEE.csv'.A525]) ->  | B525: of:=IF(ISBLANK(['BenchBudEE.csv'.B525]);"";['BenchBudEE.csv'.B525]) ->  | C525: of:=IF(ISBLANK(['BenchBudEE.csv'.C660]);"";MID(['BenchBudEE.csv'.C660];SEARCH(":";['BenchBudEE.csv'.C660])+1;100)) ->  | D525: of:=IF(ISBLANK(['BenchBudEE.csv'.D525]);"";['BenchBudEE.csv'.D525]) ->  | E525: of:=IF(ISBLANK(['BenchBudEE.csv'.E525]);"";['BenchBudEE.csv'.E525]) ->  | F525: of:=IF(ISBLANK(['BenchBudEE.csv'.F525]);"";['BenchBudEE.csv'.F525]) ->  | G525: of:=IF(ISNUMBER(SEARCH("[0-9]";[.A525]));MID([.A525];1;SEARCH("[0-9]";[.A525])-1);"") -> 
A526: of:=IF(ISBLANK(['BenchBudEE.csv'.A526]);"";['BenchBudEE.csv'.A526]) ->  | B526: of:=IF(ISBLANK(['BenchBudEE.csv'.B526]);"";['BenchBudEE.csv'.B526]) ->  | C526: of:=IF(ISBLANK(['BenchBudEE.csv'.C661]);"";MID(['BenchBudEE.csv'.C661];SEARCH(":";['BenchBudEE.csv'.C661])+1;100)) ->  | D526: of:=IF(ISBLANK(['BenchBudEE.csv'.D526]);"";['BenchBudEE.csv'.D526]) ->  | E526: of:=IF(ISBLANK(['BenchBudEE.csv'.E526]);"";['BenchBudEE.csv'.E526]) ->  | F526: of:=IF(ISBLANK(['BenchBudEE.csv'.F526]);"";['BenchBudEE.csv'.F526]) ->  | G526: of:=IF(ISNUMBER(SEARCH("[0-9]";[.A526]));MID([.A526];1;SEARCH("[0-9]";[.A526])-1);"") -> 
A527: of:=IF(ISBLANK(['BenchBudEE.csv'.A527]);"";['BenchBudEE.csv'.A527]) ->  | B527: of:=IF(ISBLANK(['BenchBudEE.csv'.B527]);"";['BenchBudEE.csv'.B527]) ->  | C527: of:=IF(ISBLANK(['BenchBudEE.csv'.C662]);"";MID(['BenchBudEE.csv'.C662];SEARCH(":";['BenchBudEE.csv'.C662])+1;100)) ->  | D527: of:=IF(ISBLANK(['BenchBudEE.csv'.D527]);"";['BenchBudEE.csv'.D527]) ->  | E527: of:=IF(ISBLANK(['BenchBudEE.csv'.E527]);"";['BenchBudEE.csv'.E527]) ->  | F527: of:=IF(ISBLANK(['BenchBudEE.csv'.F527]);"";['BenchBudEE.csv'.F527]) ->  | G527: of:=IF(ISNUMBER(SEARCH("[0-9]";[.A527]));MID([.A527];1;SEARCH("[0-9]";[.A527])-1);"") -> 
A528: of:=IF(ISBLANK(['BenchBudEE.csv'.A528]);"";['BenchBudEE.csv'.A528]) ->  | B528: of:=IF(ISBLANK(['BenchBudEE.csv'.B528]);"";['BenchBudEE.csv'.B528]) ->  | C528: of:=IF(ISBLANK(['BenchBudEE.csv'.C663]);"";MID(['BenchBudEE.csv'.C663];SEARCH(":";['BenchBudEE.csv'.C663])+1;100)) ->  | D528: of:=IF(ISBLANK(['BenchBudEE.csv'.D528]);"";['BenchBudEE.csv'.D528]) ->  | E528: of:=IF(ISBLANK(['BenchBudEE.csv'.E528]);"";['BenchBudEE.csv'.E528]) ->  | F528: of:=IF(ISBLANK(['BenchBudEE.csv'.F528]);"";['BenchBudEE.csv'.F528]) ->  | G528: of:=IF(ISNUMBER(SEARCH("[0-9]";[.A528]));MID([.A528];1;SEARCH("[0-9]";[.A528])-1);"") -> 
A529: of:=IF(ISBLANK(['BenchBudEE.csv'.A529]);"";['BenchBudEE.csv'.A529]) ->  | B529: of:=IF(ISBLANK(['BenchBudEE.csv'.B529]);"";['BenchBudEE.csv'.B529]) ->  | C529: of:=IF(ISBLANK(['BenchBudEE.csv'.C664]);"";MID(['BenchBudEE.csv'.C664];SEARCH(":";['BenchBudEE.csv'.C664])+1;100)) ->  | D529: of:=IF(ISBLANK(['BenchBudEE.csv'.D529]);"";['BenchBudEE.csv'.D529]) ->  | E529: of:=IF(ISBLANK(['BenchBudEE.csv'.E529]);"";['BenchBudEE.csv'.E529]) ->  | F529: of:=IF(ISBLANK(['BenchBudEE.csv'.F529]);"";['BenchBudEE.csv'.F529]) ->  | G529: of:=IF(ISNUMBER(SEARCH("[0-9]";[.A529]));MID([.A529];1;SEARCH("[0-9]";[.A529])-1);"") -> 
A530: of:=IF(ISBLANK(['BenchBudEE.csv'.A530]);"";['BenchBudEE.csv'.A530]) ->  | B530: of:=IF(ISBLANK(['BenchBudEE.csv'.B530]);"";['BenchBudEE.csv'.B530]) ->  | C530: of:=IF(ISBLANK(['BenchBudEE.csv'.C665]);"";MID(['BenchBudEE.csv'.C665];SEARCH(":";['BenchBudEE.csv'.C665])+1;100)) ->  | D530: of:=IF(ISBLANK(['BenchBudEE.csv'.D530]);"";['BenchBudEE.csv'.D530]) ->  | E530: of:=IF(ISBLANK(['BenchBudEE.csv'.E530]);"";['BenchBudEE.csv'.E530]) ->  | F530: of:=IF(ISBLANK(['BenchBudEE.csv'.F530]);"";['BenchBudEE.csv'.F530]) ->  | G530: of:=IF(ISNUMBER(SEARCH("[0-9]";[.A530]));MID([.A530];1;SEARCH("[0-9]";[.A530])-1);"") -> 
A531: of:=IF(ISBLANK(['BenchBudEE.csv'.A531]);"";['BenchBudEE.csv'.A531]) ->  | B531: of:=IF(ISBLANK(['BenchBudEE.csv'.B531]);"";['BenchBudEE.csv'.B531]) ->  | C531: of:=IF(ISBLANK(['BenchBudEE.csv'.C666]);"";MID(['BenchBudEE.csv'.C666];SEARCH(":";['BenchBudEE.csv'.C666])+1;100)) ->  | D531: of:=IF(ISBLANK(['BenchBudEE.csv'.D531]);"";['BenchBudEE.csv'.D531]) ->  | E531: of:=IF(ISBLANK(['BenchBudEE.csv'.E531]);"";['BenchBudEE.csv'.E531]) ->  | F531: of:=IF(ISBLANK(['BenchBudEE.csv'.F531]);"";['BenchBudEE.csv'.F531]) ->  | G531: of:=IF(ISNUMBER(SEARCH("[0-9]";[.A531]));MID([.A531];1;SEARCH("[0-9]";[.A531])-1);"") -> 
A532: of:=IF(ISBLANK(['BenchBudEE.csv'.A532]);"";['BenchBudEE.csv'.A532]) ->  | B532: of:=IF(ISBLANK(['BenchBudEE.csv'.B532]);"";['BenchBudEE.csv'.B532]) ->  | C532: of:=IF(ISBLANK(['BenchBudEE.csv'.C667]);"";MID(['BenchBudEE.csv'.C667];SEARCH(":";['BenchBudEE.csv'.C667])+1;100)) ->  | D532: of:=IF(ISBLANK(['BenchBudEE.csv'.D532]);"";['BenchBudEE.csv'.D532]) ->  | E532: of:=IF(ISBLANK(['BenchBudEE.csv'.E532]);"";['BenchBudEE.csv'.E532]) ->  | F532: of:=IF(ISBLANK(['BenchBudEE.csv'.F532]);"";['BenchBudEE.csv'.F532]) ->  | G532: of:=IF(ISNUMBER(SEARCH("[0-9]";[.A532]));MID([.A532];1;SEARCH("[0-9]";[.A532])-1);"") -> 
A533: of:=IF(ISBLANK(['BenchBudEE.csv'.A533]);"";['BenchBudEE.csv'.A533]) ->  | B533: of:=IF(ISBLANK(['BenchBudEE.csv'.B533]);"";['BenchBudEE.csv'.B533]) ->  | C533: of:=IF(ISBLANK(['BenchBudEE.csv'.C668]);"";MID(['BenchBudEE.csv'.C668];SEARCH(":";['BenchBudEE.csv'.C668])+1;100)) ->  | D533: of:=IF(ISBLANK(['BenchBudEE.csv'.D533]);"";['BenchBudEE.csv'.D533]) ->  | E533: of:=IF(ISBLANK(['BenchBudEE.csv'.E533]);"";['BenchBudEE.csv'.E533]) ->  | F533: of:=IF(ISBLANK(['BenchBudEE.csv'.F533]);"";['BenchBudEE.csv'.F533]) ->  | G533: of:=IF(ISNUMBER(SEARCH("[0-9]";[.A533]));MID([.A533];1;SEARCH("[0-9]";[.A533])-1);"") -> 
A534: of:=IF(ISBLANK(['BenchBudEE.csv'.A534]);"";['BenchBudEE.csv'.A534]) ->  | B534: of:=IF(ISBLANK(['BenchBudEE.csv'.B534]);"";['BenchBudEE.csv'.B534]) ->  | C534: of:=IF(ISBLANK(['BenchBudEE.csv'.C669]);"";MID(['BenchBudEE.csv'.C669];SEARCH(":";['BenchBudEE.csv'.C669])+1;100)) ->  | D534: of:=IF(ISBLANK(['BenchBudEE.csv'.D534]);"";['BenchBudEE.csv'.D534]) ->  | E534: of:=IF(ISBLANK(['BenchBudEE.csv'.E534]);"";['BenchBudEE.csv'.E534]) ->  | F534: of:=IF(ISBLANK(['BenchBudEE.csv'.F534]);"";['BenchBudEE.csv'.F534]) ->  | G534: of:=IF(ISNUMBER(SEARCH("[0-9]";[.A534]));MID([.A534];1;SEARCH("[0-9]";[.A534])-1);"") -> 
A535: of:=IF(ISBLANK(['BenchBudEE.csv'.A535]);"";['BenchBudEE.csv'.A535]) ->  | B535: of:=IF(ISBLANK(['BenchBudEE.csv'.B535]);"";['BenchBudEE.csv'.B535]) ->  | C535: of:=IF(ISBLANK(['BenchBudEE.csv'.C670]);"";MID(['BenchBudEE.csv'.C670];SEARCH(":";['BenchBudEE.csv'.C670])+1;100)) ->  | D535: of:=IF(ISBLANK(['BenchBudEE.csv'.D535]);"";['BenchBudEE.csv'.D535]) ->  | E535: of:=IF(ISBLANK(['BenchBudEE.csv'.E535]);"";['BenchBudEE.csv'.E535]) ->  | F535: of:=IF(ISBLANK(['BenchBudEE.csv'.F535]);"";['BenchBudEE.csv'.F535]) ->  | G535: of:=IF(ISNUMBER(SEARCH("[0-9]";[.A535]));MID([.A535];1;SEARCH("[0-9]";[.A535])-1);"") -> 
A536: of:=IF(ISBLANK(['BenchBudEE.csv'.A536]);"";['BenchBudEE.csv'.A536]) ->  | B536: of:=IF(ISBLANK(['BenchBudEE.csv'.B536]);"";['BenchBudEE.csv'.B536]) ->  | C536: of:=IF(ISBLANK(['BenchBudEE.csv'.C671]);"";MID(['BenchBudEE.csv'.C671];SEARCH(":";['BenchBudEE.csv'.C671])+1;100)) ->  | D536: of:=IF(ISBLANK(['BenchBudEE.csv'.D536]);"";['BenchBudEE.csv'.D536]) ->  | E536: of:=IF(ISBLANK(['BenchBudEE.csv'.E536]);"";['BenchBudEE.csv'.E536]) ->  | F536: of:=IF(ISBLANK(['BenchBudEE.csv'.F536]);"";['BenchBudEE.csv'.F536]) ->  | G536: of:=IF(ISNUMBER(SEARCH("[0-9]";[.A536]));MID([.A536];1;SEARCH("[0-9]";[.A536])-1);"") -> 
A537: of:=IF(ISBLANK(['BenchBudEE.csv'.A537]);"";['BenchBudEE.csv'.A537]) ->  | B537: of:=IF(ISBLANK(['BenchBudEE.csv'.B537]);"";['BenchBudEE.csv'.B537]) ->  | C537: of:=IF(ISBLANK(['BenchBudEE.csv'.C672]);"";MID(['BenchBudEE.csv'.C672];SEARCH(":";['BenchBudEE.csv'.C672])+1;100)) ->  | D537: of:=IF(ISBLANK(['BenchBudEE.csv'.D537]);"";['BenchBudEE.csv'.D537]) ->  | E537: of:=IF(ISBLANK(['BenchBudEE.csv'.E537]);"";['BenchBudEE.csv'.E537]) ->  | F537: of:=IF(ISBLANK(['BenchBudEE.csv'.F537]);"";['BenchBudEE.csv'.F537]) ->  | G537: of:=IF(ISNUMBER(SEARCH("[0-9]";[.A537]));MID([.A537];1;SEARCH("[0-9]";[.A537])-1);"") -> 
A538: of:=IF(ISBLANK(['BenchBudEE.csv'.A538]);"";['BenchBudEE.csv'.A538]) ->  | B538: of:=IF(ISBLANK(['BenchBudEE.csv'.B538]);"";['BenchBudEE.csv'.B538]) ->  | C538: of:=IF(ISBLANK(['BenchBudEE.csv'.C673]);"";MID(['BenchBudEE.csv'.C673];SEARCH(":";['BenchBudEE.csv'.C673])+1;100)) ->  | D538: of:=IF(ISBLANK(['BenchBudEE.csv'.D538]);"";['BenchBudEE.csv'.D538]) ->  | E538: of:=IF(ISBLANK(['BenchBudEE.csv'.E538]);"";['BenchBudEE.csv'.E538]) ->  | F538: of:=IF(ISBLANK(['BenchBudEE.csv'.F538]);"";['BenchBudEE.csv'.F538]) ->  | G538: of:=IF(ISNUMBER(SEARCH("[0-9]";[.A538]));MID([.A538];1;SEARCH("[0-9]";[.A538])-1);"") -> 
A539: of:=IF(ISBLANK(['BenchBudEE.csv'.A539]);"";['BenchBudEE.csv'.A539]) ->  | B539: of:=IF(ISBLANK(['BenchBudEE.csv'.B539]);"";['BenchBudEE.csv'.B539]) ->  | C539: of:=IF(ISBLANK(['BenchBudEE.csv'.C674]);"";MID(['BenchBudEE.csv'.C674];SEARCH(":";['BenchBudEE.csv'.C674])+1;100)) ->  | D539: of:=IF(ISBLANK(['BenchBudEE.csv'.D539]);"";['BenchBudEE.csv'.D539]) ->  | E539: of:=IF(ISBLANK(['BenchBudEE.csv'.E539]);"";['BenchBudEE.csv'.E539]) ->  | F539: of:=IF(ISBLANK(['BenchBudEE.csv'.F539]);"";['BenchBudEE.csv'.F539]) ->  | G539: of:=IF(ISNUMBER(SEARCH("[0-9]";[.A539]));MID([.A539];1;SEARCH("[0-9]";[.A539])-1);"") -> 
A540: of:=IF(ISBLANK(['BenchBudEE.csv'.A540]);"";['BenchBudEE.csv'.A540]) ->  | B540: of:=IF(ISBLANK(['BenchBudEE.csv'.B540]);"";['BenchBudEE.csv'.B540]) ->  | C540: of:=IF(ISBLANK(['BenchBudEE.csv'.C675]);"";MID(['BenchBudEE.csv'.C675];SEARCH(":";['BenchBudEE.csv'.C675])+1;100)) ->  | D540: of:=IF(ISBLANK(['BenchBudEE.csv'.D540]);"";['BenchBudEE.csv'.D540]) ->  | E540: of:=IF(ISBLANK(['BenchBudEE.csv'.E540]);"";['BenchBudEE.csv'.E540]) ->  | F540: of:=IF(ISBLANK(['BenchBudEE.csv'.F540]);"";['BenchBudEE.csv'.F540]) ->  | G540: of:=IF(ISNUMBER(SEARCH("[0-9]";[.A540]));MID([.A540];1;SEARCH("[0-9]";[.A540])-1);"") -> 
A541: of:=IF(ISBLANK(['BenchBudEE.csv'.A541]);"";['BenchBudEE.csv'.A541]) ->  | B541: of:=IF(ISBLANK(['BenchBudEE.csv'.B541]);"";['BenchBudEE.csv'.B541]) ->  | C541: of:=IF(ISBLANK(['BenchBudEE.csv'.C676]);"";MID(['BenchBudEE.csv'.C676];SEARCH(":";['BenchBudEE.csv'.C676])+1;100)) ->  | D541: of:=IF(ISBLANK(['BenchBudEE.csv'.D541]);"";['BenchBudEE.csv'.D541]) ->  | E541: of:=IF(ISBLANK(['BenchBudEE.csv'.E541]);"";['BenchBudEE.csv'.E541]) ->  | F541: of:=IF(ISBLANK(['BenchBudEE.csv'.F541]);"";['BenchBudEE.csv'.F541]) ->  | G541: of:=IF(ISNUMBER(SEARCH("[0-9]";[.A541]));MID([.A541];1;SEARCH("[0-9]";[.A541])-1);"") -> 
A542: of:=IF(ISBLANK(['BenchBudEE.csv'.A542]);"";['BenchBudEE.csv'.A542]) ->  | B542: of:=IF(ISBLANK(['BenchBudEE.csv'.B542]);"";['BenchBudEE.csv'.B542]) ->  | C542: of:=IF(ISBLANK(['BenchBudEE.csv'.C677]);"";MID(['BenchBudEE.csv'.C677];SEARCH(":";['BenchBudEE.csv'.C677])+1;100)) ->  | D542: of:=IF(ISBLANK(['BenchBudEE.csv'.D542]);"";['BenchBudEE.csv'.D542]) ->  | E542: of:=IF(ISBLANK(['BenchBudEE.csv'.E542]);"";['BenchBudEE.csv'.E542]) ->  | F542: of:=IF(ISBLANK(['BenchBudEE.csv'.F542]);"";['BenchBudEE.csv'.F542]) ->  | G542: of:=IF(ISNUMBER(SEARCH("[0-9]";[.A542]));MID([.A542];1;SEARCH("[0-9]";[.A542])-1);"") -> 
A543: of:=IF(ISBLANK(['BenchBudEE.csv'.A543]);"";['BenchBudEE.csv'.A543]) ->  | B543: of:=IF(ISBLANK(['BenchBudEE.csv'.B543]);"";['BenchBudEE.csv'.B543]) ->  | C543: of:=IF(ISBLANK(['BenchBudEE.csv'.C678]);"";MID(['BenchBudEE.csv'.C678];SEARCH(":";['BenchBudEE.csv'.C678])+1;100)) ->  | D543: of:=IF(ISBLANK(['BenchBudEE.csv'.D543]);"";['BenchBudEE.csv'.D543]) ->  | E543: of:=IF(ISBLANK(['BenchBudEE.csv'.E543]);"";['BenchBudEE.csv'.E543]) ->  | F543: of:=IF(ISBLANK(['BenchBudEE.csv'.F543]);"";['BenchBudEE.csv'.F543]) ->  | G543: of:=IF(ISNUMBER(SEARCH("[0-9]";[.A543]));MID([.A543];1;SEARCH("[0-9]";[.A543])-1);"") -> 
A544: of:=IF(ISBLANK(['BenchBudEE.csv'.A544]);"";['BenchBudEE.csv'.A544]) ->  | B544: of:=IF(ISBLANK(['BenchBudEE.csv'.B544]);"";['BenchBudEE.csv'.B544]) ->  | C544: of:=IF(ISBLANK(['BenchBudEE.csv'.C679]);"";MID(['BenchBudEE.csv'.C679];SEARCH(":";['BenchBudEE.csv'.C679])+1;100)) ->  | D544: of:=IF(ISBLANK(['BenchBudEE.csv'.D544]);"";['BenchBudEE.csv'.D544]) ->  | E544: of:=IF(ISBLANK(['BenchBudEE.csv'.E544]);"";['BenchBudEE.csv'.E544]) ->  | F544: of:=IF(ISBLANK(['BenchBudEE.csv'.F544]);"";['BenchBudEE.csv'.F544]) ->  | G544: of:=IF(ISNUMBER(SEARCH("[0-9]";[.A544]));MID([.A544];1;SEARCH("[0-9]";[.A544])-1);"") -> 
A545: of:=IF(ISBLANK(['BenchBudEE.csv'.A545]);"";['BenchBudEE.csv'.A545]) ->  | B545: of:=IF(ISBLANK(['BenchBudEE.csv'.B545]);"";['BenchBudEE.csv'.B545]) ->  | C545: of:=IF(ISBLANK(['BenchBudEE.csv'.C680]);"";MID(['BenchBudEE.csv'.C680];SEARCH(":";['BenchBudEE.csv'.C680])+1;100)) ->  | D545: of:=IF(ISBLANK(['BenchBudEE.csv'.D545]);"";['BenchBudEE.csv'.D545]) ->  | E545: of:=IF(ISBLANK(['BenchBudEE.csv'.E545]);"";['BenchBudEE.csv'.E545]) ->  | F545: of:=IF(ISBLANK(['BenchBudEE.csv'.F545]);"";['BenchBudEE.csv'.F545]) ->  | G545: of:=IF(ISNUMBER(SEARCH("[0-9]";[.A545]));MID([.A545];1;SEARCH("[0-9]";[.A545])-1);"") -> 
A546: of:=IF(ISBLANK(['BenchBudEE.csv'.A546]);"";['BenchBudEE.csv'.A546]) ->  | B546: of:=IF(ISBLANK(['BenchBudEE.csv'.B546]);"";['BenchBudEE.csv'.B546]) ->  | C546: of:=IF(ISBLANK(['BenchBudEE.csv'.C681]);"";MID(['BenchBudEE.csv'.C681];SEARCH(":";['BenchBudEE.csv'.C681])+1;100)) ->  | D546: of:=IF(ISBLANK(['BenchBudEE.csv'.D546]);"";['BenchBudEE.csv'.D546]) ->  | E546: of:=IF(ISBLANK(['BenchBudEE.csv'.E546]);"";['BenchBudEE.csv'.E546]) ->  | F546: of:=IF(ISBLANK(['BenchBudEE.csv'.F546]);"";['BenchBudEE.csv'.F546]) ->  | G546: of:=IF(ISNUMBER(SEARCH("[0-9]";[.A546]));MID([.A546];1;SEARCH("[0-9]";[.A546])-1);"") -> 
A547: of:=IF(ISBLANK(['BenchBudEE.csv'.A547]);"";['BenchBudEE.csv'.A547]) ->  | B547: of:=IF(ISBLANK(['BenchBudEE.csv'.B547]);"";['BenchBudEE.csv'.B547]) ->  | C547: of:=IF(ISBLANK(['BenchBudEE.csv'.C682]);"";MID(['BenchBudEE.csv'.C682];SEARCH(":";['BenchBudEE.csv'.C682])+1;100)) ->  | D547: of:=IF(ISBLANK(['BenchBudEE.csv'.D547]);"";['BenchBudEE.csv'.D547]) ->  | E547: of:=IF(ISBLANK(['BenchBudEE.csv'.E547]);"";['BenchBudEE.csv'.E547]) ->  | F547: of:=IF(ISBLANK(['BenchBudEE.csv'.F547]);"";['BenchBudEE.csv'.F547]) ->  | G547: of:=IF(ISNUMBER(SEARCH("[0-9]";[.A547]));MID([.A547];1;SEARCH("[0-9]";[.A547])-1);"") -> 
A548: of:=IF(ISBLANK(['BenchBudEE.csv'.A548]);"";['BenchBudEE.csv'.A548]) ->  | B548: of:=IF(ISBLANK(['BenchBudEE.csv'.B548]);"";['BenchBudEE.csv'.B548]) ->  | C548: of:=IF(ISBLANK(['BenchBudEE.csv'.C683]);"";MID(['BenchBudEE.csv'.C683];SEARCH(":";['BenchBudEE.csv'.C683])+1;100)) ->  | D548: of:=IF(ISBLANK(['BenchBudEE.csv'.D548]);"";['BenchBudEE.csv'.D548]) ->  | E548: of:=IF(ISBLANK(['BenchBudEE.csv'.E548]);"";['BenchBudEE.csv'.E548]) ->  | F548: of:=IF(ISBLANK(['BenchBudEE.csv'.F548]);"";['BenchBudEE.csv'.F548]) ->  | G548: of:=IF(ISNUMBER(SEARCH("[0-9]";[.A548]));MID([.A548];1;SEARCH("[0-9]";[.A548])-1);"") -> 
A549: of:=IF(ISBLANK(['BenchBudEE.csv'.A549]);"";['BenchBudEE.csv'.A549]) ->  | B549: of:=IF(ISBLANK(['BenchBudEE.csv'.B549]);"";['BenchBudEE.csv'.B549]) ->  | C549: of:=IF(ISBLANK(['BenchBudEE.csv'.C684]);"";MID(['BenchBudEE.csv'.C684];SEARCH(":";['BenchBudEE.csv'.C684])+1;100)) ->  | D549: of:=IF(ISBLANK(['BenchBudEE.csv'.D549]);"";['BenchBudEE.csv'.D549]) ->  | E549: of:=IF(ISBLANK(['BenchBudEE.csv'.E549]);"";['BenchBudEE.csv'.E549]) ->  | F549: of:=IF(ISBLANK(['BenchBudEE.csv'.F549]);"";['BenchBudEE.csv'.F549]) ->  | G549: of:=IF(ISNUMBER(SEARCH("[0-9]";[.A549]));MID([.A549];1;SEARCH("[0-9]";[.A549])-1);"") -> 
A550: of:=IF(ISBLANK(['BenchBudEE.csv'.A550]);"";['BenchBudEE.csv'.A550]) ->  | B550: of:=IF(ISBLANK(['BenchBudEE.csv'.B550]);"";['BenchBudEE.csv'.B550]) ->  | C550: of:=IF(ISBLANK(['BenchBudEE.csv'.C685]);"";MID(['BenchBudEE.csv'.C685];SEARCH(":";['BenchBudEE.csv'.C685])+1;100)) ->  | D550: of:=IF(ISBLANK(['BenchBudEE.csv'.D550]);"";['BenchBudEE.csv'.D550]) ->  | E550: of:=IF(ISBLANK(['BenchBudEE.csv'.E550]);"";['BenchBudEE.csv'.E550]) ->  | F550: of:=IF(ISBLANK(['BenchBudEE.csv'.F550]);"";['BenchBudEE.csv'.F550]) ->  | G550: of:=IF(ISNUMBER(SEARCH("[0-9]";[.A550]));MID([.A550];1;SEARCH("[0-9]";[.A550])-1);"") -> 
A551: of:=IF(ISBLANK(['BenchBudEE.csv'.A551]);"";['BenchBudEE.csv'.A551]) ->  | B551: of:=IF(ISBLANK(['BenchBudEE.csv'.B551]);"";['BenchBudEE.csv'.B551]) ->  | C551: of:=IF(ISBLANK(['BenchBudEE.csv'.C686]);"";MID(['BenchBudEE.csv'.C686];SEARCH(":";['BenchBudEE.csv'.C686])+1;100)) ->  | D551: of:=IF(ISBLANK(['BenchBudEE.csv'.D551]);"";['BenchBudEE.csv'.D551]) ->  | E551: of:=IF(ISBLANK(['BenchBudEE.csv'.E551]);"";['BenchBudEE.csv'.E551]) ->  | F551: of:=IF(ISBLANK(['BenchBudEE.csv'.F551]);"";['BenchBudEE.csv'.F551]) ->  | G551: of:=IF(ISNUMBER(SEARCH("[0-9]";[.A551]));MID([.A551];1;SEARCH("[0-9]";[.A551])-1);"") -> 
A552: of:=IF(ISBLANK(['BenchBudEE.csv'.A552]);"";['BenchBudEE.csv'.A552]) ->  | B552: of:=IF(ISBLANK(['BenchBudEE.csv'.B552]);"";['BenchBudEE.csv'.B552]) ->  | C552: of:=IF(ISBLANK(['BenchBudEE.csv'.C687]);"";MID(['BenchBudEE.csv'.C687];SEARCH(":";['BenchBudEE.csv'.C687])+1;100)) ->  | D552: of:=IF(ISBLANK(['BenchBudEE.csv'.D552]);"";['BenchBudEE.csv'.D552]) ->  | E552: of:=IF(ISBLANK(['BenchBudEE.csv'.E552]);"";['BenchBudEE.csv'.E552]) ->  | F552: of:=IF(ISBLANK(['BenchBudEE.csv'.F552]);"";['BenchBudEE.csv'.F552]) ->  | G552: of:=IF(ISNUMBER(SEARCH("[0-9]";[.A552]));MID([.A552];1;SEARCH("[0-9]";[.A552])-1);"") -> 
A553: of:=IF(ISBLANK(['BenchBudEE.csv'.A553]);"";['BenchBudEE.csv'.A553]) ->  | B553: of:=IF(ISBLANK(['BenchBudEE.csv'.B553]);"";['BenchBudEE.csv'.B553]) ->  | C553: of:=IF(ISBLANK(['BenchBudEE.csv'.C688]);"";MID(['BenchBudEE.csv'.C688];SEARCH(":";['BenchBudEE.csv'.C688])+1;100)) ->  | D553: of:=IF(ISBLANK(['BenchBudEE.csv'.D553]);"";['BenchBudEE.csv'.D553]) ->  | E553: of:=IF(ISBLANK(['BenchBudEE.csv'.E553]);"";['BenchBudEE.csv'.E553]) ->  | F553: of:=IF(ISBLANK(['BenchBudEE.csv'.F553]);"";['BenchBudEE.csv'.F553]) ->  | G553: of:=IF(ISNUMBER(SEARCH("[0-9]";[.A553]));MID([.A553];1;SEARCH("[0-9]";[.A553])-1);"") -> 
A554: of:=IF(ISBLANK(['BenchBudEE.csv'.A554]);"";['BenchBudEE.csv'.A554]) ->  | B554: of:=IF(ISBLANK(['BenchBudEE.csv'.B554]);"";['BenchBudEE.csv'.B554]) ->  | C554: of:=IF(ISBLANK(['BenchBudEE.csv'.C689]);"";MID(['BenchBudEE.csv'.C689];SEARCH(":";['BenchBudEE.csv'.C689])+1;100)) ->  | D554: of:=IF(ISBLANK(['BenchBudEE.csv'.D554]);"";['BenchBudEE.csv'.D554]) ->  | E554: of:=IF(ISBLANK(['BenchBudEE.csv'.E554]);"";['BenchBudEE.csv'.E554]) ->  | F554: of:=IF(ISBLANK(['BenchBudEE.csv'.F554]);"";['BenchBudEE.csv'.F554]) ->  | G554: of:=IF(ISNUMBER(SEARCH("[0-9]";[.A554]));MID([.A554];1;SEARCH("[0-9]";[.A554])-1);"") -> 
A555: of:=IF(ISBLANK(['BenchBudEE.csv'.A555]);"";['BenchBudEE.csv'.A555]) ->  | B555: of:=IF(ISBLANK(['BenchBudEE.csv'.B555]);"";['BenchBudEE.csv'.B555]) ->  | C555: of:=IF(ISBLANK(['BenchBudEE.csv'.C690]);"";MID(['BenchBudEE.csv'.C690];SEARCH(":";['BenchBudEE.csv'.C690])+1;100)) ->  | D555: of:=IF(ISBLANK(['BenchBudEE.csv'.D555]);"";['BenchBudEE.csv'.D555]) ->  | E555: of:=IF(ISBLANK(['BenchBudEE.csv'.E555]);"";['BenchBudEE.csv'.E555]) ->  | F555: of:=IF(ISBLANK(['BenchBudEE.csv'.F555]);"";['BenchBudEE.csv'.F555]) ->  | G555: of:=IF(ISNUMBER(SEARCH("[0-9]";[.A555]));MID([.A555];1;SEARCH("[0-9]";[.A555])-1);"") -> 
A556: of:=IF(ISBLANK(['BenchBudEE.csv'.A556]);"";['BenchBudEE.csv'.A556]) ->  | B556: of:=IF(ISBLANK(['BenchBudEE.csv'.B556]);"";['BenchBudEE.csv'.B556]) ->  | C556: of:=IF(ISBLANK(['BenchBudEE.csv'.C691]);"";MID(['BenchBudEE.csv'.C691];SEARCH(":";['BenchBudEE.csv'.C691])+1;100)) ->  | D556: of:=IF(ISBLANK(['BenchBudEE.csv'.D556]);"";['BenchBudEE.csv'.D556]) ->  | E556: of:=IF(ISBLANK(['BenchBudEE.csv'.E556]);"";['BenchBudEE.csv'.E556]) ->  | F556: of:=IF(ISBLANK(['BenchBudEE.csv'.F556]);"";['BenchBudEE.csv'.F556]) ->  | G556: of:=IF(ISNUMBER(SEARCH("[0-9]";[.A556]));MID([.A556];1;SEARCH("[0-9]";[.A556])-1);"") -> 
A557: of:=IF(ISBLANK(['BenchBudEE.csv'.A557]);"";['BenchBudEE.csv'.A557]) ->  | B557: of:=IF(ISBLANK(['BenchBudEE.csv'.B557]);"";['BenchBudEE.csv'.B557]) ->  | C557: of:=IF(ISBLANK(['BenchBudEE.csv'.C692]);"";MID(['BenchBudEE.csv'.C692];SEARCH(":";['BenchBudEE.csv'.C692])+1;100)) ->  | D557: of:=IF(ISBLANK(['BenchBudEE.csv'.D557]);"";['BenchBudEE.csv'.D557]) ->  | E557: of:=IF(ISBLANK(['BenchBudEE.csv'.E557]);"";['BenchBudEE.csv'.E557]) ->  | F557: of:=IF(ISBLANK(['BenchBudEE.csv'.F557]);"";['BenchBudEE.csv'.F557]) ->  | G557: of:=IF(ISNUMBER(SEARCH("[0-9]";[.A557]));MID([.A557];1;SEARCH("[0-9]";[.A557])-1);"") -> 
A558: of:=IF(ISBLANK(['BenchBudEE.csv'.A558]);"";['BenchBudEE.csv'.A558]) ->  | B558: of:=IF(ISBLANK(['BenchBudEE.csv'.B558]);"";['BenchBudEE.csv'.B558]) ->  | C558: of:=IF(ISBLANK(['BenchBudEE.csv'.C693]);"";MID(['BenchBudEE.csv'.C693];SEARCH(":";['BenchBudEE.csv'.C693])+1;100)) ->  | D558: of:=IF(ISBLANK(['BenchBudEE.csv'.D558]);"";['BenchBudEE.csv'.D558]) ->  | E558: of:=IF(ISBLANK(['BenchBudEE.csv'.E558]);"";['BenchBudEE.csv'.E558]) ->  | F558: of:=IF(ISBLANK(['BenchBudEE.csv'.F558]);"";['BenchBudEE.csv'.F558]) ->  | G558: of:=IF(ISNUMBER(SEARCH("[0-9]";[.A558]));MID([.A558];1;SEARCH("[0-9]";[.A558])-1);"") -> 
A559: of:=IF(ISBLANK(['BenchBudEE.csv'.A559]);"";['BenchBudEE.csv'.A559]) ->  | B559: of:=IF(ISBLANK(['BenchBudEE.csv'.B559]);"";['BenchBudEE.csv'.B559]) ->  | C559: of:=IF(ISBLANK(['BenchBudEE.csv'.C694]);"";MID(['BenchBudEE.csv'.C694];SEARCH(":";['BenchBudEE.csv'.C694])+1;100)) ->  | D559: of:=IF(ISBLANK(['BenchBudEE.csv'.D559]);"";['BenchBudEE.csv'.D559]) ->  | E559: of:=IF(ISBLANK(['BenchBudEE.csv'.E559]);"";['BenchBudEE.csv'.E559]) ->  | F559: of:=IF(ISBLANK(['BenchBudEE.csv'.F559]);"";['BenchBudEE.csv'.F559]) ->  | G559: of:=IF(ISNUMBER(SEARCH("[0-9]";[.A559]));MID([.A559];1;SEARCH("[0-9]";[.A559])-1);"") -> 
A560: of:=IF(ISBLANK(['BenchBudEE.csv'.A560]);"";['BenchBudEE.csv'.A560]) ->  | B560: of:=IF(ISBLANK(['BenchBudEE.csv'.B560]);"";['BenchBudEE.csv'.B560]) ->  | C560: of:=IF(ISBLANK(['BenchBudEE.csv'.C695]);"";MID(['BenchBudEE.csv'.C695];SEARCH(":";['BenchBudEE.csv'.C695])+1;100)) ->  | D560: of:=IF(ISBLANK(['BenchBudEE.csv'.D560]);"";['BenchBudEE.csv'.D560]) ->  | E560: of:=IF(ISBLANK(['BenchBudEE.csv'.E560]);"";['BenchBudEE.csv'.E560]) ->  | F560: of:=IF(ISBLANK(['BenchBudEE.csv'.F560]);"";['BenchBudEE.csv'.F560]) ->  | G560: of:=IF(ISNUMBER(SEARCH("[0-9]";[.A560]));MID([.A560];1;SEARCH("[0-9]";[.A560])-1);"") -> 
A561: of:=IF(ISBLANK(['BenchBudEE.csv'.A561]);"";['BenchBudEE.csv'.A561]) ->  | B561: of:=IF(ISBLANK(['BenchBudEE.csv'.B561]);"";['BenchBudEE.csv'.B561]) ->  | C561: of:=IF(ISBLANK(['BenchBudEE.csv'.C696]);"";MID(['BenchBudEE.csv'.C696];SEARCH(":";['BenchBudEE.csv'.C696])+1;100)) ->  | D561: of:=IF(ISBLANK(['BenchBudEE.csv'.D561]);"";['BenchBudEE.csv'.D561]) ->  | E561: of:=IF(ISBLANK(['BenchBudEE.csv'.E561]);"";['BenchBudEE.csv'.E561]) ->  | F561: of:=IF(ISBLANK(['BenchBudEE.csv'.F561]);"";['BenchBudEE.csv'.F561]) ->  | G561: of:=IF(ISNUMBER(SEARCH("[0-9]";[.A561]));MID([.A561];1;SEARCH("[0-9]";[.A561])-1);"") -> 
A562: of:=IF(ISBLANK(['BenchBudEE.csv'.A562]);"";['BenchBudEE.csv'.A562]) ->  | B562: of:=IF(ISBLANK(['BenchBudEE.csv'.B562]);"";['BenchBudEE.csv'.B562]) ->  | C562: of:=IF(ISBLANK(['BenchBudEE.csv'.C697]);"";MID(['BenchBudEE.csv'.C697];SEARCH(":";['BenchBudEE.csv'.C697])+1;100)) ->  | D562: of:=IF(ISBLANK(['BenchBudEE.csv'.D562]);"";['BenchBudEE.csv'.D562]) ->  | E562: of:=IF(ISBLANK(['BenchBudEE.csv'.E562]);"";['BenchBudEE.csv'.E562]) ->  | F562: of:=IF(ISBLANK(['BenchBudEE.csv'.F562]);"";['BenchBudEE.csv'.F562]) ->  | G562: of:=IF(ISNUMBER(SEARCH("[0-9]";[.A562]));MID([.A562];1;SEARCH("[0-9]";[.A562])-1);"") -> 
A563: of:=IF(ISBLANK(['BenchBudEE.csv'.A563]);"";['BenchBudEE.csv'.A563]) ->  | B563: of:=IF(ISBLANK(['BenchBudEE.csv'.B563]);"";['BenchBudEE.csv'.B563]) ->  | C563: of:=IF(ISBLANK(['BenchBudEE.csv'.C698]);"";MID(['BenchBudEE.csv'.C698];SEARCH(":";['BenchBudEE.csv'.C698])+1;100)) ->  | D563: of:=IF(ISBLANK(['BenchBudEE.csv'.D563]);"";['BenchBudEE.csv'.D563]) ->  | E563: of:=IF(ISBLANK(['BenchBudEE.csv'.E563]);"";['BenchBudEE.csv'.E563]) ->  | F563: of:=IF(ISBLANK(['BenchBudEE.csv'.F563]);"";['BenchBudEE.csv'.F563]) ->  | G563: of:=IF(ISNUMBER(SEARCH("[0-9]";[.A563]));MID([.A563];1;SEARCH("[0-9]";[.A563])-1);"") -> 
A564: of:=IF(ISBLANK(['BenchBudEE.csv'.A564]);"";['BenchBudEE.csv'.A564]) ->  | B564: of:=IF(ISBLANK(['BenchBudEE.csv'.B564]);"";['BenchBudEE.csv'.B564]) ->  | C564: of:=IF(ISBLANK(['BenchBudEE.csv'.C699]);"";MID(['BenchBudEE.csv'.C699];SEARCH(":";['BenchBudEE.csv'.C699])+1;100)) ->  | D564: of:=IF(ISBLANK(['BenchBudEE.csv'.D564]);"";['BenchBudEE.csv'.D564]) ->  | E564: of:=IF(ISBLANK(['BenchBudEE.csv'.E564]);"";['BenchBudEE.csv'.E564]) ->  | F564: of:=IF(ISBLANK(['BenchBudEE.csv'.F564]);"";['BenchBudEE.csv'.F564]) ->  | G564: of:=IF(ISNUMBER(SEARCH("[0-9]";[.A564]));MID([.A564];1;SEARCH("[0-9]";[.A564])-1);"") -> 
A565: of:=IF(ISBLANK(['BenchBudEE.csv'.A565]);"";['BenchBudEE.csv'.A565]) ->  | B565: of:=IF(ISBLANK(['BenchBudEE.csv'.B565]);"";['BenchBudEE.csv'.B565]) ->  | C565: of:=IF(ISBLANK(['BenchBudEE.csv'.C700]);"";MID(['BenchBudEE.csv'.C700];SEARCH(":";['BenchBudEE.csv'.C700])+1;100)) ->  | D565: of:=IF(ISBLANK(['BenchBudEE.csv'.D565]);"";['BenchBudEE.csv'.D565]) ->  | E565: of:=IF(ISBLANK(['BenchBudEE.csv'.E565]);"";['BenchBudEE.csv'.E565]) ->  | F565: of:=IF(ISBLANK(['BenchBudEE.csv'.F565]);"";['BenchBudEE.csv'.F565]) ->  | G565: of:=IF(ISNUMBER(SEARCH("[0-9]";[.A565]));MID([.A565];1;SEARCH("[0-9]";[.A565])-1);"") -> 
A566: of:=IF(ISBLANK(['BenchBudEE.csv'.A566]);"";['BenchBudEE.csv'.A566]) ->  | B566: of:=IF(ISBLANK(['BenchBudEE.csv'.B566]);"";['BenchBudEE.csv'.B566]) ->  | C566: of:=IF(ISBLANK(['BenchBudEE.csv'.C701]);"";MID(['BenchBudEE.csv'.C701];SEARCH(":";['BenchBudEE.csv'.C701])+1;100)) ->  | D566: of:=IF(ISBLANK(['BenchBudEE.csv'.D566]);"";['BenchBudEE.csv'.D566]) ->  | E566: of:=IF(ISBLANK(['BenchBudEE.csv'.E566]);"";['BenchBudEE.csv'.E566]) ->  | F566: of:=IF(ISBLANK(['BenchBudEE.csv'.F566]);"";['BenchBudEE.csv'.F566]) ->  | G566: of:=IF(ISNUMBER(SEARCH("[0-9]";[.A566]));MID([.A566];1;SEARCH("[0-9]";[.A566])-1);"") -> 
A567: of:=IF(ISBLANK(['BenchBudEE.csv'.A567]);"";['BenchBudEE.csv'.A567]) ->  | B567: of:=IF(ISBLANK(['BenchBudEE.csv'.B567]);"";['BenchBudEE.csv'.B567]) ->  | C567: of:=IF(ISBLANK(['BenchBudEE.csv'.C702]);"";MID(['BenchBudEE.csv'.C702];SEARCH(":";['BenchBudEE.csv'.C702])+1;100)) ->  | D567: of:=IF(ISBLANK(['BenchBudEE.csv'.D567]);"";['BenchBudEE.csv'.D567]) ->  | E567: of:=IF(ISBLANK(['BenchBudEE.csv'.E567]);"";['BenchBudEE.csv'.E567]) ->  | F567: of:=IF(ISBLANK(['BenchBudEE.csv'.F567]);"";['BenchBudEE.csv'.F567]) ->  | G567: of:=IF(ISNUMBER(SEARCH("[0-9]";[.A567]));MID([.A567];1;SEARCH("[0-9]";[.A567])-1);"") -> 
A568: of:=IF(ISBLANK(['BenchBudEE.csv'.A568]);"";['BenchBudEE.csv'.A568]) ->  | B568: of:=IF(ISBLANK(['BenchBudEE.csv'.B568]);"";['BenchBudEE.csv'.B568]) ->  | C568: of:=IF(ISBLANK(['BenchBudEE.csv'.C703]);"";MID(['BenchBudEE.csv'.C703];SEARCH(":";['BenchBudEE.csv'.C703])+1;100)) ->  | D568: of:=IF(ISBLANK(['BenchBudEE.csv'.D568]);"";['BenchBudEE.csv'.D568]) ->  | E568: of:=IF(ISBLANK(['BenchBudEE.csv'.E568]);"";['BenchBudEE.csv'.E568]) ->  | F568: of:=IF(ISBLANK(['BenchBudEE.csv'.F568]);"";['BenchBudEE.csv'.F568]) ->  | G568: of:=IF(ISNUMBER(SEARCH("[0-9]";[.A568]));MID([.A568];1;SEARCH("[0-9]";[.A568])-1);"") -> 
A569: of:=IF(ISBLANK(['BenchBudEE.csv'.A569]);"";['BenchBudEE.csv'.A569]) ->  | B569: of:=IF(ISBLANK(['BenchBudEE.csv'.B569]);"";['BenchBudEE.csv'.B569]) ->  | C569: of:=IF(ISBLANK(['BenchBudEE.csv'.C704]);"";MID(['BenchBudEE.csv'.C704];SEARCH(":";['BenchBudEE.csv'.C704])+1;100)) ->  | D569: of:=IF(ISBLANK(['BenchBudEE.csv'.D569]);"";['BenchBudEE.csv'.D569]) ->  | E569: of:=IF(ISBLANK(['BenchBudEE.csv'.E569]);"";['BenchBudEE.csv'.E569]) ->  | F569: of:=IF(ISBLANK(['BenchBudEE.csv'.F569]);"";['BenchBudEE.csv'.F569]) ->  | G569: of:=IF(ISNUMBER(SEARCH("[0-9]";[.A569]));MID([.A569];1;SEARCH("[0-9]";[.A569])-1);"") -> 
A570: of:=IF(ISBLANK(['BenchBudEE.csv'.A570]);"";['BenchBudEE.csv'.A570]) ->  | B570: of:=IF(ISBLANK(['BenchBudEE.csv'.B570]);"";['BenchBudEE.csv'.B570]) ->  | C570: of:=IF(ISBLANK(['BenchBudEE.csv'.C705]);"";MID(['BenchBudEE.csv'.C705];SEARCH(":";['BenchBudEE.csv'.C705])+1;100)) ->  | D570: of:=IF(ISBLANK(['BenchBudEE.csv'.D570]);"";['BenchBudEE.csv'.D570]) ->  | E570: of:=IF(ISBLANK(['BenchBudEE.csv'.E570]);"";['BenchBudEE.csv'.E570]) ->  | F570: of:=IF(ISBLANK(['BenchBudEE.csv'.F570]);"";['BenchBudEE.csv'.F570]) ->  | G570: of:=IF(ISNUMBER(SEARCH("[0-9]";[.A570]));MID([.A570];1;SEARCH("[0-9]";[.A570])-1);"") -> 
A571: of:=IF(ISBLANK(['BenchBudEE.csv'.A571]);"";['BenchBudEE.csv'.A571]) ->  | B571: of:=IF(ISBLANK(['BenchBudEE.csv'.B571]);"";['BenchBudEE.csv'.B571]) ->  | C571: of:=IF(ISBLANK(['BenchBudEE.csv'.C706]);"";MID(['BenchBudEE.csv'.C706];SEARCH(":";['BenchBudEE.csv'.C706])+1;100)) ->  | D571: of:=IF(ISBLANK(['BenchBudEE.csv'.D571]);"";['BenchBudEE.csv'.D571]) ->  | E571: of:=IF(ISBLANK(['BenchBudEE.csv'.E571]);"";['BenchBudEE.csv'.E571]) ->  | F571: of:=IF(ISBLANK(['BenchBudEE.csv'.F571]);"";['BenchBudEE.csv'.F571]) ->  | G571: of:=IF(ISNUMBER(SEARCH("[0-9]";[.A571]));MID([.A571];1;SEARCH("[0-9]";[.A571])-1);"") -> 
A572: of:=IF(ISBLANK(['BenchBudEE.csv'.A572]);"";['BenchBudEE.csv'.A572]) ->  | B572: of:=IF(ISBLANK(['BenchBudEE.csv'.B572]);"";['BenchBudEE.csv'.B572]) ->  | C572: of:=IF(ISBLANK(['BenchBudEE.csv'.C707]);"";MID(['BenchBudEE.csv'.C707];SEARCH(":";['BenchBudEE.csv'.C707])+1;100)) ->  | D572: of:=IF(ISBLANK(['BenchBudEE.csv'.D572]);"";['BenchBudEE.csv'.D572]) ->  | E572: of:=IF(ISBLANK(['BenchBudEE.csv'.E572]);"";['BenchBudEE.csv'.E572]) ->  | F572: of:=IF(ISBLANK(['BenchBudEE.csv'.F572]);"";['BenchBudEE.csv'.F572]) ->  | G572: of:=IF(ISNUMBER(SEARCH("[0-9]";[.A572]));MID([.A572];1;SEARCH("[0-9]";[.A572])-1);"") -> 
A573: of:=IF(ISBLANK(['BenchBudEE.csv'.A573]);"";['BenchBudEE.csv'.A573]) ->  | B573: of:=IF(ISBLANK(['BenchBudEE.csv'.B573]);"";['BenchBudEE.csv'.B573]) ->  | C573: of:=IF(ISBLANK(['BenchBudEE.csv'.C708]);"";MID(['BenchBudEE.csv'.C708];SEARCH(":";['BenchBudEE.csv'.C708])+1;100)) ->  | D573: of:=IF(ISBLANK(['BenchBudEE.csv'.D573]);"";['BenchBudEE.csv'.D573]) ->  | E573: of:=IF(ISBLANK(['BenchBudEE.csv'.E573]);"";['BenchBudEE.csv'.E573]) ->  | F573: of:=IF(ISBLANK(['BenchBudEE.csv'.F573]);"";['BenchBudEE.csv'.F573]) ->  | G573: of:=IF(ISNUMBER(SEARCH("[0-9]";[.A573]));MID([.A573];1;SEARCH("[0-9]";[.A573])-1);"") -> 
A574: of:=IF(ISBLANK(['BenchBudEE.csv'.A574]);"";['BenchBudEE.csv'.A574]) ->  | B574: of:=IF(ISBLANK(['BenchBudEE.csv'.B574]);"";['BenchBudEE.csv'.B574]) ->  | C574: of:=IF(ISBLANK(['BenchBudEE.csv'.C709]);"";MID(['BenchBudEE.csv'.C709];SEARCH(":";['BenchBudEE.csv'.C709])+1;100)) ->  | D574: of:=IF(ISBLANK(['BenchBudEE.csv'.D574]);"";['BenchBudEE.csv'.D574]) ->  | E574: of:=IF(ISBLANK(['BenchBudEE.csv'.E574]);"";['BenchBudEE.csv'.E574]) ->  | F574: of:=IF(ISBLANK(['BenchBudEE.csv'.F574]);"";['BenchBudEE.csv'.F574]) ->  | G574: of:=IF(ISNUMBER(SEARCH("[0-9]";[.A574]));MID([.A574];1;SEARCH("[0-9]";[.A574])-1);"") -> 
A575: of:=IF(ISBLANK(['BenchBudEE.csv'.A575]);"";['BenchBudEE.csv'.A575]) ->  | B575: of:=IF(ISBLANK(['BenchBudEE.csv'.B575]);"";['BenchBudEE.csv'.B575]) ->  | C575: of:=IF(ISBLANK(['BenchBudEE.csv'.C710]);"";MID(['BenchBudEE.csv'.C710];SEARCH(":";['BenchBudEE.csv'.C710])+1;100)) ->  | D575: of:=IF(ISBLANK(['BenchBudEE.csv'.D575]);"";['BenchBudEE.csv'.D575]) ->  | E575: of:=IF(ISBLANK(['BenchBudEE.csv'.E575]);"";['BenchBudEE.csv'.E575]) ->  | F575: of:=IF(ISBLANK(['BenchBudEE.csv'.F575]);"";['BenchBudEE.csv'.F575]) ->  | G575: of:=IF(ISNUMBER(SEARCH("[0-9]";[.A575]));MID([.A575];1;SEARCH("[0-9]";[.A575])-1);"") -> 
A576: of:=IF(ISBLANK(['BenchBudEE.csv'.A576]);"";['BenchBudEE.csv'.A576]) ->  | B576: of:=IF(ISBLANK(['BenchBudEE.csv'.B576]);"";['BenchBudEE.csv'.B576]) ->  | C576: of:=IF(ISBLANK(['BenchBudEE.csv'.C711]);"";MID(['BenchBudEE.csv'.C711];SEARCH(":";['BenchBudEE.csv'.C711])+1;100)) ->  | D576: of:=IF(ISBLANK(['BenchBudEE.csv'.D576]);"";['BenchBudEE.csv'.D576]) ->  | E576: of:=IF(ISBLANK(['BenchBudEE.csv'.E576]);"";['BenchBudEE.csv'.E576]) ->  | F576: of:=IF(ISBLANK(['BenchBudEE.csv'.F576]);"";['BenchBudEE.csv'.F576]) ->  | G576: of:=IF(ISNUMBER(SEARCH("[0-9]";[.A576]));MID([.A576];1;SEARCH("[0-9]";[.A576])-1);"") -> 
A577: of:=IF(ISBLANK(['BenchBudEE.csv'.A577]);"";['BenchBudEE.csv'.A577]) ->  | B577: of:=IF(ISBLANK(['BenchBudEE.csv'.B577]);"";['BenchBudEE.csv'.B577]) ->  | C577: of:=IF(ISBLANK(['BenchBudEE.csv'.C712]);"";MID(['BenchBudEE.csv'.C712];SEARCH(":";['BenchBudEE.csv'.C712])+1;100)) ->  | D577: of:=IF(ISBLANK(['BenchBudEE.csv'.D577]);"";['BenchBudEE.csv'.D577]) ->  | E577: of:=IF(ISBLANK(['BenchBudEE.csv'.E577]);"";['BenchBudEE.csv'.E577]) ->  | F577: of:=IF(ISBLANK(['BenchBudEE.csv'.F577]);"";['BenchBudEE.csv'.F577]) ->  | G577: of:=IF(ISNUMBER(SEARCH("[0-9]";[.A577]));MID([.A577];1;SEARCH("[0-9]";[.A577])-1);"") -> 
A578: of:=IF(ISBLANK(['BenchBudEE.csv'.A578]);"";['BenchBudEE.csv'.A578]) ->  | B578: of:=IF(ISBLANK(['BenchBudEE.csv'.B578]);"";['BenchBudEE.csv'.B578]) ->  | C578: of:=IF(ISBLANK(['BenchBudEE.csv'.C713]);"";MID(['BenchBudEE.csv'.C713];SEARCH(":";['BenchBudEE.csv'.C713])+1;100)) ->  | D578: of:=IF(ISBLANK(['BenchBudEE.csv'.D578]);"";['BenchBudEE.csv'.D578]) ->  | E578: of:=IF(ISBLANK(['BenchBudEE.csv'.E578]);"";['BenchBudEE.csv'.E578]) ->  | F578: of:=IF(ISBLANK(['BenchBudEE.csv'.F578]);"";['BenchBudEE.csv'.F578]) ->  | G578: of:=IF(ISNUMBER(SEARCH("[0-9]";[.A578]));MID([.A578];1;SEARCH("[0-9]";[.A578])-1);"") -> 
A579: of:=IF(ISBLANK(['BenchBudEE.csv'.A579]);"";['BenchBudEE.csv'.A579]) ->  | B579: of:=IF(ISBLANK(['BenchBudEE.csv'.B579]);"";['BenchBudEE.csv'.B579]) ->  | C579: of:=IF(ISBLANK(['BenchBudEE.csv'.C714]);"";MID(['BenchBudEE.csv'.C714];SEARCH(":";['BenchBudEE.csv'.C714])+1;100)) ->  | D579: of:=IF(ISBLANK(['BenchBudEE.csv'.D579]);"";['BenchBudEE.csv'.D579]) ->  | E579: of:=IF(ISBLANK(['BenchBudEE.csv'.E579]);"";['BenchBudEE.csv'.E579]) ->  | F579: of:=IF(ISBLANK(['BenchBudEE.csv'.F579]);"";['BenchBudEE.csv'.F579]) ->  | G579: of:=IF(ISNUMBER(SEARCH("[0-9]";[.A579]));MID([.A579];1;SEARCH("[0-9]";[.A579])-1);"") -> 
A580: of:=IF(ISBLANK(['BenchBudEE.csv'.A580]);"";['BenchBudEE.csv'.A580]) ->  | B580: of:=IF(ISBLANK(['BenchBudEE.csv'.B580]);"";['BenchBudEE.csv'.B580]) ->  | C580: of:=IF(ISBLANK(['BenchBudEE.csv'.C715]);"";MID(['BenchBudEE.csv'.C715];SEARCH(":";['BenchBudEE.csv'.C715])+1;100)) ->  | D580: of:=IF(ISBLANK(['BenchBudEE.csv'.D580]);"";['BenchBudEE.csv'.D580]) ->  | E580: of:=IF(ISBLANK(['BenchBudEE.csv'.E580]);"";['BenchBudEE.csv'.E580]) ->  | F580: of:=IF(ISBLANK(['BenchBudEE.csv'.F580]);"";['BenchBudEE.csv'.F580]) ->  | G580: of:=IF(ISNUMBER(SEARCH("[0-9]";[.A580]));MID([.A580];1;SEARCH("[0-9]";[.A580])-1);"") -> 
A581: of:=IF(ISBLANK(['BenchBudEE.csv'.A581]);"";['BenchBudEE.csv'.A581]) ->  | B581: of:=IF(ISBLANK(['BenchBudEE.csv'.B581]);"";['BenchBudEE.csv'.B581]) ->  | C581: of:=IF(ISBLANK(['BenchBudEE.csv'.C716]);"";MID(['BenchBudEE.csv'.C716];SEARCH(":";['BenchBudEE.csv'.C716])+1;100)) ->  | D581: of:=IF(ISBLANK(['BenchBudEE.csv'.D581]);"";['BenchBudEE.csv'.D581]) ->  | E581: of:=IF(ISBLANK(['BenchBudEE.csv'.E581]);"";['BenchBudEE.csv'.E581]) ->  | F581: of:=IF(ISBLANK(['BenchBudEE.csv'.F581]);"";['BenchBudEE.csv'.F581]) ->  | G581: of:=IF(ISNUMBER(SEARCH("[0-9]";[.A581]));MID([.A581];1;SEARCH("[0-9]";[.A581])-1);"") -> 
A582: of:=IF(ISBLANK(['BenchBudEE.csv'.A582]);"";['BenchBudEE.csv'.A582]) ->  | B582: of:=IF(ISBLANK(['BenchBudEE.csv'.B582]);"";['BenchBudEE.csv'.B582]) ->  | C582: of:=IF(ISBLANK(['BenchBudEE.csv'.C717]);"";MID(['BenchBudEE.csv'.C717];SEARCH(":";['BenchBudEE.csv'.C717])+1;100)) ->  | D582: of:=IF(ISBLANK(['BenchBudEE.csv'.D582]);"";['BenchBudEE.csv'.D582]) ->  | E582: of:=IF(ISBLANK(['BenchBudEE.csv'.E582]);"";['BenchBudEE.csv'.E582]) ->  | F582: of:=IF(ISBLANK(['BenchBudEE.csv'.F582]);"";['BenchBudEE.csv'.F582]) ->  | G582: of:=IF(ISNUMBER(SEARCH("[0-9]";[.A582]));MID([.A582];1;SEARCH("[0-9]";[.A582])-1);"") -> 
A583: of:=IF(ISBLANK(['BenchBudEE.csv'.A583]);"";['BenchBudEE.csv'.A583]) ->  | B583: of:=IF(ISBLANK(['BenchBudEE.csv'.B583]);"";['BenchBudEE.csv'.B583]) ->  | C583: of:=IF(ISBLANK(['BenchBudEE.csv'.C718]);"";MID(['BenchBudEE.csv'.C718];SEARCH(":";['BenchBudEE.csv'.C718])+1;100)) ->  | D583: of:=IF(ISBLANK(['BenchBudEE.csv'.D583]);"";['BenchBudEE.csv'.D583]) ->  | E583: of:=IF(ISBLANK(['BenchBudEE.csv'.E583]);"";['BenchBudEE.csv'.E583]) ->  | F583: of:=IF(ISBLANK(['BenchBudEE.csv'.F583]);"";['BenchBudEE.csv'.F583]) ->  | G583: of:=IF(ISNUMBER(SEARCH("[0-9]";[.A583]));MID([.A583];1;SEARCH("[0-9]";[.A583])-1);"") -> 
A584: of:=IF(ISBLANK(['BenchBudEE.csv'.A584]);"";['BenchBudEE.csv'.A584]) ->  | B584: of:=IF(ISBLANK(['BenchBudEE.csv'.B584]);"";['BenchBudEE.csv'.B584]) ->  | C584: of:=IF(ISBLANK(['BenchBudEE.csv'.C719]);"";MID(['BenchBudEE.csv'.C719];SEARCH(":";['BenchBudEE.csv'.C719])+1;100)) ->  | D584: of:=IF(ISBLANK(['BenchBudEE.csv'.D584]);"";['BenchBudEE.csv'.D584]) ->  | E584: of:=IF(ISBLANK(['BenchBudEE.csv'.E584]);"";['BenchBudEE.csv'.E584]) ->  | F584: of:=IF(ISBLANK(['BenchBudEE.csv'.F584]);"";['BenchBudEE.csv'.F584]) ->  | G584: of:=IF(ISNUMBER(SEARCH("[0-9]";[.A584]));MID([.A584];1;SEARCH("[0-9]";[.A584])-1);"") -> 
A585: of:=IF(ISBLANK(['BenchBudEE.csv'.A585]);"";['BenchBudEE.csv'.A585]) ->  | B585: of:=IF(ISBLANK(['BenchBudEE.csv'.B585]);"";['BenchBudEE.csv'.B585]) ->  | C585: of:=IF(ISBLANK(['BenchBudEE.csv'.C720]);"";MID(['BenchBudEE.csv'.C720];SEARCH(":";['BenchBudEE.csv'.C720])+1;100)) ->  | D585: of:=IF(ISBLANK(['BenchBudEE.csv'.D585]);"";['BenchBudEE.csv'.D585]) ->  | E585: of:=IF(ISBLANK(['BenchBudEE.csv'.E585]);"";['BenchBudEE.csv'.E585]) ->  | F585: of:=IF(ISBLANK(['BenchBudEE.csv'.F585]);"";['BenchBudEE.csv'.F585]) ->  | G585: of:=IF(ISNUMBER(SEARCH("[0-9]";[.A585]));MID([.A585];1;SEARCH("[0-9]";[.A585])-1);"") -> 
A586: of:=IF(ISBLANK(['BenchBudEE.csv'.A586]);"";['BenchBudEE.csv'.A586]) ->  | B586: of:=IF(ISBLANK(['BenchBudEE.csv'.B586]);"";['BenchBudEE.csv'.B586]) ->  | C586: of:=IF(ISBLANK(['BenchBudEE.csv'.C721]);"";MID(['BenchBudEE.csv'.C721];SEARCH(":";['BenchBudEE.csv'.C721])+1;100)) ->  | D586: of:=IF(ISBLANK(['BenchBudEE.csv'.D586]);"";['BenchBudEE.csv'.D586]) ->  | E586: of:=IF(ISBLANK(['BenchBudEE.csv'.E586]);"";['BenchBudEE.csv'.E586]) ->  | F586: of:=IF(ISBLANK(['BenchBudEE.csv'.F586]);"";['BenchBudEE.csv'.F586]) ->  | G586: of:=IF(ISNUMBER(SEARCH("[0-9]";[.A586]));MID([.A586];1;SEARCH("[0-9]";[.A586])-1);"") -> 
A587: of:=IF(ISBLANK(['BenchBudEE.csv'.A587]);"";['BenchBudEE.csv'.A587]) ->  | B587: of:=IF(ISBLANK(['BenchBudEE.csv'.B587]);"";['BenchBudEE.csv'.B587]) ->  | C587: of:=IF(ISBLANK(['BenchBudEE.csv'.C722]);"";MID(['BenchBudEE.csv'.C722];SEARCH(":";['BenchBudEE.csv'.C722])+1;100)) ->  | D587: of:=IF(ISBLANK(['BenchBudEE.csv'.D587]);"";['BenchBudEE.csv'.D587]) ->  | E587: of:=IF(ISBLANK(['BenchBudEE.csv'.E587]);"";['BenchBudEE.csv'.E587]) ->  | F587: of:=IF(ISBLANK(['BenchBudEE.csv'.F587]);"";['BenchBudEE.csv'.F587]) ->  | G587: of:=IF(ISNUMBER(SEARCH("[0-9]";[.A587]));MID([.A587];1;SEARCH("[0-9]";[.A587])-1);"") -> 
A588: of:=IF(ISBLANK(['BenchBudEE.csv'.A588]);"";['BenchBudEE.csv'.A588]) ->  | B588: of:=IF(ISBLANK(['BenchBudEE.csv'.B588]);"";['BenchBudEE.csv'.B588]) ->  | C588: of:=IF(ISBLANK(['BenchBudEE.csv'.C723]);"";MID(['BenchBudEE.csv'.C723];SEARCH(":";['BenchBudEE.csv'.C723])+1;100)) ->  | D588: of:=IF(ISBLANK(['BenchBudEE.csv'.D588]);"";['BenchBudEE.csv'.D588]) ->  | E588: of:=IF(ISBLANK(['BenchBudEE.csv'.E588]);"";['BenchBudEE.csv'.E588]) ->  | F588: of:=IF(ISBLANK(['BenchBudEE.csv'.F588]);"";['BenchBudEE.csv'.F588]) ->  | G588: of:=IF(ISNUMBER(SEARCH("[0-9]";[.A588]));MID([.A588];1;SEARCH("[0-9]";[.A588])-1);"") -> 
A589: of:=IF(ISBLANK(['BenchBudEE.csv'.A589]);"";['BenchBudEE.csv'.A589]) ->  | B589: of:=IF(ISBLANK(['BenchBudEE.csv'.B589]);"";['BenchBudEE.csv'.B589]) ->  | C589: of:=IF(ISBLANK(['BenchBudEE.csv'.C724]);"";MID(['BenchBudEE.csv'.C724];SEARCH(":";['BenchBudEE.csv'.C724])+1;100)) ->  | D589: of:=IF(ISBLANK(['BenchBudEE.csv'.D589]);"";['BenchBudEE.csv'.D589]) ->  | E589: of:=IF(ISBLANK(['BenchBudEE.csv'.E589]);"";['BenchBudEE.csv'.E589]) ->  | F589: of:=IF(ISBLANK(['BenchBudEE.csv'.F589]);"";['BenchBudEE.csv'.F589]) ->  | G589: of:=IF(ISNUMBER(SEARCH("[0-9]";[.A589]));MID([.A589];1;SEARCH("[0-9]";[.A589])-1);"") -> 
A590: of:=IF(ISBLANK(['BenchBudEE.csv'.A590]);"";['BenchBudEE.csv'.A590]) ->  | B590: of:=IF(ISBLANK(['BenchBudEE.csv'.B590]);"";['BenchBudEE.csv'.B590]) ->  | C590: of:=IF(ISBLANK(['BenchBudEE.csv'.C725]);"";MID(['BenchBudEE.csv'.C725];SEARCH(":";['BenchBudEE.csv'.C725])+1;100)) ->  | D590: of:=IF(ISBLANK(['BenchBudEE.csv'.D590]);"";['BenchBudEE.csv'.D590]) ->  | E590: of:=IF(ISBLANK(['BenchBudEE.csv'.E590]);"";['BenchBudEE.csv'.E590]) ->  | F590: of:=IF(ISBLANK(['BenchBudEE.csv'.F590]);"";['BenchBudEE.csv'.F590]) ->  | G590: of:=IF(ISNUMBER(SEARCH("[0-9]";[.A590]));MID([.A590];1;SEARCH("[0-9]";[.A590])-1);"") -> 
A591: of:=IF(ISBLANK(['BenchBudEE.csv'.A591]);"";['BenchBudEE.csv'.A591]) ->  | B591: of:=IF(ISBLANK(['BenchBudEE.csv'.B591]);"";['BenchBudEE.csv'.B591]) ->  | C591: of:=IF(ISBLANK(['BenchBudEE.csv'.C726]);"";MID(['BenchBudEE.csv'.C726];SEARCH(":";['BenchBudEE.csv'.C726])+1;100)) ->  | D591: of:=IF(ISBLANK(['BenchBudEE.csv'.D591]);"";['BenchBudEE.csv'.D591]) ->  | E591: of:=IF(ISBLANK(['BenchBudEE.csv'.E591]);"";['BenchBudEE.csv'.E591]) ->  | F591: of:=IF(ISBLANK(['BenchBudEE.csv'.F591]);"";['BenchBudEE.csv'.F591]) ->  | G591: of:=IF(ISNUMBER(SEARCH("[0-9]";[.A591]));MID([.A591];1;SEARCH("[0-9]";[.A591])-1);"") -> 
A592: of:=IF(ISBLANK(['BenchBudEE.csv'.A592]);"";['BenchBudEE.csv'.A592]) ->  | B592: of:=IF(ISBLANK(['BenchBudEE.csv'.B592]);"";['BenchBudEE.csv'.B592]) ->  | C592: of:=IF(ISBLANK(['BenchBudEE.csv'.C727]);"";MID(['BenchBudEE.csv'.C727];SEARCH(":";['BenchBudEE.csv'.C727])+1;100)) ->  | D592: of:=IF(ISBLANK(['BenchBudEE.csv'.D592]);"";['BenchBudEE.csv'.D592]) ->  | E592: of:=IF(ISBLANK(['BenchBudEE.csv'.E592]);"";['BenchBudEE.csv'.E592]) ->  | F592: of:=IF(ISBLANK(['BenchBudEE.csv'.F592]);"";['BenchBudEE.csv'.F592]) ->  | G592: of:=IF(ISNUMBER(SEARCH("[0-9]";[.A592]));MID([.A592];1;SEARCH("[0-9]";[.A592])-1);"") -> 
A593: of:=IF(ISBLANK(['BenchBudEE.csv'.A593]);"";['BenchBudEE.csv'.A593]) ->  | B593: of:=IF(ISBLANK(['BenchBudEE.csv'.B593]);"";['BenchBudEE.csv'.B593]) ->  | C593: of:=IF(ISBLANK(['BenchBudEE.csv'.C728]);"";MID(['BenchBudEE.csv'.C728];SEARCH(":";['BenchBudEE.csv'.C728])+1;100)) ->  | D593: of:=IF(ISBLANK(['BenchBudEE.csv'.D593]);"";['BenchBudEE.csv'.D593]) ->  | E593: of:=IF(ISBLANK(['BenchBudEE.csv'.E593]);"";['BenchBudEE.csv'.E593]) ->  | F593: of:=IF(ISBLANK(['BenchBudEE.csv'.F593]);"";['BenchBudEE.csv'.F593]) ->  | G593: of:=IF(ISNUMBER(SEARCH("[0-9]";[.A593]));MID([.A593];1;SEARCH("[0-9]";[.A593])-1);"") -> 
A594: of:=IF(ISBLANK(['BenchBudEE.csv'.A594]);"";['BenchBudEE.csv'.A594]) ->  | B594: of:=IF(ISBLANK(['BenchBudEE.csv'.B594]);"";['BenchBudEE.csv'.B594]) ->  | C594: of:=IF(ISBLANK(['BenchBudEE.csv'.C729]);"";MID(['BenchBudEE.csv'.C729];SEARCH(":";['BenchBudEE.csv'.C729])+1;100)) ->  | D594: of:=IF(ISBLANK(['BenchBudEE.csv'.D594]);"";['BenchBudEE.csv'.D594]) ->  | E594: of:=IF(ISBLANK(['BenchBudEE.csv'.E594]);"";['BenchBudEE.csv'.E594]) ->  | F594: of:=IF(ISBLANK(['BenchBudEE.csv'.F594]);"";['BenchBudEE.csv'.F594]) ->  | G594: of:=IF(ISNUMBER(SEARCH("[0-9]";[.A594]));MID([.A594];1;SEARCH("[0-9]";[.A594])-1);"") -> 
A595: of:=IF(ISBLANK(['BenchBudEE.csv'.A595]);"";['BenchBudEE.csv'.A595]) ->  | B595: of:=IF(ISBLANK(['BenchBudEE.csv'.B595]);"";['BenchBudEE.csv'.B595]) ->  | C595: of:=IF(ISBLANK(['BenchBudEE.csv'.C730]);"";MID(['BenchBudEE.csv'.C730];SEARCH(":";['BenchBudEE.csv'.C730])+1;100)) ->  | D595: of:=IF(ISBLANK(['BenchBudEE.csv'.D595]);"";['BenchBudEE.csv'.D595]) ->  | E595: of:=IF(ISBLANK(['BenchBudEE.csv'.E595]);"";['BenchBudEE.csv'.E595]) ->  | F595: of:=IF(ISBLANK(['BenchBudEE.csv'.F595]);"";['BenchBudEE.csv'.F595]) ->  | G595: of:=IF(ISNUMBER(SEARCH("[0-9]";[.A595]));MID([.A595];1;SEARCH("[0-9]";[.A595])-1);"") -> 
A596: of:=IF(ISBLANK(['BenchBudEE.csv'.A596]);"";['BenchBudEE.csv'.A596]) ->  | B596: of:=IF(ISBLANK(['BenchBudEE.csv'.B596]);"";['BenchBudEE.csv'.B596]) ->  | C596: of:=IF(ISBLANK(['BenchBudEE.csv'.C731]);"";MID(['BenchBudEE.csv'.C731];SEARCH(":";['BenchBudEE.csv'.C731])+1;100)) ->  | D596: of:=IF(ISBLANK(['BenchBudEE.csv'.D596]);"";['BenchBudEE.csv'.D596]) ->  | E596: of:=IF(ISBLANK(['BenchBudEE.csv'.E596]);"";['BenchBudEE.csv'.E596]) ->  | F596: of:=IF(ISBLANK(['BenchBudEE.csv'.F596]);"";['BenchBudEE.csv'.F596]) ->  | G596: of:=IF(ISNUMBER(SEARCH("[0-9]";[.A596]));MID([.A596];1;SEARCH("[0-9]";[.A596])-1);"") -> 
A597: of:=IF(ISBLANK(['BenchBudEE.csv'.A597]);"";['BenchBudEE.csv'.A597]) ->  | B597: of:=IF(ISBLANK(['BenchBudEE.csv'.B597]);"";['BenchBudEE.csv'.B597]) ->  | C597: of:=IF(ISBLANK(['BenchBudEE.csv'.C732]);"";MID(['BenchBudEE.csv'.C732];SEARCH(":";['BenchBudEE.csv'.C732])+1;100)) ->  | D597: of:=IF(ISBLANK(['BenchBudEE.csv'.D597]);"";['BenchBudEE.csv'.D597]) ->  | E597: of:=IF(ISBLANK(['BenchBudEE.csv'.E597]);"";['BenchBudEE.csv'.E597]) ->  | F597: of:=IF(ISBLANK(['BenchBudEE.csv'.F597]);"";['BenchBudEE.csv'.F597]) ->  | G597: of:=IF(ISNUMBER(SEARCH("[0-9]";[.A597]));MID([.A597];1;SEARCH("[0-9]";[.A597])-1);"") -> 
A598: of:=IF(ISBLANK(['BenchBudEE.csv'.A598]);"";['BenchBudEE.csv'.A598]) ->  | B598: of:=IF(ISBLANK(['BenchBudEE.csv'.B598]);"";['BenchBudEE.csv'.B598]) ->  | C598: of:=IF(ISBLANK(['BenchBudEE.csv'.C733]);"";MID(['BenchBudEE.csv'.C733];SEARCH(":";['BenchBudEE.csv'.C733])+1;100)) ->  | D598: of:=IF(ISBLANK(['BenchBudEE.csv'.D598]);"";['BenchBudEE.csv'.D598]) ->  | E598: of:=IF(ISBLANK(['BenchBudEE.csv'.E598]);"";['BenchBudEE.csv'.E598]) ->  | F598: of:=IF(ISBLANK(['BenchBudEE.csv'.F598]);"";['BenchBudEE.csv'.F598]) ->  | G598: of:=IF(ISNUMBER(SEARCH("[0-9]";[.A598]));MID([.A598];1;SEARCH("[0-9]";[.A598])-1);"") -> 
A599: of:=IF(ISBLANK(['BenchBudEE.csv'.A599]);"";['BenchBudEE.csv'.A599]) ->  | B599: of:=IF(ISBLANK(['BenchBudEE.csv'.B599]);"";['BenchBudEE.csv'.B599]) ->  | C599: of:=IF(ISBLANK(['BenchBudEE.csv'.C734]);"";MID(['BenchBudEE.csv'.C734];SEARCH(":";['BenchBudEE.csv'.C734])+1;100)) ->  | D599: of:=IF(ISBLANK(['BenchBudEE.csv'.D599]);"";['BenchBudEE.csv'.D599]) ->  | E599: of:=IF(ISBLANK(['BenchBudEE.csv'.E599]);"";['BenchBudEE.csv'.E599]) ->  | F599: of:=IF(ISBLANK(['BenchBudEE.csv'.F599]);"";['BenchBudEE.csv'.F599]) ->  | G599: of:=IF(ISNUMBER(SEARCH("[0-9]";[.A599]));MID([.A599];1;SEARCH("[0-9]";[.A599])-1);"") -> 
A600: of:=IF(ISBLANK(['BenchBudEE.csv'.A600]);"";['BenchBudEE.csv'.A600]) ->  | B600: of:=IF(ISBLANK(['BenchBudEE.csv'.B600]);"";['BenchBudEE.csv'.B600]) ->  | C600: of:=IF(ISBLANK(['BenchBudEE.csv'.C735]);"";MID(['BenchBudEE.csv'.C735];SEARCH(":";['BenchBudEE.csv'.C735])+1;100)) ->  | D600: of:=IF(ISBLANK(['BenchBudEE.csv'.D600]);"";['BenchBudEE.csv'.D600]) ->  | E600: of:=IF(ISBLANK(['BenchBudEE.csv'.E600]);"";['BenchBudEE.csv'.E600]) ->  | F600: of:=IF(ISBLANK(['BenchBudEE.csv'.F600]);"";['BenchBudEE.csv'.F600]) ->  | G600: of:=IF(ISNUMBER(SEARCH("[0-9]";[.A600]));MID([.A600];1;SEARCH("[0-9]";[.A600])-1);"") -> 
A601: of:=IF(ISBLANK(['BenchBudEE.csv'.A601]);"";['BenchBudEE.csv'.A601]) ->  | B601: of:=IF(ISBLANK(['BenchBudEE.csv'.B601]);"";['BenchBudEE.csv'.B601]) ->  | C601: of:=IF(ISBLANK(['BenchBudEE.csv'.C736]);"";MID(['BenchBudEE.csv'.C736];SEARCH(":";['BenchBudEE.csv'.C736])+1;100)) ->  | D601: of:=IF(ISBLANK(['BenchBudEE.csv'.D601]);"";['BenchBudEE.csv'.D601]) ->  | E601: of:=IF(ISBLANK(['BenchBudEE.csv'.E601]);"";['BenchBudEE.csv'.E601]) ->  | F601: of:=IF(ISBLANK(['BenchBudEE.csv'.F601]);"";['BenchBudEE.csv'.F601]) ->  | G601: of:=IF(ISNUMBER(SEARCH("[0-9]";[.A601]));MID([.A601];1;SEARCH("[0-9]";[.A601])-1);"") -> 
A602: of:=IF(ISBLANK(['BenchBudEE.csv'.A602]);"";['BenchBudEE.csv'.A602]) ->  | B602: of:=IF(ISBLANK(['BenchBudEE.csv'.B602]);"";['BenchBudEE.csv'.B602]) ->  | C602: of:=IF(ISBLANK(['BenchBudEE.csv'.C737]);"";MID(['BenchBudEE.csv'.C737];SEARCH(":";['BenchBudEE.csv'.C737])+1;100)) ->  | D602: of:=IF(ISBLANK(['BenchBudEE.csv'.D602]);"";['BenchBudEE.csv'.D602]) ->  | E602: of:=IF(ISBLANK(['BenchBudEE.csv'.E602]);"";['BenchBudEE.csv'.E602]) ->  | F602: of:=IF(ISBLANK(['BenchBudEE.csv'.F602]);"";['BenchBudEE.csv'.F602]) ->  | G602: of:=IF(ISNUMBER(SEARCH("[0-9]";[.A602]));MID([.A602];1;SEARCH("[0-9]";[.A602])-1);"") -> 
A603: of:=IF(ISBLANK(['BenchBudEE.csv'.A603]);"";['BenchBudEE.csv'.A603]) ->  | B603: of:=IF(ISBLANK(['BenchBudEE.csv'.B603]);"";['BenchBudEE.csv'.B603]) ->  | C603: of:=IF(ISBLANK(['BenchBudEE.csv'.C738]);"";MID(['BenchBudEE.csv'.C738];SEARCH(":";['BenchBudEE.csv'.C738])+1;100)) ->  | D603: of:=IF(ISBLANK(['BenchBudEE.csv'.D603]);"";['BenchBudEE.csv'.D603]) ->  | E603: of:=IF(ISBLANK(['BenchBudEE.csv'.E603]);"";['BenchBudEE.csv'.E603]) ->  | F603: of:=IF(ISBLANK(['BenchBudEE.csv'.F603]);"";['BenchBudEE.csv'.F603]) ->  | G603: of:=IF(ISNUMBER(SEARCH("[0-9]";[.A603]));MID([.A603];1;SEARCH("[0-9]";[.A603])-1);"") -> 
A604: of:=IF(ISBLANK(['BenchBudEE.csv'.A604]);"";['BenchBudEE.csv'.A604]) ->  | B604: of:=IF(ISBLANK(['BenchBudEE.csv'.B604]);"";['BenchBudEE.csv'.B604]) ->  | C604: of:=IF(ISBLANK(['BenchBudEE.csv'.C739]);"";MID(['BenchBudEE.csv'.C739];SEARCH(":";['BenchBudEE.csv'.C739])+1;100)) ->  | D604: of:=IF(ISBLANK(['BenchBudEE.csv'.D604]);"";['BenchBudEE.csv'.D604]) ->  | E604: of:=IF(ISBLANK(['BenchBudEE.csv'.E604]);"";['BenchBudEE.csv'.E604]) ->  | F604: of:=IF(ISBLANK(['BenchBudEE.csv'.F604]);"";['BenchBudEE.csv'.F604]) ->  | G604: of:=IF(ISNUMBER(SEARCH("[0-9]";[.A604]));MID([.A604];1;SEARCH("[0-9]";[.A604])-1);"") -> 
A605: of:=IF(ISBLANK(['BenchBudEE.csv'.A605]);"";['BenchBudEE.csv'.A605]) ->  | B605: of:=IF(ISBLANK(['BenchBudEE.csv'.B605]);"";['BenchBudEE.csv'.B605]) ->  | C605: of:=IF(ISBLANK(['BenchBudEE.csv'.C740]);"";MID(['BenchBudEE.csv'.C740];SEARCH(":";['BenchBudEE.csv'.C740])+1;100)) ->  | D605: of:=IF(ISBLANK(['BenchBudEE.csv'.D605]);"";['BenchBudEE.csv'.D605]) ->  | E605: of:=IF(ISBLANK(['BenchBudEE.csv'.E605]);"";['BenchBudEE.csv'.E605]) ->  | F605: of:=IF(ISBLANK(['BenchBudEE.csv'.F605]);"";['BenchBudEE.csv'.F605]) ->  | G605: of:=IF(ISNUMBER(SEARCH("[0-9]";[.A605]));MID([.A605];1;SEARCH("[0-9]";[.A605])-1);"") -> 
A606: of:=IF(ISBLANK(['BenchBudEE.csv'.A606]);"";['BenchBudEE.csv'.A606]) ->  | B606: of:=IF(ISBLANK(['BenchBudEE.csv'.B606]);"";['BenchBudEE.csv'.B606]) ->  | C606: of:=IF(ISBLANK(['BenchBudEE.csv'.C741]);"";MID(['BenchBudEE.csv'.C741];SEARCH(":";['BenchBudEE.csv'.C741])+1;100)) ->  | D606: of:=IF(ISBLANK(['BenchBudEE.csv'.D606]);"";['BenchBudEE.csv'.D606]) ->  | E606: of:=IF(ISBLANK(['BenchBudEE.csv'.E606]);"";['BenchBudEE.csv'.E606]) ->  | F606: of:=IF(ISBLANK(['BenchBudEE.csv'.F606]);"";['BenchBudEE.csv'.F606]) ->  | G606: of:=IF(ISNUMBER(SEARCH("[0-9]";[.A606]));MID([.A606];1;SEARCH("[0-9]";[.A606])-1);"") -> 
A607: of:=IF(ISBLANK(['BenchBudEE.csv'.A607]);"";['BenchBudEE.csv'.A607]) ->  | B607: of:=IF(ISBLANK(['BenchBudEE.csv'.B607]);"";['BenchBudEE.csv'.B607]) ->  | C607: of:=IF(ISBLANK(['BenchBudEE.csv'.C742]);"";MID(['BenchBudEE.csv'.C742];SEARCH(":";['BenchBudEE.csv'.C742])+1;100)) ->  | D607: of:=IF(ISBLANK(['BenchBudEE.csv'.D607]);"";['BenchBudEE.csv'.D607]) ->  | E607: of:=IF(ISBLANK(['BenchBudEE.csv'.E607]);"";['BenchBudEE.csv'.E607]) ->  | F607: of:=IF(ISBLANK(['BenchBudEE.csv'.F607]);"";['BenchBudEE.csv'.F607]) ->  | G607: of:=IF(ISNUMBER(SEARCH("[0-9]";[.A607]));MID([.A607];1;SEARCH("[0-9]";[.A607])-1);"") -> 
A608: of:=IF(ISBLANK(['BenchBudEE.csv'.A608]);"";['BenchBudEE.csv'.A608]) ->  | B608: of:=IF(ISBLANK(['BenchBudEE.csv'.B608]);"";['BenchBudEE.csv'.B608]) ->  | C608: of:=IF(ISBLANK(['BenchBudEE.csv'.C743]);"";MID(['BenchBudEE.csv'.C743];SEARCH(":";['BenchBudEE.csv'.C743])+1;100)) ->  | D608: of:=IF(ISBLANK(['BenchBudEE.csv'.D608]);"";['BenchBudEE.csv'.D608]) ->  | E608: of:=IF(ISBLANK(['BenchBudEE.csv'.E608]);"";['BenchBudEE.csv'.E608]) ->  | F608: of:=IF(ISBLANK(['BenchBudEE.csv'.F608]);"";['BenchBudEE.csv'.F608]) ->  | G608: of:=IF(ISNUMBER(SEARCH("[0-9]";[.A608]));MID([.A608];1;SEARCH("[0-9]";[.A608])-1);"") -> 
A609: of:=IF(ISBLANK(['BenchBudEE.csv'.A609]);"";['BenchBudEE.csv'.A609]) ->  | B609: of:=IF(ISBLANK(['BenchBudEE.csv'.B609]);"";['BenchBudEE.csv'.B609]) ->  | C609: of:=IF(ISBLANK(['BenchBudEE.csv'.C744]);"";MID(['BenchBudEE.csv'.C744];SEARCH(":";['BenchBudEE.csv'.C744])+1;100)) ->  | D609: of:=IF(ISBLANK(['BenchBudEE.csv'.D609]);"";['BenchBudEE.csv'.D609]) ->  | E609: of:=IF(ISBLANK(['BenchBudEE.csv'.E609]);"";['BenchBudEE.csv'.E609]) ->  | F609: of:=IF(ISBLANK(['BenchBudEE.csv'.F609]);"";['BenchBudEE.csv'.F609]) ->  | G609: of:=IF(ISNUMBER(SEARCH("[0-9]";[.A609]));MID([.A609];1;SEARCH("[0-9]";[.A609])-1);"") -> 
A610: of:=IF(ISBLANK(['BenchBudEE.csv'.A610]);"";['BenchBudEE.csv'.A610]) ->  | B610: of:=IF(ISBLANK(['BenchBudEE.csv'.B610]);"";['BenchBudEE.csv'.B610]) ->  | C610: of:=IF(ISBLANK(['BenchBudEE.csv'.C745]);"";MID(['BenchBudEE.csv'.C745];SEARCH(":";['BenchBudEE.csv'.C745])+1;100)) ->  | D610: of:=IF(ISBLANK(['BenchBudEE.csv'.D610]);"";['BenchBudEE.csv'.D610]) ->  | E610: of:=IF(ISBLANK(['BenchBudEE.csv'.E610]);"";['BenchBudEE.csv'.E610]) ->  | F610: of:=IF(ISBLANK(['BenchBudEE.csv'.F610]);"";['BenchBudEE.csv'.F610]) ->  | G610: of:=IF(ISNUMBER(SEARCH("[0-9]";[.A610]));MID([.A610];1;SEARCH("[0-9]";[.A610])-1);"") -> 
A611: of:=IF(ISBLANK(['BenchBudEE.csv'.A611]);"";['BenchBudEE.csv'.A611]) ->  | B611: of:=IF(ISBLANK(['BenchBudEE.csv'.B611]);"";['BenchBudEE.csv'.B611]) ->  | C611: of:=IF(ISBLANK(['BenchBudEE.csv'.C746]);"";MID(['BenchBudEE.csv'.C746];SEARCH(":";['BenchBudEE.csv'.C746])+1;100)) ->  | D611: of:=IF(ISBLANK(['BenchBudEE.csv'.D611]);"";['BenchBudEE.csv'.D611]) ->  | E611: of:=IF(ISBLANK(['BenchBudEE.csv'.E611]);"";['BenchBudEE.csv'.E611]) ->  | F611: of:=IF(ISBLANK(['BenchBudEE.csv'.F611]);"";['BenchBudEE.csv'.F611]) ->  | G611: of:=IF(ISNUMBER(SEARCH("[0-9]";[.A611]));MID([.A611];1;SEARCH("[0-9]";[.A611])-1);"") -> 
A612: of:=IF(ISBLANK(['BenchBudEE.csv'.A612]);"";['BenchBudEE.csv'.A612]) ->  | B612: of:=IF(ISBLANK(['BenchBudEE.csv'.B612]);"";['BenchBudEE.csv'.B612]) ->  | C612: of:=IF(ISBLANK(['BenchBudEE.csv'.C747]);"";MID(['BenchBudEE.csv'.C747];SEARCH(":";['BenchBudEE.csv'.C747])+1;100)) ->  | D612: of:=IF(ISBLANK(['BenchBudEE.csv'.D612]);"";['BenchBudEE.csv'.D612]) ->  | E612: of:=IF(ISBLANK(['BenchBudEE.csv'.E612]);"";['BenchBudEE.csv'.E612]) ->  | F612: of:=IF(ISBLANK(['BenchBudEE.csv'.F612]);"";['BenchBudEE.csv'.F612]) ->  | G612: of:=IF(ISNUMBER(SEARCH("[0-9]";[.A612]));MID([.A612];1;SEARCH("[0-9]";[.A612])-1);"") -> 
A613: of:=IF(ISBLANK(['BenchBudEE.csv'.A613]);"";['BenchBudEE.csv'.A613]) ->  | B613: of:=IF(ISBLANK(['BenchBudEE.csv'.B613]);"";['BenchBudEE.csv'.B613]) ->  | C613: of:=IF(ISBLANK(['BenchBudEE.csv'.C748]);"";MID(['BenchBudEE.csv'.C748];SEARCH(":";['BenchBudEE.csv'.C748])+1;100)) ->  | D613: of:=IF(ISBLANK(['BenchBudEE.csv'.D613]);"";['BenchBudEE.csv'.D613]) ->  | E613: of:=IF(ISBLANK(['BenchBudEE.csv'.E613]);"";['BenchBudEE.csv'.E613]) ->  | F613: of:=IF(ISBLANK(['BenchBudEE.csv'.F613]);"";['BenchBudEE.csv'.F613]) ->  | G613: of:=IF(ISNUMBER(SEARCH("[0-9]";[.A613]));MID([.A613];1;SEARCH("[0-9]";[.A613])-1);"") -> 
A614: of:=IF(ISBLANK(['BenchBudEE.csv'.A614]);"";['BenchBudEE.csv'.A614]) ->  | B614: of:=IF(ISBLANK(['BenchBudEE.csv'.B614]);"";['BenchBudEE.csv'.B614]) ->  | C614: of:=IF(ISBLANK(['BenchBudEE.csv'.C749]);"";MID(['BenchBudEE.csv'.C749];SEARCH(":";['BenchBudEE.csv'.C749])+1;100)) ->  | D614: of:=IF(ISBLANK(['BenchBudEE.csv'.D614]);"";['BenchBudEE.csv'.D614]) ->  | E614: of:=IF(ISBLANK(['BenchBudEE.csv'.E614]);"";['BenchBudEE.csv'.E614]) ->  | F614: of:=IF(ISBLANK(['BenchBudEE.csv'.F614]);"";['BenchBudEE.csv'.F614]) ->  | G614: of:=IF(ISNUMBER(SEARCH("[0-9]";[.A614]));MID([.A614];1;SEARCH("[0-9]";[.A614])-1);"") -> 
A615: of:=IF(ISBLANK(['BenchBudEE.csv'.A615]);"";['BenchBudEE.csv'.A615]) ->  | B615: of:=IF(ISBLANK(['BenchBudEE.csv'.B615]);"";['BenchBudEE.csv'.B615]) ->  | C615: of:=IF(ISBLANK(['BenchBudEE.csv'.C750]);"";MID(['BenchBudEE.csv'.C750];SEARCH(":";['BenchBudEE.csv'.C750])+1;100)) ->  | D615: of:=IF(ISBLANK(['BenchBudEE.csv'.D615]);"";['BenchBudEE.csv'.D615]) ->  | E615: of:=IF(ISBLANK(['BenchBudEE.csv'.E615]);"";['BenchBudEE.csv'.E615]) ->  | F615: of:=IF(ISBLANK(['BenchBudEE.csv'.F615]);"";['BenchBudEE.csv'.F615]) ->  | G615: of:=IF(ISNUMBER(SEARCH("[0-9]";[.A615]));MID([.A615];1;SEARCH("[0-9]";[.A615])-1);"") -> 
A616: of:=IF(ISBLANK(['BenchBudEE.csv'.A616]);"";['BenchBudEE.csv'.A616]) ->  | B616: of:=IF(ISBLANK(['BenchBudEE.csv'.B616]);"";['BenchBudEE.csv'.B616]) ->  | C616: of:=IF(ISBLANK(['BenchBudEE.csv'.C751]);"";MID(['BenchBudEE.csv'.C751];SEARCH(":";['BenchBudEE.csv'.C751])+1;100)) ->  | D616: of:=IF(ISBLANK(['BenchBudEE.csv'.D616]);"";['BenchBudEE.csv'.D616]) ->  | E616: of:=IF(ISBLANK(['BenchBudEE.csv'.E616]);"";['BenchBudEE.csv'.E616]) ->  | F616: of:=IF(ISBLANK(['BenchBudEE.csv'.F616]);"";['BenchBudEE.csv'.F616]) ->  | G616: of:=IF(ISNUMBER(SEARCH("[0-9]";[.A616]));MID([.A616];1;SEARCH("[0-9]";[.A616])-1);"") -> 
A617: of:=IF(ISBLANK(['BenchBudEE.csv'.A617]);"";['BenchBudEE.csv'.A617]) ->  | B617: of:=IF(ISBLANK(['BenchBudEE.csv'.B617]);"";['BenchBudEE.csv'.B617]) ->  | C617: of:=IF(ISBLANK(['BenchBudEE.csv'.C752]);"";MID(['BenchBudEE.csv'.C752];SEARCH(":";['BenchBudEE.csv'.C752])+1;100)) ->  | D617: of:=IF(ISBLANK(['BenchBudEE.csv'.D617]);"";['BenchBudEE.csv'.D617]) ->  | E617: of:=IF(ISBLANK(['BenchBudEE.csv'.E617]);"";['BenchBudEE.csv'.E617]) ->  | F617: of:=IF(ISBLANK(['BenchBudEE.csv'.F617]);"";['BenchBudEE.csv'.F617]) ->  | G617: of:=IF(ISNUMBER(SEARCH("[0-9]";[.A617]));MID([.A617];1;SEARCH("[0-9]";[.A617])-1);"") -> 
A618: of:=IF(ISBLANK(['BenchBudEE.csv'.A618]);"";['BenchBudEE.csv'.A618]) ->  | B618: of:=IF(ISBLANK(['BenchBudEE.csv'.B618]);"";['BenchBudEE.csv'.B618]) ->  | C618: of:=IF(ISBLANK(['BenchBudEE.csv'.C753]);"";MID(['BenchBudEE.csv'.C753];SEARCH(":";['BenchBudEE.csv'.C753])+1;100)) ->  | D618: of:=IF(ISBLANK(['BenchBudEE.csv'.D618]);"";['BenchBudEE.csv'.D618]) ->  | E618: of:=IF(ISBLANK(['BenchBudEE.csv'.E618]);"";['BenchBudEE.csv'.E618]) ->  | F618: of:=IF(ISBLANK(['BenchBudEE.csv'.F618]);"";['BenchBudEE.csv'.F618]) ->  | G618: of:=IF(ISNUMBER(SEARCH("[0-9]";[.A618]));MID([.A618];1;SEARCH("[0-9]";[.A618])-1);"") -> 
A619: of:=IF(ISBLANK(['BenchBudEE.csv'.A619]);"";['BenchBudEE.csv'.A619]) ->  | B619: of:=IF(ISBLANK(['BenchBudEE.csv'.B619]);"";['BenchBudEE.csv'.B619]) ->  | C619: of:=IF(ISBLANK(['BenchBudEE.csv'.C754]);"";MID(['BenchBudEE.csv'.C754];SEARCH(":";['BenchBudEE.csv'.C754])+1;100)) ->  | D619: of:=IF(ISBLANK(['BenchBudEE.csv'.D619]);"";['BenchBudEE.csv'.D619]) ->  | E619: of:=IF(ISBLANK(['BenchBudEE.csv'.E619]);"";['BenchBudEE.csv'.E619]) ->  | F619: of:=IF(ISBLANK(['BenchBudEE.csv'.F619]);"";['BenchBudEE.csv'.F619]) ->  | G619: of:=IF(ISNUMBER(SEARCH("[0-9]";[.A619]));MID([.A619];1;SEARCH("[0-9]";[.A619])-1);"") -> 
A620: of:=IF(ISBLANK(['BenchBudEE.csv'.A620]);"";['BenchBudEE.csv'.A620]) ->  | B620: of:=IF(ISBLANK(['BenchBudEE.csv'.B620]);"";['BenchBudEE.csv'.B620]) ->  | C620: of:=IF(ISBLANK(['BenchBudEE.csv'.C755]);"";MID(['BenchBudEE.csv'.C755];SEARCH(":";['BenchBudEE.csv'.C755])+1;100)) ->  | D620: of:=IF(ISBLANK(['BenchBudEE.csv'.D620]);"";['BenchBudEE.csv'.D620]) ->  | E620: of:=IF(ISBLANK(['BenchBudEE.csv'.E620]);"";['BenchBudEE.csv'.E620]) ->  | F620: of:=IF(ISBLANK(['BenchBudEE.csv'.F620]);"";['BenchBudEE.csv'.F620]) ->  | G620: of:=IF(ISNUMBER(SEARCH("[0-9]";[.A620]));MID([.A620];1;SEARCH("[0-9]";[.A620])-1);"") -> 
A621: of:=IF(ISBLANK(['BenchBudEE.csv'.A621]);"";['BenchBudEE.csv'.A621]) ->  | B621: of:=IF(ISBLANK(['BenchBudEE.csv'.B621]);"";['BenchBudEE.csv'.B621]) ->  | C621: of:=IF(ISBLANK(['BenchBudEE.csv'.C756]);"";MID(['BenchBudEE.csv'.C756];SEARCH(":";['BenchBudEE.csv'.C756])+1;100)) ->  | D621: of:=IF(ISBLANK(['BenchBudEE.csv'.D621]);"";['BenchBudEE.csv'.D621]) ->  | E621: of:=IF(ISBLANK(['BenchBudEE.csv'.E621]);"";['BenchBudEE.csv'.E621]) ->  | F621: of:=IF(ISBLANK(['BenchBudEE.csv'.F621]);"";['BenchBudEE.csv'.F621]) ->  | G621: of:=IF(ISNUMBER(SEARCH("[0-9]";[.A621]));MID([.A621];1;SEARCH("[0-9]";[.A621])-1);"") -> 
A622: of:=IF(ISBLANK(['BenchBudEE.csv'.A622]);"";['BenchBudEE.csv'.A622]) ->  | B622: of:=IF(ISBLANK(['BenchBudEE.csv'.B622]);"";['BenchBudEE.csv'.B622]) ->  | C622: of:=IF(ISBLANK(['BenchBudEE.csv'.C757]);"";MID(['BenchBudEE.csv'.C757];SEARCH(":";['BenchBudEE.csv'.C757])+1;100)) ->  | D622: of:=IF(ISBLANK(['BenchBudEE.csv'.D622]);"";['BenchBudEE.csv'.D622]) ->  | E622: of:=IF(ISBLANK(['BenchBudEE.csv'.E622]);"";['BenchBudEE.csv'.E622]) ->  | F622: of:=IF(ISBLANK(['BenchBudEE.csv'.F622]);"";['BenchBudEE.csv'.F622]) ->  | G622: of:=IF(ISNUMBER(SEARCH("[0-9]";[.A622]));MID([.A622];1;SEARCH("[0-9]";[.A622])-1);"") -> 
A623: of:=IF(ISBLANK(['BenchBudEE.csv'.A623]);"";['BenchBudEE.csv'.A623]) ->  | B623: of:=IF(ISBLANK(['BenchBudEE.csv'.B623]);"";['BenchBudEE.csv'.B623]) ->  | C623: of:=IF(ISBLANK(['BenchBudEE.csv'.C758]);"";MID(['BenchBudEE.csv'.C758];SEARCH(":";['BenchBudEE.csv'.C758])+1;100)) ->  | D623: of:=IF(ISBLANK(['BenchBudEE.csv'.D623]);"";['BenchBudEE.csv'.D623]) ->  | E623: of:=IF(ISBLANK(['BenchBudEE.csv'.E623]);"";['BenchBudEE.csv'.E623]) ->  | F623: of:=IF(ISBLANK(['BenchBudEE.csv'.F623]);"";['BenchBudEE.csv'.F623]) ->  | G623: of:=IF(ISNUMBER(SEARCH("[0-9]";[.A623]));MID([.A623];1;SEARCH("[0-9]";[.A623])-1);"") -> 
A624: of:=IF(ISBLANK(['BenchBudEE.csv'.A624]);"";['BenchBudEE.csv'.A624]) ->  | B624: of:=IF(ISBLANK(['BenchBudEE.csv'.B624]);"";['BenchBudEE.csv'.B624]) ->  | C624: of:=IF(ISBLANK(['BenchBudEE.csv'.C759]);"";MID(['BenchBudEE.csv'.C759];SEARCH(":";['BenchBudEE.csv'.C759])+1;100)) ->  | D624: of:=IF(ISBLANK(['BenchBudEE.csv'.D624]);"";['BenchBudEE.csv'.D624]) ->  | E624: of:=IF(ISBLANK(['BenchBudEE.csv'.E624]);"";['BenchBudEE.csv'.E624]) ->  | F624: of:=IF(ISBLANK(['BenchBudEE.csv'.F624]);"";['BenchBudEE.csv'.F624]) ->  | G624: of:=IF(ISNUMBER(SEARCH("[0-9]";[.A624]));MID([.A624];1;SEARCH("[0-9]";[.A624])-1);"") -> 
A625: of:=IF(ISBLANK(['BenchBudEE.csv'.A625]);"";['BenchBudEE.csv'.A625]) ->  | B625: of:=IF(ISBLANK(['BenchBudEE.csv'.B625]);"";['BenchBudEE.csv'.B625]) ->  | C625: of:=IF(ISBLANK(['BenchBudEE.csv'.C760]);"";MID(['BenchBudEE.csv'.C760];SEARCH(":";['BenchBudEE.csv'.C760])+1;100)) ->  | D625: of:=IF(ISBLANK(['BenchBudEE.csv'.D625]);"";['BenchBudEE.csv'.D625]) ->  | E625: of:=IF(ISBLANK(['BenchBudEE.csv'.E625]);"";['BenchBudEE.csv'.E625]) ->  | F625: of:=IF(ISBLANK(['BenchBudEE.csv'.F625]);"";['BenchBudEE.csv'.F625]) ->  | G625: of:=IF(ISNUMBER(SEARCH("[0-9]";[.A625]));MID([.A625];1;SEARCH("[0-9]";[.A625])-1);"") -> 
A626: of:=IF(ISBLANK(['BenchBudEE.csv'.A626]);"";['BenchBudEE.csv'.A626]) ->  | B626: of:=IF(ISBLANK(['BenchBudEE.csv'.B626]);"";['BenchBudEE.csv'.B626]) ->  | C626: of:=IF(ISBLANK(['BenchBudEE.csv'.C761]);"";MID(['BenchBudEE.csv'.C761];SEARCH(":";['BenchBudEE.csv'.C761])+1;100)) ->  | D626: of:=IF(ISBLANK(['BenchBudEE.csv'.D626]);"";['BenchBudEE.csv'.D626]) ->  | E626: of:=IF(ISBLANK(['BenchBudEE.csv'.E626]);"";['BenchBudEE.csv'.E626]) ->  | F626: of:=IF(ISBLANK(['BenchBudEE.csv'.F626]);"";['BenchBudEE.csv'.F626]) ->  | G626: of:=IF(ISNUMBER(SEARCH("[0-9]";[.A626]));MID([.A626];1;SEARCH("[0-9]";[.A626])-1);"") -> 
A627: of:=IF(ISBLANK(['BenchBudEE.csv'.A627]);"";['BenchBudEE.csv'.A627]) ->  | B627: of:=IF(ISBLANK(['BenchBudEE.csv'.B627]);"";['BenchBudEE.csv'.B627]) ->  | C627: of:=IF(ISBLANK(['BenchBudEE.csv'.C762]);"";MID(['BenchBudEE.csv'.C762];SEARCH(":";['BenchBudEE.csv'.C762])+1;100)) ->  | D627: of:=IF(ISBLANK(['BenchBudEE.csv'.D627]);"";['BenchBudEE.csv'.D627]) ->  | E627: of:=IF(ISBLANK(['BenchBudEE.csv'.E627]);"";['BenchBudEE.csv'.E627]) ->  | F627: of:=IF(ISBLANK(['BenchBudEE.csv'.F627]);"";['BenchBudEE.csv'.F627]) ->  | G627: of:=IF(ISNUMBER(SEARCH("[0-9]";[.A627]));MID([.A627];1;SEARCH("[0-9]";[.A627])-1);"") -> 
A628: of:=IF(ISBLANK(['BenchBudEE.csv'.A628]);"";['BenchBudEE.csv'.A628]) ->  | B628: of:=IF(ISBLANK(['BenchBudEE.csv'.B628]);"";['BenchBudEE.csv'.B628]) ->  | C628: of:=IF(ISBLANK(['BenchBudEE.csv'.C763]);"";MID(['BenchBudEE.csv'.C763];SEARCH(":";['BenchBudEE.csv'.C763])+1;100)) ->  | D628: of:=IF(ISBLANK(['BenchBudEE.csv'.D628]);"";['BenchBudEE.csv'.D628]) ->  | E628: of:=IF(ISBLANK(['BenchBudEE.csv'.E628]);"";['BenchBudEE.csv'.E628]) ->  | F628: of:=IF(ISBLANK(['BenchBudEE.csv'.F628]);"";['BenchBudEE.csv'.F628]) ->  | G628: of:=IF(ISNUMBER(SEARCH("[0-9]";[.A628]));MID([.A628];1;SEARCH("[0-9]";[.A628])-1);"") -> 
A629: of:=IF(ISBLANK(['BenchBudEE.csv'.A629]);"";['BenchBudEE.csv'.A629]) ->  | B629: of:=IF(ISBLANK(['BenchBudEE.csv'.B629]);"";['BenchBudEE.csv'.B629]) ->  | C629: of:=IF(ISBLANK(['BenchBudEE.csv'.C764]);"";MID(['BenchBudEE.csv'.C764];SEARCH(":";['BenchBudEE.csv'.C764])+1;100)) ->  | D629: of:=IF(ISBLANK(['BenchBudEE.csv'.D629]);"";['BenchBudEE.csv'.D629]) ->  | E629: of:=IF(ISBLANK(['BenchBudEE.csv'.E629]);"";['BenchBudEE.csv'.E629]) ->  | F629: of:=IF(ISBLANK(['BenchBudEE.csv'.F629]);"";['BenchBudEE.csv'.F629]) ->  | G629: of:=IF(ISNUMBER(SEARCH("[0-9]";[.A629]));MID([.A629];1;SEARCH("[0-9]";[.A629])-1);"") -> 
A630: of:=IF(ISBLANK(['BenchBudEE.csv'.A630]);"";['BenchBudEE.csv'.A630]) ->  | B630: of:=IF(ISBLANK(['BenchBudEE.csv'.B630]);"";['BenchBudEE.csv'.B630]) ->  | C630: of:=IF(ISBLANK(['BenchBudEE.csv'.C765]);"";MID(['BenchBudEE.csv'.C765];SEARCH(":";['BenchBudEE.csv'.C765])+1;100)) ->  | D630: of:=IF(ISBLANK(['BenchBudEE.csv'.D630]);"";['BenchBudEE.csv'.D630]) ->  | E630: of:=IF(ISBLANK(['BenchBudEE.csv'.E630]);"";['BenchBudEE.csv'.E630]) ->  | F630: of:=IF(ISBLANK(['BenchBudEE.csv'.F630]);"";['BenchBudEE.csv'.F630]) ->  | G630: of:=IF(ISNUMBER(SEARCH("[0-9]";[.A630]));MID([.A630];1;SEARCH("[0-9]";[.A630])-1);"") -> 
A631: of:=IF(ISBLANK(['BenchBudEE.csv'.A631]);"";['BenchBudEE.csv'.A631]) ->  | B631: of:=IF(ISBLANK(['BenchBudEE.csv'.B631]);"";['BenchBudEE.csv'.B631]) ->  | C631: of:=IF(ISBLANK(['BenchBudEE.csv'.C766]);"";MID(['BenchBudEE.csv'.C766];SEARCH(":";['BenchBudEE.csv'.C766])+1;100)) ->  | D631: of:=IF(ISBLANK(['BenchBudEE.csv'.D631]);"";['BenchBudEE.csv'.D631]) ->  | E631: of:=IF(ISBLANK(['BenchBudEE.csv'.E631]);"";['BenchBudEE.csv'.E631]) ->  | F631: of:=IF(ISBLANK(['BenchBudEE.csv'.F631]);"";['BenchBudEE.csv'.F631]) ->  | G631: of:=IF(ISNUMBER(SEARCH("[0-9]";[.A631]));MID([.A631];1;SEARCH("[0-9]";[.A631])-1);"") -> 
A632: of:=IF(ISBLANK(['BenchBudEE.csv'.A632]);"";['BenchBudEE.csv'.A632]) ->  | B632: of:=IF(ISBLANK(['BenchBudEE.csv'.B632]);"";['BenchBudEE.csv'.B632]) ->  | C632: of:=IF(ISBLANK(['BenchBudEE.csv'.C767]);"";MID(['BenchBudEE.csv'.C767];SEARCH(":";['BenchBudEE.csv'.C767])+1;100)) ->  | D632: of:=IF(ISBLANK(['BenchBudEE.csv'.D632]);"";['BenchBudEE.csv'.D632]) ->  | E632: of:=IF(ISBLANK(['BenchBudEE.csv'.E632]);"";['BenchBudEE.csv'.E632]) ->  | F632: of:=IF(ISBLANK(['BenchBudEE.csv'.F632]);"";['BenchBudEE.csv'.F632]) ->  | G632: of:=IF(ISNUMBER(SEARCH("[0-9]";[.A632]));MID([.A632];1;SEARCH("[0-9]";[.A632])-1);"") -> 
A633: of:=IF(ISBLANK(['BenchBudEE.csv'.A633]);"";['BenchBudEE.csv'.A633]) ->  | B633: of:=IF(ISBLANK(['BenchBudEE.csv'.B633]);"";['BenchBudEE.csv'.B633]) ->  | C633: of:=IF(ISBLANK(['BenchBudEE.csv'.C768]);"";MID(['BenchBudEE.csv'.C768];SEARCH(":";['BenchBudEE.csv'.C768])+1;100)) ->  | D633: of:=IF(ISBLANK(['BenchBudEE.csv'.D633]);"";['BenchBudEE.csv'.D633]) ->  | E633: of:=IF(ISBLANK(['BenchBudEE.csv'.E633]);"";['BenchBudEE.csv'.E633]) ->  | F633: of:=IF(ISBLANK(['BenchBudEE.csv'.F633]);"";['BenchBudEE.csv'.F633]) ->  | G633: of:=IF(ISNUMBER(SEARCH("[0-9]";[.A633]));MID([.A633];1;SEARCH("[0-9]";[.A633])-1);"") -> 
A634: of:=IF(ISBLANK(['BenchBudEE.csv'.A634]);"";['BenchBudEE.csv'.A634]) ->  | B634: of:=IF(ISBLANK(['BenchBudEE.csv'.B634]);"";['BenchBudEE.csv'.B634]) ->  | C634: of:=IF(ISBLANK(['BenchBudEE.csv'.C769]);"";MID(['BenchBudEE.csv'.C769];SEARCH(":";['BenchBudEE.csv'.C769])+1;100)) ->  | D634: of:=IF(ISBLANK(['BenchBudEE.csv'.D634]);"";['BenchBudEE.csv'.D634]) ->  | E634: of:=IF(ISBLANK(['BenchBudEE.csv'.E634]);"";['BenchBudEE.csv'.E634]) ->  | F634: of:=IF(ISBLANK(['BenchBudEE.csv'.F634]);"";['BenchBudEE.csv'.F634]) ->  | G634: of:=IF(ISNUMBER(SEARCH("[0-9]";[.A634]));MID([.A634];1;SEARCH("[0-9]";[.A634])-1);"") -> 
A635: of:=IF(ISBLANK(['BenchBudEE.csv'.A635]);"";['BenchBudEE.csv'.A635]) ->  | B635: of:=IF(ISBLANK(['BenchBudEE.csv'.B635]);"";['BenchBudEE.csv'.B635]) ->  | C635: of:=IF(ISBLANK(['BenchBudEE.csv'.C770]);"";MID(['BenchBudEE.csv'.C770];SEARCH(":";['BenchBudEE.csv'.C770])+1;100)) ->  | D635: of:=IF(ISBLANK(['BenchBudEE.csv'.D635]);"";['BenchBudEE.csv'.D635]) ->  | E635: of:=IF(ISBLANK(['BenchBudEE.csv'.E635]);"";['BenchBudEE.csv'.E635]) ->  | F635: of:=IF(ISBLANK(['BenchBudEE.csv'.F635]);"";['BenchBudEE.csv'.F635]) ->  | G635: of:=IF(ISNUMBER(SEARCH("[0-9]";[.A635]));MID([.A635];1;SEARCH("[0-9]";[.A635])-1);"") -> 
A636: of:=IF(ISBLANK(['BenchBudEE.csv'.A636]);"";['BenchBudEE.csv'.A636]) ->  | B636: of:=IF(ISBLANK(['BenchBudEE.csv'.B636]);"";['BenchBudEE.csv'.B636]) ->  | C636: of:=IF(ISBLANK(['BenchBudEE.csv'.C771]);"";MID(['BenchBudEE.csv'.C771];SEARCH(":";['BenchBudEE.csv'.C771])+1;100)) ->  | D636: of:=IF(ISBLANK(['BenchBudEE.csv'.D636]);"";['BenchBudEE.csv'.D636]) ->  | E636: of:=IF(ISBLANK(['BenchBudEE.csv'.E636]);"";['BenchBudEE.csv'.E636]) ->  | F636: of:=IF(ISBLANK(['BenchBudEE.csv'.F636]);"";['BenchBudEE.csv'.F636]) ->  | G636: of:=IF(ISNUMBER(SEARCH("[0-9]";[.A636]));MID([.A636];1;SEARCH("[0-9]";[.A636])-1);"") -> 
A637: of:=IF(ISBLANK(['BenchBudEE.csv'.A637]);"";['BenchBudEE.csv'.A637]) ->  | B637: of:=IF(ISBLANK(['BenchBudEE.csv'.B637]);"";['BenchBudEE.csv'.B637]) ->  | C637: of:=IF(ISBLANK(['BenchBudEE.csv'.C772]);"";MID(['BenchBudEE.csv'.C772];SEARCH(":";['BenchBudEE.csv'.C772])+1;100)) ->  | D637: of:=IF(ISBLANK(['BenchBudEE.csv'.D637]);"";['BenchBudEE.csv'.D637]) ->  | E637: of:=IF(ISBLANK(['BenchBudEE.csv'.E637]);"";['BenchBudEE.csv'.E637]) ->  | F637: of:=IF(ISBLANK(['BenchBudEE.csv'.F637]);"";['BenchBudEE.csv'.F637]) ->  | G637: of:=IF(ISNUMBER(SEARCH("[0-9]";[.A637]));MID([.A637];1;SEARCH("[0-9]";[.A637])-1);"") -> 
A638: of:=IF(ISBLANK(['BenchBudEE.csv'.A638]);"";['BenchBudEE.csv'.A638]) ->  | B638: of:=IF(ISBLANK(['BenchBudEE.csv'.B638]);"";['BenchBudEE.csv'.B638]) ->  | C638: of:=IF(ISBLANK(['BenchBudEE.csv'.C773]);"";MID(['BenchBudEE.csv'.C773];SEARCH(":";['BenchBudEE.csv'.C773])+1;100)) ->  | D638: of:=IF(ISBLANK(['BenchBudEE.csv'.D638]);"";['BenchBudEE.csv'.D638]) ->  | E638: of:=IF(ISBLANK(['BenchBudEE.csv'.E638]);"";['BenchBudEE.csv'.E638]) ->  | F638: of:=IF(ISBLANK(['BenchBudEE.csv'.F638]);"";['BenchBudEE.csv'.F638]) ->  | G638: of:=IF(ISNUMBER(SEARCH("[0-9]";[.A638]));MID([.A638];1;SEARCH("[0-9]";[.A638])-1);"") -> 
A639: of:=IF(ISBLANK(['BenchBudEE.csv'.A639]);"";['BenchBudEE.csv'.A639]) ->  | B639: of:=IF(ISBLANK(['BenchBudEE.csv'.B639]);"";['BenchBudEE.csv'.B639]) ->  | C639: of:=IF(ISBLANK(['BenchBudEE.csv'.C774]);"";MID(['BenchBudEE.csv'.C774];SEARCH(":";['BenchBudEE.csv'.C774])+1;100)) ->  | D639: of:=IF(ISBLANK(['BenchBudEE.csv'.D639]);"";['BenchBudEE.csv'.D639]) ->  | E639: of:=IF(ISBLANK(['BenchBudEE.csv'.E639]);"";['BenchBudEE.csv'.E639]) ->  | F639: of:=IF(ISBLANK(['BenchBudEE.csv'.F639]);"";['BenchBudEE.csv'.F639]) ->  | G639: of:=IF(ISNUMBER(SEARCH("[0-9]";[.A639]));MID([.A639];1;SEARCH("[0-9]";[.A639])-1);"") -> 
A640: of:=IF(ISBLANK(['BenchBudEE.csv'.A640]);"";['BenchBudEE.csv'.A640]) ->  | B640: of:=IF(ISBLANK(['BenchBudEE.csv'.B640]);"";['BenchBudEE.csv'.B640]) ->  | C640: of:=IF(ISBLANK(['BenchBudEE.csv'.C775]);"";MID(['BenchBudEE.csv'.C775];SEARCH(":";['BenchBudEE.csv'.C775])+1;100)) ->  | D640: of:=IF(ISBLANK(['BenchBudEE.csv'.D640]);"";['BenchBudEE.csv'.D640]) ->  | E640: of:=IF(ISBLANK(['BenchBudEE.csv'.E640]);"";['BenchBudEE.csv'.E640]) ->  | F640: of:=IF(ISBLANK(['BenchBudEE.csv'.F640]);"";['BenchBudEE.csv'.F640]) ->  | G640: of:=IF(ISNUMBER(SEARCH("[0-9]";[.A640]));MID([.A640];1;SEARCH("[0-9]";[.A640])-1);"") -> 
A641: of:=IF(ISBLANK(['BenchBudEE.csv'.A641]);"";['BenchBudEE.csv'.A641]) ->  | B641: of:=IF(ISBLANK(['BenchBudEE.csv'.B641]);"";['BenchBudEE.csv'.B641]) ->  | C641: of:=IF(ISBLANK(['BenchBudEE.csv'.C776]);"";MID(['BenchBudEE.csv'.C776];SEARCH(":";['BenchBudEE.csv'.C776])+1;100)) ->  | D641: of:=IF(ISBLANK(['BenchBudEE.csv'.D641]);"";['BenchBudEE.csv'.D641]) ->  | E641: of:=IF(ISBLANK(['BenchBudEE.csv'.E641]);"";['BenchBudEE.csv'.E641]) ->  | F641: of:=IF(ISBLANK(['BenchBudEE.csv'.F641]);"";['BenchBudEE.csv'.F641]) ->  | G641: of:=IF(ISNUMBER(SEARCH("[0-9]";[.A641]));MID([.A641];1;SEARCH("[0-9]";[.A641])-1);"") -> 
A642: of:=IF(ISBLANK(['BenchBudEE.csv'.A642]);"";['BenchBudEE.csv'.A642]) ->  | B642: of:=IF(ISBLANK(['BenchBudEE.csv'.B642]);"";['BenchBudEE.csv'.B642]) ->  | C642: of:=IF(ISBLANK(['BenchBudEE.csv'.C777]);"";MID(['BenchBudEE.csv'.C777];SEARCH(":";['BenchBudEE.csv'.C777])+1;100)) ->  | D642: of:=IF(ISBLANK(['BenchBudEE.csv'.D642]);"";['BenchBudEE.csv'.D642]) ->  | E642: of:=IF(ISBLANK(['BenchBudEE.csv'.E642]);"";['BenchBudEE.csv'.E642]) ->  | F642: of:=IF(ISBLANK(['BenchBudEE.csv'.F642]);"";['BenchBudEE.csv'.F642]) ->  | G642: of:=IF(ISNUMBER(SEARCH("[0-9]";[.A642]));MID([.A642];1;SEARCH("[0-9]";[.A642])-1);"") -> 
A643: of:=IF(ISBLANK(['BenchBudEE.csv'.A643]);"";['BenchBudEE.csv'.A643]) ->  | B643: of:=IF(ISBLANK(['BenchBudEE.csv'.B643]);"";['BenchBudEE.csv'.B643]) ->  | C643: of:=IF(ISBLANK(['BenchBudEE.csv'.C778]);"";MID(['BenchBudEE.csv'.C778];SEARCH(":";['BenchBudEE.csv'.C778])+1;100)) ->  | D643: of:=IF(ISBLANK(['BenchBudEE.csv'.D643]);"";['BenchBudEE.csv'.D643]) ->  | E643: of:=IF(ISBLANK(['BenchBudEE.csv'.E643]);"";['BenchBudEE.csv'.E643]) ->  | F643: of:=IF(ISBLANK(['BenchBudEE.csv'.F643]);"";['BenchBudEE.csv'.F643]) ->  | G643: of:=IF(ISNUMBER(SEARCH("[0-9]";[.A643]));MID([.A643];1;SEARCH("[0-9]";[.A643])-1);"") -> 
A644: of:=IF(ISBLANK(['BenchBudEE.csv'.A644]);"";['BenchBudEE.csv'.A644]) ->  | B644: of:=IF(ISBLANK(['BenchBudEE.csv'.B644]);"";['BenchBudEE.csv'.B644]) ->  | C644: of:=IF(ISBLANK(['BenchBudEE.csv'.C779]);"";MID(['BenchBudEE.csv'.C779];SEARCH(":";['BenchBudEE.csv'.C779])+1;100)) ->  | D644: of:=IF(ISBLANK(['BenchBudEE.csv'.D644]);"";['BenchBudEE.csv'.D644]) ->  | E644: of:=IF(ISBLANK(['BenchBudEE.csv'.E644]);"";['BenchBudEE.csv'.E644]) ->  | F644: of:=IF(ISBLANK(['BenchBudEE.csv'.F644]);"";['BenchBudEE.csv'.F644]) ->  | G644: of:=IF(ISNUMBER(SEARCH("[0-9]";[.A644]));MID([.A644];1;SEARCH("[0-9]";[.A644])-1);"") -> 
A645: of:=IF(ISBLANK(['BenchBudEE.csv'.A645]);"";['BenchBudEE.csv'.A645]) ->  | B645: of:=IF(ISBLANK(['BenchBudEE.csv'.B645]);"";['BenchBudEE.csv'.B645]) ->  | C645: of:=IF(ISBLANK(['BenchBudEE.csv'.C780]);"";MID(['BenchBudEE.csv'.C780];SEARCH(":";['BenchBudEE.csv'.C780])+1;100)) ->  | D645: of:=IF(ISBLANK(['BenchBudEE.csv'.D645]);"";['BenchBudEE.csv'.D645]) ->  | E645: of:=IF(ISBLANK(['BenchBudEE.csv'.E645]);"";['BenchBudEE.csv'.E645]) ->  | F645: of:=IF(ISBLANK(['BenchBudEE.csv'.F645]);"";['BenchBudEE.csv'.F645]) ->  | G645: of:=IF(ISNUMBER(SEARCH("[0-9]";[.A645]));MID([.A645];1;SEARCH("[0-9]";[.A645])-1);"") -> 
A646: of:=IF(ISBLANK(['BenchBudEE.csv'.A646]);"";['BenchBudEE.csv'.A646]) ->  | B646: of:=IF(ISBLANK(['BenchBudEE.csv'.B646]);"";['BenchBudEE.csv'.B646]) ->  | C646: of:=IF(ISBLANK(['BenchBudEE.csv'.C781]);"";MID(['BenchBudEE.csv'.C781];SEARCH(":";['BenchBudEE.csv'.C781])+1;100)) ->  | D646: of:=IF(ISBLANK(['BenchBudEE.csv'.D646]);"";['BenchBudEE.csv'.D646]) ->  | E646: of:=IF(ISBLANK(['BenchBudEE.csv'.E646]);"";['BenchBudEE.csv'.E646]) ->  | F646: of:=IF(ISBLANK(['BenchBudEE.csv'.F646]);"";['BenchBudEE.csv'.F646]) ->  | G646: of:=IF(ISNUMBER(SEARCH("[0-9]";[.A646]));MID([.A646];1;SEARCH("[0-9]";[.A646])-1);"") -> 
A647: of:=IF(ISBLANK(['BenchBudEE.csv'.A647]);"";['BenchBudEE.csv'.A647]) ->  | B647: of:=IF(ISBLANK(['BenchBudEE.csv'.B647]);"";['BenchBudEE.csv'.B647]) ->  | C647: of:=IF(ISBLANK(['BenchBudEE.csv'.C782]);"";MID(['BenchBudEE.csv'.C782];SEARCH(":";['BenchBudEE.csv'.C782])+1;100)) ->  | D647: of:=IF(ISBLANK(['BenchBudEE.csv'.D647]);"";['BenchBudEE.csv'.D647]) ->  | E647: of:=IF(ISBLANK(['BenchBudEE.csv'.E647]);"";['BenchBudEE.csv'.E647]) ->  | F647: of:=IF(ISBLANK(['BenchBudEE.csv'.F647]);"";['BenchBudEE.csv'.F647]) ->  | G647: of:=IF(ISNUMBER(SEARCH("[0-9]";[.A647]));MID([.A647];1;SEARCH("[0-9]";[.A647])-1);"") -> 
A648: of:=IF(ISBLANK(['BenchBudEE.csv'.A648]);"";['BenchBudEE.csv'.A648]) ->  | B648: of:=IF(ISBLANK(['BenchBudEE.csv'.B648]);"";['BenchBudEE.csv'.B648]) ->  | C648: of:=IF(ISBLANK(['BenchBudEE.csv'.C783]);"";MID(['BenchBudEE.csv'.C783];SEARCH(":";['BenchBudEE.csv'.C783])+1;100)) ->  | D648: of:=IF(ISBLANK(['BenchBudEE.csv'.D648]);"";['BenchBudEE.csv'.D648]) ->  | E648: of:=IF(ISBLANK(['BenchBudEE.csv'.E648]);"";['BenchBudEE.csv'.E648]) ->  | F648: of:=IF(ISBLANK(['BenchBudEE.csv'.F648]);"";['BenchBudEE.csv'.F648]) ->  | G648: of:=IF(ISNUMBER(SEARCH("[0-9]";[.A648]));MID([.A648];1;SEARCH("[0-9]";[.A648])-1);"") -> 
A649: of:=IF(ISBLANK(['BenchBudEE.csv'.A649]);"";['BenchBudEE.csv'.A649]) ->  | B649: of:=IF(ISBLANK(['BenchBudEE.csv'.B649]);"";['BenchBudEE.csv'.B649]) ->  | C649: of:=IF(ISBLANK(['BenchBudEE.csv'.C784]);"";MID(['BenchBudEE.csv'.C784];SEARCH(":";['BenchBudEE.csv'.C784])+1;100)) ->  | D649: of:=IF(ISBLANK(['BenchBudEE.csv'.D649]);"";['BenchBudEE.csv'.D649]) ->  | E649: of:=IF(ISBLANK(['BenchBudEE.csv'.E649]);"";['BenchBudEE.csv'.E649]) ->  | F649: of:=IF(ISBLANK(['BenchBudEE.csv'.F649]);"";['BenchBudEE.csv'.F649]) ->  | G649: of:=IF(ISNUMBER(SEARCH("[0-9]";[.A649]));MID([.A649];1;SEARCH("[0-9]";[.A649])-1);"") -> 
A650: of:=IF(ISBLANK(['BenchBudEE.csv'.A650]);"";['BenchBudEE.csv'.A650]) ->  | B650: of:=IF(ISBLANK(['BenchBudEE.csv'.B650]);"";['BenchBudEE.csv'.B650]) ->  | C650: of:=IF(ISBLANK(['BenchBudEE.csv'.C785]);"";MID(['BenchBudEE.csv'.C785];SEARCH(":";['BenchBudEE.csv'.C785])+1;100)) ->  | D650: of:=IF(ISBLANK(['BenchBudEE.csv'.D650]);"";['BenchBudEE.csv'.D650]) ->  | E650: of:=IF(ISBLANK(['BenchBudEE.csv'.E650]);"";['BenchBudEE.csv'.E650]) ->  | F650: of:=IF(ISBLANK(['BenchBudEE.csv'.F650]);"";['BenchBudEE.csv'.F650]) ->  | G650: of:=IF(ISNUMBER(SEARCH("[0-9]";[.A650]));MID([.A650];1;SEARCH("[0-9]";[.A650])-1);"") -> 
A651: of:=IF(ISBLANK(['BenchBudEE.csv'.A651]);"";['BenchBudEE.csv'.A651]) ->  | B651: of:=IF(ISBLANK(['BenchBudEE.csv'.B651]);"";['BenchBudEE.csv'.B651]) ->  | C651: of:=IF(ISBLANK(['BenchBudEE.csv'.C786]);"";MID(['BenchBudEE.csv'.C786];SEARCH(":";['BenchBudEE.csv'.C786])+1;100)) ->  | D651: of:=IF(ISBLANK(['BenchBudEE.csv'.D651]);"";['BenchBudEE.csv'.D651]) ->  | E651: of:=IF(ISBLANK(['BenchBudEE.csv'.E651]);"";['BenchBudEE.csv'.E651]) ->  | F651: of:=IF(ISBLANK(['BenchBudEE.csv'.F651]);"";['BenchBudEE.csv'.F651]) ->  | G651: of:=IF(ISNUMBER(SEARCH("[0-9]";[.A651]));MID([.A651];1;SEARCH("[0-9]";[.A651])-1);"") -> 
A652: of:=IF(ISBLANK(['BenchBudEE.csv'.A652]);"";['BenchBudEE.csv'.A652]) ->  | B652: of:=IF(ISBLANK(['BenchBudEE.csv'.B652]);"";['BenchBudEE.csv'.B652]) ->  | C652: of:=IF(ISBLANK(['BenchBudEE.csv'.C787]);"";MID(['BenchBudEE.csv'.C787];SEARCH(":";['BenchBudEE.csv'.C787])+1;100)) ->  | D652: of:=IF(ISBLANK(['BenchBudEE.csv'.D652]);"";['BenchBudEE.csv'.D652]) ->  | E652: of:=IF(ISBLANK(['BenchBudEE.csv'.E652]);"";['BenchBudEE.csv'.E652]) ->  | F652: of:=IF(ISBLANK(['BenchBudEE.csv'.F652]);"";['BenchBudEE.csv'.F652]) ->  | G652: of:=IF(ISNUMBER(SEARCH("[0-9]";[.A652]));MID([.A652];1;SEARCH("[0-9]";[.A652])-1);"") -> 
A653: of:=IF(ISBLANK(['BenchBudEE.csv'.A653]);"";['BenchBudEE.csv'.A653]) ->  | B653: of:=IF(ISBLANK(['BenchBudEE.csv'.B653]);"";['BenchBudEE.csv'.B653]) ->  | C653: of:=IF(ISBLANK(['BenchBudEE.csv'.C788]);"";MID(['BenchBudEE.csv'.C788];SEARCH(":";['BenchBudEE.csv'.C788])+1;100)) ->  | D653: of:=IF(ISBLANK(['BenchBudEE.csv'.D653]);"";['BenchBudEE.csv'.D653]) ->  | E653: of:=IF(ISBLANK(['BenchBudEE.csv'.E653]);"";['BenchBudEE.csv'.E653]) ->  | F653: of:=IF(ISBLANK(['BenchBudEE.csv'.F653]);"";['BenchBudEE.csv'.F653]) ->  | G653: of:=IF(ISNUMBER(SEARCH("[0-9]";[.A653]));MID([.A653];1;SEARCH("[0-9]";[.A653])-1);"") -> 
A654: of:=IF(ISBLANK(['BenchBudEE.csv'.A654]);"";['BenchBudEE.csv'.A654]) ->  | B654: of:=IF(ISBLANK(['BenchBudEE.csv'.B654]);"";['BenchBudEE.csv'.B654]) ->  | C654: of:=IF(ISBLANK(['BenchBudEE.csv'.C789]);"";MID(['BenchBudEE.csv'.C789];SEARCH(":";['BenchBudEE.csv'.C789])+1;100)) ->  | D654: of:=IF(ISBLANK(['BenchBudEE.csv'.D654]);"";['BenchBudEE.csv'.D654]) ->  | E654: of:=IF(ISBLANK(['BenchBudEE.csv'.E654]);"";['BenchBudEE.csv'.E654]) ->  | F654: of:=IF(ISBLANK(['BenchBudEE.csv'.F654]);"";['BenchBudEE.csv'.F654]) ->  | G654: of:=IF(ISNUMBER(SEARCH("[0-9]";[.A654]));MID([.A654];1;SEARCH("[0-9]";[.A654])-1);"") -> 
A655: of:=IF(ISBLANK(['BenchBudEE.csv'.A655]);"";['BenchBudEE.csv'.A655]) ->  | B655: of:=IF(ISBLANK(['BenchBudEE.csv'.B655]);"";['BenchBudEE.csv'.B655]) ->  | C655: of:=IF(ISBLANK(['BenchBudEE.csv'.C790]);"";MID(['BenchBudEE.csv'.C790];SEARCH(":";['BenchBudEE.csv'.C790])+1;100)) ->  | D655: of:=IF(ISBLANK(['BenchBudEE.csv'.D655]);"";['BenchBudEE.csv'.D655]) ->  | E655: of:=IF(ISBLANK(['BenchBudEE.csv'.E655]);"";['BenchBudEE.csv'.E655]) ->  | F655: of:=IF(ISBLANK(['BenchBudEE.csv'.F655]);"";['BenchBudEE.csv'.F655]) ->  | G655: of:=IF(ISNUMBER(SEARCH("[0-9]";[.A655]));MID([.A655];1;SEARCH("[0-9]";[.A655])-1);"") -> 
A656: of:=IF(ISBLANK(['BenchBudEE.csv'.A656]);"";['BenchBudEE.csv'.A656]) ->  | B656: of:=IF(ISBLANK(['BenchBudEE.csv'.B656]);"";['BenchBudEE.csv'.B656]) ->  | C656: of:=IF(ISBLANK(['BenchBudEE.csv'.C791]);"";MID(['BenchBudEE.csv'.C791];SEARCH(":";['BenchBudEE.csv'.C791])+1;100)) ->  | D656: of:=IF(ISBLANK(['BenchBudEE.csv'.D656]);"";['BenchBudEE.csv'.D656]) ->  | E656: of:=IF(ISBLANK(['BenchBudEE.csv'.E656]);"";['BenchBudEE.csv'.E656]) ->  | F656: of:=IF(ISBLANK(['BenchBudEE.csv'.F656]);"";['BenchBudEE.csv'.F656]) ->  | G656: of:=IF(ISNUMBER(SEARCH("[0-9]";[.A656]));MID([.A656];1;SEARCH("[0-9]";[.A656])-1);"") -> 
A657: of:=IF(ISBLANK(['BenchBudEE.csv'.A657]);"";['BenchBudEE.csv'.A657]) ->  | B657: of:=IF(ISBLANK(['BenchBudEE.csv'.B657]);"";['BenchBudEE.csv'.B657]) ->  | C657: of:=IF(ISBLANK(['BenchBudEE.csv'.C792]);"";MID(['BenchBudEE.csv'.C792];SEARCH(":";['BenchBudEE.csv'.C792])+1;100)) ->  | D657: of:=IF(ISBLANK(['BenchBudEE.csv'.D657]);"";['BenchBudEE.csv'.D657]) ->  | E657: of:=IF(ISBLANK(['BenchBudEE.csv'.E657]);"";['BenchBudEE.csv'.E657]) ->  | F657: of:=IF(ISBLANK(['BenchBudEE.csv'.F657]);"";['BenchBudEE.csv'.F657]) ->  | G657: of:=IF(ISNUMBER(SEARCH("[0-9]";[.A657]));MID([.A657];1;SEARCH("[0-9]";[.A657])-1);"") -> 
A658: of:=IF(ISBLANK(['BenchBudEE.csv'.A658]);"";['BenchBudEE.csv'.A658]) ->  | B658: of:=IF(ISBLANK(['BenchBudEE.csv'.B658]);"";['BenchBudEE.csv'.B658]) ->  | C658: of:=IF(ISBLANK(['BenchBudEE.csv'.C793]);"";MID(['BenchBudEE.csv'.C793];SEARCH(":";['BenchBudEE.csv'.C793])+1;100)) ->  | D658: of:=IF(ISBLANK(['BenchBudEE.csv'.D658]);"";['BenchBudEE.csv'.D658]) ->  | E658: of:=IF(ISBLANK(['BenchBudEE.csv'.E658]);"";['BenchBudEE.csv'.E658]) ->  | F658: of:=IF(ISBLANK(['BenchBudEE.csv'.F658]);"";['BenchBudEE.csv'.F658]) ->  | G658: of:=IF(ISNUMBER(SEARCH("[0-9]";[.A658]));MID([.A658];1;SEARCH("[0-9]";[.A658])-1);"") -> 
A659: of:=IF(ISBLANK(['BenchBudEE.csv'.A659]);"";['BenchBudEE.csv'.A659]) ->  | B659: of:=IF(ISBLANK(['BenchBudEE.csv'.B659]);"";['BenchBudEE.csv'.B659]) ->  | C659: of:=IF(ISBLANK(['BenchBudEE.csv'.C794]);"";MID(['BenchBudEE.csv'.C794];SEARCH(":";['BenchBudEE.csv'.C794])+1;100)) ->  | D659: of:=IF(ISBLANK(['BenchBudEE.csv'.D659]);"";['BenchBudEE.csv'.D659]) ->  | E659: of:=IF(ISBLANK(['BenchBudEE.csv'.E659]);"";['BenchBudEE.csv'.E659]) ->  | F659: of:=IF(ISBLANK(['BenchBudEE.csv'.F659]);"";['BenchBudEE.csv'.F659]) ->  | G659: of:=IF(ISNUMBER(SEARCH("[0-9]";[.A659]));MID([.A659];1;SEARCH("[0-9]";[.A659])-1);"") -> 
A660: of:=IF(ISBLANK(['BenchBudEE.csv'.A660]);"";['BenchBudEE.csv'.A660]) ->  | B660: of:=IF(ISBLANK(['BenchBudEE.csv'.B660]);"";['BenchBudEE.csv'.B660]) ->  | C660: of:=IF(ISBLANK(['BenchBudEE.csv'.C795]);"";MID(['BenchBudEE.csv'.C795];SEARCH(":";['BenchBudEE.csv'.C795])+1;100)) ->  | D660: of:=IF(ISBLANK(['BenchBudEE.csv'.D660]);"";['BenchBudEE.csv'.D660]) ->  | E660: of:=IF(ISBLANK(['BenchBudEE.csv'.E660]);"";['BenchBudEE.csv'.E660]) ->  | F660: of:=IF(ISBLANK(['BenchBudEE.csv'.F660]);"";['BenchBudEE.csv'.F660]) ->  | G660: of:=IF(ISNUMBER(SEARCH("[0-9]";[.A660]));MID([.A660];1;SEARCH("[0-9]";[.A660])-1);"") -> 
A661: of:=IF(ISBLANK(['BenchBudEE.csv'.A661]);"";['BenchBudEE.csv'.A661]) ->  | B661: of:=IF(ISBLANK(['BenchBudEE.csv'.B661]);"";['BenchBudEE.csv'.B661]) ->  | C661: of:=IF(ISBLANK(['BenchBudEE.csv'.C796]);"";MID(['BenchBudEE.csv'.C796];SEARCH(":";['BenchBudEE.csv'.C796])+1;100)) ->  | D661: of:=IF(ISBLANK(['BenchBudEE.csv'.D661]);"";['BenchBudEE.csv'.D661]) ->  | E661: of:=IF(ISBLANK(['BenchBudEE.csv'.E661]);"";['BenchBudEE.csv'.E661]) ->  | F661: of:=IF(ISBLANK(['BenchBudEE.csv'.F661]);"";['BenchBudEE.csv'.F661]) ->  | G661: of:=IF(ISNUMBER(SEARCH("[0-9]";[.A661]));MID([.A661];1;SEARCH("[0-9]";[.A661])-1);"") -> 
A662: of:=IF(ISBLANK(['BenchBudEE.csv'.A662]);"";['BenchBudEE.csv'.A662]) ->  | B662: of:=IF(ISBLANK(['BenchBudEE.csv'.B662]);"";['BenchBudEE.csv'.B662]) ->  | C662: of:=IF(ISBLANK(['BenchBudEE.csv'.C797]);"";MID(['BenchBudEE.csv'.C797];SEARCH(":";['BenchBudEE.csv'.C797])+1;100)) ->  | D662: of:=IF(ISBLANK(['BenchBudEE.csv'.D662]);"";['BenchBudEE.csv'.D662]) ->  | E662: of:=IF(ISBLANK(['BenchBudEE.csv'.E662]);"";['BenchBudEE.csv'.E662]) ->  | F662: of:=IF(ISBLANK(['BenchBudEE.csv'.F662]);"";['BenchBudEE.csv'.F662]) ->  | G662: of:=IF(ISNUMBER(SEARCH("[0-9]";[.A662]));MID([.A662];1;SEARCH("[0-9]";[.A662])-1);"") -> 
A663: of:=IF(ISBLANK(['BenchBudEE.csv'.A663]);"";['BenchBudEE.csv'.A663]) ->  | B663: of:=IF(ISBLANK(['BenchBudEE.csv'.B663]);"";['BenchBudEE.csv'.B663]) ->  | C663: of:=IF(ISBLANK(['BenchBudEE.csv'.C798]);"";MID(['BenchBudEE.csv'.C798];SEARCH(":";['BenchBudEE.csv'.C798])+1;100)) ->  | D663: of:=IF(ISBLANK(['BenchBudEE.csv'.D663]);"";['BenchBudEE.csv'.D663]) ->  | E663: of:=IF(ISBLANK(['BenchBudEE.csv'.E663]);"";['BenchBudEE.csv'.E663]) ->  | F663: of:=IF(ISBLANK(['BenchBudEE.csv'.F663]);"";['BenchBudEE.csv'.F663]) ->  | G663: of:=IF(ISNUMBER(SEARCH("[0-9]";[.A663]));MID([.A663];1;SEARCH("[0-9]";[.A663])-1);"") -> 
A664: of:=IF(ISBLANK(['BenchBudEE.csv'.A664]);"";['BenchBudEE.csv'.A664]) ->  | B664: of:=IF(ISBLANK(['BenchBudEE.csv'.B664]);"";['BenchBudEE.csv'.B664]) ->  | C664: of:=IF(ISBLANK(['BenchBudEE.csv'.C799]);"";MID(['BenchBudEE.csv'.C799];SEARCH(":";['BenchBudEE.csv'.C799])+1;100)) ->  | D664: of:=IF(ISBLANK(['BenchBudEE.csv'.D664]);"";['BenchBudEE.csv'.D664]) ->  | E664: of:=IF(ISBLANK(['BenchBudEE.csv'.E664]);"";['BenchBudEE.csv'.E664]) ->  | F664: of:=IF(ISBLANK(['BenchBudEE.csv'.F664]);"";['BenchBudEE.csv'.F664]) ->  | G664: of:=IF(ISNUMBER(SEARCH("[0-9]";[.A664]));MID([.A664];1;SEARCH("[0-9]";[.A664])-1);"") -> 
A665: of:=IF(ISBLANK(['BenchBudEE.csv'.A665]);"";['BenchBudEE.csv'.A665]) ->  | B665: of:=IF(ISBLANK(['BenchBudEE.csv'.B665]);"";['BenchBudEE.csv'.B665]) ->  | C665: of:=IF(ISBLANK(['BenchBudEE.csv'.C800]);"";MID(['BenchBudEE.csv'.C800];SEARCH(":";['BenchBudEE.csv'.C800])+1;100)) ->  | D665: of:=IF(ISBLANK(['BenchBudEE.csv'.D665]);"";['BenchBudEE.csv'.D665]) ->  | E665: of:=IF(ISBLANK(['BenchBudEE.csv'.E665]);"";['BenchBudEE.csv'.E665]) ->  | F665: of:=IF(ISBLANK(['BenchBudEE.csv'.F665]);"";['BenchBudEE.csv'.F665]) ->  | G665: of:=IF(ISNUMBER(SEARCH("[0-9]";[.A665]));MID([.A665];1;SEARCH("[0-9]";[.A665])-1);"") -> 
A666: of:=IF(ISBLANK(['BenchBudEE.csv'.A666]);"";['BenchBudEE.csv'.A666]) ->  | B666: of:=IF(ISBLANK(['BenchBudEE.csv'.B666]);"";['BenchBudEE.csv'.B666]) ->  | C666: of:=IF(ISBLANK(['BenchBudEE.csv'.C801]);"";MID(['BenchBudEE.csv'.C801];SEARCH(":";['BenchBudEE.csv'.C801])+1;100)) ->  | D666: of:=IF(ISBLANK(['BenchBudEE.csv'.D666]);"";['BenchBudEE.csv'.D666]) ->  | E666: of:=IF(ISBLANK(['BenchBudEE.csv'.E666]);"";['BenchBudEE.csv'.E666]) ->  | F666: of:=IF(ISBLANK(['BenchBudEE.csv'.F666]);"";['BenchBudEE.csv'.F666]) ->  | G666: of:=IF(ISNUMBER(SEARCH("[0-9]";[.A666]));MID([.A666];1;SEARCH("[0-9]";[.A666])-1);"") -> 
A667: of:=IF(ISBLANK(['BenchBudEE.csv'.A667]);"";['BenchBudEE.csv'.A667]) ->  | B667: of:=IF(ISBLANK(['BenchBudEE.csv'.B667]);"";['BenchBudEE.csv'.B667]) ->  | C667: of:=IF(ISBLANK(['BenchBudEE.csv'.C802]);"";MID(['BenchBudEE.csv'.C802];SEARCH(":";['BenchBudEE.csv'.C802])+1;100)) ->  | D667: of:=IF(ISBLANK(['BenchBudEE.csv'.D667]);"";['BenchBudEE.csv'.D667]) ->  | E667: of:=IF(ISBLANK(['BenchBudEE.csv'.E667]);"";['BenchBudEE.csv'.E667]) ->  | F667: of:=IF(ISBLANK(['BenchBudEE.csv'.F667]);"";['BenchBudEE.csv'.F667]) ->  | G667: of:=IF(ISNUMBER(SEARCH("[0-9]";[.A667]));MID([.A667];1;SEARCH("[0-9]";[.A667])-1);"") -> 
A668: of:=IF(ISBLANK(['BenchBudEE.csv'.A668]);"";['BenchBudEE.csv'.A668]) ->  | B668: of:=IF(ISBLANK(['BenchBudEE.csv'.B668]);"";['BenchBudEE.csv'.B668]) ->  | C668: of:=IF(ISBLANK(['BenchBudEE.csv'.C803]);"";MID(['BenchBudEE.csv'.C803];SEARCH(":";['BenchBudEE.csv'.C803])+1;100)) ->  | D668: of:=IF(ISBLANK(['BenchBudEE.csv'.D668]);"";['BenchBudEE.csv'.D668]) ->  | E668: of:=IF(ISBLANK(['BenchBudEE.csv'.E668]);"";['BenchBudEE.csv'.E668]) ->  | F668: of:=IF(ISBLANK(['BenchBudEE.csv'.F668]);"";['BenchBudEE.csv'.F668]) ->  | G668: of:=IF(ISNUMBER(SEARCH("[0-9]";[.A668]));MID([.A668];1;SEARCH("[0-9]";[.A668])-1);"") -> 
A669: of:=IF(ISBLANK(['BenchBudEE.csv'.A669]);"";['BenchBudEE.csv'.A669]) ->  | B669: of:=IF(ISBLANK(['BenchBudEE.csv'.B669]);"";['BenchBudEE.csv'.B669]) ->  | C669: of:=IF(ISBLANK(['BenchBudEE.csv'.C804]);"";MID(['BenchBudEE.csv'.C804];SEARCH(":";['BenchBudEE.csv'.C804])+1;100)) ->  | D669: of:=IF(ISBLANK(['BenchBudEE.csv'.D669]);"";['BenchBudEE.csv'.D669]) ->  | E669: of:=IF(ISBLANK(['BenchBudEE.csv'.E669]);"";['BenchBudEE.csv'.E669]) ->  | F669: of:=IF(ISBLANK(['BenchBudEE.csv'.F669]);"";['BenchBudEE.csv'.F669]) ->  | G669: of:=IF(ISNUMBER(SEARCH("[0-9]";[.A669]));MID([.A669];1;SEARCH("[0-9]";[.A669])-1);"") -> 
A670: of:=IF(ISBLANK(['BenchBudEE.csv'.A670]);"";['BenchBudEE.csv'.A670]) ->  | B670: of:=IF(ISBLANK(['BenchBudEE.csv'.B670]);"";['BenchBudEE.csv'.B670]) ->  | C670: of:=IF(ISBLANK(['BenchBudEE.csv'.C805]);"";MID(['BenchBudEE.csv'.C805];SEARCH(":";['BenchBudEE.csv'.C805])+1;100)) ->  | D670: of:=IF(ISBLANK(['BenchBudEE.csv'.D670]);"";['BenchBudEE.csv'.D670]) ->  | E670: of:=IF(ISBLANK(['BenchBudEE.csv'.E670]);"";['BenchBudEE.csv'.E670]) ->  | F670: of:=IF(ISBLANK(['BenchBudEE.csv'.F670]);"";['BenchBudEE.csv'.F670]) ->  | G670: of:=IF(ISNUMBER(SEARCH("[0-9]";[.A670]));MID([.A670];1;SEARCH("[0-9]";[.A670])-1);"") -> 
A671: of:=IF(ISBLANK(['BenchBudEE.csv'.A671]);"";['BenchBudEE.csv'.A671]) ->  | B671: of:=IF(ISBLANK(['BenchBudEE.csv'.B671]);"";['BenchBudEE.csv'.B671]) ->  | C671: of:=IF(ISBLANK(['BenchBudEE.csv'.C806]);"";MID(['BenchBudEE.csv'.C806];SEARCH(":";['BenchBudEE.csv'.C806])+1;100)) ->  | D671: of:=IF(ISBLANK(['BenchBudEE.csv'.D671]);"";['BenchBudEE.csv'.D671]) ->  | E671: of:=IF(ISBLANK(['BenchBudEE.csv'.E671]);"";['BenchBudEE.csv'.E671]) ->  | F671: of:=IF(ISBLANK(['BenchBudEE.csv'.F671]);"";['BenchBudEE.csv'.F671]) ->  | G671: of:=IF(ISNUMBER(SEARCH("[0-9]";[.A671]));MID([.A671];1;SEARCH("[0-9]";[.A671])-1);"") -> 
A672: of:=IF(ISBLANK(['BenchBudEE.csv'.A672]);"";['BenchBudEE.csv'.A672]) ->  | B672: of:=IF(ISBLANK(['BenchBudEE.csv'.B672]);"";['BenchBudEE.csv'.B672]) ->  | C672: of:=IF(ISBLANK(['BenchBudEE.csv'.C807]);"";MID(['BenchBudEE.csv'.C807];SEARCH(":";['BenchBudEE.csv'.C807])+1;100)) ->  | D672: of:=IF(ISBLANK(['BenchBudEE.csv'.D672]);"";['BenchBudEE.csv'.D672]) ->  | E672: of:=IF(ISBLANK(['BenchBudEE.csv'.E672]);"";['BenchBudEE.csv'.E672]) ->  | F672: of:=IF(ISBLANK(['BenchBudEE.csv'.F672]);"";['BenchBudEE.csv'.F672]) ->  | G672: of:=IF(ISNUMBER(SEARCH("[0-9]";[.A672]));MID([.A672];1;SEARCH("[0-9]";[.A672])-1);"") -> 
A673: of:=IF(ISBLANK(['BenchBudEE.csv'.A673]);"";['BenchBudEE.csv'.A673]) ->  | B673: of:=IF(ISBLANK(['BenchBudEE.csv'.B673]);"";['BenchBudEE.csv'.B673]) ->  | C673: of:=IF(ISBLANK(['BenchBudEE.csv'.C808]);"";MID(['BenchBudEE.csv'.C808];SEARCH(":";['BenchBudEE.csv'.C808])+1;100)) ->  | D673: of:=IF(ISBLANK(['BenchBudEE.csv'.D673]);"";['BenchBudEE.csv'.D673]) ->  | E673: of:=IF(ISBLANK(['BenchBudEE.csv'.E673]);"";['BenchBudEE.csv'.E673]) ->  | F673: of:=IF(ISBLANK(['BenchBudEE.csv'.F673]);"";['BenchBudEE.csv'.F673]) ->  | G673: of:=IF(ISNUMBER(SEARCH("[0-9]";[.A673]));MID([.A673];1;SEARCH("[0-9]";[.A673])-1);"") -> 
A674: of:=IF(ISBLANK(['BenchBudEE.csv'.A674]);"";['BenchBudEE.csv'.A674]) ->  | B674: of:=IF(ISBLANK(['BenchBudEE.csv'.B674]);"";['BenchBudEE.csv'.B674]) ->  | C674: of:=IF(ISBLANK(['BenchBudEE.csv'.C809]);"";MID(['BenchBudEE.csv'.C809];SEARCH(":";['BenchBudEE.csv'.C809])+1;100)) ->  | D674: of:=IF(ISBLANK(['BenchBudEE.csv'.D674]);"";['BenchBudEE.csv'.D674]) ->  | E674: of:=IF(ISBLANK(['BenchBudEE.csv'.E674]);"";['BenchBudEE.csv'.E674]) ->  | F674: of:=IF(ISBLANK(['BenchBudEE.csv'.F674]);"";['BenchBudEE.csv'.F674]) ->  | G674: of:=IF(ISNUMBER(SEARCH("[0-9]";[.A674]));MID([.A674];1;SEARCH("[0-9]";[.A674])-1);"") -> 
A675: of:=IF(ISBLANK(['BenchBudEE.csv'.A675]);"";['BenchBudEE.csv'.A675]) ->  | B675: of:=IF(ISBLANK(['BenchBudEE.csv'.B675]);"";['BenchBudEE.csv'.B675]) ->  | C675: of:=IF(ISBLANK(['BenchBudEE.csv'.C810]);"";MID(['BenchBudEE.csv'.C810];SEARCH(":";['BenchBudEE.csv'.C810])+1;100)) ->  | D675: of:=IF(ISBLANK(['BenchBudEE.csv'.D675]);"";['BenchBudEE.csv'.D675]) ->  | E675: of:=IF(ISBLANK(['BenchBudEE.csv'.E675]);"";['BenchBudEE.csv'.E675]) ->  | F675: of:=IF(ISBLANK(['BenchBudEE.csv'.F675]);"";['BenchBudEE.csv'.F675]) ->  | G675: of:=IF(ISNUMBER(SEARCH("[0-9]";[.A675]));MID([.A675];1;SEARCH("[0-9]";[.A675])-1);"") -> 
A676: of:=IF(ISBLANK(['BenchBudEE.csv'.A676]);"";['BenchBudEE.csv'.A676]) ->  | B676: of:=IF(ISBLANK(['BenchBudEE.csv'.B676]);"";['BenchBudEE.csv'.B676]) ->  | C676: of:=IF(ISBLANK(['BenchBudEE.csv'.C811]);"";MID(['BenchBudEE.csv'.C811];SEARCH(":";['BenchBudEE.csv'.C811])+1;100)) ->  | D676: of:=IF(ISBLANK(['BenchBudEE.csv'.D676]);"";['BenchBudEE.csv'.D676]) ->  | E676: of:=IF(ISBLANK(['BenchBudEE.csv'.E676]);"";['BenchBudEE.csv'.E676]) ->  | F676: of:=IF(ISBLANK(['BenchBudEE.csv'.F676]);"";['BenchBudEE.csv'.F676]) ->  | G676: of:=IF(ISNUMBER(SEARCH("[0-9]";[.A676]));MID([.A676];1;SEARCH("[0-9]";[.A676])-1);"") -> 
A677: of:=IF(ISBLANK(['BenchBudEE.csv'.A677]);"";['BenchBudEE.csv'.A677]) ->  | B677: of:=IF(ISBLANK(['BenchBudEE.csv'.B677]);"";['BenchBudEE.csv'.B677]) ->  | C677: of:=IF(ISBLANK(['BenchBudEE.csv'.C812]);"";MID(['BenchBudEE.csv'.C812];SEARCH(":";['BenchBudEE.csv'.C812])+1;100)) ->  | D677: of:=IF(ISBLANK(['BenchBudEE.csv'.D677]);"";['BenchBudEE.csv'.D677]) ->  | E677: of:=IF(ISBLANK(['BenchBudEE.csv'.E677]);"";['BenchBudEE.csv'.E677]) ->  | F677: of:=IF(ISBLANK(['BenchBudEE.csv'.F677]);"";['BenchBudEE.csv'.F677]) ->  | G677: of:=IF(ISNUMBER(SEARCH("[0-9]";[.A677]));MID([.A677];1;SEARCH("[0-9]";[.A677])-1);"") -> 
A678: of:=IF(ISBLANK(['BenchBudEE.csv'.A678]);"";['BenchBudEE.csv'.A678]) ->  | B678: of:=IF(ISBLANK(['BenchBudEE.csv'.B678]);"";['BenchBudEE.csv'.B678]) ->  | C678: of:=IF(ISBLANK(['BenchBudEE.csv'.C813]);"";MID(['BenchBudEE.csv'.C813];SEARCH(":";['BenchBudEE.csv'.C813])+1;100)) ->  | D678: of:=IF(ISBLANK(['BenchBudEE.csv'.D678]);"";['BenchBudEE.csv'.D678]) ->  | E678: of:=IF(ISBLANK(['BenchBudEE.csv'.E678]);"";['BenchBudEE.csv'.E678]) ->  | F678: of:=IF(ISBLANK(['BenchBudEE.csv'.F678]);"";['BenchBudEE.csv'.F678]) ->  | G678: of:=IF(ISNUMBER(SEARCH("[0-9]";[.A678]));MID([.A678];1;SEARCH("[0-9]";[.A678])-1);"") -> 
A679: of:=IF(ISBLANK(['BenchBudEE.csv'.A679]);"";['BenchBudEE.csv'.A679]) ->  | B679: of:=IF(ISBLANK(['BenchBudEE.csv'.B679]);"";['BenchBudEE.csv'.B679]) ->  | C679: of:=IF(ISBLANK(['BenchBudEE.csv'.C814]);"";MID(['BenchBudEE.csv'.C814];SEARCH(":";['BenchBudEE.csv'.C814])+1;100)) ->  | D679: of:=IF(ISBLANK(['BenchBudEE.csv'.D679]);"";['BenchBudEE.csv'.D679]) ->  | E679: of:=IF(ISBLANK(['BenchBudEE.csv'.E679]);"";['BenchBudEE.csv'.E679]) ->  | F679: of:=IF(ISBLANK(['BenchBudEE.csv'.F679]);"";['BenchBudEE.csv'.F679]) ->  | G679: of:=IF(ISNUMBER(SEARCH("[0-9]";[.A679]));MID([.A679];1;SEARCH("[0-9]";[.A679])-1);"") -> 
A680: of:=IF(ISBLANK(['BenchBudEE.csv'.A680]);"";['BenchBudEE.csv'.A680]) ->  | B680: of:=IF(ISBLANK(['BenchBudEE.csv'.B680]);"";['BenchBudEE.csv'.B680]) ->  | C680: of:=IF(ISBLANK(['BenchBudEE.csv'.C815]);"";MID(['BenchBudEE.csv'.C815];SEARCH(":";['BenchBudEE.csv'.C815])+1;100)) ->  | D680: of:=IF(ISBLANK(['BenchBudEE.csv'.D680]);"";['BenchBudEE.csv'.D680]) ->  | E680: of:=IF(ISBLANK(['BenchBudEE.csv'.E680]);"";['BenchBudEE.csv'.E680]) ->  | F680: of:=IF(ISBLANK(['BenchBudEE.csv'.F680]);"";['BenchBudEE.csv'.F680]) ->  | G680: of:=IF(ISNUMBER(SEARCH("[0-9]";[.A680]));MID([.A680];1;SEARCH("[0-9]";[.A680])-1);"") -> 
A681: of:=IF(ISBLANK(['BenchBudEE.csv'.A681]);"";['BenchBudEE.csv'.A681]) ->  | B681: of:=IF(ISBLANK(['BenchBudEE.csv'.B681]);"";['BenchBudEE.csv'.B681]) ->  | C681: of:=IF(ISBLANK(['BenchBudEE.csv'.C816]);"";MID(['BenchBudEE.csv'.C816];SEARCH(":";['BenchBudEE.csv'.C816])+1;100)) ->  | D681: of:=IF(ISBLANK(['BenchBudEE.csv'.D681]);"";['BenchBudEE.csv'.D681]) ->  | E681: of:=IF(ISBLANK(['BenchBudEE.csv'.E681]);"";['BenchBudEE.csv'.E681]) ->  | F681: of:=IF(ISBLANK(['BenchBudEE.csv'.F681]);"";['BenchBudEE.csv'.F681]) ->  | G681: of:=IF(ISNUMBER(SEARCH("[0-9]";[.A681]));MID([.A681];1;SEARCH("[0-9]";[.A681])-1);"") -> 
A682: of:=IF(ISBLANK(['BenchBudEE.csv'.A682]);"";['BenchBudEE.csv'.A682]) ->  | B682: of:=IF(ISBLANK(['BenchBudEE.csv'.B682]);"";['BenchBudEE.csv'.B682]) ->  | C682: of:=IF(ISBLANK(['BenchBudEE.csv'.C817]);"";MID(['BenchBudEE.csv'.C817];SEARCH(":";['BenchBudEE.csv'.C817])+1;100)) ->  | D682: of:=IF(ISBLANK(['BenchBudEE.csv'.D682]);"";['BenchBudEE.csv'.D682]) ->  | E682: of:=IF(ISBLANK(['BenchBudEE.csv'.E682]);"";['BenchBudEE.csv'.E682]) ->  | F682: of:=IF(ISBLANK(['BenchBudEE.csv'.F682]);"";['BenchBudEE.csv'.F682]) ->  | G682: of:=IF(ISNUMBER(SEARCH("[0-9]";[.A682]));MID([.A682];1;SEARCH("[0-9]";[.A682])-1);"") -> 
A683: of:=IF(ISBLANK(['BenchBudEE.csv'.A683]);"";['BenchBudEE.csv'.A683]) ->  | B683: of:=IF(ISBLANK(['BenchBudEE.csv'.B683]);"";['BenchBudEE.csv'.B683]) ->  | C683: of:=IF(ISBLANK(['BenchBudEE.csv'.C818]);"";MID(['BenchBudEE.csv'.C818];SEARCH(":";['BenchBudEE.csv'.C818])+1;100)) ->  | D683: of:=IF(ISBLANK(['BenchBudEE.csv'.D683]);"";['BenchBudEE.csv'.D683]) ->  | E683: of:=IF(ISBLANK(['BenchBudEE.csv'.E683]);"";['BenchBudEE.csv'.E683]) ->  | F683: of:=IF(ISBLANK(['BenchBudEE.csv'.F683]);"";['BenchBudEE.csv'.F683]) ->  | G683: of:=IF(ISNUMBER(SEARCH("[0-9]";[.A683]));MID([.A683];1;SEARCH("[0-9]";[.A683])-1);"") -> 
A684: of:=IF(ISBLANK(['BenchBudEE.csv'.A684]);"";['BenchBudEE.csv'.A684]) ->  | B684: of:=IF(ISBLANK(['BenchBudEE.csv'.B684]);"";['BenchBudEE.csv'.B684]) ->  | C684: of:=IF(ISBLANK(['BenchBudEE.csv'.C819]);"";MID(['BenchBudEE.csv'.C819];SEARCH(":";['BenchBudEE.csv'.C819])+1;100)) ->  | D684: of:=IF(ISBLANK(['BenchBudEE.csv'.D684]);"";['BenchBudEE.csv'.D684]) ->  | E684: of:=IF(ISBLANK(['BenchBudEE.csv'.E684]);"";['BenchBudEE.csv'.E684]) ->  | F684: of:=IF(ISBLANK(['BenchBudEE.csv'.F684]);"";['BenchBudEE.csv'.F684]) ->  | G684: of:=IF(ISNUMBER(SEARCH("[0-9]";[.A684]));MID([.A684];1;SEARCH("[0-9]";[.A684])-1);"") -> 
A685: of:=IF(ISBLANK(['BenchBudEE.csv'.A685]);"";['BenchBudEE.csv'.A685]) ->  | B685: of:=IF(ISBLANK(['BenchBudEE.csv'.B685]);"";['BenchBudEE.csv'.B685]) ->  | C685: of:=IF(ISBLANK(['BenchBudEE.csv'.C820]);"";MID(['BenchBudEE.csv'.C820];SEARCH(":";['BenchBudEE.csv'.C820])+1;100)) ->  | D685: of:=IF(ISBLANK(['BenchBudEE.csv'.D685]);"";['BenchBudEE.csv'.D685]) ->  | E685: of:=IF(ISBLANK(['BenchBudEE.csv'.E685]);"";['BenchBudEE.csv'.E685]) ->  | F685: of:=IF(ISBLANK(['BenchBudEE.csv'.F685]);"";['BenchBudEE.csv'.F685]) ->  | G685: of:=IF(ISNUMBER(SEARCH("[0-9]";[.A685]));MID([.A685];1;SEARCH("[0-9]";[.A685])-1);"") -> 
A686: of:=IF(ISBLANK(['BenchBudEE.csv'.A686]);"";['BenchBudEE.csv'.A686]) ->  | B686: of:=IF(ISBLANK(['BenchBudEE.csv'.B686]);"";['BenchBudEE.csv'.B686]) ->  | C686: of:=IF(ISBLANK(['BenchBudEE.csv'.C821]);"";MID(['BenchBudEE.csv'.C821];SEARCH(":";['BenchBudEE.csv'.C821])+1;100)) ->  | D686: of:=IF(ISBLANK(['BenchBudEE.csv'.D686]);"";['BenchBudEE.csv'.D686]) ->  | E686: of:=IF(ISBLANK(['BenchBudEE.csv'.E686]);"";['BenchBudEE.csv'.E686]) ->  | F686: of:=IF(ISBLANK(['BenchBudEE.csv'.F686]);"";['BenchBudEE.csv'.F686]) ->  | G686: of:=IF(ISNUMBER(SEARCH("[0-9]";[.A686]));MID([.A686];1;SEARCH("[0-9]";[.A686])-1);"") -> 
A687: of:=IF(ISBLANK(['BenchBudEE.csv'.A687]);"";['BenchBudEE.csv'.A687]) ->  | B687: of:=IF(ISBLANK(['BenchBudEE.csv'.B687]);"";['BenchBudEE.csv'.B687]) ->  | C687: of:=IF(ISBLANK(['BenchBudEE.csv'.C822]);"";MID(['BenchBudEE.csv'.C822];SEARCH(":";['BenchBudEE.csv'.C822])+1;100)) ->  | D687: of:=IF(ISBLANK(['BenchBudEE.csv'.D687]);"";['BenchBudEE.csv'.D687]) ->  | E687: of:=IF(ISBLANK(['BenchBudEE.csv'.E687]);"";['BenchBudEE.csv'.E687]) ->  | F687: of:=IF(ISBLANK(['BenchBudEE.csv'.F687]);"";['BenchBudEE.csv'.F687]) ->  | G687: of:=IF(ISNUMBER(SEARCH("[0-9]";[.A687]));MID([.A687];1;SEARCH("[0-9]";[.A687])-1);"") -> 
A688: of:=IF(ISBLANK(['BenchBudEE.csv'.A688]);"";['BenchBudEE.csv'.A688]) ->  | B688: of:=IF(ISBLANK(['BenchBudEE.csv'.B688]);"";['BenchBudEE.csv'.B688]) ->  | C688: of:=IF(ISBLANK(['BenchBudEE.csv'.C823]);"";MID(['BenchBudEE.csv'.C823];SEARCH(":";['BenchBudEE.csv'.C823])+1;100)) ->  | D688: of:=IF(ISBLANK(['BenchBudEE.csv'.D688]);"";['BenchBudEE.csv'.D688]) ->  | E688: of:=IF(ISBLANK(['BenchBudEE.csv'.E688]);"";['BenchBudEE.csv'.E688]) ->  | F688: of:=IF(ISBLANK(['BenchBudEE.csv'.F688]);"";['BenchBudEE.csv'.F688]) ->  | G688: of:=IF(ISNUMBER(SEARCH("[0-9]";[.A688]));MID([.A688];1;SEARCH("[0-9]";[.A688])-1);"") -> 
A689: of:=IF(ISBLANK(['BenchBudEE.csv'.A689]);"";['BenchBudEE.csv'.A689]) ->  | B689: of:=IF(ISBLANK(['BenchBudEE.csv'.B689]);"";['BenchBudEE.csv'.B689]) ->  | C689: of:=IF(ISBLANK(['BenchBudEE.csv'.C824]);"";MID(['BenchBudEE.csv'.C824];SEARCH(":";['BenchBudEE.csv'.C824])+1;100)) ->  | D689: of:=IF(ISBLANK(['BenchBudEE.csv'.D689]);"";['BenchBudEE.csv'.D689]) ->  | E689: of:=IF(ISBLANK(['BenchBudEE.csv'.E689]);"";['BenchBudEE.csv'.E689]) ->  | F689: of:=IF(ISBLANK(['BenchBudEE.csv'.F689]);"";['BenchBudEE.csv'.F689]) ->  | G689: of:=IF(ISNUMBER(SEARCH("[0-9]";[.A689]));MID([.A689];1;SEARCH("[0-9]";[.A689])-1);"") -> 
A690: of:=IF(ISBLANK(['BenchBudEE.csv'.A690]);"";['BenchBudEE.csv'.A690]) ->  | B690: of:=IF(ISBLANK(['BenchBudEE.csv'.B690]);"";['BenchBudEE.csv'.B690]) ->  | C690: of:=IF(ISBLANK(['BenchBudEE.csv'.C825]);"";MID(['BenchBudEE.csv'.C825];SEARCH(":";['BenchBudEE.csv'.C825])+1;100)) ->  | D690: of:=IF(ISBLANK(['BenchBudEE.csv'.D690]);"";['BenchBudEE.csv'.D690]) ->  | E690: of:=IF(ISBLANK(['BenchBudEE.csv'.E690]);"";['BenchBudEE.csv'.E690]) ->  | F690: of:=IF(ISBLANK(['BenchBudEE.csv'.F690]);"";['BenchBudEE.csv'.F690]) ->  | G690: of:=IF(ISNUMBER(SEARCH("[0-9]";[.A690]));MID([.A690];1;SEARCH("[0-9]";[.A690])-1);"") -> 
A691: of:=IF(ISBLANK(['BenchBudEE.csv'.A691]);"";['BenchBudEE.csv'.A691]) ->  | B691: of:=IF(ISBLANK(['BenchBudEE.csv'.B691]);"";['BenchBudEE.csv'.B691]) ->  | C691: of:=IF(ISBLANK(['BenchBudEE.csv'.C826]);"";MID(['BenchBudEE.csv'.C826];SEARCH(":";['BenchBudEE.csv'.C826])+1;100)) ->  | D691: of:=IF(ISBLANK(['BenchBudEE.csv'.D691]);"";['BenchBudEE.csv'.D691]) ->  | E691: of:=IF(ISBLANK(['BenchBudEE.csv'.E691]);"";['BenchBudEE.csv'.E691]) ->  | F691: of:=IF(ISBLANK(['BenchBudEE.csv'.F691]);"";['BenchBudEE.csv'.F691]) ->  | G691: of:=IF(ISNUMBER(SEARCH("[0-9]";[.A691]));MID([.A691];1;SEARCH("[0-9]";[.A691])-1);"") -> 
A692: of:=IF(ISBLANK(['BenchBudEE.csv'.A692]);"";['BenchBudEE.csv'.A692]) ->  | B692: of:=IF(ISBLANK(['BenchBudEE.csv'.B692]);"";['BenchBudEE.csv'.B692]) ->  | C692: of:=IF(ISBLANK(['BenchBudEE.csv'.C827]);"";MID(['BenchBudEE.csv'.C827];SEARCH(":";['BenchBudEE.csv'.C827])+1;100)) ->  | D692: of:=IF(ISBLANK(['BenchBudEE.csv'.D692]);"";['BenchBudEE.csv'.D692]) ->  | E692: of:=IF(ISBLANK(['BenchBudEE.csv'.E692]);"";['BenchBudEE.csv'.E692]) ->  | F692: of:=IF(ISBLANK(['BenchBudEE.csv'.F692]);"";['BenchBudEE.csv'.F692]) ->  | G692: of:=IF(ISNUMBER(SEARCH("[0-9]";[.A692]));MID([.A692];1;SEARCH("[0-9]";[.A692])-1);"") -> 
A693: of:=IF(ISBLANK(['BenchBudEE.csv'.A693]);"";['BenchBudEE.csv'.A693]) ->  | B693: of:=IF(ISBLANK(['BenchBudEE.csv'.B693]);"";['BenchBudEE.csv'.B693]) ->  | C693: of:=IF(ISBLANK(['BenchBudEE.csv'.C828]);"";MID(['BenchBudEE.csv'.C828];SEARCH(":";['BenchBudEE.csv'.C828])+1;100)) ->  | D693: of:=IF(ISBLANK(['BenchBudEE.csv'.D693]);"";['BenchBudEE.csv'.D693]) ->  | E693: of:=IF(ISBLANK(['BenchBudEE.csv'.E693]);"";['BenchBudEE.csv'.E693]) ->  | F693: of:=IF(ISBLANK(['BenchBudEE.csv'.F693]);"";['BenchBudEE.csv'.F693]) ->  | G693: of:=IF(ISNUMBER(SEARCH("[0-9]";[.A693]));MID([.A693];1;SEARCH("[0-9]";[.A693])-1);"") -> 
A694: of:=IF(ISBLANK(['BenchBudEE.csv'.A694]);"";['BenchBudEE.csv'.A694]) ->  | B694: of:=IF(ISBLANK(['BenchBudEE.csv'.B694]);"";['BenchBudEE.csv'.B694]) ->  | C694: of:=IF(ISBLANK(['BenchBudEE.csv'.C829]);"";MID(['BenchBudEE.csv'.C829];SEARCH(":";['BenchBudEE.csv'.C829])+1;100)) ->  | D694: of:=IF(ISBLANK(['BenchBudEE.csv'.D694]);"";['BenchBudEE.csv'.D694]) ->  | E694: of:=IF(ISBLANK(['BenchBudEE.csv'.E694]);"";['BenchBudEE.csv'.E694]) ->  | F694: of:=IF(ISBLANK(['BenchBudEE.csv'.F694]);"";['BenchBudEE.csv'.F694]) ->  | G694: of:=IF(ISNUMBER(SEARCH("[0-9]";[.A694]));MID([.A694];1;SEARCH("[0-9]";[.A694])-1);"") -> 
A695: of:=IF(ISBLANK(['BenchBudEE.csv'.A695]);"";['BenchBudEE.csv'.A695]) ->  | B695: of:=IF(ISBLANK(['BenchBudEE.csv'.B695]);"";['BenchBudEE.csv'.B695]) ->  | C695: of:=IF(ISBLANK(['BenchBudEE.csv'.C830]);"";MID(['BenchBudEE.csv'.C830];SEARCH(":";['BenchBudEE.csv'.C830])+1;100)) ->  | D695: of:=IF(ISBLANK(['BenchBudEE.csv'.D695]);"";['BenchBudEE.csv'.D695]) ->  | E695: of:=IF(ISBLANK(['BenchBudEE.csv'.E695]);"";['BenchBudEE.csv'.E695]) ->  | F695: of:=IF(ISBLANK(['BenchBudEE.csv'.F695]);"";['BenchBudEE.csv'.F695]) ->  | G695: of:=IF(ISNUMBER(SEARCH("[0-9]";[.A695]));MID([.A695];1;SEARCH("[0-9]";[.A695])-1);"") -> 
A696: of:=IF(ISBLANK(['BenchBudEE.csv'.A696]);"";['BenchBudEE.csv'.A696]) ->  | B696: of:=IF(ISBLANK(['BenchBudEE.csv'.B696]);"";['BenchBudEE.csv'.B696]) ->  | C696: of:=IF(ISBLANK(['BenchBudEE.csv'.C831]);"";MID(['BenchBudEE.csv'.C831];SEARCH(":";['BenchBudEE.csv'.C831])+1;100)) ->  | D696: of:=IF(ISBLANK(['BenchBudEE.csv'.D696]);"";['BenchBudEE.csv'.D696]) ->  | E696: of:=IF(ISBLANK(['BenchBudEE.csv'.E696]);"";['BenchBudEE.csv'.E696]) ->  | F696: of:=IF(ISBLANK(['BenchBudEE.csv'.F696]);"";['BenchBudEE.csv'.F696]) ->  | G696: of:=IF(ISNUMBER(SEARCH("[0-9]";[.A696]));MID([.A696];1;SEARCH("[0-9]";[.A696])-1);"") -> 
A697: of:=IF(ISBLANK(['BenchBudEE.csv'.A697]);"";['BenchBudEE.csv'.A697]) ->  | B697: of:=IF(ISBLANK(['BenchBudEE.csv'.B697]);"";['BenchBudEE.csv'.B697]) ->  | C697: of:=IF(ISBLANK(['BenchBudEE.csv'.C832]);"";MID(['BenchBudEE.csv'.C832];SEARCH(":";['BenchBudEE.csv'.C832])+1;100)) ->  | D697: of:=IF(ISBLANK(['BenchBudEE.csv'.D697]);"";['BenchBudEE.csv'.D697]) ->  | E697: of:=IF(ISBLANK(['BenchBudEE.csv'.E697]);"";['BenchBudEE.csv'.E697]) ->  | F697: of:=IF(ISBLANK(['BenchBudEE.csv'.F697]);"";['BenchBudEE.csv'.F697]) ->  | G697: of:=IF(ISNUMBER(SEARCH("[0-9]";[.A697]));MID([.A697];1;SEARCH("[0-9]";[.A697])-1);"") -> 
A698: of:=IF(ISBLANK(['BenchBudEE.csv'.A698]);"";['BenchBudEE.csv'.A698]) ->  | B698: of:=IF(ISBLANK(['BenchBudEE.csv'.B698]);"";['BenchBudEE.csv'.B698]) ->  | C698: of:=IF(ISBLANK(['BenchBudEE.csv'.C833]);"";MID(['BenchBudEE.csv'.C833];SEARCH(":";['BenchBudEE.csv'.C833])+1;100)) ->  | D698: of:=IF(ISBLANK(['BenchBudEE.csv'.D698]);"";['BenchBudEE.csv'.D698]) ->  | E698: of:=IF(ISBLANK(['BenchBudEE.csv'.E698]);"";['BenchBudEE.csv'.E698]) ->  | F698: of:=IF(ISBLANK(['BenchBudEE.csv'.F698]);"";['BenchBudEE.csv'.F698]) ->  | G698: of:=IF(ISNUMBER(SEARCH("[0-9]";[.A698]));MID([.A698];1;SEARCH("[0-9]";[.A698])-1);"") -> 
A699: of:=IF(ISBLANK(['BenchBudEE.csv'.A699]);"";['BenchBudEE.csv'.A699]) ->  | B699: of:=IF(ISBLANK(['BenchBudEE.csv'.B699]);"";['BenchBudEE.csv'.B699]) ->  | C699: of:=IF(ISBLANK(['BenchBudEE.csv'.C834]);"";MID(['BenchBudEE.csv'.C834];SEARCH(":";['BenchBudEE.csv'.C834])+1;100)) ->  | D699: of:=IF(ISBLANK(['BenchBudEE.csv'.D699]);"";['BenchBudEE.csv'.D699]) ->  | E699: of:=IF(ISBLANK(['BenchBudEE.csv'.E699]);"";['BenchBudEE.csv'.E699]) ->  | F699: of:=IF(ISBLANK(['BenchBudEE.csv'.F699]);"";['BenchBudEE.csv'.F699]) ->  | G699: of:=IF(ISNUMBER(SEARCH("[0-9]";[.A699]));MID([.A699];1;SEARCH("[0-9]";[.A699])-1);"") -> 
A700: of:=IF(ISBLANK(['BenchBudEE.csv'.A700]);"";['BenchBudEE.csv'.A700]) ->  | B700: of:=IF(ISBLANK(['BenchBudEE.csv'.B700]);"";['BenchBudEE.csv'.B700]) ->  | C700: of:=IF(ISBLANK(['BenchBudEE.csv'.C835]);"";MID(['BenchBudEE.csv'.C835];SEARCH(":";['BenchBudEE.csv'.C835])+1;100)) ->  | D700: of:=IF(ISBLANK(['BenchBudEE.csv'.D700]);"";['BenchBudEE.csv'.D700]) ->  | E700: of:=IF(ISBLANK(['BenchBudEE.csv'.E700]);"";['BenchBudEE.csv'.E700]) ->  | F700: of:=IF(ISBLANK(['BenchBudEE.csv'.F700]);"";['BenchBudEE.csv'.F700]) ->  | G700: of:=IF(ISNUMBER(SEARCH("[0-9]";[.A700]));MID([.A700];1;SEARCH("[0-9]";[.A700])-1);"") -> 
A701: of:=IF(ISBLANK(['BenchBudEE.csv'.A701]);"";['BenchBudEE.csv'.A701]) ->  | B701: of:=IF(ISBLANK(['BenchBudEE.csv'.B701]);"";['BenchBudEE.csv'.B701]) ->  | C701: of:=IF(ISBLANK(['BenchBudEE.csv'.C836]);"";MID(['BenchBudEE.csv'.C836];SEARCH(":";['BenchBudEE.csv'.C836])+1;100)) ->  | D701: of:=IF(ISBLANK(['BenchBudEE.csv'.D701]);"";['BenchBudEE.csv'.D701]) ->  | E701: of:=IF(ISBLANK(['BenchBudEE.csv'.E701]);"";['BenchBudEE.csv'.E701]) ->  | F701: of:=IF(ISBLANK(['BenchBudEE.csv'.F701]);"";['BenchBudEE.csv'.F701]) ->  | G701: of:=IF(ISNUMBER(SEARCH("[0-9]";[.A701]));MID([.A701];1;SEARCH("[0-9]";[.A701])-1);"") -> 
A702: of:=IF(ISBLANK(['BenchBudEE.csv'.A702]);"";['BenchBudEE.csv'.A702]) ->  | B702: of:=IF(ISBLANK(['BenchBudEE.csv'.B702]);"";['BenchBudEE.csv'.B702]) ->  | C702: of:=IF(ISBLANK(['BenchBudEE.csv'.C837]);"";MID(['BenchBudEE.csv'.C837];SEARCH(":";['BenchBudEE.csv'.C837])+1;100)) ->  | D702: of:=IF(ISBLANK(['BenchBudEE.csv'.D702]);"";['BenchBudEE.csv'.D702]) ->  | E702: of:=IF(ISBLANK(['BenchBudEE.csv'.E702]);"";['BenchBudEE.csv'.E702]) ->  | F702: of:=IF(ISBLANK(['BenchBudEE.csv'.F702]);"";['BenchBudEE.csv'.F702]) ->  | G702: of:=IF(ISNUMBER(SEARCH("[0-9]";[.A702]));MID([.A702];1;SEARCH("[0-9]";[.A702])-1);"") -> 
A703: of:=IF(ISBLANK(['BenchBudEE.csv'.A703]);"";['BenchBudEE.csv'.A703]) ->  | B703: of:=IF(ISBLANK(['BenchBudEE.csv'.B703]);"";['BenchBudEE.csv'.B703]) ->  | C703: of:=IF(ISBLANK(['BenchBudEE.csv'.C838]);"";MID(['BenchBudEE.csv'.C838];SEARCH(":";['BenchBudEE.csv'.C838])+1;100)) ->  | D703: of:=IF(ISBLANK(['BenchBudEE.csv'.D703]);"";['BenchBudEE.csv'.D703]) ->  | E703: of:=IF(ISBLANK(['BenchBudEE.csv'.E703]);"";['BenchBudEE.csv'.E703]) ->  | F703: of:=IF(ISBLANK(['BenchBudEE.csv'.F703]);"";['BenchBudEE.csv'.F703]) ->  | G703: of:=IF(ISNUMBER(SEARCH("[0-9]";[.A703]));MID([.A703];1;SEARCH("[0-9]";[.A703])-1);"") -> 
A704: of:=IF(ISBLANK(['BenchBudEE.csv'.A704]);"";['BenchBudEE.csv'.A704]) ->  | B704: of:=IF(ISBLANK(['BenchBudEE.csv'.B704]);"";['BenchBudEE.csv'.B704]) ->  | C704: of:=IF(ISBLANK(['BenchBudEE.csv'.C839]);"";MID(['BenchBudEE.csv'.C839];SEARCH(":";['BenchBudEE.csv'.C839])+1;100)) ->  | D704: of:=IF(ISBLANK(['BenchBudEE.csv'.D704]);"";['BenchBudEE.csv'.D704]) ->  | E704: of:=IF(ISBLANK(['BenchBudEE.csv'.E704]);"";['BenchBudEE.csv'.E704]) ->  | F704: of:=IF(ISBLANK(['BenchBudEE.csv'.F704]);"";['BenchBudEE.csv'.F704]) ->  | G704: of:=IF(ISNUMBER(SEARCH("[0-9]";[.A704]));MID([.A704];1;SEARCH("[0-9]";[.A704])-1);"") -> 
A705: of:=IF(ISBLANK(['BenchBudEE.csv'.A705]);"";['BenchBudEE.csv'.A705]) ->  | B705: of:=IF(ISBLANK(['BenchBudEE.csv'.B705]);"";['BenchBudEE.csv'.B705]) ->  | C705: of:=IF(ISBLANK(['BenchBudEE.csv'.C840]);"";MID(['BenchBudEE.csv'.C840];SEARCH(":";['BenchBudEE.csv'.C840])+1;100)) ->  | D705: of:=IF(ISBLANK(['BenchBudEE.csv'.D705]);"";['BenchBudEE.csv'.D705]) ->  | E705: of:=IF(ISBLANK(['BenchBudEE.csv'.E705]);"";['BenchBudEE.csv'.E705]) ->  | F705: of:=IF(ISBLANK(['BenchBudEE.csv'.F705]);"";['BenchBudEE.csv'.F705]) ->  | G705: of:=IF(ISNUMBER(SEARCH("[0-9]";[.A705]));MID([.A705];1;SEARCH("[0-9]";[.A705])-1);"") -> 
A706: of:=IF(ISBLANK(['BenchBudEE.csv'.A706]);"";['BenchBudEE.csv'.A706]) ->  | B706: of:=IF(ISBLANK(['BenchBudEE.csv'.B706]);"";['BenchBudEE.csv'.B706]) ->  | C706: of:=IF(ISBLANK(['BenchBudEE.csv'.C841]);"";MID(['BenchBudEE.csv'.C841];SEARCH(":";['BenchBudEE.csv'.C841])+1;100)) ->  | D706: of:=IF(ISBLANK(['BenchBudEE.csv'.D706]);"";['BenchBudEE.csv'.D706]) ->  | E706: of:=IF(ISBLANK(['BenchBudEE.csv'.E706]);"";['BenchBudEE.csv'.E706]) ->  | F706: of:=IF(ISBLANK(['BenchBudEE.csv'.F706]);"";['BenchBudEE.csv'.F706]) ->  | G706: of:=IF(ISNUMBER(SEARCH("[0-9]";[.A706]));MID([.A706];1;SEARCH("[0-9]";[.A706])-1);"") -> 
A707: of:=IF(ISBLANK(['BenchBudEE.csv'.A707]);"";['BenchBudEE.csv'.A707]) ->  | B707: of:=IF(ISBLANK(['BenchBudEE.csv'.B707]);"";['BenchBudEE.csv'.B707]) ->  | C707: of:=IF(ISBLANK(['BenchBudEE.csv'.C842]);"";MID(['BenchBudEE.csv'.C842];SEARCH(":";['BenchBudEE.csv'.C842])+1;100)) ->  | D707: of:=IF(ISBLANK(['BenchBudEE.csv'.D707]);"";['BenchBudEE.csv'.D707]) ->  | E707: of:=IF(ISBLANK(['BenchBudEE.csv'.E707]);"";['BenchBudEE.csv'.E707]) ->  | F707: of:=IF(ISBLANK(['BenchBudEE.csv'.F707]);"";['BenchBudEE.csv'.F707]) ->  | G707: of:=IF(ISNUMBER(SEARCH("[0-9]";[.A707]));MID([.A707];1;SEARCH("[0-9]";[.A707])-1);"") -> 
A708: of:=IF(ISBLANK(['BenchBudEE.csv'.A708]);"";['BenchBudEE.csv'.A708]) ->  | B708: of:=IF(ISBLANK(['BenchBudEE.csv'.B708]);"";['BenchBudEE.csv'.B708]) ->  | C708: of:=IF(ISBLANK(['BenchBudEE.csv'.C843]);"";MID(['BenchBudEE.csv'.C843];SEARCH(":";['BenchBudEE.csv'.C843])+1;100)) ->  | D708: of:=IF(ISBLANK(['BenchBudEE.csv'.D708]);"";['BenchBudEE.csv'.D708]) ->  | E708: of:=IF(ISBLANK(['BenchBudEE.csv'.E708]);"";['BenchBudEE.csv'.E708]) ->  | F708: of:=IF(ISBLANK(['BenchBudEE.csv'.F708]);"";['BenchBudEE.csv'.F708]) ->  | G708: of:=IF(ISNUMBER(SEARCH("[0-9]";[.A708]));MID([.A708];1;SEARCH("[0-9]";[.A708])-1);"") -> 
A709: of:=IF(ISBLANK(['BenchBudEE.csv'.A709]);"";['BenchBudEE.csv'.A709]) ->  | B709: of:=IF(ISBLANK(['BenchBudEE.csv'.B709]);"";['BenchBudEE.csv'.B709]) ->  | C709: of:=IF(ISBLANK(['BenchBudEE.csv'.C844]);"";MID(['BenchBudEE.csv'.C844];SEARCH(":";['BenchBudEE.csv'.C844])+1;100)) ->  | D709: of:=IF(ISBLANK(['BenchBudEE.csv'.D709]);"";['BenchBudEE.csv'.D709]) ->  | E709: of:=IF(ISBLANK(['BenchBudEE.csv'.E709]);"";['BenchBudEE.csv'.E709]) ->  | F709: of:=IF(ISBLANK(['BenchBudEE.csv'.F709]);"";['BenchBudEE.csv'.F709]) ->  | G709: of:=IF(ISNUMBER(SEARCH("[0-9]";[.A709]));MID([.A709];1;SEARCH("[0-9]";[.A709])-1);"") -> 
A710: of:=IF(ISBLANK(['BenchBudEE.csv'.A710]);"";['BenchBudEE.csv'.A710]) ->  | B710: of:=IF(ISBLANK(['BenchBudEE.csv'.B710]);"";['BenchBudEE.csv'.B710]) ->  | C710: of:=IF(ISBLANK(['BenchBudEE.csv'.C845]);"";MID(['BenchBudEE.csv'.C845];SEARCH(":";['BenchBudEE.csv'.C845])+1;100)) ->  | D710: of:=IF(ISBLANK(['BenchBudEE.csv'.D710]);"";['BenchBudEE.csv'.D710]) ->  | E710: of:=IF(ISBLANK(['BenchBudEE.csv'.E710]);"";['BenchBudEE.csv'.E710]) ->  | F710: of:=IF(ISBLANK(['BenchBudEE.csv'.F710]);"";['BenchBudEE.csv'.F710]) ->  | G710: of:=IF(ISNUMBER(SEARCH("[0-9]";[.A710]));MID([.A710];1;SEARCH("[0-9]";[.A710])-1);"") -> 
A711: of:=IF(ISBLANK(['BenchBudEE.csv'.A711]);"";['BenchBudEE.csv'.A711]) ->  | B711: of:=IF(ISBLANK(['BenchBudEE.csv'.B711]);"";['BenchBudEE.csv'.B711]) ->  | C711: of:=IF(ISBLANK(['BenchBudEE.csv'.C846]);"";MID(['BenchBudEE.csv'.C846];SEARCH(":";['BenchBudEE.csv'.C846])+1;100)) ->  | D711: of:=IF(ISBLANK(['BenchBudEE.csv'.D711]);"";['BenchBudEE.csv'.D711]) ->  | E711: of:=IF(ISBLANK(['BenchBudEE.csv'.E711]);"";['BenchBudEE.csv'.E711]) ->  | F711: of:=IF(ISBLANK(['BenchBudEE.csv'.F711]);"";['BenchBudEE.csv'.F711]) ->  | G711: of:=IF(ISNUMBER(SEARCH("[0-9]";[.A711]));MID([.A711];1;SEARCH("[0-9]";[.A711])-1);"") -> 
A712: of:=IF(ISBLANK(['BenchBudEE.csv'.A712]);"";['BenchBudEE.csv'.A712]) ->  | B712: of:=IF(ISBLANK(['BenchBudEE.csv'.B712]);"";['BenchBudEE.csv'.B712]) ->  | C712: of:=IF(ISBLANK(['BenchBudEE.csv'.C847]);"";MID(['BenchBudEE.csv'.C847];SEARCH(":";['BenchBudEE.csv'.C847])+1;100)) ->  | D712: of:=IF(ISBLANK(['BenchBudEE.csv'.D712]);"";['BenchBudEE.csv'.D712]) ->  | E712: of:=IF(ISBLANK(['BenchBudEE.csv'.E712]);"";['BenchBudEE.csv'.E712]) ->  | F712: of:=IF(ISBLANK(['BenchBudEE.csv'.F712]);"";['BenchBudEE.csv'.F712]) ->  | G712: of:=IF(ISNUMBER(SEARCH("[0-9]";[.A712]));MID([.A712];1;SEARCH("[0-9]";[.A712])-1);"") -> 
A713: of:=IF(ISBLANK(['BenchBudEE.csv'.A713]);"";['BenchBudEE.csv'.A713]) ->  | B713: of:=IF(ISBLANK(['BenchBudEE.csv'.B713]);"";['BenchBudEE.csv'.B713]) ->  | C713: of:=IF(ISBLANK(['BenchBudEE.csv'.C848]);"";MID(['BenchBudEE.csv'.C848];SEARCH(":";['BenchBudEE.csv'.C848])+1;100)) ->  | D713: of:=IF(ISBLANK(['BenchBudEE.csv'.D713]);"";['BenchBudEE.csv'.D713]) ->  | E713: of:=IF(ISBLANK(['BenchBudEE.csv'.E713]);"";['BenchBudEE.csv'.E713]) ->  | F713: of:=IF(ISBLANK(['BenchBudEE.csv'.F713]);"";['BenchBudEE.csv'.F713]) ->  | G713: of:=IF(ISNUMBER(SEARCH("[0-9]";[.A713]));MID([.A713];1;SEARCH("[0-9]";[.A713])-1);"") -> 
A714: of:=IF(ISBLANK(['BenchBudEE.csv'.A714]);"";['BenchBudEE.csv'.A714]) ->  | B714: of:=IF(ISBLANK(['BenchBudEE.csv'.B714]);"";['BenchBudEE.csv'.B714]) ->  | C714: of:=IF(ISBLANK(['BenchBudEE.csv'.C849]);"";MID(['BenchBudEE.csv'.C849];SEARCH(":";['BenchBudEE.csv'.C849])+1;100)) ->  | D714: of:=IF(ISBLANK(['BenchBudEE.csv'.D714]);"";['BenchBudEE.csv'.D714]) ->  | E714: of:=IF(ISBLANK(['BenchBudEE.csv'.E714]);"";['BenchBudEE.csv'.E714]) ->  | F714: of:=IF(ISBLANK(['BenchBudEE.csv'.F714]);"";['BenchBudEE.csv'.F714]) ->  | G714: of:=IF(ISNUMBER(SEARCH("[0-9]";[.A714]));MID([.A714];1;SEARCH("[0-9]";[.A714])-1);"") -> 
A715: of:=IF(ISBLANK(['BenchBudEE.csv'.A715]);"";['BenchBudEE.csv'.A715]) ->  | B715: of:=IF(ISBLANK(['BenchBudEE.csv'.B715]);"";['BenchBudEE.csv'.B715]) ->  | C715: of:=IF(ISBLANK(['BenchBudEE.csv'.C850]);"";MID(['BenchBudEE.csv'.C850];SEARCH(":";['BenchBudEE.csv'.C850])+1;100)) ->  | D715: of:=IF(ISBLANK(['BenchBudEE.csv'.D715]);"";['BenchBudEE.csv'.D715]) ->  | E715: of:=IF(ISBLANK(['BenchBudEE.csv'.E715]);"";['BenchBudEE.csv'.E715]) ->  | F715: of:=IF(ISBLANK(['BenchBudEE.csv'.F715]);"";['BenchBudEE.csv'.F715]) ->  | G715: of:=IF(ISNUMBER(SEARCH("[0-9]";[.A715]));MID([.A715];1;SEARCH("[0-9]";[.A715])-1);"") -> 
A716: of:=IF(ISBLANK(['BenchBudEE.csv'.A716]);"";['BenchBudEE.csv'.A716]) ->  | B716: of:=IF(ISBLANK(['BenchBudEE.csv'.B716]);"";['BenchBudEE.csv'.B716]) ->  | C716: of:=IF(ISBLANK(['BenchBudEE.csv'.C851]);"";MID(['BenchBudEE.csv'.C851];SEARCH(":";['BenchBudEE.csv'.C851])+1;100)) ->  | D716: of:=IF(ISBLANK(['BenchBudEE.csv'.D716]);"";['BenchBudEE.csv'.D716]) ->  | E716: of:=IF(ISBLANK(['BenchBudEE.csv'.E716]);"";['BenchBudEE.csv'.E716]) ->  | F716: of:=IF(ISBLANK(['BenchBudEE.csv'.F716]);"";['BenchBudEE.csv'.F716]) ->  | G716: of:=IF(ISNUMBER(SEARCH("[0-9]";[.A716]));MID([.A716];1;SEARCH("[0-9]";[.A716])-1);"") -> 
A717: of:=IF(ISBLANK(['BenchBudEE.csv'.A717]);"";['BenchBudEE.csv'.A717]) ->  | B717: of:=IF(ISBLANK(['BenchBudEE.csv'.B717]);"";['BenchBudEE.csv'.B717]) ->  | C717: of:=IF(ISBLANK(['BenchBudEE.csv'.C852]);"";MID(['BenchBudEE.csv'.C852];SEARCH(":";['BenchBudEE.csv'.C852])+1;100)) ->  | D717: of:=IF(ISBLANK(['BenchBudEE.csv'.D717]);"";['BenchBudEE.csv'.D717]) ->  | E717: of:=IF(ISBLANK(['BenchBudEE.csv'.E717]);"";['BenchBudEE.csv'.E717]) ->  | F717: of:=IF(ISBLANK(['BenchBudEE.csv'.F717]);"";['BenchBudEE.csv'.F717]) ->  | G717: of:=IF(ISNUMBER(SEARCH("[0-9]";[.A717]));MID([.A717];1;SEARCH("[0-9]";[.A717])-1);"") -> 
A718: of:=IF(ISBLANK(['BenchBudEE.csv'.A718]);"";['BenchBudEE.csv'.A718]) ->  | B718: of:=IF(ISBLANK(['BenchBudEE.csv'.B718]);"";['BenchBudEE.csv'.B718]) ->  | C718: of:=IF(ISBLANK(['BenchBudEE.csv'.C853]);"";MID(['BenchBudEE.csv'.C853];SEARCH(":";['BenchBudEE.csv'.C853])+1;100)) ->  | D718: of:=IF(ISBLANK(['BenchBudEE.csv'.D718]);"";['BenchBudEE.csv'.D718]) ->  | E718: of:=IF(ISBLANK(['BenchBudEE.csv'.E718]);"";['BenchBudEE.csv'.E718]) ->  | F718: of:=IF(ISBLANK(['BenchBudEE.csv'.F718]);"";['BenchBudEE.csv'.F718]) ->  | G718: of:=IF(ISNUMBER(SEARCH("[0-9]";[.A718]));MID([.A718];1;SEARCH("[0-9]";[.A718])-1);"") -> 
A719: of:=IF(ISBLANK(['BenchBudEE.csv'.A719]);"";['BenchBudEE.csv'.A719]) ->  | B719: of:=IF(ISBLANK(['BenchBudEE.csv'.B719]);"";['BenchBudEE.csv'.B719]) ->  | C719: of:=IF(ISBLANK(['BenchBudEE.csv'.C854]);"";MID(['BenchBudEE.csv'.C854];SEARCH(":";['BenchBudEE.csv'.C854])+1;100)) ->  | D719: of:=IF(ISBLANK(['BenchBudEE.csv'.D719]);"";['BenchBudEE.csv'.D719]) ->  | E719: of:=IF(ISBLANK(['BenchBudEE.csv'.E719]);"";['BenchBudEE.csv'.E719]) ->  | F719: of:=IF(ISBLANK(['BenchBudEE.csv'.F719]);"";['BenchBudEE.csv'.F719]) ->  | G719: of:=IF(ISNUMBER(SEARCH("[0-9]";[.A719]));MID([.A719];1;SEARCH("[0-9]";[.A719])-1);"") -> 
A720: of:=IF(ISBLANK(['BenchBudEE.csv'.A720]);"";['BenchBudEE.csv'.A720]) ->  | B720: of:=IF(ISBLANK(['BenchBudEE.csv'.B720]);"";['BenchBudEE.csv'.B720]) ->  | C720: of:=IF(ISBLANK(['BenchBudEE.csv'.C855]);"";MID(['BenchBudEE.csv'.C855];SEARCH(":";['BenchBudEE.csv'.C855])+1;100)) ->  | D720: of:=IF(ISBLANK(['BenchBudEE.csv'.D720]);"";['BenchBudEE.csv'.D720]) ->  | E720: of:=IF(ISBLANK(['BenchBudEE.csv'.E720]);"";['BenchBudEE.csv'.E720]) ->  | F720: of:=IF(ISBLANK(['BenchBudEE.csv'.F720]);"";['BenchBudEE.csv'.F720]) ->  | G720: of:=IF(ISNUMBER(SEARCH("[0-9]";[.A720]));MID([.A720];1;SEARCH("[0-9]";[.A720])-1);"") -> 
A721: of:=IF(ISBLANK(['BenchBudEE.csv'.A721]);"";['BenchBudEE.csv'.A721]) ->  | B721: of:=IF(ISBLANK(['BenchBudEE.csv'.B721]);"";['BenchBudEE.csv'.B721]) ->  | C721: of:=IF(ISBLANK(['BenchBudEE.csv'.C856]);"";MID(['BenchBudEE.csv'.C856];SEARCH(":";['BenchBudEE.csv'.C856])+1;100)) ->  | D721: of:=IF(ISBLANK(['BenchBudEE.csv'.D721]);"";['BenchBudEE.csv'.D721]) ->  | E721: of:=IF(ISBLANK(['BenchBudEE.csv'.E721]);"";['BenchBudEE.csv'.E721]) ->  | F721: of:=IF(ISBLANK(['BenchBudEE.csv'.F721]);"";['BenchBudEE.csv'.F721]) ->  | G721: of:=IF(ISNUMBER(SEARCH("[0-9]";[.A721]));MID([.A721];1;SEARCH("[0-9]";[.A721])-1);"") -> 
A722: of:=IF(ISBLANK(['BenchBudEE.csv'.A722]);"";['BenchBudEE.csv'.A722]) ->  | B722: of:=IF(ISBLANK(['BenchBudEE.csv'.B722]);"";['BenchBudEE.csv'.B722]) ->  | C722: of:=IF(ISBLANK(['BenchBudEE.csv'.C857]);"";MID(['BenchBudEE.csv'.C857];SEARCH(":";['BenchBudEE.csv'.C857])+1;100)) ->  | D722: of:=IF(ISBLANK(['BenchBudEE.csv'.D722]);"";['BenchBudEE.csv'.D722]) ->  | E722: of:=IF(ISBLANK(['BenchBudEE.csv'.E722]);"";['BenchBudEE.csv'.E722]) ->  | F722: of:=IF(ISBLANK(['BenchBudEE.csv'.F722]);"";['BenchBudEE.csv'.F722]) ->  | G722: of:=IF(ISNUMBER(SEARCH("[0-9]";[.A722]));MID([.A722];1;SEARCH("[0-9]";[.A722])-1);"") -> 
A723: of:=IF(ISBLANK(['BenchBudEE.csv'.A723]);"";['BenchBudEE.csv'.A723]) ->  | B723: of:=IF(ISBLANK(['BenchBudEE.csv'.B723]);"";['BenchBudEE.csv'.B723]) ->  | C723: of:=IF(ISBLANK(['BenchBudEE.csv'.C858]);"";MID(['BenchBudEE.csv'.C858];SEARCH(":";['BenchBudEE.csv'.C858])+1;100)) ->  | D723: of:=IF(ISBLANK(['BenchBudEE.csv'.D723]);"";['BenchBudEE.csv'.D723]) ->  | E723: of:=IF(ISBLANK(['BenchBudEE.csv'.E723]);"";['BenchBudEE.csv'.E723]) ->  | F723: of:=IF(ISBLANK(['BenchBudEE.csv'.F723]);"";['BenchBudEE.csv'.F723]) ->  | G723: of:=IF(ISNUMBER(SEARCH("[0-9]";[.A723]));MID([.A723];1;SEARCH("[0-9]";[.A723])-1);"") -> 
A724: of:=IF(ISBLANK(['BenchBudEE.csv'.A724]);"";['BenchBudEE.csv'.A724]) ->  | B724: of:=IF(ISBLANK(['BenchBudEE.csv'.B724]);"";['BenchBudEE.csv'.B724]) ->  | C724: of:=IF(ISBLANK(['BenchBudEE.csv'.C859]);"";MID(['BenchBudEE.csv'.C859];SEARCH(":";['BenchBudEE.csv'.C859])+1;100)) ->  | D724: of:=IF(ISBLANK(['BenchBudEE.csv'.D724]);"";['BenchBudEE.csv'.D724]) ->  | E724: of:=IF(ISBLANK(['BenchBudEE.csv'.E724]);"";['BenchBudEE.csv'.E724]) ->  | F724: of:=IF(ISBLANK(['BenchBudEE.csv'.F724]);"";['BenchBudEE.csv'.F724]) ->  | G724: of:=IF(ISNUMBER(SEARCH("[0-9]";[.A724]));MID([.A724];1;SEARCH("[0-9]";[.A724])-1);"") -> 
A725: of:=IF(ISBLANK(['BenchBudEE.csv'.A725]);"";['BenchBudEE.csv'.A725]) ->  | B725: of:=IF(ISBLANK(['BenchBudEE.csv'.B725]);"";['BenchBudEE.csv'.B725]) ->  | C725: of:=IF(ISBLANK(['BenchBudEE.csv'.C860]);"";MID(['BenchBudEE.csv'.C860];SEARCH(":";['BenchBudEE.csv'.C860])+1;100)) ->  | D725: of:=IF(ISBLANK(['BenchBudEE.csv'.D725]);"";['BenchBudEE.csv'.D725]) ->  | E725: of:=IF(ISBLANK(['BenchBudEE.csv'.E725]);"";['BenchBudEE.csv'.E725]) ->  | F725: of:=IF(ISBLANK(['BenchBudEE.csv'.F725]);"";['BenchBudEE.csv'.F725]) ->  | G725: of:=IF(ISNUMBER(SEARCH("[0-9]";[.A725]));MID([.A725];1;SEARCH("[0-9]";[.A725])-1);"") -> 
A726: of:=IF(ISBLANK(['BenchBudEE.csv'.A726]);"";['BenchBudEE.csv'.A726]) ->  | B726: of:=IF(ISBLANK(['BenchBudEE.csv'.B726]);"";['BenchBudEE.csv'.B726]) ->  | C726: of:=IF(ISBLANK(['BenchBudEE.csv'.C861]);"";MID(['BenchBudEE.csv'.C861];SEARCH(":";['BenchBudEE.csv'.C861])+1;100)) ->  | D726: of:=IF(ISBLANK(['BenchBudEE.csv'.D726]);"";['BenchBudEE.csv'.D726]) ->  | E726: of:=IF(ISBLANK(['BenchBudEE.csv'.E726]);"";['BenchBudEE.csv'.E726]) ->  | F726: of:=IF(ISBLANK(['BenchBudEE.csv'.F726]);"";['BenchBudEE.csv'.F726]) ->  | G726: of:=IF(ISNUMBER(SEARCH("[0-9]";[.A726]));MID([.A726];1;SEARCH("[0-9]";[.A726])-1);"") -> 
A727: of:=IF(ISBLANK(['BenchBudEE.csv'.A727]);"";['BenchBudEE.csv'.A727]) ->  | B727: of:=IF(ISBLANK(['BenchBudEE.csv'.B727]);"";['BenchBudEE.csv'.B727]) ->  | C727: of:=IF(ISBLANK(['BenchBudEE.csv'.C862]);"";MID(['BenchBudEE.csv'.C862];SEARCH(":";['BenchBudEE.csv'.C862])+1;100)) ->  | D727: of:=IF(ISBLANK(['BenchBudEE.csv'.D727]);"";['BenchBudEE.csv'.D727]) ->  | E727: of:=IF(ISBLANK(['BenchBudEE.csv'.E727]);"";['BenchBudEE.csv'.E727]) ->  | F727: of:=IF(ISBLANK(['BenchBudEE.csv'.F727]);"";['BenchBudEE.csv'.F727]) ->  | G727: of:=IF(ISNUMBER(SEARCH("[0-9]";[.A727]));MID([.A727];1;SEARCH("[0-9]";[.A727])-1);"") -> 
A728: of:=IF(ISBLANK(['BenchBudEE.csv'.A728]);"";['BenchBudEE.csv'.A728]) ->  | B728: of:=IF(ISBLANK(['BenchBudEE.csv'.B728]);"";['BenchBudEE.csv'.B728]) ->  | C728: of:=IF(ISBLANK(['BenchBudEE.csv'.C863]);"";MID(['BenchBudEE.csv'.C863];SEARCH(":";['BenchBudEE.csv'.C863])+1;100)) ->  | D728: of:=IF(ISBLANK(['BenchBudEE.csv'.D728]);"";['BenchBudEE.csv'.D728]) ->  | E728: of:=IF(ISBLANK(['BenchBudEE.csv'.E728]);"";['BenchBudEE.csv'.E728]) ->  | F728: of:=IF(ISBLANK(['BenchBudEE.csv'.F728]);"";['BenchBudEE.csv'.F728]) ->  | G728: of:=IF(ISNUMBER(SEARCH("[0-9]";[.A728]));MID([.A728];1;SEARCH("[0-9]";[.A728])-1);"") -> 
A729: of:=IF(ISBLANK(['BenchBudEE.csv'.A729]);"";['BenchBudEE.csv'.A729]) ->  | B729: of:=IF(ISBLANK(['BenchBudEE.csv'.B729]);"";['BenchBudEE.csv'.B729]) ->  | C729: of:=IF(ISBLANK(['BenchBudEE.csv'.C864]);"";MID(['BenchBudEE.csv'.C864];SEARCH(":";['BenchBudEE.csv'.C864])+1;100)) ->  | D729: of:=IF(ISBLANK(['BenchBudEE.csv'.D729]);"";['BenchBudEE.csv'.D729]) ->  | E729: of:=IF(ISBLANK(['BenchBudEE.csv'.E729]);"";['BenchBudEE.csv'.E729]) ->  | F729: of:=IF(ISBLANK(['BenchBudEE.csv'.F729]);"";['BenchBudEE.csv'.F729]) ->  | G729: of:=IF(ISNUMBER(SEARCH("[0-9]";[.A729]));MID([.A729];1;SEARCH("[0-9]";[.A729])-1);"") -> 
A730: of:=IF(ISBLANK(['BenchBudEE.csv'.A730]);"";['BenchBudEE.csv'.A730]) ->  | B730: of:=IF(ISBLANK(['BenchBudEE.csv'.B730]);"";['BenchBudEE.csv'.B730]) ->  | C730: of:=IF(ISBLANK(['BenchBudEE.csv'.C865]);"";MID(['BenchBudEE.csv'.C865];SEARCH(":";['BenchBudEE.csv'.C865])+1;100)) ->  | D730: of:=IF(ISBLANK(['BenchBudEE.csv'.D730]);"";['BenchBudEE.csv'.D730]) ->  | E730: of:=IF(ISBLANK(['BenchBudEE.csv'.E730]);"";['BenchBudEE.csv'.E730]) ->  | F730: of:=IF(ISBLANK(['BenchBudEE.csv'.F730]);"";['BenchBudEE.csv'.F730]) ->  | G730: of:=IF(ISNUMBER(SEARCH("[0-9]";[.A730]));MID([.A730];1;SEARCH("[0-9]";[.A730])-1);"") -> 
A731: of:=IF(ISBLANK(['BenchBudEE.csv'.A731]);"";['BenchBudEE.csv'.A731]) ->  | B731: of:=IF(ISBLANK(['BenchBudEE.csv'.B731]);"";['BenchBudEE.csv'.B731]) ->  | C731: of:=IF(ISBLANK(['BenchBudEE.csv'.C866]);"";MID(['BenchBudEE.csv'.C866];SEARCH(":";['BenchBudEE.csv'.C866])+1;100)) ->  | D731: of:=IF(ISBLANK(['BenchBudEE.csv'.D731]);"";['BenchBudEE.csv'.D731]) ->  | E731: of:=IF(ISBLANK(['BenchBudEE.csv'.E731]);"";['BenchBudEE.csv'.E731]) ->  | F731: of:=IF(ISBLANK(['BenchBudEE.csv'.F731]);"";['BenchBudEE.csv'.F731]) ->  | G731: of:=IF(ISNUMBER(SEARCH("[0-9]";[.A731]));MID([.A731];1;SEARCH("[0-9]";[.A731])-1);"") -> 
A732: of:=IF(ISBLANK(['BenchBudEE.csv'.A732]);"";['BenchBudEE.csv'.A732]) ->  | B732: of:=IF(ISBLANK(['BenchBudEE.csv'.B732]);"";['BenchBudEE.csv'.B732]) ->  | C732: of:=IF(ISBLANK(['BenchBudEE.csv'.C867]);"";MID(['BenchBudEE.csv'.C867];SEARCH(":";['BenchBudEE.csv'.C867])+1;100)) ->  | D732: of:=IF(ISBLANK(['BenchBudEE.csv'.D732]);"";['BenchBudEE.csv'.D732]) ->  | E732: of:=IF(ISBLANK(['BenchBudEE.csv'.E732]);"";['BenchBudEE.csv'.E732]) ->  | F732: of:=IF(ISBLANK(['BenchBudEE.csv'.F732]);"";['BenchBudEE.csv'.F732]) ->  | G732: of:=IF(ISNUMBER(SEARCH("[0-9]";[.A732]));MID([.A732];1;SEARCH("[0-9]";[.A732])-1);"") -> 
A733: of:=IF(ISBLANK(['BenchBudEE.csv'.A733]);"";['BenchBudEE.csv'.A733]) ->  | B733: of:=IF(ISBLANK(['BenchBudEE.csv'.B733]);"";['BenchBudEE.csv'.B733]) ->  | C733: of:=IF(ISBLANK(['BenchBudEE.csv'.C868]);"";MID(['BenchBudEE.csv'.C868];SEARCH(":";['BenchBudEE.csv'.C868])+1;100)) ->  | D733: of:=IF(ISBLANK(['BenchBudEE.csv'.D733]);"";['BenchBudEE.csv'.D733]) ->  | E733: of:=IF(ISBLANK(['BenchBudEE.csv'.E733]);"";['BenchBudEE.csv'.E733]) ->  | F733: of:=IF(ISBLANK(['BenchBudEE.csv'.F733]);"";['BenchBudEE.csv'.F733]) ->  | G733: of:=IF(ISNUMBER(SEARCH("[0-9]";[.A733]));MID([.A733];1;SEARCH("[0-9]";[.A733])-1);"") -> 
A734: of:=IF(ISBLANK(['BenchBudEE.csv'.A734]);"";['BenchBudEE.csv'.A734]) ->  | B734: of:=IF(ISBLANK(['BenchBudEE.csv'.B734]);"";['BenchBudEE.csv'.B734]) ->  | C734: of:=IF(ISBLANK(['BenchBudEE.csv'.C869]);"";MID(['BenchBudEE.csv'.C869];SEARCH(":";['BenchBudEE.csv'.C869])+1;100)) ->  | D734: of:=IF(ISBLANK(['BenchBudEE.csv'.D734]);"";['BenchBudEE.csv'.D734]) ->  | E734: of:=IF(ISBLANK(['BenchBudEE.csv'.E734]);"";['BenchBudEE.csv'.E734]) ->  | F734: of:=IF(ISBLANK(['BenchBudEE.csv'.F734]);"";['BenchBudEE.csv'.F734]) ->  | G734: of:=IF(ISNUMBER(SEARCH("[0-9]";[.A734]));MID([.A734];1;SEARCH("[0-9]";[.A734])-1);"") -> 
A735: of:=IF(ISBLANK(['BenchBudEE.csv'.A735]);"";['BenchBudEE.csv'.A735]) ->  | B735: of:=IF(ISBLANK(['BenchBudEE.csv'.B735]);"";['BenchBudEE.csv'.B735]) ->  | C735: of:=IF(ISBLANK(['BenchBudEE.csv'.C870]);"";MID(['BenchBudEE.csv'.C870];SEARCH(":";['BenchBudEE.csv'.C870])+1;100)) ->  | D735: of:=IF(ISBLANK(['BenchBudEE.csv'.D735]);"";['BenchBudEE.csv'.D735]) ->  | E735: of:=IF(ISBLANK(['BenchBudEE.csv'.E735]);"";['BenchBudEE.csv'.E735]) ->  | F735: of:=IF(ISBLANK(['BenchBudEE.csv'.F735]);"";['BenchBudEE.csv'.F735]) ->  | G735: of:=IF(ISNUMBER(SEARCH("[0-9]";[.A735]));MID([.A735];1;SEARCH("[0-9]";[.A735])-1);"") -> 
A736: of:=IF(ISBLANK(['BenchBudEE.csv'.A736]);"";['BenchBudEE.csv'.A736]) ->  | B736: of:=IF(ISBLANK(['BenchBudEE.csv'.B736]);"";['BenchBudEE.csv'.B736]) ->  | C736: of:=IF(ISBLANK(['BenchBudEE.csv'.C871]);"";MID(['BenchBudEE.csv'.C871];SEARCH(":";['BenchBudEE.csv'.C871])+1;100)) ->  | D736: of:=IF(ISBLANK(['BenchBudEE.csv'.D736]);"";['BenchBudEE.csv'.D736]) ->  | E736: of:=IF(ISBLANK(['BenchBudEE.csv'.E736]);"";['BenchBudEE.csv'.E736]) ->  | F736: of:=IF(ISBLANK(['BenchBudEE.csv'.F736]);"";['BenchBudEE.csv'.F736]) ->  | G736: of:=IF(ISNUMBER(SEARCH("[0-9]";[.A736]));MID([.A736];1;SEARCH("[0-9]";[.A736])-1);"") -> 
A737: of:=IF(ISBLANK(['BenchBudEE.csv'.A737]);"";['BenchBudEE.csv'.A737]) ->  | B737: of:=IF(ISBLANK(['BenchBudEE.csv'.B737]);"";['BenchBudEE.csv'.B737]) ->  | C737: of:=IF(ISBLANK(['BenchBudEE.csv'.C872]);"";MID(['BenchBudEE.csv'.C872];SEARCH(":";['BenchBudEE.csv'.C872])+1;100)) ->  | D737: of:=IF(ISBLANK(['BenchBudEE.csv'.D737]);"";['BenchBudEE.csv'.D737]) ->  | E737: of:=IF(ISBLANK(['BenchBudEE.csv'.E737]);"";['BenchBudEE.csv'.E737]) ->  | F737: of:=IF(ISBLANK(['BenchBudEE.csv'.F737]);"";['BenchBudEE.csv'.F737]) ->  | G737: of:=IF(ISNUMBER(SEARCH("[0-9]";[.A737]));MID([.A737];1;SEARCH("[0-9]";[.A737])-1);"") -> 
A738: of:=IF(ISBLANK(['BenchBudEE.csv'.A738]);"";['BenchBudEE.csv'.A738]) ->  | B738: of:=IF(ISBLANK(['BenchBudEE.csv'.B738]);"";['BenchBudEE.csv'.B738]) ->  | C738: of:=IF(ISBLANK(['BenchBudEE.csv'.C873]);"";MID(['BenchBudEE.csv'.C873];SEARCH(":";['BenchBudEE.csv'.C873])+1;100)) ->  | D738: of:=IF(ISBLANK(['BenchBudEE.csv'.D738]);"";['BenchBudEE.csv'.D738]) ->  | E738: of:=IF(ISBLANK(['BenchBudEE.csv'.E738]);"";['BenchBudEE.csv'.E738]) ->  | F738: of:=IF(ISBLANK(['BenchBudEE.csv'.F738]);"";['BenchBudEE.csv'.F738]) ->  | G738: of:=IF(ISNUMBER(SEARCH("[0-9]";[.A738]));MID([.A738];1;SEARCH("[0-9]";[.A738])-1);"") -> 
A739: of:=IF(ISBLANK(['BenchBudEE.csv'.A739]);"";['BenchBudEE.csv'.A739]) ->  | B739: of:=IF(ISBLANK(['BenchBudEE.csv'.B739]);"";['BenchBudEE.csv'.B739]) ->  | C739: of:=IF(ISBLANK(['BenchBudEE.csv'.C874]);"";MID(['BenchBudEE.csv'.C874];SEARCH(":";['BenchBudEE.csv'.C874])+1;100)) ->  | D739: of:=IF(ISBLANK(['BenchBudEE.csv'.D739]);"";['BenchBudEE.csv'.D739]) ->  | E739: of:=IF(ISBLANK(['BenchBudEE.csv'.E739]);"";['BenchBudEE.csv'.E739]) ->  | F739: of:=IF(ISBLANK(['BenchBudEE.csv'.F739]);"";['BenchBudEE.csv'.F739]) ->  | G739: of:=IF(ISNUMBER(SEARCH("[0-9]";[.A739]));MID([.A739];1;SEARCH("[0-9]";[.A739])-1);"") -> 
A740: of:=IF(ISBLANK(['BenchBudEE.csv'.A740]);"";['BenchBudEE.csv'.A740]) ->  | B740: of:=IF(ISBLANK(['BenchBudEE.csv'.B740]);"";['BenchBudEE.csv'.B740]) ->  | C740: of:=IF(ISBLANK(['BenchBudEE.csv'.C875]);"";MID(['BenchBudEE.csv'.C875];SEARCH(":";['BenchBudEE.csv'.C875])+1;100)) ->  | D740: of:=IF(ISBLANK(['BenchBudEE.csv'.D740]);"";['BenchBudEE.csv'.D740]) ->  | E740: of:=IF(ISBLANK(['BenchBudEE.csv'.E740]);"";['BenchBudEE.csv'.E740]) ->  | F740: of:=IF(ISBLANK(['BenchBudEE.csv'.F740]);"";['BenchBudEE.csv'.F740]) ->  | G740: of:=IF(ISNUMBER(SEARCH("[0-9]";[.A740]));MID([.A740];1;SEARCH("[0-9]";[.A740])-1);"") -> 
A741: of:=IF(ISBLANK(['BenchBudEE.csv'.A741]);"";['BenchBudEE.csv'.A741]) ->  | B741: of:=IF(ISBLANK(['BenchBudEE.csv'.B741]);"";['BenchBudEE.csv'.B741]) ->  | C741: of:=IF(ISBLANK(['BenchBudEE.csv'.C876]);"";MID(['BenchBudEE.csv'.C876];SEARCH(":";['BenchBudEE.csv'.C876])+1;100)) ->  | D741: of:=IF(ISBLANK(['BenchBudEE.csv'.D741]);"";['BenchBudEE.csv'.D741]) ->  | E741: of:=IF(ISBLANK(['BenchBudEE.csv'.E741]);"";['BenchBudEE.csv'.E741]) ->  | F741: of:=IF(ISBLANK(['BenchBudEE.csv'.F741]);"";['BenchBudEE.csv'.F741]) ->  | G741: of:=IF(ISNUMBER(SEARCH("[0-9]";[.A741]));MID([.A741];1;SEARCH("[0-9]";[.A741])-1);"") -> 
A742: of:=IF(ISBLANK(['BenchBudEE.csv'.A742]);"";['BenchBudEE.csv'.A742]) ->  | B742: of:=IF(ISBLANK(['BenchBudEE.csv'.B742]);"";['BenchBudEE.csv'.B742]) ->  | C742: of:=IF(ISBLANK(['BenchBudEE.csv'.C877]);"";MID(['BenchBudEE.csv'.C877];SEARCH(":";['BenchBudEE.csv'.C877])+1;100)) ->  | D742: of:=IF(ISBLANK(['BenchBudEE.csv'.D742]);"";['BenchBudEE.csv'.D742]) ->  | E742: of:=IF(ISBLANK(['BenchBudEE.csv'.E742]);"";['BenchBudEE.csv'.E742]) ->  | F742: of:=IF(ISBLANK(['BenchBudEE.csv'.F742]);"";['BenchBudEE.csv'.F742]) ->  | G742: of:=IF(ISNUMBER(SEARCH("[0-9]";[.A742]));MID([.A742];1;SEARCH("[0-9]";[.A742])-1);"") -> 
A743: of:=IF(ISBLANK(['BenchBudEE.csv'.A743]);"";['BenchBudEE.csv'.A743]) ->  | B743: of:=IF(ISBLANK(['BenchBudEE.csv'.B743]);"";['BenchBudEE.csv'.B743]) ->  | C743: of:=IF(ISBLANK(['BenchBudEE.csv'.C878]);"";MID(['BenchBudEE.csv'.C878];SEARCH(":";['BenchBudEE.csv'.C878])+1;100)) ->  | D743: of:=IF(ISBLANK(['BenchBudEE.csv'.D743]);"";['BenchBudEE.csv'.D743]) ->  | E743: of:=IF(ISBLANK(['BenchBudEE.csv'.E743]);"";['BenchBudEE.csv'.E743]) ->  | F743: of:=IF(ISBLANK(['BenchBudEE.csv'.F743]);"";['BenchBudEE.csv'.F743]) ->  | G743: of:=IF(ISNUMBER(SEARCH("[0-9]";[.A743]));MID([.A743];1;SEARCH("[0-9]";[.A743])-1);"") -> 
A744: of:=IF(ISBLANK(['BenchBudEE.csv'.A744]);"";['BenchBudEE.csv'.A744]) ->  | B744: of:=IF(ISBLANK(['BenchBudEE.csv'.B744]);"";['BenchBudEE.csv'.B744]) ->  | C744: of:=IF(ISBLANK(['BenchBudEE.csv'.C879]);"";MID(['BenchBudEE.csv'.C879];SEARCH(":";['BenchBudEE.csv'.C879])+1;100)) ->  | D744: of:=IF(ISBLANK(['BenchBudEE.csv'.D744]);"";['BenchBudEE.csv'.D744]) ->  | E744: of:=IF(ISBLANK(['BenchBudEE.csv'.E744]);"";['BenchBudEE.csv'.E744]) ->  | F744: of:=IF(ISBLANK(['BenchBudEE.csv'.F744]);"";['BenchBudEE.csv'.F744]) ->  | G744: of:=IF(ISNUMBER(SEARCH("[0-9]";[.A744]));MID([.A744];1;SEARCH("[0-9]";[.A744])-1);"") -> 
A745: of:=IF(ISBLANK(['BenchBudEE.csv'.A745]);"";['BenchBudEE.csv'.A745]) ->  | B745: of:=IF(ISBLANK(['BenchBudEE.csv'.B745]);"";['BenchBudEE.csv'.B745]) ->  | C745: of:=IF(ISBLANK(['BenchBudEE.csv'.C880]);"";MID(['BenchBudEE.csv'.C880];SEARCH(":";['BenchBudEE.csv'.C880])+1;100)) ->  | D745: of:=IF(ISBLANK(['BenchBudEE.csv'.D745]);"";['BenchBudEE.csv'.D745]) ->  | E745: of:=IF(ISBLANK(['BenchBudEE.csv'.E745]);"";['BenchBudEE.csv'.E745]) ->  | F745: of:=IF(ISBLANK(['BenchBudEE.csv'.F745]);"";['BenchBudEE.csv'.F745]) ->  | G745: of:=IF(ISNUMBER(SEARCH("[0-9]";[.A745]));MID([.A745];1;SEARCH("[0-9]";[.A745])-1);"") -> 
A746: of:=IF(ISBLANK(['BenchBudEE.csv'.A746]);"";['BenchBudEE.csv'.A746]) ->  | B746: of:=IF(ISBLANK(['BenchBudEE.csv'.B746]);"";['BenchBudEE.csv'.B746]) ->  | C746: of:=IF(ISBLANK(['BenchBudEE.csv'.C881]);"";MID(['BenchBudEE.csv'.C881];SEARCH(":";['BenchBudEE.csv'.C881])+1;100)) ->  | D746: of:=IF(ISBLANK(['BenchBudEE.csv'.D746]);"";['BenchBudEE.csv'.D746]) ->  | E746: of:=IF(ISBLANK(['BenchBudEE.csv'.E746]);"";['BenchBudEE.csv'.E746]) ->  | F746: of:=IF(ISBLANK(['BenchBudEE.csv'.F746]);"";['BenchBudEE.csv'.F746]) ->  | G746: of:=IF(ISNUMBER(SEARCH("[0-9]";[.A746]));MID([.A746];1;SEARCH("[0-9]";[.A746])-1);"") -> 
A747: of:=IF(ISBLANK(['BenchBudEE.csv'.A747]);"";['BenchBudEE.csv'.A747]) ->  | B747: of:=IF(ISBLANK(['BenchBudEE.csv'.B747]);"";['BenchBudEE.csv'.B747]) ->  | C747: of:=IF(ISBLANK(['BenchBudEE.csv'.C882]);"";MID(['BenchBudEE.csv'.C882];SEARCH(":";['BenchBudEE.csv'.C882])+1;100)) ->  | D747: of:=IF(ISBLANK(['BenchBudEE.csv'.D747]);"";['BenchBudEE.csv'.D747]) ->  | E747: of:=IF(ISBLANK(['BenchBudEE.csv'.E747]);"";['BenchBudEE.csv'.E747]) ->  | F747: of:=IF(ISBLANK(['BenchBudEE.csv'.F747]);"";['BenchBudEE.csv'.F747]) ->  | G747: of:=IF(ISNUMBER(SEARCH("[0-9]";[.A747]));MID([.A747];1;SEARCH("[0-9]";[.A747])-1);"") -> 
A748: of:=IF(ISBLANK(['BenchBudEE.csv'.A748]);"";['BenchBudEE.csv'.A748]) ->  | B748: of:=IF(ISBLANK(['BenchBudEE.csv'.B748]);"";['BenchBudEE.csv'.B748]) ->  | C748: of:=IF(ISBLANK(['BenchBudEE.csv'.C883]);"";MID(['BenchBudEE.csv'.C883];SEARCH(":";['BenchBudEE.csv'.C883])+1;100)) ->  | D748: of:=IF(ISBLANK(['BenchBudEE.csv'.D748]);"";['BenchBudEE.csv'.D748]) ->  | E748: of:=IF(ISBLANK(['BenchBudEE.csv'.E748]);"";['BenchBudEE.csv'.E748]) ->  | F748: of:=IF(ISBLANK(['BenchBudEE.csv'.F748]);"";['BenchBudEE.csv'.F748]) ->  | G748: of:=IF(ISNUMBER(SEARCH("[0-9]";[.A748]));MID([.A748];1;SEARCH("[0-9]";[.A748])-1);"") -> 
A749: of:=IF(ISBLANK(['BenchBudEE.csv'.A749]);"";['BenchBudEE.csv'.A749]) ->  | B749: of:=IF(ISBLANK(['BenchBudEE.csv'.B749]);"";['BenchBudEE.csv'.B749]) ->  | C749: of:=IF(ISBLANK(['BenchBudEE.csv'.C884]);"";MID(['BenchBudEE.csv'.C884];SEARCH(":";['BenchBudEE.csv'.C884])+1;100)) ->  | D749: of:=IF(ISBLANK(['BenchBudEE.csv'.D749]);"";['BenchBudEE.csv'.D749]) ->  | E749: of:=IF(ISBLANK(['BenchBudEE.csv'.E749]);"";['BenchBudEE.csv'.E749]) ->  | F749: of:=IF(ISBLANK(['BenchBudEE.csv'.F749]);"";['BenchBudEE.csv'.F749]) ->  | G749: of:=IF(ISNUMBER(SEARCH("[0-9]";[.A749]));MID([.A749];1;SEARCH("[0-9]";[.A749])-1);"") -> 
A750: of:=IF(ISBLANK(['BenchBudEE.csv'.A750]);"";['BenchBudEE.csv'.A750]) ->  | B750: of:=IF(ISBLANK(['BenchBudEE.csv'.B750]);"";['BenchBudEE.csv'.B750]) ->  | C750: of:=IF(ISBLANK(['BenchBudEE.csv'.C885]);"";MID(['BenchBudEE.csv'.C885];SEARCH(":";['BenchBudEE.csv'.C885])+1;100)) ->  | D750: of:=IF(ISBLANK(['BenchBudEE.csv'.D750]);"";['BenchBudEE.csv'.D750]) ->  | E750: of:=IF(ISBLANK(['BenchBudEE.csv'.E750]);"";['BenchBudEE.csv'.E750]) ->  | F750: of:=IF(ISBLANK(['BenchBudEE.csv'.F750]);"";['BenchBudEE.csv'.F750]) ->  | G750: of:=IF(ISNUMBER(SEARCH("[0-9]";[.A750]));MID([.A750];1;SEARCH("[0-9]";[.A750])-1);"") -> 
A751: of:=IF(ISBLANK(['BenchBudEE.csv'.A751]);"";['BenchBudEE.csv'.A751]) ->  | B751: of:=IF(ISBLANK(['BenchBudEE.csv'.B751]);"";['BenchBudEE.csv'.B751]) ->  | C751: of:=IF(ISBLANK(['BenchBudEE.csv'.C886]);"";MID(['BenchBudEE.csv'.C886];SEARCH(":";['BenchBudEE.csv'.C886])+1;100)) ->  | D751: of:=IF(ISBLANK(['BenchBudEE.csv'.D751]);"";['BenchBudEE.csv'.D751]) ->  | E751: of:=IF(ISBLANK(['BenchBudEE.csv'.E751]);"";['BenchBudEE.csv'.E751]) ->  | F751: of:=IF(ISBLANK(['BenchBudEE.csv'.F751]);"";['BenchBudEE.csv'.F751]) ->  | G751: of:=IF(ISNUMBER(SEARCH("[0-9]";[.A751]));MID([.A751];1;SEARCH("[0-9]";[.A751])-1);"") -> 
A752: of:=IF(ISBLANK(['BenchBudEE.csv'.A752]);"";['BenchBudEE.csv'.A752]) ->  | B752: of:=IF(ISBLANK(['BenchBudEE.csv'.B752]);"";['BenchBudEE.csv'.B752]) ->  | C752: of:=IF(ISBLANK(['BenchBudEE.csv'.C887]);"";MID(['BenchBudEE.csv'.C887];SEARCH(":";['BenchBudEE.csv'.C887])+1;100)) ->  | D752: of:=IF(ISBLANK(['BenchBudEE.csv'.D752]);"";['BenchBudEE.csv'.D752]) ->  | E752: of:=IF(ISBLANK(['BenchBudEE.csv'.E752]);"";['BenchBudEE.csv'.E752]) ->  | F752: of:=IF(ISBLANK(['BenchBudEE.csv'.F752]);"";['BenchBudEE.csv'.F752]) ->  | G752: of:=IF(ISNUMBER(SEARCH("[0-9]";[.A752]));MID([.A752];1;SEARCH("[0-9]";[.A752])-1);"") -> 
A753: of:=IF(ISBLANK(['BenchBudEE.csv'.A753]);"";['BenchBudEE.csv'.A753]) ->  | B753: of:=IF(ISBLANK(['BenchBudEE.csv'.B753]);"";['BenchBudEE.csv'.B753]) ->  | C753: of:=IF(ISBLANK(['BenchBudEE.csv'.C888]);"";MID(['BenchBudEE.csv'.C888];SEARCH(":";['BenchBudEE.csv'.C888])+1;100)) ->  | D753: of:=IF(ISBLANK(['BenchBudEE.csv'.D753]);"";['BenchBudEE.csv'.D753]) ->  | E753: of:=IF(ISBLANK(['BenchBudEE.csv'.E753]);"";['BenchBudEE.csv'.E753]) ->  | F753: of:=IF(ISBLANK(['BenchBudEE.csv'.F753]);"";['BenchBudEE.csv'.F753]) ->  | G753: of:=IF(ISNUMBER(SEARCH("[0-9]";[.A753]));MID([.A753];1;SEARCH("[0-9]";[.A753])-1);"") -> 
A754: of:=IF(ISBLANK(['BenchBudEE.csv'.A754]);"";['BenchBudEE.csv'.A754]) ->  | B754: of:=IF(ISBLANK(['BenchBudEE.csv'.B754]);"";['BenchBudEE.csv'.B754]) ->  | C754: of:=IF(ISBLANK(['BenchBudEE.csv'.C889]);"";MID(['BenchBudEE.csv'.C889];SEARCH(":";['BenchBudEE.csv'.C889])+1;100)) ->  | D754: of:=IF(ISBLANK(['BenchBudEE.csv'.D754]);"";['BenchBudEE.csv'.D754]) ->  | E754: of:=IF(ISBLANK(['BenchBudEE.csv'.E754]);"";['BenchBudEE.csv'.E754]) ->  | F754: of:=IF(ISBLANK(['BenchBudEE.csv'.F754]);"";['BenchBudEE.csv'.F754]) ->  | G754: of:=IF(ISNUMBER(SEARCH("[0-9]";[.A754]));MID([.A754];1;SEARCH("[0-9]";[.A754])-1);"") -> 
A755: of:=IF(ISBLANK(['BenchBudEE.csv'.A755]);"";['BenchBudEE.csv'.A755]) ->  | B755: of:=IF(ISBLANK(['BenchBudEE.csv'.B755]);"";['BenchBudEE.csv'.B755]) ->  | C755: of:=IF(ISBLANK(['BenchBudEE.csv'.C890]);"";MID(['BenchBudEE.csv'.C890];SEARCH(":";['BenchBudEE.csv'.C890])+1;100)) ->  | D755: of:=IF(ISBLANK(['BenchBudEE.csv'.D755]);"";['BenchBudEE.csv'.D755]) ->  | E755: of:=IF(ISBLANK(['BenchBudEE.csv'.E755]);"";['BenchBudEE.csv'.E755]) ->  | F755: of:=IF(ISBLANK(['BenchBudEE.csv'.F755]);"";['BenchBudEE.csv'.F755]) ->  | G755: of:=IF(ISNUMBER(SEARCH("[0-9]";[.A755]));MID([.A755];1;SEARCH("[0-9]";[.A755])-1);"") -> 
A756: of:=IF(ISBLANK(['BenchBudEE.csv'.A756]);"";['BenchBudEE.csv'.A756]) ->  | B756: of:=IF(ISBLANK(['BenchBudEE.csv'.B756]);"";['BenchBudEE.csv'.B756]) ->  | C756: of:=IF(ISBLANK(['BenchBudEE.csv'.C891]);"";MID(['BenchBudEE.csv'.C891];SEARCH(":";['BenchBudEE.csv'.C891])+1;100)) ->  | D756: of:=IF(ISBLANK(['BenchBudEE.csv'.D756]);"";['BenchBudEE.csv'.D756]) ->  | E756: of:=IF(ISBLANK(['BenchBudEE.csv'.E756]);"";['BenchBudEE.csv'.E756]) ->  | F756: of:=IF(ISBLANK(['BenchBudEE.csv'.F756]);"";['BenchBudEE.csv'.F756]) ->  | G756: of:=IF(ISNUMBER(SEARCH("[0-9]";[.A756]));MID([.A756];1;SEARCH("[0-9]";[.A756])-1);"") -> 
A757: of:=IF(ISBLANK(['BenchBudEE.csv'.A757]);"";['BenchBudEE.csv'.A757]) ->  | B757: of:=IF(ISBLANK(['BenchBudEE.csv'.B757]);"";['BenchBudEE.csv'.B757]) ->  | C757: of:=IF(ISBLANK(['BenchBudEE.csv'.C892]);"";MID(['BenchBudEE.csv'.C892];SEARCH(":";['BenchBudEE.csv'.C892])+1;100)) ->  | D757: of:=IF(ISBLANK(['BenchBudEE.csv'.D757]);"";['BenchBudEE.csv'.D757]) ->  | E757: of:=IF(ISBLANK(['BenchBudEE.csv'.E757]);"";['BenchBudEE.csv'.E757]) ->  | F757: of:=IF(ISBLANK(['BenchBudEE.csv'.F757]);"";['BenchBudEE.csv'.F757]) ->  | G757: of:=IF(ISNUMBER(SEARCH("[0-9]";[.A757]));MID([.A757];1;SEARCH("[0-9]";[.A757])-1);"") -> 
A758: of:=IF(ISBLANK(['BenchBudEE.csv'.A758]);"";['BenchBudEE.csv'.A758]) ->  | B758: of:=IF(ISBLANK(['BenchBudEE.csv'.B758]);"";['BenchBudEE.csv'.B758]) ->  | C758: of:=IF(ISBLANK(['BenchBudEE.csv'.C893]);"";MID(['BenchBudEE.csv'.C893];SEARCH(":";['BenchBudEE.csv'.C893])+1;100)) ->  | D758: of:=IF(ISBLANK(['BenchBudEE.csv'.D758]);"";['BenchBudEE.csv'.D758]) ->  | E758: of:=IF(ISBLANK(['BenchBudEE.csv'.E758]);"";['BenchBudEE.csv'.E758]) ->  | F758: of:=IF(ISBLANK(['BenchBudEE.csv'.F758]);"";['BenchBudEE.csv'.F758]) ->  | G758: of:=IF(ISNUMBER(SEARCH("[0-9]";[.A758]));MID([.A758];1;SEARCH("[0-9]";[.A758])-1);"") -> 
A759: of:=IF(ISBLANK(['BenchBudEE.csv'.A759]);"";['BenchBudEE.csv'.A759]) ->  | B759: of:=IF(ISBLANK(['BenchBudEE.csv'.B759]);"";['BenchBudEE.csv'.B759]) ->  | C759: of:=IF(ISBLANK(['BenchBudEE.csv'.C894]);"";MID(['BenchBudEE.csv'.C894];SEARCH(":";['BenchBudEE.csv'.C894])+1;100)) ->  | D759: of:=IF(ISBLANK(['BenchBudEE.csv'.D759]);"";['BenchBudEE.csv'.D759]) ->  | E759: of:=IF(ISBLANK(['BenchBudEE.csv'.E759]);"";['BenchBudEE.csv'.E759]) ->  | F759: of:=IF(ISBLANK(['BenchBudEE.csv'.F759]);"";['BenchBudEE.csv'.F759]) ->  | G759: of:=IF(ISNUMBER(SEARCH("[0-9]";[.A759]));MID([.A759];1;SEARCH("[0-9]";[.A759])-1);"") -> 
A760: of:=IF(ISBLANK(['BenchBudEE.csv'.A760]);"";['BenchBudEE.csv'.A760]) ->  | B760: of:=IF(ISBLANK(['BenchBudEE.csv'.B760]);"";['BenchBudEE.csv'.B760]) ->  | C760: of:=IF(ISBLANK(['BenchBudEE.csv'.C895]);"";MID(['BenchBudEE.csv'.C895];SEARCH(":";['BenchBudEE.csv'.C895])+1;100)) ->  | D760: of:=IF(ISBLANK(['BenchBudEE.csv'.D760]);"";['BenchBudEE.csv'.D760]) ->  | E760: of:=IF(ISBLANK(['BenchBudEE.csv'.E760]);"";['BenchBudEE.csv'.E760]) ->  | F760: of:=IF(ISBLANK(['BenchBudEE.csv'.F760]);"";['BenchBudEE.csv'.F760]) ->  | G760: of:=IF(ISNUMBER(SEARCH("[0-9]";[.A760]));MID([.A760];1;SEARCH("[0-9]";[.A760])-1);"") -> 
A761: of:=IF(ISBLANK(['BenchBudEE.csv'.A761]);"";['BenchBudEE.csv'.A761]) ->  | B761: of:=IF(ISBLANK(['BenchBudEE.csv'.B761]);"";['BenchBudEE.csv'.B761]) ->  | C761: of:=IF(ISBLANK(['BenchBudEE.csv'.C896]);"";MID(['BenchBudEE.csv'.C896];SEARCH(":";['BenchBudEE.csv'.C896])+1;100)) ->  | D761: of:=IF(ISBLANK(['BenchBudEE.csv'.D761]);"";['BenchBudEE.csv'.D761]) ->  | E761: of:=IF(ISBLANK(['BenchBudEE.csv'.E761]);"";['BenchBudEE.csv'.E761]) ->  | F761: of:=IF(ISBLANK(['BenchBudEE.csv'.F761]);"";['BenchBudEE.csv'.F761]) ->  | G761: of:=IF(ISNUMBER(SEARCH("[0-9]";[.A761]));MID([.A761];1;SEARCH("[0-9]";[.A761])-1);"") -> 
A762: of:=IF(ISBLANK(['BenchBudEE.csv'.A762]);"";['BenchBudEE.csv'.A762]) ->  | B762: of:=IF(ISBLANK(['BenchBudEE.csv'.B762]);"";['BenchBudEE.csv'.B762]) ->  | C762: of:=IF(ISBLANK(['BenchBudEE.csv'.C897]);"";MID(['BenchBudEE.csv'.C897];SEARCH(":";['BenchBudEE.csv'.C897])+1;100)) ->  | D762: of:=IF(ISBLANK(['BenchBudEE.csv'.D762]);"";['BenchBudEE.csv'.D762]) ->  | E762: of:=IF(ISBLANK(['BenchBudEE.csv'.E762]);"";['BenchBudEE.csv'.E762]) ->  | F762: of:=IF(ISBLANK(['BenchBudEE.csv'.F762]);"";['BenchBudEE.csv'.F762]) ->  | G762: of:=IF(ISNUMBER(SEARCH("[0-9]";[.A762]));MID([.A762];1;SEARCH("[0-9]";[.A762])-1);"") -> 
A763: of:=IF(ISBLANK(['BenchBudEE.csv'.A763]);"";['BenchBudEE.csv'.A763]) ->  | B763: of:=IF(ISBLANK(['BenchBudEE.csv'.B763]);"";['BenchBudEE.csv'.B763]) ->  | C763: of:=IF(ISBLANK(['BenchBudEE.csv'.C898]);"";MID(['BenchBudEE.csv'.C898];SEARCH(":";['BenchBudEE.csv'.C898])+1;100)) ->  | D763: of:=IF(ISBLANK(['BenchBudEE.csv'.D763]);"";['BenchBudEE.csv'.D763]) ->  | E763: of:=IF(ISBLANK(['BenchBudEE.csv'.E763]);"";['BenchBudEE.csv'.E763]) ->  | F763: of:=IF(ISBLANK(['BenchBudEE.csv'.F763]);"";['BenchBudEE.csv'.F763]) ->  | G763: of:=IF(ISNUMBER(SEARCH("[0-9]";[.A763]));MID([.A763];1;SEARCH("[0-9]";[.A763])-1);"") -> 
A764: of:=IF(ISBLANK(['BenchBudEE.csv'.A764]);"";['BenchBudEE.csv'.A764]) ->  | B764: of:=IF(ISBLANK(['BenchBudEE.csv'.B764]);"";['BenchBudEE.csv'.B764]) ->  | C764: of:=IF(ISBLANK(['BenchBudEE.csv'.C899]);"";MID(['BenchBudEE.csv'.C899];SEARCH(":";['BenchBudEE.csv'.C899])+1;100)) ->  | D764: of:=IF(ISBLANK(['BenchBudEE.csv'.D764]);"";['BenchBudEE.csv'.D764]) ->  | E764: of:=IF(ISBLANK(['BenchBudEE.csv'.E764]);"";['BenchBudEE.csv'.E764]) ->  | F764: of:=IF(ISBLANK(['BenchBudEE.csv'.F764]);"";['BenchBudEE.csv'.F764]) ->  | G764: of:=IF(ISNUMBER(SEARCH("[0-9]";[.A764]));MID([.A764];1;SEARCH("[0-9]";[.A764])-1);"") -> 
A765: of:=IF(ISBLANK(['BenchBudEE.csv'.A765]);"";['BenchBudEE.csv'.A765]) ->  | B765: of:=IF(ISBLANK(['BenchBudEE.csv'.B765]);"";['BenchBudEE.csv'.B765]) ->  | C765: of:=IF(ISBLANK(['BenchBudEE.csv'.C900]);"";MID(['BenchBudEE.csv'.C900];SEARCH(":";['BenchBudEE.csv'.C900])+1;100)) ->  | D765: of:=IF(ISBLANK(['BenchBudEE.csv'.D765]);"";['BenchBudEE.csv'.D765]) ->  | E765: of:=IF(ISBLANK(['BenchBudEE.csv'.E765]);"";['BenchBudEE.csv'.E765]) ->  | F765: of:=IF(ISBLANK(['BenchBudEE.csv'.F765]);"";['BenchBudEE.csv'.F765]) ->  | G765: of:=IF(ISNUMBER(SEARCH("[0-9]";[.A765]));MID([.A765];1;SEARCH("[0-9]";[.A765])-1);"") -> 
A766: of:=IF(ISBLANK(['BenchBudEE.csv'.A766]);"";['BenchBudEE.csv'.A766]) ->  | B766: of:=IF(ISBLANK(['BenchBudEE.csv'.B766]);"";['BenchBudEE.csv'.B766]) ->  | C766: of:=IF(ISBLANK(['BenchBudEE.csv'.C901]);"";MID(['BenchBudEE.csv'.C901];SEARCH(":";['BenchBudEE.csv'.C901])+1;100)) ->  | D766: of:=IF(ISBLANK(['BenchBudEE.csv'.D766]);"";['BenchBudEE.csv'.D766]) ->  | E766: of:=IF(ISBLANK(['BenchBudEE.csv'.E766]);"";['BenchBudEE.csv'.E766]) ->  | F766: of:=IF(ISBLANK(['BenchBudEE.csv'.F766]);"";['BenchBudEE.csv'.F766]) ->  | G766: of:=IF(ISNUMBER(SEARCH("[0-9]";[.A766]));MID([.A766];1;SEARCH("[0-9]";[.A766])-1);"") -> 
A767: of:=IF(ISBLANK(['BenchBudEE.csv'.A767]);"";['BenchBudEE.csv'.A767]) ->  | B767: of:=IF(ISBLANK(['BenchBudEE.csv'.B767]);"";['BenchBudEE.csv'.B767]) ->  | C767: of:=IF(ISBLANK(['BenchBudEE.csv'.C902]);"";MID(['BenchBudEE.csv'.C902];SEARCH(":";['BenchBudEE.csv'.C902])+1;100)) ->  | D767: of:=IF(ISBLANK(['BenchBudEE.csv'.D767]);"";['BenchBudEE.csv'.D767]) ->  | E767: of:=IF(ISBLANK(['BenchBudEE.csv'.E767]);"";['BenchBudEE.csv'.E767]) ->  | F767: of:=IF(ISBLANK(['BenchBudEE.csv'.F767]);"";['BenchBudEE.csv'.F767]) ->  | G767: of:=IF(ISNUMBER(SEARCH("[0-9]";[.A767]));MID([.A767];1;SEARCH("[0-9]";[.A767])-1);"") -> 
A768: of:=IF(ISBLANK(['BenchBudEE.csv'.A768]);"";['BenchBudEE.csv'.A768]) ->  | B768: of:=IF(ISBLANK(['BenchBudEE.csv'.B768]);"";['BenchBudEE.csv'.B768]) ->  | C768: of:=IF(ISBLANK(['BenchBudEE.csv'.C903]);"";MID(['BenchBudEE.csv'.C903];SEARCH(":";['BenchBudEE.csv'.C903])+1;100)) ->  | D768: of:=IF(ISBLANK(['BenchBudEE.csv'.D768]);"";['BenchBudEE.csv'.D768]) ->  | E768: of:=IF(ISBLANK(['BenchBudEE.csv'.E768]);"";['BenchBudEE.csv'.E768]) ->  | F768: of:=IF(ISBLANK(['BenchBudEE.csv'.F768]);"";['BenchBudEE.csv'.F768]) ->  | G768: of:=IF(ISNUMBER(SEARCH("[0-9]";[.A768]));MID([.A768];1;SEARCH("[0-9]";[.A768])-1);"") -> 
A769: of:=IF(ISBLANK(['BenchBudEE.csv'.A769]);"";['BenchBudEE.csv'.A769]) ->  | B769: of:=IF(ISBLANK(['BenchBudEE.csv'.B769]);"";['BenchBudEE.csv'.B769]) ->  | C769: of:=IF(ISBLANK(['BenchBudEE.csv'.C904]);"";MID(['BenchBudEE.csv'.C904];SEARCH(":";['BenchBudEE.csv'.C904])+1;100)) ->  | D769: of:=IF(ISBLANK(['BenchBudEE.csv'.D769]);"";['BenchBudEE.csv'.D769]) ->  | E769: of:=IF(ISBLANK(['BenchBudEE.csv'.E769]);"";['BenchBudEE.csv'.E769]) ->  | F769: of:=IF(ISBLANK(['BenchBudEE.csv'.F769]);"";['BenchBudEE.csv'.F769]) ->  | G769: of:=IF(ISNUMBER(SEARCH("[0-9]";[.A769]));MID([.A769];1;SEARCH("[0-9]";[.A769])-1);"") -> 
A770: of:=IF(ISBLANK(['BenchBudEE.csv'.A770]);"";['BenchBudEE.csv'.A770]) ->  | B770: of:=IF(ISBLANK(['BenchBudEE.csv'.B770]);"";['BenchBudEE.csv'.B770]) ->  | C770: of:=IF(ISBLANK(['BenchBudEE.csv'.C905]);"";MID(['BenchBudEE.csv'.C905];SEARCH(":";['BenchBudEE.csv'.C905])+1;100)) ->  | D770: of:=IF(ISBLANK(['BenchBudEE.csv'.D770]);"";['BenchBudEE.csv'.D770]) ->  | E770: of:=IF(ISBLANK(['BenchBudEE.csv'.E770]);"";['BenchBudEE.csv'.E770]) ->  | F770: of:=IF(ISBLANK(['BenchBudEE.csv'.F770]);"";['BenchBudEE.csv'.F770]) ->  | G770: of:=IF(ISNUMBER(SEARCH("[0-9]";[.A770]));MID([.A770];1;SEARCH("[0-9]";[.A770])-1);"") -> 
A771: of:=IF(ISBLANK(['BenchBudEE.csv'.A771]);"";['BenchBudEE.csv'.A771]) ->  | B771: of:=IF(ISBLANK(['BenchBudEE.csv'.B771]);"";['BenchBudEE.csv'.B771]) ->  | C771: of:=IF(ISBLANK(['BenchBudEE.csv'.C906]);"";MID(['BenchBudEE.csv'.C906];SEARCH(":";['BenchBudEE.csv'.C906])+1;100)) ->  | D771: of:=IF(ISBLANK(['BenchBudEE.csv'.D771]);"";['BenchBudEE.csv'.D771]) ->  | E771: of:=IF(ISBLANK(['BenchBudEE.csv'.E771]);"";['BenchBudEE.csv'.E771]) ->  | F771: of:=IF(ISBLANK(['BenchBudEE.csv'.F771]);"";['BenchBudEE.csv'.F771]) ->  | G771: of:=IF(ISNUMBER(SEARCH("[0-9]";[.A771]));MID([.A771];1;SEARCH("[0-9]";[.A771])-1);"") -> 
A772: of:=IF(ISBLANK(['BenchBudEE.csv'.A772]);"";['BenchBudEE.csv'.A772]) ->  | B772: of:=IF(ISBLANK(['BenchBudEE.csv'.B772]);"";['BenchBudEE.csv'.B772]) ->  | C772: of:=IF(ISBLANK(['BenchBudEE.csv'.C907]);"";MID(['BenchBudEE.csv'.C907];SEARCH(":";['BenchBudEE.csv'.C907])+1;100)) ->  | D772: of:=IF(ISBLANK(['BenchBudEE.csv'.D772]);"";['BenchBudEE.csv'.D772]) ->  | E772: of:=IF(ISBLANK(['BenchBudEE.csv'.E772]);"";['BenchBudEE.csv'.E772]) ->  | F772: of:=IF(ISBLANK(['BenchBudEE.csv'.F772]);"";['BenchBudEE.csv'.F772]) ->  | G772: of:=IF(ISNUMBER(SEARCH("[0-9]";[.A772]));MID([.A772];1;SEARCH("[0-9]";[.A772])-1);"") -> 
A773: of:=IF(ISBLANK(['BenchBudEE.csv'.A773]);"";['BenchBudEE.csv'.A773]) ->  | B773: of:=IF(ISBLANK(['BenchBudEE.csv'.B773]);"";['BenchBudEE.csv'.B773]) ->  | C773: of:=IF(ISBLANK(['BenchBudEE.csv'.C908]);"";MID(['BenchBudEE.csv'.C908];SEARCH(":";['BenchBudEE.csv'.C908])+1;100)) ->  | D773: of:=IF(ISBLANK(['BenchBudEE.csv'.D773]);"";['BenchBudEE.csv'.D773]) ->  | E773: of:=IF(ISBLANK(['BenchBudEE.csv'.E773]);"";['BenchBudEE.csv'.E773]) ->  | F773: of:=IF(ISBLANK(['BenchBudEE.csv'.F773]);"";['BenchBudEE.csv'.F773]) ->  | G773: of:=IF(ISNUMBER(SEARCH("[0-9]";[.A773]));MID([.A773];1;SEARCH("[0-9]";[.A773])-1);"") -> 
A774: of:=IF(ISBLANK(['BenchBudEE.csv'.A774]);"";['BenchBudEE.csv'.A774]) ->  | B774: of:=IF(ISBLANK(['BenchBudEE.csv'.B774]);"";['BenchBudEE.csv'.B774]) ->  | C774: of:=IF(ISBLANK(['BenchBudEE.csv'.C909]);"";MID(['BenchBudEE.csv'.C909];SEARCH(":";['BenchBudEE.csv'.C909])+1;100)) ->  | D774: of:=IF(ISBLANK(['BenchBudEE.csv'.D774]);"";['BenchBudEE.csv'.D774]) ->  | E774: of:=IF(ISBLANK(['BenchBudEE.csv'.E774]);"";['BenchBudEE.csv'.E774]) ->  | F774: of:=IF(ISBLANK(['BenchBudEE.csv'.F774]);"";['BenchBudEE.csv'.F774]) ->  | G774: of:=IF(ISNUMBER(SEARCH("[0-9]";[.A774]));MID([.A774];1;SEARCH("[0-9]";[.A774])-1);"") -> 
A775: of:=IF(ISBLANK(['BenchBudEE.csv'.A775]);"";['BenchBudEE.csv'.A775]) ->  | B775: of:=IF(ISBLANK(['BenchBudEE.csv'.B775]);"";['BenchBudEE.csv'.B775]) ->  | C775: of:=IF(ISBLANK(['BenchBudEE.csv'.C910]);"";MID(['BenchBudEE.csv'.C910];SEARCH(":";['BenchBudEE.csv'.C910])+1;100)) ->  | D775: of:=IF(ISBLANK(['BenchBudEE.csv'.D775]);"";['BenchBudEE.csv'.D775]) ->  | E775: of:=IF(ISBLANK(['BenchBudEE.csv'.E775]);"";['BenchBudEE.csv'.E775]) ->  | F775: of:=IF(ISBLANK(['BenchBudEE.csv'.F775]);"";['BenchBudEE.csv'.F775]) ->  | G775: of:=IF(ISNUMBER(SEARCH("[0-9]";[.A775]));MID([.A775];1;SEARCH("[0-9]";[.A775])-1);"") -> 
A776: of:=IF(ISBLANK(['BenchBudEE.csv'.A776]);"";['BenchBudEE.csv'.A776]) ->  | B776: of:=IF(ISBLANK(['BenchBudEE.csv'.B776]);"";['BenchBudEE.csv'.B776]) ->  | C776: of:=IF(ISBLANK(['BenchBudEE.csv'.C911]);"";MID(['BenchBudEE.csv'.C911];SEARCH(":";['BenchBudEE.csv'.C911])+1;100)) ->  | D776: of:=IF(ISBLANK(['BenchBudEE.csv'.D776]);"";['BenchBudEE.csv'.D776]) ->  | E776: of:=IF(ISBLANK(['BenchBudEE.csv'.E776]);"";['BenchBudEE.csv'.E776]) ->  | F776: of:=IF(ISBLANK(['BenchBudEE.csv'.F776]);"";['BenchBudEE.csv'.F776]) ->  | G776: of:=IF(ISNUMBER(SEARCH("[0-9]";[.A776]));MID([.A776];1;SEARCH("[0-9]";[.A776])-1);"") -> 
A777: of:=IF(ISBLANK(['BenchBudEE.csv'.A777]);"";['BenchBudEE.csv'.A777]) ->  | B777: of:=IF(ISBLANK(['BenchBudEE.csv'.B777]);"";['BenchBudEE.csv'.B777]) ->  | C777: of:=IF(ISBLANK(['BenchBudEE.csv'.C912]);"";MID(['BenchBudEE.csv'.C912];SEARCH(":";['BenchBudEE.csv'.C912])+1;100)) ->  | D777: of:=IF(ISBLANK(['BenchBudEE.csv'.D777]);"";['BenchBudEE.csv'.D777]) ->  | E777: of:=IF(ISBLANK(['BenchBudEE.csv'.E777]);"";['BenchBudEE.csv'.E777]) ->  | F777: of:=IF(ISBLANK(['BenchBudEE.csv'.F777]);"";['BenchBudEE.csv'.F777]) ->  | G777: of:=IF(ISNUMBER(SEARCH("[0-9]";[.A777]));MID([.A777];1;SEARCH("[0-9]";[.A777])-1);"") -> 
A778: of:=IF(ISBLANK(['BenchBudEE.csv'.A778]);"";['BenchBudEE.csv'.A778]) ->  | B778: of:=IF(ISBLANK(['BenchBudEE.csv'.B778]);"";['BenchBudEE.csv'.B778]) ->  | C778: of:=IF(ISBLANK(['BenchBudEE.csv'.C913]);"";MID(['BenchBudEE.csv'.C913];SEARCH(":";['BenchBudEE.csv'.C913])+1;100)) ->  | D778: of:=IF(ISBLANK(['BenchBudEE.csv'.D778]);"";['BenchBudEE.csv'.D778]) ->  | E778: of:=IF(ISBLANK(['BenchBudEE.csv'.E778]);"";['BenchBudEE.csv'.E778]) ->  | F778: of:=IF(ISBLANK(['BenchBudEE.csv'.F778]);"";['BenchBudEE.csv'.F778]) ->  | G778: of:=IF(ISNUMBER(SEARCH("[0-9]";[.A778]));MID([.A778];1;SEARCH("[0-9]";[.A778])-1);"") -> 
A779: of:=IF(ISBLANK(['BenchBudEE.csv'.A779]);"";['BenchBudEE.csv'.A779]) ->  | B779: of:=IF(ISBLANK(['BenchBudEE.csv'.B779]);"";['BenchBudEE.csv'.B779]) ->  | C779: of:=IF(ISBLANK(['BenchBudEE.csv'.C914]);"";MID(['BenchBudEE.csv'.C914];SEARCH(":";['BenchBudEE.csv'.C914])+1;100)) ->  | D779: of:=IF(ISBLANK(['BenchBudEE.csv'.D779]);"";['BenchBudEE.csv'.D779]) ->  | E779: of:=IF(ISBLANK(['BenchBudEE.csv'.E779]);"";['BenchBudEE.csv'.E779]) ->  | F779: of:=IF(ISBLANK(['BenchBudEE.csv'.F779]);"";['BenchBudEE.csv'.F779]) ->  | G779: of:=IF(ISNUMBER(SEARCH("[0-9]";[.A779]));MID([.A779];1;SEARCH("[0-9]";[.A779])-1);"") -> 
A780: of:=IF(ISBLANK(['BenchBudEE.csv'.A780]);"";['BenchBudEE.csv'.A780]) ->  | B780: of:=IF(ISBLANK(['BenchBudEE.csv'.B780]);"";['BenchBudEE.csv'.B780]) ->  | C780: of:=IF(ISBLANK(['BenchBudEE.csv'.C915]);"";MID(['BenchBudEE.csv'.C915];SEARCH(":";['BenchBudEE.csv'.C915])+1;100)) ->  | D780: of:=IF(ISBLANK(['BenchBudEE.csv'.D780]);"";['BenchBudEE.csv'.D780]) ->  | E780: of:=IF(ISBLANK(['BenchBudEE.csv'.E780]);"";['BenchBudEE.csv'.E780]) ->  | F780: of:=IF(ISBLANK(['BenchBudEE.csv'.F780]);"";['BenchBudEE.csv'.F780]) ->  | G780: of:=IF(ISNUMBER(SEARCH("[0-9]";[.A780]));MID([.A780];1;SEARCH("[0-9]";[.A780])-1);"") -> 
A781: of:=IF(ISBLANK(['BenchBudEE.csv'.A781]);"";['BenchBudEE.csv'.A781]) ->  | B781: of:=IF(ISBLANK(['BenchBudEE.csv'.B781]);"";['BenchBudEE.csv'.B781]) ->  | C781: of:=IF(ISBLANK(['BenchBudEE.csv'.C916]);"";MID(['BenchBudEE.csv'.C916];SEARCH(":";['BenchBudEE.csv'.C916])+1;100)) ->  | D781: of:=IF(ISBLANK(['BenchBudEE.csv'.D781]);"";['BenchBudEE.csv'.D781]) ->  | E781: of:=IF(ISBLANK(['BenchBudEE.csv'.E781]);"";['BenchBudEE.csv'.E781]) ->  | F781: of:=IF(ISBLANK(['BenchBudEE.csv'.F781]);"";['BenchBudEE.csv'.F781]) ->  | G781: of:=IF(ISNUMBER(SEARCH("[0-9]";[.A781]));MID([.A781];1;SEARCH("[0-9]";[.A781])-1);"") -> 
A782: of:=IF(ISBLANK(['BenchBudEE.csv'.A782]);"";['BenchBudEE.csv'.A782]) ->  | B782: of:=IF(ISBLANK(['BenchBudEE.csv'.B782]);"";['BenchBudEE.csv'.B782]) ->  | C782: of:=IF(ISBLANK(['BenchBudEE.csv'.C917]);"";MID(['BenchBudEE.csv'.C917];SEARCH(":";['BenchBudEE.csv'.C917])+1;100)) ->  | D782: of:=IF(ISBLANK(['BenchBudEE.csv'.D782]);"";['BenchBudEE.csv'.D782]) ->  | E782: of:=IF(ISBLANK(['BenchBudEE.csv'.E782]);"";['BenchBudEE.csv'.E782]) ->  | F782: of:=IF(ISBLANK(['BenchBudEE.csv'.F782]);"";['BenchBudEE.csv'.F782]) ->  | G782: of:=IF(ISNUMBER(SEARCH("[0-9]";[.A782]));MID([.A782];1;SEARCH("[0-9]";[.A782])-1);"") -> 
A783: of:=IF(ISBLANK(['BenchBudEE.csv'.A783]);"";['BenchBudEE.csv'.A783]) ->  | B783: of:=IF(ISBLANK(['BenchBudEE.csv'.B783]);"";['BenchBudEE.csv'.B783]) ->  | C783: of:=IF(ISBLANK(['BenchBudEE.csv'.C918]);"";MID(['BenchBudEE.csv'.C918];SEARCH(":";['BenchBudEE.csv'.C918])+1;100)) ->  | D783: of:=IF(ISBLANK(['BenchBudEE.csv'.D783]);"";['BenchBudEE.csv'.D783]) ->  | E783: of:=IF(ISBLANK(['BenchBudEE.csv'.E783]);"";['BenchBudEE.csv'.E783]) ->  | F783: of:=IF(ISBLANK(['BenchBudEE.csv'.F783]);"";['BenchBudEE.csv'.F783]) ->  | G783: of:=IF(ISNUMBER(SEARCH("[0-9]";[.A783]));MID([.A783];1;SEARCH("[0-9]";[.A783])-1);"") -> 
A784: of:=IF(ISBLANK(['BenchBudEE.csv'.A784]);"";['BenchBudEE.csv'.A784]) ->  | B784: of:=IF(ISBLANK(['BenchBudEE.csv'.B784]);"";['BenchBudEE.csv'.B784]) ->  | C784: of:=IF(ISBLANK(['BenchBudEE.csv'.C919]);"";MID(['BenchBudEE.csv'.C919];SEARCH(":";['BenchBudEE.csv'.C919])+1;100)) ->  | D784: of:=IF(ISBLANK(['BenchBudEE.csv'.D784]);"";['BenchBudEE.csv'.D784]) ->  | E784: of:=IF(ISBLANK(['BenchBudEE.csv'.E784]);"";['BenchBudEE.csv'.E784]) ->  | F784: of:=IF(ISBLANK(['BenchBudEE.csv'.F784]);"";['BenchBudEE.csv'.F784]) ->  | G784: of:=IF(ISNUMBER(SEARCH("[0-9]";[.A784]));MID([.A784];1;SEARCH("[0-9]";[.A784])-1);"") -> 
A785: of:=IF(ISBLANK(['BenchBudEE.csv'.A785]);"";['BenchBudEE.csv'.A785]) ->  | B785: of:=IF(ISBLANK(['BenchBudEE.csv'.B785]);"";['BenchBudEE.csv'.B785]) ->  | C785: of:=IF(ISBLANK(['BenchBudEE.csv'.C920]);"";MID(['BenchBudEE.csv'.C920];SEARCH(":";['BenchBudEE.csv'.C920])+1;100)) ->  | D785: of:=IF(ISBLANK(['BenchBudEE.csv'.D785]);"";['BenchBudEE.csv'.D785]) ->  | E785: of:=IF(ISBLANK(['BenchBudEE.csv'.E785]);"";['BenchBudEE.csv'.E785]) ->  | F785: of:=IF(ISBLANK(['BenchBudEE.csv'.F785]);"";['BenchBudEE.csv'.F785]) ->  | G785: of:=IF(ISNUMBER(SEARCH("[0-9]";[.A785]));MID([.A785];1;SEARCH("[0-9]";[.A785])-1);"") -> 
A786: of:=IF(ISBLANK(['BenchBudEE.csv'.A786]);"";['BenchBudEE.csv'.A786]) ->  | B786: of:=IF(ISBLANK(['BenchBudEE.csv'.B786]);"";['BenchBudEE.csv'.B786]) ->  | C786: of:=IF(ISBLANK(['BenchBudEE.csv'.C921]);"";MID(['BenchBudEE.csv'.C921];SEARCH(":";['BenchBudEE.csv'.C921])+1;100)) ->  | D786: of:=IF(ISBLANK(['BenchBudEE.csv'.D786]);"";['BenchBudEE.csv'.D786]) ->  | E786: of:=IF(ISBLANK(['BenchBudEE.csv'.E786]);"";['BenchBudEE.csv'.E786]) ->  | F786: of:=IF(ISBLANK(['BenchBudEE.csv'.F786]);"";['BenchBudEE.csv'.F786]) ->  | G786: of:=IF(ISNUMBER(SEARCH("[0-9]";[.A786]));MID([.A786];1;SEARCH("[0-9]";[.A786])-1);"") -> 
A787: of:=IF(ISBLANK(['BenchBudEE.csv'.A787]);"";['BenchBudEE.csv'.A787]) ->  | B787: of:=IF(ISBLANK(['BenchBudEE.csv'.B787]);"";['BenchBudEE.csv'.B787]) ->  | C787: of:=IF(ISBLANK(['BenchBudEE.csv'.C922]);"";MID(['BenchBudEE.csv'.C922];SEARCH(":";['BenchBudEE.csv'.C922])+1;100)) ->  | D787: of:=IF(ISBLANK(['BenchBudEE.csv'.D787]);"";['BenchBudEE.csv'.D787]) ->  | E787: of:=IF(ISBLANK(['BenchBudEE.csv'.E787]);"";['BenchBudEE.csv'.E787]) ->  | F787: of:=IF(ISBLANK(['BenchBudEE.csv'.F787]);"";['BenchBudEE.csv'.F787]) ->  | G787: of:=IF(ISNUMBER(SEARCH("[0-9]";[.A787]));MID([.A787];1;SEARCH("[0-9]";[.A787])-1);"") -> 
A788: of:=IF(ISBLANK(['BenchBudEE.csv'.A788]);"";['BenchBudEE.csv'.A788]) ->  | B788: of:=IF(ISBLANK(['BenchBudEE.csv'.B788]);"";['BenchBudEE.csv'.B788]) ->  | C788: of:=IF(ISBLANK(['BenchBudEE.csv'.C923]);"";MID(['BenchBudEE.csv'.C923];SEARCH(":";['BenchBudEE.csv'.C923])+1;100)) ->  | D788: of:=IF(ISBLANK(['BenchBudEE.csv'.D788]);"";['BenchBudEE.csv'.D788]) ->  | E788: of:=IF(ISBLANK(['BenchBudEE.csv'.E788]);"";['BenchBudEE.csv'.E788]) ->  | F788: of:=IF(ISBLANK(['BenchBudEE.csv'.F788]);"";['BenchBudEE.csv'.F788]) ->  | G788: of:=IF(ISNUMBER(SEARCH("[0-9]";[.A788]));MID([.A788];1;SEARCH("[0-9]";[.A788])-1);"") -> 
A789: of:=IF(ISBLANK(['BenchBudEE.csv'.A789]);"";['BenchBudEE.csv'.A789]) ->  | B789: of:=IF(ISBLANK(['BenchBudEE.csv'.B789]);"";['BenchBudEE.csv'.B789]) ->  | C789: of:=IF(ISBLANK(['BenchBudEE.csv'.C924]);"";MID(['BenchBudEE.csv'.C924];SEARCH(":";['BenchBudEE.csv'.C924])+1;100)) ->  | D789: of:=IF(ISBLANK(['BenchBudEE.csv'.D789]);"";['BenchBudEE.csv'.D789]) ->  | E789: of:=IF(ISBLANK(['BenchBudEE.csv'.E789]);"";['BenchBudEE.csv'.E789]) ->  | F789: of:=IF(ISBLANK(['BenchBudEE.csv'.F789]);"";['BenchBudEE.csv'.F789]) ->  | G789: of:=IF(ISNUMBER(SEARCH("[0-9]";[.A789]));MID([.A789];1;SEARCH("[0-9]";[.A789])-1);"") -> 
A790: of:=IF(ISBLANK(['BenchBudEE.csv'.A790]);"";['BenchBudEE.csv'.A790]) ->  | B790: of:=IF(ISBLANK(['BenchBudEE.csv'.B790]);"";['BenchBudEE.csv'.B790]) ->  | C790: of:=IF(ISBLANK(['BenchBudEE.csv'.C925]);"";MID(['BenchBudEE.csv'.C925];SEARCH(":";['BenchBudEE.csv'.C925])+1;100)) ->  | D790: of:=IF(ISBLANK(['BenchBudEE.csv'.D790]);"";['BenchBudEE.csv'.D790]) ->  | E790: of:=IF(ISBLANK(['BenchBudEE.csv'.E790]);"";['BenchBudEE.csv'.E790]) ->  | F790: of:=IF(ISBLANK(['BenchBudEE.csv'.F790]);"";['BenchBudEE.csv'.F790]) ->  | G790: of:=IF(ISNUMBER(SEARCH("[0-9]";[.A790]));MID([.A790];1;SEARCH("[0-9]";[.A790])-1);"") -> 
A791: of:=IF(ISBLANK(['BenchBudEE.csv'.A791]);"";['BenchBudEE.csv'.A791]) ->  | B791: of:=IF(ISBLANK(['BenchBudEE.csv'.B791]);"";['BenchBudEE.csv'.B791]) ->  | C791: of:=IF(ISBLANK(['BenchBudEE.csv'.C926]);"";MID(['BenchBudEE.csv'.C926];SEARCH(":";['BenchBudEE.csv'.C926])+1;100)) ->  | D791: of:=IF(ISBLANK(['BenchBudEE.csv'.D791]);"";['BenchBudEE.csv'.D791]) ->  | E791: of:=IF(ISBLANK(['BenchBudEE.csv'.E791]);"";['BenchBudEE.csv'.E791]) ->  | F791: of:=IF(ISBLANK(['BenchBudEE.csv'.F791]);"";['BenchBudEE.csv'.F791]) ->  | G791: of:=IF(ISNUMBER(SEARCH("[0-9]";[.A791]));MID([.A791];1;SEARCH("[0-9]";[.A791])-1);"") -> 
A792: of:=IF(ISBLANK(['BenchBudEE.csv'.A792]);"";['BenchBudEE.csv'.A792]) ->  | B792: of:=IF(ISBLANK(['BenchBudEE.csv'.B792]);"";['BenchBudEE.csv'.B792]) ->  | C792: of:=IF(ISBLANK(['BenchBudEE.csv'.C927]);"";MID(['BenchBudEE.csv'.C927];SEARCH(":";['BenchBudEE.csv'.C927])+1;100)) ->  | D792: of:=IF(ISBLANK(['BenchBudEE.csv'.D792]);"";['BenchBudEE.csv'.D792]) ->  | E792: of:=IF(ISBLANK(['BenchBudEE.csv'.E792]);"";['BenchBudEE.csv'.E792]) ->  | F792: of:=IF(ISBLANK(['BenchBudEE.csv'.F792]);"";['BenchBudEE.csv'.F792]) ->  | G792: of:=IF(ISNUMBER(SEARCH("[0-9]";[.A792]));MID([.A792];1;SEARCH("[0-9]";[.A792])-1);"") -> 
A793: of:=IF(ISBLANK(['BenchBudEE.csv'.A793]);"";['BenchBudEE.csv'.A793]) ->  | B793: of:=IF(ISBLANK(['BenchBudEE.csv'.B793]);"";['BenchBudEE.csv'.B793]) ->  | C793: of:=IF(ISBLANK(['BenchBudEE.csv'.C928]);"";MID(['BenchBudEE.csv'.C928];SEARCH(":";['BenchBudEE.csv'.C928])+1;100)) ->  | D793: of:=IF(ISBLANK(['BenchBudEE.csv'.D793]);"";['BenchBudEE.csv'.D793]) ->  | E793: of:=IF(ISBLANK(['BenchBudEE.csv'.E793]);"";['BenchBudEE.csv'.E793]) ->  | F793: of:=IF(ISBLANK(['BenchBudEE.csv'.F793]);"";['BenchBudEE.csv'.F793]) ->  | G793: of:=IF(ISNUMBER(SEARCH("[0-9]";[.A793]));MID([.A793];1;SEARCH("[0-9]";[.A793])-1);"") -> 
A794: of:=IF(ISBLANK(['BenchBudEE.csv'.A794]);"";['BenchBudEE.csv'.A794]) ->  | B794: of:=IF(ISBLANK(['BenchBudEE.csv'.B794]);"";['BenchBudEE.csv'.B794]) ->  | C794: of:=IF(ISBLANK(['BenchBudEE.csv'.C929]);"";MID(['BenchBudEE.csv'.C929];SEARCH(":";['BenchBudEE.csv'.C929])+1;100)) ->  | D794: of:=IF(ISBLANK(['BenchBudEE.csv'.D794]);"";['BenchBudEE.csv'.D794]) ->  | E794: of:=IF(ISBLANK(['BenchBudEE.csv'.E794]);"";['BenchBudEE.csv'.E794]) ->  | F794: of:=IF(ISBLANK(['BenchBudEE.csv'.F794]);"";['BenchBudEE.csv'.F794]) ->  | G794: of:=IF(ISNUMBER(SEARCH("[0-9]";[.A794]));MID([.A794];1;SEARCH("[0-9]";[.A794])-1);"") -> 
A795: of:=IF(ISBLANK(['BenchBudEE.csv'.A795]);"";['BenchBudEE.csv'.A795]) ->  | B795: of:=IF(ISBLANK(['BenchBudEE.csv'.B795]);"";['BenchBudEE.csv'.B795]) ->  | C795: of:=IF(ISBLANK(['BenchBudEE.csv'.C930]);"";MID(['BenchBudEE.csv'.C930];SEARCH(":";['BenchBudEE.csv'.C930])+1;100)) ->  | D795: of:=IF(ISBLANK(['BenchBudEE.csv'.D795]);"";['BenchBudEE.csv'.D795]) ->  | E795: of:=IF(ISBLANK(['BenchBudEE.csv'.E795]);"";['BenchBudEE.csv'.E795]) ->  | F795: of:=IF(ISBLANK(['BenchBudEE.csv'.F795]);"";['BenchBudEE.csv'.F795]) ->  | G795: of:=IF(ISNUMBER(SEARCH("[0-9]";[.A795]));MID([.A795];1;SEARCH("[0-9]";[.A795])-1);"") -> 
A796: of:=IF(ISBLANK(['BenchBudEE.csv'.A796]);"";['BenchBudEE.csv'.A796]) ->  | B796: of:=IF(ISBLANK(['BenchBudEE.csv'.B796]);"";['BenchBudEE.csv'.B796]) ->  | C796: of:=IF(ISBLANK(['BenchBudEE.csv'.C931]);"";MID(['BenchBudEE.csv'.C931];SEARCH(":";['BenchBudEE.csv'.C931])+1;100)) ->  | D796: of:=IF(ISBLANK(['BenchBudEE.csv'.D796]);"";['BenchBudEE.csv'.D796]) ->  | E796: of:=IF(ISBLANK(['BenchBudEE.csv'.E796]);"";['BenchBudEE.csv'.E796]) ->  | F796: of:=IF(ISBLANK(['BenchBudEE.csv'.F796]);"";['BenchBudEE.csv'.F796]) ->  | G796: of:=IF(ISNUMBER(SEARCH("[0-9]";[.A796]));MID([.A796];1;SEARCH("[0-9]";[.A796])-1);"") -> 
A797: of:=IF(ISBLANK(['BenchBudEE.csv'.A797]);"";['BenchBudEE.csv'.A797]) ->  | B797: of:=IF(ISBLANK(['BenchBudEE.csv'.B797]);"";['BenchBudEE.csv'.B797]) ->  | C797: of:=IF(ISBLANK(['BenchBudEE.csv'.C932]);"";MID(['BenchBudEE.csv'.C932];SEARCH(":";['BenchBudEE.csv'.C932])+1;100)) ->  | D797: of:=IF(ISBLANK(['BenchBudEE.csv'.D797]);"";['BenchBudEE.csv'.D797]) ->  | E797: of:=IF(ISBLANK(['BenchBudEE.csv'.E797]);"";['BenchBudEE.csv'.E797]) ->  | F797: of:=IF(ISBLANK(['BenchBudEE.csv'.F797]);"";['BenchBudEE.csv'.F797]) ->  | G797: of:=IF(ISNUMBER(SEARCH("[0-9]";[.A797]));MID([.A797];1;SEARCH("[0-9]";[.A797])-1);"") -> 
A798: of:=IF(ISBLANK(['BenchBudEE.csv'.A798]);"";['BenchBudEE.csv'.A798]) ->  | B798: of:=IF(ISBLANK(['BenchBudEE.csv'.B798]);"";['BenchBudEE.csv'.B798]) ->  | C798: of:=IF(ISBLANK(['BenchBudEE.csv'.C933]);"";MID(['BenchBudEE.csv'.C933];SEARCH(":";['BenchBudEE.csv'.C933])+1;100)) ->  | D798: of:=IF(ISBLANK(['BenchBudEE.csv'.D798]);"";['BenchBudEE.csv'.D798]) ->  | E798: of:=IF(ISBLANK(['BenchBudEE.csv'.E798]);"";['BenchBudEE.csv'.E798]) ->  | F798: of:=IF(ISBLANK(['BenchBudEE.csv'.F798]);"";['BenchBudEE.csv'.F798]) ->  | G798: of:=IF(ISNUMBER(SEARCH("[0-9]";[.A798]));MID([.A798];1;SEARCH("[0-9]";[.A798])-1);"") -> 
A799: of:=IF(ISBLANK(['BenchBudEE.csv'.A799]);"";['BenchBudEE.csv'.A799]) ->  | B799: of:=IF(ISBLANK(['BenchBudEE.csv'.B799]);"";['BenchBudEE.csv'.B799]) ->  | C799: of:=IF(ISBLANK(['BenchBudEE.csv'.C934]);"";MID(['BenchBudEE.csv'.C934];SEARCH(":";['BenchBudEE.csv'.C934])+1;100)) ->  | D799: of:=IF(ISBLANK(['BenchBudEE.csv'.D799]);"";['BenchBudEE.csv'.D799]) ->  | E799: of:=IF(ISBLANK(['BenchBudEE.csv'.E799]);"";['BenchBudEE.csv'.E799]) ->  | F799: of:=IF(ISBLANK(['BenchBudEE.csv'.F799]);"";['BenchBudEE.csv'.F799]) ->  | G799: of:=IF(ISNUMBER(SEARCH("[0-9]";[.A799]));MID([.A799];1;SEARCH("[0-9]";[.A799])-1);"") -> 
A800: of:=IF(ISBLANK(['BenchBudEE.csv'.A800]);"";['BenchBudEE.csv'.A800]) ->  | B800: of:=IF(ISBLANK(['BenchBudEE.csv'.B800]);"";['BenchBudEE.csv'.B800]) ->  | C800: of:=IF(ISBLANK(['BenchBudEE.csv'.C935]);"";MID(['BenchBudEE.csv'.C935];SEARCH(":";['BenchBudEE.csv'.C935])+1;100)) ->  | D800: of:=IF(ISBLANK(['BenchBudEE.csv'.D800]);"";['BenchBudEE.csv'.D800]) ->  | E800: of:=IF(ISBLANK(['BenchBudEE.csv'.E800]);"";['BenchBudEE.csv'.E800]) ->  | F800: of:=IF(ISBLANK(['BenchBudEE.csv'.F800]);"";['BenchBudEE.csv'.F800]) ->  | G800: of:=IF(ISNUMBER(SEARCH("[0-9]";[.A800]));MID([.A800];1;SEARCH("[0-9]";[.A800])-1);"") -> 
A801: of:=IF(ISBLANK(['BenchBudEE.csv'.A801]);"";['BenchBudEE.csv'.A801]) ->  | B801: of:=IF(ISBLANK(['BenchBudEE.csv'.B801]);"";['BenchBudEE.csv'.B801]) ->  | C801: of:=IF(ISBLANK(['BenchBudEE.csv'.C936]);"";MID(['BenchBudEE.csv'.C936];SEARCH(":";['BenchBudEE.csv'.C936])+1;100)) ->  | D801: of:=IF(ISBLANK(['BenchBudEE.csv'.D801]);"";['BenchBudEE.csv'.D801]) ->  | E801: of:=IF(ISBLANK(['BenchBudEE.csv'.E801]);"";['BenchBudEE.csv'.E801]) ->  | F801: of:=IF(ISBLANK(['BenchBudEE.csv'.F801]);"";['BenchBudEE.csv'.F801]) ->  | G801: of:=IF(ISNUMBER(SEARCH("[0-9]";[.A801]));MID([.A801];1;SEARCH("[0-9]";[.A801])-1);"") -> 
A802: of:=IF(ISBLANK(['BenchBudEE.csv'.A802]);"";['BenchBudEE.csv'.A802]) ->  | B802: of:=IF(ISBLANK(['BenchBudEE.csv'.B802]);"";['BenchBudEE.csv'.B802]) ->  | C802: of:=IF(ISBLANK(['BenchBudEE.csv'.C937]);"";MID(['BenchBudEE.csv'.C937];SEARCH(":";['BenchBudEE.csv'.C937])+1;100)) ->  | D802: of:=IF(ISBLANK(['BenchBudEE.csv'.D802]);"";['BenchBudEE.csv'.D802]) ->  | E802: of:=IF(ISBLANK(['BenchBudEE.csv'.E802]);"";['BenchBudEE.csv'.E802]) ->  | F802: of:=IF(ISBLANK(['BenchBudEE.csv'.F802]);"";['BenchBudEE.csv'.F802]) ->  | G802: of:=IF(ISNUMBER(SEARCH("[0-9]";[.A802]));MID([.A802];1;SEARCH("[0-9]";[.A802])-1);"") -> 
A803: of:=IF(ISBLANK(['BenchBudEE.csv'.A803]);"";['BenchBudEE.csv'.A803]) ->  | B803: of:=IF(ISBLANK(['BenchBudEE.csv'.B803]);"";['BenchBudEE.csv'.B803]) ->  | C803: of:=IF(ISBLANK(['BenchBudEE.csv'.C938]);"";MID(['BenchBudEE.csv'.C938];SEARCH(":";['BenchBudEE.csv'.C938])+1;100)) ->  | D803: of:=IF(ISBLANK(['BenchBudEE.csv'.D803]);"";['BenchBudEE.csv'.D803]) ->  | E803: of:=IF(ISBLANK(['BenchBudEE.csv'.E803]);"";['BenchBudEE.csv'.E803]) ->  | F803: of:=IF(ISBLANK(['BenchBudEE.csv'.F803]);"";['BenchBudEE.csv'.F803]) ->  | G803: of:=IF(ISNUMBER(SEARCH("[0-9]";[.A803]));MID([.A803];1;SEARCH("[0-9]";[.A803])-1);"") -> 
A804: of:=IF(ISBLANK(['BenchBudEE.csv'.A804]);"";['BenchBudEE.csv'.A804]) ->  | B804: of:=IF(ISBLANK(['BenchBudEE.csv'.B804]);"";['BenchBudEE.csv'.B804]) ->  | C804: of:=IF(ISBLANK(['BenchBudEE.csv'.C939]);"";MID(['BenchBudEE.csv'.C939];SEARCH(":";['BenchBudEE.csv'.C939])+1;100)) ->  | D804: of:=IF(ISBLANK(['BenchBudEE.csv'.D804]);"";['BenchBudEE.csv'.D804]) ->  | E804: of:=IF(ISBLANK(['BenchBudEE.csv'.E804]);"";['BenchBudEE.csv'.E804]) ->  | F804: of:=IF(ISBLANK(['BenchBudEE.csv'.F804]);"";['BenchBudEE.csv'.F804]) ->  | G804: of:=IF(ISNUMBER(SEARCH("[0-9]";[.A804]));MID([.A804];1;SEARCH("[0-9]";[.A804])-1);"") -> 
A805: of:=IF(ISBLANK(['BenchBudEE.csv'.A805]);"";['BenchBudEE.csv'.A805]) ->  | B805: of:=IF(ISBLANK(['BenchBudEE.csv'.B805]);"";['BenchBudEE.csv'.B805]) ->  | C805: of:=IF(ISBLANK(['BenchBudEE.csv'.C940]);"";MID(['BenchBudEE.csv'.C940];SEARCH(":";['BenchBudEE.csv'.C940])+1;100)) ->  | D805: of:=IF(ISBLANK(['BenchBudEE.csv'.D805]);"";['BenchBudEE.csv'.D805]) ->  | E805: of:=IF(ISBLANK(['BenchBudEE.csv'.E805]);"";['BenchBudEE.csv'.E805]) ->  | F805: of:=IF(ISBLANK(['BenchBudEE.csv'.F805]);"";['BenchBudEE.csv'.F805]) ->  | G805: of:=IF(ISNUMBER(SEARCH("[0-9]";[.A805]));MID([.A805];1;SEARCH("[0-9]";[.A805])-1);"") -> 
A806: of:=IF(ISBLANK(['BenchBudEE.csv'.A806]);"";['BenchBudEE.csv'.A806]) ->  | B806: of:=IF(ISBLANK(['BenchBudEE.csv'.B806]);"";['BenchBudEE.csv'.B806]) ->  | C806: of:=IF(ISBLANK(['BenchBudEE.csv'.C941]);"";MID(['BenchBudEE.csv'.C941];SEARCH(":";['BenchBudEE.csv'.C941])+1;100)) ->  | D806: of:=IF(ISBLANK(['BenchBudEE.csv'.D806]);"";['BenchBudEE.csv'.D806]) ->  | E806: of:=IF(ISBLANK(['BenchBudEE.csv'.E806]);"";['BenchBudEE.csv'.E806]) ->  | F806: of:=IF(ISBLANK(['BenchBudEE.csv'.F806]);"";['BenchBudEE.csv'.F806]) ->  | G806: of:=IF(ISNUMBER(SEARCH("[0-9]";[.A806]));MID([.A806];1;SEARCH("[0-9]";[.A806])-1);"") -> 
A807: of:=IF(ISBLANK(['BenchBudEE.csv'.A807]);"";['BenchBudEE.csv'.A807]) ->  | B807: of:=IF(ISBLANK(['BenchBudEE.csv'.B807]);"";['BenchBudEE.csv'.B807]) ->  | C807: of:=IF(ISBLANK(['BenchBudEE.csv'.C942]);"";MID(['BenchBudEE.csv'.C942];SEARCH(":";['BenchBudEE.csv'.C942])+1;100)) ->  | D807: of:=IF(ISBLANK(['BenchBudEE.csv'.D807]);"";['BenchBudEE.csv'.D807]) ->  | E807: of:=IF(ISBLANK(['BenchBudEE.csv'.E807]);"";['BenchBudEE.csv'.E807]) ->  | F807: of:=IF(ISBLANK(['BenchBudEE.csv'.F807]);"";['BenchBudEE.csv'.F807]) ->  | G807: of:=IF(ISNUMBER(SEARCH("[0-9]";[.A807]));MID([.A807];1;SEARCH("[0-9]";[.A807])-1);"") -> 
A808: of:=IF(ISBLANK(['BenchBudEE.csv'.A808]);"";['BenchBudEE.csv'.A808]) ->  | B808: of:=IF(ISBLANK(['BenchBudEE.csv'.B808]);"";['BenchBudEE.csv'.B808]) ->  | C808: of:=IF(ISBLANK(['BenchBudEE.csv'.C943]);"";MID(['BenchBudEE.csv'.C943];SEARCH(":";['BenchBudEE.csv'.C943])+1;100)) ->  | D808: of:=IF(ISBLANK(['BenchBudEE.csv'.D808]);"";['BenchBudEE.csv'.D808]) ->  | E808: of:=IF(ISBLANK(['BenchBudEE.csv'.E808]);"";['BenchBudEE.csv'.E808]) ->  | F808: of:=IF(ISBLANK(['BenchBudEE.csv'.F808]);"";['BenchBudEE.csv'.F808]) ->  | G808: of:=IF(ISNUMBER(SEARCH("[0-9]";[.A808]));MID([.A808];1;SEARCH("[0-9]";[.A808])-1);"") -> 
A809: of:=IF(ISBLANK(['BenchBudEE.csv'.A809]);"";['BenchBudEE.csv'.A809]) ->  | B809: of:=IF(ISBLANK(['BenchBudEE.csv'.B809]);"";['BenchBudEE.csv'.B809]) ->  | C809: of:=IF(ISBLANK(['BenchBudEE.csv'.C944]);"";MID(['BenchBudEE.csv'.C944];SEARCH(":";['BenchBudEE.csv'.C944])+1;100)) ->  | D809: of:=IF(ISBLANK(['BenchBudEE.csv'.D809]);"";['BenchBudEE.csv'.D809]) ->  | E809: of:=IF(ISBLANK(['BenchBudEE.csv'.E809]);"";['BenchBudEE.csv'.E809]) ->  | F809: of:=IF(ISBLANK(['BenchBudEE.csv'.F809]);"";['BenchBudEE.csv'.F809]) ->  | G809: of:=IF(ISNUMBER(SEARCH("[0-9]";[.A809]));MID([.A809];1;SEARCH("[0-9]";[.A809])-1);"") -> 
A810: of:=IF(ISBLANK(['BenchBudEE.csv'.A810]);"";['BenchBudEE.csv'.A810]) ->  | B810: of:=IF(ISBLANK(['BenchBudEE.csv'.B810]);"";['BenchBudEE.csv'.B810]) ->  | C810: of:=IF(ISBLANK(['BenchBudEE.csv'.C945]);"";MID(['BenchBudEE.csv'.C945];SEARCH(":";['BenchBudEE.csv'.C945])+1;100)) ->  | D810: of:=IF(ISBLANK(['BenchBudEE.csv'.D810]);"";['BenchBudEE.csv'.D810]) ->  | E810: of:=IF(ISBLANK(['BenchBudEE.csv'.E810]);"";['BenchBudEE.csv'.E810]) ->  | F810: of:=IF(ISBLANK(['BenchBudEE.csv'.F810]);"";['BenchBudEE.csv'.F810]) ->  | G810: of:=IF(ISNUMBER(SEARCH("[0-9]";[.A810]));MID([.A810];1;SEARCH("[0-9]";[.A810])-1);"") -> 
A811: of:=IF(ISBLANK(['BenchBudEE.csv'.A811]);"";['BenchBudEE.csv'.A811]) ->  | B811: of:=IF(ISBLANK(['BenchBudEE.csv'.B811]);"";['BenchBudEE.csv'.B811]) ->  | C811: of:=IF(ISBLANK(['BenchBudEE.csv'.C946]);"";MID(['BenchBudEE.csv'.C946];SEARCH(":";['BenchBudEE.csv'.C946])+1;100)) ->  | D811: of:=IF(ISBLANK(['BenchBudEE.csv'.D811]);"";['BenchBudEE.csv'.D811]) ->  | E811: of:=IF(ISBLANK(['BenchBudEE.csv'.E811]);"";['BenchBudEE.csv'.E811]) ->  | F811: of:=IF(ISBLANK(['BenchBudEE.csv'.F811]);"";['BenchBudEE.csv'.F811]) ->  | G811: of:=IF(ISNUMBER(SEARCH("[0-9]";[.A811]));MID([.A811];1;SEARCH("[0-9]";[.A811])-1);"") -> 
A812: of:=IF(ISBLANK(['BenchBudEE.csv'.A812]);"";['BenchBudEE.csv'.A812]) ->  | B812: of:=IF(ISBLANK(['BenchBudEE.csv'.B812]);"";['BenchBudEE.csv'.B812]) ->  | C812: of:=IF(ISBLANK(['BenchBudEE.csv'.C947]);"";MID(['BenchBudEE.csv'.C947];SEARCH(":";['BenchBudEE.csv'.C947])+1;100)) ->  | D812: of:=IF(ISBLANK(['BenchBudEE.csv'.D812]);"";['BenchBudEE.csv'.D812]) ->  | E812: of:=IF(ISBLANK(['BenchBudEE.csv'.E812]);"";['BenchBudEE.csv'.E812]) ->  | F812: of:=IF(ISBLANK(['BenchBudEE.csv'.F812]);"";['BenchBudEE.csv'.F812]) ->  | G812: of:=IF(ISNUMBER(SEARCH("[0-9]";[.A812]));MID([.A812];1;SEARCH("[0-9]";[.A812])-1);"") -> 
A813: of:=IF(ISBLANK(['BenchBudEE.csv'.A813]);"";['BenchBudEE.csv'.A813]) ->  | B813: of:=IF(ISBLANK(['BenchBudEE.csv'.B813]);"";['BenchBudEE.csv'.B813]) ->  | C813: of:=IF(ISBLANK(['BenchBudEE.csv'.C948]);"";MID(['BenchBudEE.csv'.C948];SEARCH(":";['BenchBudEE.csv'.C948])+1;100)) ->  | D813: of:=IF(ISBLANK(['BenchBudEE.csv'.D813]);"";['BenchBudEE.csv'.D813]) ->  | E813: of:=IF(ISBLANK(['BenchBudEE.csv'.E813]);"";['BenchBudEE.csv'.E813]) ->  | F813: of:=IF(ISBLANK(['BenchBudEE.csv'.F813]);"";['BenchBudEE.csv'.F813]) ->  | G813: of:=IF(ISNUMBER(SEARCH("[0-9]";[.A813]));MID([.A813];1;SEARCH("[0-9]";[.A813])-1);"") -> 
A814: of:=IF(ISBLANK(['BenchBudEE.csv'.A814]);"";['BenchBudEE.csv'.A814]) ->  | B814: of:=IF(ISBLANK(['BenchBudEE.csv'.B814]);"";['BenchBudEE.csv'.B814]) ->  | C814: of:=IF(ISBLANK(['BenchBudEE.csv'.C949]);"";MID(['BenchBudEE.csv'.C949];SEARCH(":";['BenchBudEE.csv'.C949])+1;100)) ->  | D814: of:=IF(ISBLANK(['BenchBudEE.csv'.D814]);"";['BenchBudEE.csv'.D814]) ->  | E814: of:=IF(ISBLANK(['BenchBudEE.csv'.E814]);"";['BenchBudEE.csv'.E814]) ->  | F814: of:=IF(ISBLANK(['BenchBudEE.csv'.F814]);"";['BenchBudEE.csv'.F814]) ->  | G814: of:=IF(ISNUMBER(SEARCH("[0-9]";[.A814]));MID([.A814];1;SEARCH("[0-9]";[.A814])-1);"") -> 
A815: of:=IF(ISBLANK(['BenchBudEE.csv'.A815]);"";['BenchBudEE.csv'.A815]) ->  | B815: of:=IF(ISBLANK(['BenchBudEE.csv'.B815]);"";['BenchBudEE.csv'.B815]) ->  | C815: of:=IF(ISBLANK(['BenchBudEE.csv'.C950]);"";MID(['BenchBudEE.csv'.C950];SEARCH(":";['BenchBudEE.csv'.C950])+1;100)) ->  | D815: of:=IF(ISBLANK(['BenchBudEE.csv'.D815]);"";['BenchBudEE.csv'.D815]) ->  | E815: of:=IF(ISBLANK(['BenchBudEE.csv'.E815]);"";['BenchBudEE.csv'.E815]) ->  | F815: of:=IF(ISBLANK(['BenchBudEE.csv'.F815]);"";['BenchBudEE.csv'.F815]) ->  | G815: of:=IF(ISNUMBER(SEARCH("[0-9]";[.A815]));MID([.A815];1;SEARCH("[0-9]";[.A815])-1);"") -> 
A816: of:=IF(ISBLANK(['BenchBudEE.csv'.A816]);"";['BenchBudEE.csv'.A816]) ->  | B816: of:=IF(ISBLANK(['BenchBudEE.csv'.B816]);"";['BenchBudEE.csv'.B816]) ->  | C816: of:=IF(ISBLANK(['BenchBudEE.csv'.C951]);"";MID(['BenchBudEE.csv'.C951];SEARCH(":";['BenchBudEE.csv'.C951])+1;100)) ->  | D816: of:=IF(ISBLANK(['BenchBudEE.csv'.D816]);"";['BenchBudEE.csv'.D816]) ->  | E816: of:=IF(ISBLANK(['BenchBudEE.csv'.E816]);"";['BenchBudEE.csv'.E816]) ->  | F816: of:=IF(ISBLANK(['BenchBudEE.csv'.F816]);"";['BenchBudEE.csv'.F816]) ->  | G816: of:=IF(ISNUMBER(SEARCH("[0-9]";[.A816]));MID([.A816];1;SEARCH("[0-9]";[.A816])-1);"") -> 
A817: of:=IF(ISBLANK(['BenchBudEE.csv'.A817]);"";['BenchBudEE.csv'.A817]) ->  | B817: of:=IF(ISBLANK(['BenchBudEE.csv'.B817]);"";['BenchBudEE.csv'.B817]) ->  | C817: of:=IF(ISBLANK(['BenchBudEE.csv'.C952]);"";MID(['BenchBudEE.csv'.C952];SEARCH(":";['BenchBudEE.csv'.C952])+1;100)) ->  | D817: of:=IF(ISBLANK(['BenchBudEE.csv'.D817]);"";['BenchBudEE.csv'.D817]) ->  | E817: of:=IF(ISBLANK(['BenchBudEE.csv'.E817]);"";['BenchBudEE.csv'.E817]) ->  | F817: of:=IF(ISBLANK(['BenchBudEE.csv'.F817]);"";['BenchBudEE.csv'.F817]) ->  | G817: of:=IF(ISNUMBER(SEARCH("[0-9]";[.A817]));MID([.A817];1;SEARCH("[0-9]";[.A817])-1);"") -> 
A818: of:=IF(ISBLANK(['BenchBudEE.csv'.A818]);"";['BenchBudEE.csv'.A818]) ->  | B818: of:=IF(ISBLANK(['BenchBudEE.csv'.B818]);"";['BenchBudEE.csv'.B818]) ->  | C818: of:=IF(ISBLANK(['BenchBudEE.csv'.C953]);"";MID(['BenchBudEE.csv'.C953];SEARCH(":";['BenchBudEE.csv'.C953])+1;100)) ->  | D818: of:=IF(ISBLANK(['BenchBudEE.csv'.D818]);"";['BenchBudEE.csv'.D818]) ->  | E818: of:=IF(ISBLANK(['BenchBudEE.csv'.E818]);"";['BenchBudEE.csv'.E818]) ->  | F818: of:=IF(ISBLANK(['BenchBudEE.csv'.F818]);"";['BenchBudEE.csv'.F818]) ->  | G818: of:=IF(ISNUMBER(SEARCH("[0-9]";[.A818]));MID([.A818];1;SEARCH("[0-9]";[.A818])-1);"") -> 
A819: of:=IF(ISBLANK(['BenchBudEE.csv'.A819]);"";['BenchBudEE.csv'.A819]) ->  | B819: of:=IF(ISBLANK(['BenchBudEE.csv'.B819]);"";['BenchBudEE.csv'.B819]) ->  | C819: of:=IF(ISBLANK(['BenchBudEE.csv'.C954]);"";MID(['BenchBudEE.csv'.C954];SEARCH(":";['BenchBudEE.csv'.C954])+1;100)) ->  | D819: of:=IF(ISBLANK(['BenchBudEE.csv'.D819]);"";['BenchBudEE.csv'.D819]) ->  | E819: of:=IF(ISBLANK(['BenchBudEE.csv'.E819]);"";['BenchBudEE.csv'.E819]) ->  | F819: of:=IF(ISBLANK(['BenchBudEE.csv'.F819]);"";['BenchBudEE.csv'.F819]) ->  | G819: of:=IF(ISNUMBER(SEARCH("[0-9]";[.A819]));MID([.A819];1;SEARCH("[0-9]";[.A819])-1);"") -> 
A820: of:=IF(ISBLANK(['BenchBudEE.csv'.A820]);"";['BenchBudEE.csv'.A820]) ->  | B820: of:=IF(ISBLANK(['BenchBudEE.csv'.B820]);"";['BenchBudEE.csv'.B820]) ->  | C820: of:=IF(ISBLANK(['BenchBudEE.csv'.C955]);"";MID(['BenchBudEE.csv'.C955];SEARCH(":";['BenchBudEE.csv'.C955])+1;100)) ->  | D820: of:=IF(ISBLANK(['BenchBudEE.csv'.D820]);"";['BenchBudEE.csv'.D820]) ->  | E820: of:=IF(ISBLANK(['BenchBudEE.csv'.E820]);"";['BenchBudEE.csv'.E820]) ->  | F820: of:=IF(ISBLANK(['BenchBudEE.csv'.F820]);"";['BenchBudEE.csv'.F820]) ->  | G820: of:=IF(ISNUMBER(SEARCH("[0-9]";[.A820]));MID([.A820];1;SEARCH("[0-9]";[.A820])-1);"") -> 
A821: of:=IF(ISBLANK(['BenchBudEE.csv'.A821]);"";['BenchBudEE.csv'.A821]) ->  | B821: of:=IF(ISBLANK(['BenchBudEE.csv'.B821]);"";['BenchBudEE.csv'.B821]) ->  | C821: of:=IF(ISBLANK(['BenchBudEE.csv'.C956]);"";MID(['BenchBudEE.csv'.C956];SEARCH(":";['BenchBudEE.csv'.C956])+1;100)) ->  | D821: of:=IF(ISBLANK(['BenchBudEE.csv'.D821]);"";['BenchBudEE.csv'.D821]) ->  | E821: of:=IF(ISBLANK(['BenchBudEE.csv'.E821]);"";['BenchBudEE.csv'.E821]) ->  | F821: of:=IF(ISBLANK(['BenchBudEE.csv'.F821]);"";['BenchBudEE.csv'.F821]) ->  | G821: of:=IF(ISNUMBER(SEARCH("[0-9]";[.A821]));MID([.A821];1;SEARCH("[0-9]";[.A821])-1);"") -> 
A822: of:=IF(ISBLANK(['BenchBudEE.csv'.A822]);"";['BenchBudEE.csv'.A822]) ->  | B822: of:=IF(ISBLANK(['BenchBudEE.csv'.B822]);"";['BenchBudEE.csv'.B822]) ->  | C822: of:=IF(ISBLANK(['BenchBudEE.csv'.C957]);"";MID(['BenchBudEE.csv'.C957];SEARCH(":";['BenchBudEE.csv'.C957])+1;100)) ->  | D822: of:=IF(ISBLANK(['BenchBudEE.csv'.D822]);"";['BenchBudEE.csv'.D822]) ->  | E822: of:=IF(ISBLANK(['BenchBudEE.csv'.E822]);"";['BenchBudEE.csv'.E822]) ->  | F822: of:=IF(ISBLANK(['BenchBudEE.csv'.F822]);"";['BenchBudEE.csv'.F822]) ->  | G822: of:=IF(ISNUMBER(SEARCH("[0-9]";[.A822]));MID([.A822];1;SEARCH("[0-9]";[.A822])-1);"") -> 
A823: of:=IF(ISBLANK(['BenchBudEE.csv'.A823]);"";['BenchBudEE.csv'.A823]) ->  | B823: of:=IF(ISBLANK(['BenchBudEE.csv'.B823]);"";['BenchBudEE.csv'.B823]) ->  | C823: of:=IF(ISBLANK(['BenchBudEE.csv'.C958]);"";MID(['BenchBudEE.csv'.C958];SEARCH(":";['BenchBudEE.csv'.C958])+1;100)) ->  | D823: of:=IF(ISBLANK(['BenchBudEE.csv'.D823]);"";['BenchBudEE.csv'.D823]) ->  | E823: of:=IF(ISBLANK(['BenchBudEE.csv'.E823]);"";['BenchBudEE.csv'.E823]) ->  | F823: of:=IF(ISBLANK(['BenchBudEE.csv'.F823]);"";['BenchBudEE.csv'.F823]) ->  | G823: of:=IF(ISNUMBER(SEARCH("[0-9]";[.A823]));MID([.A823];1;SEARCH("[0-9]";[.A823])-1);"") -> 
A824: of:=IF(ISBLANK(['BenchBudEE.csv'.A824]);"";['BenchBudEE.csv'.A824]) ->  | B824: of:=IF(ISBLANK(['BenchBudEE.csv'.B824]);"";['BenchBudEE.csv'.B824]) ->  | C824: of:=IF(ISBLANK(['BenchBudEE.csv'.C959]);"";MID(['BenchBudEE.csv'.C959];SEARCH(":";['BenchBudEE.csv'.C959])+1;100)) ->  | D824: of:=IF(ISBLANK(['BenchBudEE.csv'.D824]);"";['BenchBudEE.csv'.D824]) ->  | E824: of:=IF(ISBLANK(['BenchBudEE.csv'.E824]);"";['BenchBudEE.csv'.E824]) ->  | F824: of:=IF(ISBLANK(['BenchBudEE.csv'.F824]);"";['BenchBudEE.csv'.F824]) ->  | G824: of:=IF(ISNUMBER(SEARCH("[0-9]";[.A824]));MID([.A824];1;SEARCH("[0-9]";[.A824])-1);"") -> 
A825: of:=IF(ISBLANK(['BenchBudEE.csv'.A825]);"";['BenchBudEE.csv'.A825]) ->  | B825: of:=IF(ISBLANK(['BenchBudEE.csv'.B825]);"";['BenchBudEE.csv'.B825]) ->  | C825: of:=IF(ISBLANK(['BenchBudEE.csv'.C960]);"";MID(['BenchBudEE.csv'.C960];SEARCH(":";['BenchBudEE.csv'.C960])+1;100)) ->  | D825: of:=IF(ISBLANK(['BenchBudEE.csv'.D825]);"";['BenchBudEE.csv'.D825]) ->  | E825: of:=IF(ISBLANK(['BenchBudEE.csv'.E825]);"";['BenchBudEE.csv'.E825]) ->  | F825: of:=IF(ISBLANK(['BenchBudEE.csv'.F825]);"";['BenchBudEE.csv'.F825]) ->  | G825: of:=IF(ISNUMBER(SEARCH("[0-9]";[.A825]));MID([.A825];1;SEARCH("[0-9]";[.A825])-1);"") -> 
A826: of:=IF(ISBLANK(['BenchBudEE.csv'.A826]);"";['BenchBudEE.csv'.A826]) ->  | B826: of:=IF(ISBLANK(['BenchBudEE.csv'.B826]);"";['BenchBudEE.csv'.B826]) ->  | C826: of:=IF(ISBLANK(['BenchBudEE.csv'.C961]);"";MID(['BenchBudEE.csv'.C961];SEARCH(":";['BenchBudEE.csv'.C961])+1;100)) ->  | D826: of:=IF(ISBLANK(['BenchBudEE.csv'.D826]);"";['BenchBudEE.csv'.D826]) ->  | E826: of:=IF(ISBLANK(['BenchBudEE.csv'.E826]);"";['BenchBudEE.csv'.E826]) ->  | F826: of:=IF(ISBLANK(['BenchBudEE.csv'.F826]);"";['BenchBudEE.csv'.F826]) ->  | G826: of:=IF(ISNUMBER(SEARCH("[0-9]";[.A826]));MID([.A826];1;SEARCH("[0-9]";[.A826])-1);"") -> 
A827: of:=IF(ISBLANK(['BenchBudEE.csv'.A827]);"";['BenchBudEE.csv'.A827]) ->  | B827: of:=IF(ISBLANK(['BenchBudEE.csv'.B827]);"";['BenchBudEE.csv'.B827]) ->  | C827: of:=IF(ISBLANK(['BenchBudEE.csv'.C962]);"";MID(['BenchBudEE.csv'.C962];SEARCH(":";['BenchBudEE.csv'.C962])+1;100)) ->  | D827: of:=IF(ISBLANK(['BenchBudEE.csv'.D827]);"";['BenchBudEE.csv'.D827]) ->  | E827: of:=IF(ISBLANK(['BenchBudEE.csv'.E827]);"";['BenchBudEE.csv'.E827]) ->  | F827: of:=IF(ISBLANK(['BenchBudEE.csv'.F827]);"";['BenchBudEE.csv'.F827]) ->  | G827: of:=IF(ISNUMBER(SEARCH("[0-9]";[.A827]));MID([.A827];1;SEARCH("[0-9]";[.A827])-1);"") -> 
A828: of:=IF(ISBLANK(['BenchBudEE.csv'.A828]);"";['BenchBudEE.csv'.A828]) ->  | B828: of:=IF(ISBLANK(['BenchBudEE.csv'.B828]);"";['BenchBudEE.csv'.B828]) ->  | C828: of:=IF(ISBLANK(['BenchBudEE.csv'.C963]);"";MID(['BenchBudEE.csv'.C963];SEARCH(":";['BenchBudEE.csv'.C963])+1;100)) ->  | D828: of:=IF(ISBLANK(['BenchBudEE.csv'.D828]);"";['BenchBudEE.csv'.D828]) ->  | E828: of:=IF(ISBLANK(['BenchBudEE.csv'.E828]);"";['BenchBudEE.csv'.E828]) ->  | F828: of:=IF(ISBLANK(['BenchBudEE.csv'.F828]);"";['BenchBudEE.csv'.F828]) ->  | G828: of:=IF(ISNUMBER(SEARCH("[0-9]";[.A828]));MID([.A828];1;SEARCH("[0-9]";[.A828])-1);"") -> 
A829: of:=IF(ISBLANK(['BenchBudEE.csv'.A829]);"";['BenchBudEE.csv'.A829]) ->  | B829: of:=IF(ISBLANK(['BenchBudEE.csv'.B829]);"";['BenchBudEE.csv'.B829]) ->  | C829: of:=IF(ISBLANK(['BenchBudEE.csv'.C964]);"";MID(['BenchBudEE.csv'.C964];SEARCH(":";['BenchBudEE.csv'.C964])+1;100)) ->  | D829: of:=IF(ISBLANK(['BenchBudEE.csv'.D829]);"";['BenchBudEE.csv'.D829]) ->  | E829: of:=IF(ISBLANK(['BenchBudEE.csv'.E829]);"";['BenchBudEE.csv'.E829]) ->  | F829: of:=IF(ISBLANK(['BenchBudEE.csv'.F829]);"";['BenchBudEE.csv'.F829]) ->  | G829: of:=IF(ISNUMBER(SEARCH("[0-9]";[.A829]));MID([.A829];1;SEARCH("[0-9]";[.A829])-1);"") -> 
A830: of:=IF(ISBLANK(['BenchBudEE.csv'.A830]);"";['BenchBudEE.csv'.A830]) ->  | B830: of:=IF(ISBLANK(['BenchBudEE.csv'.B830]);"";['BenchBudEE.csv'.B830]) ->  | C830: of:=IF(ISBLANK(['BenchBudEE.csv'.C965]);"";MID(['BenchBudEE.csv'.C965];SEARCH(":";['BenchBudEE.csv'.C965])+1;100)) ->  | D830: of:=IF(ISBLANK(['BenchBudEE.csv'.D830]);"";['BenchBudEE.csv'.D830]) ->  | E830: of:=IF(ISBLANK(['BenchBudEE.csv'.E830]);"";['BenchBudEE.csv'.E830]) ->  | F830: of:=IF(ISBLANK(['BenchBudEE.csv'.F830]);"";['BenchBudEE.csv'.F830]) ->  | G830: of:=IF(ISNUMBER(SEARCH("[0-9]";[.A830]));MID([.A830];1;SEARCH("[0-9]";[.A830])-1);"") -> 
A831: of:=IF(ISBLANK(['BenchBudEE.csv'.A831]);"";['BenchBudEE.csv'.A831]) ->  | B831: of:=IF(ISBLANK(['BenchBudEE.csv'.B831]);"";['BenchBudEE.csv'.B831]) ->  | C831: of:=IF(ISBLANK(['BenchBudEE.csv'.C966]);"";MID(['BenchBudEE.csv'.C966];SEARCH(":";['BenchBudEE.csv'.C966])+1;100)) ->  | D831: of:=IF(ISBLANK(['BenchBudEE.csv'.D831]);"";['BenchBudEE.csv'.D831]) ->  | E831: of:=IF(ISBLANK(['BenchBudEE.csv'.E831]);"";['BenchBudEE.csv'.E831]) ->  | F831: of:=IF(ISBLANK(['BenchBudEE.csv'.F831]);"";['BenchBudEE.csv'.F831]) ->  | G831: of:=IF(ISNUMBER(SEARCH("[0-9]";[.A831]));MID([.A831];1;SEARCH("[0-9]";[.A831])-1);"") -> 
A832: of:=IF(ISBLANK(['BenchBudEE.csv'.A832]);"";['BenchBudEE.csv'.A832]) ->  | B832: of:=IF(ISBLANK(['BenchBudEE.csv'.B832]);"";['BenchBudEE.csv'.B832]) ->  | C832: of:=IF(ISBLANK(['BenchBudEE.csv'.C967]);"";MID(['BenchBudEE.csv'.C967];SEARCH(":";['BenchBudEE.csv'.C967])+1;100)) ->  | D832: of:=IF(ISBLANK(['BenchBudEE.csv'.D832]);"";['BenchBudEE.csv'.D832]) ->  | E832: of:=IF(ISBLANK(['BenchBudEE.csv'.E832]);"";['BenchBudEE.csv'.E832]) ->  | F832: of:=IF(ISBLANK(['BenchBudEE.csv'.F832]);"";['BenchBudEE.csv'.F832]) ->  | G832: of:=IF(ISNUMBER(SEARCH("[0-9]";[.A832]));MID([.A832];1;SEARCH("[0-9]";[.A832])-1);"") -> 
A833: of:=IF(ISBLANK(['BenchBudEE.csv'.A833]);"";['BenchBudEE.csv'.A833]) ->  | B833: of:=IF(ISBLANK(['BenchBudEE.csv'.B833]);"";['BenchBudEE.csv'.B833]) ->  | C833: of:=IF(ISBLANK(['BenchBudEE.csv'.C968]);"";MID(['BenchBudEE.csv'.C968];SEARCH(":";['BenchBudEE.csv'.C968])+1;100)) ->  | D833: of:=IF(ISBLANK(['BenchBudEE.csv'.D833]);"";['BenchBudEE.csv'.D833]) ->  | E833: of:=IF(ISBLANK(['BenchBudEE.csv'.E833]);"";['BenchBudEE.csv'.E833]) ->  | F833: of:=IF(ISBLANK(['BenchBudEE.csv'.F833]);"";['BenchBudEE.csv'.F833]) ->  | G833: of:=IF(ISNUMBER(SEARCH("[0-9]";[.A833]));MID([.A833];1;SEARCH("[0-9]";[.A833])-1);"") -> 
A834: of:=IF(ISBLANK(['BenchBudEE.csv'.A834]);"";['BenchBudEE.csv'.A834]) ->  | B834: of:=IF(ISBLANK(['BenchBudEE.csv'.B834]);"";['BenchBudEE.csv'.B834]) ->  | C834: of:=IF(ISBLANK(['BenchBudEE.csv'.C969]);"";MID(['BenchBudEE.csv'.C969];SEARCH(":";['BenchBudEE.csv'.C969])+1;100)) ->  | D834: of:=IF(ISBLANK(['BenchBudEE.csv'.D834]);"";['BenchBudEE.csv'.D834]) ->  | E834: of:=IF(ISBLANK(['BenchBudEE.csv'.E834]);"";['BenchBudEE.csv'.E834]) ->  | F834: of:=IF(ISBLANK(['BenchBudEE.csv'.F834]);"";['BenchBudEE.csv'.F834]) ->  | G834: of:=IF(ISNUMBER(SEARCH("[0-9]";[.A834]));MID([.A834];1;SEARCH("[0-9]";[.A834])-1);"") -> 
A835: of:=IF(ISBLANK(['BenchBudEE.csv'.A835]);"";['BenchBudEE.csv'.A835]) ->  | B835: of:=IF(ISBLANK(['BenchBudEE.csv'.B835]);"";['BenchBudEE.csv'.B835]) ->  | C835: of:=IF(ISBLANK(['BenchBudEE.csv'.C970]);"";MID(['BenchBudEE.csv'.C970];SEARCH(":";['BenchBudEE.csv'.C970])+1;100)) ->  | D835: of:=IF(ISBLANK(['BenchBudEE.csv'.D835]);"";['BenchBudEE.csv'.D835]) ->  | E835: of:=IF(ISBLANK(['BenchBudEE.csv'.E835]);"";['BenchBudEE.csv'.E835]) ->  | F835: of:=IF(ISBLANK(['BenchBudEE.csv'.F835]);"";['BenchBudEE.csv'.F835]) ->  | G835: of:=IF(ISNUMBER(SEARCH("[0-9]";[.A835]));MID([.A835];1;SEARCH("[0-9]";[.A835])-1);"") -> 
A836: of:=IF(ISBLANK(['BenchBudEE.csv'.A836]);"";['BenchBudEE.csv'.A836]) ->  | B836: of:=IF(ISBLANK(['BenchBudEE.csv'.B836]);"";['BenchBudEE.csv'.B836]) ->  | C836: of:=IF(ISBLANK(['BenchBudEE.csv'.C971]);"";MID(['BenchBudEE.csv'.C971];SEARCH(":";['BenchBudEE.csv'.C971])+1;100)) ->  | D836: of:=IF(ISBLANK(['BenchBudEE.csv'.D836]);"";['BenchBudEE.csv'.D836]) ->  | E836: of:=IF(ISBLANK(['BenchBudEE.csv'.E836]);"";['BenchBudEE.csv'.E836]) ->  | F836: of:=IF(ISBLANK(['BenchBudEE.csv'.F836]);"";['BenchBudEE.csv'.F836]) ->  | G836: of:=IF(ISNUMBER(SEARCH("[0-9]";[.A836]));MID([.A836];1;SEARCH("[0-9]";[.A836])-1);"") -> 
A837: of:=IF(ISBLANK(['BenchBudEE.csv'.A837]);"";['BenchBudEE.csv'.A837]) ->  | B837: of:=IF(ISBLANK(['BenchBudEE.csv'.B837]);"";['BenchBudEE.csv'.B837]) ->  | C837: of:=IF(ISBLANK(['BenchBudEE.csv'.C972]);"";MID(['BenchBudEE.csv'.C972];SEARCH(":";['BenchBudEE.csv'.C972])+1;100)) ->  | D837: of:=IF(ISBLANK(['BenchBudEE.csv'.D837]);"";['BenchBudEE.csv'.D837]) ->  | E837: of:=IF(ISBLANK(['BenchBudEE.csv'.E837]);"";['BenchBudEE.csv'.E837]) ->  | F837: of:=IF(ISBLANK(['BenchBudEE.csv'.F837]);"";['BenchBudEE.csv'.F837]) ->  | G837: of:=IF(ISNUMBER(SEARCH("[0-9]";[.A837]));MID([.A837];1;SEARCH("[0-9]";[.A837])-1);"") -> 
A838: of:=IF(ISBLANK(['BenchBudEE.csv'.A838]);"";['BenchBudEE.csv'.A838]) ->  | B838: of:=IF(ISBLANK(['BenchBudEE.csv'.B838]);"";['BenchBudEE.csv'.B838]) ->  | C838: of:=IF(ISBLANK(['BenchBudEE.csv'.C973]);"";MID(['BenchBudEE.csv'.C973];SEARCH(":";['BenchBudEE.csv'.C973])+1;100)) ->  | D838: of:=IF(ISBLANK(['BenchBudEE.csv'.D838]);"";['BenchBudEE.csv'.D838]) ->  | E838: of:=IF(ISBLANK(['BenchBudEE.csv'.E838]);"";['BenchBudEE.csv'.E838]) ->  | F838: of:=IF(ISBLANK(['BenchBudEE.csv'.F838]);"";['BenchBudEE.csv'.F838]) ->  | G838: of:=IF(ISNUMBER(SEARCH("[0-9]";[.A838]));MID([.A838];1;SEARCH("[0-9]";[.A838])-1);"") -> 
A839: of:=IF(ISBLANK(['BenchBudEE.csv'.A839]);"";['BenchBudEE.csv'.A839]) ->  | B839: of:=IF(ISBLANK(['BenchBudEE.csv'.B839]);"";['BenchBudEE.csv'.B839]) ->  | C839: of:=IF(ISBLANK(['BenchBudEE.csv'.C974]);"";MID(['BenchBudEE.csv'.C974];SEARCH(":";['BenchBudEE.csv'.C974])+1;100)) ->  | D839: of:=IF(ISBLANK(['BenchBudEE.csv'.D839]);"";['BenchBudEE.csv'.D839]) ->  | E839: of:=IF(ISBLANK(['BenchBudEE.csv'.E839]);"";['BenchBudEE.csv'.E839]) ->  | F839: of:=IF(ISBLANK(['BenchBudEE.csv'.F839]);"";['BenchBudEE.csv'.F839]) ->  | G839: of:=IF(ISNUMBER(SEARCH("[0-9]";[.A839]));MID([.A839];1;SEARCH("[0-9]";[.A839])-1);"") -> 
A840: of:=IF(ISBLANK(['BenchBudEE.csv'.A840]);"";['BenchBudEE.csv'.A840]) ->  | B840: of:=IF(ISBLANK(['BenchBudEE.csv'.B840]);"";['BenchBudEE.csv'.B840]) ->  | C840: of:=IF(ISBLANK(['BenchBudEE.csv'.C975]);"";MID(['BenchBudEE.csv'.C975];SEARCH(":";['BenchBudEE.csv'.C975])+1;100)) ->  | D840: of:=IF(ISBLANK(['BenchBudEE.csv'.D840]);"";['BenchBudEE.csv'.D840]) ->  | E840: of:=IF(ISBLANK(['BenchBudEE.csv'.E840]);"";['BenchBudEE.csv'.E840]) ->  | F840: of:=IF(ISBLANK(['BenchBudEE.csv'.F840]);"";['BenchBudEE.csv'.F840]) ->  | G840: of:=IF(ISNUMBER(SEARCH("[0-9]";[.A840]));MID([.A840];1;SEARCH("[0-9]";[.A840])-1);"") -> 
A841: of:=IF(ISBLANK(['BenchBudEE.csv'.A841]);"";['BenchBudEE.csv'.A841]) ->  | B841: of:=IF(ISBLANK(['BenchBudEE.csv'.B841]);"";['BenchBudEE.csv'.B841]) ->  | C841: of:=IF(ISBLANK(['BenchBudEE.csv'.C976]);"";MID(['BenchBudEE.csv'.C976];SEARCH(":";['BenchBudEE.csv'.C976])+1;100)) ->  | D841: of:=IF(ISBLANK(['BenchBudEE.csv'.D841]);"";['BenchBudEE.csv'.D841]) ->  | E841: of:=IF(ISBLANK(['BenchBudEE.csv'.E841]);"";['BenchBudEE.csv'.E841]) ->  | F841: of:=IF(ISBLANK(['BenchBudEE.csv'.F841]);"";['BenchBudEE.csv'.F841]) ->  | G841: of:=IF(ISNUMBER(SEARCH("[0-9]";[.A841]));MID([.A841];1;SEARCH("[0-9]";[.A841])-1);"") -> 
A842: of:=IF(ISBLANK(['BenchBudEE.csv'.A842]);"";['BenchBudEE.csv'.A842]) ->  | B842: of:=IF(ISBLANK(['BenchBudEE.csv'.B842]);"";['BenchBudEE.csv'.B842]) ->  | C842: of:=IF(ISBLANK(['BenchBudEE.csv'.C977]);"";MID(['BenchBudEE.csv'.C977];SEARCH(":";['BenchBudEE.csv'.C977])+1;100)) ->  | D842: of:=IF(ISBLANK(['BenchBudEE.csv'.D842]);"";['BenchBudEE.csv'.D842]) ->  | E842: of:=IF(ISBLANK(['BenchBudEE.csv'.E842]);"";['BenchBudEE.csv'.E842]) ->  | F842: of:=IF(ISBLANK(['BenchBudEE.csv'.F842]);"";['BenchBudEE.csv'.F842]) ->  | G842: of:=IF(ISNUMBER(SEARCH("[0-9]";[.A842]));MID([.A842];1;SEARCH("[0-9]";[.A842])-1);"") -> 
A843: of:=IF(ISBLANK(['BenchBudEE.csv'.A843]);"";['BenchBudEE.csv'.A843]) ->  | B843: of:=IF(ISBLANK(['BenchBudEE.csv'.B843]);"";['BenchBudEE.csv'.B843]) ->  | C843: of:=IF(ISBLANK(['BenchBudEE.csv'.C978]);"";MID(['BenchBudEE.csv'.C978];SEARCH(":";['BenchBudEE.csv'.C978])+1;100)) ->  | D843: of:=IF(ISBLANK(['BenchBudEE.csv'.D843]);"";['BenchBudEE.csv'.D843]) ->  | E843: of:=IF(ISBLANK(['BenchBudEE.csv'.E843]);"";['BenchBudEE.csv'.E843]) ->  | F843: of:=IF(ISBLANK(['BenchBudEE.csv'.F843]);"";['BenchBudEE.csv'.F843]) ->  | G843: of:=IF(ISNUMBER(SEARCH("[0-9]";[.A843]));MID([.A843];1;SEARCH("[0-9]";[.A843])-1);"") -> 
A844: of:=IF(ISBLANK(['BenchBudEE.csv'.A844]);"";['BenchBudEE.csv'.A844]) ->  | B844: of:=IF(ISBLANK(['BenchBudEE.csv'.B844]);"";['BenchBudEE.csv'.B844]) ->  | C844: of:=IF(ISBLANK(['BenchBudEE.csv'.C979]);"";MID(['BenchBudEE.csv'.C979];SEARCH(":";['BenchBudEE.csv'.C979])+1;100)) ->  | D844: of:=IF(ISBLANK(['BenchBudEE.csv'.D844]);"";['BenchBudEE.csv'.D844]) ->  | E844: of:=IF(ISBLANK(['BenchBudEE.csv'.E844]);"";['BenchBudEE.csv'.E844]) ->  | F844: of:=IF(ISBLANK(['BenchBudEE.csv'.F844]);"";['BenchBudEE.csv'.F844]) ->  | G844: of:=IF(ISNUMBER(SEARCH("[0-9]";[.A844]));MID([.A844];1;SEARCH("[0-9]";[.A844])-1);"") -> 
A845: of:=IF(ISBLANK(['BenchBudEE.csv'.A845]);"";['BenchBudEE.csv'.A845]) ->  | B845: of:=IF(ISBLANK(['BenchBudEE.csv'.B845]);"";['BenchBudEE.csv'.B845]) ->  | C845: of:=IF(ISBLANK(['BenchBudEE.csv'.C980]);"";MID(['BenchBudEE.csv'.C980];SEARCH(":";['BenchBudEE.csv'.C980])+1;100)) ->  | D845: of:=IF(ISBLANK(['BenchBudEE.csv'.D845]);"";['BenchBudEE.csv'.D845]) ->  | E845: of:=IF(ISBLANK(['BenchBudEE.csv'.E845]);"";['BenchBudEE.csv'.E845]) ->  | F845: of:=IF(ISBLANK(['BenchBudEE.csv'.F845]);"";['BenchBudEE.csv'.F845]) ->  | G845: of:=IF(ISNUMBER(SEARCH("[0-9]";[.A845]));MID([.A845];1;SEARCH("[0-9]";[.A845])-1);"") -> 
A846: of:=IF(ISBLANK(['BenchBudEE.csv'.A846]);"";['BenchBudEE.csv'.A846]) ->  | B846: of:=IF(ISBLANK(['BenchBudEE.csv'.B846]);"";['BenchBudEE.csv'.B846]) ->  | C846: of:=IF(ISBLANK(['BenchBudEE.csv'.C981]);"";MID(['BenchBudEE.csv'.C981];SEARCH(":";['BenchBudEE.csv'.C981])+1;100)) ->  | D846: of:=IF(ISBLANK(['BenchBudEE.csv'.D846]);"";['BenchBudEE.csv'.D846]) ->  | E846: of:=IF(ISBLANK(['BenchBudEE.csv'.E846]);"";['BenchBudEE.csv'.E846]) ->  | F846: of:=IF(ISBLANK(['BenchBudEE.csv'.F846]);"";['BenchBudEE.csv'.F846]) ->  | G846: of:=IF(ISNUMBER(SEARCH("[0-9]";[.A846]));MID([.A846];1;SEARCH("[0-9]";[.A846])-1);"") -> 
A847: of:=IF(ISBLANK(['BenchBudEE.csv'.A847]);"";['BenchBudEE.csv'.A847]) ->  | B847: of:=IF(ISBLANK(['BenchBudEE.csv'.B847]);"";['BenchBudEE.csv'.B847]) ->  | C847: of:=IF(ISBLANK(['BenchBudEE.csv'.C982]);"";MID(['BenchBudEE.csv'.C982];SEARCH(":";['BenchBudEE.csv'.C982])+1;100)) ->  | D847: of:=IF(ISBLANK(['BenchBudEE.csv'.D847]);"";['BenchBudEE.csv'.D847]) ->  | E847: of:=IF(ISBLANK(['BenchBudEE.csv'.E847]);"";['BenchBudEE.csv'.E847]) ->  | F847: of:=IF(ISBLANK(['BenchBudEE.csv'.F847]);"";['BenchBudEE.csv'.F847]) ->  | G847: of:=IF(ISNUMBER(SEARCH("[0-9]";[.A847]));MID([.A847];1;SEARCH("[0-9]";[.A847])-1);"") -> 
A848: of:=IF(ISBLANK(['BenchBudEE.csv'.A848]);"";['BenchBudEE.csv'.A848]) ->  | B848: of:=IF(ISBLANK(['BenchBudEE.csv'.B848]);"";['BenchBudEE.csv'.B848]) ->  | C848: of:=IF(ISBLANK(['BenchBudEE.csv'.C983]);"";MID(['BenchBudEE.csv'.C983];SEARCH(":";['BenchBudEE.csv'.C983])+1;100)) ->  | D848: of:=IF(ISBLANK(['BenchBudEE.csv'.D848]);"";['BenchBudEE.csv'.D848]) ->  | E848: of:=IF(ISBLANK(['BenchBudEE.csv'.E848]);"";['BenchBudEE.csv'.E848]) ->  | F848: of:=IF(ISBLANK(['BenchBudEE.csv'.F848]);"";['BenchBudEE.csv'.F848]) ->  | G848: of:=IF(ISNUMBER(SEARCH("[0-9]";[.A848]));MID([.A848];1;SEARCH("[0-9]";[.A848])-1);"") -> 
A849: of:=IF(ISBLANK(['BenchBudEE.csv'.A849]);"";['BenchBudEE.csv'.A849]) ->  | B849: of:=IF(ISBLANK(['BenchBudEE.csv'.B849]);"";['BenchBudEE.csv'.B849]) ->  | C849: of:=IF(ISBLANK(['BenchBudEE.csv'.C984]);"";MID(['BenchBudEE.csv'.C984];SEARCH(":";['BenchBudEE.csv'.C984])+1;100)) ->  | D849: of:=IF(ISBLANK(['BenchBudEE.csv'.D849]);"";['BenchBudEE.csv'.D849]) ->  | E849: of:=IF(ISBLANK(['BenchBudEE.csv'.E849]);"";['BenchBudEE.csv'.E849]) ->  | F849: of:=IF(ISBLANK(['BenchBudEE.csv'.F849]);"";['BenchBudEE.csv'.F849]) ->  | G849: of:=IF(ISNUMBER(SEARCH("[0-9]";[.A849]));MID([.A849];1;SEARCH("[0-9]";[.A849])-1);"") -> 
A850: of:=IF(ISBLANK(['BenchBudEE.csv'.A850]);"";['BenchBudEE.csv'.A850]) ->  | B850: of:=IF(ISBLANK(['BenchBudEE.csv'.B850]);"";['BenchBudEE.csv'.B850]) ->  | C850: of:=IF(ISBLANK(['BenchBudEE.csv'.C985]);"";MID(['BenchBudEE.csv'.C985];SEARCH(":";['BenchBudEE.csv'.C985])+1;100)) ->  | D850: of:=IF(ISBLANK(['BenchBudEE.csv'.D850]);"";['BenchBudEE.csv'.D850]) ->  | E850: of:=IF(ISBLANK(['BenchBudEE.csv'.E850]);"";['BenchBudEE.csv'.E850]) ->  | F850: of:=IF(ISBLANK(['BenchBudEE.csv'.F850]);"";['BenchBudEE.csv'.F850]) ->  | G850: of:=IF(ISNUMBER(SEARCH("[0-9]";[.A850]));MID([.A850];1;SEARCH("[0-9]";[.A850])-1);"") -> 
A851: of:=IF(ISBLANK(['BenchBudEE.csv'.A851]);"";['BenchBudEE.csv'.A851]) ->  | B851: of:=IF(ISBLANK(['BenchBudEE.csv'.B851]);"";['BenchBudEE.csv'.B851]) ->  | C851: of:=IF(ISBLANK(['BenchBudEE.csv'.C986]);"";MID(['BenchBudEE.csv'.C986];SEARCH(":";['BenchBudEE.csv'.C986])+1;100)) ->  | D851: of:=IF(ISBLANK(['BenchBudEE.csv'.D851]);"";['BenchBudEE.csv'.D851]) ->  | E851: of:=IF(ISBLANK(['BenchBudEE.csv'.E851]);"";['BenchBudEE.csv'.E851]) ->  | F851: of:=IF(ISBLANK(['BenchBudEE.csv'.F851]);"";['BenchBudEE.csv'.F851]) ->  | G851: of:=IF(ISNUMBER(SEARCH("[0-9]";[.A851]));MID([.A851];1;SEARCH("[0-9]";[.A851])-1);"") -> 
A852: of:=IF(ISBLANK(['BenchBudEE.csv'.A852]);"";['BenchBudEE.csv'.A852]) ->  | B852: of:=IF(ISBLANK(['BenchBudEE.csv'.B852]);"";['BenchBudEE.csv'.B852]) ->  | C852: of:=IF(ISBLANK(['BenchBudEE.csv'.C987]);"";MID(['BenchBudEE.csv'.C987];SEARCH(":";['BenchBudEE.csv'.C987])+1;100)) ->  | D852: of:=IF(ISBLANK(['BenchBudEE.csv'.D852]);"";['BenchBudEE.csv'.D852]) ->  | E852: of:=IF(ISBLANK(['BenchBudEE.csv'.E852]);"";['BenchBudEE.csv'.E852]) ->  | F852: of:=IF(ISBLANK(['BenchBudEE.csv'.F852]);"";['BenchBudEE.csv'.F852]) ->  | G852: of:=IF(ISNUMBER(SEARCH("[0-9]";[.A852]));MID([.A852];1;SEARCH("[0-9]";[.A852])-1);"") -> 
A853: of:=IF(ISBLANK(['BenchBudEE.csv'.A853]);"";['BenchBudEE.csv'.A853]) ->  | B853: of:=IF(ISBLANK(['BenchBudEE.csv'.B853]);"";['BenchBudEE.csv'.B853]) ->  | C853: of:=IF(ISBLANK(['BenchBudEE.csv'.C988]);"";MID(['BenchBudEE.csv'.C988];SEARCH(":";['BenchBudEE.csv'.C988])+1;100)) ->  | D853: of:=IF(ISBLANK(['BenchBudEE.csv'.D853]);"";['BenchBudEE.csv'.D853]) ->  | E853: of:=IF(ISBLANK(['BenchBudEE.csv'.E853]);"";['BenchBudEE.csv'.E853]) ->  | F853: of:=IF(ISBLANK(['BenchBudEE.csv'.F853]);"";['BenchBudEE.csv'.F853]) ->  | G853: of:=IF(ISNUMBER(SEARCH("[0-9]";[.A853]));MID([.A853];1;SEARCH("[0-9]";[.A853])-1);"") -> 
A854: of:=IF(ISBLANK(['BenchBudEE.csv'.A854]);"";['BenchBudEE.csv'.A854]) ->  | B854: of:=IF(ISBLANK(['BenchBudEE.csv'.B854]);"";['BenchBudEE.csv'.B854]) ->  | C854: of:=IF(ISBLANK(['BenchBudEE.csv'.C989]);"";MID(['BenchBudEE.csv'.C989];SEARCH(":";['BenchBudEE.csv'.C989])+1;100)) ->  | D854: of:=IF(ISBLANK(['BenchBudEE.csv'.D854]);"";['BenchBudEE.csv'.D854]) ->  | E854: of:=IF(ISBLANK(['BenchBudEE.csv'.E854]);"";['BenchBudEE.csv'.E854]) ->  | F854: of:=IF(ISBLANK(['BenchBudEE.csv'.F854]);"";['BenchBudEE.csv'.F854]) ->  | G854: of:=IF(ISNUMBER(SEARCH("[0-9]";[.A854]));MID([.A854];1;SEARCH("[0-9]";[.A854])-1);"") -> 
A855: of:=IF(ISBLANK(['BenchBudEE.csv'.A855]);"";['BenchBudEE.csv'.A855]) ->  | B855: of:=IF(ISBLANK(['BenchBudEE.csv'.B855]);"";['BenchBudEE.csv'.B855]) ->  | C855: of:=IF(ISBLANK(['BenchBudEE.csv'.C990]);"";MID(['BenchBudEE.csv'.C990];SEARCH(":";['BenchBudEE.csv'.C990])+1;100)) ->  | D855: of:=IF(ISBLANK(['BenchBudEE.csv'.D855]);"";['BenchBudEE.csv'.D855]) ->  | E855: of:=IF(ISBLANK(['BenchBudEE.csv'.E855]);"";['BenchBudEE.csv'.E855]) ->  | F855: of:=IF(ISBLANK(['BenchBudEE.csv'.F855]);"";['BenchBudEE.csv'.F855]) ->  | G855: of:=IF(ISNUMBER(SEARCH("[0-9]";[.A855]));MID([.A855];1;SEARCH("[0-9]";[.A855])-1);"") -> 
A856: of:=IF(ISBLANK(['BenchBudEE.csv'.A856]);"";['BenchBudEE.csv'.A856]) ->  | B856: of:=IF(ISBLANK(['BenchBudEE.csv'.B856]);"";['BenchBudEE.csv'.B856]) ->  | C856: of:=IF(ISBLANK(['BenchBudEE.csv'.C991]);"";MID(['BenchBudEE.csv'.C991];SEARCH(":";['BenchBudEE.csv'.C991])+1;100)) ->  | D856: of:=IF(ISBLANK(['BenchBudEE.csv'.D856]);"";['BenchBudEE.csv'.D856]) ->  | E856: of:=IF(ISBLANK(['BenchBudEE.csv'.E856]);"";['BenchBudEE.csv'.E856]) ->  | F856: of:=IF(ISBLANK(['BenchBudEE.csv'.F856]);"";['BenchBudEE.csv'.F856]) ->  | G856: of:=IF(ISNUMBER(SEARCH("[0-9]";[.A856]));MID([.A856];1;SEARCH("[0-9]";[.A856])-1);"") -> 
A857: of:=IF(ISBLANK(['BenchBudEE.csv'.A857]);"";['BenchBudEE.csv'.A857]) ->  | B857: of:=IF(ISBLANK(['BenchBudEE.csv'.B857]);"";['BenchBudEE.csv'.B857]) ->  | C857: of:=IF(ISBLANK(['BenchBudEE.csv'.C992]);"";MID(['BenchBudEE.csv'.C992];SEARCH(":";['BenchBudEE.csv'.C992])+1;100)) ->  | D857: of:=IF(ISBLANK(['BenchBudEE.csv'.D857]);"";['BenchBudEE.csv'.D857]) ->  | E857: of:=IF(ISBLANK(['BenchBudEE.csv'.E857]);"";['BenchBudEE.csv'.E857]) ->  | F857: of:=IF(ISBLANK(['BenchBudEE.csv'.F857]);"";['BenchBudEE.csv'.F857]) ->  | G857: of:=IF(ISNUMBER(SEARCH("[0-9]";[.A857]));MID([.A857];1;SEARCH("[0-9]";[.A857])-1);"") -> 
A858: of:=IF(ISBLANK(['BenchBudEE.csv'.A858]);"";['BenchBudEE.csv'.A858]) ->  | B858: of:=IF(ISBLANK(['BenchBudEE.csv'.B858]);"";['BenchBudEE.csv'.B858]) ->  | C858: of:=IF(ISBLANK(['BenchBudEE.csv'.C993]);"";MID(['BenchBudEE.csv'.C993];SEARCH(":";['BenchBudEE.csv'.C993])+1;100)) ->  | D858: of:=IF(ISBLANK(['BenchBudEE.csv'.D858]);"";['BenchBudEE.csv'.D858]) ->  | E858: of:=IF(ISBLANK(['BenchBudEE.csv'.E858]);"";['BenchBudEE.csv'.E858]) ->  | F858: of:=IF(ISBLANK(['BenchBudEE.csv'.F858]);"";['BenchBudEE.csv'.F858]) ->  | G858: of:=IF(ISNUMBER(SEARCH("[0-9]";[.A858]));MID([.A858];1;SEARCH("[0-9]";[.A858])-1);"") -> 
A859: of:=IF(ISBLANK(['BenchBudEE.csv'.A859]);"";['BenchBudEE.csv'.A859]) ->  | B859: of:=IF(ISBLANK(['BenchBudEE.csv'.B859]);"";['BenchBudEE.csv'.B859]) ->  | C859: of:=IF(ISBLANK(['BenchBudEE.csv'.C994]);"";MID(['BenchBudEE.csv'.C994];SEARCH(":";['BenchBudEE.csv'.C994])+1;100)) ->  | D859: of:=IF(ISBLANK(['BenchBudEE.csv'.D859]);"";['BenchBudEE.csv'.D859]) ->  | E859: of:=IF(ISBLANK(['BenchBudEE.csv'.E859]);"";['BenchBudEE.csv'.E859]) ->  | F859: of:=IF(ISBLANK(['BenchBudEE.csv'.F859]);"";['BenchBudEE.csv'.F859]) ->  | G859: of:=IF(ISNUMBER(SEARCH("[0-9]";[.A859]));MID([.A859];1;SEARCH("[0-9]";[.A859])-1);"") -> 
A860: of:=IF(ISBLANK(['BenchBudEE.csv'.A860]);"";['BenchBudEE.csv'.A860]) ->  | B860: of:=IF(ISBLANK(['BenchBudEE.csv'.B860]);"";['BenchBudEE.csv'.B860]) ->  | C860: of:=IF(ISBLANK(['BenchBudEE.csv'.C995]);"";MID(['BenchBudEE.csv'.C995];SEARCH(":";['BenchBudEE.csv'.C995])+1;100)) ->  | D860: of:=IF(ISBLANK(['BenchBudEE.csv'.D860]);"";['BenchBudEE.csv'.D860]) ->  | E860: of:=IF(ISBLANK(['BenchBudEE.csv'.E860]);"";['BenchBudEE.csv'.E860]) ->  | F860: of:=IF(ISBLANK(['BenchBudEE.csv'.F860]);"";['BenchBudEE.csv'.F860]) ->  | G860: of:=IF(ISNUMBER(SEARCH("[0-9]";[.A860]));MID([.A860];1;SEARCH("[0-9]";[.A860])-1);"") -> 
A861: of:=IF(ISBLANK(['BenchBudEE.csv'.A861]);"";['BenchBudEE.csv'.A861]) ->  | B861: of:=IF(ISBLANK(['BenchBudEE.csv'.B861]);"";['BenchBudEE.csv'.B861]) ->  | C861: of:=IF(ISBLANK(['BenchBudEE.csv'.C996]);"";MID(['BenchBudEE.csv'.C996];SEARCH(":";['BenchBudEE.csv'.C996])+1;100)) ->  | D861: of:=IF(ISBLANK(['BenchBudEE.csv'.D861]);"";['BenchBudEE.csv'.D861]) ->  | E861: of:=IF(ISBLANK(['BenchBudEE.csv'.E861]);"";['BenchBudEE.csv'.E861]) ->  | F861: of:=IF(ISBLANK(['BenchBudEE.csv'.F861]);"";['BenchBudEE.csv'.F861]) ->  | G861: of:=IF(ISNUMBER(SEARCH("[0-9]";[.A861]));MID([.A861];1;SEARCH("[0-9]";[.A861])-1);"") -> 
A862: of:=IF(ISBLANK(['BenchBudEE.csv'.A862]);"";['BenchBudEE.csv'.A862]) ->  | B862: of:=IF(ISBLANK(['BenchBudEE.csv'.B862]);"";['BenchBudEE.csv'.B862]) ->  | C862: of:=IF(ISBLANK(['BenchBudEE.csv'.C997]);"";MID(['BenchBudEE.csv'.C997];SEARCH(":";['BenchBudEE.csv'.C997])+1;100)) ->  | D862: of:=IF(ISBLANK(['BenchBudEE.csv'.D862]);"";['BenchBudEE.csv'.D862]) ->  | E862: of:=IF(ISBLANK(['BenchBudEE.csv'.E862]);"";['BenchBudEE.csv'.E862]) ->  | F862: of:=IF(ISBLANK(['BenchBudEE.csv'.F862]);"";['BenchBudEE.csv'.F862]) ->  | G862: of:=IF(ISNUMBER(SEARCH("[0-9]";[.A862]));MID([.A862];1;SEARCH("[0-9]";[.A862])-1);"") -> 
A863: of:=IF(ISBLANK(['BenchBudEE.csv'.A863]);"";['BenchBudEE.csv'.A863]) ->  | B863: of:=IF(ISBLANK(['BenchBudEE.csv'.B863]);"";['BenchBudEE.csv'.B863]) ->  | C863: of:=IF(ISBLANK(['BenchBudEE.csv'.C998]);"";MID(['BenchBudEE.csv'.C998];SEARCH(":";['BenchBudEE.csv'.C998])+1;100)) ->  | D863: of:=IF(ISBLANK(['BenchBudEE.csv'.D863]);"";['BenchBudEE.csv'.D863]) ->  | E863: of:=IF(ISBLANK(['BenchBudEE.csv'.E863]);"";['BenchBudEE.csv'.E863]) ->  | F863: of:=IF(ISBLANK(['BenchBudEE.csv'.F863]);"";['BenchBudEE.csv'.F863]) ->  | G863: of:=IF(ISNUMBER(SEARCH("[0-9]";[.A863]));MID([.A863];1;SEARCH("[0-9]";[.A863])-1);"") -> 
A864: of:=IF(ISBLANK(['BenchBudEE.csv'.A864]);"";['BenchBudEE.csv'.A864]) ->  | B864: of:=IF(ISBLANK(['BenchBudEE.csv'.B864]);"";['BenchBudEE.csv'.B864]) ->  | C864: of:=IF(ISBLANK(['BenchBudEE.csv'.C999]);"";MID(['BenchBudEE.csv'.C999];SEARCH(":";['BenchBudEE.csv'.C999])+1;100)) ->  | D864: of:=IF(ISBLANK(['BenchBudEE.csv'.D864]);"";['BenchBudEE.csv'.D864]) ->  | E864: of:=IF(ISBLANK(['BenchBudEE.csv'.E864]);"";['BenchBudEE.csv'.E864]) ->  | F864: of:=IF(ISBLANK(['BenchBudEE.csv'.F864]);"";['BenchBudEE.csv'.F864]) ->  | G864: of:=IF(ISNUMBER(SEARCH("[0-9]";[.A864]));MID([.A864];1;SEARCH("[0-9]";[.A864])-1);"") -> 
A865: of:=IF(ISBLANK(['BenchBudEE.csv'.A865]);"";['BenchBudEE.csv'.A865]) ->  | B865: of:=IF(ISBLANK(['BenchBudEE.csv'.B865]);"";['BenchBudEE.csv'.B865]) ->  | C865: of:=IF(ISBLANK(['BenchBudEE.csv'.C1000]);"";MID(['BenchBudEE.csv'.C1000];SEARCH(":";['BenchBudEE.csv'.C1000])+1;100)) ->  | D865: of:=IF(ISBLANK(['BenchBudEE.csv'.D865]);"";['BenchBudEE.csv'.D865]) ->  | E865: of:=IF(ISBLANK(['BenchBudEE.csv'.E865]);"";['BenchBudEE.csv'.E865]) ->  | F865: of:=IF(ISBLANK(['BenchBudEE.csv'.F865]);"";['BenchBudEE.csv'.F865]) ->  | G865: of:=IF(ISNUMBER(SEARCH("[0-9]";[.A865]));MID([.A865];1;SEARCH("[0-9]";[.A865])-1);"") -> 
A866: of:=IF(ISBLANK(['BenchBudEE.csv'.A866]);"";['BenchBudEE.csv'.A866]) ->  | B866: of:=IF(ISBLANK(['BenchBudEE.csv'.B866]);"";['BenchBudEE.csv'.B866]) ->  | C866: of:=IF(ISBLANK(['BenchBudEE.csv'.C1001]);"";MID(['BenchBudEE.csv'.C1001];SEARCH(":";['BenchBudEE.csv'.C1001])+1;100)) ->  | D866: of:=IF(ISBLANK(['BenchBudEE.csv'.D866]);"";['BenchBudEE.csv'.D866]) ->  | E866: of:=IF(ISBLANK(['BenchBudEE.csv'.E866]);"";['BenchBudEE.csv'.E866]) ->  | F866: of:=IF(ISBLANK(['BenchBudEE.csv'.F866]);"";['BenchBudEE.csv'.F866]) ->  | G866: of:=IF(ISNUMBER(SEARCH("[0-9]";[.A866]));MID([.A866];1;SEARCH("[0-9]";[.A866])-1);"") -> 
A867: of:=IF(ISBLANK(['BenchBudEE.csv'.A867]);"";['BenchBudEE.csv'.A867]) ->  | B867: of:=IF(ISBLANK(['BenchBudEE.csv'.B867]);"";['BenchBudEE.csv'.B867]) ->  | C867: of:=IF(ISBLANK(['BenchBudEE.csv'.C1002]);"";MID(['BenchBudEE.csv'.C1002];SEARCH(":";['BenchBudEE.csv'.C1002])+1;100)) ->  | D867: of:=IF(ISBLANK(['BenchBudEE.csv'.D867]);"";['BenchBudEE.csv'.D867]) ->  | E867: of:=IF(ISBLANK(['BenchBudEE.csv'.E867]);"";['BenchBudEE.csv'.E867]) ->  | F867: of:=IF(ISBLANK(['BenchBudEE.csv'.F867]);"";['BenchBudEE.csv'.F867]) ->  | G867: of:=IF(ISNUMBER(SEARCH("[0-9]";[.A867]));MID([.A867];1;SEARCH("[0-9]";[.A867])-1);"") -> 
A868: of:=IF(ISBLANK(['BenchBudEE.csv'.A868]);"";['BenchBudEE.csv'.A868]) ->  | B868: of:=IF(ISBLANK(['BenchBudEE.csv'.B868]);"";['BenchBudEE.csv'.B868]) ->  | C868: of:=IF(ISBLANK(['BenchBudEE.csv'.C1003]);"";MID(['BenchBudEE.csv'.C1003];SEARCH(":";['BenchBudEE.csv'.C1003])+1;100)) ->  | D868: of:=IF(ISBLANK(['BenchBudEE.csv'.D868]);"";['BenchBudEE.csv'.D868]) ->  | E868: of:=IF(ISBLANK(['BenchBudEE.csv'.E868]);"";['BenchBudEE.csv'.E868]) ->  | F868: of:=IF(ISBLANK(['BenchBudEE.csv'.F868]);"";['BenchBudEE.csv'.F868]) ->  | G868: of:=IF(ISNUMBER(SEARCH("[0-9]";[.A868]));MID([.A868];1;SEARCH("[0-9]";[.A868])-1);"") -> 
A869: of:=IF(ISBLANK(['BenchBudEE.csv'.A869]);"";['BenchBudEE.csv'.A869]) ->  | B869: of:=IF(ISBLANK(['BenchBudEE.csv'.B869]);"";['BenchBudEE.csv'.B869]) ->  | C869: of:=IF(ISBLANK(['BenchBudEE.csv'.C1004]);"";MID(['BenchBudEE.csv'.C1004];SEARCH(":";['BenchBudEE.csv'.C1004])+1;100)) ->  | D869: of:=IF(ISBLANK(['BenchBudEE.csv'.D869]);"";['BenchBudEE.csv'.D869]) ->  | E869: of:=IF(ISBLANK(['BenchBudEE.csv'.E869]);"";['BenchBudEE.csv'.E869]) ->  | F869: of:=IF(ISBLANK(['BenchBudEE.csv'.F869]);"";['BenchBudEE.csv'.F869]) ->  | G869: of:=IF(ISNUMBER(SEARCH("[0-9]";[.A869]));MID([.A869];1;SEARCH("[0-9]";[.A869])-1);"") -> 
A870: of:=IF(ISBLANK(['BenchBudEE.csv'.A870]);"";['BenchBudEE.csv'.A870]) ->  | B870: of:=IF(ISBLANK(['BenchBudEE.csv'.B870]);"";['BenchBudEE.csv'.B870]) ->  | C870: of:=IF(ISBLANK(['BenchBudEE.csv'.C1005]);"";MID(['BenchBudEE.csv'.C1005];SEARCH(":";['BenchBudEE.csv'.C1005])+1;100)) ->  | D870: of:=IF(ISBLANK(['BenchBudEE.csv'.D870]);"";['BenchBudEE.csv'.D870]) ->  | E870: of:=IF(ISBLANK(['BenchBudEE.csv'.E870]);"";['BenchBudEE.csv'.E870]) ->  | F870: of:=IF(ISBLANK(['BenchBudEE.csv'.F870]);"";['BenchBudEE.csv'.F870]) ->  | G870: of:=IF(ISNUMBER(SEARCH("[0-9]";[.A870]));MID([.A870];1;SEARCH("[0-9]";[.A870])-1);"") -> 
A871: of:=IF(ISBLANK(['BenchBudEE.csv'.A871]);"";['BenchBudEE.csv'.A871]) ->  | B871: of:=IF(ISBLANK(['BenchBudEE.csv'.B871]);"";['BenchBudEE.csv'.B871]) ->  | C871: of:=IF(ISBLANK(['BenchBudEE.csv'.C1006]);"";MID(['BenchBudEE.csv'.C1006];SEARCH(":";['BenchBudEE.csv'.C1006])+1;100)) ->  | D871: of:=IF(ISBLANK(['BenchBudEE.csv'.D871]);"";['BenchBudEE.csv'.D871]) ->  | E871: of:=IF(ISBLANK(['BenchBudEE.csv'.E871]);"";['BenchBudEE.csv'.E871]) ->  | F871: of:=IF(ISBLANK(['BenchBudEE.csv'.F871]);"";['BenchBudEE.csv'.F871]) ->  | G871: of:=IF(ISNUMBER(SEARCH("[0-9]";[.A871]));MID([.A871];1;SEARCH("[0-9]";[.A871])-1);"") -> 
A872: of:=IF(ISBLANK(['BenchBudEE.csv'.A872]);"";['BenchBudEE.csv'.A872]) ->  | B872: of:=IF(ISBLANK(['BenchBudEE.csv'.B872]);"";['BenchBudEE.csv'.B872]) ->  | C872: of:=IF(ISBLANK(['BenchBudEE.csv'.C1007]);"";MID(['BenchBudEE.csv'.C1007];SEARCH(":";['BenchBudEE.csv'.C1007])+1;100)) ->  | D872: of:=IF(ISBLANK(['BenchBudEE.csv'.D872]);"";['BenchBudEE.csv'.D872]) ->  | E872: of:=IF(ISBLANK(['BenchBudEE.csv'.E872]);"";['BenchBudEE.csv'.E872]) ->  | F872: of:=IF(ISBLANK(['BenchBudEE.csv'.F872]);"";['BenchBudEE.csv'.F872]) ->  | G872: of:=IF(ISNUMBER(SEARCH("[0-9]";[.A872]));MID([.A872];1;SEARCH("[0-9]";[.A872])-1);"") -> 
A873: of:=IF(ISBLANK(['BenchBudEE.csv'.A873]);"";['BenchBudEE.csv'.A873]) ->  | B873: of:=IF(ISBLANK(['BenchBudEE.csv'.B873]);"";['BenchBudEE.csv'.B873]) ->  | C873: of:=IF(ISBLANK(['BenchBudEE.csv'.C1008]);"";MID(['BenchBudEE.csv'.C1008];SEARCH(":";['BenchBudEE.csv'.C1008])+1;100)) ->  | D873: of:=IF(ISBLANK(['BenchBudEE.csv'.D873]);"";['BenchBudEE.csv'.D873]) ->  | E873: of:=IF(ISBLANK(['BenchBudEE.csv'.E873]);"";['BenchBudEE.csv'.E873]) ->  | F873: of:=IF(ISBLANK(['BenchBudEE.csv'.F873]);"";['BenchBudEE.csv'.F873]) ->  | G873: of:=IF(ISNUMBER(SEARCH("[0-9]";[.A873]));MID([.A873];1;SEARCH("[0-9]";[.A873])-1);"") -> 
A874: of:=IF(ISBLANK(['BenchBudEE.csv'.A874]);"";['BenchBudEE.csv'.A874]) ->  | B874: of:=IF(ISBLANK(['BenchBudEE.csv'.B874]);"";['BenchBudEE.csv'.B874]) ->  | C874: of:=IF(ISBLANK(['BenchBudEE.csv'.C1009]);"";MID(['BenchBudEE.csv'.C1009];SEARCH(":";['BenchBudEE.csv'.C1009])+1;100)) ->  | D874: of:=IF(ISBLANK(['BenchBudEE.csv'.D874]);"";['BenchBudEE.csv'.D874]) ->  | E874: of:=IF(ISBLANK(['BenchBudEE.csv'.E874]);"";['BenchBudEE.csv'.E874]) ->  | F874: of:=IF(ISBLANK(['BenchBudEE.csv'.F874]);"";['BenchBudEE.csv'.F874]) ->  | G874: of:=IF(ISNUMBER(SEARCH("[0-9]";[.A874]));MID([.A874];1;SEARCH("[0-9]";[.A874])-1);"") -> 
A875: of:=IF(ISBLANK(['BenchBudEE.csv'.A875]);"";['BenchBudEE.csv'.A875]) ->  | B875: of:=IF(ISBLANK(['BenchBudEE.csv'.B875]);"";['BenchBudEE.csv'.B875]) ->  | C875: of:=IF(ISBLANK(['BenchBudEE.csv'.C1010]);"";MID(['BenchBudEE.csv'.C1010];SEARCH(":";['BenchBudEE.csv'.C1010])+1;100)) ->  | D875: of:=IF(ISBLANK(['BenchBudEE.csv'.D875]);"";['BenchBudEE.csv'.D875]) ->  | E875: of:=IF(ISBLANK(['BenchBudEE.csv'.E875]);"";['BenchBudEE.csv'.E875]) ->  | F875: of:=IF(ISBLANK(['BenchBudEE.csv'.F875]);"";['BenchBudEE.csv'.F875]) ->  | G875: of:=IF(ISNUMBER(SEARCH("[0-9]";[.A875]));MID([.A875];1;SEARCH("[0-9]";[.A875])-1);"") -> 
A876: of:=IF(ISBLANK(['BenchBudEE.csv'.A876]);"";['BenchBudEE.csv'.A876]) ->  | B876: of:=IF(ISBLANK(['BenchBudEE.csv'.B876]);"";['BenchBudEE.csv'.B876]) ->  | C876: of:=IF(ISBLANK(['BenchBudEE.csv'.C1011]);"";MID(['BenchBudEE.csv'.C1011];SEARCH(":";['BenchBudEE.csv'.C1011])+1;100)) ->  | D876: of:=IF(ISBLANK(['BenchBudEE.csv'.D876]);"";['BenchBudEE.csv'.D876]) ->  | E876: of:=IF(ISBLANK(['BenchBudEE.csv'.E876]);"";['BenchBudEE.csv'.E876]) ->  | F876: of:=IF(ISBLANK(['BenchBudEE.csv'.F876]);"";['BenchBudEE.csv'.F876]) ->  | G876: of:=IF(ISNUMBER(SEARCH("[0-9]";[.A876]));MID([.A876];1;SEARCH("[0-9]";[.A876])-1);"") -> 
A877: of:=IF(ISBLANK(['BenchBudEE.csv'.A877]);"";['BenchBudEE.csv'.A877]) ->  | B877: of:=IF(ISBLANK(['BenchBudEE.csv'.B877]);"";['BenchBudEE.csv'.B877]) ->  | C877: of:=IF(ISBLANK(['BenchBudEE.csv'.C1012]);"";MID(['BenchBudEE.csv'.C1012];SEARCH(":";['BenchBudEE.csv'.C1012])+1;100)) ->  | D877: of:=IF(ISBLANK(['BenchBudEE.csv'.D877]);"";['BenchBudEE.csv'.D877]) ->  | E877: of:=IF(ISBLANK(['BenchBudEE.csv'.E877]);"";['BenchBudEE.csv'.E877]) ->  | F877: of:=IF(ISBLANK(['BenchBudEE.csv'.F877]);"";['BenchBudEE.csv'.F877]) ->  | G877: of:=IF(ISNUMBER(SEARCH("[0-9]";[.A877]));MID([.A877];1;SEARCH("[0-9]";[.A877])-1);"") -> 
A878: of:=IF(ISBLANK(['BenchBudEE.csv'.A878]);"";['BenchBudEE.csv'.A878]) ->  | B878: of:=IF(ISBLANK(['BenchBudEE.csv'.B878]);"";['BenchBudEE.csv'.B878]) ->  | C878: of:=IF(ISBLANK(['BenchBudEE.csv'.C1013]);"";MID(['BenchBudEE.csv'.C1013];SEARCH(":";['BenchBudEE.csv'.C1013])+1;100)) ->  | D878: of:=IF(ISBLANK(['BenchBudEE.csv'.D878]);"";['BenchBudEE.csv'.D878]) ->  | E878: of:=IF(ISBLANK(['BenchBudEE.csv'.E878]);"";['BenchBudEE.csv'.E878]) ->  | F878: of:=IF(ISBLANK(['BenchBudEE.csv'.F878]);"";['BenchBudEE.csv'.F878]) ->  | G878: of:=IF(ISNUMBER(SEARCH("[0-9]";[.A878]));MID([.A878];1;SEARCH("[0-9]";[.A878])-1);"") -> 
A879: of:=IF(ISBLANK(['BenchBudEE.csv'.A879]);"";['BenchBudEE.csv'.A879]) ->  | B879: of:=IF(ISBLANK(['BenchBudEE.csv'.B879]);"";['BenchBudEE.csv'.B879]) ->  | C879: of:=IF(ISBLANK(['BenchBudEE.csv'.C1014]);"";MID(['BenchBudEE.csv'.C1014];SEARCH(":";['BenchBudEE.csv'.C1014])+1;100)) ->  | D879: of:=IF(ISBLANK(['BenchBudEE.csv'.D879]);"";['BenchBudEE.csv'.D879]) ->  | E879: of:=IF(ISBLANK(['BenchBudEE.csv'.E879]);"";['BenchBudEE.csv'.E879]) ->  | F879: of:=IF(ISBLANK(['BenchBudEE.csv'.F879]);"";['BenchBudEE.csv'.F879]) ->  | G879: of:=IF(ISNUMBER(SEARCH("[0-9]";[.A879]));MID([.A879];1;SEARCH("[0-9]";[.A879])-1);"") -> 
A880: of:=IF(ISBLANK(['BenchBudEE.csv'.A880]);"";['BenchBudEE.csv'.A880]) ->  | B880: of:=IF(ISBLANK(['BenchBudEE.csv'.B880]);"";['BenchBudEE.csv'.B880]) ->  | C880: of:=IF(ISBLANK(['BenchBudEE.csv'.C1015]);"";MID(['BenchBudEE.csv'.C1015];SEARCH(":";['BenchBudEE.csv'.C1015])+1;100)) ->  | D880: of:=IF(ISBLANK(['BenchBudEE.csv'.D880]);"";['BenchBudEE.csv'.D880]) ->  | E880: of:=IF(ISBLANK(['BenchBudEE.csv'.E880]);"";['BenchBudEE.csv'.E880]) ->  | F880: of:=IF(ISBLANK(['BenchBudEE.csv'.F880]);"";['BenchBudEE.csv'.F880]) ->  | G880: of:=IF(ISNUMBER(SEARCH("[0-9]";[.A880]));MID([.A880];1;SEARCH("[0-9]";[.A880])-1);"") -> 
A881: of:=IF(ISBLANK(['BenchBudEE.csv'.A881]);"";['BenchBudEE.csv'.A881]) ->  | B881: of:=IF(ISBLANK(['BenchBudEE.csv'.B881]);"";['BenchBudEE.csv'.B881]) ->  | C881: of:=IF(ISBLANK(['BenchBudEE.csv'.C1016]);"";MID(['BenchBudEE.csv'.C1016];SEARCH(":";['BenchBudEE.csv'.C1016])+1;100)) ->  | D881: of:=IF(ISBLANK(['BenchBudEE.csv'.D881]);"";['BenchBudEE.csv'.D881]) ->  | E881: of:=IF(ISBLANK(['BenchBudEE.csv'.E881]);"";['BenchBudEE.csv'.E881]) ->  | F881: of:=IF(ISBLANK(['BenchBudEE.csv'.F881]);"";['BenchBudEE.csv'.F881]) ->  | G881: of:=IF(ISNUMBER(SEARCH("[0-9]";[.A881]));MID([.A881];1;SEARCH("[0-9]";[.A881])-1);"") -> 
A882: of:=IF(ISBLANK(['BenchBudEE.csv'.A882]);"";['BenchBudEE.csv'.A882]) ->  | B882: of:=IF(ISBLANK(['BenchBudEE.csv'.B882]);"";['BenchBudEE.csv'.B882]) ->  | C882: of:=IF(ISBLANK(['BenchBudEE.csv'.C1017]);"";MID(['BenchBudEE.csv'.C1017];SEARCH(":";['BenchBudEE.csv'.C1017])+1;100)) ->  | D882: of:=IF(ISBLANK(['BenchBudEE.csv'.D882]);"";['BenchBudEE.csv'.D882]) ->  | E882: of:=IF(ISBLANK(['BenchBudEE.csv'.E882]);"";['BenchBudEE.csv'.E882]) ->  | F882: of:=IF(ISBLANK(['BenchBudEE.csv'.F882]);"";['BenchBudEE.csv'.F882]) ->  | G882: of:=IF(ISNUMBER(SEARCH("[0-9]";[.A882]));MID([.A882];1;SEARCH("[0-9]";[.A882])-1);"") -> 
A883: of:=IF(ISBLANK(['BenchBudEE.csv'.A883]);"";['BenchBudEE.csv'.A883]) ->  | B883: of:=IF(ISBLANK(['BenchBudEE.csv'.B883]);"";['BenchBudEE.csv'.B883]) ->  | C883: of:=IF(ISBLANK(['BenchBudEE.csv'.C1018]);"";MID(['BenchBudEE.csv'.C1018];SEARCH(":";['BenchBudEE.csv'.C1018])+1;100)) ->  | D883: of:=IF(ISBLANK(['BenchBudEE.csv'.D883]);"";['BenchBudEE.csv'.D883]) ->  | E883: of:=IF(ISBLANK(['BenchBudEE.csv'.E883]);"";['BenchBudEE.csv'.E883]) ->  | F883: of:=IF(ISBLANK(['BenchBudEE.csv'.F883]);"";['BenchBudEE.csv'.F883]) ->  | G883: of:=IF(ISNUMBER(SEARCH("[0-9]";[.A883]));MID([.A883];1;SEARCH("[0-9]";[.A883])-1);"") -> 
A884: of:=IF(ISBLANK(['BenchBudEE.csv'.A884]);"";['BenchBudEE.csv'.A884]) ->  | B884: of:=IF(ISBLANK(['BenchBudEE.csv'.B884]);"";['BenchBudEE.csv'.B884]) ->  | C884: of:=IF(ISBLANK(['BenchBudEE.csv'.C1019]);"";MID(['BenchBudEE.csv'.C1019];SEARCH(":";['BenchBudEE.csv'.C1019])+1;100)) ->  | D884: of:=IF(ISBLANK(['BenchBudEE.csv'.D884]);"";['BenchBudEE.csv'.D884]) ->  | E884: of:=IF(ISBLANK(['BenchBudEE.csv'.E884]);"";['BenchBudEE.csv'.E884]) ->  | F884: of:=IF(ISBLANK(['BenchBudEE.csv'.F884]);"";['BenchBudEE.csv'.F884]) ->  | G884: of:=IF(ISNUMBER(SEARCH("[0-9]";[.A884]));MID([.A884];1;SEARCH("[0-9]";[.A884])-1);"") -> 
A885: of:=IF(ISBLANK(['BenchBudEE.csv'.A885]);"";['BenchBudEE.csv'.A885]) ->  | B885: of:=IF(ISBLANK(['BenchBudEE.csv'.B885]);"";['BenchBudEE.csv'.B885]) ->  | C885: of:=IF(ISBLANK(['BenchBudEE.csv'.C1020]);"";MID(['BenchBudEE.csv'.C1020];SEARCH(":";['BenchBudEE.csv'.C1020])+1;100)) ->  | D885: of:=IF(ISBLANK(['BenchBudEE.csv'.D885]);"";['BenchBudEE.csv'.D885]) ->  | E885: of:=IF(ISBLANK(['BenchBudEE.csv'.E885]);"";['BenchBudEE.csv'.E885]) ->  | F885: of:=IF(ISBLANK(['BenchBudEE.csv'.F885]);"";['BenchBudEE.csv'.F885]) ->  | G885: of:=IF(ISNUMBER(SEARCH("[0-9]";[.A885]));MID([.A885];1;SEARCH("[0-9]";[.A885])-1);"") -> 
A886: of:=IF(ISBLANK(['BenchBudEE.csv'.A886]);"";['BenchBudEE.csv'.A886]) ->  | B886: of:=IF(ISBLANK(['BenchBudEE.csv'.B886]);"";['BenchBudEE.csv'.B886]) ->  | C886: of:=IF(ISBLANK(['BenchBudEE.csv'.C1021]);"";MID(['BenchBudEE.csv'.C1021];SEARCH(":";['BenchBudEE.csv'.C1021])+1;100)) ->  | D886: of:=IF(ISBLANK(['BenchBudEE.csv'.D886]);"";['BenchBudEE.csv'.D886]) ->  | E886: of:=IF(ISBLANK(['BenchBudEE.csv'.E886]);"";['BenchBudEE.csv'.E886]) ->  | F886: of:=IF(ISBLANK(['BenchBudEE.csv'.F886]);"";['BenchBudEE.csv'.F886]) ->  | G886: of:=IF(ISNUMBER(SEARCH("[0-9]";[.A886]));MID([.A886];1;SEARCH("[0-9]";[.A886])-1);"") -> 
A887: of:=IF(ISBLANK(['BenchBudEE.csv'.A887]);"";['BenchBudEE.csv'.A887]) ->  | B887: of:=IF(ISBLANK(['BenchBudEE.csv'.B887]);"";['BenchBudEE.csv'.B887]) ->  | C887: of:=IF(ISBLANK(['BenchBudEE.csv'.C1022]);"";MID(['BenchBudEE.csv'.C1022];SEARCH(":";['BenchBudEE.csv'.C1022])+1;100)) ->  | D887: of:=IF(ISBLANK(['BenchBudEE.csv'.D887]);"";['BenchBudEE.csv'.D887]) ->  | E887: of:=IF(ISBLANK(['BenchBudEE.csv'.E887]);"";['BenchBudEE.csv'.E887]) ->  | F887: of:=IF(ISBLANK(['BenchBudEE.csv'.F887]);"";['BenchBudEE.csv'.F887]) ->  | G887: of:=IF(ISNUMBER(SEARCH("[0-9]";[.A887]));MID([.A887];1;SEARCH("[0-9]";[.A887])-1);"") -> 
A888: of:=IF(ISBLANK(['BenchBudEE.csv'.A888]);"";['BenchBudEE.csv'.A888]) ->  | B888: of:=IF(ISBLANK(['BenchBudEE.csv'.B888]);"";['BenchBudEE.csv'.B888]) ->  | C888: of:=IF(ISBLANK(['BenchBudEE.csv'.C1023]);"";MID(['BenchBudEE.csv'.C1023];SEARCH(":";['BenchBudEE.csv'.C1023])+1;100)) ->  | D888: of:=IF(ISBLANK(['BenchBudEE.csv'.D888]);"";['BenchBudEE.csv'.D888]) ->  | E888: of:=IF(ISBLANK(['BenchBudEE.csv'.E888]);"";['BenchBudEE.csv'.E888]) ->  | F888: of:=IF(ISBLANK(['BenchBudEE.csv'.F888]);"";['BenchBudEE.csv'.F888]) ->  | G888: of:=IF(ISNUMBER(SEARCH("[0-9]";[.A888]));MID([.A888];1;SEARCH("[0-9]";[.A888])-1);"") -> 
A889: of:=IF(ISBLANK(['BenchBudEE.csv'.A889]);"";['BenchBudEE.csv'.A889]) ->  | B889: of:=IF(ISBLANK(['BenchBudEE.csv'.B889]);"";['BenchBudEE.csv'.B889]) ->  | C889: of:=IF(ISBLANK(['BenchBudEE.csv'.C1024]);"";MID(['BenchBudEE.csv'.C1024];SEARCH(":";['BenchBudEE.csv'.C1024])+1;100)) ->  | D889: of:=IF(ISBLANK(['BenchBudEE.csv'.D889]);"";['BenchBudEE.csv'.D889]) ->  | E889: of:=IF(ISBLANK(['BenchBudEE.csv'.E889]);"";['BenchBudEE.csv'.E889]) ->  | F889: of:=IF(ISBLANK(['BenchBudEE.csv'.F889]);"";['BenchBudEE.csv'.F889]) ->  | G889: of:=IF(ISNUMBER(SEARCH("[0-9]";[.A889]));MID([.A889];1;SEARCH("[0-9]";[.A889])-1);"") -> 
A890: of:=IF(ISBLANK(['BenchBudEE.csv'.A890]);"";['BenchBudEE.csv'.A890]) ->  | B890: of:=IF(ISBLANK(['BenchBudEE.csv'.B890]);"";['BenchBudEE.csv'.B890]) ->  | C890: of:=IF(ISBLANK(['BenchBudEE.csv'.C1025]);"";MID(['BenchBudEE.csv'.C1025];SEARCH(":";['BenchBudEE.csv'.C1025])+1;100)) ->  | D890: of:=IF(ISBLANK(['BenchBudEE.csv'.D890]);"";['BenchBudEE.csv'.D890]) ->  | E890: of:=IF(ISBLANK(['BenchBudEE.csv'.E890]);"";['BenchBudEE.csv'.E890]) ->  | F890: of:=IF(ISBLANK(['BenchBudEE.csv'.F890]);"";['BenchBudEE.csv'.F890]) ->  | G890: of:=IF(ISNUMBER(SEARCH("[0-9]";[.A890]));MID([.A890];1;SEARCH("[0-9]";[.A890])-1);"") -> 
A891: of:=IF(ISBLANK(['BenchBudEE.csv'.A891]);"";['BenchBudEE.csv'.A891]) ->  | B891: of:=IF(ISBLANK(['BenchBudEE.csv'.B891]);"";['BenchBudEE.csv'.B891]) ->  | C891: of:=IF(ISBLANK(['BenchBudEE.csv'.C1026]);"";MID(['BenchBudEE.csv'.C1026];SEARCH(":";['BenchBudEE.csv'.C1026])+1;100)) ->  | D891: of:=IF(ISBLANK(['BenchBudEE.csv'.D891]);"";['BenchBudEE.csv'.D891]) ->  | E891: of:=IF(ISBLANK(['BenchBudEE.csv'.E891]);"";['BenchBudEE.csv'.E891]) ->  | F891: of:=IF(ISBLANK(['BenchBudEE.csv'.F891]);"";['BenchBudEE.csv'.F891]) ->  | G891: of:=IF(ISNUMBER(SEARCH("[0-9]";[.A891]));MID([.A891];1;SEARCH("[0-9]";[.A891])-1);"") -> 
A892: of:=IF(ISBLANK(['BenchBudEE.csv'.A892]);"";['BenchBudEE.csv'.A892]) ->  | B892: of:=IF(ISBLANK(['BenchBudEE.csv'.B892]);"";['BenchBudEE.csv'.B892]) ->  | C892: of:=IF(ISBLANK(['BenchBudEE.csv'.C1027]);"";MID(['BenchBudEE.csv'.C1027];SEARCH(":";['BenchBudEE.csv'.C1027])+1;100)) ->  | D892: of:=IF(ISBLANK(['BenchBudEE.csv'.D892]);"";['BenchBudEE.csv'.D892]) ->  | E892: of:=IF(ISBLANK(['BenchBudEE.csv'.E892]);"";['BenchBudEE.csv'.E892]) ->  | F892: of:=IF(ISBLANK(['BenchBudEE.csv'.F892]);"";['BenchBudEE.csv'.F892]) ->  | G892: of:=IF(ISNUMBER(SEARCH("[0-9]";[.A892]));MID([.A892];1;SEARCH("[0-9]";[.A892])-1);"") -> 
A893: of:=IF(ISBLANK(['BenchBudEE.csv'.A893]);"";['BenchBudEE.csv'.A893]) ->  | B893: of:=IF(ISBLANK(['BenchBudEE.csv'.B893]);"";['BenchBudEE.csv'.B893]) ->  | C893: of:=IF(ISBLANK(['BenchBudEE.csv'.C1028]);"";MID(['BenchBudEE.csv'.C1028];SEARCH(":";['BenchBudEE.csv'.C1028])+1;100)) ->  | D893: of:=IF(ISBLANK(['BenchBudEE.csv'.D893]);"";['BenchBudEE.csv'.D893]) ->  | E893: of:=IF(ISBLANK(['BenchBudEE.csv'.E893]);"";['BenchBudEE.csv'.E893]) ->  | F893: of:=IF(ISBLANK(['BenchBudEE.csv'.F893]);"";['BenchBudEE.csv'.F893]) ->  | G893: of:=IF(ISNUMBER(SEARCH("[0-9]";[.A893]));MID([.A893];1;SEARCH("[0-9]";[.A893])-1);"") -> 
A894: of:=IF(ISBLANK(['BenchBudEE.csv'.A894]);"";['BenchBudEE.csv'.A894]) ->  | B894: of:=IF(ISBLANK(['BenchBudEE.csv'.B894]);"";['BenchBudEE.csv'.B894]) ->  | C894: of:=IF(ISBLANK(['BenchBudEE.csv'.C1029]);"";MID(['BenchBudEE.csv'.C1029];SEARCH(":";['BenchBudEE.csv'.C1029])+1;100)) ->  | D894: of:=IF(ISBLANK(['BenchBudEE.csv'.D894]);"";['BenchBudEE.csv'.D894]) ->  | E894: of:=IF(ISBLANK(['BenchBudEE.csv'.E894]);"";['BenchBudEE.csv'.E894]) ->  | F894: of:=IF(ISBLANK(['BenchBudEE.csv'.F894]);"";['BenchBudEE.csv'.F894]) ->  | G894: of:=IF(ISNUMBER(SEARCH("[0-9]";[.A894]));MID([.A894];1;SEARCH("[0-9]";[.A894])-1);"") -> 
A895: of:=IF(ISBLANK(['BenchBudEE.csv'.A895]);"";['BenchBudEE.csv'.A895]) ->  | B895: of:=IF(ISBLANK(['BenchBudEE.csv'.B895]);"";['BenchBudEE.csv'.B895]) ->  | C895: of:=IF(ISBLANK(['BenchBudEE.csv'.C1030]);"";MID(['BenchBudEE.csv'.C1030];SEARCH(":";['BenchBudEE.csv'.C1030])+1;100)) ->  | D895: of:=IF(ISBLANK(['BenchBudEE.csv'.D895]);"";['BenchBudEE.csv'.D895]) ->  | E895: of:=IF(ISBLANK(['BenchBudEE.csv'.E895]);"";['BenchBudEE.csv'.E895]) ->  | F895: of:=IF(ISBLANK(['BenchBudEE.csv'.F895]);"";['BenchBudEE.csv'.F895]) ->  | G895: of:=IF(ISNUMBER(SEARCH("[0-9]";[.A895]));MID([.A895];1;SEARCH("[0-9]";[.A895])-1);"") -> 
A896: of:=IF(ISBLANK(['BenchBudEE.csv'.A896]);"";['BenchBudEE.csv'.A896]) ->  | B896: of:=IF(ISBLANK(['BenchBudEE.csv'.B896]);"";['BenchBudEE.csv'.B896]) ->  | C896: of:=IF(ISBLANK(['BenchBudEE.csv'.C1031]);"";MID(['BenchBudEE.csv'.C1031];SEARCH(":";['BenchBudEE.csv'.C1031])+1;100)) ->  | D896: of:=IF(ISBLANK(['BenchBudEE.csv'.D896]);"";['BenchBudEE.csv'.D896]) ->  | E896: of:=IF(ISBLANK(['BenchBudEE.csv'.E896]);"";['BenchBudEE.csv'.E896]) ->  | F896: of:=IF(ISBLANK(['BenchBudEE.csv'.F896]);"";['BenchBudEE.csv'.F896]) ->  | G896: of:=IF(ISNUMBER(SEARCH("[0-9]";[.A896]));MID([.A896];1;SEARCH("[0-9]";[.A896])-1);"") -> 
A897: of:=IF(ISBLANK(['BenchBudEE.csv'.A897]);"";['BenchBudEE.csv'.A897]) ->  | B897: of:=IF(ISBLANK(['BenchBudEE.csv'.B897]);"";['BenchBudEE.csv'.B897]) ->  | C897: of:=IF(ISBLANK(['BenchBudEE.csv'.C1032]);"";MID(['BenchBudEE.csv'.C1032];SEARCH(":";['BenchBudEE.csv'.C1032])+1;100)) ->  | D897: of:=IF(ISBLANK(['BenchBudEE.csv'.D897]);"";['BenchBudEE.csv'.D897]) ->  | E897: of:=IF(ISBLANK(['BenchBudEE.csv'.E897]);"";['BenchBudEE.csv'.E897]) ->  | F897: of:=IF(ISBLANK(['BenchBudEE.csv'.F897]);"";['BenchBudEE.csv'.F897]) ->  | G897: of:=IF(ISNUMBER(SEARCH("[0-9]";[.A897]));MID([.A897];1;SEARCH("[0-9]";[.A897])-1);"") -> 
A898: of:=IF(ISBLANK(['BenchBudEE.csv'.A898]);"";['BenchBudEE.csv'.A898]) ->  | B898: of:=IF(ISBLANK(['BenchBudEE.csv'.B898]);"";['BenchBudEE.csv'.B898]) ->  | C898: of:=IF(ISBLANK(['BenchBudEE.csv'.C1033]);"";MID(['BenchBudEE.csv'.C1033];SEARCH(":";['BenchBudEE.csv'.C1033])+1;100)) ->  | D898: of:=IF(ISBLANK(['BenchBudEE.csv'.D898]);"";['BenchBudEE.csv'.D898]) ->  | E898: of:=IF(ISBLANK(['BenchBudEE.csv'.E898]);"";['BenchBudEE.csv'.E898]) ->  | F898: of:=IF(ISBLANK(['BenchBudEE.csv'.F898]);"";['BenchBudEE.csv'.F898]) ->  | G898: of:=IF(ISNUMBER(SEARCH("[0-9]";[.A898]));MID([.A898];1;SEARCH("[0-9]";[.A898])-1);"") -> 
A899: of:=IF(ISBLANK(['BenchBudEE.csv'.A899]);"";['BenchBudEE.csv'.A899]) ->  | B899: of:=IF(ISBLANK(['BenchBudEE.csv'.B899]);"";['BenchBudEE.csv'.B899]) ->  | C899: of:=IF(ISBLANK(['BenchBudEE.csv'.C1034]);"";MID(['BenchBudEE.csv'.C1034];SEARCH(":";['BenchBudEE.csv'.C1034])+1;100)) ->  | D899: of:=IF(ISBLANK(['BenchBudEE.csv'.D899]);"";['BenchBudEE.csv'.D899]) ->  | E899: of:=IF(ISBLANK(['BenchBudEE.csv'.E899]);"";['BenchBudEE.csv'.E899]) ->  | F899: of:=IF(ISBLANK(['BenchBudEE.csv'.F899]);"";['BenchBudEE.csv'.F899]) ->  | G899: of:=IF(ISNUMBER(SEARCH("[0-9]";[.A899]));MID([.A899];1;SEARCH("[0-9]";[.A899])-1);"") -> 
A900: of:=IF(ISBLANK(['BenchBudEE.csv'.A900]);"";['BenchBudEE.csv'.A900]) ->  | B900: of:=IF(ISBLANK(['BenchBudEE.csv'.B900]);"";['BenchBudEE.csv'.B900]) ->  | C900: of:=IF(ISBLANK(['BenchBudEE.csv'.C1035]);"";MID(['BenchBudEE.csv'.C1035];SEARCH(":";['BenchBudEE.csv'.C1035])+1;100)) ->  | D900: of:=IF(ISBLANK(['BenchBudEE.csv'.D900]);"";['BenchBudEE.csv'.D900]) ->  | E900: of:=IF(ISBLANK(['BenchBudEE.csv'.E900]);"";['BenchBudEE.csv'.E900]) ->  | F900: of:=IF(ISBLANK(['BenchBudEE.csv'.F900]);"";['BenchBudEE.csv'.F900]) ->  | G900: of:=IF(ISNUMBER(SEARCH("[0-9]";[.A900]));MID([.A900];1;SEARCH("[0-9]";[.A900])-1);"") -> 
A901: of:=IF(ISBLANK(['BenchBudEE.csv'.A901]);"";['BenchBudEE.csv'.A901]) ->  | B901: of:=IF(ISBLANK(['BenchBudEE.csv'.B901]);"";['BenchBudEE.csv'.B901]) ->  | C901: of:=IF(ISBLANK(['BenchBudEE.csv'.C1036]);"";MID(['BenchBudEE.csv'.C1036];SEARCH(":";['BenchBudEE.csv'.C1036])+1;100)) ->  | D901: of:=IF(ISBLANK(['BenchBudEE.csv'.D901]);"";['BenchBudEE.csv'.D901]) ->  | E901: of:=IF(ISBLANK(['BenchBudEE.csv'.E901]);"";['BenchBudEE.csv'.E901]) ->  | F901: of:=IF(ISBLANK(['BenchBudEE.csv'.F901]);"";['BenchBudEE.csv'.F901]) ->  | G901: of:=IF(ISNUMBER(SEARCH("[0-9]";[.A901]));MID([.A901];1;SEARCH("[0-9]";[.A901])-1);"") -> 
A902: of:=IF(ISBLANK(['BenchBudEE.csv'.A902]);"";['BenchBudEE.csv'.A902]) ->  | B902: of:=IF(ISBLANK(['BenchBudEE.csv'.B902]);"";['BenchBudEE.csv'.B902]) ->  | C902: of:=IF(ISBLANK(['BenchBudEE.csv'.C1037]);"";MID(['BenchBudEE.csv'.C1037];SEARCH(":";['BenchBudEE.csv'.C1037])+1;100)) ->  | D902: of:=IF(ISBLANK(['BenchBudEE.csv'.D902]);"";['BenchBudEE.csv'.D902]) ->  | E902: of:=IF(ISBLANK(['BenchBudEE.csv'.E902]);"";['BenchBudEE.csv'.E902]) ->  | F902: of:=IF(ISBLANK(['BenchBudEE.csv'.F902]);"";['BenchBudEE.csv'.F902]) ->  | G902: of:=IF(ISNUMBER(SEARCH("[0-9]";[.A902]));MID([.A902];1;SEARCH("[0-9]";[.A902])-1);"") -> 
A903: of:=IF(ISBLANK(['BenchBudEE.csv'.A903]);"";['BenchBudEE.csv'.A903]) ->  | B903: of:=IF(ISBLANK(['BenchBudEE.csv'.B903]);"";['BenchBudEE.csv'.B903]) ->  | C903: of:=IF(ISBLANK(['BenchBudEE.csv'.C1038]);"";MID(['BenchBudEE.csv'.C1038];SEARCH(":";['BenchBudEE.csv'.C1038])+1;100)) ->  | D903: of:=IF(ISBLANK(['BenchBudEE.csv'.D903]);"";['BenchBudEE.csv'.D903]) ->  | E903: of:=IF(ISBLANK(['BenchBudEE.csv'.E903]);"";['BenchBudEE.csv'.E903]) ->  | F903: of:=IF(ISBLANK(['BenchBudEE.csv'.F903]);"";['BenchBudEE.csv'.F903]) ->  | G903: of:=IF(ISNUMBER(SEARCH("[0-9]";[.A903]));MID([.A903];1;SEARCH("[0-9]";[.A903])-1);"") -> 
A904: of:=IF(ISBLANK(['BenchBudEE.csv'.A904]);"";['BenchBudEE.csv'.A904]) ->  | B904: of:=IF(ISBLANK(['BenchBudEE.csv'.B904]);"";['BenchBudEE.csv'.B904]) ->  | C904: of:=IF(ISBLANK(['BenchBudEE.csv'.C1039]);"";MID(['BenchBudEE.csv'.C1039];SEARCH(":";['BenchBudEE.csv'.C1039])+1;100)) ->  | D904: of:=IF(ISBLANK(['BenchBudEE.csv'.D904]);"";['BenchBudEE.csv'.D904]) ->  | E904: of:=IF(ISBLANK(['BenchBudEE.csv'.E904]);"";['BenchBudEE.csv'.E904]) ->  | F904: of:=IF(ISBLANK(['BenchBudEE.csv'.F904]);"";['BenchBudEE.csv'.F904]) ->  | G904: of:=IF(ISNUMBER(SEARCH("[0-9]";[.A904]));MID([.A904];1;SEARCH("[0-9]";[.A904])-1);"") -> 
A905: of:=IF(ISBLANK(['BenchBudEE.csv'.A905]);"";['BenchBudEE.csv'.A905]) ->  | B905: of:=IF(ISBLANK(['BenchBudEE.csv'.B905]);"";['BenchBudEE.csv'.B905]) ->  | C905: of:=IF(ISBLANK(['BenchBudEE.csv'.C1040]);"";MID(['BenchBudEE.csv'.C1040];SEARCH(":";['BenchBudEE.csv'.C1040])+1;100)) ->  | D905: of:=IF(ISBLANK(['BenchBudEE.csv'.D905]);"";['BenchBudEE.csv'.D905]) ->  | E905: of:=IF(ISBLANK(['BenchBudEE.csv'.E905]);"";['BenchBudEE.csv'.E905]) ->  | F905: of:=IF(ISBLANK(['BenchBudEE.csv'.F905]);"";['BenchBudEE.csv'.F905]) ->  | G905: of:=IF(ISNUMBER(SEARCH("[0-9]";[.A905]));MID([.A905];1;SEARCH("[0-9]";[.A905])-1);"") -> 
A906: of:=IF(ISBLANK(['BenchBudEE.csv'.A906]);"";['BenchBudEE.csv'.A906]) ->  | B906: of:=IF(ISBLANK(['BenchBudEE.csv'.B906]);"";['BenchBudEE.csv'.B906]) ->  | C906: of:=IF(ISBLANK(['BenchBudEE.csv'.C1041]);"";MID(['BenchBudEE.csv'.C1041];SEARCH(":";['BenchBudEE.csv'.C1041])+1;100)) ->  | D906: of:=IF(ISBLANK(['BenchBudEE.csv'.D906]);"";['BenchBudEE.csv'.D906]) ->  | E906: of:=IF(ISBLANK(['BenchBudEE.csv'.E906]);"";['BenchBudEE.csv'.E906]) ->  | F906: of:=IF(ISBLANK(['BenchBudEE.csv'.F906]);"";['BenchBudEE.csv'.F906]) ->  | G906: of:=IF(ISNUMBER(SEARCH("[0-9]";[.A906]));MID([.A906];1;SEARCH("[0-9]";[.A906])-1);"") -> 
A907: of:=IF(ISBLANK(['BenchBudEE.csv'.A907]);"";['BenchBudEE.csv'.A907]) ->  | B907: of:=IF(ISBLANK(['BenchBudEE.csv'.B907]);"";['BenchBudEE.csv'.B907]) ->  | C907: of:=IF(ISBLANK(['BenchBudEE.csv'.C1042]);"";MID(['BenchBudEE.csv'.C1042];SEARCH(":";['BenchBudEE.csv'.C1042])+1;100)) ->  | D907: of:=IF(ISBLANK(['BenchBudEE.csv'.D907]);"";['BenchBudEE.csv'.D907]) ->  | E907: of:=IF(ISBLANK(['BenchBudEE.csv'.E907]);"";['BenchBudEE.csv'.E907]) ->  | F907: of:=IF(ISBLANK(['BenchBudEE.csv'.F907]);"";['BenchBudEE.csv'.F907]) ->  | G907: of:=IF(ISNUMBER(SEARCH("[0-9]";[.A907]));MID([.A907];1;SEARCH("[0-9]";[.A907])-1);"") -> 
A908: of:=IF(ISBLANK(['BenchBudEE.csv'.A908]);"";['BenchBudEE.csv'.A908]) ->  | B908: of:=IF(ISBLANK(['BenchBudEE.csv'.B908]);"";['BenchBudEE.csv'.B908]) ->  | C908: of:=IF(ISBLANK(['BenchBudEE.csv'.C1043]);"";MID(['BenchBudEE.csv'.C1043];SEARCH(":";['BenchBudEE.csv'.C1043])+1;100)) ->  | D908: of:=IF(ISBLANK(['BenchBudEE.csv'.D908]);"";['BenchBudEE.csv'.D908]) ->  | E908: of:=IF(ISBLANK(['BenchBudEE.csv'.E908]);"";['BenchBudEE.csv'.E908]) ->  | F908: of:=IF(ISBLANK(['BenchBudEE.csv'.F908]);"";['BenchBudEE.csv'.F908]) ->  | G908: of:=IF(ISNUMBER(SEARCH("[0-9]";[.A908]));MID([.A908];1;SEARCH("[0-9]";[.A908])-1);"") -> 
A909: of:=IF(ISBLANK(['BenchBudEE.csv'.A909]);"";['BenchBudEE.csv'.A909]) ->  | B909: of:=IF(ISBLANK(['BenchBudEE.csv'.B909]);"";['BenchBudEE.csv'.B909]) ->  | C909: of:=IF(ISBLANK(['BenchBudEE.csv'.C1044]);"";MID(['BenchBudEE.csv'.C1044];SEARCH(":";['BenchBudEE.csv'.C1044])+1;100)) ->  | D909: of:=IF(ISBLANK(['BenchBudEE.csv'.D909]);"";['BenchBudEE.csv'.D909]) ->  | E909: of:=IF(ISBLANK(['BenchBudEE.csv'.E909]);"";['BenchBudEE.csv'.E909]) ->  | F909: of:=IF(ISBLANK(['BenchBudEE.csv'.F909]);"";['BenchBudEE.csv'.F909]) ->  | G909: of:=IF(ISNUMBER(SEARCH("[0-9]";[.A909]));MID([.A909];1;SEARCH("[0-9]";[.A909])-1);"") -> 
A910: of:=IF(ISBLANK(['BenchBudEE.csv'.A910]);"";['BenchBudEE.csv'.A910]) ->  | B910: of:=IF(ISBLANK(['BenchBudEE.csv'.B910]);"";['BenchBudEE.csv'.B910]) ->  | C910: of:=IF(ISBLANK(['BenchBudEE.csv'.C1045]);"";MID(['BenchBudEE.csv'.C1045];SEARCH(":";['BenchBudEE.csv'.C1045])+1;100)) ->  | D910: of:=IF(ISBLANK(['BenchBudEE.csv'.D910]);"";['BenchBudEE.csv'.D910]) ->  | E910: of:=IF(ISBLANK(['BenchBudEE.csv'.E910]);"";['BenchBudEE.csv'.E910]) ->  | F910: of:=IF(ISBLANK(['BenchBudEE.csv'.F910]);"";['BenchBudEE.csv'.F910]) ->  | G910: of:=IF(ISNUMBER(SEARCH("[0-9]";[.A910]));MID([.A910];1;SEARCH("[0-9]";[.A910])-1);"") -> 
A911: of:=IF(ISBLANK(['BenchBudEE.csv'.A911]);"";['BenchBudEE.csv'.A911]) ->  | B911: of:=IF(ISBLANK(['BenchBudEE.csv'.B911]);"";['BenchBudEE.csv'.B911]) ->  | C911: of:=IF(ISBLANK(['BenchBudEE.csv'.C1046]);"";MID(['BenchBudEE.csv'.C1046];SEARCH(":";['BenchBudEE.csv'.C1046])+1;100)) ->  | D911: of:=IF(ISBLANK(['BenchBudEE.csv'.D911]);"";['BenchBudEE.csv'.D911]) ->  | E911: of:=IF(ISBLANK(['BenchBudEE.csv'.E911]);"";['BenchBudEE.csv'.E911]) ->  | F911: of:=IF(ISBLANK(['BenchBudEE.csv'.F911]);"";['BenchBudEE.csv'.F911]) ->  | G911: of:=IF(ISNUMBER(SEARCH("[0-9]";[.A911]));MID([.A911];1;SEARCH("[0-9]";[.A911])-1);"") -> 
A912: of:=IF(ISBLANK(['BenchBudEE.csv'.A912]);"";['BenchBudEE.csv'.A912]) ->  | B912: of:=IF(ISBLANK(['BenchBudEE.csv'.B912]);"";['BenchBudEE.csv'.B912]) ->  | C912: of:=IF(ISBLANK(['BenchBudEE.csv'.C1047]);"";MID(['BenchBudEE.csv'.C1047];SEARCH(":";['BenchBudEE.csv'.C1047])+1;100)) ->  | D912: of:=IF(ISBLANK(['BenchBudEE.csv'.D912]);"";['BenchBudEE.csv'.D912]) ->  | E912: of:=IF(ISBLANK(['BenchBudEE.csv'.E912]);"";['BenchBudEE.csv'.E912]) ->  | F912: of:=IF(ISBLANK(['BenchBudEE.csv'.F912]);"";['BenchBudEE.csv'.F912]) ->  | G912: of:=IF(ISNUMBER(SEARCH("[0-9]";[.A912]));MID([.A912];1;SEARCH("[0-9]";[.A912])-1);"") -> 
A913: of:=IF(ISBLANK(['BenchBudEE.csv'.A913]);"";['BenchBudEE.csv'.A913]) ->  | B913: of:=IF(ISBLANK(['BenchBudEE.csv'.B913]);"";['BenchBudEE.csv'.B913]) ->  | C913: of:=IF(ISBLANK(['BenchBudEE.csv'.C1048]);"";MID(['BenchBudEE.csv'.C1048];SEARCH(":";['BenchBudEE.csv'.C1048])+1;100)) ->  | D913: of:=IF(ISBLANK(['BenchBudEE.csv'.D913]);"";['BenchBudEE.csv'.D913]) ->  | E913: of:=IF(ISBLANK(['BenchBudEE.csv'.E913]);"";['BenchBudEE.csv'.E913]) ->  | F913: of:=IF(ISBLANK(['BenchBudEE.csv'.F913]);"";['BenchBudEE.csv'.F913]) ->  | G913: of:=IF(ISNUMBER(SEARCH("[0-9]";[.A913]));MID([.A913];1;SEARCH("[0-9]";[.A913])-1);"") -> 
A914: of:=IF(ISBLANK(['BenchBudEE.csv'.A914]);"";['BenchBudEE.csv'.A914]) ->  | B914: of:=IF(ISBLANK(['BenchBudEE.csv'.B914]);"";['BenchBudEE.csv'.B914]) ->  | C914: of:=IF(ISBLANK(['BenchBudEE.csv'.C1049]);"";MID(['BenchBudEE.csv'.C1049];SEARCH(":";['BenchBudEE.csv'.C1049])+1;100)) ->  | D914: of:=IF(ISBLANK(['BenchBudEE.csv'.D914]);"";['BenchBudEE.csv'.D914]) ->  | E914: of:=IF(ISBLANK(['BenchBudEE.csv'.E914]);"";['BenchBudEE.csv'.E914]) ->  | F914: of:=IF(ISBLANK(['BenchBudEE.csv'.F914]);"";['BenchBudEE.csv'.F914]) ->  | G914: of:=IF(ISNUMBER(SEARCH("[0-9]";[.A914]));MID([.A914];1;SEARCH("[0-9]";[.A914])-1);"") -> 
A915: of:=IF(ISBLANK(['BenchBudEE.csv'.A915]);"";['BenchBudEE.csv'.A915]) ->  | B915: of:=IF(ISBLANK(['BenchBudEE.csv'.B915]);"";['BenchBudEE.csv'.B915]) ->  | C915: of:=IF(ISBLANK(['BenchBudEE.csv'.C1050]);"";MID(['BenchBudEE.csv'.C1050];SEARCH(":";['BenchBudEE.csv'.C1050])+1;100)) ->  | D915: of:=IF(ISBLANK(['BenchBudEE.csv'.D915]);"";['BenchBudEE.csv'.D915]) ->  | E915: of:=IF(ISBLANK(['BenchBudEE.csv'.E915]);"";['BenchBudEE.csv'.E915]) ->  | F915: of:=IF(ISBLANK(['BenchBudEE.csv'.F915]);"";['BenchBudEE.csv'.F915]) ->  | G915: of:=IF(ISNUMBER(SEARCH("[0-9]";[.A915]));MID([.A915];1;SEARCH("[0-9]";[.A915])-1);"") -> 
A916: of:=IF(ISBLANK(['BenchBudEE.csv'.A916]);"";['BenchBudEE.csv'.A916]) ->  | B916: of:=IF(ISBLANK(['BenchBudEE.csv'.B916]);"";['BenchBudEE.csv'.B916]) ->  | C916: of:=IF(ISBLANK(['BenchBudEE.csv'.C1051]);"";MID(['BenchBudEE.csv'.C1051];SEARCH(":";['BenchBudEE.csv'.C1051])+1;100)) ->  | D916: of:=IF(ISBLANK(['BenchBudEE.csv'.D916]);"";['BenchBudEE.csv'.D916]) ->  | E916: of:=IF(ISBLANK(['BenchBudEE.csv'.E916]);"";['BenchBudEE.csv'.E916]) ->  | F916: of:=IF(ISBLANK(['BenchBudEE.csv'.F916]);"";['BenchBudEE.csv'.F916]) ->  | G916: of:=IF(ISNUMBER(SEARCH("[0-9]";[.A916]));MID([.A916];1;SEARCH("[0-9]";[.A916])-1);"") -> 
A917: of:=IF(ISBLANK(['BenchBudEE.csv'.A917]);"";['BenchBudEE.csv'.A917]) ->  | B917: of:=IF(ISBLANK(['BenchBudEE.csv'.B917]);"";['BenchBudEE.csv'.B917]) ->  | C917: of:=IF(ISBLANK(['BenchBudEE.csv'.C1052]);"";MID(['BenchBudEE.csv'.C1052];SEARCH(":";['BenchBudEE.csv'.C1052])+1;100)) ->  | D917: of:=IF(ISBLANK(['BenchBudEE.csv'.D917]);"";['BenchBudEE.csv'.D917]) ->  | E917: of:=IF(ISBLANK(['BenchBudEE.csv'.E917]);"";['BenchBudEE.csv'.E917]) ->  | F917: of:=IF(ISBLANK(['BenchBudEE.csv'.F917]);"";['BenchBudEE.csv'.F917]) ->  | G917: of:=IF(ISNUMBER(SEARCH("[0-9]";[.A917]));MID([.A917];1;SEARCH("[0-9]";[.A917])-1);"") -> 
A918: of:=IF(ISBLANK(['BenchBudEE.csv'.A918]);"";['BenchBudEE.csv'.A918]) ->  | B918: of:=IF(ISBLANK(['BenchBudEE.csv'.B918]);"";['BenchBudEE.csv'.B918]) ->  | C918: of:=IF(ISBLANK(['BenchBudEE.csv'.C1053]);"";MID(['BenchBudEE.csv'.C1053];SEARCH(":";['BenchBudEE.csv'.C1053])+1;100)) ->  | D918: of:=IF(ISBLANK(['BenchBudEE.csv'.D918]);"";['BenchBudEE.csv'.D918]) ->  | E918: of:=IF(ISBLANK(['BenchBudEE.csv'.E918]);"";['BenchBudEE.csv'.E918]) ->  | F918: of:=IF(ISBLANK(['BenchBudEE.csv'.F918]);"";['BenchBudEE.csv'.F918]) ->  | G918: of:=IF(ISNUMBER(SEARCH("[0-9]";[.A918]));MID([.A918];1;SEARCH("[0-9]";[.A918])-1);"") -> 
A919: of:=IF(ISBLANK(['BenchBudEE.csv'.A919]);"";['BenchBudEE.csv'.A919]) ->  | B919: of:=IF(ISBLANK(['BenchBudEE.csv'.B919]);"";['BenchBudEE.csv'.B919]) ->  | C919: of:=IF(ISBLANK(['BenchBudEE.csv'.C1054]);"";MID(['BenchBudEE.csv'.C1054];SEARCH(":";['BenchBudEE.csv'.C1054])+1;100)) ->  | D919: of:=IF(ISBLANK(['BenchBudEE.csv'.D919]);"";['BenchBudEE.csv'.D919]) ->  | E919: of:=IF(ISBLANK(['BenchBudEE.csv'.E919]);"";['BenchBudEE.csv'.E919]) ->  | F919: of:=IF(ISBLANK(['BenchBudEE.csv'.F919]);"";['BenchBudEE.csv'.F919]) ->  | G919: of:=IF(ISNUMBER(SEARCH("[0-9]";[.A919]));MID([.A919];1;SEARCH("[0-9]";[.A919])-1);"") -> 
A920: of:=IF(ISBLANK(['BenchBudEE.csv'.A920]);"";['BenchBudEE.csv'.A920]) ->  | B920: of:=IF(ISBLANK(['BenchBudEE.csv'.B920]);"";['BenchBudEE.csv'.B920]) ->  | C920: of:=IF(ISBLANK(['BenchBudEE.csv'.C1055]);"";MID(['BenchBudEE.csv'.C1055];SEARCH(":";['BenchBudEE.csv'.C1055])+1;100)) ->  | D920: of:=IF(ISBLANK(['BenchBudEE.csv'.D920]);"";['BenchBudEE.csv'.D920]) ->  | E920: of:=IF(ISBLANK(['BenchBudEE.csv'.E920]);"";['BenchBudEE.csv'.E920]) ->  | F920: of:=IF(ISBLANK(['BenchBudEE.csv'.F920]);"";['BenchBudEE.csv'.F920]) ->  | G920: of:=IF(ISNUMBER(SEARCH("[0-9]";[.A920]));MID([.A920];1;SEARCH("[0-9]";[.A920])-1);"") -> 
A921: of:=IF(ISBLANK(['BenchBudEE.csv'.A921]);"";['BenchBudEE.csv'.A921]) ->  | B921: of:=IF(ISBLANK(['BenchBudEE.csv'.B921]);"";['BenchBudEE.csv'.B921]) ->  | C921: of:=IF(ISBLANK(['BenchBudEE.csv'.C1056]);"";MID(['BenchBudEE.csv'.C1056];SEARCH(":";['BenchBudEE.csv'.C1056])+1;100)) ->  | D921: of:=IF(ISBLANK(['BenchBudEE.csv'.D921]);"";['BenchBudEE.csv'.D921]) ->  | E921: of:=IF(ISBLANK(['BenchBudEE.csv'.E921]);"";['BenchBudEE.csv'.E921]) ->  | F921: of:=IF(ISBLANK(['BenchBudEE.csv'.F921]);"";['BenchBudEE.csv'.F921]) ->  | G921: of:=IF(ISNUMBER(SEARCH("[0-9]";[.A921]));MID([.A921];1;SEARCH("[0-9]";[.A921])-1);"") -> 
A922: of:=IF(ISBLANK(['BenchBudEE.csv'.A922]);"";['BenchBudEE.csv'.A922]) ->  | B922: of:=IF(ISBLANK(['BenchBudEE.csv'.B922]);"";['BenchBudEE.csv'.B922]) ->  | C922: of:=IF(ISBLANK(['BenchBudEE.csv'.C1057]);"";MID(['BenchBudEE.csv'.C1057];SEARCH(":";['BenchBudEE.csv'.C1057])+1;100)) ->  | D922: of:=IF(ISBLANK(['BenchBudEE.csv'.D922]);"";['BenchBudEE.csv'.D922]) ->  | E922: of:=IF(ISBLANK(['BenchBudEE.csv'.E922]);"";['BenchBudEE.csv'.E922]) ->  | F922: of:=IF(ISBLANK(['BenchBudEE.csv'.F922]);"";['BenchBudEE.csv'.F922]) ->  | G922: of:=IF(ISNUMBER(SEARCH("[0-9]";[.A922]));MID([.A922];1;SEARCH("[0-9]";[.A922])-1);"") -> 
A923: of:=IF(ISBLANK(['BenchBudEE.csv'.A923]);"";['BenchBudEE.csv'.A923]) ->  | B923: of:=IF(ISBLANK(['BenchBudEE.csv'.B923]);"";['BenchBudEE.csv'.B923]) ->  | C923: of:=IF(ISBLANK(['BenchBudEE.csv'.C1058]);"";MID(['BenchBudEE.csv'.C1058];SEARCH(":";['BenchBudEE.csv'.C1058])+1;100)) ->  | D923: of:=IF(ISBLANK(['BenchBudEE.csv'.D923]);"";['BenchBudEE.csv'.D923]) ->  | E923: of:=IF(ISBLANK(['BenchBudEE.csv'.E923]);"";['BenchBudEE.csv'.E923]) ->  | F923: of:=IF(ISBLANK(['BenchBudEE.csv'.F923]);"";['BenchBudEE.csv'.F923]) ->  | G923: of:=IF(ISNUMBER(SEARCH("[0-9]";[.A923]));MID([.A923];1;SEARCH("[0-9]";[.A923])-1);"") -> 
A924: of:=IF(ISBLANK(['BenchBudEE.csv'.A924]);"";['BenchBudEE.csv'.A924]) ->  | B924: of:=IF(ISBLANK(['BenchBudEE.csv'.B924]);"";['BenchBudEE.csv'.B924]) ->  | C924: of:=IF(ISBLANK(['BenchBudEE.csv'.C1059]);"";MID(['BenchBudEE.csv'.C1059];SEARCH(":";['BenchBudEE.csv'.C1059])+1;100)) ->  | D924: of:=IF(ISBLANK(['BenchBudEE.csv'.D924]);"";['BenchBudEE.csv'.D924]) ->  | E924: of:=IF(ISBLANK(['BenchBudEE.csv'.E924]);"";['BenchBudEE.csv'.E924]) ->  | F924: of:=IF(ISBLANK(['BenchBudEE.csv'.F924]);"";['BenchBudEE.csv'.F924]) ->  | G924: of:=IF(ISNUMBER(SEARCH("[0-9]";[.A924]));MID([.A924];1;SEARCH("[0-9]";[.A924])-1);"") -> 
A925: of:=IF(ISBLANK(['BenchBudEE.csv'.A925]);"";['BenchBudEE.csv'.A925]) ->  | B925: of:=IF(ISBLANK(['BenchBudEE.csv'.B925]);"";['BenchBudEE.csv'.B925]) ->  | C925: of:=IF(ISBLANK(['BenchBudEE.csv'.C1060]);"";MID(['BenchBudEE.csv'.C1060];SEARCH(":";['BenchBudEE.csv'.C1060])+1;100)) ->  | D925: of:=IF(ISBLANK(['BenchBudEE.csv'.D925]);"";['BenchBudEE.csv'.D925]) ->  | E925: of:=IF(ISBLANK(['BenchBudEE.csv'.E925]);"";['BenchBudEE.csv'.E925]) ->  | F925: of:=IF(ISBLANK(['BenchBudEE.csv'.F925]);"";['BenchBudEE.csv'.F925]) ->  | G925: of:=IF(ISNUMBER(SEARCH("[0-9]";[.A925]));MID([.A925];1;SEARCH("[0-9]";[.A925])-1);"") -> 
A926: of:=IF(ISBLANK(['BenchBudEE.csv'.A926]);"";['BenchBudEE.csv'.A926]) ->  | B926: of:=IF(ISBLANK(['BenchBudEE.csv'.B926]);"";['BenchBudEE.csv'.B926]) ->  | C926: of:=IF(ISBLANK(['BenchBudEE.csv'.C1061]);"";MID(['BenchBudEE.csv'.C1061];SEARCH(":";['BenchBudEE.csv'.C1061])+1;100)) ->  | D926: of:=IF(ISBLANK(['BenchBudEE.csv'.D926]);"";['BenchBudEE.csv'.D926]) ->  | E926: of:=IF(ISBLANK(['BenchBudEE.csv'.E926]);"";['BenchBudEE.csv'.E926]) ->  | F926: of:=IF(ISBLANK(['BenchBudEE.csv'.F926]);"";['BenchBudEE.csv'.F926]) ->  | G926: of:=IF(ISNUMBER(SEARCH("[0-9]";[.A926]));MID([.A926];1;SEARCH("[0-9]";[.A926])-1);"") -> 
A927: of:=IF(ISBLANK(['BenchBudEE.csv'.A927]);"";['BenchBudEE.csv'.A927]) ->  | B927: of:=IF(ISBLANK(['BenchBudEE.csv'.B927]);"";['BenchBudEE.csv'.B927]) ->  | C927: of:=IF(ISBLANK(['BenchBudEE.csv'.C1062]);"";MID(['BenchBudEE.csv'.C1062];SEARCH(":";['BenchBudEE.csv'.C1062])+1;100)) ->  | D927: of:=IF(ISBLANK(['BenchBudEE.csv'.D927]);"";['BenchBudEE.csv'.D927]) ->  | E927: of:=IF(ISBLANK(['BenchBudEE.csv'.E927]);"";['BenchBudEE.csv'.E927]) ->  | F927: of:=IF(ISBLANK(['BenchBudEE.csv'.F927]);"";['BenchBudEE.csv'.F927]) ->  | G927: of:=IF(ISNUMBER(SEARCH("[0-9]";[.A927]));MID([.A927];1;SEARCH("[0-9]";[.A927])-1);"") -> 
A928: of:=IF(ISBLANK(['BenchBudEE.csv'.A928]);"";['BenchBudEE.csv'.A928]) ->  | B928: of:=IF(ISBLANK(['BenchBudEE.csv'.B928]);"";['BenchBudEE.csv'.B928]) ->  | C928: of:=IF(ISBLANK(['BenchBudEE.csv'.C1063]);"";MID(['BenchBudEE.csv'.C1063];SEARCH(":";['BenchBudEE.csv'.C1063])+1;100)) ->  | D928: of:=IF(ISBLANK(['BenchBudEE.csv'.D928]);"";['BenchBudEE.csv'.D928]) ->  | E928: of:=IF(ISBLANK(['BenchBudEE.csv'.E928]);"";['BenchBudEE.csv'.E928]) ->  | F928: of:=IF(ISBLANK(['BenchBudEE.csv'.F928]);"";['BenchBudEE.csv'.F928]) ->  | G928: of:=IF(ISNUMBER(SEARCH("[0-9]";[.A928]));MID([.A928];1;SEARCH("[0-9]";[.A928])-1);"") -> 
A929: of:=IF(ISBLANK(['BenchBudEE.csv'.A929]);"";['BenchBudEE.csv'.A929]) ->  | B929: of:=IF(ISBLANK(['BenchBudEE.csv'.B929]);"";['BenchBudEE.csv'.B929]) ->  | C929: of:=IF(ISBLANK(['BenchBudEE.csv'.C1064]);"";MID(['BenchBudEE.csv'.C1064];SEARCH(":";['BenchBudEE.csv'.C1064])+1;100)) ->  | D929: of:=IF(ISBLANK(['BenchBudEE.csv'.D929]);"";['BenchBudEE.csv'.D929]) ->  | E929: of:=IF(ISBLANK(['BenchBudEE.csv'.E929]);"";['BenchBudEE.csv'.E929]) ->  | F929: of:=IF(ISBLANK(['BenchBudEE.csv'.F929]);"";['BenchBudEE.csv'.F929]) ->  | G929: of:=IF(ISNUMBER(SEARCH("[0-9]";[.A929]));MID([.A929];1;SEARCH("[0-9]";[.A929])-1);"") -> 
A930: of:=IF(ISBLANK(['BenchBudEE.csv'.A930]);"";['BenchBudEE.csv'.A930]) ->  | B930: of:=IF(ISBLANK(['BenchBudEE.csv'.B930]);"";['BenchBudEE.csv'.B930]) ->  | C930: of:=IF(ISBLANK(['BenchBudEE.csv'.C1065]);"";MID(['BenchBudEE.csv'.C1065];SEARCH(":";['BenchBudEE.csv'.C1065])+1;100)) ->  | D930: of:=IF(ISBLANK(['BenchBudEE.csv'.D930]);"";['BenchBudEE.csv'.D930]) ->  | E930: of:=IF(ISBLANK(['BenchBudEE.csv'.E930]);"";['BenchBudEE.csv'.E930]) ->  | F930: of:=IF(ISBLANK(['BenchBudEE.csv'.F930]);"";['BenchBudEE.csv'.F930]) ->  | G930: of:=IF(ISNUMBER(SEARCH("[0-9]";[.A930]));MID([.A930];1;SEARCH("[0-9]";[.A930])-1);"") -> 
A931: of:=IF(ISBLANK(['BenchBudEE.csv'.A931]);"";['BenchBudEE.csv'.A931]) ->  | B931: of:=IF(ISBLANK(['BenchBudEE.csv'.B931]);"";['BenchBudEE.csv'.B931]) ->  | C931: of:=IF(ISBLANK(['BenchBudEE.csv'.C1066]);"";MID(['BenchBudEE.csv'.C1066];SEARCH(":";['BenchBudEE.csv'.C1066])+1;100)) ->  | D931: of:=IF(ISBLANK(['BenchBudEE.csv'.D931]);"";['BenchBudEE.csv'.D931]) ->  | E931: of:=IF(ISBLANK(['BenchBudEE.csv'.E931]);"";['BenchBudEE.csv'.E931]) ->  | F931: of:=IF(ISBLANK(['BenchBudEE.csv'.F931]);"";['BenchBudEE.csv'.F931]) ->  | G931: of:=IF(ISNUMBER(SEARCH("[0-9]";[.A931]));MID([.A931];1;SEARCH("[0-9]";[.A931])-1);"") -> 
A932: of:=IF(ISBLANK(['BenchBudEE.csv'.A932]);"";['BenchBudEE.csv'.A932]) ->  | B932: of:=IF(ISBLANK(['BenchBudEE.csv'.B932]);"";['BenchBudEE.csv'.B932]) ->  | C932: of:=IF(ISBLANK(['BenchBudEE.csv'.C1067]);"";MID(['BenchBudEE.csv'.C1067];SEARCH(":";['BenchBudEE.csv'.C1067])+1;100)) ->  | D932: of:=IF(ISBLANK(['BenchBudEE.csv'.D932]);"";['BenchBudEE.csv'.D932]) ->  | E932: of:=IF(ISBLANK(['BenchBudEE.csv'.E932]);"";['BenchBudEE.csv'.E932]) ->  | F932: of:=IF(ISBLANK(['BenchBudEE.csv'.F932]);"";['BenchBudEE.csv'.F932]) ->  | G932: of:=IF(ISNUMBER(SEARCH("[0-9]";[.A932]));MID([.A932];1;SEARCH("[0-9]";[.A932])-1);"") -> 
A933: of:=IF(ISBLANK(['BenchBudEE.csv'.A933]);"";['BenchBudEE.csv'.A933]) ->  | B933: of:=IF(ISBLANK(['BenchBudEE.csv'.B933]);"";['BenchBudEE.csv'.B933]) ->  | C933: of:=IF(ISBLANK(['BenchBudEE.csv'.C1068]);"";MID(['BenchBudEE.csv'.C1068];SEARCH(":";['BenchBudEE.csv'.C1068])+1;100)) ->  | D933: of:=IF(ISBLANK(['BenchBudEE.csv'.D933]);"";['BenchBudEE.csv'.D933]) ->  | E933: of:=IF(ISBLANK(['BenchBudEE.csv'.E933]);"";['BenchBudEE.csv'.E933]) ->  | F933: of:=IF(ISBLANK(['BenchBudEE.csv'.F933]);"";['BenchBudEE.csv'.F933]) ->  | G933: of:=IF(ISNUMBER(SEARCH("[0-9]";[.A933]));MID([.A933];1;SEARCH("[0-9]";[.A933])-1);"") -> 
A934: of:=IF(ISBLANK(['BenchBudEE.csv'.A934]);"";['BenchBudEE.csv'.A934]) ->  | B934: of:=IF(ISBLANK(['BenchBudEE.csv'.B934]);"";['BenchBudEE.csv'.B934]) ->  | C934: of:=IF(ISBLANK(['BenchBudEE.csv'.C1069]);"";MID(['BenchBudEE.csv'.C1069];SEARCH(":";['BenchBudEE.csv'.C1069])+1;100)) ->  | D934: of:=IF(ISBLANK(['BenchBudEE.csv'.D934]);"";['BenchBudEE.csv'.D934]) ->  | E934: of:=IF(ISBLANK(['BenchBudEE.csv'.E934]);"";['BenchBudEE.csv'.E934]) ->  | F934: of:=IF(ISBLANK(['BenchBudEE.csv'.F934]);"";['BenchBudEE.csv'.F934]) ->  | G934: of:=IF(ISNUMBER(SEARCH("[0-9]";[.A934]));MID([.A934];1;SEARCH("[0-9]";[.A934])-1);"") -> 
A935: of:=IF(ISBLANK(['BenchBudEE.csv'.A935]);"";['BenchBudEE.csv'.A935]) ->  | B935: of:=IF(ISBLANK(['BenchBudEE.csv'.B935]);"";['BenchBudEE.csv'.B935]) ->  | C935: of:=IF(ISBLANK(['BenchBudEE.csv'.C1070]);"";MID(['BenchBudEE.csv'.C1070];SEARCH(":";['BenchBudEE.csv'.C1070])+1;100)) ->  | D935: of:=IF(ISBLANK(['BenchBudEE.csv'.D935]);"";['BenchBudEE.csv'.D935]) ->  | E935: of:=IF(ISBLANK(['BenchBudEE.csv'.E935]);"";['BenchBudEE.csv'.E935]) ->  | F935: of:=IF(ISBLANK(['BenchBudEE.csv'.F935]);"";['BenchBudEE.csv'.F935]) ->  | G935: of:=IF(ISNUMBER(SEARCH("[0-9]";[.A935]));MID([.A935];1;SEARCH("[0-9]";[.A935])-1);"") -> 
A936: of:=IF(ISBLANK(['BenchBudEE.csv'.A936]);"";['BenchBudEE.csv'.A936]) ->  | B936: of:=IF(ISBLANK(['BenchBudEE.csv'.B936]);"";['BenchBudEE.csv'.B936]) ->  | C936: of:=IF(ISBLANK(['BenchBudEE.csv'.C1071]);"";MID(['BenchBudEE.csv'.C1071];SEARCH(":";['BenchBudEE.csv'.C1071])+1;100)) ->  | D936: of:=IF(ISBLANK(['BenchBudEE.csv'.D936]);"";['BenchBudEE.csv'.D936]) ->  | E936: of:=IF(ISBLANK(['BenchBudEE.csv'.E936]);"";['BenchBudEE.csv'.E936]) ->  | F936: of:=IF(ISBLANK(['BenchBudEE.csv'.F936]);"";['BenchBudEE.csv'.F936]) ->  | G936: of:=IF(ISNUMBER(SEARCH("[0-9]";[.A936]));MID([.A936];1;SEARCH("[0-9]";[.A936])-1);"") -> 
A937: of:=IF(ISBLANK(['BenchBudEE.csv'.A937]);"";['BenchBudEE.csv'.A937]) ->  | B937: of:=IF(ISBLANK(['BenchBudEE.csv'.B937]);"";['BenchBudEE.csv'.B937]) ->  | C937: of:=IF(ISBLANK(['BenchBudEE.csv'.C1072]);"";MID(['BenchBudEE.csv'.C1072];SEARCH(":";['BenchBudEE.csv'.C1072])+1;100)) ->  | D937: of:=IF(ISBLANK(['BenchBudEE.csv'.D937]);"";['BenchBudEE.csv'.D937]) ->  | E937: of:=IF(ISBLANK(['BenchBudEE.csv'.E937]);"";['BenchBudEE.csv'.E937]) ->  | F937: of:=IF(ISBLANK(['BenchBudEE.csv'.F937]);"";['BenchBudEE.csv'.F937]) ->  | G937: of:=IF(ISNUMBER(SEARCH("[0-9]";[.A937]));MID([.A937];1;SEARCH("[0-9]";[.A937])-1);"") -> 
A938: of:=IF(ISBLANK(['BenchBudEE.csv'.A938]);"";['BenchBudEE.csv'.A938]) ->  | B938: of:=IF(ISBLANK(['BenchBudEE.csv'.B938]);"";['BenchBudEE.csv'.B938]) ->  | C938: of:=IF(ISBLANK(['BenchBudEE.csv'.C1073]);"";MID(['BenchBudEE.csv'.C1073];SEARCH(":";['BenchBudEE.csv'.C1073])+1;100)) ->  | D938: of:=IF(ISBLANK(['BenchBudEE.csv'.D938]);"";['BenchBudEE.csv'.D938]) ->  | E938: of:=IF(ISBLANK(['BenchBudEE.csv'.E938]);"";['BenchBudEE.csv'.E938]) ->  | F938: of:=IF(ISBLANK(['BenchBudEE.csv'.F938]);"";['BenchBudEE.csv'.F938]) ->  | G938: of:=IF(ISNUMBER(SEARCH("[0-9]";[.A938]));MID([.A938];1;SEARCH("[0-9]";[.A938])-1);"") -> 
A939: of:=IF(ISBLANK(['BenchBudEE.csv'.A939]);"";['BenchBudEE.csv'.A939]) ->  | B939: of:=IF(ISBLANK(['BenchBudEE.csv'.B939]);"";['BenchBudEE.csv'.B939]) ->  | C939: of:=IF(ISBLANK(['BenchBudEE.csv'.C1074]);"";MID(['BenchBudEE.csv'.C1074];SEARCH(":";['BenchBudEE.csv'.C1074])+1;100)) ->  | D939: of:=IF(ISBLANK(['BenchBudEE.csv'.D939]);"";['BenchBudEE.csv'.D939]) ->  | E939: of:=IF(ISBLANK(['BenchBudEE.csv'.E939]);"";['BenchBudEE.csv'.E939]) ->  | F939: of:=IF(ISBLANK(['BenchBudEE.csv'.F939]);"";['BenchBudEE.csv'.F939]) ->  | G939: of:=IF(ISNUMBER(SEARCH("[0-9]";[.A939]));MID([.A939];1;SEARCH("[0-9]";[.A939])-1);"") -> 
A940: of:=IF(ISBLANK(['BenchBudEE.csv'.A940]);"";['BenchBudEE.csv'.A940]) ->  | B940: of:=IF(ISBLANK(['BenchBudEE.csv'.B940]);"";['BenchBudEE.csv'.B940]) ->  | C940: of:=IF(ISBLANK(['BenchBudEE.csv'.C1075]);"";MID(['BenchBudEE.csv'.C1075];SEARCH(":";['BenchBudEE.csv'.C1075])+1;100)) ->  | D940: of:=IF(ISBLANK(['BenchBudEE.csv'.D940]);"";['BenchBudEE.csv'.D940]) ->  | E940: of:=IF(ISBLANK(['BenchBudEE.csv'.E940]);"";['BenchBudEE.csv'.E940]) ->  | F940: of:=IF(ISBLANK(['BenchBudEE.csv'.F940]);"";['BenchBudEE.csv'.F940]) ->  | G940: of:=IF(ISNUMBER(SEARCH("[0-9]";[.A940]));MID([.A940];1;SEARCH("[0-9]";[.A940])-1);"") -> 
A941: of:=IF(ISBLANK(['BenchBudEE.csv'.A941]);"";['BenchBudEE.csv'.A941]) ->  | B941: of:=IF(ISBLANK(['BenchBudEE.csv'.B941]);"";['BenchBudEE.csv'.B941]) ->  | C941: of:=IF(ISBLANK(['BenchBudEE.csv'.C1076]);"";MID(['BenchBudEE.csv'.C1076];SEARCH(":";['BenchBudEE.csv'.C1076])+1;100)) ->  | D941: of:=IF(ISBLANK(['BenchBudEE.csv'.D941]);"";['BenchBudEE.csv'.D941]) ->  | E941: of:=IF(ISBLANK(['BenchBudEE.csv'.E941]);"";['BenchBudEE.csv'.E941]) ->  | F941: of:=IF(ISBLANK(['BenchBudEE.csv'.F941]);"";['BenchBudEE.csv'.F941]) ->  | G941: of:=IF(ISNUMBER(SEARCH("[0-9]";[.A941]));MID([.A941];1;SEARCH("[0-9]";[.A941])-1);"") -> 
A942: of:=IF(ISBLANK(['BenchBudEE.csv'.A942]);"";['BenchBudEE.csv'.A942]) ->  | B942: of:=IF(ISBLANK(['BenchBudEE.csv'.B942]);"";['BenchBudEE.csv'.B942]) ->  | C942: of:=IF(ISBLANK(['BenchBudEE.csv'.C1077]);"";MID(['BenchBudEE.csv'.C1077];SEARCH(":";['BenchBudEE.csv'.C1077])+1;100)) ->  | D942: of:=IF(ISBLANK(['BenchBudEE.csv'.D942]);"";['BenchBudEE.csv'.D942]) ->  | E942: of:=IF(ISBLANK(['BenchBudEE.csv'.E942]);"";['BenchBudEE.csv'.E942]) ->  | F942: of:=IF(ISBLANK(['BenchBudEE.csv'.F942]);"";['BenchBudEE.csv'.F942]) ->  | G942: of:=IF(ISNUMBER(SEARCH("[0-9]";[.A942]));MID([.A942];1;SEARCH("[0-9]";[.A942])-1);"") -> 
A943: of:=IF(ISBLANK(['BenchBudEE.csv'.A943]);"";['BenchBudEE.csv'.A943]) ->  | B943: of:=IF(ISBLANK(['BenchBudEE.csv'.B943]);"";['BenchBudEE.csv'.B943]) ->  | C943: of:=IF(ISBLANK(['BenchBudEE.csv'.C1078]);"";MID(['BenchBudEE.csv'.C1078];SEARCH(":";['BenchBudEE.csv'.C1078])+1;100)) ->  | D943: of:=IF(ISBLANK(['BenchBudEE.csv'.D943]);"";['BenchBudEE.csv'.D943]) ->  | E943: of:=IF(ISBLANK(['BenchBudEE.csv'.E943]);"";['BenchBudEE.csv'.E943]) ->  | F943: of:=IF(ISBLANK(['BenchBudEE.csv'.F943]);"";['BenchBudEE.csv'.F943]) ->  | G943: of:=IF(ISNUMBER(SEARCH("[0-9]";[.A943]));MID([.A943];1;SEARCH("[0-9]";[.A943])-1);"") -> 
A944: of:=IF(ISBLANK(['BenchBudEE.csv'.A944]);"";['BenchBudEE.csv'.A944]) ->  | B944: of:=IF(ISBLANK(['BenchBudEE.csv'.B944]);"";['BenchBudEE.csv'.B944]) ->  | C944: of:=IF(ISBLANK(['BenchBudEE.csv'.C1079]);"";MID(['BenchBudEE.csv'.C1079];SEARCH(":";['BenchBudEE.csv'.C1079])+1;100)) ->  | D944: of:=IF(ISBLANK(['BenchBudEE.csv'.D944]);"";['BenchBudEE.csv'.D944]) ->  | E944: of:=IF(ISBLANK(['BenchBudEE.csv'.E944]);"";['BenchBudEE.csv'.E944]) ->  | F944: of:=IF(ISBLANK(['BenchBudEE.csv'.F944]);"";['BenchBudEE.csv'.F944]) ->  | G944: of:=IF(ISNUMBER(SEARCH("[0-9]";[.A944]));MID([.A944];1;SEARCH("[0-9]";[.A944])-1);"") -> 
A945: of:=IF(ISBLANK(['BenchBudEE.csv'.A945]);"";['BenchBudEE.csv'.A945]) ->  | B945: of:=IF(ISBLANK(['BenchBudEE.csv'.B945]);"";['BenchBudEE.csv'.B945]) ->  | C945: of:=IF(ISBLANK(['BenchBudEE.csv'.C1080]);"";MID(['BenchBudEE.csv'.C1080];SEARCH(":";['BenchBudEE.csv'.C1080])+1;100)) ->  | D945: of:=IF(ISBLANK(['BenchBudEE.csv'.D945]);"";['BenchBudEE.csv'.D945]) ->  | E945: of:=IF(ISBLANK(['BenchBudEE.csv'.E945]);"";['BenchBudEE.csv'.E945]) ->  | F945: of:=IF(ISBLANK(['BenchBudEE.csv'.F945]);"";['BenchBudEE.csv'.F945]) ->  | G945: of:=IF(ISNUMBER(SEARCH("[0-9]";[.A945]));MID([.A945];1;SEARCH("[0-9]";[.A945])-1);"") -> 
A946: of:=IF(ISBLANK(['BenchBudEE.csv'.A946]);"";['BenchBudEE.csv'.A946]) ->  | B946: of:=IF(ISBLANK(['BenchBudEE.csv'.B946]);"";['BenchBudEE.csv'.B946]) ->  | C946: of:=IF(ISBLANK(['BenchBudEE.csv'.C1081]);"";MID(['BenchBudEE.csv'.C1081];SEARCH(":";['BenchBudEE.csv'.C1081])+1;100)) ->  | D946: of:=IF(ISBLANK(['BenchBudEE.csv'.D946]);"";['BenchBudEE.csv'.D946]) ->  | E946: of:=IF(ISBLANK(['BenchBudEE.csv'.E946]);"";['BenchBudEE.csv'.E946]) ->  | F946: of:=IF(ISBLANK(['BenchBudEE.csv'.F946]);"";['BenchBudEE.csv'.F946]) ->  | G946: of:=IF(ISNUMBER(SEARCH("[0-9]";[.A946]));MID([.A946];1;SEARCH("[0-9]";[.A946])-1);"") -> 
A947: of:=IF(ISBLANK(['BenchBudEE.csv'.A947]);"";['BenchBudEE.csv'.A947]) ->  | B947: of:=IF(ISBLANK(['BenchBudEE.csv'.B947]);"";['BenchBudEE.csv'.B947]) ->  | C947: of:=IF(ISBLANK(['BenchBudEE.csv'.C1082]);"";MID(['BenchBudEE.csv'.C1082];SEARCH(":";['BenchBudEE.csv'.C1082])+1;100)) ->  | D947: of:=IF(ISBLANK(['BenchBudEE.csv'.D947]);"";['BenchBudEE.csv'.D947]) ->  | E947: of:=IF(ISBLANK(['BenchBudEE.csv'.E947]);"";['BenchBudEE.csv'.E947]) ->  | F947: of:=IF(ISBLANK(['BenchBudEE.csv'.F947]);"";['BenchBudEE.csv'.F947]) ->  | G947: of:=IF(ISNUMBER(SEARCH("[0-9]";[.A947]));MID([.A947];1;SEARCH("[0-9]";[.A947])-1);"") -> 
A948: of:=IF(ISBLANK(['BenchBudEE.csv'.A948]);"";['BenchBudEE.csv'.A948]) ->  | B948: of:=IF(ISBLANK(['BenchBudEE.csv'.B948]);"";['BenchBudEE.csv'.B948]) ->  | C948: of:=IF(ISBLANK(['BenchBudEE.csv'.C1083]);"";MID(['BenchBudEE.csv'.C1083];SEARCH(":";['BenchBudEE.csv'.C1083])+1;100)) ->  | D948: of:=IF(ISBLANK(['BenchBudEE.csv'.D948]);"";['BenchBudEE.csv'.D948]) ->  | E948: of:=IF(ISBLANK(['BenchBudEE.csv'.E948]);"";['BenchBudEE.csv'.E948]) ->  | F948: of:=IF(ISBLANK(['BenchBudEE.csv'.F948]);"";['BenchBudEE.csv'.F948]) ->  | G948: of:=IF(ISNUMBER(SEARCH("[0-9]";[.A948]));MID([.A948];1;SEARCH("[0-9]";[.A948])-1);"") -> 
A949: of:=IF(ISBLANK(['BenchBudEE.csv'.A949]);"";['BenchBudEE.csv'.A949]) ->  | B949: of:=IF(ISBLANK(['BenchBudEE.csv'.B949]);"";['BenchBudEE.csv'.B949]) ->  | C949: of:=IF(ISBLANK(['BenchBudEE.csv'.C1084]);"";MID(['BenchBudEE.csv'.C1084];SEARCH(":";['BenchBudEE.csv'.C1084])+1;100)) ->  | D949: of:=IF(ISBLANK(['BenchBudEE.csv'.D949]);"";['BenchBudEE.csv'.D949]) ->  | E949: of:=IF(ISBLANK(['BenchBudEE.csv'.E949]);"";['BenchBudEE.csv'.E949]) ->  | F949: of:=IF(ISBLANK(['BenchBudEE.csv'.F949]);"";['BenchBudEE.csv'.F949]) ->  | G949: of:=IF(ISNUMBER(SEARCH("[0-9]";[.A949]));MID([.A949];1;SEARCH("[0-9]";[.A949])-1);"") -> 
A950: of:=IF(ISBLANK(['BenchBudEE.csv'.A950]);"";['BenchBudEE.csv'.A950]) ->  | B950: of:=IF(ISBLANK(['BenchBudEE.csv'.B950]);"";['BenchBudEE.csv'.B950]) ->  | C950: of:=IF(ISBLANK(['BenchBudEE.csv'.C1085]);"";MID(['BenchBudEE.csv'.C1085];SEARCH(":";['BenchBudEE.csv'.C1085])+1;100)) ->  | D950: of:=IF(ISBLANK(['BenchBudEE.csv'.D950]);"";['BenchBudEE.csv'.D950]) ->  | E950: of:=IF(ISBLANK(['BenchBudEE.csv'.E950]);"";['BenchBudEE.csv'.E950]) ->  | F950: of:=IF(ISBLANK(['BenchBudEE.csv'.F950]);"";['BenchBudEE.csv'.F950]) ->  | G950: of:=IF(ISNUMBER(SEARCH("[0-9]";[.A950]));MID([.A950];1;SEARCH("[0-9]";[.A950])-1);"") -> 
A951: of:=IF(ISBLANK(['BenchBudEE.csv'.A951]);"";['BenchBudEE.csv'.A951]) ->  | B951: of:=IF(ISBLANK(['BenchBudEE.csv'.B951]);"";['BenchBudEE.csv'.B951]) ->  | C951: of:=IF(ISBLANK(['BenchBudEE.csv'.C1086]);"";MID(['BenchBudEE.csv'.C1086];SEARCH(":";['BenchBudEE.csv'.C1086])+1;100)) ->  | D951: of:=IF(ISBLANK(['BenchBudEE.csv'.D951]);"";['BenchBudEE.csv'.D951]) ->  | E951: of:=IF(ISBLANK(['BenchBudEE.csv'.E951]);"";['BenchBudEE.csv'.E951]) ->  | F951: of:=IF(ISBLANK(['BenchBudEE.csv'.F951]);"";['BenchBudEE.csv'.F951]) ->  | G951: of:=IF(ISNUMBER(SEARCH("[0-9]";[.A951]));MID([.A951];1;SEARCH("[0-9]";[.A951])-1);"") -> 
A952: of:=IF(ISBLANK(['BenchBudEE.csv'.A952]);"";['BenchBudEE.csv'.A952]) ->  | B952: of:=IF(ISBLANK(['BenchBudEE.csv'.B952]);"";['BenchBudEE.csv'.B952]) ->  | C952: of:=IF(ISBLANK(['BenchBudEE.csv'.C1087]);"";MID(['BenchBudEE.csv'.C1087];SEARCH(":";['BenchBudEE.csv'.C1087])+1;100)) ->  | D952: of:=IF(ISBLANK(['BenchBudEE.csv'.D952]);"";['BenchBudEE.csv'.D952]) ->  | E952: of:=IF(ISBLANK(['BenchBudEE.csv'.E952]);"";['BenchBudEE.csv'.E952]) ->  | F952: of:=IF(ISBLANK(['BenchBudEE.csv'.F952]);"";['BenchBudEE.csv'.F952]) ->  | G952: of:=IF(ISNUMBER(SEARCH("[0-9]";[.A952]));MID([.A952];1;SEARCH("[0-9]";[.A952])-1);"") -> 
A953: of:=IF(ISBLANK(['BenchBudEE.csv'.A953]);"";['BenchBudEE.csv'.A953]) ->  | B953: of:=IF(ISBLANK(['BenchBudEE.csv'.B953]);"";['BenchBudEE.csv'.B953]) ->  | C953: of:=IF(ISBLANK(['BenchBudEE.csv'.C1088]);"";MID(['BenchBudEE.csv'.C1088];SEARCH(":";['BenchBudEE.csv'.C1088])+1;100)) ->  | D953: of:=IF(ISBLANK(['BenchBudEE.csv'.D953]);"";['BenchBudEE.csv'.D953]) ->  | E953: of:=IF(ISBLANK(['BenchBudEE.csv'.E953]);"";['BenchBudEE.csv'.E953]) ->  | F953: of:=IF(ISBLANK(['BenchBudEE.csv'.F953]);"";['BenchBudEE.csv'.F953]) ->  | G953: of:=IF(ISNUMBER(SEARCH("[0-9]";[.A953]));MID([.A953];1;SEARCH("[0-9]";[.A953])-1);"") -> 
A954: of:=IF(ISBLANK(['BenchBudEE.csv'.A954]);"";['BenchBudEE.csv'.A954]) ->  | B954: of:=IF(ISBLANK(['BenchBudEE.csv'.B954]);"";['BenchBudEE.csv'.B954]) ->  | C954: of:=IF(ISBLANK(['BenchBudEE.csv'.C1089]);"";MID(['BenchBudEE.csv'.C1089];SEARCH(":";['BenchBudEE.csv'.C1089])+1;100)) ->  | D954: of:=IF(ISBLANK(['BenchBudEE.csv'.D954]);"";['BenchBudEE.csv'.D954]) ->  | E954: of:=IF(ISBLANK(['BenchBudEE.csv'.E954]);"";['BenchBudEE.csv'.E954]) ->  | F954: of:=IF(ISBLANK(['BenchBudEE.csv'.F954]);"";['BenchBudEE.csv'.F954]) ->  | G954: of:=IF(ISNUMBER(SEARCH("[0-9]";[.A954]));MID([.A954];1;SEARCH("[0-9]";[.A954])-1);"") -> 
A955: of:=IF(ISBLANK(['BenchBudEE.csv'.A955]);"";['BenchBudEE.csv'.A955]) ->  | B955: of:=IF(ISBLANK(['BenchBudEE.csv'.B955]);"";['BenchBudEE.csv'.B955]) ->  | C955: of:=IF(ISBLANK(['BenchBudEE.csv'.C1090]);"";MID(['BenchBudEE.csv'.C1090];SEARCH(":";['BenchBudEE.csv'.C1090])+1;100)) ->  | D955: of:=IF(ISBLANK(['BenchBudEE.csv'.D955]);"";['BenchBudEE.csv'.D955]) ->  | E955: of:=IF(ISBLANK(['BenchBudEE.csv'.E955]);"";['BenchBudEE.csv'.E955]) ->  | F955: of:=IF(ISBLANK(['BenchBudEE.csv'.F955]);"";['BenchBudEE.csv'.F955]) ->  | G955: of:=IF(ISNUMBER(SEARCH("[0-9]";[.A955]));MID([.A955];1;SEARCH("[0-9]";[.A955])-1);"") -> 
A956: of:=IF(ISBLANK(['BenchBudEE.csv'.A956]);"";['BenchBudEE.csv'.A956]) ->  | B956: of:=IF(ISBLANK(['BenchBudEE.csv'.B956]);"";['BenchBudEE.csv'.B956]) ->  | C956: of:=IF(ISBLANK(['BenchBudEE.csv'.C1091]);"";MID(['BenchBudEE.csv'.C1091];SEARCH(":";['BenchBudEE.csv'.C1091])+1;100)) ->  | D956: of:=IF(ISBLANK(['BenchBudEE.csv'.D956]);"";['BenchBudEE.csv'.D956]) ->  | E956: of:=IF(ISBLANK(['BenchBudEE.csv'.E956]);"";['BenchBudEE.csv'.E956]) ->  | F956: of:=IF(ISBLANK(['BenchBudEE.csv'.F956]);"";['BenchBudEE.csv'.F956]) ->  | G956: of:=IF(ISNUMBER(SEARCH("[0-9]";[.A956]));MID([.A956];1;SEARCH("[0-9]";[.A956])-1);"") -> 
A957: of:=IF(ISBLANK(['BenchBudEE.csv'.A957]);"";['BenchBudEE.csv'.A957]) ->  | B957: of:=IF(ISBLANK(['BenchBudEE.csv'.B957]);"";['BenchBudEE.csv'.B957]) ->  | C957: of:=IF(ISBLANK(['BenchBudEE.csv'.C1092]);"";MID(['BenchBudEE.csv'.C1092];SEARCH(":";['BenchBudEE.csv'.C1092])+1;100)) ->  | D957: of:=IF(ISBLANK(['BenchBudEE.csv'.D957]);"";['BenchBudEE.csv'.D957]) ->  | E957: of:=IF(ISBLANK(['BenchBudEE.csv'.E957]);"";['BenchBudEE.csv'.E957]) ->  | F957: of:=IF(ISBLANK(['BenchBudEE.csv'.F957]);"";['BenchBudEE.csv'.F957]) ->  | G957: of:=IF(ISNUMBER(SEARCH("[0-9]";[.A957]));MID([.A957];1;SEARCH("[0-9]";[.A957])-1);"") -> 
A958: of:=IF(ISBLANK(['BenchBudEE.csv'.A958]);"";['BenchBudEE.csv'.A958]) ->  | B958: of:=IF(ISBLANK(['BenchBudEE.csv'.B958]);"";['BenchBudEE.csv'.B958]) ->  | C958: of:=IF(ISBLANK(['BenchBudEE.csv'.C1093]);"";MID(['BenchBudEE.csv'.C1093];SEARCH(":";['BenchBudEE.csv'.C1093])+1;100)) ->  | D958: of:=IF(ISBLANK(['BenchBudEE.csv'.D958]);"";['BenchBudEE.csv'.D958]) ->  | E958: of:=IF(ISBLANK(['BenchBudEE.csv'.E958]);"";['BenchBudEE.csv'.E958]) ->  | F958: of:=IF(ISBLANK(['BenchBudEE.csv'.F958]);"";['BenchBudEE.csv'.F958]) ->  | G958: of:=IF(ISNUMBER(SEARCH("[0-9]";[.A958]));MID([.A958];1;SEARCH("[0-9]";[.A958])-1);"") -> 
A959: of:=IF(ISBLANK(['BenchBudEE.csv'.A959]);"";['BenchBudEE.csv'.A959]) ->  | B959: of:=IF(ISBLANK(['BenchBudEE.csv'.B959]);"";['BenchBudEE.csv'.B959]) ->  | C959: of:=IF(ISBLANK(['BenchBudEE.csv'.C1094]);"";MID(['BenchBudEE.csv'.C1094];SEARCH(":";['BenchBudEE.csv'.C1094])+1;100)) ->  | D959: of:=IF(ISBLANK(['BenchBudEE.csv'.D959]);"";['BenchBudEE.csv'.D959]) ->  | E959: of:=IF(ISBLANK(['BenchBudEE.csv'.E959]);"";['BenchBudEE.csv'.E959]) ->  | F959: of:=IF(ISBLANK(['BenchBudEE.csv'.F959]);"";['BenchBudEE.csv'.F959]) ->  | G959: of:=IF(ISNUMBER(SEARCH("[0-9]";[.A959]));MID([.A959];1;SEARCH("[0-9]";[.A959])-1);"") -> 
A960: of:=IF(ISBLANK(['BenchBudEE.csv'.A960]);"";['BenchBudEE.csv'.A960]) ->  | B960: of:=IF(ISBLANK(['BenchBudEE.csv'.B960]);"";['BenchBudEE.csv'.B960]) ->  | C960: of:=IF(ISBLANK(['BenchBudEE.csv'.C1095]);"";MID(['BenchBudEE.csv'.C1095];SEARCH(":";['BenchBudEE.csv'.C1095])+1;100)) ->  | D960: of:=IF(ISBLANK(['BenchBudEE.csv'.D960]);"";['BenchBudEE.csv'.D960]) ->  | E960: of:=IF(ISBLANK(['BenchBudEE.csv'.E960]);"";['BenchBudEE.csv'.E960]) ->  | F960: of:=IF(ISBLANK(['BenchBudEE.csv'.F960]);"";['BenchBudEE.csv'.F960]) ->  | G960: of:=IF(ISNUMBER(SEARCH("[0-9]";[.A960]));MID([.A960];1;SEARCH("[0-9]";[.A960])-1);"") -> 
A961: of:=IF(ISBLANK(['BenchBudEE.csv'.A961]);"";['BenchBudEE.csv'.A961]) ->  | B961: of:=IF(ISBLANK(['BenchBudEE.csv'.B961]);"";['BenchBudEE.csv'.B961]) ->  | C961: of:=IF(ISBLANK(['BenchBudEE.csv'.C1096]);"";MID(['BenchBudEE.csv'.C1096];SEARCH(":";['BenchBudEE.csv'.C1096])+1;100)) ->  | D961: of:=IF(ISBLANK(['BenchBudEE.csv'.D961]);"";['BenchBudEE.csv'.D961]) ->  | E961: of:=IF(ISBLANK(['BenchBudEE.csv'.E961]);"";['BenchBudEE.csv'.E961]) ->  | F961: of:=IF(ISBLANK(['BenchBudEE.csv'.F961]);"";['BenchBudEE.csv'.F961]) ->  | G961: of:=IF(ISNUMBER(SEARCH("[0-9]";[.A961]));MID([.A961];1;SEARCH("[0-9]";[.A961])-1);"") -> 
A962: of:=IF(ISBLANK(['BenchBudEE.csv'.A962]);"";['BenchBudEE.csv'.A962]) ->  | B962: of:=IF(ISBLANK(['BenchBudEE.csv'.B962]);"";['BenchBudEE.csv'.B962]) ->  | C962: of:=IF(ISBLANK(['BenchBudEE.csv'.C1097]);"";MID(['BenchBudEE.csv'.C1097];SEARCH(":";['BenchBudEE.csv'.C1097])+1;100)) ->  | D962: of:=IF(ISBLANK(['BenchBudEE.csv'.D962]);"";['BenchBudEE.csv'.D962]) ->  | E962: of:=IF(ISBLANK(['BenchBudEE.csv'.E962]);"";['BenchBudEE.csv'.E962]) ->  | F962: of:=IF(ISBLANK(['BenchBudEE.csv'.F962]);"";['BenchBudEE.csv'.F962]) ->  | G962: of:=IF(ISNUMBER(SEARCH("[0-9]";[.A962]));MID([.A962];1;SEARCH("[0-9]";[.A962])-1);"") -> 
A963: of:=IF(ISBLANK(['BenchBudEE.csv'.A963]);"";['BenchBudEE.csv'.A963]) ->  | B963: of:=IF(ISBLANK(['BenchBudEE.csv'.B963]);"";['BenchBudEE.csv'.B963]) ->  | C963: of:=IF(ISBLANK(['BenchBudEE.csv'.C1098]);"";MID(['BenchBudEE.csv'.C1098];SEARCH(":";['BenchBudEE.csv'.C1098])+1;100)) ->  | D963: of:=IF(ISBLANK(['BenchBudEE.csv'.D963]);"";['BenchBudEE.csv'.D963]) ->  | E963: of:=IF(ISBLANK(['BenchBudEE.csv'.E963]);"";['BenchBudEE.csv'.E963]) ->  | F963: of:=IF(ISBLANK(['BenchBudEE.csv'.F963]);"";['BenchBudEE.csv'.F963]) ->  | G963: of:=IF(ISNUMBER(SEARCH("[0-9]";[.A963]));MID([.A963];1;SEARCH("[0-9]";[.A963])-1);"") -> 
A964: of:=IF(ISBLANK(['BenchBudEE.csv'.A964]);"";['BenchBudEE.csv'.A964]) ->  | B964: of:=IF(ISBLANK(['BenchBudEE.csv'.B964]);"";['BenchBudEE.csv'.B964]) ->  | C964: of:=IF(ISBLANK(['BenchBudEE.csv'.C1099]);"";MID(['BenchBudEE.csv'.C1099];SEARCH(":";['BenchBudEE.csv'.C1099])+1;100)) ->  | D964: of:=IF(ISBLANK(['BenchBudEE.csv'.D964]);"";['BenchBudEE.csv'.D964]) ->  | E964: of:=IF(ISBLANK(['BenchBudEE.csv'.E964]);"";['BenchBudEE.csv'.E964]) ->  | F964: of:=IF(ISBLANK(['BenchBudEE.csv'.F964]);"";['BenchBudEE.csv'.F964]) ->  | G964: of:=IF(ISNUMBER(SEARCH("[0-9]";[.A964]));MID([.A964];1;SEARCH("[0-9]";[.A964])-1);"") -> 
A965: of:=IF(ISBLANK(['BenchBudEE.csv'.A965]);"";['BenchBudEE.csv'.A965]) ->  | B965: of:=IF(ISBLANK(['BenchBudEE.csv'.B965]);"";['BenchBudEE.csv'.B965]) ->  | C965: of:=IF(ISBLANK(['BenchBudEE.csv'.C1100]);"";MID(['BenchBudEE.csv'.C1100];SEARCH(":";['BenchBudEE.csv'.C1100])+1;100)) ->  | D965: of:=IF(ISBLANK(['BenchBudEE.csv'.D965]);"";['BenchBudEE.csv'.D965]) ->  | E965: of:=IF(ISBLANK(['BenchBudEE.csv'.E965]);"";['BenchBudEE.csv'.E965]) ->  | F965: of:=IF(ISBLANK(['BenchBudEE.csv'.F965]);"";['BenchBudEE.csv'.F965]) ->  | G965: of:=IF(ISNUMBER(SEARCH("[0-9]";[.A965]));MID([.A965];1;SEARCH("[0-9]";[.A965])-1);"") -> 
A966: of:=IF(ISBLANK(['BenchBudEE.csv'.A966]);"";['BenchBudEE.csv'.A966]) ->  | B966: of:=IF(ISBLANK(['BenchBudEE.csv'.B966]);"";['BenchBudEE.csv'.B966]) ->  | C966: of:=IF(ISBLANK(['BenchBudEE.csv'.C1101]);"";MID(['BenchBudEE.csv'.C1101];SEARCH(":";['BenchBudEE.csv'.C1101])+1;100)) ->  | D966: of:=IF(ISBLANK(['BenchBudEE.csv'.D966]);"";['BenchBudEE.csv'.D966]) ->  | E966: of:=IF(ISBLANK(['BenchBudEE.csv'.E966]);"";['BenchBudEE.csv'.E966]) ->  | F966: of:=IF(ISBLANK(['BenchBudEE.csv'.F966]);"";['BenchBudEE.csv'.F966]) ->  | G966: of:=IF(ISNUMBER(SEARCH("[0-9]";[.A966]));MID([.A966];1;SEARCH("[0-9]";[.A966])-1);"") -> 
A967: of:=IF(ISBLANK(['BenchBudEE.csv'.A967]);"";['BenchBudEE.csv'.A967]) ->  | B967: of:=IF(ISBLANK(['BenchBudEE.csv'.B967]);"";['BenchBudEE.csv'.B967]) ->  | C967: of:=IF(ISBLANK(['BenchBudEE.csv'.C1102]);"";MID(['BenchBudEE.csv'.C1102];SEARCH(":";['BenchBudEE.csv'.C1102])+1;100)) ->  | D967: of:=IF(ISBLANK(['BenchBudEE.csv'.D967]);"";['BenchBudEE.csv'.D967]) ->  | E967: of:=IF(ISBLANK(['BenchBudEE.csv'.E967]);"";['BenchBudEE.csv'.E967]) ->  | F967: of:=IF(ISBLANK(['BenchBudEE.csv'.F967]);"";['BenchBudEE.csv'.F967]) ->  | G967: of:=IF(ISNUMBER(SEARCH("[0-9]";[.A967]));MID([.A967];1;SEARCH("[0-9]";[.A967])-1);"") -> 
A968: of:=IF(ISBLANK(['BenchBudEE.csv'.A968]);"";['BenchBudEE.csv'.A968]) ->  | B968: of:=IF(ISBLANK(['BenchBudEE.csv'.B968]);"";['BenchBudEE.csv'.B968]) ->  | C968: of:=IF(ISBLANK(['BenchBudEE.csv'.C1103]);"";MID(['BenchBudEE.csv'.C1103];SEARCH(":";['BenchBudEE.csv'.C1103])+1;100)) ->  | D968: of:=IF(ISBLANK(['BenchBudEE.csv'.D968]);"";['BenchBudEE.csv'.D968]) ->  | E968: of:=IF(ISBLANK(['BenchBudEE.csv'.E968]);"";['BenchBudEE.csv'.E968]) ->  | F968: of:=IF(ISBLANK(['BenchBudEE.csv'.F968]);"";['BenchBudEE.csv'.F968]) ->  | G968: of:=IF(ISNUMBER(SEARCH("[0-9]";[.A968]));MID([.A968];1;SEARCH("[0-9]";[.A968])-1);"") -> 
A969: of:=IF(ISBLANK(['BenchBudEE.csv'.A969]);"";['BenchBudEE.csv'.A969]) ->  | B969: of:=IF(ISBLANK(['BenchBudEE.csv'.B969]);"";['BenchBudEE.csv'.B969]) ->  | C969: of:=IF(ISBLANK(['BenchBudEE.csv'.C1104]);"";MID(['BenchBudEE.csv'.C1104];SEARCH(":";['BenchBudEE.csv'.C1104])+1;100)) ->  | D969: of:=IF(ISBLANK(['BenchBudEE.csv'.D969]);"";['BenchBudEE.csv'.D969]) ->  | E969: of:=IF(ISBLANK(['BenchBudEE.csv'.E969]);"";['BenchBudEE.csv'.E969]) ->  | F969: of:=IF(ISBLANK(['BenchBudEE.csv'.F969]);"";['BenchBudEE.csv'.F969]) ->  | G969: of:=IF(ISNUMBER(SEARCH("[0-9]";[.A969]));MID([.A969];1;SEARCH("[0-9]";[.A969])-1);"") -> 
A970: of:=IF(ISBLANK(['BenchBudEE.csv'.A970]);"";['BenchBudEE.csv'.A970]) ->  | B970: of:=IF(ISBLANK(['BenchBudEE.csv'.B970]);"";['BenchBudEE.csv'.B970]) ->  | C970: of:=IF(ISBLANK(['BenchBudEE.csv'.C1105]);"";MID(['BenchBudEE.csv'.C1105];SEARCH(":";['BenchBudEE.csv'.C1105])+1;100)) ->  | D970: of:=IF(ISBLANK(['BenchBudEE.csv'.D970]);"";['BenchBudEE.csv'.D970]) ->  | E970: of:=IF(ISBLANK(['BenchBudEE.csv'.E970]);"";['BenchBudEE.csv'.E970]) ->  | F970: of:=IF(ISBLANK(['BenchBudEE.csv'.F970]);"";['BenchBudEE.csv'.F970]) ->  | G970: of:=IF(ISNUMBER(SEARCH("[0-9]";[.A970]));MID([.A970];1;SEARCH("[0-9]";[.A970])-1);"") -> 
A971: of:=IF(ISBLANK(['BenchBudEE.csv'.A971]);"";['BenchBudEE.csv'.A971]) ->  | B971: of:=IF(ISBLANK(['BenchBudEE.csv'.B971]);"";['BenchBudEE.csv'.B971]) ->  | C971: of:=IF(ISBLANK(['BenchBudEE.csv'.C1106]);"";MID(['BenchBudEE.csv'.C1106];SEARCH(":";['BenchBudEE.csv'.C1106])+1;100)) ->  | D971: of:=IF(ISBLANK(['BenchBudEE.csv'.D971]);"";['BenchBudEE.csv'.D971]) ->  | E971: of:=IF(ISBLANK(['BenchBudEE.csv'.E971]);"";['BenchBudEE.csv'.E971]) ->  | F971: of:=IF(ISBLANK(['BenchBudEE.csv'.F971]);"";['BenchBudEE.csv'.F971]) ->  | G971: of:=IF(ISNUMBER(SEARCH("[0-9]";[.A971]));MID([.A971];1;SEARCH("[0-9]";[.A971])-1);"") -> 
A972: of:=IF(ISBLANK(['BenchBudEE.csv'.A972]);"";['BenchBudEE.csv'.A972]) ->  | B972: of:=IF(ISBLANK(['BenchBudEE.csv'.B972]);"";['BenchBudEE.csv'.B972]) ->  | C972: of:=IF(ISBLANK(['BenchBudEE.csv'.C1107]);"";MID(['BenchBudEE.csv'.C1107];SEARCH(":";['BenchBudEE.csv'.C1107])+1;100)) ->  | D972: of:=IF(ISBLANK(['BenchBudEE.csv'.D972]);"";['BenchBudEE.csv'.D972]) ->  | E972: of:=IF(ISBLANK(['BenchBudEE.csv'.E972]);"";['BenchBudEE.csv'.E972]) ->  | F972: of:=IF(ISBLANK(['BenchBudEE.csv'.F972]);"";['BenchBudEE.csv'.F972]) ->  | G972: of:=IF(ISNUMBER(SEARCH("[0-9]";[.A972]));MID([.A972];1;SEARCH("[0-9]";[.A972])-1);"") -> 
A973: of:=IF(ISBLANK(['BenchBudEE.csv'.A973]);"";['BenchBudEE.csv'.A973]) ->  | B973: of:=IF(ISBLANK(['BenchBudEE.csv'.B973]);"";['BenchBudEE.csv'.B973]) ->  | C973: of:=IF(ISBLANK(['BenchBudEE.csv'.C1108]);"";MID(['BenchBudEE.csv'.C1108];SEARCH(":";['BenchBudEE.csv'.C1108])+1;100)) ->  | D973: of:=IF(ISBLANK(['BenchBudEE.csv'.D973]);"";['BenchBudEE.csv'.D973]) ->  | E973: of:=IF(ISBLANK(['BenchBudEE.csv'.E973]);"";['BenchBudEE.csv'.E973]) ->  | F973: of:=IF(ISBLANK(['BenchBudEE.csv'.F973]);"";['BenchBudEE.csv'.F973]) ->  | G973: of:=IF(ISNUMBER(SEARCH("[0-9]";[.A973]));MID([.A973];1;SEARCH("[0-9]";[.A973])-1);"") -> 
A974: of:=IF(ISBLANK(['BenchBudEE.csv'.A974]);"";['BenchBudEE.csv'.A974]) ->  | B974: of:=IF(ISBLANK(['BenchBudEE.csv'.B974]);"";['BenchBudEE.csv'.B974]) ->  | C974: of:=IF(ISBLANK(['BenchBudEE.csv'.C1109]);"";MID(['BenchBudEE.csv'.C1109];SEARCH(":";['BenchBudEE.csv'.C1109])+1;100)) ->  | D974: of:=IF(ISBLANK(['BenchBudEE.csv'.D974]);"";['BenchBudEE.csv'.D974]) ->  | E974: of:=IF(ISBLANK(['BenchBudEE.csv'.E974]);"";['BenchBudEE.csv'.E974]) ->  | F974: of:=IF(ISBLANK(['BenchBudEE.csv'.F974]);"";['BenchBudEE.csv'.F974]) ->  | G974: of:=IF(ISNUMBER(SEARCH("[0-9]";[.A974]));MID([.A974];1;SEARCH("[0-9]";[.A974])-1);"") -> 
A975: of:=IF(ISBLANK(['BenchBudEE.csv'.A975]);"";['BenchBudEE.csv'.A975]) ->  | B975: of:=IF(ISBLANK(['BenchBudEE.csv'.B975]);"";['BenchBudEE.csv'.B975]) ->  | C975: of:=IF(ISBLANK(['BenchBudEE.csv'.C1110]);"";MID(['BenchBudEE.csv'.C1110];SEARCH(":";['BenchBudEE.csv'.C1110])+1;100)) ->  | D975: of:=IF(ISBLANK(['BenchBudEE.csv'.D975]);"";['BenchBudEE.csv'.D975]) ->  | E975: of:=IF(ISBLANK(['BenchBudEE.csv'.E975]);"";['BenchBudEE.csv'.E975]) ->  | F975: of:=IF(ISBLANK(['BenchBudEE.csv'.F975]);"";['BenchBudEE.csv'.F975]) ->  | G975: of:=IF(ISNUMBER(SEARCH("[0-9]";[.A975]));MID([.A975];1;SEARCH("[0-9]";[.A975])-1);"") -> 
A976: of:=IF(ISBLANK(['BenchBudEE.csv'.A976]);"";['BenchBudEE.csv'.A976]) ->  | B976: of:=IF(ISBLANK(['BenchBudEE.csv'.B976]);"";['BenchBudEE.csv'.B976]) ->  | C976: of:=IF(ISBLANK(['BenchBudEE.csv'.C1111]);"";MID(['BenchBudEE.csv'.C1111];SEARCH(":";['BenchBudEE.csv'.C1111])+1;100)) ->  | D976: of:=IF(ISBLANK(['BenchBudEE.csv'.D976]);"";['BenchBudEE.csv'.D976]) ->  | E976: of:=IF(ISBLANK(['BenchBudEE.csv'.E976]);"";['BenchBudEE.csv'.E976]) ->  | F976: of:=IF(ISBLANK(['BenchBudEE.csv'.F976]);"";['BenchBudEE.csv'.F976]) ->  | G976: of:=IF(ISNUMBER(SEARCH("[0-9]";[.A976]));MID([.A976];1;SEARCH("[0-9]";[.A976])-1);"") -> 
A977: of:=IF(ISBLANK(['BenchBudEE.csv'.A977]);"";['BenchBudEE.csv'.A977]) ->  | B977: of:=IF(ISBLANK(['BenchBudEE.csv'.B977]);"";['BenchBudEE.csv'.B977]) ->  | C977: of:=IF(ISBLANK(['BenchBudEE.csv'.C1112]);"";MID(['BenchBudEE.csv'.C1112];SEARCH(":";['BenchBudEE.csv'.C1112])+1;100)) ->  | D977: of:=IF(ISBLANK(['BenchBudEE.csv'.D977]);"";['BenchBudEE.csv'.D977]) ->  | E977: of:=IF(ISBLANK(['BenchBudEE.csv'.E977]);"";['BenchBudEE.csv'.E977]) ->  | F977: of:=IF(ISBLANK(['BenchBudEE.csv'.F977]);"";['BenchBudEE.csv'.F977]) ->  | G977: of:=IF(ISNUMBER(SEARCH("[0-9]";[.A977]));MID([.A977];1;SEARCH("[0-9]";[.A977])-1);"") -> 
A978: of:=IF(ISBLANK(['BenchBudEE.csv'.A978]);"";['BenchBudEE.csv'.A978]) ->  | B978: of:=IF(ISBLANK(['BenchBudEE.csv'.B978]);"";['BenchBudEE.csv'.B978]) ->  | C978: of:=IF(ISBLANK(['BenchBudEE.csv'.C1113]);"";MID(['BenchBudEE.csv'.C1113];SEARCH(":";['BenchBudEE.csv'.C1113])+1;100)) ->  | D978: of:=IF(ISBLANK(['BenchBudEE.csv'.D978]);"";['BenchBudEE.csv'.D978]) ->  | E978: of:=IF(ISBLANK(['BenchBudEE.csv'.E978]);"";['BenchBudEE.csv'.E978]) ->  | F978: of:=IF(ISBLANK(['BenchBudEE.csv'.F978]);"";['BenchBudEE.csv'.F978]) ->  | G978: of:=IF(ISNUMBER(SEARCH("[0-9]";[.A978]));MID([.A978];1;SEARCH("[0-9]";[.A978])-1);"") -> 
A979: of:=IF(ISBLANK(['BenchBudEE.csv'.A979]);"";['BenchBudEE.csv'.A979]) ->  | B979: of:=IF(ISBLANK(['BenchBudEE.csv'.B979]);"";['BenchBudEE.csv'.B979]) ->  | C979: of:=IF(ISBLANK(['BenchBudEE.csv'.C1114]);"";MID(['BenchBudEE.csv'.C1114];SEARCH(":";['BenchBudEE.csv'.C1114])+1;100)) ->  | D979: of:=IF(ISBLANK(['BenchBudEE.csv'.D979]);"";['BenchBudEE.csv'.D979]) ->  | E979: of:=IF(ISBLANK(['BenchBudEE.csv'.E979]);"";['BenchBudEE.csv'.E979]) ->  | F979: of:=IF(ISBLANK(['BenchBudEE.csv'.F979]);"";['BenchBudEE.csv'.F979]) ->  | G979: of:=IF(ISNUMBER(SEARCH("[0-9]";[.A979]));MID([.A979];1;SEARCH("[0-9]";[.A979])-1);"") -> 
A980: of:=IF(ISBLANK(['BenchBudEE.csv'.A980]);"";['BenchBudEE.csv'.A980]) ->  | B980: of:=IF(ISBLANK(['BenchBudEE.csv'.B980]);"";['BenchBudEE.csv'.B980]) ->  | C980: of:=IF(ISBLANK(['BenchBudEE.csv'.C1115]);"";MID(['BenchBudEE.csv'.C1115];SEARCH(":";['BenchBudEE.csv'.C1115])+1;100)) ->  | D980: of:=IF(ISBLANK(['BenchBudEE.csv'.D980]);"";['BenchBudEE.csv'.D980]) ->  | E980: of:=IF(ISBLANK(['BenchBudEE.csv'.E980]);"";['BenchBudEE.csv'.E980]) ->  | F980: of:=IF(ISBLANK(['BenchBudEE.csv'.F980]);"";['BenchBudEE.csv'.F980]) ->  | G980: of:=IF(ISNUMBER(SEARCH("[0-9]";[.A980]));MID([.A980];1;SEARCH("[0-9]";[.A980])-1);"") -> 
A981: of:=IF(ISBLANK(['BenchBudEE.csv'.A981]);"";['BenchBudEE.csv'.A981]) ->  | B981: of:=IF(ISBLANK(['BenchBudEE.csv'.B981]);"";['BenchBudEE.csv'.B981]) ->  | C981: of:=IF(ISBLANK(['BenchBudEE.csv'.C1116]);"";MID(['BenchBudEE.csv'.C1116];SEARCH(":";['BenchBudEE.csv'.C1116])+1;100)) ->  | D981: of:=IF(ISBLANK(['BenchBudEE.csv'.D981]);"";['BenchBudEE.csv'.D981]) ->  | E981: of:=IF(ISBLANK(['BenchBudEE.csv'.E981]);"";['BenchBudEE.csv'.E981]) ->  | F981: of:=IF(ISBLANK(['BenchBudEE.csv'.F981]);"";['BenchBudEE.csv'.F981]) ->  | G981: of:=IF(ISNUMBER(SEARCH("[0-9]";[.A981]));MID([.A981];1;SEARCH("[0-9]";[.A981])-1);"") -> 
A982: of:=IF(ISBLANK(['BenchBudEE.csv'.A982]);"";['BenchBudEE.csv'.A982]) ->  | B982: of:=IF(ISBLANK(['BenchBudEE.csv'.B982]);"";['BenchBudEE.csv'.B982]) ->  | C982: of:=IF(ISBLANK(['BenchBudEE.csv'.C1117]);"";MID(['BenchBudEE.csv'.C1117];SEARCH(":";['BenchBudEE.csv'.C1117])+1;100)) ->  | D982: of:=IF(ISBLANK(['BenchBudEE.csv'.D982]);"";['BenchBudEE.csv'.D982]) ->  | E982: of:=IF(ISBLANK(['BenchBudEE.csv'.E982]);"";['BenchBudEE.csv'.E982]) ->  | F982: of:=IF(ISBLANK(['BenchBudEE.csv'.F982]);"";['BenchBudEE.csv'.F982]) ->  | G982: of:=IF(ISNUMBER(SEARCH("[0-9]";[.A982]));MID([.A982];1;SEARCH("[0-9]";[.A982])-1);"") -> 
A983: of:=IF(ISBLANK(['BenchBudEE.csv'.A983]);"";['BenchBudEE.csv'.A983]) ->  | B983: of:=IF(ISBLANK(['BenchBudEE.csv'.B983]);"";['BenchBudEE.csv'.B983]) ->  | C983: of:=IF(ISBLANK(['BenchBudEE.csv'.C1118]);"";MID(['BenchBudEE.csv'.C1118];SEARCH(":";['BenchBudEE.csv'.C1118])+1;100)) ->  | D983: of:=IF(ISBLANK(['BenchBudEE.csv'.D983]);"";['BenchBudEE.csv'.D983]) ->  | E983: of:=IF(ISBLANK(['BenchBudEE.csv'.E983]);"";['BenchBudEE.csv'.E983]) ->  | F983: of:=IF(ISBLANK(['BenchBudEE.csv'.F983]);"";['BenchBudEE.csv'.F983]) ->  | G983: of:=IF(ISNUMBER(SEARCH("[0-9]";[.A983]));MID([.A983];1;SEARCH("[0-9]";[.A983])-1);"") -> 
A984: of:=IF(ISBLANK(['BenchBudEE.csv'.A984]);"";['BenchBudEE.csv'.A984]) ->  | B984: of:=IF(ISBLANK(['BenchBudEE.csv'.B984]);"";['BenchBudEE.csv'.B984]) ->  | C984: of:=IF(ISBLANK(['BenchBudEE.csv'.C1119]);"";MID(['BenchBudEE.csv'.C1119];SEARCH(":";['BenchBudEE.csv'.C1119])+1;100)) ->  | D984: of:=IF(ISBLANK(['BenchBudEE.csv'.D984]);"";['BenchBudEE.csv'.D984]) ->  | E984: of:=IF(ISBLANK(['BenchBudEE.csv'.E984]);"";['BenchBudEE.csv'.E984]) ->  | F984: of:=IF(ISBLANK(['BenchBudEE.csv'.F984]);"";['BenchBudEE.csv'.F984]) ->  | G984: of:=IF(ISNUMBER(SEARCH("[0-9]";[.A984]));MID([.A984];1;SEARCH("[0-9]";[.A984])-1);"") -> 
A985: of:=IF(ISBLANK(['BenchBudEE.csv'.A985]);"";['BenchBudEE.csv'.A985]) ->  | B985: of:=IF(ISBLANK(['BenchBudEE.csv'.B985]);"";['BenchBudEE.csv'.B985]) ->  | C985: of:=IF(ISBLANK(['BenchBudEE.csv'.C1120]);"";MID(['BenchBudEE.csv'.C1120];SEARCH(":";['BenchBudEE.csv'.C1120])+1;100)) ->  | D985: of:=IF(ISBLANK(['BenchBudEE.csv'.D985]);"";['BenchBudEE.csv'.D985]) ->  | E985: of:=IF(ISBLANK(['BenchBudEE.csv'.E985]);"";['BenchBudEE.csv'.E985]) ->  | F985: of:=IF(ISBLANK(['BenchBudEE.csv'.F985]);"";['BenchBudEE.csv'.F985]) ->  | G985: of:=IF(ISNUMBER(SEARCH("[0-9]";[.A985]));MID([.A985];1;SEARCH("[0-9]";[.A985])-1);"") -> 
A986: of:=IF(ISBLANK(['BenchBudEE.csv'.A986]);"";['BenchBudEE.csv'.A986]) ->  | B986: of:=IF(ISBLANK(['BenchBudEE.csv'.B986]);"";['BenchBudEE.csv'.B986]) ->  | C986: of:=IF(ISBLANK(['BenchBudEE.csv'.C1121]);"";MID(['BenchBudEE.csv'.C1121];SEARCH(":";['BenchBudEE.csv'.C1121])+1;100)) ->  | D986: of:=IF(ISBLANK(['BenchBudEE.csv'.D986]);"";['BenchBudEE.csv'.D986]) ->  | E986: of:=IF(ISBLANK(['BenchBudEE.csv'.E986]);"";['BenchBudEE.csv'.E986]) ->  | F986: of:=IF(ISBLANK(['BenchBudEE.csv'.F986]);"";['BenchBudEE.csv'.F986]) ->  | G986: of:=IF(ISNUMBER(SEARCH("[0-9]";[.A986]));MID([.A986];1;SEARCH("[0-9]";[.A986])-1);"") -> 
A987: of:=IF(ISBLANK(['BenchBudEE.csv'.A987]);"";['BenchBudEE.csv'.A987]) ->  | B987: of:=IF(ISBLANK(['BenchBudEE.csv'.B987]);"";['BenchBudEE.csv'.B987]) ->  | C987: of:=IF(ISBLANK(['BenchBudEE.csv'.C1122]);"";MID(['BenchBudEE.csv'.C1122];SEARCH(":";['BenchBudEE.csv'.C1122])+1;100)) ->  | D987: of:=IF(ISBLANK(['BenchBudEE.csv'.D987]);"";['BenchBudEE.csv'.D987]) ->  | E987: of:=IF(ISBLANK(['BenchBudEE.csv'.E987]);"";['BenchBudEE.csv'.E987]) ->  | F987: of:=IF(ISBLANK(['BenchBudEE.csv'.F987]);"";['BenchBudEE.csv'.F987]) ->  | G987: of:=IF(ISNUMBER(SEARCH("[0-9]";[.A987]));MID([.A987];1;SEARCH("[0-9]";[.A987])-1);"") -> 
A988: of:=IF(ISBLANK(['BenchBudEE.csv'.A988]);"";['BenchBudEE.csv'.A988]) ->  | B988: of:=IF(ISBLANK(['BenchBudEE.csv'.B988]);"";['BenchBudEE.csv'.B988]) ->  | C988: of:=IF(ISBLANK(['BenchBudEE.csv'.C1123]);"";MID(['BenchBudEE.csv'.C1123];SEARCH(":";['BenchBudEE.csv'.C1123])+1;100)) ->  | D988: of:=IF(ISBLANK(['BenchBudEE.csv'.D988]);"";['BenchBudEE.csv'.D988]) ->  | E988: of:=IF(ISBLANK(['BenchBudEE.csv'.E988]);"";['BenchBudEE.csv'.E988]) ->  | F988: of:=IF(ISBLANK(['BenchBudEE.csv'.F988]);"";['BenchBudEE.csv'.F988]) ->  | G988: of:=IF(ISNUMBER(SEARCH("[0-9]";[.A988]));MID([.A988];1;SEARCH("[0-9]";[.A988])-1);"") -> 
A989: of:=IF(ISBLANK(['BenchBudEE.csv'.A989]);"";['BenchBudEE.csv'.A989]) ->  | B989: of:=IF(ISBLANK(['BenchBudEE.csv'.B989]);"";['BenchBudEE.csv'.B989]) ->  | C989: of:=IF(ISBLANK(['BenchBudEE.csv'.C1124]);"";MID(['BenchBudEE.csv'.C1124];SEARCH(":";['BenchBudEE.csv'.C1124])+1;100)) ->  | D989: of:=IF(ISBLANK(['BenchBudEE.csv'.D989]);"";['BenchBudEE.csv'.D989]) ->  | E989: of:=IF(ISBLANK(['BenchBudEE.csv'.E989]);"";['BenchBudEE.csv'.E989]) ->  | F989: of:=IF(ISBLANK(['BenchBudEE.csv'.F989]);"";['BenchBudEE.csv'.F989]) ->  | G989: of:=IF(ISNUMBER(SEARCH("[0-9]";[.A989]));MID([.A989];1;SEARCH("[0-9]";[.A989])-1);"") -> 
A990: of:=IF(ISBLANK(['BenchBudEE.csv'.A990]);"";['BenchBudEE.csv'.A990]) ->  | B990: of:=IF(ISBLANK(['BenchBudEE.csv'.B990]);"";['BenchBudEE.csv'.B990]) ->  | C990: of:=IF(ISBLANK(['BenchBudEE.csv'.C1125]);"";MID(['BenchBudEE.csv'.C1125];SEARCH(":";['BenchBudEE.csv'.C1125])+1;100)) ->  | D990: of:=IF(ISBLANK(['BenchBudEE.csv'.D990]);"";['BenchBudEE.csv'.D990]) ->  | E990: of:=IF(ISBLANK(['BenchBudEE.csv'.E990]);"";['BenchBudEE.csv'.E990]) ->  | F990: of:=IF(ISBLANK(['BenchBudEE.csv'.F990]);"";['BenchBudEE.csv'.F990]) ->  | G990: of:=IF(ISNUMBER(SEARCH("[0-9]";[.A990]));MID([.A990];1;SEARCH("[0-9]";[.A990])-1);"") -> 
A991: of:=IF(ISBLANK(['BenchBudEE.csv'.A991]);"";['BenchBudEE.csv'.A991]) ->  | B991: of:=IF(ISBLANK(['BenchBudEE.csv'.B991]);"";['BenchBudEE.csv'.B991]) ->  | C991: of:=IF(ISBLANK(['BenchBudEE.csv'.C1126]);"";MID(['BenchBudEE.csv'.C1126];SEARCH(":";['BenchBudEE.csv'.C1126])+1;100)) ->  | D991: of:=IF(ISBLANK(['BenchBudEE.csv'.D991]);"";['BenchBudEE.csv'.D991]) ->  | E991: of:=IF(ISBLANK(['BenchBudEE.csv'.E991]);"";['BenchBudEE.csv'.E991]) ->  | F991: of:=IF(ISBLANK(['BenchBudEE.csv'.F991]);"";['BenchBudEE.csv'.F991]) ->  | G991: of:=IF(ISNUMBER(SEARCH("[0-9]";[.A991]));MID([.A991];1;SEARCH("[0-9]";[.A991])-1);"") -> 
A992: of:=IF(ISBLANK(['BenchBudEE.csv'.A992]);"";['BenchBudEE.csv'.A992]) ->  | B992: of:=IF(ISBLANK(['BenchBudEE.csv'.B992]);"";['BenchBudEE.csv'.B992]) ->  | C992: of:=IF(ISBLANK(['BenchBudEE.csv'.C1127]);"";MID(['BenchBudEE.csv'.C1127];SEARCH(":";['BenchBudEE.csv'.C1127])+1;100)) ->  | D992: of:=IF(ISBLANK(['BenchBudEE.csv'.D992]);"";['BenchBudEE.csv'.D992]) ->  | E992: of:=IF(ISBLANK(['BenchBudEE.csv'.E992]);"";['BenchBudEE.csv'.E992]) ->  | F992: of:=IF(ISBLANK(['BenchBudEE.csv'.F992]);"";['BenchBudEE.csv'.F992]) ->  | G992: of:=IF(ISNUMBER(SEARCH("[0-9]";[.A992]));MID([.A992];1;SEARCH("[0-9]";[.A992])-1);"") -> 
A993: of:=IF(ISBLANK(['BenchBudEE.csv'.A993]);"";['BenchBudEE.csv'.A993]) ->  | B993: of:=IF(ISBLANK(['BenchBudEE.csv'.B993]);"";['BenchBudEE.csv'.B993]) ->  | C993: of:=IF(ISBLANK(['BenchBudEE.csv'.C1128]);"";MID(['BenchBudEE.csv'.C1128];SEARCH(":";['BenchBudEE.csv'.C1128])+1;100)) ->  | D993: of:=IF(ISBLANK(['BenchBudEE.csv'.D993]);"";['BenchBudEE.csv'.D993]) ->  | E993: of:=IF(ISBLANK(['BenchBudEE.csv'.E993]);"";['BenchBudEE.csv'.E993]) ->  | F993: of:=IF(ISBLANK(['BenchBudEE.csv'.F993]);"";['BenchBudEE.csv'.F993]) ->  | G993: of:=IF(ISNUMBER(SEARCH("[0-9]";[.A993]));MID([.A993];1;SEARCH("[0-9]";[.A993])-1);"") -> 
A994: of:=IF(ISBLANK(['BenchBudEE.csv'.A994]);"";['BenchBudEE.csv'.A994]) ->  | B994: of:=IF(ISBLANK(['BenchBudEE.csv'.B994]);"";['BenchBudEE.csv'.B994]) ->  | C994: of:=IF(ISBLANK(['BenchBudEE.csv'.C1129]);"";MID(['BenchBudEE.csv'.C1129];SEARCH(":";['BenchBudEE.csv'.C1129])+1;100)) ->  | D994: of:=IF(ISBLANK(['BenchBudEE.csv'.D994]);"";['BenchBudEE.csv'.D994]) ->  | E994: of:=IF(ISBLANK(['BenchBudEE.csv'.E994]);"";['BenchBudEE.csv'.E994]) ->  | F994: of:=IF(ISBLANK(['BenchBudEE.csv'.F994]);"";['BenchBudEE.csv'.F994]) ->  | G994: of:=IF(ISNUMBER(SEARCH("[0-9]";[.A994]));MID([.A994];1;SEARCH("[0-9]";[.A994])-1);"") -> 
A995: of:=IF(ISBLANK(['BenchBudEE.csv'.A995]);"";['BenchBudEE.csv'.A995]) ->  | B995: of:=IF(ISBLANK(['BenchBudEE.csv'.B995]);"";['BenchBudEE.csv'.B995]) ->  | C995: of:=IF(ISBLANK(['BenchBudEE.csv'.C1130]);"";MID(['BenchBudEE.csv'.C1130];SEARCH(":";['BenchBudEE.csv'.C1130])+1;100)) ->  | D995: of:=IF(ISBLANK(['BenchBudEE.csv'.D995]);"";['BenchBudEE.csv'.D995]) ->  | E995: of:=IF(ISBLANK(['BenchBudEE.csv'.E995]);"";['BenchBudEE.csv'.E995]) ->  | F995: of:=IF(ISBLANK(['BenchBudEE.csv'.F995]);"";['BenchBudEE.csv'.F995]) ->  | G995: of:=IF(ISNUMBER(SEARCH("[0-9]";[.A995]));MID([.A995];1;SEARCH("[0-9]";[.A995])-1);"") -> 
A996: of:=IF(ISBLANK(['BenchBudEE.csv'.A996]);"";['BenchBudEE.csv'.A996]) ->  | B996: of:=IF(ISBLANK(['BenchBudEE.csv'.B996]);"";['BenchBudEE.csv'.B996]) ->  | C996: of:=IF(ISBLANK(['BenchBudEE.csv'.C1131]);"";MID(['BenchBudEE.csv'.C1131];SEARCH(":";['BenchBudEE.csv'.C1131])+1;100)) ->  | D996: of:=IF(ISBLANK(['BenchBudEE.csv'.D996]);"";['BenchBudEE.csv'.D996]) ->  | E996: of:=IF(ISBLANK(['BenchBudEE.csv'.E996]);"";['BenchBudEE.csv'.E996]) ->  | F996: of:=IF(ISBLANK(['BenchBudEE.csv'.F996]);"";['BenchBudEE.csv'.F996]) ->  | G996: of:=IF(ISNUMBER(SEARCH("[0-9]";[.A996]));MID([.A996];1;SEARCH("[0-9]";[.A996])-1);"") -> 
A997: of:=IF(ISBLANK(['BenchBudEE.csv'.A997]);"";['BenchBudEE.csv'.A997]) ->  | B997: of:=IF(ISBLANK(['BenchBudEE.csv'.B997]);"";['BenchBudEE.csv'.B997]) ->  | C997: of:=IF(ISBLANK(['BenchBudEE.csv'.C1132]);"";MID(['BenchBudEE.csv'.C1132];SEARCH(":";['BenchBudEE.csv'.C1132])+1;100)) ->  | D997: of:=IF(ISBLANK(['BenchBudEE.csv'.D997]);"";['BenchBudEE.csv'.D997]) ->  | E997: of:=IF(ISBLANK(['BenchBudEE.csv'.E997]);"";['BenchBudEE.csv'.E997]) ->  | F997: of:=IF(ISBLANK(['BenchBudEE.csv'.F997]);"";['BenchBudEE.csv'.F997]) ->  | G997: of:=IF(ISNUMBER(SEARCH("[0-9]";[.A997]));MID([.A997];1;SEARCH("[0-9]";[.A997])-1);"") -> 
A998: of:=IF(ISBLANK(['BenchBudEE.csv'.A998]);"";['BenchBudEE.csv'.A998]) ->  | B998: of:=IF(ISBLANK(['BenchBudEE.csv'.B998]);"";['BenchBudEE.csv'.B998]) ->  | C998: of:=IF(ISBLANK(['BenchBudEE.csv'.C1133]);"";MID(['BenchBudEE.csv'.C1133];SEARCH(":";['BenchBudEE.csv'.C1133])+1;100)) ->  | D998: of:=IF(ISBLANK(['BenchBudEE.csv'.D998]);"";['BenchBudEE.csv'.D998]) ->  | E998: of:=IF(ISBLANK(['BenchBudEE.csv'.E998]);"";['BenchBudEE.csv'.E998]) ->  | F998: of:=IF(ISBLANK(['BenchBudEE.csv'.F998]);"";['BenchBudEE.csv'.F998]) ->  | G998: of:=IF(ISNUMBER(SEARCH("[0-9]";[.A998]));MID([.A998];1;SEARCH("[0-9]";[.A998])-1);"") -> 
A999: of:=IF(ISBLANK(['BenchBudEE.csv'.A999]);"";['BenchBudEE.csv'.A999]) ->  | B999: of:=IF(ISBLANK(['BenchBudEE.csv'.B999]);"";['BenchBudEE.csv'.B999]) ->  | C999: of:=IF(ISBLANK(['BenchBudEE.csv'.C1134]);"";MID(['BenchBudEE.csv'.C1134];SEARCH(":";['BenchBudEE.csv'.C1134])+1;100)) ->  | D999: of:=IF(ISBLANK(['BenchBudEE.csv'.D999]);"";['BenchBudEE.csv'.D999]) ->  | E999: of:=IF(ISBLANK(['BenchBudEE.csv'.E999]);"";['BenchBudEE.csv'.E999]) ->  | F999: of:=IF(ISBLANK(['BenchBudEE.csv'.F999]);"";['BenchBudEE.csv'.F999]) ->  | G999: of:=IF(ISNUMBER(SEARCH("[0-9]";[.A999]));MID([.A999];1;SEARCH("[0-9]";[.A999])-1);"") -> 
A1000: of:=IF(ISBLANK(['BenchBudEE.csv'.A1000]);"";['BenchBudEE.csv'.A1000]) ->  | B1000: of:=IF(ISBLANK(['BenchBudEE.csv'.B1000]);"";['BenchBudEE.csv'.B1000]) ->  | C1000: of:=IF(ISBLANK(['BenchBudEE.csv'.C1135]);"";MID(['BenchBudEE.csv'.C1135];SEARCH(":";['BenchBudEE.csv'.C1135])+1;100)) ->  | D1000: of:=IF(ISBLANK(['BenchBudEE.csv'.D1000]);"";['BenchBudEE.csv'.D1000]) ->  | E1000: of:=IF(ISBLANK(['BenchBudEE.csv'.E1000]);"";['BenchBudEE.csv'.E1000]) ->  | F1000: of:=IF(ISBLANK(['BenchBudEE.csv'.F1000]);"";['BenchBudEE.csv'.F1000]) ->  | G1000: of:=IF(ISNUMBER(SEARCH("[0-9]";[.A1000]));MID([.A1000];1;SEARCH("[0-9]";[.A1000])-1);"") -> 

Sheet: BenchBudEE.csv
A1: Reference | B1: Value | C1: Footprint | D1: Datasheet | E1: MFG Name | F1: MFG Part Number
A2: R3 | B2: 100 | C2: SMD_Packages:SM0805
A3: Q1 | B3: MMBT3904-7-F | C3: SMD_Packages:SOT23EBC | E3: Diodes Inc | F3: MMBT3904-7-F
A4: D1 | B4: KP-1608CGCK | C4: LEDs:LED-0603
A5: K1 | B5: G5LA-1 12DC | C5: BenchBudEE:TE-SPDT
A6: R6 | B6: 0 | C6: SMD_Packages:SM0805
A7: R2 | B7: 200 | C7: SMD_Packages:SM0805
A8: R4 | B8: 0 | C8: SMD_Packages:SM0805
A9: R1 | B9: 200 | C9: SMD_Packages:SM0805
A10: D2 | B10: S1M-13-F | C10: Diodes_SMD:Diode-SMA_Standard
A11: U1 | B11: ACPL-217-500E | C11: BenchBudEE:4-SMD | F11: LTV-816S
A12: R5 | B12: 0 | C12: SMD_Packages:SM0805
A13: TP2 | B13: RLY_LOW | C13: BenchBudEE:TestPointTH
A14: TP1 | B14: +12P | C14: BenchBudEE:TestPointTH
A15: U2 | B15: TS19371CX6 RF | C15: SMD_Packages:SOT23_6
A16: C1 | B16: 1u | C16: Capacitors_SMD:c_0805
A17: C2 | B17: 1u | C17: Capacitors_SMD:c_0805
A18: L1 | B18: 22u | C18: BenchBudEE:NR4012 | F18: NR4012T220M
A19: D3 | B19: B0540WS-7 | C19: BenchBudEE:SOD-323 | F19: BO540WS-7
A20: R7 | B20: 4.87 | C20: SMD_Packages:SM0805
A21: P1 | B21: 39-30-1240 | C21: BenchBudEE:ATX_Header | E21: Molex | F21: 39-30-1240
A22: SW1 | B22: OS102011MA1QN1 | C22: BenchBudEE:BB_switch | E22: C&K Components | F22: OS102011MA1QN1
A23: R8 | B23: 0 | C23: SMD_Packages:SM0805
A24: L3 | B24: CM322522-220KL | C24: SMD_Packages:SM1210L | E24: Bourns
A25: C4 | B25: 10u | C25: Capacitors_SMD:c_1206
A26: C3 | B26: 10u | C26: Capacitors_SMD:c_1206
A27: TH1 | B27: MINISMDC050F-2 | C27: SMD_Packages:SM1812 | E27: TE Connectivity | F27: MINISMDC050F-2
A28: TH2 | B28: MINISMDC050F-2 | C28: SMD_Packages:SM1812 | E28: TE Connectivity | F28: MINISMDC050F-2
A29: TH3 | B29: MINISMDC050F-2 | C29: SMD_Packages:SM1812 | E29: TE Connectivity | F29: MINISMDC050F-2
A30: TH4 | B30: MINISMDC050F-2 | C30: SMD_Packages:SM1812 | E30: TE Connectivity | F30: MINISMDC050F-2
A31: L4 | B31: CM322522-220KL | C31: SMD_Packages:SM1210L | E31: Bourns
A32: C13 | B32: 10u | C32: Capacitors_SMD:c_1206
A33: L2 | B33: CM322522-220KL | C33: SMD_Packages:SM1210L | E33: Bourns
A34: STAR1 | B34: CONN_1 | C34: Connect:1pin
A35: JP1 | B35: JUMPER | C35: BenchBudEE:GND_POINT
A36: JP2 | B36: JUMPER | C36: BenchBudEE:GND_POINT
A37: JP3 | B37: JUMPER | C37: BenchBudEE:GND_POINT
A38: JP4 | B38: JUMPER | C38: BenchBudEE:GND_POINT
A39: P4 | B39: CTB0355/12 | C39: BenchBudEE:12pinTB | E39: On Shore | F39: OSTTE120104
A40: P5 | B40: 20.501M/3 | C40: BenchBudEE:3pinTB | E40: Phoenix | F40: 1935174
A41: R56 | B41: 0 | C41: SMD_Packages:SM0805
A42: C26 | B42: 10u | C42: Capacitors_SMD:c_1210
A43: C27 | B43: 10u | C43: Capacitors_SMD:c_1210
A44: C28 | B44: 10u | C44: Capacitors_SMD:c_1210
A45: C29 | B45: 10u | C45: Capacitors_SMD:c_1210
A46: R11 | B46: 715 | C46: SMD_Packages:SM0805
A47: U3 | B47: LM317TG | C47: Transistors_TO-220:TO-220_Neutral123_Vertical
A48: R10 | B48: 715 | C48: SMD_Packages:SM0805
A49: R15 | B49: 1K | C49: SMD_Packages:SM0805
A50: R16 | B50: 3K | C50: SMD_Packages:SM0805
A51: R18 | B51: 1K | C51: SMD_Packages:SM0805
A52: R17 | B52: 3K | C52: SMD_Packages:SM0805
A53: R12 | B53: 3310C-1-502L | C53: BenchBudEE:EVUE3K
A54: R9 | B54: 3310C-1-502L | C54: BenchBudEE:EVUE3K
A55: U4 | B55: LM317TG | C55: Transistors_TO-220:TO-220_Neutral123_Vertical
A56: R51 | B56: 1.3K | C56: SMD_Packages:SM0805
A57: R52 | B57: 9.1K | C57: SMD_Packages:SM0805
A58: U6 | B58: LM337TG | C58: Transistors_TO-220:TO-220_Neutral123_Vertical
A59: R54 | B59: 1.3K | C59: SMD_Packages:SM0805
A60: R53 | B60: 9.1K | C60: SMD_Packages:SM0805
A61: U5 | B61: LM337TG | C61: Transistors_TO-220:TO-220_Neutral123_Vertical
A62: C17 | B62: 10u | C62: Capacitors_SMD:c_0805
A63: C15 | B63: 10u | C63: Capacitors_SMD:c_0805
A64: C14 | B64: 10u | C64: Capacitors_SMD:c_0805
A65: C16 | B65: 10u | C65: Capacitors_SMD:c_0805
A66: C19 | B66: .01u | C66: Capacitors_SMD:c_0805
A67: C18 | B67: .01u | C67: Capacitors_SMD:c_0805
A68: C24 | B68: 10u | C68: Capacitors_SMD:c_0805
A69: C25 | B69: 10u | C69: Capacitors_SMD:c_0805
A70: C20 | B70: .01u | C70: Capacitors_SMD:c_0805
A71: C21 | B71: .01u | C71: Capacitors_SMD:c_0805
A72: D12 | B72: MMBD914-7-F | C72: BenchBudEE:SOT23-DIODE | E72: Diodes Inc | F72: MMBD914-7-F
A73: C22 | B73: 10u | C73: Capacitors_SMD:c_0805
A74: C23 | B74: 10u | C74: Capacitors_SMD:c_0805
A75: D7 | B75: MMBD914-7-F | C75: BenchBudEE:SOT23-DIODE | E75: Diodes Inc | F75: MMBD914-7-F
A76: D10 | B76: MMBD914-7-F | C76: BenchBudEE:SOT23-DIODE | E76: Diodes Inc | F76: MMBD914-7-F
A77: D6 | B77: MMBD914-7-F | C77: BenchBudEE:SOT23-DIODE | E77: Diodes Inc | F77: MMBD914-7-F
A78: D9 | B78: MMBD914-7-F | C78: BenchBudEE:SOT23-DIODE | E78: Diodes Inc | F78: MMBD914-7-F
A79: D5 | B79: MMBD914-7-F | C79: BenchBudEE:SOT23-DIODE | E79: Diodes Inc | F79: MMBD914-7-F
A80: D11 | B80: MMBD914-7-F | C80: BenchBudEE:SOT23-DIODE | E80: Diodes Inc | F80: MMBD914-7-F
A81: D8 | B81: MMBD914-7-F | C81: BenchBudEE:SOT23-DIODE | E81: Diodes Inc | F81: MMBD914-7-F
A82: R57 | B82: 0 | C82: SMD_Packages:SM0805
A83: P6 | B83: MC33282 | C83: BenchBudEE:V8508H
A84: R58 | B84: 0 | C84: SMD_Packages:SM0805
A85: P7 | B85: MC33282 | C85: BenchBudEE:V8508H
A86: TP6 | B86: GND_PWR | C86: BenchBudEE:TestPointTH
A87: K3 | B87: SPC20484 | C87: Pin_Headers:Pin_Header_Straight_1x03
A88: K2 | B88: SPC20484 | C88: Pin_Headers:Pin_Header_Straight_1x03
A89: TP3 | B89: AGND | C89: BenchBudEE:TestPointTH
A90: U11 | B90: OPA4170AID | C90: SMD_Packages:SO14E
A91: R20 | B91: 1 | C91: SMD_Packages:SM1206
A92: R19 | B92: 0 | C92: SMD_Packages:SM0805
A93: TH5 | B93: MINISMDC050F-2 | C93: SMD_Packages:SM1812 | E93: TE Connectivity | F93: MINISMDC050F-2
A94: D4 | B94: S1M-13-F | C94: Diodes_SMD:Diode-SMA_Standard | E94: Diodes Inc | F94: B130-13-F
A95: U8 | B95: MCP4801-E/SN | C95: SMD_Packages:SO8N
A96: C11 | B96: 1u | C96: Capacitors_SMD:c_0805
A97: C12 | B97: 1u | C97: Capacitors_SMD:c_0805
A98: Q4 | B98: FDD6630A | C98: SMD_Packages:DPAK2 | E98: Alpha and Omega | F98: AOD476
A99: Q3 | B99: FDD6630A | C99: SMD_Packages:DPAK2 | E99: Alpha and Omega | F99: AOD476
A100: Q2 | B100: 2N7002 | C100: SMD_Packages:SOT23EBC | E100: Diodes Inc | F100: DMN65D8L-7
A101: TP7 | B101: DAC_OUT | C101: BenchBudEE:TestPointTH
A102: R60 | B102: 0 | C102: SMD_Packages:SM0805
A103: C32 | B103: NOPOP | C103: Capacitors_SMD:c_0805
A104: R61 | B104: 0 | C104: SMD_Packages:SM0805
A105: C33 | B105: 1u | C105: Capacitors_SMD:c_0805
A106: R59 | B106: 0 | C106: SMD_Packages:SM0805
A107: R25 | B107: 5K | C107: SMD_Packages:SM0805
A108: R27 | B108: 5K | C108: SMD_Packages:SM0805
A109: R23 | B109: 200K | C109: SMD_Packages:SM1206
A110: R21 | B110: 5K | C110: SMD_Packages:SM1206
A111: R24 | B111: 200K | C111: SMD_Packages:SM1206
A112: R22 | B112: 5K | C112: SMD_Packages:SM1206
A113: U9 | B113: MCP3901A0-I/SS | C113: SMD_Packages:SSOP20
A114: C7 | B114: 100p | C114: Capacitors_SMD:c_0805
A115: P3 | B115: SPC20484 | C115: Pin_Headers:Pin_Header_Straight_2x03
A116: R26 | B116: 10 | C116: SMD_Packages:SM0805
A117: R43 | B117: 100 | C117: SMD_Packages:SM0805
A118: R44 | B118: 1K | C118: SMD_Packages:SM0805
A119: U10 | B119: LMT84DCKT | C119: SMD_Packages:SOT353
A120: C10 | B120: 1u | C120: Capacitors_SMD:c_0805
A121: C8 | B121: 1u | C121: Capacitors_SMD:c_0805
A122: C9 | B122: 1u | C122: Capacitors_SMD:c_0805
A123: C6 | B123: 1u | C123: Capacitors_SMD:c_0805
A124: C5 | B124: 1u | C124: Capacitors_SMD:c_0805
A125: R48 | B125: 0 | C125: SMD_Packages:SM0805
A126: R47 | B126: 0 | C126: SMD_Packages:SM0805
A127: L5 | B127: 1u | C127: SMD_Packages:SM0805
A128: C30 | B128: NOPOP | C128: Capacitors_SMD:c_0805
A129: C31 | B129: NOPOP | C129: Capacitors_SMD:c_0805
A130: R65 | B130: 0 | C130: SMD_Packages:SM0805
A131: TP10 | B131: CH0+ | C131: BenchBudEE:TestPointTH
A132: TP9 | B132: CH1+ | C132: BenchBudEE:TestPointTH
A133: TP8 | B133: +5V | C133: BenchBudEE:TestPointTH
A134: R63 | B134: 0 | C134: SMD_Packages:SM0805
A135: R64 | B135: 1K | C135: SMD_Packages:SM0805
A136: R62 | B136: 1K | C136: SMD_Packages:SM0805
A137: ARD1 | B137: A000066 | C137: BenchBudEE:Arduino
A138: R36 | B138: 0 | C138: BenchBudEE:Resistor_SMD0805_Blob
A139: R40 | B139: 0 | C139: BenchBudEE:Resistor_SMD0805_Blob
A140: R32 | B140: 0 | C140: BenchBudEE:Resistor_SMD0805_Blob
A141: R31 | B141: 0 | C141: BenchBudEE:Resistor_SMD0805_Blob
A142: R30 | B142: 0 | C142: BenchBudEE:Resistor_SMD0805_Blob
A143: R29 | B143: 0 | C143: BenchBudEE:Resistor_SMD0805_Blob
A144: R34 | B144: 0 | C144: BenchBudEE:Resistor_SMD0805_Blob
A145: R33 | B145: 0 | C145: BenchBudEE:Resistor_SMD0805_Blob
A146: R39 | B146: 0 | C146: BenchBudEE:Resistor_SMD0805_Blob
A147: R35 | B147: 0 | C147: BenchBudEE:Resistor_SMD0805_Blob
A148: R42 | B148: 0 | C148: BenchBudEE:Resistor_SMD0805_Blob
A149: R37 | B149: 0 | C149: BenchBudEE:Resistor_SMD0805_Blob
A150: R38 | B150: 0 | C150: BenchBudEE:Resistor_SMD0805_Blob
A151: R41 | B151: 0 | C151: BenchBudEE:Resistor_SMD0805_Blob
A152: R28 | B152: 0 | C152: BenchBudEE:Resistor_SMD0805_Blob
A153: R45 | B153: 0 | C153: BenchBudEE:Resistor_SMD0805_Blob
A154: R46 | B154: 0 | C154: BenchBudEE:Resistor_SMD0805_Blob
A155: R49 | B155: 0 | C155: BenchBudEE:Resistor_SMD0805_Blob
A156: R50 | B156: 0 | C156: BenchBudEE:Resistor_SMD0805_Blob
A157: R13 | B157: 0 | C157: BenchBudEE:Resistor_SMD0805_Blob
A158: R14 | B158: 0 | C158: BenchBudEE:Resistor_SMD0805_Blob
A159: R55 | B159: 0 | C159: BenchBudEE:Resistor_SMD0805_Blob

Sheet: Parts
A1: Key | B1: Type | C1: Footprint | D1: MFG | E1: MFG Part No. | F1: Farnell Part No. | G1: RS Part No. | H1: Price | I1: MOQ | J1: Quantity | K1: Quantity 1 | L1: Price 1 | M1: Quantity 2 | N1: Price 2 | O1: Quantity 3 | P1: Price 3 | Q1: Link | R1: Part Index | S1: Section | T1: Device | U1: 2nd
A2: of:=[.B2]&[.C2]&[.E2] -> QSMD_Packages:DPAK2 | B2: Q | C2: SMD_Packages:DPAK2 | L2: of:=IF(ISBLANK([.K2]);"";[.K2]*[.$H2]) ->  | N2: of:=IF(ISBLANK([.M2]);"";[.M2]*[.$H2]) ->  | P2: of:=IF(ISBLANK([.O2]);"";[.O2]*[.$H2]) ->  | R2: 1 | S2: Current/Fan | T2: Power/Mode FET | U2: y
A3: of:=[.B3]&[.C3]&[.E3] -> QSMD_Packages:DPAK2FDD6630A | B3: Q | C3: of:=[.C2] -> SMD_Packages:DPAK2 | D3: Fairchild Semiconductor | E3: FDD6630A | F3: 2322585 | H3: 236.18 | I3: 1 | J3: 2 | K3: of:=MAX([.I3];[.J3]) -> 2 | L3: of:=IF(ISBLANK([.K3]);"";[.K3]*[.$H3]) -> 472.36 | M3: 5 | N3: of:=IF(ISBLANK([.M3]);"";[.M3]*[.$H3]) -> 1180.9 | O3: 5 | P3: of:=IF(ISBLANK([.O3]);"";[.O3]*[.$H3]) -> 1180.9 | Q3: http://hu.farnell.com/jsp/search/productdetail.jsp?sku=2322585 | R3: 1 | S3: of:=[.S2] -> Current/Fan | T3: of:=[.T2] -> Power/Mode FET | U3: y
A4: of:=[.B4]&[.C4]&[.E4] -> QSMD_Packages:SOT23EBC | B4: Q | C4: SMD_Packages:SOT23EBC | L4: of:=IF(ISBLANK([.K4]);"";[.K4]*[.$H4]) ->  | N4: of:=IF(ISBLANK([.M4]);"";[.M4]*[.$H4]) ->  | P4: of:=IF(ISBLANK([.O4]);"";[.O4]*[.$H4]) ->  | R4: 2 | S4: Current/Fan | T4: Signal FET | U4: y
A5: of:=[.B5]&[.C5]&[.E5] -> QSMD_Packages:SOT23EBC2N7002 | B5: Q | C5: of:=[.C4] -> SMD_Packages:SOT23EBC | D5: NXP | E5: 2N7002 | F5: 1510761 | H5: 11.43 | I5: 5 | J5: 1 | K5: of:=MAX([.I5];[.J5]) -> 5 | L5: of:=IF(ISBLANK([.K5]);"";[.K5]*[.$H5]) -> 57.15 | M5: 5 | N5: of:=IF(ISBLANK([.M5]);"";[.M5]*[.$H5]) -> 57.15 | O5: 5 | P5: of:=IF(ISBLANK([.O5]);"";[.O5]*[.$H5]) -> 57.15 | Q5: http://hu.farnell.com/nxp/2n7002/mosfet-n-ch-60v-0-3a-sot23/dp/1510761 | R5: 2 | S5: of:=[.S4] -> Current/Fan | T5: of:=[.T4] -> Signal FET | U5: y
A6: of:=[.B6]&[.C6]&[.E6] -> MINISMDC050F-2 | D6: TE Connectivity | E6: MINISMDC050F-2 | F6: 1175839 | H6: 110.47 | I6: 5 | J6: 1 | L6: of:=IF(ISBLANK([.K6]);"";[.K6]*[.$H6]) ->  | N6: of:=IF(ISBLANK([.M6]);"";[.M6]*[.$H6]) ->  | P6: of:=IF(ISBLANK([.O6]);"";[.O6]*[.$H6]) ->  | Q6: http://hu.farnell.com/te-connectivity-raychem/minismdc050f-2/polyswitch-0-5a-24v-smd/dp/1175839 | R6: 3 | S6: Current/Fan | T6: PTC
A7: of:=[.B7]&[.C7]&[.E7] -> USMD_Packages:SO8NMCP4801-E/SN | B7: U | C7: SMD_Packages:SO8N | D7: Microchip | E7: MCP4801-E/SN | H7: 250 | I7: 5 | J7: 1 | K7: 5 | L7: of:=IF(ISBLANK([.K7]);"";[.K7]*[.$H7]) -> 1250 | M7: 5 | N7: of:=IF(ISBLANK([.M7]);"";[.M7]*[.$H7]) -> 1250 | O7: 5 | P7: of:=IF(ISBLANK([.O7]);"";[.O7]*[.$H7]) -> 1250 | Q7: http://www.microchipdirect.com/ProductSearch.aspx?Keywords=MCP4801-E/SN | R7: 4 | S7: Current/Fan | T7: MCP4801
A8: of:=[.B8]&[.C8]&[.E8] -> PBenchBudEE:3pinTB20.501M/3 | B8: P | C8: BenchBudEE:3pinTB | D8: IMO Precision Controls | E8: 20.501M/3 | F8: 9632980 | H8: 129.52 | I8: 1 | J8: 1 | K8: of:=MAX([.I8];[.J8]) -> 1 | L8: of:=IF(ISBLANK([.K8]);"";[.K8]*[.$H8]) -> 129.52 | M8: 3 | N8: of:=IF(ISBLANK([.M8]);"";[.M8]*[.$H8]) -> 388.56 | O8: 1 | P8: of:=IF(ISBLANK([.O8]);"";[.O8]*[.$H8]) -> 129.52 | Q8: http://hu.farnell.com/imo-precision-controls/20-501m-3/terminal-block-pcb-3way-21-14awg/dp/9632980 | R8: 5 | S8: Interface | T8: 3 pin 5.0mm Terminal Block
A9: of:=[.B9]&[.C9]&[.E9] -> PBenchBudEE:12pinTB | B9: P | C9: BenchBudEE:12pinTB | L9: of:=IF(ISBLANK([.K9]);"";[.K9]*[.$H9]) ->  | N9: of:=IF(ISBLANK([.M9]);"";[.M9]*[.$H9]) ->  | P9: of:=IF(ISBLANK([.O9]);"";[.O9]*[.$H9]) ->  | R9: 6 | S9: Interface | T9: 12 input 3.5 mm Terminal Block | U9: y
A10: of:=[.B10]&[.C10]&[.E10] -> PBenchBudEE:12pinTB1984714 | B10: P | C10: of:=[.C9] -> BenchBudEE:12pinTB | D10: Phoenix Contact | E10: 1984714 | G10: 648-8793 | H10: 500 | I10: 1 | J10: 1 | L10: of:=IF(ISBLANK([.K10]);"";[.K10]*[.$H10]) ->  | N10: of:=IF(ISBLANK([.M10]);"";[.M10]*[.$H10]) ->  | P10: of:=IF(ISBLANK([.O10]);"";[.O10]*[.$H10]) ->  | Q10: http://hu.rs-online.com/web/p/biztositek-nelkuli-sorkapcsok/6488793/ | R10: 6 | S10: of:=[.S9] -> Interface | T10: of:=[.T9] -> 12 input 3.5 mm Terminal Block | U10: y
A11: of:=[.B11]&[.C11]&[.E11] -> PBenchBudEE:12pinTB25.195.1253.0 | B11: P | C11: of:=[.C9] -> BenchBudEE:12pinTB | D11: Wieland Electric | E11: 25.195.1253.0 | F11: 1172825 | H11: 1321.83 | I11: 5 | J11: 1 | L11: of:=IF(ISBLANK([.K11]);"";[.K11]*[.$H11]) ->  | N11: of:=IF(ISBLANK([.M11]);"";[.M11]*[.$H11]) ->  | P11: of:=IF(ISBLANK([.O11]);"";[.O11]*[.$H11]) ->  | Q11: http://hu.farnell.com/wieland-electric/25-195-1253-0/terminal-block-3-5mm-12way/dp/1172825 | R11: 6 | S11: of:=[.S9] -> Interface | T11: of:=[.T9] -> 12 input 3.5 mm Terminal Block | U11: y
A12: of:=[.B12]&[.C12]&[.E12] -> PBenchBudEE:12pinTBCTB0355/12 | B12: P | C12: of:=[.C9] -> BenchBudEE:12pinTB | D12: CamdenBoss | E12: CTB0355/12 | F12: 2315251 | H12: 1146.6 | I12: 1 | J12: 1 | K12: of:=MAX([.I12];[.J12]) -> 1 | L12: of:=IF(ISBLANK([.K12]);"";[.K12]*[.$H12]) -> 1146.6 | M12: 3 | N12: of:=IF(ISBLANK([.M12]);"";[.M12]*[.$H12]) -> 3439.8 | O12: 1 | P12: of:=IF(ISBLANK([.O12]);"";[.O12]*[.$H12]) -> 1146.6 | Q12: http://hu.farnell.com/camdenboss/ctb0355-12/terminal-block-stanadrd-12p-30/dp/2315251 | R12: 6 | S12: of:=[.S9] -> Interface | T12: of:=[.T9] -> 12 input 3.5 mm Terminal Block
A13: of:=[.B13]&[.C13]&[.E13] -> PBenchBudEE:ATX_Header39-30-1240 | B13: P | C13: BenchBudEE:ATX_Header | D13: Molex | E13: 39-30-1240 | F13: 9963472 | H13: 860.9 | I13: 1 | J13: 1 | K13: of:=MAX([.I13];[.J13]) -> 1 | L13: of:=IF(ISBLANK([.K13]);"";[.K13]*[.$H13]) -> 860.9 | M13: 3 | N13: of:=IF(ISBLANK([.M13]);"";[.M13]*[.$H13]) -> 2582.7 | O13: 1 | P13: of:=IF(ISBLANK([.O13]);"";[.O13]*[.$H13]) -> 860.9 | Q13: http://hu.farnell.com/molex/39-30-1240/header-mini-fit-r-a-w-peg-24way/dp/9963472 | R13: 7 | S13: Interface | T13: ATX connector
A14: of:=[.B14]&[.C14]&[.E14] -> PPin_Headers:Pin_Header_Straight_2x03SPC20484 | B14: P | C14: Pin_Headers:Pin_Header_Straight_2x03 | D14: Multicomp | E14: SPC20484 | F14: 1462888 | H14: 327.6 | I14: 1 | J14: 1 | K14: of:=MAX([.I14];[.J14]) -> 1 | L14: of:=IF(ISBLANK([.K14]);"";[.K14]*[.$H14]) -> 327.6 | M14: 3 | N14: of:=IF(ISBLANK([.M14]);"";[.M14]*[.$H14]) -> 982.8 | O14: 1 | P14: of:=IF(ISBLANK([.O14]);"";[.O14]*[.$H14]) -> 327.6 | Q14: http://hu.farnell.com/multicomp/spc20484/header-1row-40way/dp/1462888 | R14: 8 | S14: Interface | T14: 36 pin Breakaway | U14: y
A15: of:=[.B15]&[.C15]&[.E15] -> KPin_Headers:Pin_Header_Straight_1x03SPC20484 | B15: K | C15: Pin_Headers:Pin_Header_Straight_1x03 | D15: Multicomp | E15: SPC20484 | F15: 1462888 | H15: 327.6 | I15: 1 | J15: 1 | K15: of:=MAX([.I15];[.J15]) -> 1 | L15: of:=IF(ISBLANK([.K15]);"";[.K15]*[.$H15]) -> 327.6 | M15: 3 | N15: of:=IF(ISBLANK([.M15]);"";[.M15]*[.$H15]) -> 982.8 | O15: 1 | P15: of:=IF(ISBLANK([.O15]);"";[.O15]*[.$H15]) -> 327.6 | Q15: http://hu.farnell.com/multicomp/spc20484/header-1row-40way/dp/1462888 | R15: 8 | S15: Interface | T15: 36 pin Breakaway | U15: y
A16: of:=[.B16]&[.C16]&[.E16] -> USMD_Packages:SOT23_6AP5726WG-7 | B16: U | C16: SMD_Packages:SOT23_6 | D16: Diodes Inc. | E16: AP5726WG-7 | G16: 751-3017 | H16: 99 | I16: 25 | J16: 1 | L16: of:=IF(ISBLANK([.K16]);"";[.K16]*[.$H16]) ->  | N16: of:=IF(ISBLANK([.M16]);"";[.M16]*[.$H16]) ->  | P16: of:=IF(ISBLANK([.O16]);"";[.O16]*[.$H16]) ->  | Q16: http://hu.rs-online.com/web/p/led-kijelzomeghajto/7513017/ | R16: 9 | S16: LED | T16: AP5726
A17: of:=[.B17]&[.C17]&[.E17] -> USMD_Packages:SOT23_6TS19371CX6 RF | B17: U | C17: of:=[.C16] -> SMD_Packages:SOT23_6 | D17: Taiwan Semiconductor | E17: TS19371CX6 RF | F17: 1824780 | H17: 319.98 | I17: 1 | J17: 1 | K17: of:=MAX([.I17];[.J17]) -> 1 | L17: of:=IF(ISBLANK([.K17]);"";[.K17]*[.$H17]) -> 319.98 | M17: 3 | N17: of:=IF(ISBLANK([.M17]);"";[.M17]*[.$H17]) -> 959.94 | O17: 2 | P17: of:=IF(ISBLANK([.O17]);"";[.O17]*[.$H17]) -> 639.96 | Q17: http://hu.farnell.com/taiwan-semiconductor/ts19371cx6-rf/ic-led-driver-sot26-6/dp/1824780 | R17: 9
A18: of:=[.B18]&[.C18]&[.E18] -> DBenchBudEE:SOD-323B0540WS-7 | B18: D | C18: BenchBudEE:SOD-323 | D18: Diodes Inc. | E18: B0540WS-7 | F18: 1773477 | H18: 163.8 | I18: 1 | J18: 1 | K18: of:=MAX([.I18];[.J18]) -> 1 | L18: of:=IF(ISBLANK([.K18]);"";[.K18]*[.$H18]) -> 163.8 | M18: 3 | N18: of:=IF(ISBLANK([.M18]);"";[.M18]*[.$H18]) -> 491.4 | O18: 2 | P18: of:=IF(ISBLANK([.O18]);"";[.O18]*[.$H18]) -> 327.6 | Q18: http://hu.farnell.com/diodes-inc/b0540ws-7/diode-scky-recti-0-5a-40v-sod323/dp/1773477 | R18: 10 | S18: LED | T18: B0540WS-7
A19: of:=[.B19]&[.C19]&[.E19] -> UTransistors_TO-220:TO-220_Neutral123_Vertical | B19: U | C19: Transistors_TO-220:TO-220_Neutral123_Vertical | L19: of:=IF(ISBLANK([.K19]);"";[.K19]*[.$H19]) ->  | N19: of:=IF(ISBLANK([.M19]);"";[.M19]*[.$H19]) ->  | P19: of:=IF(ISBLANK([.O19]);"";[.O19]*[.$H19]) ->  | R19: 12 | S19: Power Modify | T19: 10V linear | U19: y
A20: of:=[.B20]&[.C20]&[.E20] -> UTransistors_TO-220:TO-220_Neutral123_VerticalLM317TG | B20: U | C20: of:=[.C19] -> Transistors_TO-220:TO-220_Neutral123_Vertical | D20: ON Semiconductor | E20: LM317TG | F20: 1652293 | H20: 186.66 | I20: 1 | J20: 2 | K20: of:=MAX([.I20];[.J20]) -> 2 | L20: of:=IF(ISBLANK([.K20]);"";[.K20]*[.$H20]) -> 373.32 | M20: 5 | N20: of:=IF(ISBLANK([.M20]);"";[.M20]*[.$H20]) -> 933.3 | O20: 3 | P20: of:=IF(ISBLANK([.O20]);"";[.O20]*[.$H20]) -> 559.98 | Q20: http://hu.farnell.com/on-semiconductor/lm317tg/ic-voltage-regulator/dp/1652293 | R20: 12 | S20: of:=[.S19] -> Power Modify | T20: of:=[.T19] -> 10V linear | U20: y
A21: of:=[.B21]&[.C21]&[.E21] -> UTransistors_TO-220:TO-220_Neutral123_Vertical | B21: U | C21: Transistors_TO-220:TO-220_Neutral123_Vertical | L21: of:=IF(ISBLANK([.K21]);"";[.K21]*[.$H21]) ->  | N21: of:=IF(ISBLANK([.M21]);"";[.M21]*[.$H21]) ->  | P21: of:=IF(ISBLANK([.O21]);"";[.O21]*[.$H21]) ->  | R21: 13 | S21: Power Modify | T21: -10V linear | U21: y
A22: of:=[.B22]&[.C22]&[.E22] -> UTransistors_TO-220:TO-220_Neutral123_VerticalLM337TG | B22: U | C22: of:=[.C21] -> Transistors_TO-220:TO-220_Neutral123_Vertical | D22: ON Semiconductor | E22: LM337TG | F22: 1211104 | H22: 236.18 | I22: 1 | J22: 2 | K22: of:=MAX([.I22];[.J22]) -> 2 | L22: of:=IF(ISBLANK([.K22]);"";[.K22]*[.$H22]) -> 472.36 | M22: 5 | N22: of:=IF(ISBLANK([.M22]);"";[.M22]*[.$H22]) -> 1180.9 | O22: 3 | P22: of:=IF(ISBLANK([.O22]);"";[.O22]*[.$H22]) -> 708.54 | Q22: http://hu.farnell.com/on-semiconductor/lm337tg/v-reg-adj-1-2-37v-to-220-3-337/dp/1211104 | R22: 13 | S22: of:=[.S21] -> Power Modify | T22: of:=[.T21] -> -10V linear | U22: y
A23: of:=[.B23]&[.C23]&[.E23] -> RBenchBudEE:EVUE3K | B23: R | C23: BenchBudEE:EVUE3K | L23: of:=IF(ISBLANK([.K23]);"";[.K23]*[.$H23]) ->  | N23: of:=IF(ISBLANK([.M23]);"";[.M23]*[.$H23]) ->  | P23: of:=IF(ISBLANK([.O23]);"";[.O23]*[.$H23]) ->  | R23: 16 | S23: Power Modify | T23: Potentiometer | U23: y*
A24: of:=[.B24]&[.C24]&[.E24] -> RBenchBudEE:EVUE3K3310C-1-502L | B24: R | C24: of:=[.C23] -> BenchBudEE:EVUE3K | D24: Bourns | E24: 3310C-1-502L | F24: 9353895 | H24: 1020.89 | I24: 1 | J24: 2 | K24: of:=MAX([.I24];[.J24]) -> 2 | L24: of:=IF(ISBLANK([.K24]);"";[.K24]*[.$H24]) -> 2041.78 | M24: 5 | N24: of:=IF(ISBLANK([.M24]);"";[.M24]*[.$H24]) -> 5104.45 | O24: 2 | P24: of:=IF(ISBLANK([.O24]);"";[.O24]*[.$H24]) -> 2041.78 | Q24: http://hu.farnell.com/bourns/3310c-1-502l/potentiometer-5k/dp/9353895?Ntt=3310C-1-502L | R24: 16 | S24: of:=[.S23] -> Power Modify | T24: of:=[.T23] -> Potentiometer | U24: y*
A25: of:=[.B25]&[.C25]&[.E25] -> DDiodes_SMD:Diode-SMA_StandardS1M-13-F | B25: D | C25: Diodes_SMD:Diode-SMA_Standard | D25: Diodes Inc. | E25: S1M-13-F | F25: 1773482 | H25: 59.43 | I25: 1 | J25: 8 | K25: of:=MAX([.I25];[.J25]) -> 8 | L25: of:=IF(ISBLANK([.K25]);"";[.K25]*[.$H25]) -> 475.44 | M25: 20 | N25: of:=IF(ISBLANK([.M25]);"";[.M25]*[.$H25]) -> 1188.6 | O25: 10 | P25: of:=IF(ISBLANK([.O25]);"";[.O25]*[.$H25]) -> 594.3 | Q25: http://hu.farnell.com/diodes-inc/s1m-13-f/diode-stand-rec-gpp-1a-1000v-sma/dp/1773482 | R25: 17 | S25: Power Modify | T25: Diode
A26: of:=[.B26]&[.C26]&[.E26] -> THSMD_Packages:SM1812MINISMDC050F-2 | B26: TH | C26: SMD_Packages:SM1812 | D26: TE Connectivity | E26: MINISMDC050F-2 | F26: 1175839 | H26: 110.47 | I26: 5 | J26: 4 | K26: of:=MAX([.I26];[.J26]) -> 5 | L26: of:=IF(ISBLANK([.K26]);"";[.K26]*[.$H26]) -> 552.35 | M26: 15 | N26: of:=IF(ISBLANK([.M26]);"";[.M26]*[.$H26]) -> 1657.05 | O26: 5 | P26: of:=IF(ISBLANK([.O26]);"";[.O26]*[.$H26]) -> 552.35 | Q26: http://hu.farnell.com/te-connectivity-raychem/minismdc050f-2/polyswitch-0-5a-24v-smd/dp/1175839 | R26: 18 | S26: Protection/Filtering | T26: PTC
A27: of:=[.B27]&[.C27]&[.E27] -> SWBenchBudEE:BB_switchOS102011MA1QN1 | B27: SW | C27: BenchBudEE:BB_switch | D27: C&K Components | E27: OS102011MA1QN1 | F27: 1201431 | H27: 171.42 | I27: 5 | J27: 1 | K27: of:=MAX([.I27];[.J27]) -> 5 | L27: of:=IF(ISBLANK([.K27]);"";[.K27]*[.$H27]) -> 857.1 | M27: 5 | N27: of:=IF(ISBLANK([.M27]);"";[.M27]*[.$H27]) -> 857.1 | O27: 5 | P27: of:=IF(ISBLANK([.O27]);"";[.O27]*[.$H27]) -> 857.1 | Q27: http://hu.farnell.com/c-k-components/os102011ma1qn1/switch-spdt-0-1a-12v-pcb-r-a/dp/1201431 | R27: 20 | S27: Protection/Filtering | T27: Switch
A28: of:=[.B28]&[.C28]&[.E28] -> KBenchBudEE:TE-SPDT | B28: K | C28: BenchBudEE:TE-SPDT | L28: of:=IF(ISBLANK([.K28]);"";[.K28]*[.$H28]) ->  | N28: of:=IF(ISBLANK([.M28]);"";[.M28]*[.$H28]) ->  | P28: of:=IF(ISBLANK([.O28]);"";[.O28]*[.$H28]) ->  | R28: 21 | S28: Relay | T28: SPDT | U28: y
A29: of:=[.B29]&[.C29]&[.E29] -> KBenchBudEE:TE-SPDTG5LA-1 12DC | B29: K | C29: of:=[.C28] -> BenchBudEE:TE-SPDT | D29: Omron | E29: G5LA-1 12DC | F29: 1455504 | H29: 247.61 | I29: 1 | J29: 1 | K29: of:=MAX([.I29];[.J29]) -> 1 | L29: of:=IF(ISBLANK([.K29]);"";[.K29]*[.$H29]) -> 247.61 | M29: 3 | N29: of:=IF(ISBLANK([.M29]);"";[.M29]*[.$H29]) -> 742.83 | O29: 1 | P29: of:=IF(ISBLANK([.O29]);"";[.O29]*[.$H29]) -> 247.61 | Q29: http://hu.farnell.com/omron-electronic-components/g5la-1-12dc/relay-pcb-spdt-12vdc-10a/dp/1455504 | R29: 21 | S29: of:=[.S28] -> Relay | T29: of:=[.T28] -> SPDT | U29: y
A30: of:=[.B30]&[.C30]&[.E30] -> QSMD_Packages:SOT23EBCMMBT3904-7-F | B30: Q | C30: SMD_Packages:SOT23EBC | D30: Diodes Inc. | E30: MMBT3904-7-F | F30: 1773602 | H30: 17.52 | I30: 1 | J30: 1 | K30: of:=MAX([.I30];[.J30]) -> 1 | L30: of:=IF(ISBLANK([.K30]);"";[.K30]*[.$H30]) -> 17.52 | M30: 3 | N30: of:=IF(ISBLANK([.M30]);"";[.M30]*[.$H30]) -> 52.56 | O30: 3 | P30: of:=IF(ISBLANK([.O30]);"";[.O30]*[.$H30]) -> 52.56 | Q30: http://hu.farnell.com/diodes-inc/mmbt3904-7-f/transistor-npn-sot23/dp/1773602 | R30: 22 | S30: Relay | T30: NPN (MMBT3904)
A31: of:=[.B31]&[.C31]&[.E31] -> UBenchBudEE:4-SMD | B31: U | C31: BenchBudEE:4-SMD | L31: of:=IF(ISBLANK([.K31]);"";[.K31]*[.$H31]) ->  | N31: of:=IF(ISBLANK([.M31]);"";[.M31]*[.$H31]) ->  | P31: of:=IF(ISBLANK([.O31]);"";[.O31]*[.$H31]) ->  | R31: 23 | S31: Relay | T31: Opto | U31: y
A32: of:=[.B32]&[.C32]&[.E32] -> UBenchBudEE:4-SMDACPL-217-500E | B32: U | C32: of:=[.C31] -> BenchBudEE:4-SMD | D32: Avago Technologies | E32: ACPL-217-500E | F32: 1602614 | H32: 91.8 | I32: 1 | J32: 1 | K32: of:=MAX([.I32];[.J32]) -> 1 | L32: of:=IF(ISBLANK([.K32]);"";[.K32]*[.$H32]) -> 91.8 | M32: 3 | N32: of:=IF(ISBLANK([.M32]);"";[.M32]*[.$H32]) -> 275.4 | O32: 3 | P32: of:=IF(ISBLANK([.O32]);"";[.O32]*[.$H32]) -> 275.4 | Q32: http://hu.farnell.com/avago-technologies/acpl-217-500e/optocoupler-3kv-transistor-o-p/dp/1602614 | R32: 23 | S32: of:=[.S31] -> Relay | T32: of:=[.T31] -> Opto | U32: y
A33: of:=[.B33]&[.C33]&[.E33] -> DDiodes_SMD:Diode-SMA_StandardB130-13-F | B33: D | C33: Diodes_SMD:Diode-SMA_Standard | D33: Diodes Inc. | E33: B130-13-F | F33: 1843713 | H33: 118.09 | I33: 1 | J33: 1 | K33: of:=MAX([.I33];[.J33]) -> 1 | L33: of:=IF(ISBLANK([.K33]);"";[.K33]*[.$H33]) -> 118.09 | M33: 3 | N33: of:=IF(ISBLANK([.M33]);"";[.M33]*[.$H33]) -> 354.27 | O33: 2 | P33: of:=IF(ISBLANK([.O33]);"";[.O33]*[.$H33]) -> 236.18 | Q33: http://hu.farnell.com/diodes-inc/b130-13-f/diode-schottky-1a-30v-sma/dp/1843713 | R33: 24 | S33: Relay | T33: B130-13-F
A34: of:=[.B34]&[.C34]&[.E34] -> DLEDs:LED-0603 | B34: D | C34: LEDs:LED-0603 | L34: of:=IF(ISBLANK([.K34]);"";[.K34]*[.$H34]) ->  | N34: of:=IF(ISBLANK([.M34]);"";[.M34]*[.$H34]) ->  | P34: of:=IF(ISBLANK([.O34]);"";[.O34]*[.$H34]) ->  | R34: 25 | S34: Relay | T34: LED | U34: y
A35: of:=[.B35]&[.C35]&[.E35] -> DLEDs:LED-0603KP-1608CGCK | B35: D | C35: of:=[.C34] -> LEDs:LED-0603 | D35: Kingbright | E35: KP-1608CGCK | F35: 2290328 | H35: 24 | I35: 1 | J35: 1 | K35: of:=MAX([.I35];[.J35]) -> 1 | L35: of:=IF(ISBLANK([.K35]);"";[.K35]*[.$H35]) -> 24 | M35: 3 | N35: of:=IF(ISBLANK([.M35]);"";[.M35]*[.$H35]) -> 72 | O35: 3 | P35: of:=IF(ISBLANK([.O35]);"";[.O35]*[.$H35]) -> 72 | Q35: http://hu.farnell.com/kingbright/kp-1608cgck/led-0603-50mcd-green/dp/2290328 | R35: 25 | S35: of:=[.S34] -> Relay | T35: of:=[.T34] -> LED  | U35: y
A36: of:=[.B36]&[.C36]&[.E36] -> MCP3901A0-I/SS | D36: Microchip | E36: MCP3901A0-I/SS | F36: 1825015 | H36: 639.96 | I36: 1 | J36: 1 | L36: of:=IF(ISBLANK([.K36]);"";[.K36]*[.$H36]) ->  | N36: of:=IF(ISBLANK([.M36]);"";[.M36]*[.$H36]) ->  | P36: of:=IF(ISBLANK([.O36]);"";[.O36]*[.$H36]) ->  | Q36: http://hu.farnell.com/microchip/mcp3901a0-i-ss/ic-afe-24bit-64ksps-20ssop/dp/1825015 | R36: 27 | S36: TC/Analog | T36: MCP3901
A37: of:=[.B37]&[.C37]&[.E37] -> USMD_Packages:SSOP20MCP3901A0-I/SS | B37: U | C37: SMD_Packages:SSOP20 | D37: Microchip | E37: MCP3901A0-I/SS | H37: 450 | I37: 5 | J37: 1 | K37: 5 | L37: of:=IF(ISBLANK([.K37]);"";[.K37]*[.$H37]) -> 2250 | M37: 5 | N37: of:=IF(ISBLANK([.M37]);"";[.M37]*[.$H37]) -> 2250 | O37: 5 | P37: of:=IF(ISBLANK([.O37]);"";[.O37]*[.$H37]) -> 2250 | Q37: http://www.microchipdirect.com/ProductSearch.aspx?Keywords=MCP3901A0-I/SS | R37: 27 | S37: TC/Analog | T37: MCP3901
A38: of:=[.B38]&[.C38]&[.E38] -> USMD_Packages:SO14E | B38: U | C38: SMD_Packages:SO14E | L38: of:=IF(ISBLANK([.K38]);"";[.K38]*[.$H38]) ->  | N38: of:=IF(ISBLANK([.M38]);"";[.M38]*[.$H38]) ->  | P38: of:=IF(ISBLANK([.O38]);"";[.O38]*[.$H38]) ->  | R38: 27 | S38: TC/Analog | T38: OPA4170 | U38: y
A39: of:=[.B39]&[.C39]&[.E39] -> USMD_Packages:SO14EOPA4170AID | B39: U | C39: of:=[.C38] -> SMD_Packages:SO14E | D39: Texas Instruments | E39: OPA4170AID | F39: 2382790 | H39: 735.2 | I39: 1 | J39: 1 | K39: of:=MAX([.I39];[.J39]) -> 1 | L39: of:=IF(ISBLANK([.K39]);"";[.K39]*[.$H39]) -> 735.2 | M39: 3 | N39: of:=IF(ISBLANK([.M39]);"";[.M39]*[.$H39]) -> 2205.6 | O39: 2 | P39: of:=IF(ISBLANK([.O39]);"";[.O39]*[.$H39]) -> 1470.4 | Q39: http://hu.farnell.com/texas-instruments/opa4170aid/op-amp-1-2mhz-0-4v-us-soic-14/dp/2382790 | R39: 27 | S39: of:=[.S38] -> TC/Analog | T39: of:=[.T38] -> OPA4170 | U39: y
A40: of:=[.B40]&[.C40]&[.E40] -> USMD_Packages:SOT353LMT84DCKT | B40: U | C40: SMD_Packages:SOT353 | D40: Texas Instruments | E40: LMT84DCKT | F40: 2314386 | H40: 148.56 | I40: 1 | J40: 1 | K40: of:=MAX([.I40];[.J40]) -> 1 | L40: of:=IF(ISBLANK([.K40]);"";[.K40]*[.$H40]) -> 148.56 | M40: 3 | N40: of:=IF(ISBLANK([.M40]);"";[.M40]*[.$H40]) -> 445.68 | O40: 2 | P40: of:=IF(ISBLANK([.O40]);"";[.O40]*[.$H40]) -> 297.12 | Q40: http://hu.farnell.com/texas-instruments/lmt84dckt/temp-sensor-1-5v-50-to-150-deg/dp/2314386 | R40: 28 | S40: TC/Analog | T40: LMT84
A41: of:=[.B41]&[.C41]&[.E41] ->  | L41: of:=IF(ISBLANK([.K41]);"";[.K41]*[.$H41]) ->  | N41: of:=IF(ISBLANK([.M41]);"";[.M41]*[.$H41]) ->  | P41: of:=IF(ISBLANK([.O41]);"";[.O41]*[.$H41]) ->  | R41: 29 | S41: TC/Analog | T41: .1% 20K, 1206 | U41: y
A42: of:=[.B42]&[.C42]&[.E42] -> CRT1206-BY-1002ELF | D42: Bourns | E42: CRT1206-BY-1002ELF | F42: 2008319 | H42: 84.19 | I42: 5 | J42: 4 | K42: of:=MAX([.I42];[.J42]) -> 5 | L42: of:=IF(ISBLANK([.K42]);"";[.K42]*[.$H42]) -> 420.95 | M42: 12 | N42: of:=IF(ISBLANK([.M42]);"";[.M42]*[.$H42]) -> 1010.28 | O42: 5 | P42: of:=IF(ISBLANK([.O42]);"";[.O42]*[.$H42]) -> 420.95 | Q42: http://hu.farnell.com/bourns/crt1206-by-1002elf/resistor-10k-0-25w-0-1/dp/2008319 | R42: 29 | S42: of:=[.S41] -> TC/Analog | T42: of:=[.T41] -> .1% 20K, 1206 | U42: y
A43: of:=[.B43]&[.C43]&[.E43] -> 881545-1 | D43: TE Connectivity | E43: 881545-1 | F43: 4218164 | H43: 51.43 | I43: 10 | J43: 4 | K43: of:=MAX([.I43];[.J43]) -> 10 | L43: of:=IF(ISBLANK([.K43]);"";[.K43]*[.$H43]) -> 514.3 | M43: 12 | N43: of:=IF(ISBLANK([.M43]);"";[.M43]*[.$H43]) -> 617.16 | O43: 10 | P43: of:=IF(ISBLANK([.O43]);"";[.O43]*[.$H43]) -> 514.3 | Q43: http://hu.farnell.com/te-connectivity-amp/881545-1/jumper-black-amp-modu-2-54mm-2way/dp/4218164 | R43: 30 | S43: TC/Analog | T43: Shunt/Jumper
A44: of:=[.B44]&[.C44]&[.E44] -> PBenchBudEE:V8508H | B44: P | C44: BenchBudEE:V8508H | L44: of:=IF(ISBLANK([.K44]);"";[.K44]*[.$H44]) ->  | N44: of:=IF(ISBLANK([.M44]);"";[.M44]*[.$H44]) ->  | P44: of:=IF(ISBLANK([.O44]);"";[.O44]*[.$H44]) ->  | R44: 31 | S44: Power Modify | T44: Heatsink | U44: y
A45: of:=[.B45]&[.C45]&[.E45] -> PBenchBudEE:V8508HMC33282 | B45: P | C45: of:=[.C44] -> BenchBudEE:V8508H | D45: Multicomp | E45: MC33282 | F45: 1710672 | H45: 140.94 | I45: 1 | J45: 2 | K45: of:=MAX([.I45];[.J45]) -> 2 | L45: of:=IF(ISBLANK([.K45]);"";[.K45]*[.$H45]) -> 281.88 | M45: 5 | N45: of:=IF(ISBLANK([.M45]);"";[.M45]*[.$H45]) -> 704.7 | O45: 1 | P45: of:=IF(ISBLANK([.O45]);"";[.O45]*[.$H45]) -> 140.94 | Q45: http://hu.farnell.com/multicomp/mc33282/heatsink-to220-21-c-w/dp/1710627 | R45: 31 | S45: of:=[.S44] -> Power Modify | T45: of:=[.T44] -> Heatsink | U45: y
L46: of:=IF(ISBLANK([.K46]);"";[.K46]*[.$H46]) ->  | N46: of:=IF(ISBLANK([.M46]);"";[.M46]*[.$H46]) ->  | P46: of:=IF(ISBLANK([.O46]);"";[.O46]*[.$H46]) -> 
A47: of:=[.B47]&[.C47]&[.E47] -> ARDBenchBudEE:ArduinoA000066 | B47: ARD | C47: BenchBudEE:Arduino | D47: Arduino | E47: A000066 | F47: 2075382 | H47: 6875.79 | I47: 1 | J47: 1 | K47: of:=MAX([.I47];[.J47]) -> 1 | L47: of:=IF(ISBLANK([.K47]);"";[.K47]*[.$H47]) -> 6875.79 | M47: 2 | N47: of:=IF(ISBLANK([.M47]);"";[.M47]*[.$H47]) -> 13751.58 | O47: 1 | P47: of:=IF(ISBLANK([.O47]);"";[.O47]*[.$H47]) -> 6875.79 | Q47: http://hu.farnell.com/arduino/a000066/eval-atmega328p-8bit-uno-rv3/dp/2075382
D48: Resistor kit 0805 | L48: of:=IF(ISBLANK([.K48]);"";[.K48]*[.$H48]) ->  | N48: of:=IF(ISBLANK([.M48]);"";[.M48]*[.$H48]) ->  | P48: of:=IF(ISBLANK([.O48]);"";[.O48]*[.$H48]) -> 
D49: Capacitor kit? | L49: of:=IF(ISBLANK([.K49]);"";[.K49]*[.$H49]) ->  | N49: of:=IF(ISBLANK([.M49]);"";[.M49]*[.$H49]) ->  | P49: of:=IF(ISBLANK([.O49]);"";[.O49]*[.$H49]) -> 
L50: of:=IF(ISBLANK([.K50]);"";[.K50]*[.$H50]) ->  | N50: of:=IF(ISBLANK([.M50]);"";[.M50]*[.$H50]) ->  | P50: of:=IF(ISBLANK([.O50]);"";[.O50]*[.$H50]) -> 
D51: MFG | E51: MFG Part No. | F51: Farnell Part No. | G51: RS Part No. | H51: Price | I51: MOQ | J51: Quantity | K51: Quantity 1 | L51: Price 1 | M51: Quantity 2 | N51: Price 2 | O51: Quantity 3 | P51: Price 3 | T51: Value | U51: Footprint | V51: Tolerance
L52: of:=IF(ISBLANK([.K52]);"";[.K52]*[.$H52]) ->  | N52: of:=IF(ISBLANK([.M52]);"";[.M52]*[.$H52]) ->  | P52: of:=IF(ISBLANK([.O52]);"";[.O52]*[.$H52]) ->  | T52: Capacitors
A53: of:=[.B53]&[.C53]&[.T53] -> CCapacitors_SMD:c_0805100p | B53: C | C53: Capacitors_SMD:c_0805 | D53: Multicomp | E53: MC0805N101J500CT | F53: 1759203 | H53: 6.1 | I53: 10 | J53: 1 | K53: of:=MAX([.I53];[.J53]) -> 10 | L53: of:=IF(ISBLANK([.K53]);"";[.K53]*[.$H53]) -> 61 | M53: 25 | N53: of:=IF(ISBLANK([.M53]);"";[.M53]*[.$H53]) -> 152.5 | O53: 20 | P53: of:=IF(ISBLANK([.O53]);"";[.O53]*[.$H53]) -> 122 | Q53: http://hu.farnell.com/multicomp/mc0805n101j500ct/cap-mlcc-c0g-np0-100pf-50v-0805/dp/1759203 | S53: extra | T53: 100p | U53: 0805
A54: of:=[.B54]&[.C54]&[.T54] -> CCapacitors_SMD:c_08051000p | B54: C | C54: Capacitors_SMD:c_0805 | D54: Multicomp | E54: MC0805B102K500CT | F54: 1759226 | H54: 3.9 | I54: 10 | L54: of:=IF(ISBLANK([.K54]);"";[.K54]*[.$H54]) ->  | M54: 25 | N54: of:=IF(ISBLANK([.M54]);"";[.M54]*[.$H54]) -> 97.5 | O54: 20 | P54: of:=IF(ISBLANK([.O54]);"";[.O54]*[.$H54]) -> 78 | Q54: http://hu.farnell.com/multicomp/mc0805b102k500ct/cap-mlcc-x7r-1nf-50v-0805/dp/1759226 | S54: extra | T54: 1000p | U54: 0805
A55: of:=[.B55]&[.C55]&[.T55] -> CCapacitors_SMD:c_0805.01u | B55: C | C55: Capacitors_SMD:c_0805 | D55: Multicomp | E55: MC0805B103K500CT | F55: 1759246 | H55: 3.9 | I55: 10 | J55: 4 | K55: of:=MAX([.I55];[.J55]) -> 10 | L55: of:=IF(ISBLANK([.K55]);"";[.K55]*[.$H55]) -> 39 | M55: 25 | N55: of:=IF(ISBLANK([.M55]);"";[.M55]*[.$H55]) -> 97.5 | O55: 20 | P55: of:=IF(ISBLANK([.O55]);"";[.O55]*[.$H55]) -> 78 | Q55: http://hu.farnell.com/multicomp/mc0805b103k500ct/cap-mlcc-x7r-10nf-50v-0805/dp/1759246 | S55: extra | T55: .01u | U55: 0805
A56: of:=[.B56]&[.C56]&[.T56] -> CCapacitors_SMD:c_0805.1u | B56: C | C56: Capacitors_SMD:c_0805 | D56: Multicomp | E56: MC0805B104K250CT | F56: 1759166 | H56: 3.9 | I56: 10 | L56: of:=IF(ISBLANK([.K56]);"";[.K56]*[.$H56]) ->  | M56: 25 | N56: of:=IF(ISBLANK([.M56]);"";[.M56]*[.$H56]) -> 97.5 | O56: 20 | P56: of:=IF(ISBLANK([.O56]);"";[.O56]*[.$H56]) -> 78 | Q56: http://hu.farnell.com/multicomp/mc0805b104k250ct/cap-mlcc-x7r-100nf-25v-0805/dp/1759166 | S56: extra | T56: .1u | U56: 0805
A57: of:=[.B57]&[.C57]&[.T57] -> CCapacitors_SMD:c_08051u | B57: C | C57: Capacitors_SMD:c_0805 | D57: TDK | E57: C2012X7R1E105K125AB | F57: 2346940 | H57: 14.09 | I57: 1 | J57: 11 | K57: of:=MAX([.I57];[.J57]) -> 11 | L57: of:=IF(ISBLANK([.K57]);"";[.K57]*[.$H57]) -> 154.99 | M57: 50 | N57: of:=IF(ISBLANK([.M57]);"";[.M57]*[.$H57]) -> 704.5 | O57: 40 | P57: of:=IF(ISBLANK([.O57]);"";[.O57]*[.$H57]) -> 563.6 | Q57: http://hu.farnell.com/tdk/c2012x7r1e105k125ab/cap-mlcc-x7r-1uf-25v-0805/dp/2346940 | S57: extra | T57: 1u | U57: 0805
A58: of:=[.B58]&[.C58]&[.T58] -> CCapacitors_SMD:c_080510u | B58: C | C58: Capacitors_SMD:c_0805 | D58: Multicomp | E58: MC0805X106K250CT | F58: 2320833 | H58: 43.8 | I58: 10 | J58: 8 | K58: of:=MAX([.I58];[.J58]) -> 10 | L58: of:=IF(ISBLANK([.K58]);"";[.K58]*[.$H58]) -> 438 | M58: 25 | N58: of:=IF(ISBLANK([.M58]);"";[.M58]*[.$H58]) -> 1095 | O58: 20 | P58: of:=IF(ISBLANK([.O58]);"";[.O58]*[.$H58]) -> 876 | Q58: http://hu.farnell.com/multicomp/mc0805x106k250ct/cap-mlcc-x5r-10uf-25v-0805/dp/2320833 | S58: extra | T58: 10u | U58: 0805
A59: of:=[.B59]&[.C59]&[.T59] -> CCapacitors_SMD:c_120610u | B59: C | C59: Capacitors_SMD:c_1206 | D59: Multicomp | E59: MC1206X106K250CT | F59: 2320887 | H59: 33.8 | I59: 10 | J59: 4 | K59: of:=MAX([.I59];[.J59]) -> 10 | L59: of:=IF(ISBLANK([.K59]);"";[.K59]*[.$H59]) -> 338 | M59: 25 | N59: of:=IF(ISBLANK([.M59]);"";[.M59]*[.$H59]) -> 845 | O59: 25 | P59: of:=IF(ISBLANK([.O59]);"";[.O59]*[.$H59]) -> 845 | Q59: http://hu.farnell.com/multicomp/mc1206x106k250ct/cap-mlcc-x5r-10uf-25v-1206/dp/2320887 | S59: extra | T59: 10u | U59: 1206
A60: of:=[.B60]&[.C60]&[.T60] -> CCapacitors_SMD:c_121010u | B60: C | C60: Capacitors_SMD:c_1210 | T60: 10u | U60: 1210
L61: of:=IF(ISBLANK([.K61]);"";[.K61]*[.$H61]) ->  | N61: of:=IF(ISBLANK([.M61]);"";[.M61]*[.$H61]) ->  | P61: of:=IF(ISBLANK([.O61]);"";[.O61]*[.$H61]) ->  | T61: Resistors
A62: of:=[.B62]&[.C62]&[.T62] -> RBenchBudEE:Resistor_SMD0805_Blob0 | B62: R | C62: BenchBudEE:Resistor_SMD0805_Blob | D62: Multicomp | E62: MCMR08X000 PTL | F62: 2073603 | H62: 2.67 | I62: 100 | J62: 33 | K62: of:=MAX([.I62];[.J62]) -> 100 | L62: of:=IF(ISBLANK([.K62]);"";[.K62]*[.$H62]) -> 267 | M62: 100 | N62: of:=IF(ISBLANK([.M62]);"";[.M62]*[.$H62]) -> 267 | O62: 100 | P62: of:=IF(ISBLANK([.O62]);"";[.O62]*[.$H62]) -> 267 | Q62: http://hu.farnell.com/multicomp/mcmr08x000-ptl/resistor-0805-0r-anti-sulfuration/dp/2073603 | S62: extra | T62: 0 | U62: 0805
A63: of:=[.B63]&[.C63]&[.T63] -> RSMD_Packages:SM08050 | B63: R | C63: SMD_Packages:SM0805 | D63: Multicomp | E63: MCMR08X000 PTL | F63: 2073603 | H63: 2.67 | I63: 100 | J63: 33 | K63: of:=MAX([.I63];[.J63]) -> 100 | L63: of:=IF(ISBLANK([.K63]);"";[.K63]*[.$H63]) -> 267 | M63: 100 | N63: of:=IF(ISBLANK([.M63]);"";[.M63]*[.$H63]) -> 267 | O63: 100 | P63: of:=IF(ISBLANK([.O63]);"";[.O63]*[.$H63]) -> 267 | Q63: http://hu.farnell.com/multicomp/mcmr08x000-ptl/resistor-0805-0r-anti-sulfuration/dp/2073603 | S63: extra | T63: 0 | U63: 0805
A64: of:=[.B64]&[.C64]&[.T64] -> RSMD_Packages:SM12061 | B64: R | C64: SMD_Packages:SM1206 | D64: Multicomp | E64: MCHP06W2F100KT5E | F64: 1576602 | H64: 11.05 | I64: 50 | J64: 1 | K64: of:=MAX([.I64];[.J64]) -> 50 | L64: of:=IF(ISBLANK([.K64]);"";[.K64]*[.$H64]) -> 552.5 | M64: 50 | N64: of:=IF(ISBLANK([.M64]);"";[.M64]*[.$H64]) -> 552.5 | O64: 50 | P64: of:=IF(ISBLANK([.O64]);"";[.O64]*[.$H64]) -> 552.5 | Q64: http://hu.farnell.com/multicomp/mchp06w2f100kt5e/resistor-1206-1r-1-0-5w/dp/1576602 | T64: 1 | U64: 1206
A65: of:=[.B65]&[.C65]&[.T65] -> RSMD_Packages:SM08054.87 | B65: R | C65: SMD_Packages:SM0805 | D65: Multicomp | E65: MC01W080514R87 | F65: 2141671 | H65: 13.33 | I65: 1 | J65: 1 | K65: 1 | L65: of:=IF(ISBLANK([.K65]);"";[.K65]*[.$H65]) -> 13.33 | M65: 3 | N65: of:=IF(ISBLANK([.M65]);"";[.M65]*[.$H65]) -> 39.99 | O65: 3 | P65: of:=IF(ISBLANK([.O65]);"";[.O65]*[.$H65]) -> 39.99 | Q65: http://hu.farnell.com/multicomp/mc01w080514r87/resistor-4r87-0-1w-1-0805/dp/2141671 | T65: 4.87 | U65: 0805
A66: of:=[.B66]&[.C66]&[.T66] -> RSMD_Packages:SM080510 | B66: R | C66: SMD_Packages:SM0805 | D66: Bourns | E66: CRT0805-BY-10R0ELF | F66: 2008313 | H66: 62.47 | I66: 5 | J66: 1 | K66: of:=MAX([.I66];[.J66]) -> 5 | L66: of:=IF(ISBLANK([.K66]);"";[.K66]*[.$H66]) -> 312.35 | M66: 25 | N66: of:=IF(ISBLANK([.M66]);"";[.M66]*[.$H66]) -> 1561.75 | O66: 5 | P66: of:=IF(ISBLANK([.O66]);"";[.O66]*[.$H66]) -> 312.35 | Q66: http://hu.farnell.com/bourns/crt0805-by-10r0elf/resistor-0805-10r-0-1-1-8w/dp/2008313 | T66: 10 | U66: 0805 | V66: 0.1%
A67: of:=[.B67]&[.C67]&[.T67] -> RSMD_Packages:SM080515 | B67: R | C67: SMD_Packages:SM0805 | D67: TE Connectivity | E67: CRGH0805F15R | F67: 2332045 | H67: 5.33 | I67: 10 | J67: 1 | K67: of:=MAX([.I67];[.J67]) -> 10 | L67: of:=IF(ISBLANK([.K67]);"";[.K67]*[.$H67]) -> 53.3 | M67: 10 | N67: of:=IF(ISBLANK([.M67]);"";[.M67]*[.$H67]) -> 53.3 | O67: 10 | P67: of:=IF(ISBLANK([.O67]);"";[.O67]*[.$H67]) -> 53.3 | Q67: http://hu.farnell.com/te-connectivity/crgh0805f15r/resistor-power-15r-0-33w-1-0805/dp/2332045 | T67: 15 | U67: 0805
A68: of:=[.B68]&[.C68]&[.T68] -> RSMD_Packages:SM0805100 | B68: R | C68: SMD_Packages:SM0805 | D68: Multicomp | E68: MCMR08X1000FTL | F68: 2073605 | H68: 3.43 | I68: 100 | J68: 1 | K68: of:=MAX([.I68];[.J68]) -> 100 | L68: of:=IF(ISBLANK([.K68]);"";[.K68]*[.$H68]) -> 343 | M68: 100 | N68: of:=IF(ISBLANK([.M68]);"";[.M68]*[.$H68]) -> 343 | O68: 100 | P68: of:=IF(ISBLANK([.O68]);"";[.O68]*[.$H68]) -> 343 | Q68: http://hu.farnell.com/multicomp/mcmr08x1000ftl/resistor-0805-100r-1-anti-sulfur/dp/2073605 | S68: extra | T68: 100 | U68: 0805
A69: of:=[.B69]&[.C69]&[.T69] -> RSMD_Packages:SM0805100 | B69: R | C69: SMD_Packages:SM0805 | D69: Susumu | E69: RR1220P-101-B-T5 | F69: 1653279 | H69: 25.9 | I69: 1 | J69: 1 | K69: of:=MAX([.I69];[.J69]) -> 1 | L69: of:=IF(ISBLANK([.K69]);"";[.K69]*[.$H69]) -> 25.9 | M69: 3 | N69: of:=IF(ISBLANK([.M69]);"";[.M69]*[.$H69]) -> 77.7 | O69: 3 | P69: of:=IF(ISBLANK([.O69]);"";[.O69]*[.$H69]) -> 77.7 | Q69: http://hu.farnell.com/susumu/rr1220p-101-b-t5/thin-film-chip-resistor/dp/1653279 | T69: 100 | U69: 0805 | V69: 0.1%
A70: of:=[.B70]&[.C70]&[.T70] -> RSMD_Packages:SM0805200 | B70: R | C70: SMD_Packages:SM0805 | D70: Multicomp | E70: MCTC0525B2000T5E | F70: 1575647 | H70: 18.29 | I70: 5 | J70: 2 | K70: of:=MAX([.I70];[.J70]) -> 5 | L70: of:=IF(ISBLANK([.K70]);"";[.K70]*[.$H70]) -> 91.45 | M70: 5 | N70: of:=IF(ISBLANK([.M70]);"";[.M70]*[.$H70]) -> 91.45 | O70: 5 | P70: of:=IF(ISBLANK([.O70]);"";[.O70]*[.$H70]) -> 91.45 | Q70: http://hu.farnell.com/multicomp/mctc0525b2000t5e/resistor-200r-0805-0-1-25ppm-0/dp/1575647 | T70: 200 | U70: 0805
A71: of:=[.B71]&[.C71]&[.T71] -> RSMD_Packages:SM0805715 | B71: R | C71: SMD_Packages:SM0805 | D71: Multicomp | E71: MC01W08051715R | F71: 2141787 | H71: 13.33 | I71: 1 | J71: 2 | K71: of:=MAX([.I71];[.J71]) -> 2 | L71: of:=IF(ISBLANK([.K71]);"";[.K71]*[.$H71]) -> 26.66 | M71: 5 | N71: of:=IF(ISBLANK([.M71]);"";[.M71]*[.$H71]) -> 66.65 | O71: 5 | P71: of:=IF(ISBLANK([.O71]);"";[.O71]*[.$H71]) -> 66.65 | Q71: http://hu.farnell.com/multicomp/mc01w08051715r/resistor-715r-0-1w-1-0805/dp/2141787 | T71: 715 | U71: 0805
A72: of:=[.B72]&[.C72]&[.T72] -> RSMD_Packages:SM08051K | B72: R | C72: SMD_Packages:SM0805 | D72: Multicomp | E72: MCMR08X1001FTL | F72: 2073606 | H72: 3.43 | I72: 100 | J72: 4 | K72: of:=MAX([.I72];[.J72]) -> 100 | L72: of:=IF(ISBLANK([.K72]);"";[.K72]*[.$H72]) -> 343 | M72: 100 | N72: of:=IF(ISBLANK([.M72]);"";[.M72]*[.$H72]) -> 343 | O72: 100 | P72: of:=IF(ISBLANK([.O72]);"";[.O72]*[.$H72]) -> 343 | Q72: http://hu.farnell.com/multicomp/mcmr08x1001ftl/resistor-0805-1k-1-anti-sulfur/dp/2073606 | S72: extra | T72: 1K | U72: 0805
A73: of:=[.B73]&[.C73]&[.T73] -> RSMD_Packages:SM08051K | B73: R | C73: SMD_Packages:SM0805 | D73: Susumu | E73: RR1220P-102-B-T5 | F73: 1653280 | H73: 25.9 | I73: 1 | J73: 1 | K73: of:=MAX([.I73];[.J73]) -> 1 | L73: of:=IF(ISBLANK([.K73]);"";[.K73]*[.$H73]) -> 25.9 | M73: 3 | N73: of:=IF(ISBLANK([.M73]);"";[.M73]*[.$H73]) -> 77.7 | O73: 3 | P73: of:=IF(ISBLANK([.O73]);"";[.O73]*[.$H73]) -> 77.7 | Q73: http://hu.farnell.com/susumu/rr1220p-102-b-t5/resistor-thin-film-1k-0-1w-0-1/dp/1653280 | T73: 1K | U73: 0805 | V73: 0.1%
A74: of:=[.B74]&[.C74]&[.T74] -> RSMD_Packages:SM08051.3K | B74: R | C74: SMD_Packages:SM0805 | D74: KOA | E74: RK73H2ATTD1301F | F74: 1811799 | H74: 6.48 | I74: 5 | J74: 2 | K74: of:=MAX([.I74];[.J74]) -> 5 | L74: of:=IF(ISBLANK([.K74]);"";[.K74]*[.$H74]) -> 32.4 | M74: 5 | N74: of:=IF(ISBLANK([.M74]);"";[.M74]*[.$H74]) -> 32.4 | O74: 5 | P74: of:=IF(ISBLANK([.O74]);"";[.O74]*[.$H74]) -> 32.4 | Q74: http://hu.farnell.com/koa/rk73h2attd1301f/resistor-0805-1k3-ohm-1/dp/1811799 | T74: 1.3K | U74: 0805
A75: of:=[.B75]&[.C75]&[.T75] -> RSMD_Packages:SM08053K | B75: R | C75: SMD_Packages:SM0805 | D75: Bourns | E75: CR0805-FX-3001GLF | F75: 2333540 | H75: 10.29 | I75: 1 | J75: 2 | K75: of:=MAX([.I75];[.J75]) -> 2 | L75: of:=IF(ISBLANK([.K75]);"";[.K75]*[.$H75]) -> 20.58 | M75: 5 | N75: of:=IF(ISBLANK([.M75]);"";[.M75]*[.$H75]) -> 51.45 | O75: 5 | P75: of:=IF(ISBLANK([.O75]);"";[.O75]*[.$H75]) -> 51.45 | Q75: http://hu.farnell.com/bourns/cr0805-fx-3001glf/resistor-thick-film-3kohm-1-0805/dp/2333540 | T75: 3K | U75: 0805
A76: of:=[.B76]&[.C76]&[.T76] -> RSMD_Packages:SM08055K | B76: R | C76: SMD_Packages:SM0805 | D76: Susumu | E76: RR1220P-4991-B-M-T5 | F76: 1653310 | H76: 25.9 | I76: 1 | J76: 2 | K76: of:=MAX([.I76];[.J76]) -> 2 | L76: of:=IF(ISBLANK([.K76]);"";[.K76]*[.$H76]) -> 51.8 | M76: 5 | N76: of:=IF(ISBLANK([.M76]);"";[.M76]*[.$H76]) -> 129.5 | O76: 5 | P76: of:=IF(ISBLANK([.O76]);"";[.O76]*[.$H76]) -> 129.5 | Q76: http://hu.farnell.com/susumu/rr1220p-4991-b-m-t5/resistor-0805-0-1-4k99/dp/1653310 | T76: 5K | U76: 0805 | V76: 0.1%
A77: of:=[.B77]&[.C77]&[.T77] -> RSMD_Packages:SM12065K | B77: R | C77: SMD_Packages:SM1206 | D77: Vishay | E77: PHP01206E4991BST3 | F77: 2325357 | H77: 384.74 | I77: 1 | J77: 2 | K77: of:=MAX([.I77];[.J77]) -> 2 | L77: of:=IF(ISBLANK([.K77]);"";[.K77]*[.$H77]) -> 769.48 | M77: 5 | N77: of:=IF(ISBLANK([.M77]);"";[.M77]*[.$H77]) -> 1923.7 | O77: 3 | P77: of:=IF(ISBLANK([.O77]);"";[.O77]*[.$H77]) -> 1154.22 | Q77: http://hu.farnell.com/vishay-thin-film/php01206e4991bst3/resistor-thin-film-4-99kohm-0-1/dp/2325357 | T77: 5K | U77: 1206 | V77: 0.1%
A78: of:=[.B78]&[.C78]&[.T78] -> RSMD_Packages:SM08059.1K | B78: R | C78: SMD_Packages:SM0805 | D78: Vishay | E78: CRCW08059K10FKEA | F78: 1653046 | H78: 24.76 | I78: 1 | J78: 2 | K78: 2 | L78: of:=IF(ISBLANK([.K78]);"";[.K78]*[.$H78]) -> 49.52 | M78: 5 | N78: of:=IF(ISBLANK([.M78]);"";[.M78]*[.$H78]) -> 123.8 | O78: 5 | P78: of:=IF(ISBLANK([.O78]);"";[.O78]*[.$H78]) -> 123.8 | Q78: http://hu.farnell.com/vishay-draloric/crcw08059k10fkea/resistor-0805-9k10-1/dp/1653046 | T78: 9.1K | U78: 0805
A79: of:=[.B79]&[.C79]&[.T79] -> RSMD_Packages:SM080510K | B79: R | C79: SMD_Packages:SM0805 | D79: Multicomp | E79: MCMR08X1002FTL | F79: 2073607 | H79: 3.43 | I79: 100 | J79: 2 | K79: of:=MAX([.I79];[.J79]) -> 100 | L79: of:=IF(ISBLANK([.K79]);"";[.K79]*[.$H79]) -> 343 | M79: 100 | N79: of:=IF(ISBLANK([.M79]);"";[.M79]*[.$H79]) -> 343 | O79: 100 | P79: of:=IF(ISBLANK([.O79]);"";[.O79]*[.$H79]) -> 343 | Q79: http://hu.farnell.com/multicomp/mcmr08x1002ftl/resistor-0805-10k-1-anti-sulfur/dp/2073607 | S79: extra | T79: 10K | U79: 0805
A80: of:=[.B80]&[.C80]&[.T80] -> RSMD_Packages:SM1206200K | B80: R | C80: SMD_Packages:SM1206 | D80: Vishay | E80: PAT1206E2003BST5 | F80: 1858262 | H80: 380.93 | I80: 1 | J80: 2 | K80: of:=MAX([.I80];[.J80]) -> 2 | L80: of:=IF(ISBLANK([.K80]);"";[.K80]*[.$H80]) -> 761.86 | M80: 5 | N80: of:=IF(ISBLANK([.M80]);"";[.M80]*[.$H80]) -> 1904.65 | O80: 5 | P80: of:=IF(ISBLANK([.O80]);"";[.O80]*[.$H80]) -> 1904.65 | Q80: http://hu.farnell.com/vishay-thin-film/pat1206e2003bst5/resistor-1206-200k-0-1/dp/1858262 | T80: 200K | U80: 1206 | V80: 0.1%
L81: of:=IF(ISBLANK([.K81]);"";[.K81]*[.$H81]) ->  | N81: of:=IF(ISBLANK([.M81]);"";[.M81]*[.$H81]) ->  | P81: of:=IF(ISBLANK([.O81]);"";[.O81]*[.$H81]) ->  | T81: Inductors
A82: of:=[.B82]&[.C82]&[.T82] -> LSMD_Packages:SM08051u | B82: L | C82: SMD_Packages:SM0805 | D82: TDK | E82: MPZ2012S101A | F82: 1669751 | H82: 25.52 | I82: 5 | J82: 1 | K82: of:=MAX([.I82];[.J82]) -> 5 | L82: of:=IF(ISBLANK([.K82]);"";[.K82]*[.$H82]) -> 127.6 | M82: 5 | N82: of:=IF(ISBLANK([.M82]);"";[.M82]*[.$H82]) -> 127.6 | O82: 5 | P82: of:=IF(ISBLANK([.O82]);"";[.O82]*[.$H82]) -> 127.6 | Q82: http://hu.farnell.com/tdk/mpz2012s101a/ferrite-bead-0-02ohm-4a-0805/dp/1669751 | T82: 1u | U82: 0805
A83: of:=[.B83]&[.C83]&[.T83] -> LBenchBudEE:NR401222u | B83: L | C83: BenchBudEE:NR4012 | D83: Würth Elektronik | E83: 744031220 | F83: 1890602 | H83: 399.98 | I83: 1 | J83: 1 | K83: of:=MAX([.I83];[.J83]) -> 1 | L83: of:=IF(ISBLANK([.K83]);"";[.K83]*[.$H83]) -> 399.98 | M83: 3 | N83: of:=IF(ISBLANK([.M83]);"";[.M83]*[.$H83]) -> 1199.94 | O83: 2 | P83: of:=IF(ISBLANK([.O83]);"";[.O83]*[.$H83]) -> 799.96 | Q83: http://hu.farnell.com/wurth-elektronik/744031220/inductor-power-22uh-30-0-51a/dp/1890602 | T83: 22u | U83: NR4012
A84: of:=[.B84]&[.C84]&[.E84] -> LSMD_Packages:SM1210LCM322522-220KL | B84: L | C84: SMD_Packages:SM1210L | D84: Bourns | E84: CM322522-220KL | F84: 9357912 | H84: 69.71 | I84: 10 | J84: 3 | K84: of:=MAX([.I84];[.J84]) -> 10 | L84: of:=IF(ISBLANK([.K84]);"";[.K84]*[.$H84]) -> 697.1 | M84: 10 | N84: of:=IF(ISBLANK([.M84]);"";[.M84]*[.$H84]) -> 697.1 | O84: 10 | P84: of:=IF(ISBLANK([.O84]);"";[.O84]*[.$H84]) -> 697.1 | Q84: http://hu.farnell.com/bourns/cm322522-220kl/inductor-22uh/dp/9357912 | T84: 22u | U84: 1210
L85: of:=IF(ISBLANK([.K85]);"";[.K85]*[.$H85]) ->  | N85: of:=IF(ISBLANK([.M85]);"";[.M85]*[.$H85]) ->  | P85: of:=IF(ISBLANK([.O85]);"";[.O85]*[.$H85]) ->  | T85: Diodes
A86: of:=[.B86]&[.C86]&[.E86] -> DBenchBudEE:SOT23-DIODEMMBD914-7-F | B86: D | C86: BenchBudEE:SOT23-DIODE | D86: Diodes Inc. | E86: MMBD914-7-F | F86: 1773539 | H86: 14.4 | I86: 1 | J86: 8 | K86: of:=MAX([.I86];[.J86]) -> 8 | L86: of:=IF(ISBLANK([.K86]);"";[.K86]*[.$H86]) -> 115.2 | M86: 25 | N86: of:=IF(ISBLANK([.M86]);"";[.M86]*[.$H86]) -> 360 | O86: 10 | P86: of:=IF(ISBLANK([.O86]);"";[.O86]*[.$H86]) -> 144 | Q86: http://hu.farnell.com/diodes-inc/mmbd914-7-f/diode-sw-array-75v-0-35w-sot23/dp/1773539 | T86: MMBD914-7-F | U86: SOT-23
L87: of:=SUM([.L2:.L86]) -> 28274.46 | N87: of:=SUM([.N2:.N86]) -> 59443.19 | P87: of:=SUM([.P2:.P86]) -> 35055.05
L88: of:=[.L87]/300 -> 94.2482 | N88: of:=[.N87]/300 -> 198.143966666667 | P88: of:=[.P87]/300 -> 116.850166666667

Sheet: 'file:///home/eelco/projects/ce/session1b/BenchBudEE/bom/BenchBudEE_BOM_KiCad.fods/BenchBudEE.csv'#Sheet1
B1: Value