Sheet: Sheet1
A1: MFG | B1: MFG Part No. | C1: Farnell Part No. | D1: RS Part No. | E1: Price | F1: MOQ | G1: Quantity | H1: Quantity 1 | I1: Price 1 | J1: Quantity 2 | K1: Price 2 | L1: Quantity 3 | M1: Price 3 | N1: Link | O1: Part Index | P1: Section | Q1: Device | R1: 2nd | S1: MFG | T1: MFG Part Number | U1: Quantity | V1: 1 piece price | W1: 1 piece sub total | X1: 100 piece price | Y1: 100 piece subtotal | Z1: 1000 piece price | AA1: 1000 piece subtotal | AB1: DK Link | AE1: 1 | AF1: 100 | AG1: 1000
I2: of:=IF(ISBLANK([.H2]);"";[.H2]*[.$E2]) ->  | K2: of:=IF(ISBLANK([.J2]);"";[.J2]*[.$E2]) ->  | M2: of:=IF(ISBLANK([.L2]);"";[.L2]*[.$E2]) ->  | O2: 1 | P2: Current/Fan | Q2: Power/Mode FET | R2: y | S2: Alpha And Omega | T2: AOD476 | U2: 2 | V2: 0.54 | W2: of:=[.U2]*[.V2] -> 1.08 | X2: 0.3234 | Y2: of:=[.X2]*[.U2] -> 0.6468 | Z2: 0.1862 | AA2: of:=[.Z2]*[.U2] -> 0.3724 | AB2: http://www.digikey.com/product-detail/en/AOD476/785-1112-1-ND/1856055
A3: Fairchild Semiconductor | B3: FDD6630A | C3: 2322585 | E3: 236.18 | F3: 1 | G3: 2 | H3: of:=MAX([.F3];[.G3]) -> 2 | I3: of:=IF(ISBLANK([.H3]);"";[.H3]*[.$E3]) -> 472.36 | J3: 5 | K3: of:=IF(ISBLANK([.J3]);"";[.J3]*[.$E3]) -> 1180.9 | L3: 5 | M3: of:=IF(ISBLANK([.L3]);"";[.L3]*[.$E3]) -> 1180.9 | N3: http://hu.farnell.com/jsp/search/productdetail.jsp?sku=2322585 | O3: 1 | P3: Current/Fan | Q3: Power/Mode FET | R3: y | S3: Fairchild Semiconductor | T3: FDD6630A | U3: 2 | V3: 0.84 | AB3: http://www.findchips.com/search/FDD6630A
I4: of:=IF(ISBLANK([.H4]);"";[.H4]*[.$E4]) ->  | K4: of:=IF(ISBLANK([.J4]);"";[.J4]*[.$E4]) ->  | M4: of:=IF(ISBLANK([.L4]);"";[.L4]*[.$E4]) ->  | O4: 2 | P4: Current/Fan | Q4: Signal FET | R4: y | S4: Diodes Inc | T4: DMN65D8L-7 | U4: 1 | V4: 0.06 | W4: of:=[.U4]*[.V4] -> 0.06 | X4: 0.0348 | Y4: of:=[.X4]*[.U4] -> 0.0348 | Z4: 0.01969 | AA4: of:=[.Z4]*[.U4] -> 0.01969 | AB4: http://www.digikey.com/product-detail/en/DMN65D8L-7/DMN65D8L-7DICT-ND/3677916
A5: NXP | B5: 2N7002 | C5: 1510761 | E5: 11.43 | F5: 5 | G5: 1 | H5: of:=MAX([.F5];[.G5]) -> 5 | I5: of:=IF(ISBLANK([.H5]);"";[.H5]*[.$E5]) -> 57.15 | J5: 5 | K5: of:=IF(ISBLANK([.J5]);"";[.J5]*[.$E5]) -> 57.15 | L5: 5 | M5: of:=IF(ISBLANK([.L5]);"";[.L5]*[.$E5]) -> 57.15 | N5: http://hu.farnell.com/nxp/2n7002/mosfet-n-ch-60v-0-3a-sot23/dp/1510761 | O5: 2 | P5: Current/Fan | Q5: Signal FET | R5: y | S5: ST Micro | T5: 2N7002 (SOT23) | U5: 1 | V5: 0.04 | AB5: http://www.findchips.com/search/2N7002#2953375
A6: TE Connectivity | B6: MINISMDC050F-2 | C6: 1175839 | E6: 110.47 | F6: 5 | G6: 1 | I6: of:=IF(ISBLANK([.H6]);"";[.H6]*[.$E6]) ->  | K6: of:=IF(ISBLANK([.J6]);"";[.J6]*[.$E6]) ->  | M6: of:=IF(ISBLANK([.L6]);"";[.L6]*[.$E6]) ->  | N6: http://hu.farnell.com/te-connectivity-raychem/minismdc050f-2/polyswitch-0-5a-24v-smd/dp/1175839 | O6: 3 | P6: Current/Fan | Q6: PTC | S6: TE Connectivity | T6: MINISMDC050F-2 | U6: 1 | V6: 0.31 | W6: of:=[.U6]*[.V6] -> 0.31 | X6: 0.257 | Y6: of:=[.X6]*[.U6] -> 0.257 | Z6: 0.173 | AA6: of:=[.Z6]*[.U6] -> 0.173 | AB6: http://www.digikey.com/product-detail/en/MINISMDC050F-2/MINISMDC050FCT-ND/1045862
A7: Microchip | B7: MCP4801-E/SN | E7: 250 | F7: 5 | G7: 1 | H7: 5 | I7: of:=IF(ISBLANK([.H7]);"";[.H7]*[.$E7]) -> 1250 | J7: 5 | K7: of:=IF(ISBLANK([.J7]);"";[.J7]*[.$E7]) -> 1250 | L7: 5 | M7: of:=IF(ISBLANK([.L7]);"";[.L7]*[.$E7]) -> 1250 | N7: http://www.microchipdirect.com/ProductSearch.aspx?Keywords=MCP4801-E/SN | O7: 4 | P7: Current/Fan | Q7: MCP4801 | S7: Microchip | T7: MCP4801-E/SN | V7: 1.36 | W7: of:=[.U7]*[.V7] -> 0 | X7: 0.86 | Y7: of:=[.X7]*[.U7] -> 0 | Z7: 0.86 | AA7: of:=[.Z7]*[.U7] -> 0 | AB7: http://www.digikey.com/product-detail/en/MCP4801-E%2FSN/MCP4801-E%2FSN-ND/2332805
A8: IMO Precision Controls | B8: 20.501M/3 | C8: 9632980 | E8: 129.52 | F8: 1 | G8: 1 | H8: of:=MAX([.F8];[.G8]) -> 1 | I8: of:=IF(ISBLANK([.H8]);"";[.H8]*[.$E8]) -> 129.52 | J8: 3 | K8: of:=IF(ISBLANK([.J8]);"";[.J8]*[.$E8]) -> 388.56 | L8: 1 | M8: of:=IF(ISBLANK([.L8]);"";[.L8]*[.$E8]) -> 129.52 | N8: http://hu.farnell.com/imo-precision-controls/20-501m-3/terminal-block-pcb-3way-21-14awg/dp/9632980 | O8: 5 | P8: Interface | Q8: 3 pin 5.0mm Terminal Block | S8: Phoenix Contact | T8: 1935174 | U8: 1 | V8: 0.5 | W8: of:=[.U8]*[.V8] -> 0.5 | X8: 0.4494 | Y8: of:=[.X8]*[.U8] -> 0.4494 | Z8: 0.357 | AA8: of:=[.Z8]*[.U8] -> 0.357 | AB8: http://www.digikey.com/product-detail/en/1935174/277-1578-ND/568615 | AD8: Power Modify | AE8: of:=SUMIF([.$P$2:.$P$97];[.$AD8];[.W$2:.W$97]) -> 9.64 | AF8: of:=SUMIF([.$P$2:.$P$97];[.$AD8];[.X$2:.X$97]) -> 2.0764 | AG8: of:=SUMIF([.$P$2:.$P$97];[.$AD8];[.AA$2:.AA$97]) -> 2.55312
I9: of:=IF(ISBLANK([.H9]);"";[.H9]*[.$E9]) ->  | K9: of:=IF(ISBLANK([.J9]);"";[.J9]*[.$E9]) ->  | M9: of:=IF(ISBLANK([.L9]);"";[.L9]*[.$E9]) ->  | O9: 6 | P9: Interface | Q9: 12 input 3.5 mm Terminal Block | R9: y | S9: On Shore | T9: OSTTE120104 | U9: 1 | V9: 1.57 | W9: of:=[.U9]*[.V9] -> 1.57 | X9: 1.22 | Y9: of:=[.X9]*[.U9] -> 1.22 | Z9: 0.875 | AA9: of:=[.Z9]*[.U9] -> 0.875 | AB9: http://www.digikey.com/product-detail/en/OSTTE120104/ED2737-ND/2351813
A10: Phoenix Contact | B10: 1984714 | D10: 648-8793 | E10: 500 | F10: 1 | G10: 1 | I10: of:=IF(ISBLANK([.H10]);"";[.H10]*[.$E10]) ->  | K10: of:=IF(ISBLANK([.J10]);"";[.J10]*[.$E10]) ->  | M10: of:=IF(ISBLANK([.L10]);"";[.L10]*[.$E10]) ->  | N10: http://hu.rs-online.com/web/p/biztositek-nelkuli-sorkapcsok/6488793/ | O10: 6 | P10: Interface | Q10: 12 input 3.5 mm Terminal Block | R10: y | S10: Phoenix Contact | T10: 1984714 | U10: 1 | V10: 2.2 | AB10: http://www.findchips.com/search/1984714
A11: Wieland Electric | B11: 25.195.1253.0 | C11: 1172825 | E11: 1321.83 | F11: 5 | G11: 1 | I11: of:=IF(ISBLANK([.H11]);"";[.H11]*[.$E11]) ->  | K11: of:=IF(ISBLANK([.J11]);"";[.J11]*[.$E11]) ->  | M11: of:=IF(ISBLANK([.L11]);"";[.L11]*[.$E11]) ->  | N11: http://hu.farnell.com/wieland-electric/25-195-1253-0/terminal-block-3-5mm-12way/dp/1172825 | O11: 6
A12: CamdenBoss | B12: CTB0355/12 | C12: 2315251 | E12: 1146.6 | F12: 1 | G12: 1 | H12: of:=MAX([.F12];[.G12]) -> 1 | I12: of:=IF(ISBLANK([.H12]);"";[.H12]*[.$E12]) -> 1146.6 | J12: 3 | K12: of:=IF(ISBLANK([.J12]);"";[.J12]*[.$E12]) -> 3439.8 | L12: 1 | M12: of:=IF(ISBLANK([.L12]);"";[.L12]*[.$E12]) -> 1146.6 | N12: http://hu.farnell.com/camdenboss/ctb0355-12/terminal-block-stanadrd-12p-30/dp/2315251 | O12: 27
A13: Molex | B13: 39-30-1240 | C13: 9963472 | E13: 860.9 | F13: 1 | G13: 1 | H13: of:=MAX([.F13];[.G13]) -> 1 | I13: of:=IF(ISBLANK([.H13]);"";[.H13]*[.$E13]) -> 860.9 | J13: 3 | K13: of:=IF(ISBLANK([.J13]);"";[.J13]*[.$E13]) -> 2582.7 | L13: 1 | M13: of:=IF(ISBLANK([.L13]);"";[.L13]*[.$E13]) -> 860.9 | N13: http://hu.farnell.com/molex/39-30-1240/header-mini-fit-r-a-w-peg-24way/dp/9963472 | O13: 7 | P13: Interface | Q13: ATX connector | S13: Molex | T13: 39-30-1240 | U13: 1 | V13: 3.56 | W13: of:=[.U13]*[.V13] -> 3.56 | X13: 2.49 | Y13: of:=[.X13]*[.U13] -> 2.49 | Z13: 1.89 | AA13: of:=[.Z13]*[.U13] -> 1.89 | AB13: http://www.mouser.com/ProductDetail/Molex/39-30-1240/?qs=sGAEpiMZZMs%252bGHln7q6pm%252bS0pk2Wo0Xxrf8ldfSZpwQ%3d | AD13: Slush | AE13: of:=SUM([.AE1:.AE9])*0.3 -> 3.192 | AF13: of:=SUM([.AF1:.AF9])*0.3 -> 30.62292 | AG13: of:=SUM([.AG1:.AG9])*0.3 -> 300.765936
A14: Multicomp | B14: SPC20484 | C14: 1462888 | E14: 327.6 | F14: 1 | G14: 1 | H14: of:=MAX([.F14];[.G14]) -> 1 | I14: of:=IF(ISBLANK([.H14]);"";[.H14]*[.$E14]) -> 327.6 | J14: 3 | K14: of:=IF(ISBLANK([.J14]);"";[.J14]*[.$E14]) -> 982.8 | L14: 1 | M14: of:=IF(ISBLANK([.L14]);"";[.L14]*[.$E14]) -> 327.6 | N14: http://hu.farnell.com/multicomp/spc20484/header-1row-40way/dp/1462888 | O14: 8 | P14: Interface | Q14: 36 pin Breakaway | R14: y | S14: Molex | T14: 22284360 | U14: 1 | V14: 0.89 | W14: of:=[.U14]*[.V14] -> 0.89 | X14: 0.6548 | Y14: of:=[.X14]*[.U14] -> 0.6548 | Z14: 0.44432 | AA14: of:=[.Z14]*[.U14] -> 0.44432 | AB14: http://www.digikey.com/product-detail/en/0022284360/WM50014-36-ND/313821
A15: Diodes Inc. | B15: AP5726WG-7 | D15: 751-3017 | E15: 99 | F15: 25 | G15: 1 | I15: of:=IF(ISBLANK([.H15]);"";[.H15]*[.$E15]) ->  | K15: of:=IF(ISBLANK([.J15]);"";[.J15]*[.$E15]) ->  | M15: of:=IF(ISBLANK([.L15]);"";[.L15]*[.$E15]) ->  | N15: http://hu.rs-online.com/web/p/led-kijelzomeghajto/7513017/ | O15: 9 | P15: LED | Q15: AP5726 | S15: Diodes Inc | T15: AP5726WG-7 | U15: 1 | V15: 0.64 | W15: of:=[.U15]*[.V15] -> 0.64 | X15: 0.4 | Y15: of:=[.X15]*[.U15] -> 0.4 | Z15: 0.22 | AA15: of:=[.Z15]*[.U15] -> 0.22 | AB15: http://www.digikey.com/product-detail/en/AP5726WG-7/AP5726WG-7DICT-ND/2639342
A16: Taiwan Semiconductor | B16: TS19371CX6 RF | C16: 1824780 | E16: 319.98 | F16: 1 | G16: 1 | H16: of:=MAX([.F16];[.G16]) -> 1 | I16: of:=IF(ISBLANK([.H16]);"";[.H16]*[.$E16]) -> 319.98 | J16: 3 | K16: of:=IF(ISBLANK([.J16]);"";[.J16]*[.$E16]) -> 959.94 | L16: 2 | M16: of:=IF(ISBLANK([.L16]);"";[.L16]*[.$E16]) -> 639.96 | N16: http://hu.farnell.com/taiwan-semiconductor/ts19371cx6-rf/ic-led-driver-sot26-6/dp/1824780 | O16: 27
A17: Diodes Inc. | B17: B0540WS-7 | C17: 1773477 | E17: 163.8 | F17: 1 | G17: 1 | H17: of:=MAX([.F17];[.G17]) -> 1 | I17: of:=IF(ISBLANK([.H17]);"";[.H17]*[.$E17]) -> 163.8 | J17: 3 | K17: of:=IF(ISBLANK([.J17]);"";[.J17]*[.$E17]) -> 491.4 | L17: 2 | M17: of:=IF(ISBLANK([.L17]);"";[.L17]*[.$E17]) -> 327.6 | N17: http://hu.farnell.com/diodes-inc/b0540ws-7/diode-scky-recti-0-5a-40v-sod323/dp/1773477 | O17: 10 | P17: LED | Q17: B0540WS-7 | S17: Diodes Inc | T17: B0540WS-7 | U17: 1 | V17: 0.45 | W17: of:=[.U17]*[.V17] -> 0.45 | X17: 0.1911 | Y17: of:=[.X17]*[.U17] -> 0.1911 | Z17: 0.08295 | AA17: of:=[.Z17]*[.U17] -> 0.08295 | AB17: http://www.digikey.com/product-search/en?x=0&y=0&lang=en&site=us&KeyWords=B0540WS
A18: Würth Elektronik | B18: 744031220 | C18: 1890602 | E18: 399.98 | F18: 1 | G18: 1 | H18: of:=MAX([.F18];[.G18]) -> 1 | I18: of:=IF(ISBLANK([.H18]);"";[.H18]*[.$E18]) -> 399.98 | J18: 3 | K18: of:=IF(ISBLANK([.J18]);"";[.J18]*[.$E18]) -> 1199.94 | L18: 2 | M18: of:=IF(ISBLANK([.L18]);"";[.L18]*[.$E18]) -> 799.96 | N18: http://hu.farnell.com/wurth-elektronik/744031220/inductor-power-22uh-30-0-51a/dp/1890602 | O18: 11 | P18: LED | Q18: NR4012T220M | S18: Toiyo Yuden | T18: NR4012T220M | U18: 1 | V18: 0.4 | W18: of:=[.U18]*[.V18] -> 0.4 | X18: 0.3325 | Y18: of:=[.X18]*[.U18] -> 0.3325 | Z18: 0.21375 | AA18: of:=[.Z18]*[.U18] -> 0.21375 | AB18: http://www.digikey.com/product-detail/en/NR4012T220M/587-1660-1-ND/1008275
I19: of:=IF(ISBLANK([.H19]);"";[.H19]*[.$E19]) ->  | K19: of:=IF(ISBLANK([.J19]);"";[.J19]*[.$E19]) ->  | M19: of:=IF(ISBLANK([.L19]);"";[.L19]*[.$E19]) ->  | O19: 12 | P19: Power Modify | Q19: 10V linear | R19: y | S19: On Semiconductor | T19: LM317TG | U19: 2 | V19: 0.57 | W19: of:=[.U19]*[.V19] -> 1.14 | X19: 0.3624 | Y19: of:=[.X19]*[.U19] -> 0.7248 | Z19: 0.20536 | AA19: of:=[.Z19]*[.U19] -> 0.41072 | AB19: http://www.digikey.com/product-detail/en/LM317TG/LM317TGOS-ND/918508
A20: ON Semiconductor | B20: LM317TG | C20: 1652293 | E20: 186.66 | F20: 1 | G20: 2 | H20: of:=MAX([.F20];[.G20]) -> 2 | I20: of:=IF(ISBLANK([.H20]);"";[.H20]*[.$E20]) -> 373.32 | J20: 5 | K20: of:=IF(ISBLANK([.J20]);"";[.J20]*[.$E20]) -> 933.3 | L20: 3 | M20: of:=IF(ISBLANK([.L20]);"";[.L20]*[.$E20]) -> 559.98 | N20: http://hu.farnell.com/on-semiconductor/lm317tg/ic-voltage-regulator/dp/1652293 | O20: 12 | P20: Power Modify | Q20: 10V linear | R20: y | S20: On Semiconductor | T20: LM317MTG | U20: 2 | V20: 0.64 | AB20: http://www.findchips.com/search/LM317MTG
I21: of:=IF(ISBLANK([.H21]);"";[.H21]*[.$E21]) ->  | K21: of:=IF(ISBLANK([.J21]);"";[.J21]*[.$E21]) ->  | M21: of:=IF(ISBLANK([.L21]);"";[.L21]*[.$E21]) ->  | O21: 13 | P21: Power Modify | Q21: -10V linear | R21: y | S21: Fairchild Semiconductor | T21: LM337TFS | U21: 2 | V21: 0.71 | W21: of:=[.U21]*[.V21] -> 1.42 | X21: 0.482 | Y21: of:=[.X21]*[.U21] -> 0.964 | Z21: 0.2856 | AA21: of:=[.Z21]*[.U21] -> 0.5712 | AB21: http://www.digikey.com/product-detail/en/LM337T/LM337TFS-ND/458683
A22: ON Semiconductor | B22: LM337TG | C22: 1211104 | E22: 236.18 | F22: 1 | G22: 2 | H22: of:=MAX([.F22];[.G22]) -> 2 | I22: of:=IF(ISBLANK([.H22]);"";[.H22]*[.$E22]) -> 472.36 | J22: 5 | K22: of:=IF(ISBLANK([.J22]);"";[.J22]*[.$E22]) -> 1180.9 | L22: 3 | M22: of:=IF(ISBLANK([.L22]);"";[.L22]*[.$E22]) -> 708.54 | N22: http://hu.farnell.com/on-semiconductor/lm337tg/v-reg-adj-1-2-37v-to-220-3-337/dp/1211104 | O22: 13 | P22: Power Modify | Q22: -10V linear | R22: y | S22: Fairchild Semiconductor | T22: LM337BTG | U22: 2 | V22: 0.71 | W22: of:=[.U22]*[.V22] -> 1.42 | X22: 0.482 | Y22: of:=[.X22]*[.U22] -> 0.964 | Z22: 0.2856 | AA22: of:=[.Z22]*[.U22] -> 0.5712 | AB22: http://www.findchips.com/search/LM337BTG
I23: of:=IF(ISBLANK([.H23]);"";[.H23]*[.$E23]) ->  | K23: of:=IF(ISBLANK([.J23]);"";[.J23]*[.$E23]) ->  | M23: of:=IF(ISBLANK([.L23]);"";[.L23]*[.$E23]) ->  | O23: 16 | P23: Power Modify | Q23: Potentiometer | R23: y* | S23: Panasonic Electric Components | T23: EVU-E3KFK4B53 | U23: 2 | V23: 1 | W23: of:=[.U23]*[.V23] -> 2 | X23: 0.75 | Y23: of:=[.X23]*[.U23] -> 1.5 | Z23: 0.5 | AA23: of:=[.Z23]*[.U23] -> 1 | AB23: http://www.digikey.com/product-detail/en/EVU-E3KFK4B53/P3W1502-ND/243676
A24: Bourns | B24: 3310C-1-502L | C24: 9353895 | E24: 1020.89 | F24: 1 | G24: 2 | H24: of:=MAX([.F24];[.G24]) -> 2 | I24: of:=IF(ISBLANK([.H24]);"";[.H24]*[.$E24]) -> 2041.78 | J24: 5 | K24: of:=IF(ISBLANK([.J24]);"";[.J24]*[.$E24]) -> 5104.45 | L24: 2 | M24: of:=IF(ISBLANK([.L24]);"";[.L24]*[.$E24]) -> 2041.78 | N24: http://hu.farnell.com/bourns/3310c-1-502l/potentiometer-5k/dp/9353895?Ntt=3310C-1-502L | O24: 16 | P24: Power Modify | Q24: Potentiometer | R24: y* | S24: Bourns Inc | T24: 3310C-1-502L | U24: 2 | V24: 2.35 | AB24: http://www.findchips.com/search/3310C-1-502L
A25: Diodes Inc. | B25: S1M-13-F | C25: 1773482 | E25: 59.43 | F25: 1 | G25: 8 | H25: of:=MAX([.F25];[.G25]) -> 8 | I25: of:=IF(ISBLANK([.H25]);"";[.H25]*[.$E25]) -> 475.44 | J25: 20 | K25: of:=IF(ISBLANK([.J25]);"";[.J25]*[.$E25]) -> 1188.6 | L25: 10 | M25: of:=IF(ISBLANK([.L25]);"";[.L25]*[.$E25]) -> 594.3 | N25: http://hu.farnell.com/diodes-inc/s1m-13-f/diode-stand-rec-gpp-1a-1000v-sma/dp/1773482 | O25: 17 | P25: Power Modify | Q25: Diode | S25: Diodes Inc | T25: S1M-13-F | U25: 4 | V25: 0.15 | AB25: http://www.digikey.com/product-detail/en/S1M-13-F/S1M-FDICT-ND/804909
A26: TE Connectivity | B26: MINISMDC050F-2 | C26: 1175839 | E26: 110.47 | F26: 5 | G26: 4 | H26: of:=MAX([.F26];[.G26]) -> 5 | I26: of:=IF(ISBLANK([.H26]);"";[.H26]*[.$E26]) -> 552.35 | J26: 15 | K26: of:=IF(ISBLANK([.J26]);"";[.J26]*[.$E26]) -> 1657.05 | L26: 5 | M26: of:=IF(ISBLANK([.L26]);"";[.L26]*[.$E26]) -> 552.35 | N26: http://hu.farnell.com/te-connectivity-raychem/minismdc050f-2/polyswitch-0-5a-24v-smd/dp/1175839 | O26: 18 | P26: Protection/Filtering | Q26: PTC | S26: TE Connectivity | T26: MINISMDC050F-2 | U26: 4 | V26: 0.31 | W26: of:=[.U26]*[.V26] -> 1.24 | X26: 0.258 | Y26: of:=[.X26]*[.U26] -> 1.032 | Z26: 0.173 | AA26: of:=[.Z26]*[.U26] -> 0.692 | AB26: www.digikey.com/product-detail/en/MINISMDC050F-2/MINISMDC050FCT-ND/1045862
A27: Bourns | B27: CM322522-220KL | C27: 9357912 | E27: 69.71 | F27: 10 | G27: 3 | H27: of:=MAX([.F27];[.G27]) -> 10 | I27: of:=IF(ISBLANK([.H27]);"";[.H27]*[.$E27]) -> 697.1 | J27: 10 | K27: of:=IF(ISBLANK([.J27]);"";[.J27]*[.$E27]) -> 697.1 | L27: 10 | M27: of:=IF(ISBLANK([.L27]);"";[.L27]*[.$E27]) -> 697.1 | N27: http://hu.farnell.com/bourns/cm322522-220kl/inductor-22uh/dp/9357912 | O27: 19 | P27: Protection/Filtering | Q27: Inductor | S27: Bourns Inc | T27: CM322522-220KL | U27: 2 | V27: 0.22 | W27: of:=[.U27]*[.V27] -> 0.44 | X27: 0.144 | Y27: of:=[.X27]*[.U27] -> 0.288 | Z27: 0.102 | AA27: of:=[.Z27]*[.U27] -> 0.204 | AB27: http://www.digikey.com/product-detail/en/CM322522-220KL/CM322522-220KLCT-ND/3437950
A28: C&K Components | B28: OS102011MA1QN1 | C28: 1201431 | E28: 171.42 | F28: 5 | G28: 1 | H28: of:=MAX([.F28];[.G28]) -> 5 | I28: of:=IF(ISBLANK([.H28]);"";[.H28]*[.$E28]) -> 857.1 | J28: 5 | K28: of:=IF(ISBLANK([.J28]);"";[.J28]*[.$E28]) -> 857.1 | L28: 5 | M28: of:=IF(ISBLANK([.L28]);"";[.L28]*[.$E28]) -> 857.1 | N28: http://hu.farnell.com/c-k-components/os102011ma1qn1/switch-spdt-0-1a-12v-pcb-r-a/dp/1201431 | O28: 20 | P28: Protection/Filtering | Q28: Switch | S28: C&K Components | T28: OS102011MA1QN1 | U28: 1 | V28: 0.35 | W28: of:=[.U28]*[.V28] -> 0.35 | X28: 0.282 | Y28: of:=[.X28]*[.U28] -> 0.282 | Z28: 0.226 | AA28: of:=[.Z28]*[.U28] -> 0.226 | AB28: http://www.digikey.com/product-detail/en/OS102011MA1QN1/CKN9559-ND/1981430
I29: of:=IF(ISBLANK([.H29]);"";[.H29]*[.$E29]) ->  | K29: of:=IF(ISBLANK([.J29]);"";[.J29]*[.$E29]) ->  | M29: of:=IF(ISBLANK([.L29]);"";[.L29]*[.$E29]) ->  | O29: 21 | P29: Relay | Q29: SPDT | R29: y | S29: TE Connectivity | T29: 1461069-5 | U29: 1 | V29: 1.15 | W29: of:=[.U29]*[.V29] -> 1.15 | X29: 0.72 | Y29: of:=[.X29]*[.U29] -> 0.72 | Z29: 0.58 | AA29: of:=[.Z29]*[.U29] -> 0.58 | AB29: http://www.digikey.com/product-detail/en/1461069-5/PB1321-ND/3318145 | AD29: LED | AE29: of:=SUMIF([.$P$2:.$P$37];[.$AD29];[.W$2:.W$97]) -> 1.49 | AF29: of:=SUMIF([.$P$2:.$P$37];[.$AD29];[.Y$2:.Y$97]) -> 0.9236 | AG29: of:=SUMIF([.$P$2:.$P$37];[.$AD29];[.AA$2:.AA$97]) -> 0.5167
A30: Omron | B30: G5LA-1 12DC | C30: 1455504 | E30: 247.61 | F30: 1 | G30: 1 | H30: of:=MAX([.F30];[.G30]) -> 1 | I30: of:=IF(ISBLANK([.H30]);"";[.H30]*[.$E30]) -> 247.61 | J30: 3 | K30: of:=IF(ISBLANK([.J30]);"";[.J30]*[.$E30]) -> 742.83 | L30: 1 | M30: of:=IF(ISBLANK([.L30]);"";[.L30]*[.$E30]) -> 247.61 | N30: http://hu.farnell.com/omron-electronic-components/g5la-1-12dc/relay-pcb-spdt-12vdc-10a/dp/1455504 | O30: 21 | P30: Relay | Q30: SPDT | R30: y | S30: OMRON | T30: G5LA-1 12DC | U30: 1 | V30: 0.7 | AB30: http://www.findchips.com/search/G5LA-1%2012DC
A31: Diodes Inc. | B31: MMBT3904-7-F | C31: 1773602 | E31: 17.52 | F31: 1 | G31: 1 | H31: of:=MAX([.F31];[.G31]) -> 1 | I31: of:=IF(ISBLANK([.H31]);"";[.H31]*[.$E31]) -> 17.52 | J31: 3 | K31: of:=IF(ISBLANK([.J31]);"";[.J31]*[.$E31]) -> 52.56 | L31: 3 | M31: of:=IF(ISBLANK([.L31]);"";[.L31]*[.$E31]) -> 52.56 | N31: http://hu.farnell.com/diodes-inc/mmbt3904-7-f/transistor-npn-sot23/dp/1773602 | O31: 22 | P31: Relay | Q31: NPN (MMBT3904) | S31: Diodes Inc | T31: MMBT3904-7-F | U31: 1 | V31: 0.12 | W31: of:=[.U31]*[.V31] -> 0.12 | X31: 0.0742 | Y31: of:=[.X31]*[.U31] -> 0.0742 | Z31: 0.02472 | AA31: of:=[.Z31]*[.U31] -> 0.02472 | AB31: http://www.digikey.com/product-detail/en/MMBT3904-7-F/MMBT3904-FDICT-ND/815727
I32: of:=IF(ISBLANK([.H32]);"";[.H32]*[.$E32]) ->  | K32: of:=IF(ISBLANK([.J32]);"";[.J32]*[.$E32]) ->  | M32: of:=IF(ISBLANK([.L32]);"";[.L32]*[.$E32]) ->  | O32: 23 | P32: Relay | Q32: Opto | R32: y | S32: Lite On Ince | T32: LTV-816S | U32: 1 | V32: 0.39 | W32: of:=[.U32]*[.V32] -> 0.39 | X32: 0.1814 | Y32: of:=[.X32]*[.U32] -> 0.1814 | Z32: 0.10206 | AA32: of:=[.Z32]*[.U32] -> 0.10206 | AB32: www.digikey.com/product-detail/en/LTV-816S/160-1361-5-ND/385831
A33: Avago Technologies | B33: ACPL-217-500E | C33: 1602614 | E33: 91.8 | F33: 1 | G33: 1 | H33: of:=MAX([.F33];[.G33]) -> 1 | I33: of:=IF(ISBLANK([.H33]);"";[.H33]*[.$E33]) -> 91.8 | J33: 3 | K33: of:=IF(ISBLANK([.J33]);"";[.J33]*[.$E33]) -> 275.4 | L33: 3 | M33: of:=IF(ISBLANK([.L33]);"";[.L33]*[.$E33]) -> 275.4 | N33: http://hu.farnell.com/avago-technologies/acpl-217-500e/optocoupler-3kv-transistor-o-p/dp/1602614 | O33: 23 | P33: Relay | Q33: Opto | R33: y | S33: Lite On Ince | T33: ACPL-217-500E | U33: 1 | AB33: http://www.findchips.com/search/ACPL-217-500E
A34: Diodes Inc. | B34: B130-13-F | C34: 1843713 | E34: 118.09 | F34: 1 | G34: 1 | H34: of:=MAX([.F34];[.G34]) -> 1 | I34: of:=IF(ISBLANK([.H34]);"";[.H34]*[.$E34]) -> 118.09 | J34: 3 | K34: of:=IF(ISBLANK([.J34]);"";[.J34]*[.$E34]) -> 354.27 | L34: 2 | M34: of:=IF(ISBLANK([.L34]);"";[.L34]*[.$E34]) -> 236.18 | N34: http://hu.farnell.com/diodes-inc/b130-13-f/diode-schottky-1a-30v-sma/dp/1843713 | O34: 24 | P34: Relay | Q34: B130-13-F | S34: Diodes Inc | T34: B130-13-F | U34: 1 | V34: 0.43 | W34: of:=[.U34]*[.V34] -> 0.43 | X34: 0.1802 | Y34: of:=[.X34]*[.U34] -> 0.1802 | Z34: 0.0782 | AA34: of:=[.Z34]*[.U34] -> 0.0782 | AB34: http://www.digikey.com/product-detail/en/B130-13-F/B130-FDICT-ND/815318
I35: of:=IF(ISBLANK([.H35]);"";[.H35]*[.$E35]) ->  | K35: of:=IF(ISBLANK([.J35]);"";[.J35]*[.$E35]) ->  | M35: of:=IF(ISBLANK([.L35]);"";[.L35]*[.$E35]) ->  | O35: 25 | P35: Relay | Q35: LED | R35: y | S35: OSRAM Opto | T35: LG Q971-KN-1 | U35: 1 | V35: 0.08 | W35: of:=[.U35]*[.V35] -> 0.08 | X35: 0.0546 | Y35: of:=[.X35]*[.U35] -> 0.0546 | Z35: 0.04 | AA35: of:=[.Z35]*[.U35] -> 0.04 | AB35: http://www.digikey.com/product-detail/en/LG%20Q971-KN-1/475-1409-1-ND/1802597
A36: Kingbright | B36: KP-1608CGCK | C36: 2290328 | E36: 24 | F36: 1 | G36: 1 | H36: of:=MAX([.F36];[.G36]) -> 1 | I36: of:=IF(ISBLANK([.H36]);"";[.H36]*[.$E36]) -> 24 | J36: 3 | K36: of:=IF(ISBLANK([.J36]);"";[.J36]*[.$E36]) -> 72 | L36: 3 | M36: of:=IF(ISBLANK([.L36]);"";[.L36]*[.$E36]) -> 72 | N36: http://hu.farnell.com/kingbright/kp-1608cgck/led-0603-50mcd-green/dp/2290328 | O36: 25 | P36: Relay | Q36: LED | R36: y | S36: Kingbright | T36: KP-1608CGCK | U36: 1 | V36: 0.16 | AB36: http://www.findchips.com/search/KP-1608CGCK
A37: Microchip | B37: MCP3901A0-I/SS | C37: 1825015 | E37: 639.96 | F37: 1 | G37: 1 | I37: of:=IF(ISBLANK([.H37]);"";[.H37]*[.$E37]) ->  | K37: of:=IF(ISBLANK([.J37]);"";[.J37]*[.$E37]) ->  | M37: of:=IF(ISBLANK([.L37]);"";[.L37]*[.$E37]) ->  | N37: http://hu.farnell.com/microchip/mcp3901a0-i-ss/ic-afe-24bit-64ksps-20ssop/dp/1825015 | O37: 27 | P37: TC/Analog | Q37: MCP3901 | S37: Microchip | T37: MCP3901A0-I/SS | U37: 1 | V37: 2.39 | W37: of:=[.U37]*[.V37] -> 2.39 | X37: 1.51 | Y37: of:=[.X37]*[.U37] -> 1.51 | Z37: 1.51 | AA37: of:=[.Z37]*[.U37] -> 1.51 | AB37: http://www.digikey.com/product-detail/en/MCP3901A0-I%2FSS/MCP3901A0-I%2FSS-ND/2179119 | AD37: Total | AE37: of:=SUM([.W37:.W123])+[.AE50] -> 17.23 | AF37: of:=SUM([.X37:.X123])+[.AF50] -> 7.2956 | AG37: of:=SUM([.Y37:.Y123])+[.AG50] -> 8.1316
A38: Microchip | B38: MCP3901A0-I/SS | E38: 450 | F38: 5 | G38: 1 | H38: 5 | I38: of:=IF(ISBLANK([.H38]);"";[.H38]*[.$E38]) -> 2250 | J38: 5 | K38: of:=IF(ISBLANK([.J38]);"";[.J38]*[.$E38]) -> 2250 | L38: 5 | M38: of:=IF(ISBLANK([.L38]);"";[.L38]*[.$E38]) -> 2250 | N38: http://www.microchipdirect.com/ProductSearch.aspx?Keywords=MCP3901A0-I/SS | O38: 27 | P38: TC/Analog | Q38: MCP3901 | S38: Microchip | T38: MCP3901A0-I/SS | U38: 1 | V38: 2.39 | W38: of:=[.U38]*[.V38] -> 2.39 | X38: 1.51 | Y38: of:=[.X38]*[.U38] -> 1.51 | Z38: 1.51 | AA38: of:=[.Z38]*[.U38] -> 1.51 | AB38: http://www.digikey.com/product-detail/en/MCP3901A0-I%2FSS/MCP3901A0-I%2FSS-ND/2179119 | AD38: Total | AE38: of:=SUM([.W38:.W124])+[.AE51] -> 14.84 | AF38: of:=SUM([.X38:.X124])+[.AF51] -> 5.7856 | AG38: of:=SUM([.Y38:.Y124])+[.AG51] -> 6.6216
I39: of:=IF(ISBLANK([.H39]);"";[.H39]*[.$E39]) ->  | K39: of:=IF(ISBLANK([.J39]);"";[.J39]*[.$E39]) ->  | M39: of:=IF(ISBLANK([.L39]);"";[.L39]*[.$E39]) ->  | O39: 27 | P39: TC/Analog | Q39: OPA4170 | R39: y | S39: Texas Instruments | T39: OPA4170AIDR | U39: 1 | V39: 2.58 | W39: of:=[.U39]*[.V39] -> 2.58 | X39: 1.87 | Y39: of:=[.X39]*[.U39] -> 1.87 | Z39: 1.32 | AA39: of:=[.Z39]*[.U39] -> 1.32 | AB39: http://www.digikey.com/product-detail/en/OPA4170AIDR/296-29664-1-ND/2762167 | AD39: TC/Analog | AE39: of:=SUMIF([.$P$2:.$P$37];[.$AD39];[.W$2:.W$97]) -> 2.39 | AF39: of:=SUMIF([.$P$2:.$P$37];[.$AD39];[.Y$2:.Y$97]) -> 1.51 | AG39: of:=SUMIF([.$P$2:.$P$37];[.$AD39];[.AA$2:.AA$97]) -> 1.51
A40: Texas Instruments | B40: OPA4170AID | C40: 2382790 | E40: 735.2 | F40: 1 | G40: 1 | H40: of:=MAX([.F40];[.G40]) -> 1 | I40: of:=IF(ISBLANK([.H40]);"";[.H40]*[.$E40]) -> 735.2 | J40: 3 | K40: of:=IF(ISBLANK([.J40]);"";[.J40]*[.$E40]) -> 2205.6 | L40: 2 | M40: of:=IF(ISBLANK([.L40]);"";[.L40]*[.$E40]) -> 1470.4 | N40: http://hu.farnell.com/texas-instruments/opa4170aid/op-amp-1-2mhz-0-4v-us-soic-14/dp/2382790 | O40: 27 | P40: TC/Analog | Q40: OPA4170 | R40: y | S40: Texas Instruments | T40: OPA4170AID | U40: 1 | V40: 2.58 | W40: of:=[.U40]*[.V40] -> 2.58 | X40: 1.87 | Y40: of:=[.X40]*[.U40] -> 1.87 | Z40: 1.32 | AA40: of:=[.Z40]*[.U40] -> 1.32 | AB40: http://www.findchips.com/search/OPA4170AID
A41: Texas Instruments | B41: LMT84DCKT | C41: 2314386 | E41: 148.56 | F41: 1 | G41: 1 | H41: of:=MAX([.F41];[.G41]) -> 1 | I41: of:=IF(ISBLANK([.H41]);"";[.H41]*[.$E41]) -> 148.56 | J41: 3 | K41: of:=IF(ISBLANK([.J41]);"";[.J41]*[.$E41]) -> 445.68 | L41: 2 | M41: of:=IF(ISBLANK([.L41]);"";[.L41]*[.$E41]) -> 297.12 | N41: http://hu.farnell.com/texas-instruments/lmt84dckt/temp-sensor-1-5v-50-to-150-deg/dp/2314386 | O41: 28 | P41: TC/Analog | Q41: LMT84 | S41: Texas Instruments | T41: LMT84DCKT | U41: 1 | V41: 0.73 | W41: of:=[.U41]*[.V41] -> 0.73 | X41: 0.2376 | Y41: of:=[.X41]*[.U41] -> 0.2376 | Z41: 0.224 | AA41: of:=[.Z41]*[.U41] -> 0.224 | AB41: http://www.digikey.com/product-detail/en/LMT84DCKT/296-35727-2-ND/3974441 | AD41: Current/Fan | AE41: of:=SUMIF([.$P$2:.$P$37];[.$AD41];[.W$2:.W$97]) -> 1.45 | AF41: of:=SUMIF([.$P$2:.$P$37];[.$AD41];[.Y$2:.Y$97]) -> 0.9386 | AG41: of:=SUMIF([.$P$2:.$P$37];[.$AD41];[.AA$2:.AA$97]) -> 0.56509
I42: of:=IF(ISBLANK([.H42]);"";[.H42]*[.$E42]) ->  | K42: of:=IF(ISBLANK([.J42]);"";[.J42]*[.$E42]) ->  | M42: of:=IF(ISBLANK([.L42]);"";[.L42]*[.$E42]) ->  | O42: 29 | P42: TC/Analog | Q42: .1% 20K, 1206 | R42: y | S42: Susumu | T42: RG3216P-2002-B-T1 | U42: 4 | V42: 0.65 | W42: of:=[.U42]*[.V42] -> 2.6 | X42: 0.24 | Y42: of:=[.X42]*[.U42] -> 0.96 | Z42: 0.14 | AA42: of:=[.Z42]*[.U42] -> 0.56 | AB42: http://www.digikey.com/product-search/en?v=408&FV=fff40001%2Cfff800e9%2C40127%2Cc002c%2Cc002d%2Cc0059%2Cc0061%2Cc007b%2Cc00b5%2C1c0002&k=1206+resistor&mnonly=0&newproducts=0&ColumnSort=100001&page=1&stock=1&quantity=1&ptm=0&fid=0&pageSize=100&k=1206+resistor&filterAlwaysExpand=1 | AD42: Relay | AE42: of:=SUMIF([.$P$2:.$P$37];[.$AD42];[.W$2:.W$97]) -> 2.17 | AF42: of:=SUMIF([.$P$2:.$P$37];[.$AD42];[.Y$2:.Y$97]) -> 1.2104 | AG42: of:=SUMIF([.$P$2:.$P$37];[.$AD42];[.AA$2:.AA$97]) -> 0.82498
A43: Bourns | B43: CRT1206-BY-1002ELF | C43: 2008319 | E43: 84.19 | F43: 5 | G43: 4 | H43: of:=MAX([.F43];[.G43]) -> 5 | I43: of:=IF(ISBLANK([.H43]);"";[.H43]*[.$E43]) -> 420.95 | J43: 12 | K43: of:=IF(ISBLANK([.J43]);"";[.J43]*[.$E43]) -> 1010.28 | L43: 5 | M43: of:=IF(ISBLANK([.L43]);"";[.L43]*[.$E43]) -> 420.95 | N43: http://hu.farnell.com/bourns/crt1206-by-1002elf/resistor-10k-0-25w-0-1/dp/2008319 | O43: 29 | P43: TC/Analog | Q43: .1% 10K, 1206 | R43: y | S43: Susumu | T43: CRT1206-BY-1002ELF | U43: 4 | AB43: http://www.findchips.com/search/CRT1206-BY-1002ELF
A44: TE Connectivity | B44: 881545-1 | C44: 4218164 | E44: 51.43 | F44: 10 | G44: 4 | H44: of:=MAX([.F44];[.G44]) -> 10 | I44: of:=IF(ISBLANK([.H44]);"";[.H44]*[.$E44]) -> 514.3 | J44: 12 | K44: of:=IF(ISBLANK([.J44]);"";[.J44]*[.$E44]) -> 617.16 | L44: 10 | M44: of:=IF(ISBLANK([.L44]);"";[.L44]*[.$E44]) -> 514.3 | N44: http://hu.farnell.com/te-connectivity-amp/881545-1/jumper-black-amp-modu-2-54mm-2way/dp/4218164 | O44: 30 | P44: TC/Analog | Q44: Shunt/Jumper | S44: 3M | T44: 969102-0000-DA | U44: 3 | V44: 0.1 | W44: of:=[.U44]*[.V44] -> 0.3 | X44: 0.058 | Y44: of:=[.X44]*[.U44] -> 0.174 | Z44: 0.042 | AA44: of:=[.Z44]*[.U44] -> 0.126 | AB44: http://www.digikey.com/product-detail/en/969102-0000-DA/3M9580-ND/2071621 | AD44: General | AE44: of:=SUMIF([.$P$2:.$P$37];[.$AD44];[.W$2:.W$97]) -> 0 | AF44: of:=SUMIF([.$P$2:.$P$37];[.$AD44];[.Y$2:.Y$97]) -> 0 | AG44: of:=SUMIF([.$P$2:.$P$37];[.$AD44];[.AA$2:.AA$97]) -> 0
I45: of:=IF(ISBLANK([.H45]);"";[.H45]*[.$E45]) ->  | K45: of:=IF(ISBLANK([.J45]);"";[.J45]*[.$E45]) ->  | M45: of:=IF(ISBLANK([.L45]);"";[.L45]*[.$E45]) ->  | O45: 31 | P45: Power Modify | Q45: Heatsink | R45: y | S45: Assmann | T45: V8508H | U45: 2 | V45: 0.58 | W45: of:=[.U45]*[.V45] -> 1.16 | Y45: of:=[.X45]*[.U45] -> 0 | AA45: of:=[.Z45]*[.U45] -> 0 | AB45: http://www.digikey.com/product-search/en?vendor=0&keywords=V8508H
A46: Multicomp | B46: MC33282 | C46: 1710672 | E46: 140.94 | F46: 1 | G46: 2 | H46: of:=MAX([.F46];[.G46]) -> 2 | I46: of:=IF(ISBLANK([.H46]);"";[.H46]*[.$E46]) -> 281.88 | J46: 5 | K46: of:=IF(ISBLANK([.J46]);"";[.J46]*[.$E46]) -> 704.7 | L46: 1 | M46: of:=IF(ISBLANK([.L46]);"";[.L46]*[.$E46]) -> 140.94 | N46: http://hu.farnell.com/multicomp/mc33282/heatsink-to220-21-c-w/dp/1710627 | O46: 31 | P46: Power Modify | Q46: Heatsink | R46: y | S46: Multicomp | T46: MC33282 | U46: 2 | V46: 1.25 | W46: of:=[.U46]*[.V46] -> 2.5 | Y46: of:=[.X46]*[.U46] -> 0 | AA46: of:=[.Z46]*[.U46] -> 0 | AB46: http://www.findchips.com/search/MC33282
I47: of:=IF(ISBLANK([.H47]);"";[.H47]*[.$E47]) ->  | K47: of:=IF(ISBLANK([.J47]);"";[.J47]*[.$E47]) ->  | M47: of:=IF(ISBLANK([.L47]);"";[.L47]*[.$E47]) -> 
A48: Arduino | B48: A000066 | C48: 2075382 | E48: 6875.79 | F48: 1 | G48: 1 | H48: of:=MAX([.F48];[.G48]) -> 1 | I48: of:=IF(ISBLANK([.H48]);"";[.H48]*[.$E48]) -> 6875.79 | J48: 2 | K48: of:=IF(ISBLANK([.J48]);"";[.J48]*[.$E48]) -> 13751.58 | L48: 1 | M48: of:=IF(ISBLANK([.L48]);"";[.L48]*[.$E48]) -> 6875.79 | N48: http://hu.farnell.com/arduino/a000066/eval-atmega328p-8bit-uno-rv3/dp/2075382 | W48: of:=[.U48]*[.V48] -> 0 | Y48: of:=[.X48]*[.U48] -> 0 | AA48: of:=[.Z48]*[.U48] -> 0
A49: Resistor kit 0805 | I49: of:=IF(ISBLANK([.H49]);"";[.H49]*[.$E49]) ->  | K49: of:=IF(ISBLANK([.J49]);"";[.J49]*[.$E49]) ->  | M49: of:=IF(ISBLANK([.L49]);"";[.L49]*[.$E49]) ->  | W49: of:=[.U49]*[.V49] -> 0 | Y49: of:=[.X49]*[.U49] -> 0 | AA49: of:=[.Z49]*[.U49] -> 0
A50: Capacitor kit? | I50: of:=IF(ISBLANK([.H50]);"";[.H50]*[.$E50]) ->  | K50: of:=IF(ISBLANK([.J50]);"";[.J50]*[.$E50]) ->  | M50: of:=IF(ISBLANK([.L50]);"";[.L50]*[.$E50]) ->  | W50: of:=[.U50]*[.V50] -> 0 | Y50: of:=[.X50]*[.U50] -> 0 | AA50: of:=[.Z50]*[.U50] -> 0
I51: of:=IF(ISBLANK([.H51]);"";[.H51]*[.$E51]) ->  | K51: of:=IF(ISBLANK([.J51]);"";[.J51]*[.$E51]) ->  | M51: of:=IF(ISBLANK([.L51]);"";[.L51]*[.$E51]) -> 
A52: MFG | B52: MFG Part No. | C52: Farnell Part No. | D52: RS Part No. | E52: Price | F52: MOQ | G52: Quantity | H52: Quantity 1 | I52: Price 1 | J52: Quantity 2 | K52: Price 2 | L52: Quantity 3 | M52: Price 3 | Q52: Value | R52: Footprint | S52: Tolerance
I53: of:=IF(ISBLANK([.H53]);"";[.H53]*[.$E53]) ->  | K53: of:=IF(ISBLANK([.J53]);"";[.J53]*[.$E53]) ->  | M53: of:=IF(ISBLANK([.L53]);"";[.L53]*[.$E53]) ->  | Q53: Capacitors
A54: Multicomp | B54: MC0805N101J500CT | C54: 1759203 | E54: 6.1 | F54: 10 | G54: 1 | H54: of:=MAX([.F54];[.G54]) -> 10 | I54: of:=IF(ISBLANK([.H54]);"";[.H54]*[.$E54]) -> 61 | J54: 25 | K54: of:=IF(ISBLANK([.J54]);"";[.J54]*[.$E54]) -> 152.5 | L54: 20 | M54: of:=IF(ISBLANK([.L54]);"";[.L54]*[.$E54]) -> 122 | N54: http://hu.farnell.com/multicomp/mc0805n101j500ct/cap-mlcc-c0g-np0-100pf-50v-0805/dp/1759203 | P54: extra | Q54: 100p | R54: 0805
A55: Multicomp | B55: MC0805B102K500CT | C55: 1759226 | E55: 3.9 | F55: 10 | I55: of:=IF(ISBLANK([.H55]);"";[.H55]*[.$E55]) ->  | J55: 25 | K55: of:=IF(ISBLANK([.J55]);"";[.J55]*[.$E55]) -> 97.5 | L55: 20 | M55: of:=IF(ISBLANK([.L55]);"";[.L55]*[.$E55]) -> 78 | N55: http://hu.farnell.com/multicomp/mc0805b102k500ct/cap-mlcc-x7r-1nf-50v-0805/dp/1759226 | P55: extra | Q55: 1000p | R55: 0805
A56: Multicomp | B56: MC0805B103K500CT | C56: 1759246 | E56: 3.9 | F56: 10 | G56: 4 | H56: of:=MAX([.F56];[.G56]) -> 10 | I56: of:=IF(ISBLANK([.H56]);"";[.H56]*[.$E56]) -> 39 | J56: 25 | K56: of:=IF(ISBLANK([.J56]);"";[.J56]*[.$E56]) -> 97.5 | L56: 20 | M56: of:=IF(ISBLANK([.L56]);"";[.L56]*[.$E56]) -> 78 | N56: http://hu.farnell.com/multicomp/mc0805b103k500ct/cap-mlcc-x7r-10nf-50v-0805/dp/1759246 | P56: extra | Q56: 10000p | R56: 0805
A57: Multicomp | B57: MC0805B104K250CT | C57: 1759166 | E57: 3.9 | F57: 10 | I57: of:=IF(ISBLANK([.H57]);"";[.H57]*[.$E57]) ->  | J57: 25 | K57: of:=IF(ISBLANK([.J57]);"";[.J57]*[.$E57]) -> 97.5 | L57: 20 | M57: of:=IF(ISBLANK([.L57]);"";[.L57]*[.$E57]) -> 78 | N57: http://hu.farnell.com/multicomp/mc0805b104k250ct/cap-mlcc-x7r-100nf-25v-0805/dp/1759166 | P57: extra | Q57: .1u | R57: 0805
A58: TDK | B58: C2012X7R1E105K125AB | C58: 2346940 | E58: 14.09 | F58: 1 | G58: 11 | H58: of:=MAX([.F58];[.G58]) -> 11 | I58: of:=IF(ISBLANK([.H58]);"";[.H58]*[.$E58]) -> 154.99 | J58: 50 | K58: of:=IF(ISBLANK([.J58]);"";[.J58]*[.$E58]) -> 704.5 | L58: 40 | M58: of:=IF(ISBLANK([.L58]);"";[.L58]*[.$E58]) -> 563.6 | N58: http://hu.farnell.com/tdk/c2012x7r1e105k125ab/cap-mlcc-x7r-1uf-25v-0805/dp/2346940 | P58: extra | Q58: 1u | R58: 0805
A59: Multicomp | B59: MC0805X106K250CT | C59: 2320833 | E59: 43.8 | F59: 10 | G59: 8 | H59: of:=MAX([.F59];[.G59]) -> 10 | I59: of:=IF(ISBLANK([.H59]);"";[.H59]*[.$E59]) -> 438 | J59: 25 | K59: of:=IF(ISBLANK([.J59]);"";[.J59]*[.$E59]) -> 1095 | L59: 20 | M59: of:=IF(ISBLANK([.L59]);"";[.L59]*[.$E59]) -> 876 | N59: http://hu.farnell.com/multicomp/mc0805x106k250ct/cap-mlcc-x5r-10uf-25v-0805/dp/2320833 | P59: extra | Q59: 10u | R59: 0805
G60: 3 | K60: of:=IF(ISBLANK([.J60]);"";[.J60]*[.$E60]) ->  | M60: of:=IF(ISBLANK([.L60]);"";[.L60]*[.$E60]) ->  | Q60: 10u | R60: 1206
A61: Multicomp | B61: MC1206X106K250CT | C61: 2320887 | E61: 33.8 | F61: 10 | G61: 4 | H61: of:=MAX([.F61];[.G61]) -> 10 | I61: of:=IF(ISBLANK([.H61]);"";[.H61]*[.$E61]) -> 338 | J61: 25 | K61: of:=IF(ISBLANK([.J61]);"";[.J61]*[.$E61]) -> 845 | L61: 25 | M61: of:=IF(ISBLANK([.L61]);"";[.L61]*[.$E61]) -> 845 | N61: http://hu.farnell.com/multicomp/mc1206x106k250ct/cap-mlcc-x5r-10uf-25v-1206/dp/2320887 | P61: extra | Q61: 10u | R61: 1210
I62: of:=IF(ISBLANK([.H62]);"";[.H62]*[.$E62]) ->  | K62: of:=IF(ISBLANK([.J62]);"";[.J62]*[.$E62]) ->  | M62: of:=IF(ISBLANK([.L62]);"";[.L62]*[.$E62]) ->  | Q62: Resistors
A63: Multicomp | B63: MCMR08X000 PTL | C63: 2073603 | E63: 2.67 | F63: 100 | G63: 33 | H63: of:=MAX([.F63];[.G63]) -> 100 | I63: of:=IF(ISBLANK([.H63]);"";[.H63]*[.$E63]) -> 267 | J63: 100 | K63: of:=IF(ISBLANK([.J63]);"";[.J63]*[.$E63]) -> 267 | L63: 100 | M63: of:=IF(ISBLANK([.L63]);"";[.L63]*[.$E63]) -> 267 | N63: http://hu.farnell.com/multicomp/mcmr08x000-ptl/resistor-0805-0r-anti-sulfuration/dp/2073603 | P63: extra | Q63: 0 | R63: 0805
A64: Multicomp | B64: MCHP06W2F100KT5E | C64: 1576602 | E64: 11.05 | F64: 50 | G64: 1 | H64: of:=MAX([.F64];[.G64]) -> 50 | I64: of:=IF(ISBLANK([.H64]);"";[.H64]*[.$E64]) -> 552.5 | J64: 50 | K64: of:=IF(ISBLANK([.J64]);"";[.J64]*[.$E64]) -> 552.5 | L64: 50 | M64: of:=IF(ISBLANK([.L64]);"";[.L64]*[.$E64]) -> 552.5 | N64: http://hu.farnell.com/multicomp/mchp06w2f100kt5e/resistor-1206-1r-1-0-5w/dp/1576602 | Q64: 1 | R64: 1206
A65: Bourns | B65: CRT0805-BY-10R0ELF | C65: 2008313 | E65: 62.47 | F65: 5 | G65: 1 | H65: of:=MAX([.F65];[.G65]) -> 5 | I65: of:=IF(ISBLANK([.H65]);"";[.H65]*[.$E65]) -> 312.35 | J65: 25 | K65: of:=IF(ISBLANK([.J65]);"";[.J65]*[.$E65]) -> 1561.75 | L65: 5 | M65: of:=IF(ISBLANK([.L65]);"";[.L65]*[.$E65]) -> 312.35 | N65: http://hu.farnell.com/bourns/crt0805-by-10r0elf/resistor-0805-10r-0-1-1-8w/dp/2008313 | Q65: 10 | R65: 0805 | S65: 0.1%
A66: TE Connectivity | B66: CRGH0805F15R | C66: 2332045 | E66: 5.33 | F66: 10 | G66: 1 | H66: of:=MAX([.F66];[.G66]) -> 10 | I66: of:=IF(ISBLANK([.H66]);"";[.H66]*[.$E66]) -> 53.3 | J66: 10 | K66: of:=IF(ISBLANK([.J66]);"";[.J66]*[.$E66]) -> 53.3 | L66: 10 | M66: of:=IF(ISBLANK([.L66]);"";[.L66]*[.$E66]) -> 53.3 | N66: http://hu.farnell.com/te-connectivity/crgh0805f15r/resistor-power-15r-0-33w-1-0805/dp/2332045 | Q66: 15 | R66: 0805
A67: Multicomp | B67: MCMR08X1000FTL | C67: 2073605 | E67: 3.43 | F67: 100 | G67: 1 | H67: of:=MAX([.F67];[.G67]) -> 100 | I67: of:=IF(ISBLANK([.H67]);"";[.H67]*[.$E67]) -> 343 | J67: 100 | K67: of:=IF(ISBLANK([.J67]);"";[.J67]*[.$E67]) -> 343 | L67: 100 | M67: of:=IF(ISBLANK([.L67]);"";[.L67]*[.$E67]) -> 343 | N67: http://hu.farnell.com/multicomp/mcmr08x1000ftl/resistor-0805-100r-1-anti-sulfur/dp/2073605 | P67: extra | Q67: 100 | R67: 0805
A68: Susumu | B68: RR1220P-101-B-T5 | C68: 1653279 | E68: 25.9 | F68: 1 | G68: 1 | H68: of:=MAX([.F68];[.G68]) -> 1 | I68: of:=IF(ISBLANK([.H68]);"";[.H68]*[.$E68]) -> 25.9 | J68: 3 | K68: of:=IF(ISBLANK([.J68]);"";[.J68]*[.$E68]) -> 77.7 | L68: 3 | M68: of:=IF(ISBLANK([.L68]);"";[.L68]*[.$E68]) -> 77.7 | N68: http://hu.farnell.com/susumu/rr1220p-101-b-t5/thin-film-chip-resistor/dp/1653279 | Q68: 100 | R68: 0805 | S68: 0.1%
A69: Multicomp | B69: MCTC0525B2000T5E | C69: 1575647 | E69: 18.29 | F69: 5 | G69: 2 | H69: of:=MAX([.F69];[.G69]) -> 5 | I69: of:=IF(ISBLANK([.H69]);"";[.H69]*[.$E69]) -> 91.45 | J69: 5 | K69: of:=IF(ISBLANK([.J69]);"";[.J69]*[.$E69]) -> 91.45 | L69: 5 | M69: of:=IF(ISBLANK([.L69]);"";[.L69]*[.$E69]) -> 91.45 | N69: http://hu.farnell.com/multicomp/mctc0525b2000t5e/resistor-200r-0805-0-1-25ppm-0/dp/1575647 | Q69: 200 | R69: 0805
A70: Multicomp | B70: MC01W08051715R | C70: 2141787 | E70: 13.33 | F70: 1 | G70: 2 | H70: of:=MAX([.F70];[.G70]) -> 2 | I70: of:=IF(ISBLANK([.H70]);"";[.H70]*[.$E70]) -> 26.66 | J70: 5 | K70: of:=IF(ISBLANK([.J70]);"";[.J70]*[.$E70]) -> 66.65 | L70: 5 | M70: of:=IF(ISBLANK([.L70]);"";[.L70]*[.$E70]) -> 66.65 | N70: http://hu.farnell.com/multicomp/mc01w08051715r/resistor-715r-0-1w-1-0805/dp/2141787 | Q70: 715 | R70: 0805
A71: Multicomp | B71: MCMR08X1001FTL | C71: 2073606 | E71: 3.43 | F71: 100 | G71: 4 | H71: of:=MAX([.F71];[.G71]) -> 100 | I71: of:=IF(ISBLANK([.H71]);"";[.H71]*[.$E71]) -> 343 | J71: 100 | K71: of:=IF(ISBLANK([.J71]);"";[.J71]*[.$E71]) -> 343 | L71: 100 | M71: of:=IF(ISBLANK([.L71]);"";[.L71]*[.$E71]) -> 343 | N71: http://hu.farnell.com/multicomp/mcmr08x1001ftl/resistor-0805-1k-1-anti-sulfur/dp/2073606 | P71: extra | Q71: 1K | R71: 0805
A72: Susumu | B72: RR1220P-102-B-T5 | C72: 1653280 | E72: 25.9 | F72: 1 | G72: 1 | H72: of:=MAX([.F72];[.G72]) -> 1 | I72: of:=IF(ISBLANK([.H72]);"";[.H72]*[.$E72]) -> 25.9 | J72: 3 | K72: of:=IF(ISBLANK([.J72]);"";[.J72]*[.$E72]) -> 77.7 | L72: 3 | M72: of:=IF(ISBLANK([.L72]);"";[.L72]*[.$E72]) -> 77.7 | N72: http://hu.farnell.com/susumu/rr1220p-102-b-t5/resistor-thin-film-1k-0-1w-0-1/dp/1653280 | Q72: 1K | R72: 0805 | S72: 0.1%
A73: KOA | B73: RK73H2ATTD1301F | C73: 1811799 | E73: 6.48 | F73: 5 | G73: 2 | H73: of:=MAX([.F73];[.G73]) -> 5 | I73: of:=IF(ISBLANK([.H73]);"";[.H73]*[.$E73]) -> 32.4 | J73: 5 | K73: of:=IF(ISBLANK([.J73]);"";[.J73]*[.$E73]) -> 32.4 | L73: 5 | M73: of:=IF(ISBLANK([.L73]);"";[.L73]*[.$E73]) -> 32.4 | N73: http://hu.farnell.com/koa/rk73h2attd1301f/resistor-0805-1k3-ohm-1/dp/1811799 | Q73: 1.3K | R73: 0805
A74: Bourns | B74: CR0805-FX-3001GLF | C74: 2333540 | E74: 10.29 | F74: 1 | G74: 2 | H74: of:=MAX([.F74];[.G74]) -> 2 | I74: of:=IF(ISBLANK([.H74]);"";[.H74]*[.$E74]) -> 20.58 | J74: 5 | K74: of:=IF(ISBLANK([.J74]);"";[.J74]*[.$E74]) -> 51.45 | L74: 5 | M74: of:=IF(ISBLANK([.L74]);"";[.L74]*[.$E74]) -> 51.45 | N74: http://hu.farnell.com/bourns/cr0805-fx-3001glf/resistor-thick-film-3kohm-1-0805/dp/2333540 | Q74: 3K | R74: 0805
A75: Susumu | B75: RR1220P-4991-B-M-T5 | C75: 1653310 | E75: 25.9 | F75: 1 | G75: 2 | H75: of:=MAX([.F75];[.G75]) -> 2 | I75: of:=IF(ISBLANK([.H75]);"";[.H75]*[.$E75]) -> 51.8 | J75: 5 | K75: of:=IF(ISBLANK([.J75]);"";[.J75]*[.$E75]) -> 129.5 | L75: 5 | M75: of:=IF(ISBLANK([.L75]);"";[.L75]*[.$E75]) -> 129.5 | N75: http://hu.farnell.com/susumu/rr1220p-4991-b-m-t5/resistor-0805-0-1-4k99/dp/1653310 | Q75: 5K (4.99K) | R75: 0805 | S75: 0.1%
A76: Vishay | B76: PHP01206E4991BST3 | C76: 2325357 | E76: 384.74 | F76: 1 | G76: 2 | H76: of:=MAX([.F76];[.G76]) -> 2 | I76: of:=IF(ISBLANK([.H76]);"";[.H76]*[.$E76]) -> 769.48 | J76: 5 | K76: of:=IF(ISBLANK([.J76]);"";[.J76]*[.$E76]) -> 1923.7 | L76: 3 | M76: of:=IF(ISBLANK([.L76]);"";[.L76]*[.$E76]) -> 1154.22 | N76: http://hu.farnell.com/vishay-thin-film/php01206e4991bst3/resistor-thin-film-4-99kohm-0-1/dp/2325357 | Q76: 5K (4.99K) | R76: 1206 | S76: 0.1%
A77: Vishay | B77: CRCW08059K10FKEA | C77: 1653046 | E77: 24.76 | F77: 1 | G77: 2 | H77: 2 | I77: of:=IF(ISBLANK([.H77]);"";[.H77]*[.$E77]) -> 49.52 | J77: 5 | K77: of:=IF(ISBLANK([.J77]);"";[.J77]*[.$E77]) -> 123.8 | L77: 5 | M77: of:=IF(ISBLANK([.L77]);"";[.L77]*[.$E77]) -> 123.8 | N77: http://hu.farnell.com/vishay-draloric/crcw08059k10fkea/resistor-0805-9k10-1/dp/1653046 | Q77: 9.1K | R77: 0805
A78: Multicomp | B78: MCMR08X1002FTL | C78: 2073607 | E78: 3.43 | F78: 100 | G78: 2 | H78: of:=MAX([.F78];[.G78]) -> 100 | I78: of:=IF(ISBLANK([.H78]);"";[.H78]*[.$E78]) -> 343 | J78: 100 | K78: of:=IF(ISBLANK([.J78]);"";[.J78]*[.$E78]) -> 343 | L78: 100 | M78: of:=IF(ISBLANK([.L78]);"";[.L78]*[.$E78]) -> 343 | N78: http://hu.farnell.com/multicomp/mcmr08x1002ftl/resistor-0805-10k-1-anti-sulfur/dp/2073607 | P78: extra | Q78: 10K | R78: 0805
A79: Vishay | B79: PAT1206E2003BST5 | C79: 1858262 | E79: 380.93 | F79: 1 | G79: 2 | H79: of:=MAX([.F79];[.G79]) -> 2 | I79: of:=IF(ISBLANK([.H79]);"";[.H79]*[.$E79]) -> 761.86 | J79: 5 | K79: of:=IF(ISBLANK([.J79]);"";[.J79]*[.$E79]) -> 1904.65 | L79: 5 | M79: of:=IF(ISBLANK([.L79]);"";[.L79]*[.$E79]) -> 1904.65 | N79: http://hu.farnell.com/vishay-thin-film/pat1206e2003bst5/resistor-1206-200k-0-1/dp/1858262 | Q79: 200K | R79: 1206 | S79: 0.1%
I80: of:=IF(ISBLANK([.H80]);"";[.H80]*[.$E80]) ->  | K80: of:=IF(ISBLANK([.J80]);"";[.J80]*[.$E80]) ->  | M80: of:=IF(ISBLANK([.L80]);"";[.L80]*[.$E80]) ->  | Q80: Inductors
A81: TDK | B81: MPZ2012S101A | C81: 1669751 | E81: 25.52 | F81: 5 | G81: 1 | H81: of:=MAX([.F81];[.G81]) -> 5 | I81: of:=IF(ISBLANK([.H81]);"";[.H81]*[.$E81]) -> 127.6 | J81: 5 | K81: of:=IF(ISBLANK([.J81]);"";[.J81]*[.$E81]) -> 127.6 | L81: 5 | M81: of:=IF(ISBLANK([.L81]);"";[.L81]*[.$E81]) -> 127.6 | N81: http://hu.farnell.com/tdk/mpz2012s101a/ferrite-bead-0-02ohm-4a-0805/dp/1669751 | Q81: 1u | R81: 0805
I82: of:=IF(ISBLANK([.H82]);"";[.H82]*[.$E82]) ->  | K82: of:=IF(ISBLANK([.J82]);"";[.J82]*[.$E82]) ->  | M82: of:=IF(ISBLANK([.L82]);"";[.L82]*[.$E82]) ->  | Q82: Diodes
A83: Diodes Inc. | B83: MMBD914-7-F | C83: 1773539 | E83: 14.4 | F83: 1 | G83: 8 | H83: of:=MAX([.F83];[.G83]) -> 8 | I83: of:=IF(ISBLANK([.H83]);"";[.H83]*[.$E83]) -> 115.2 | J83: 25 | K83: of:=IF(ISBLANK([.J83]);"";[.J83]*[.$E83]) -> 360 | L83: 10 | M83: of:=IF(ISBLANK([.L83]);"";[.L83]*[.$E83]) -> 144 | N83: http://hu.farnell.com/diodes-inc/mmbd914-7-f/diode-sw-array-75v-0-35w-sot23/dp/1773539 | Q83: MMBD914-7-F | R83: SOT-23
I84: of:=SUM([.I2:.I83]) -> 27666.53 | K84: of:=SUM([.K2:.K83]) -> 58153.4 | M84: of:=SUM([.M2:.M83]) -> 34420.46
I85: of:=[.I84]/300 -> 92.2217666666667 | K85: of:=[.K84]/300 -> 193.844666666667 | M85: of:=[.M84]/300 -> 114.734866666667
W86: of:=[.U86]*[.V86] -> 0 | Y86: of:=[.X86]*[.U86] -> 0 | AA86: of:=[.Z86]*[.U86] -> 0
W87: of:=[.U87]*[.V87] -> 0 | Y87: of:=[.X87]*[.U87] -> 0 | AA87: of:=[.Z87]*[.U87] -> 0
W88: of:=[.U88]*[.V88] -> 0 | Y88: of:=[.X88]*[.U88] -> 0 | AA88: of:=[.Z88]*[.U88] -> 0
W89: of:=[.U89]*[.V89] -> 0 | Y89: of:=[.X89]*[.U89] -> 0 | AA89: of:=[.Z89]*[.U89] -> 0
W90: of:=[.U90]*[.V90] -> 0 | Y90: of:=[.X90]*[.U90] -> 0 | AA90: of:=[.Z90]*[.U90] -> 0
W91: of:=[.U91]*[.V91] -> 0 | Y91: of:=[.X91]*[.U91] -> 0 | AA91: of:=[.Z91]*[.U91] -> 0
W92: of:=[.U92]*[.V92] -> 0 | Y92: of:=[.X92]*[.U92] -> 0 | AA92: of:=[.Z92]*[.U92] -> 0
W93: of:=[.U93]*[.V93] -> 0 | Y93: of:=[.X93]*[.U93] -> 0 | AA93: of:=[.Z93]*[.U93] -> 0
W94: of:=[.U94]*[.V94] -> 0 | Y94: of:=[.X94]*[.U94] -> 0 | AA94: of:=[.Z94]*[.U94] -> 0
W95: of:=[.U95]*[.V95] -> 0 | Y95: of:=[.X95]*[.U95] -> 0 | AA95: of:=[.Z95]*[.U95] -> 0
W96: of:=[.U96]*[.V96] -> 0 | Y96: of:=[.X96]*[.U96] -> 0 | AA96: of:=[.Z96]*[.U96] -> 0
W97: of:=[.U97]*[.V97] -> 0 | Y97: of:=[.X97]*[.U97] -> 0 | AA97: of:=[.Z97]*[.U97] -> 0
W98: of:=[.U98]*[.V98] -> 0 | Y98: of:=[.X98]*[.U98] -> 0 | AA98: of:=[.Z98]*[.U98] -> 0
W99: of:=[.U99]*[.V99] -> 0 | Y99: of:=[.X99]*[.U99] -> 0 | AA99: of:=[.Z99]*[.U99] -> 0
W100: of:=[.U100]*[.V100] -> 0 | Y100: of:=[.X100]*[.U100] -> 0 | AA100: of:=[.Z100]*[.U100] -> 0
W101: of:=[.U101]*[.V101] -> 0 | Y101: of:=[.X101]*[.U101] -> 0 | AA101: of:=[.Z101]*[.U101] -> 0
W102: of:=[.U102]*[.V102] -> 0 | Y102: of:=[.X102]*[.U102] -> 0 | AA102: of:=[.Z102]*[.U102] -> 0
W103: of:=[.U103]*[.V103] -> 0 | Y103: of:=[.X103]*[.U103] -> 0 | AA103: of:=[.Z103]*[.U103] -> 0
W104: of:=[.U104]*[.V104] -> 0 | Y104: of:=[.X104]*[.U104] -> 0 | AA104: of:=[.Z104]*[.U104] -> 0
W105: of:=[.U105]*[.V105] -> 0 | Y105: of:=[.X105]*[.U105] -> 0 | AA105: of:=[.Z105]*[.U105] -> 0
W106: of:=[.U106]*[.V106] -> 0 | Y106: of:=[.X106]*[.U106] -> 0 | AA106: of:=[.Z106]*[.U106] -> 0
W107: of:=[.U107]*[.V107] -> 0 | Y107: of:=[.X107]*[.U107] -> 0 | AA107: of:=[.Z107]*[.U107] -> 0
W108: of:=[.U108]*[.V108] -> 0 | Y108: of:=[.X108]*[.U108] -> 0 | AA108: of:=[.Z108]*[.U108] -> 0
W109: of:=[.U109]*[.V109] -> 0 | Y109: of:=[.X109]*[.U109] -> 0 | AA109: of:=[.Z109]*[.U109] -> 0
W110: of:=[.U110]*[.V110] -> 0 | Y110: of:=[.X110]*[.U110] -> 0 | AA110: of:=[.Z110]*[.U110] -> 0
W111: of:=[.U111]*[.V111] -> 0 | Y111: of:=[.X111]*[.U111] -> 0 | AA111: of:=[.Z111]*[.U111] -> 0
W112: of:=[.U112]*[.V112] -> 0 | Y112: of:=[.X112]*[.U112] -> 0 | AA112: of:=[.Z112]*[.U112] -> 0
W113: of:=[.U113]*[.V113] -> 0 | Y113: of:=[.X113]*[.U113] -> 0 | AA113: of:=[.Z113]*[.U113] -> 0
W114: of:=[.U114]*[.V114] -> 0 | Y114: of:=[.X114]*[.U114] -> 0 | AA114: of:=[.Z114]*[.U114] -> 0
W115: of:=[.U115]*[.V115] -> 0 | Y115: of:=[.X115]*[.U115] -> 0 | AA115: of:=[.Z115]*[.U115] -> 0
W116: of:=[.U116]*[.V116] -> 0 | Y116: of:=[.X116]*[.U116] -> 0 | AA116: of:=[.Z116]*[.U116] -> 0
W117: of:=[.U117]*[.V117] -> 0 | Y117: of:=[.X117]*[.U117] -> 0 | AA117: of:=[.Z117]*[.U117] -> 0
W118: of:=[.U118]*[.V118] -> 0 | Y118: of:=[.X118]*[.U118] -> 0 | AA118: of:=[.Z118]*[.U118] -> 0
W119: of:=[.U119]*[.V119] -> 0
W120: of:=[.U120]*[.V120] -> 0
W121: of:=[.U121]*[.V121] -> 0
W122: of:=[.U122]*[.V122] -> 0
W123: of:=[.U123]*[.V123] -> 0
W124: of:=[.U124]*[.V124] -> 0
W125: of:=[.U125]*[.V125] -> 0
W126: of:=[.U126]*[.V126] -> 0
W127: of:=[.U127]*[.V127] -> 0